"Status","Start Time","Stop Time","Duration in ms","Parent Suite","Suite","Sub Suite","Test Class","Test Method","Name","Description"
"passed","Sun Dec 29 21:22:18 GMT 2024","Sun Dec 29 21:22:18 GMT 2024","179","tests","main_page_test","TestMainPage","","","Verify redirection to used resources page not authorized user.",""
"passed","Sun Dec 29 21:27:20 GMT 2024","Sun Dec 29 21:27:28 GMT 2024","8130","tests","Речевые упражнения.","TestCardsRU","","","Select random card from group ""Слова Королёвой"" and compare UI vs BACKEND data.",""
"passed","Sun Dec 29 21:12:39 GMT 2024","Sun Dec 29 21:12:41 GMT 2024","1191","tests","description_page_test","TestDescriptionPage","","","Verify redirection to telegram page not authorized user.",""
"passed","Sun Dec 29 21:21:38 GMT 2024","Sun Dec 29 21:21:38 GMT 2024","65","tests","header_test","TestHeaderPage","","","Verify presence, visibility and attributes of the profile avatar in the Header 
               for an authorized user",""
"passed","Sun Dec 29 21:25:22 GMT 2024","Sun Dec 29 21:25:22 GMT 2024","70","tests","start_unauthorized_page_test","TestStartUnauthorizedPage","","","Verify content of the text in sections 1, 2",""
"passed","Sun Dec 29 21:12:09 GMT 2024","Sun Dec 29 21:12:11 GMT 2024","1379","tests","contributors_page_test","TestContributorsPage","","","Verify values of the text in card descriptions",""
"passed","Sun Dec 29 21:21:13 GMT 2024","Sun Dec 29 21:21:14 GMT 2024","365","tests","header_test","TestHeaderPage","","","Verify user logout after clicking the 'Logout' button in the Header for an authorized user",""
"passed","Sun Dec 29 21:21:56 GMT 2024","Sun Dec 29 21:21:57 GMT 2024","1045","tests","main_page_test","TestMainPage","","","Verify redirection to donate page not authorized user.",""
"passed","Sun Dec 29 21:11:13 GMT 2024","Sun Dec 29 21:11:13 GMT 2024","51","tests","contacts_page_test","TestContactsPage","","","Verify values of the title and subtitles with tags h1, h2 on the page",""
"skipped","Sun Dec 29 21:32:45 GMT 2024","Sun Dec 29 21:33:06 GMT 2024","20267","tests","Речевые упражнения.","TestCardsRU","","","Solutions to a random task in the ""Слова"" group and comparison of statics.",""
"skipped","Sun Dec 29 21:26:39 GMT 2024","Sun Dec 29 21:27:00 GMT 2024","20240","tests","Speech exercises EN.","TestCardsEN","","","Select a random card from ""Similar phrases"" group and compare UI vs BACKEND data",""
"passed","Sun Dec 29 21:14:36 GMT 2024","Sun Dec 29 21:14:36 GMT 2024","52","tests","footer_test","TestFooter","","","Verify presence and visibility of the Footer",""
"skipped","Sun Dec 29 21:28:31 GMT 2024","Sun Dec 29 21:28:54 GMT 2024","22537","tests","Речевые упражнения.","TestCardsRU","","","Select a random card from ""Слова с частотной группировкой"" group and compare UI vs BACKEND data.",""
"skipped","Sun Dec 29 21:25:47 GMT 2024","Sun Dec 29 21:26:07 GMT 2024","20254","tests","Speech exercises EN.","TestCardsEN","","","Select random card from ""Word"" group and compare UI vs BACKEND data",""
"passed","Sun Dec 29 21:18:03 GMT 2024","Sun Dec 29 21:18:11 GMT 2024","8215","tests","groups_page_test","TestGroupsPage","","","Verify attributes of images in links on the page",""
"passed","Sun Dec 29 21:13:06 GMT 2024","Sun Dec 29 21:13:06 GMT 2024","216","tests","description_page_test","TestDescriptionPage","","","Verify redirection to used resources page not authorized user.",""
"passed","Sun Dec 29 21:25:11 GMT 2024","Sun Dec 29 21:25:11 GMT 2024","127","tests","start_unauthorized_page_test","TestStartUnauthorizedPage","","","Verify the composition and visibility of elements 
        on the 1st-3rd levels of nesting in the section 2",""
"passed","Sun Dec 29 21:25:41 GMT 2024","Sun Dec 29 21:25:41 GMT 2024","61","tests","start_unauthorized_page_test","TestStartUnauthorizedPage","","","Verify size of the image in the section 1",""
"passed","Sun Dec 29 21:12:44 GMT 2024","Sun Dec 29 21:12:45 GMT 2024","1205","tests","description_page_test","TestDescriptionPage","","","Verify redirection to donate page not authorized user.",""
"passed","Sun Dec 29 21:19:40 GMT 2024","Sun Dec 29 21:19:50 GMT 2024","10241","tests","header_test","TestHeaderPage","","","Verify composition, visibility of elements on the 1st-6th levels of nesting in the Header
            for an authorized user",""
"passed","Sun Dec 29 21:24:24 GMT 2024","Sun Dec 29 21:24:24 GMT 2024","107","tests","specialists_page_test","TestSpecialistsPage","","","Verify values of names and professions in specialist cards in the grid",""
"passed","Sun Dec 29 21:22:58 GMT 2024","Sun Dec 29 21:22:59 GMT 2024","752","tests","registration_page_test","TestRegistrationPage","","","Check registration with new email and empty confirm password",""
"passed","Sun Dec 29 21:17:14 GMT 2024","Sun Dec 29 21:17:32 GMT 2024","18321","tests","groups_page_test","TestGroupsPage","","","Verify if links on the 'ru' local lead to correct pages after clicking",""
"passed","Sun Dec 29 21:23:11 GMT 2024","Sun Dec 29 21:23:12 GMT 2024","762","tests","registration_page_test","TestRegistrationPage","","","Check registration with new email and empty birthday",""
"passed","Sun Dec 29 21:18:44 GMT 2024","Sun Dec 29 21:18:44 GMT 2024","386","tests","header_test","TestHeaderPage","","","Verify presence, visibility of links, buttons in the Header for an unauthorized user",""
"passed","Sun Dec 29 21:18:26 GMT 2024","Sun Dec 29 21:18:27 GMT 2024","32","tests","header_test","TestHeaderPage","","","Verify presence and visibility of the Header for an unauthorized user",""
"passed","Sun Dec 29 21:22:29 GMT 2024","Sun Dec 29 21:22:42 GMT 2024","12329","tests","profile_page_test","TestProfilePage","","","Change the password by receiving an email link",""
"passed","Sun Dec 29 21:14:21 GMT 2024","Sun Dec 29 21:14:23 GMT 2024","1547","tests","exercises_ru_words_page_test","TestExercisesRuWordsPage","","","Verify clickability, href, status code of links in breadcrumbs on the page",""
"passed","Sun Dec 29 21:16:19 GMT 2024","Sun Dec 29 21:16:36 GMT 2024","16390","tests","groups_page_test","TestGroupsPage","","","Verify value of the title and subtitles on the page",""
"passed","Sun Dec 29 21:33:37 GMT 2024","Sun Dec 29 21:33:37 GMT 2024","27","tests","used_resources_page_test","TestUsedResourcesPage","","","Verify presence and visibility of content on the page",""
"passed","Sun Dec 29 21:22:01 GMT 2024","Sun Dec 29 21:22:01 GMT 2024","191","tests","main_page_test","TestMainPage","","","Verify redirection to contacts page not authorized user.",""
"passed","Sun Dec 29 21:34:18 GMT 2024","Sun Dec 29 21:34:19 GMT 2024","58","tests","used_resources_page_test","TestUsedResourcesPage","","","Verify presence, visibility and attributes of icons in sections",""
"passed","Sun Dec 29 21:13:35 GMT 2024","Sun Dec 29 21:13:35 GMT 2024","123","tests","exercises_ru_words_page_test","TestExercisesRuWordsPage","","","Verify presence, visibility of lists on the page",""
"passed","Sun Dec 29 21:12:14 GMT 2024","Sun Dec 29 21:12:15 GMT 2024","446","tests","contributors_page_test","TestContributorsPage","","","Verify text in card links and the 'All Team' link",""
"passed","Sun Dec 29 21:14:03 GMT 2024","Sun Dec 29 21:14:03 GMT 2024","50","tests","exercises_ru_words_page_test","TestExercisesRuWordsPage","","","Verify text in group links on the page",""
"passed","Sun Dec 29 21:15:56 GMT 2024","Sun Dec 29 21:15:59 GMT 2024","3131","tests","groups_page_test","TestGroupsPage","","","Verify presence, visibility of the title, tiles, links, images, subtitles on the page",""
"passed","Sun Dec 29 21:14:32 GMT 2024","Sun Dec 29 21:14:32 GMT 2024","100","tests","exercises_ru_words_page_test","TestExercisesRuWordsPage","","","Verify clickability, titles of group links on the page",""
"passed","Sun Dec 29 21:12:18 GMT 2024","Sun Dec 29 21:12:19 GMT 2024","746","tests","contributors_page_test","TestContributorsPage","","","Verify clickability, href of links on the page",""
