"Status","Start Time","Stop Time","Duration in ms","Parent Suite","Suite","Sub Suite","Test Class","Test Method","Name","Description"
"passed","Sun Dec 29 21:29:00 GMT 2024","Sun Dec 29 21:29:30 GMT 2024","29649","tests","Речевые упражнения.","TestCardsRU","","","Solutions to a random task in the ""Слова"" .",""
"passed","Sun Dec 29 21:25:29 GMT 2024","Sun Dec 29 21:25:30 GMT 2024","608","tests","start_unauthorized_page_test","TestStartUnauthorizedPage","","","Verify presence, visibility, clickability, href, status code 
                         of the 'Login' link in the section 1",""
"passed","Sun Dec 29 21:19:28 GMT 2024","Sun Dec 29 21:19:28 GMT 2024","52","tests","header_test","TestHeaderPage","","","Verify size of the image in the 'Logo' link in the Header on the Start Unauthorized Page",""
"passed","Sun Dec 29 21:11:22 GMT 2024","Sun Dec 29 21:11:22 GMT 2024","28","tests","contacts_page_test","TestContactsPage","","","Verify text in links in the section 2",""
"passed","Sun Dec 29 21:24:29 GMT 2024","Sun Dec 29 21:24:29 GMT 2024","45","tests","specialists_page_test","TestSpecialistsPage","","","Verify text in the 'All Specialists' link",""
"passed","Sun Dec 29 21:19:34 GMT 2024","Sun Dec 29 21:19:34 GMT 2024","27","tests","header_test","TestHeaderPage","","","Verify presence and visibility of the Header for an authorized user",""
"passed","Sun Dec 29 21:15:41 GMT 2024","Sun Dec 29 21:15:41 GMT 2024","26","tests","groups_page_test","TestGroupsPage","","","Verify presence and visibility of content on the page",""
"passed","Sun Dec 29 21:14:54 GMT 2024","Sun Dec 29 21:14:56 GMT 2024","2473","tests","footer_test","TestFooter","","","Verify clickability, href, prefix and subject, status code of links in the Footer",""
"passed","Sun Dec 29 21:10:38 GMT 2024","Sun Dec 29 21:10:39 GMT 2024","1191","tests","authorisation_page_test","TestAuthorizedUserPage","","","Checking the possibility of authorization with the correct data",""
"passed","Sun Dec 29 21:27:34 GMT 2024","Sun Dec 29 21:27:42 GMT 2024","8288","tests","Речевые упражнения.","TestCardsRU","","","Select a random card from ""Похожие фразы"" group and compare UI vs BACKEND data.",""
"passed","Sun Dec 29 21:12:31 GMT 2024","Sun Dec 29 21:12:32 GMT 2024","1172","tests","contributors_page_test","TestContributorsPage","","","Verify sizes of images in contributor cards in grids",""
"passed","Sun Dec 29 21:20:09 GMT 2024","Sun Dec 29 21:20:09 GMT 2024","36","tests","header_test","TestHeaderPage","","","Verify presence, visibility of the user name in the Header for an authorized user",""
"passed","Sun Dec 29 21:12:49 GMT 2024","Sun Dec 29 21:12:49 GMT 2024","217","tests","description_page_test","TestDescriptionPage","","","Verify redirection to contacts page not authorized user.",""
"passed","Sun Dec 29 21:15:25 GMT 2024","Sun Dec 29 21:15:25 GMT 2024","112","tests","footer_test","TestFooter","","","Verify sizes of images in links in the Footer",""
"passed","Sun Dec 29 21:20:26 GMT 2024","Sun Dec 29 21:20:41 GMT 2024","14051","tests","header_test","TestHeaderPage","","","Verify if internal links in the Header for an authorized user 
            lead to correct pages after click",""
"passed","Sun Dec 29 21:33:47 GMT 2024","Sun Dec 29 21:33:47 GMT 2024","12","tests","used_resources_page_test","TestUsedResourcesPage","","","Verify value of the title of the tab",""
"passed","Sun Dec 29 21:14:39 GMT 2024","Sun Dec 29 21:14:39 GMT 2024","258","tests","footer_test","TestFooter","","","Verify composition and visibility of elements on the 1st-7th levels of nesting in the Footer",""
"passed","Sun Dec 29 21:15:00 GMT 2024","Sun Dec 29 21:15:14 GMT 2024","14462","tests","footer_test","TestFooter","","","Verify that links in the Footer lead to correct pages after clicking",""
"passed","Sun Dec 29 21:18:48 GMT 2024","Sun Dec 29 21:18:48 GMT 2024","201","tests","header_test","TestHeaderPage","","","Verify values of the text in links, buttons in the Header for an unauthorized user",""
"passed","Sun Dec 29 21:21:01 GMT 2024","Sun Dec 29 21:21:01 GMT 2024","265","tests","header_test","TestHeaderPage","","","Verify the dropdown opens/closes after clicking on the 'More' button in the Header 
               for an authorized user",""
"passed","Sun Dec 29 21:24:52 GMT 2024","Sun Dec 29 21:24:52 GMT 2024","107","tests","specialists_page_test","TestSpecialistsPage","","","Verify attributes of images in specialist cards in the grid",""
"passed","Sun Dec 29 21:21:20 GMT 2024","Sun Dec 29 21:21:20 GMT 2024","41","tests","header_test","TestHeaderPage","","","Verify presence, visibility and attributes of the image in the 'Logo' link in the Header 
               for an authorized user",""
"passed","Sun Dec 29 21:18:17 GMT 2024","Sun Dec 29 21:18:23 GMT 2024","6063","tests","groups_page_test","TestGroupsPage","","","Verify sizes of images in links on the page",""
"passed","Sun Dec 29 21:16:05 GMT 2024","Sun Dec 29 21:16:13 GMT 2024","8181","tests","groups_page_test","TestGroupsPage","","","Verify value of the title of the tab",""
"passed","Sun Dec 29 21:34:01 GMT 2024","Sun Dec 29 21:34:01 GMT 2024","29","tests","used_resources_page_test","TestUsedResourcesPage","","","Verify text in links in sections",""
"passed","Sun Dec 29 21:11:39 GMT 2024","Sun Dec 29 21:11:39 GMT 2024","99","tests","contacts_page_test","TestContactsPage","","","Verify that the email link calls an email client",""
"passed","Sun Dec 29 21:21:47 GMT 2024","Sun Dec 29 21:21:48 GMT 2024","134","tests","main_page_test","TestMainPage","","","Verify redirection to description page not authorized user.",""
"passed","Sun Dec 29 21:29:36 GMT 2024","Sun Dec 29 21:32:39 GMT 2024","183748","tests","Речевые упражнения.","TestCardsRU","","","Solutions to a random task in the ""Слова Королёвой"" .",""
"passed","Sun Dec 29 21:20:15 GMT 2024","Sun Dec 29 21:20:21 GMT 2024","5274","tests","header_test","TestHeaderPage","","","Verify clickability, href, status code of links in the Header for an authorized user",""
"passed","Sun Dec 29 21:15:31 GMT 2024","Sun Dec 29 21:15:35 GMT 2024","3435","tests","footer_test","TestFooter","","","Verify Footer invisibility through the modal window with the exercise",""
"passed","Sun Dec 29 21:27:06 GMT 2024","Sun Dec 29 21:27:14 GMT 2024","8090","tests","Речевые упражнения.","TestCardsRU","","","Select random card from group ""Слова"" and compare UI vs BACKEND data.",""
"passed","Sun Dec 29 21:25:15 GMT 2024","Sun Dec 29 21:25:15 GMT 2024","13","tests","start_unauthorized_page_test","TestStartUnauthorizedPage","","","Verify value of the title of the tab",""
"passed","Sun Dec 29 21:34:13 GMT 2024","Sun Dec 29 21:34:14 GMT 2024","993","tests","used_resources_page_test","TestUsedResourcesPage","","","Verify that links in the sections lead to the correct pages after clicking",""
"passed","Sun Dec 29 21:10:58 GMT 2024","Sun Dec 29 21:10:58 GMT 2024","148","tests","contacts_page_test","TestContactsPage","","","Verify the composition and visibility of elements 
        on the 1st-5th levels of nesting in the section 2",""
"passed","Sun Dec 29 21:22:25 GMT 2024","Sun Dec 29 21:22:25 GMT 2024","169","tests","main_page_test","TestMainPage","","","Checking the clickability of the Registration button.",""
"passed","Sun Dec 29 21:10:43 GMT 2024","Sun Dec 29 21:10:44 GMT 2024","958","tests","authorisation_page_test","TestAuthorizedUserPage","","","Checking the possibility of authorization with incorrect data",""
"passed","Sun Dec 29 21:12:22 GMT 2024","Sun Dec 29 21:12:23 GMT 2024","556","tests","contributors_page_test","TestContributorsPage","","","Verify href, status code of the 'All Team' link",""
"passed","Sun Dec 29 21:19:00 GMT 2024","Sun Dec 29 21:19:05 GMT 2024","4973","tests","header_test","TestHeaderPage","","","Verify if internal links in the Header for an unauthorized user 
            lead to correct pages after click",""
"passed","Sun Dec 29 21:13:02 GMT 2024","Sun Dec 29 21:13:03 GMT 2024","696","tests","description_page_test","TestDescriptionPage","","","Verify redirection to contributors page not authorized user.",""
"passed","Sun Dec 29 21:23:54 GMT 2024","Sun Dec 29 21:23:55 GMT 2024","336","tests","specialists_page_test","TestSpecialistsPage","","","Verify the composition and visibility of elements 
        on the 1st-6th levels of nesting on the page",""
"passed","Sun Dec 29 21:22:21 GMT 2024","Sun Dec 29 21:22:22 GMT 2024","141","tests","main_page_test","TestMainPage","","","Checking the clickability of the Start button.",""
"passed","Sun Dec 29 21:21:07 GMT 2024","Sun Dec 29 21:21:07 GMT 2024","202","tests","header_test","TestHeaderPage","","","Verify switching of the 'ru', 'en' buttons in the Header for an authorized user",""
"passed","Sun Dec 29 21:23:59 GMT 2024","Sun Dec 29 21:24:05 GMT 2024","5370","tests","specialists_page_test","TestSpecialistsPage","","","Verify presence, visibility of the title, text, link, grid, cards and images  
        on the 2nd, 3rd, 5th, 6th levels of nesting on the page",""
"passed","Sun Dec 29 21:12:57 GMT 2024","Sun Dec 29 21:12:58 GMT 2024","1399","tests","description_page_test","TestDescriptionPage","","","Verify redirection to github not authorized user.",""
"passed","Sun Dec 29 21:12:53 GMT 2024","Sun Dec 29 21:12:53 GMT 2024","696","tests","description_page_test","TestDescriptionPage","","","Verify redirection to specialists page not authorized user.",""
"passed","Sun Dec 29 21:20:55 GMT 2024","Sun Dec 29 21:20:55 GMT 2024","87","tests","header_test","TestHeaderPage","","","Verify that the 'Logo' link on the Start Authorized Page 
                             doesn't refresh the current page or lead to other pages after clicking",""
"passed","Sun Dec 29 21:14:12 GMT 2024","Sun Dec 29 21:14:12 GMT 2024","289","tests","exercises_ru_words_page_test","TestExercisesRuWordsPage","","","Verify text in cards on the page",""
"passed","Sun Dec 29 21:23:03 GMT 2024","Sun Dec 29 21:23:04 GMT 2024","779","tests","registration_page_test","TestRegistrationPage","","","Check registration with new email and empty password",""
"passed","Sun Dec 29 21:11:59 GMT 2024","Sun Dec 29 21:11:59 GMT 2024","12","tests","contributors_page_test","TestContributorsPage","","","Verify value of the title of the tab",""
"passed","Sun Dec 29 21:33:31 GMT 2024","Sun Dec 29 21:33:33 GMT 2024","1869","tests","Statistic.","TestCardsRU","","","Check statistic table.",""
"passed","Sun Dec 29 21:34:06 GMT 2024","Sun Dec 29 21:34:08 GMT 2024","1664","tests","used_resources_page_test","TestUsedResourcesPage","","","Verify presence, visibility, clickability, href, status code of links in sections",""
"passed","Sun Dec 29 21:24:39 GMT 2024","Sun Dec 29 21:24:39 GMT 2024","611","tests","specialists_page_test","TestSpecialistsPage","","","Verify that the 'All Specialists' link leads an unauthorized user 
                         to the correct page after clicking",""
"passed","Sun Dec 29 21:11:46 GMT 2024","Sun Dec 29 21:11:48 GMT 2024","1699","tests","contributors_page_test","TestContributorsPage","","","Verify the composition and visibility of elements 
        on the 1st-5th levels of nesting on the page",""
"passed","Sun Dec 29 21:11:51 GMT 2024","Sun Dec 29 21:11:55 GMT 2024","3698","tests","contributors_page_test","TestContributorsPage","","","Verify presence, visibility of titles/subtitles, cards, descriptions, links, images on the page",""
"passed","Sun Dec 29 21:18:51 GMT 2024","Sun Dec 29 21:18:56 GMT 2024","4910","tests","header_test","TestHeaderPage","","","Verify clickability, href, status code of links in the Header for an unauthorized user",""
"passed","Sun Dec 29 21:19:25 GMT 2024","Sun Dec 29 21:19:25 GMT 2024","47","tests","header_test","TestHeaderPage","","","Verify presence, visibility and attributes of the image in the 'Logo' link in the Header 
               on the Start Unauthorized Page",""
"passed","Sun Dec 29 21:24:34 GMT 2024","Sun Dec 29 21:24:34 GMT 2024","424","tests","specialists_page_test","TestSpecialistsPage","","","Verify clickability, href, status code of the 'All Specialists' link",""
"passed","Sun Dec 29 21:20:46 GMT 2024","Sun Dec 29 21:20:48 GMT 2024","1896","tests","header_test","TestHeaderPage","","","Verify if external links in the Header for an authorized user 
            lead to correct pages after click",""
"passed","Sun Dec 29 21:19:21 GMT 2024","Sun Dec 29 21:19:21 GMT 2024","218","tests","header_test","TestHeaderPage","","","Verify switching of the 'ru', 'en' buttons in the Header on the Start Unauthorized Page",""
"passed","Sun Dec 29 21:33:52 GMT 2024","Sun Dec 29 21:33:52 GMT 2024","33","tests","used_resources_page_test","TestUsedResourcesPage","","","Verify value of title with tag 'h1' on the page",""
"passed","Sun Dec 29 21:10:48 GMT 2024","Sun Dec 29 21:10:49 GMT 2024","27","tests","contacts_page_test","TestContactsPage","","","Verify presence and visibility of content on the page",""
"passed","Sun Dec 29 21:22:45 GMT 2024","Sun Dec 29 21:22:50 GMT 2024","4558","tests","registration_page_test","TestRegistrationPage","","","Check registration with new email",""
"passed","Sun Dec 29 21:12:27 GMT 2024","Sun Dec 29 21:12:27 GMT 2024","825","tests","contributors_page_test","TestContributorsPage","","","Verify attribute values of images in contributors cards in grids",""
"passed","Sun Dec 29 21:13:16 GMT 2024","Sun Dec 29 21:13:16 GMT 2024","45","tests","exercises_ru_words_page_test","TestExercisesRuWordsPage","","","Verify presence and visibility of content on the page",""
"passed","Sun Dec 29 21:21:44 GMT 2024","Sun Dec 29 21:21:44 GMT 2024","3","tests","login_page_test","TestLoginPage","","","Test for authorization customer.",""
"passed","Sun Dec 29 21:12:06 GMT 2024","Sun Dec 29 21:12:06 GMT 2024","19","tests","contributors_page_test","TestContributorsPage","","","Verify content of the text on the page",""
"passed","Sun Dec 29 21:18:30 GMT 2024","Sun Dec 29 21:18:40 GMT 2024","10212","tests","header_test","TestHeaderPage","","","Verify composition, visibility of elements on the 1st-6th levels of nesting in the Header
            for an unauthorized user",""
"passed","Sun Dec 29 21:23:49 GMT 2024","Sun Dec 29 21:23:50 GMT 2024","29","tests","specialists_page_test","TestSpecialistsPage","","","Verify presence and visibility of content on the page",""
"passed","Sun Dec 29 21:25:26 GMT 2024","Sun Dec 29 21:25:26 GMT 2024","40","tests","start_unauthorized_page_test","TestStartUnauthorizedPage","","","Verify text in the 'Login' link in the section 1",""
"passed","Sun Dec 29 21:24:19 GMT 2024","Sun Dec 29 21:24:19 GMT 2024","34","tests","specialists_page_test","TestSpecialistsPage","","","Verify value of text on the page",""
"passed","Sun Dec 29 21:19:14 GMT 2024","Sun Dec 29 21:19:14 GMT 2024","134","tests","header_test","TestHeaderPage","","","Verify that the 'Logo' link on the Start Unauthorized Page 
                             doesn't refresh the current page or lead to other pages after clicking",""
"passed","Sun Dec 29 21:20:03 GMT 2024","Sun Dec 29 21:20:03 GMT 2024","204","tests","header_test","TestHeaderPage","","","Verify values of the text in links, buttons in the Header for an authorized user",""
"passed","Sun Dec 29 21:11:43 GMT 2024","Sun Dec 29 21:11:43 GMT 2024","36","tests","contributors_page_test","TestContributorsPage","","","Verify presence, visibility and structure of content on the page",""
"passed","Sun Dec 29 21:22:14 GMT 2024","Sun Dec 29 21:22:14 GMT 2024","706","tests","main_page_test","TestMainPage","","","Verify redirection to contributors page not authorized user.",""
"passed","Sun Dec 29 21:23:20 GMT 2024","Sun Dec 29 21:23:21 GMT 2024","703","tests","registration_page_test","TestRegistrationPage","","","Check registration without choosing gender",""
"passed","Sun Dec 29 21:21:26 GMT 2024","Sun Dec 29 21:21:26 GMT 2024","64","tests","header_test","TestHeaderPage","","","Verify size of the image in the 'Logo' link in the Header for an authorized user",""
"passed","Sun Dec 29 21:23:16 GMT 2024","Sun Dec 29 21:23:16 GMT 2024","743","tests","registration_page_test","TestRegistrationPage","","","Check registration with new email and empty email",""
"passed","Sun Dec 29 21:24:45 GMT 2024","Sun Dec 29 21:24:47 GMT 2024","1690","tests","specialists_page_test","TestSpecialistsPage","","","Verify that the 'All Specialists' link leads an authorized user 
                         to the correct page after clicking",""
"passed","Sun Dec 29 21:22:54 GMT 2024","Sun Dec 29 21:22:55 GMT 2024","1291","tests","registration_page_test","TestRegistrationPage","","","Check registration with an existing email",""
"passed","Sun Dec 29 21:15:47 GMT 2024","Sun Dec 29 21:15:50 GMT 2024","3173","tests","groups_page_test","TestGroupsPage","","","Verify composition, visibility of elements on the 1st-6th levels of nesting on the page",""
"passed","Sun Dec 29 21:24:14 GMT 2024","Sun Dec 29 21:24:14 GMT 2024","34","tests","specialists_page_test","TestSpecialistsPage","","","Verify value of title with tag 'h2' on the page",""
"passed","Sun Dec 29 21:12:36 GMT 2024","Sun Dec 29 21:12:36 GMT 2024","176","tests","description_page_test","TestDescriptionPage","","","Verify return main page from description page.",""
"passed","Sun Dec 29 21:13:54 GMT 2024","Sun Dec 29 21:13:54 GMT 2024","32","tests","exercises_ru_words_page_test","TestExercisesRuWordsPage","","","Verify value of the breadcrumbs on the page",""
"skipped","Sun Dec 29 21:26:13 GMT 2024","Sun Dec 29 21:26:33 GMT 2024","20277","tests","Speech exercises EN.","TestCardsEN","","","Check progres-bar and buttons.",""
"passed","Sun Dec 29 21:22:09 GMT 2024","Sun Dec 29 21:22:10 GMT 2024","1326","tests","main_page_test","TestMainPage","","","Verify redirection to github not authorized user.",""
"passed","Sun Dec 29 21:24:10 GMT 2024","Sun Dec 29 21:24:10 GMT 2024","12","tests","specialists_page_test","TestSpecialistsPage","","","Verify value of the title of the tab",""
"passed","Sun Dec 29 21:33:42 GMT 2024","Sun Dec 29 21:33:42 GMT 2024","124","tests","used_resources_page_test","TestUsedResourcesPage","","","Verify the composition and visibility of elements 
        on the 1st-4th levels of nesting on the page",""
"passed","Sun Dec 29 21:14:47 GMT 2024","Sun Dec 29 21:14:47 GMT 2024","47","tests","footer_test","TestFooter","","","Verify content of text in the Footer",""
"skipped","Sun Dec 29 21:22:26 GMT 2024","Sun Dec 29 21:22:26 GMT 2024","0","tests","main_page_test","TestMainPage","","","Checking the ip is available",""
"passed","Sun Dec 29 21:11:33 GMT 2024","Sun Dec 29 21:11:34 GMT 2024","1425","tests","contacts_page_test","TestContactsPage","","","Verify if links in the section 2 lead to the correct pages after clicking",""
"passed","Sun Dec 29 21:25:33 GMT 2024","Sun Dec 29 21:25:34 GMT 2024","161","tests","start_unauthorized_page_test","TestStartUnauthorizedPage","","","Verify that the 'Login' link leads to the correct page after clicking",""
"passed","Sun Dec 29 21:13:44 GMT 2024","Sun Dec 29 21:13:44 GMT 2024","23","tests","exercises_ru_words_page_test","TestExercisesRuWordsPage","","","Verify value of the title of the tab",""
"passed","Sun Dec 29 21:25:07 GMT 2024","Sun Dec 29 21:25:08 GMT 2024","101","tests","start_unauthorized_page_test","TestStartUnauthorizedPage","","","Verify the composition and visibility of elements 
        on the 1st-3rd levels of nesting in the section 1",""
"passed","Sun Dec 29 21:17:38 GMT 2024","Sun Dec 29 21:17:57 GMT 2024","18242","tests","groups_page_test","TestGroupsPage","","","Verify if links on the 'en' local lead to correct pages after clicking",""
"passed","Sun Dec 29 21:16:42 GMT 2024","Sun Dec 29 21:17:08 GMT 2024","26386","tests","groups_page_test","TestGroupsPage","","","Verify clickability, title, href, status code of links on the page",""
"passed","Sun Dec 29 21:22:04 GMT 2024","Sun Dec 29 21:22:05 GMT 2024","705","tests","main_page_test","TestMainPage","","","Verify redirection to specialists page not authorized user.",""
"passed","Sun Dec 29 21:24:57 GMT 2024","Sun Dec 29 21:24:57 GMT 2024","156","tests","specialists_page_test","TestSpecialistsPage","","","Verify sizes of images in specialist cards in the grid",""
"passed","Sun Dec 29 21:13:25 GMT 2024","Sun Dec 29 21:13:26 GMT 2024","1329","tests","exercises_ru_words_page_test","TestExercisesRuWordsPage","","","Verify composition, visibility of elements on the 1st-6th levels of nesting on the page",""
"passed","Sun Dec 29 21:19:17 GMT 2024","Sun Dec 29 21:19:18 GMT 2024","289","tests","header_test","TestHeaderPage","","","Verify the dropdown opens/closes after clicking on the 'More' button in the Header 
            on the Start Unauthorized Page",""
"passed","Sun Dec 29 21:11:27 GMT 2024","Sun Dec 29 21:11:28 GMT 2024","777","tests","contacts_page_test","TestContactsPage","","","Verify presence, visibility, clickability, href, prefix, status code of links in the section 2",""
"passed","Sun Dec 29 21:10:53 GMT 2024","Sun Dec 29 21:10:53 GMT 2024","20","tests","contacts_page_test","TestContactsPage","","","Verify the composition and visibility of elements on the 1st level of nesting in the section 1",""
"passed","Sun Dec 29 21:19:08 GMT 2024","Sun Dec 29 21:19:10 GMT 2024","1785","tests","header_test","TestHeaderPage","","","Verify if external links in the Header for an unauthorized user 
            lead to correct pages after click",""
"skipped","Sun Dec 29 21:28:03 GMT 2024","Sun Dec 29 21:28:25 GMT 2024","22603","tests","Речевые упражнения.","TestCardsRU","","","Select a random card from ""Предложения"" group and compare UI vs BACKEND data.",""
"passed","Sun Dec 29 21:21:32 GMT 2024","Sun Dec 29 21:21:32 GMT 2024","59","tests","header_test","TestHeaderPage","","","Verify presence, visibility, attributes of icons in the Header for an authorized user",""
"passed","Sun Dec 29 21:27:48 GMT 2024","Sun Dec 29 21:27:57 GMT 2024","8527","tests","Речевые упражнения.","TestCardsRU","","","Select a random card from ""Группа слов"" group and compare UI vs BACKEND data.",""
"passed","Sun Dec 29 21:11:03 GMT 2024","Sun Dec 29 21:11:03 GMT 2024","160","tests","contacts_page_test","TestContactsPage","","","Verify presence, visibility of sections, the dividing line and elements with text on the page",""
"passed","Sun Dec 29 21:14:43 GMT 2024","Sun Dec 29 21:14:43 GMT 2024","139","tests","footer_test","TestFooter","","","Verify presence, visibility of text, links, images in the Footer",""
"passed","Sun Dec 29 21:34:23 GMT 2024","Sun Dec 29 21:34:23 GMT 2024","77","tests","used_resources_page_test","TestUsedResourcesPage","","","Verify sizes of icons in sections",""
"passed","Sun Dec 29 21:25:00 GMT 2024","Sun Dec 29 21:25:00 GMT 2024","36","tests","start_unauthorized_page_test","TestStartUnauthorizedPage","","","Verify presence and visibility of content on the page",""
"passed","Sun Dec 29 21:23:07 GMT 2024","Sun Dec 29 21:23:08 GMT 2024","745","tests","registration_page_test","TestRegistrationPage","","","Check registration with new email and empty first name",""
"passed","Sun Dec 29 21:11:18 GMT 2024","Sun Dec 29 21:11:18 GMT 2024","30","tests","contacts_page_test","TestContactsPage","","","Verify content of the text in the section 2",""
"passed","Sun Dec 29 21:15:18 GMT 2024","Sun Dec 29 21:15:18 GMT 2024","110","tests","footer_test","TestFooter","","","Verify that the 'Contact us' link in the Footer calls an email client",""
"passed","Sun Dec 29 21:19:57 GMT 2024","Sun Dec 29 21:19:57 GMT 2024","378","tests","header_test","TestHeaderPage","","","Verify presence, visibility of links, buttons in the Header for an authorized user",""
"passed","Sun Dec 29 21:14:50 GMT 2024","Sun Dec 29 21:14:50 GMT 2024","48","tests","footer_test","TestFooter","","","Verify text in the 'Contact us' link in the Footer",""
"passed","Sun Dec 29 21:25:19 GMT 2024","Sun Dec 29 21:25:19 GMT 2024","47","tests","start_unauthorized_page_test","TestStartUnauthorizedPage","","","Verify values of titles and subtitles with tags h2, h4 on the page",""
"passed","Sun Dec 29 21:23:24 GMT 2024","Sun Dec 29 21:23:45 GMT 2024","20807","tests","registration_page_test","TestRegistrationPage","","","Check registration without choosing agreement",""
"passed","Sun Dec 29 21:25:04 GMT 2024","Sun Dec 29 21:25:04 GMT 2024","33","tests","start_unauthorized_page_test","TestStartUnauthorizedPage","","","Verify amount and visibility of sections with content on the page",""
"passed","Sun Dec 29 21:25:37 GMT 2024","Sun Dec 29 21:25:37 GMT 2024","92","tests","start_unauthorized_page_test","TestStartUnauthorizedPage","","","Verify presence, visibility and attributes of the image in the section 1",""
"passed","Sun Dec 29 21:12:02 GMT 2024","Sun Dec 29 21:12:02 GMT 2024","52","tests","contributors_page_test","TestContributorsPage","","","Verify values of title and subtitles with tags h2, h3 on the page",""
"passed","Sun Dec 29 21:15:21 GMT 2024","Sun Dec 29 21:15:21 GMT 2024","78","tests","footer_test","TestFooter","","","Verify attributes of images in links in the Footer",""
"passed","Sun Dec 29 21:21:51 GMT 2024","Sun Dec 29 21:21:52 GMT 2024","1224","tests","main_page_test","TestMainPage","","","Verify redirection to telegram page not authorized user.",""
"passed","Sun Dec 29 21:22:25 GMT 2024","Sun Dec 29 21:22:26 GMT 2024","511","tests","main_page_test","TestMainPage","","","Checking the domain is available",""
"passed","Sun Dec 29 21:33:57 GMT 2024","Sun Dec 29 21:33:57 GMT 2024","33","tests","used_resources_page_test","TestUsedResourcesPage","","","Verify content of the text on the page",""
"passed","Sun Dec 29 21:11:08 GMT 2024","Sun Dec 29 21:11:08 GMT 2024","14","tests","contacts_page_test","TestContactsPage","","","Verify value of the title of the tab",""
