"Status","Start Time","Stop Time","Duration in ms","Parent Suite","Suite","Sub Suite","Test Class","Test Method","Name","Description"
"passed","Mon Oct 14 08:49:12 GMT 2024","Mon Oct 14 08:49:12 GMT 2024","680","tests","start_unauthorized_page_test","TestStartUnauthorizedPage","","","Verify presence, visibility, clickability, href, status code 
                         of the 'Login' link in the section 1",""
"passed","Mon Oct 14 08:40:28 GMT 2024","Mon Oct 14 08:40:28 GMT 2024","149","tests","description_page_test","TestDescriptionPage","","","Verify redirection to used resources page not authorized user.",""
"passed","Mon Oct 14 08:40:48 GMT 2024","Mon Oct 14 08:40:48 GMT 2024","46","tests","footer_test","TestFooter","","","Verify text in the 'Contact us' link in the Footer",""
"passed","Mon Oct 14 08:39:54 GMT 2024","Mon Oct 14 08:39:54 GMT 2024","132","tests","description_page_test","TestDescriptionPage","","","Verify return main page from description page.",""
"passed","Mon Oct 14 08:38:51 GMT 2024","Mon Oct 14 08:38:52 GMT 2024","902","tests","authorisation_page_test","TestAuthorizedUserPage","","","Checking the possibility of authorization with incorrect data",""
"passed","Mon Oct 14 08:41:34 GMT 2024","Mon Oct 14 08:41:35 GMT 2024","1278","tests","groups_page_test","TestGroupsPage","","","Verify composition, visibility of elements on the 1st-6th levels of nesting on the page",""
"passed","Mon Oct 14 08:59:59 GMT 2024","Mon Oct 14 08:59:59 GMT 2024","76","tests","used_resources_page_test","TestUsedResourcesPage","","","Verify sizes of icons in sections",""
"passed","Mon Oct 14 08:44:14 GMT 2024","Mon Oct 14 08:44:16 GMT 2024","1863","tests","header_test","TestHeaderPage","","","Verify if external links in the Header for an authorized user 
            lead to correct pages after click",""
"passed","Mon Oct 14 08:39:18 GMT 2024","Mon Oct 14 08:39:18 GMT 2024","11","tests","contacts_page_test","TestContactsPage","","","Verify value of the title of the tab",""
"passed","Mon Oct 14 08:43:54 GMT 2024","Mon Oct 14 08:44:08 GMT 2024","13927","tests","header_test","TestHeaderPage","","","Verify if internal links in the Header for an authorized user 
            lead to correct pages after click",""
"skipped","Mon Oct 14 08:58:51 GMT 2024","Mon Oct 14 08:58:57 GMT 2024","6632","tests","Речевые упражнения.","TestCardsRU","","","Solutions to a random task in the ""Слова"" group and comparison of statics.",""
"passed","Mon Oct 14 08:48:16 GMT 2024","Mon Oct 14 08:48:16 GMT 2024","622","tests","specialists_page_test","TestSpecialistsPage","","","Verify that the 'All Specialists' link leads an unauthorized user 
                         to the correct page after clicking",""
"passed","Mon Oct 14 08:42:54 GMT 2024","Mon Oct 14 08:42:54 GMT 2024","53","tests","header_test","TestHeaderPage","","","Verify size of the image in the 'Logo' link in the Header on the Start Unauthorized Page",""
"passed","Mon Oct 14 08:43:42 GMT 2024","Mon Oct 14 08:43:48 GMT 2024","5739","tests","header_test","TestHeaderPage","","","Verify clickability, href, status code of links in the Header for an authorized user",""
"passed","Mon Oct 14 08:43:00 GMT 2024","Mon Oct 14 08:43:00 GMT 2024","26","tests","header_test","TestHeaderPage","","","Verify presence and visibility of the Header for an authorized user",""
"passed","Mon Oct 14 08:39:50 GMT 2024","Mon Oct 14 08:39:50 GMT 2024","99","tests","contacts_page_test","TestContactsPage","","","Verify that the email link calls an email client",""
"passed","Mon Oct 14 08:46:02 GMT 2024","Mon Oct 14 08:46:14 GMT 2024","11810","tests","profile_page_test","TestProfilePage","","","Change the password by receiving an email link",""
"skipped","Mon Oct 14 08:39:50 GMT 2024","Mon Oct 14 08:39:50 GMT 2024","0","tests","contributors_page_test","TestContributorsPage","","","Verify text in card links and the 'All Team' link",""
"passed","Mon Oct 14 08:40:04 GMT 2024","Mon Oct 14 08:40:05 GMT 2024","1417","tests","description_page_test","TestDescriptionPage","","","Verify redirection to donate page not authorized user.",""
"passed","Mon Oct 14 08:42:23 GMT 2024","Mon Oct 14 08:42:28 GMT 2024","4766","tests","header_test","TestHeaderPage","","","Verify if internal links in the Header for an unauthorized user 
            lead to correct pages after click",""
"passed","Mon Oct 14 08:48:23 GMT 2024","Mon Oct 14 08:48:25 GMT 2024","1757","tests","specialists_page_test","TestSpecialistsPage","","","Verify that the 'All Specialists' link leads an authorized user 
                         to the correct page after clicking",""
"passed","Mon Oct 14 08:48:35 GMT 2024","Mon Oct 14 08:48:35 GMT 2024","166","tests","specialists_page_test","TestSpecialistsPage","","","Verify sizes of images in specialist cards in the grid",""
"passed","Mon Oct 14 08:59:31 GMT 2024","Mon Oct 14 08:59:31 GMT 2024","33","tests","used_resources_page_test","TestUsedResourcesPage","","","Verify content of the text on the page",""
"passed","Mon Oct 14 08:44:22 GMT 2024","Mon Oct 14 08:44:22 GMT 2024","86","tests","header_test","TestHeaderPage","","","Verify that the 'Logo' link on the Start Authorized Page 
                             doesn't refresh the current page or lead to other pages after clicking",""
"passed","Mon Oct 14 08:42:50 GMT 2024","Mon Oct 14 08:42:50 GMT 2024","47","tests","header_test","TestHeaderPage","","","Verify presence, visibility and attributes of the image in the 'Logo' link in the Header 
               on the Start Unauthorized Page",""
"passed","Mon Oct 14 08:45:14 GMT 2024","Mon Oct 14 08:45:14 GMT 2024","3","tests","login_page_test","TestLoginPage","","","Test for authorization customer.",""
"passed","Mon Oct 14 08:44:42 GMT 2024","Mon Oct 14 08:44:42 GMT 2024","376","tests","header_test","TestHeaderPage","","","Verify user logout after clicking the 'Logout' button in the Header for an authorized user",""
"passed","Mon Oct 14 08:39:58 GMT 2024","Mon Oct 14 08:40:00 GMT 2024","1351","tests","description_page_test","TestDescriptionPage","","","Verify redirection to telegram page not authorized user.",""
"passed","Mon Oct 14 08:59:54 GMT 2024","Mon Oct 14 08:59:54 GMT 2024","57","tests","used_resources_page_test","TestUsedResourcesPage","","","Verify presence, visibility and attributes of icons in sections",""
"passed","Mon Oct 14 08:40:58 GMT 2024","Mon Oct 14 08:41:08 GMT 2024","9559","tests","footer_test","TestFooter","","","Verify that links in the Footer lead to correct pages after clicking",""
"passed","Mon Oct 14 08:39:12 GMT 2024","Mon Oct 14 08:39:12 GMT 2024","157","tests","contacts_page_test","TestContactsPage","","","Verify presence, visibility of sections, the dividing line and elements with text on the page",""
"passed","Mon Oct 14 08:41:16 GMT 2024","Mon Oct 14 08:41:16 GMT 2024","77","tests","footer_test","TestFooter","","","Verify attributes of images in links in the Footer",""
"passed","Mon Oct 14 08:42:04 GMT 2024","Mon Oct 14 08:42:05 GMT 2024","355","tests","header_test","TestHeaderPage","","","Verify presence, visibility of links, buttons in the Header for an unauthorized user",""
"passed","Mon Oct 14 08:46:36 GMT 2024","Mon Oct 14 08:46:36 GMT 2024","688","tests","registration_page_test","TestRegistrationPage","","","Check registration with new email and empty password",""
"passed","Mon Oct 14 08:48:51 GMT 2024","Mon Oct 14 08:48:51 GMT 2024","138","tests","start_unauthorized_page_test","TestStartUnauthorizedPage","","","Verify the composition and visibility of elements 
        on the 1st-3rd levels of nesting in the section 2",""
"passed","Mon Oct 14 08:42:42 GMT 2024","Mon Oct 14 08:42:42 GMT 2024","266","tests","header_test","TestHeaderPage","","","Verify the dropdown opens/closes after clicking on the 'More' button in the Header 
            on the Start Unauthorized Page",""
"passed","Mon Oct 14 08:41:46 GMT 2024","Mon Oct 14 08:41:46 GMT 2024","32","tests","header_test","TestHeaderPage","","","Verify presence and visibility of the Header for an unauthorized user",""
"passed","Mon Oct 14 08:41:27 GMT 2024","Mon Oct 14 08:41:27 GMT 2024","25","tests","groups_page_test","TestGroupsPage","","","Verify presence and visibility of content on the page",""
"passed","Mon Oct 14 08:38:46 GMT 2024","Mon Oct 14 08:38:47 GMT 2024","1262","tests","authorisation_page_test","TestAuthorizedUserPage","","","Checking the possibility of authorization with the correct data",""
"passed","Mon Oct 14 08:47:45 GMT 2024","Mon Oct 14 08:47:45 GMT 2024","13","tests","specialists_page_test","TestSpecialistsPage","","","Verify value of the title of the tab",""
"passed","Mon Oct 14 08:51:14 GMT 2024","Mon Oct 14 08:51:26 GMT 2024","11441","tests","Речевые упражнения.","TestCardsRU","","","Select random card from group ""Слова"" and compare UI vs BACKEND data.",""
"passed","Mon Oct 14 08:45:32 GMT 2024","Mon Oct 14 08:45:32 GMT 2024","148","tests","main_page_test","TestMainPage","","","Verify redirection to contacts page not authorized user.",""
"passed","Mon Oct 14 08:41:41 GMT 2024","Mon Oct 14 08:41:42 GMT 2024","1102","tests","groups_page_test","TestGroupsPage","","","Verify presence, visibility of the title, tiles, links on the page",""
"skipped","Mon Oct 14 08:39:50 GMT 2024","Mon Oct 14 08:39:50 GMT 2024","0","tests","contributors_page_test","TestContributorsPage","","","Verify content of the text on the page",""
"passed","Mon Oct 14 08:44:48 GMT 2024","Mon Oct 14 08:44:48 GMT 2024","40","tests","header_test","TestHeaderPage","","","Verify presence, visibility and attributes of the image in the 'Logo' link in the Header 
               for an authorized user",""
"passed","Mon Oct 14 08:46:59 GMT 2024","Mon Oct 14 08:47:19 GMT 2024","20745","tests","registration_page_test","TestRegistrationPage","","","Check registration without choosing agreement",""
"skipped","Mon Oct 14 08:39:50 GMT 2024","Mon Oct 14 08:39:50 GMT 2024","0","tests","contributors_page_test","TestContributorsPage","","","Verify href, status code of the 'All Team' link",""
"passed","Mon Oct 14 08:41:20 GMT 2024","Mon Oct 14 08:41:20 GMT 2024","108","tests","footer_test","TestFooter","","","Verify sizes of images in links in the Footer",""
"passed","Mon Oct 14 08:49:08 GMT 2024","Mon Oct 14 08:49:08 GMT 2024","40","tests","start_unauthorized_page_test","TestStartUnauthorizedPage","","","Verify text in the 'Login' link in the section 1",""
"passed","Mon Oct 14 08:47:50 GMT 2024","Mon Oct 14 08:47:50 GMT 2024","34","tests","specialists_page_test","TestSpecialistsPage","","","Verify value of title with tag 'h2' on the page",""
"passed","Mon Oct 14 08:46:18 GMT 2024","Mon Oct 14 08:46:22 GMT 2024","4233","tests","registration_page_test","TestRegistrationPage","","","Check registration with new email",""
"passed","Mon Oct 14 08:43:06 GMT 2024","Mon Oct 14 08:43:17 GMT 2024","10247","tests","header_test","TestHeaderPage","","","Verify composition, visibility of elements on the 1st-6th levels of nesting in the Header
            for an authorized user",""
"passed","Mon Oct 14 08:45:18 GMT 2024","Mon Oct 14 08:45:18 GMT 2024","118","tests","main_page_test","TestMainPage","","","Verify redirection to description page not authorized user.",""
"passed","Mon Oct 14 08:48:47 GMT 2024","Mon Oct 14 08:48:47 GMT 2024","95","tests","start_unauthorized_page_test","TestStartUnauthorizedPage","","","Verify the composition and visibility of elements 
        on the 1st-3rd levels of nesting in the section 1",""
"passed","Mon Oct 14 08:47:35 GMT 2024","Mon Oct 14 08:47:40 GMT 2024","5352","tests","specialists_page_test","TestSpecialistsPage","","","Verify presence, visibility of the title, text, link, grid, cards and images  
        on the 2nd, 3rd, 5th, 6th levels of nesting on the page",""
"passed","Mon Oct 14 08:46:50 GMT 2024","Mon Oct 14 08:46:50 GMT 2024","687","tests","registration_page_test","TestRegistrationPage","","","Check registration with new email and empty email",""
"skipped","Mon Oct 14 08:39:50 GMT 2024","Mon Oct 14 08:39:50 GMT 2024","0","tests","contributors_page_test","TestContributorsPage","","","Verify value of the title of the tab",""
"passed","Mon Oct 14 08:48:05 GMT 2024","Mon Oct 14 08:48:06 GMT 2024","56","tests","specialists_page_test","TestSpecialistsPage","","","Verify text in the 'All Specialists' link",""
"passed","Mon Oct 14 08:38:57 GMT 2024","Mon Oct 14 08:38:57 GMT 2024","27","tests","contacts_page_test","TestContactsPage","","","Verify presence and visibility of content on the page",""
"passed","Mon Oct 14 08:40:44 GMT 2024","Mon Oct 14 08:40:44 GMT 2024","48","tests","footer_test","TestFooter","","","Verify content of text in the Footer",""
"passed","Mon Oct 14 08:54:29 GMT 2024","Mon Oct 14 08:55:18 GMT 2024","49472","tests","Речевые упражнения.","TestCardsRU","","","Solutions to a random task in the ""Слова"" .",""
"skipped","Mon Oct 14 08:39:50 GMT 2024","Mon Oct 14 08:39:50 GMT 2024","0","tests","contributors_page_test","TestContributorsPage","","","Verify the composition and visibility of elements 
        on the 1st-5th levels of nesting on the page",""
"skipped","Mon Oct 14 08:39:50 GMT 2024","Mon Oct 14 08:39:50 GMT 2024","0","tests","contributors_page_test","TestContributorsPage","","","Verify clickability, href of links on the page",""
"passed","Mon Oct 14 08:40:18 GMT 2024","Mon Oct 14 08:40:20 GMT 2024","1804","tests","description_page_test","TestDescriptionPage","","","Verify redirection to github not authorized user.",""
"passed","Mon Oct 14 08:59:26 GMT 2024","Mon Oct 14 08:59:26 GMT 2024","32","tests","used_resources_page_test","TestUsedResourcesPage","","","Verify value of title with tag 'h1' on the page",""
"passed","Mon Oct 14 08:59:04 GMT 2024","Mon Oct 14 08:59:06 GMT 2024","1943","tests","Statistic.","TestCardsRU","","","Check statistic table.",""
"passed","Mon Oct 14 08:48:10 GMT 2024","Mon Oct 14 08:48:11 GMT 2024","623","tests","specialists_page_test","TestSpecialistsPage","","","Verify clickability, href, status code of the 'All Specialists' link",""
"passed","Mon Oct 14 08:59:41 GMT 2024","Mon Oct 14 08:59:42 GMT 2024","972","tests","used_resources_page_test","TestUsedResourcesPage","","","Verify presence, visibility, clickability, href, status code of links in sections",""
"passed","Mon Oct 14 08:44:55 GMT 2024","Mon Oct 14 08:44:55 GMT 2024","57","tests","header_test","TestHeaderPage","","","Verify size of the image in the 'Logo' link in the Header for an authorized user",""
"passed","Mon Oct 14 08:46:31 GMT 2024","Mon Oct 14 08:46:32 GMT 2024","676","tests","registration_page_test","TestRegistrationPage","","","Check registration with new email and empty confirm password",""
"passed","Mon Oct 14 08:45:27 GMT 2024","Mon Oct 14 08:45:28 GMT 2024","1221","tests","main_page_test","TestMainPage","","","Verify redirection to donate page not authorized user.",""
"passed","Mon Oct 14 08:39:07 GMT 2024","Mon Oct 14 08:39:07 GMT 2024","160","tests","contacts_page_test","TestContactsPage","","","Verify the composition and visibility of elements 
        on the 1st-5th levels of nesting in the section 2",""
"skipped","Mon Oct 14 08:53:53 GMT 2024","Mon Oct 14 08:54:22 GMT 2024","29187","tests","Речевые упражнения.","TestCardsRU","","","Select a random card from ""Слова с частотной группировкой"" group and compare UI vs BACKEND data.",""
"passed","Mon Oct 14 08:59:11 GMT 2024","Mon Oct 14 08:59:11 GMT 2024","28","tests","used_resources_page_test","TestUsedResourcesPage","","","Verify presence and visibility of content on the page",""
"skipped","Mon Oct 14 08:52:42 GMT 2024","Mon Oct 14 08:53:11 GMT 2024","29473","tests","Речевые упражнения.","TestCardsRU","","","Select a random card from ""Группа слов"" group and compare UI vs BACKEND data.",""
"passed","Mon Oct 14 08:42:38 GMT 2024","Mon Oct 14 08:42:38 GMT 2024","117","tests","header_test","TestHeaderPage","","","Verify that the 'Logo' link on the Start Unauthorized Page 
                             doesn't refresh the current page or lead to other pages after clicking",""
"passed","Mon Oct 14 08:39:33 GMT 2024","Mon Oct 14 08:39:33 GMT 2024","29","tests","contacts_page_test","TestContactsPage","","","Verify text in links in the section 2",""
"passed","Mon Oct 14 08:42:13 GMT 2024","Mon Oct 14 08:42:19 GMT 2024","6661","tests","header_test","TestHeaderPage","","","Verify clickability, href, status code of links in the Header for an unauthorized user",""
"passed","Mon Oct 14 08:49:17 GMT 2024","Mon Oct 14 08:49:17 GMT 2024","150","tests","start_unauthorized_page_test","TestStartUnauthorizedPage","","","Verify that the 'Login' link leads to the correct page after clicking",""
"passed","Mon Oct 14 08:46:40 GMT 2024","Mon Oct 14 08:46:41 GMT 2024","695","tests","registration_page_test","TestRegistrationPage","","","Check registration with new email and empty first name",""
"passed","Mon Oct 14 08:45:58 GMT 2024","Mon Oct 14 08:45:58 GMT 2024","106","tests","main_page_test","TestMainPage","","","Checking the clickability of the Registration button.",""
"skipped","Mon Oct 14 08:53:18 GMT 2024","Mon Oct 14 08:53:47 GMT 2024","29003","tests","Речевые упражнения.","TestCardsRU","","","Select a random card from ""Предложения"" group and compare UI vs BACKEND data.",""
"passed","Mon Oct 14 08:46:26 GMT 2024","Mon Oct 14 08:46:27 GMT 2024","1206","tests","registration_page_test","TestRegistrationPage","","","Check registration with an existing email",""
"passed","Mon Oct 14 08:47:30 GMT 2024","Mon Oct 14 08:47:30 GMT 2024","340","tests","specialists_page_test","TestSpecialistsPage","","","Verify the composition and visibility of elements 
        on the 1st-6th levels of nesting on the page",""
"skipped","Mon Oct 14 08:51:32 GMT 2024","Mon Oct 14 08:52:00 GMT 2024","28024","tests","Речевые упражнения.","TestCardsRU","","","Select random card from group ""Слова Королёвой"" and compare UI vs BACKEND data.",""
"passed","Mon Oct 14 08:45:41 GMT 2024","Mon Oct 14 08:45:42 GMT 2024","1610","tests","main_page_test","TestMainPage","","","Verify redirection to github not authorized user.",""
"skipped","Mon Oct 14 08:41:20 GMT 2024","Mon Oct 14 08:41:20 GMT 2024","0","tests","footer_test","TestFooter","","","Verify Footer invisibility through the modal window with the exercise",""
"skipped","Mon Oct 14 08:39:50 GMT 2024","Mon Oct 14 08:39:50 GMT 2024","0","tests","contributors_page_test","TestContributorsPage","","","Verify presence, visibility and structure of content on the page",""
"passed","Mon Oct 14 08:45:36 GMT 2024","Mon Oct 14 08:45:37 GMT 2024","645","tests","main_page_test","TestMainPage","","","Verify redirection to specialists page not authorized user.",""
"passed","Mon Oct 14 08:45:46 GMT 2024","Mon Oct 14 08:45:47 GMT 2024","647","tests","main_page_test","TestMainPage","","","Verify redirection to contributors page not authorized user.",""
"skipped","Mon Oct 14 08:52:06 GMT 2024","Mon Oct 14 08:52:36 GMT 2024","29452","tests","Речевые упражнения.","TestCardsRU","","","Select a random card from ""Похожие фразы"" group and compare UI vs BACKEND data.",""
"passed","Mon Oct 14 08:45:55 GMT 2024","Mon Oct 14 08:45:55 GMT 2024","88","tests","main_page_test","TestMainPage","","","Checking the clickability of the Start button.",""
"passed","Mon Oct 14 08:48:43 GMT 2024","Mon Oct 14 08:48:43 GMT 2024","32","tests","start_unauthorized_page_test","TestStartUnauthorizedPage","","","Verify amount and visibility of sections with content on the page",""
"passed","Mon Oct 14 08:40:32 GMT 2024","Mon Oct 14 08:40:32 GMT 2024","40","tests","footer_test","TestFooter","","","Verify presence and visibility of the Footer",""
"passed","Mon Oct 14 08:45:08 GMT 2024","Mon Oct 14 08:45:08 GMT 2024","54","tests","header_test","TestHeaderPage","","","Verify presence, visibility and attributes of the profile avatar in the Header 
               for an authorized user",""
"passed","Mon Oct 14 08:40:13 GMT 2024","Mon Oct 14 08:40:14 GMT 2024","667","tests","description_page_test","TestDescriptionPage","","","Verify redirection to specialists page not authorized user.",""
"passed","Mon Oct 14 08:40:23 GMT 2024","Mon Oct 14 08:40:24 GMT 2024","667","tests","description_page_test","TestDescriptionPage","","","Verify redirection to contributors page not authorized user.",""
"passed","Mon Oct 14 08:39:23 GMT 2024","Mon Oct 14 08:39:23 GMT 2024","50","tests","contacts_page_test","TestContactsPage","","","Verify values of the title and subtitles with tags h1, h2 on the page",""
"passed","Mon Oct 14 08:40:40 GMT 2024","Mon Oct 14 08:40:40 GMT 2024","135","tests","footer_test","TestFooter","","","Verify presence, visibility of text, links, images in the Footer",""
"passed","Mon Oct 14 08:45:50 GMT 2024","Mon Oct 14 08:45:51 GMT 2024","179","tests","main_page_test","TestMainPage","","","Verify redirection to used resources page not authorized user.",""
"passed","Mon Oct 14 08:41:50 GMT 2024","Mon Oct 14 08:42:01 GMT 2024","10212","tests","header_test","TestHeaderPage","","","Verify composition, visibility of elements on the 1st-6th levels of nesting in the Header
            for an unauthorized user",""
"passed","Mon Oct 14 08:45:01 GMT 2024","Mon Oct 14 08:45:01 GMT 2024","58","tests","header_test","TestHeaderPage","","","Verify presence, visibility, attributes of icons in the Header for an authorized user",""
"skipped","Mon Oct 14 08:39:50 GMT 2024","Mon Oct 14 08:39:50 GMT 2024","0","tests","contributors_page_test","TestContributorsPage","","","Verify attribute values of images in contributors cards in grids",""
"passed","Mon Oct 14 08:42:32 GMT 2024","Mon Oct 14 08:42:34 GMT 2024","1803","tests","header_test","TestHeaderPage","","","Verify if external links in the Header for an unauthorized user 
            lead to correct pages after click",""
"passed","Mon Oct 14 08:44:29 GMT 2024","Mon Oct 14 08:44:29 GMT 2024","238","tests","header_test","TestHeaderPage","","","Verify the dropdown opens/closes after clicking on the 'More' button in the Header 
               for an authorized user",""
"passed","Mon Oct 14 08:43:36 GMT 2024","Mon Oct 14 08:43:36 GMT 2024","26","tests","header_test","TestHeaderPage","","","Verify presence, visibility of the user name in the Header for an authorized user",""
"passed","Mon Oct 14 08:59:21 GMT 2024","Mon Oct 14 08:59:21 GMT 2024","12","tests","used_resources_page_test","TestUsedResourcesPage","","","Verify value of the title of the tab",""
"skipped","Mon Oct 14 08:39:50 GMT 2024","Mon Oct 14 08:39:50 GMT 2024","0","tests","contributors_page_test","TestContributorsPage","","","Verify sizes of images in contributor cards in grids",""
"passed","Mon Oct 14 08:43:29 GMT 2024","Mon Oct 14 08:43:29 GMT 2024","184","tests","header_test","TestHeaderPage","","","Verify values of the text in links, buttons in the Header for an authorized user",""
"passed","Mon Oct 14 08:46:54 GMT 2024","Mon Oct 14 08:46:55 GMT 2024","656","tests","registration_page_test","TestRegistrationPage","","","Check registration without choosing gender",""
"skipped","Mon Oct 14 08:39:50 GMT 2024","Mon Oct 14 08:39:50 GMT 2024","0","tests","contributors_page_test","TestContributorsPage","","","Verify values of the text in card descriptions",""
"passed","Mon Oct 14 08:49:00 GMT 2024","Mon Oct 14 08:49:00 GMT 2024","61","tests","start_unauthorized_page_test","TestStartUnauthorizedPage","","","Verify values of titles and subtitles with tags h2, h4 on the page",""
"passed","Mon Oct 14 08:42:09 GMT 2024","Mon Oct 14 08:42:09 GMT 2024","209","tests","header_test","TestHeaderPage","","","Verify values of the text in links, buttons in the Header for an unauthorized user",""
"passed","Mon Oct 14 08:42:46 GMT 2024","Mon Oct 14 08:42:46 GMT 2024","175","tests","header_test","TestHeaderPage","","","Verify switching of the 'ru', 'en' buttons in the Header on the Start Unauthorized Page",""
"passed","Mon Oct 14 08:39:28 GMT 2024","Mon Oct 14 08:39:28 GMT 2024","29","tests","contacts_page_test","TestContactsPage","","","Verify content of the text in the section 2",""
"passed","Mon Oct 14 08:46:45 GMT 2024","Mon Oct 14 08:46:46 GMT 2024","697","tests","registration_page_test","TestRegistrationPage","","","Check registration with new email and empty birthday",""
"passed","Mon Oct 14 08:40:09 GMT 2024","Mon Oct 14 08:40:09 GMT 2024","184","tests","description_page_test","TestDescriptionPage","","","Verify redirection to contacts page not authorized user.",""
"passed","Mon Oct 14 08:48:39 GMT 2024","Mon Oct 14 08:48:39 GMT 2024","34","tests","start_unauthorized_page_test","TestStartUnauthorizedPage","","","Verify presence and visibility of content on the page",""
"skipped","Mon Oct 14 08:39:50 GMT 2024","Mon Oct 14 08:39:50 GMT 2024","0","tests","contributors_page_test","TestContributorsPage","","","Verify values of title and subtitles with tags h2, h3 on the page",""
"passed","Mon Oct 14 08:39:44 GMT 2024","Mon Oct 14 08:39:45 GMT 2024","1363","tests","contacts_page_test","TestContactsPage","","","Verify if links in the section 2 lead to the correct pages after clicking",""
"skipped","Mon Oct 14 08:50:40 GMT 2024","Mon Oct 14 08:51:08 GMT 2024","27644","tests","Speech exercises EN.","TestCardsEN","","","Select a random card from ""Similar phrases"" group and compare UI vs BACKEND data",""
"passed","Mon Oct 14 08:49:25 GMT 2024","Mon Oct 14 08:49:25 GMT 2024","73","tests","start_unauthorized_page_test","TestStartUnauthorizedPage","","","Verify size of the image in the section 1",""
"passed","Mon Oct 14 08:41:12 GMT 2024","Mon Oct 14 08:41:12 GMT 2024","105","tests","footer_test","TestFooter","","","Verify that the 'Contact us' link in the Footer calls an email client",""
