"Status","Start Time","Stop Time","Duration in ms","Parent Suite","Suite","Sub Suite","Test Class","Test Method","Name","Description"
"passed","Mon Oct 14 08:48:00 GMT 2024","Mon Oct 14 08:48:00 GMT 2024","109","tests","specialists_page_test","TestSpecialistsPage","","","Verify values of names and professions in specialist cards in the grid",""
"passed","Mon Oct 14 08:40:52 GMT 2024","Mon Oct 14 08:40:54 GMT 2024","2486","tests","footer_test","TestFooter","","","Verify clickability, href, prefix and subject, status code of links in the Footer",""
"passed","Mon Oct 14 08:47:25 GMT 2024","Mon Oct 14 08:47:25 GMT 2024","32","tests","specialists_page_test","TestSpecialistsPage","","","Verify presence and visibility of content on the page",""
"passed","Mon Oct 14 08:49:03 GMT 2024","Mon Oct 14 08:49:04 GMT 2024","90","tests","start_unauthorized_page_test","TestStartUnauthorizedPage","","","Verify content of the text in sections 1, 2",""
"passed","Mon Oct 14 08:59:16 GMT 2024","Mon Oct 14 08:59:16 GMT 2024","124","tests","used_resources_page_test","TestUsedResourcesPage","","","Verify the composition and visibility of elements 
        on the 1st-4th levels of nesting on the page",""
"passed","Mon Oct 14 08:59:36 GMT 2024","Mon Oct 14 08:59:36 GMT 2024","29","tests","used_resources_page_test","TestUsedResourcesPage","","","Verify text in links in sections",""
"passed","Mon Oct 14 08:40:36 GMT 2024","Mon Oct 14 08:40:36 GMT 2024","260","tests","footer_test","TestFooter","","","Verify composition and visibility of elements on the 1st-7th levels of nesting in the Footer",""
"skipped","Mon Oct 14 08:39:50 GMT 2024","Mon Oct 14 08:39:50 GMT 2024","0","tests","contributors_page_test","TestContributorsPage","","","Verify presence, visibility of titles/subtitles, cards, descriptions, links, images on the page",""
"skipped","Mon Oct 14 08:50:06 GMT 2024","Mon Oct 14 08:50:34 GMT 2024","28175","tests","Speech exercises EN.","TestCardsEN","","","Check progres-bar and buttons.",""
"passed","Mon Oct 14 08:59:47 GMT 2024","Mon Oct 14 08:59:48 GMT 2024","1271","tests","used_resources_page_test","TestUsedResourcesPage","","","Verify that links in the sections lead to the correct pages after clicking",""
"passed","Mon Oct 14 08:45:22 GMT 2024","Mon Oct 14 08:45:23 GMT 2024","1372","tests","main_page_test","TestMainPage","","","Verify redirection to telegram page not authorized user.",""
"skipped","Mon Oct 14 08:49:31 GMT 2024","Mon Oct 14 08:49:59 GMT 2024","28285","tests","Speech exercises EN.","TestCardsEN","","","Select random card from ""Word"" group and compare UI vs BACKEND data",""
"passed","Mon Oct 14 08:48:30 GMT 2024","Mon Oct 14 08:48:30 GMT 2024","123","tests","specialists_page_test","TestSpecialistsPage","","","Verify attributes of images in specialist cards in the grid",""
"passed","Mon Oct 14 08:44:35 GMT 2024","Mon Oct 14 08:44:35 GMT 2024","168","tests","header_test","TestHeaderPage","","","Verify switching of the 'ru', 'en' buttons in the Header for an authorized user",""
"passed","Mon Oct 14 08:55:25 GMT 2024","Mon Oct 14 08:58:44 GMT 2024","199788","tests","Речевые упражнения.","TestCardsRU","","","Solutions to a random task in the ""Слова Королёвой"" .",""
"passed","Mon Oct 14 08:48:56 GMT 2024","Mon Oct 14 08:48:56 GMT 2024","14","tests","start_unauthorized_page_test","TestStartUnauthorizedPage","","","Verify value of the title of the tab",""
"passed","Mon Oct 14 08:39:02 GMT 2024","Mon Oct 14 08:39:02 GMT 2024","20","tests","contacts_page_test","TestContactsPage","","","Verify the composition and visibility of elements on the 1st level of nesting in the section 1",""
"passed","Mon Oct 14 08:49:21 GMT 2024","Mon Oct 14 08:49:21 GMT 2024","92","tests","start_unauthorized_page_test","TestStartUnauthorizedPage","","","Verify presence, visibility and attributes of the image in the section 1",""
"passed","Mon Oct 14 08:39:38 GMT 2024","Mon Oct 14 08:39:39 GMT 2024","853","tests","contacts_page_test","TestContactsPage","","","Verify presence, visibility, clickability, href, prefix, status code of links in the section 2",""
"passed","Mon Oct 14 08:43:23 GMT 2024","Mon Oct 14 08:43:23 GMT 2024","366","tests","header_test","TestHeaderPage","","","Verify presence, visibility of links, buttons in the Header for an authorized user",""
"passed","Mon Oct 14 08:47:55 GMT 2024","Mon Oct 14 08:47:55 GMT 2024","38","tests","specialists_page_test","TestSpecialistsPage","","","Verify value of text on the page",""
