"Status","Start Time","Stop Time","Duration in ms","Parent Suite","Suite","Sub Suite","Test Class","Test Method","Name","Description"
"passed","Fri Mar 07 01:00:03 GMT 2025","Fri Mar 07 01:00:03 GMT 2025","19","tests","contacts_page_test","TestContactsPage","","","Verify the composition and visibility of elements on the 1st level of nesting in the section 1",""
"passed","Fri Mar 07 01:23:54 GMT 2025","Fri Mar 07 01:24:06 GMT 2025","12301","tests","Речевые упражнения.","TestCardsRU","","","Select random card from group ""Слова Королёвой"" and compare UI vs BACKEND data.",""
"passed","Fri Mar 07 01:13:39 GMT 2025","Fri Mar 07 01:13:41 GMT 2025","2055","tests","header_test","TestHeaderPage","","","Verify if external links in the Header for an unauthorized user 
            lead to correct pages after click",""
"passed","Fri Mar 07 01:18:34 GMT 2025","Fri Mar 07 01:18:35 GMT 2025","1261","tests","registration_page_test","TestRegistrationPage","","","Check registration with an existing email",""
"passed","Fri Mar 07 01:15:49 GMT 2025","Fri Mar 07 01:15:50 GMT 2025","85","tests","header_test","TestHeaderPage","","","Verify that the 'Logo' link on the Start Authorized Page 
                             doesn't refresh the current page or lead to other pages after clicking",""
"passed","Fri Mar 07 01:20:18 GMT 2025","Fri Mar 07 01:20:18 GMT 2025","107","tests","specialists_page_test","TestSpecialistsPage","","","Verify values of names and professions in specialist cards in the grid",""
"passed","Fri Mar 07 01:05:16 GMT 2025","Fri Mar 07 01:05:16 GMT 2025","581","tests","exercises_ru_words_page_test","TestExercisesRuWordsPage","","","Verify text in cards on the page",""
"passed","Fri Mar 07 01:05:04 GMT 2025","Fri Mar 07 01:05:04 GMT 2025","160","tests","exercises_ru_words_page_test","TestExercisesRuWordsPage","","","Verify text in group links on the page",""
"passed","Fri Mar 07 01:26:56 GMT 2025","Fri Mar 07 01:27:24 GMT 2025","27610","tests","Речевые упражнения.","TestCardsRU","","","Solutions to a random task in the ""Слова Королёвой"" .",""
"passed","Fri Mar 07 01:28:42 GMT 2025","Fri Mar 07 01:28:42 GMT 2025","55","tests","used_resources_page_test","TestUsedResourcesPage","","","Verify presence, visibility and attributes of icons in sections",""
"passed","Fri Mar 07 01:05:53 GMT 2025","Fri Mar 07 01:06:20 GMT 2025","26527","tests","exercises_ru_words_page_test","TestExercisesRuWordsPage","","","Verify clickability, titles, href, status code of subgroup links on the page",""
"passed","Fri Mar 07 01:19:06 GMT 2025","Fri Mar 07 01:19:07 GMT 2025","697","tests","registration_page_test","TestRegistrationPage","","","Check registration without choosing gender",""
"passed","Fri Mar 07 01:17:15 GMT 2025","Fri Mar 07 01:17:15 GMT 2025","198","tests","main_page_test","TestMainPage","","","Verify redirection to contacts page not authorized user.",""
"passed","Fri Mar 07 01:17:51 GMT 2025","Fri Mar 07 01:18:19 GMT 2025","27801","tests","profile_page_test","TestProfilePage","","","Change the password by receiving an email link",""
"passed","Fri Mar 07 01:11:57 GMT 2025","Fri Mar 07 01:12:15 GMT 2025","18246","tests","groups_page_test","TestGroupsPage","","","Verify if links on the 'en' local lead to correct pages after clicking",""
"passed","Fri Mar 07 01:02:28 GMT 2025","Fri Mar 07 01:02:28 GMT 2025","181","tests","description_page_test","TestDescriptionPage","","","Verify redirection to contacts page not authorized user.",""
"passed","Fri Mar 07 01:10:04 GMT 2025","Fri Mar 07 01:10:08 GMT 2025","3119","tests","groups_page_test","TestGroupsPage","","","Verify presence, visibility of the title, tiles, links, images, subtitles on the page",""
"passed","Fri Mar 07 01:09:23 GMT 2025","Fri Mar 07 01:09:23 GMT 2025","107","tests","footer_test","TestFooter","","","Verify sizes of images in links in the Footer",""
"passed","Fri Mar 07 01:03:28 GMT 2025","Fri Mar 07 01:03:30 GMT 2025","2235","tests","exercises_ru_similar_phrases_page_test","TestExercisesRuSimilarPhrasesPage","","","Verify presence, visibility of lists on the page",""
"skipped","Fri Mar 07 01:22:37 GMT 2025","Fri Mar 07 01:22:58 GMT 2025","20635","tests","Speech exercises EN.","TestCardsEN","","","Check progres-bar and buttons.",""
"passed","Fri Mar 07 01:13:14 GMT 2025","Fri Mar 07 01:13:15 GMT 2025","203","tests","header_test","TestHeaderPage","","","Verify values of the text in links, buttons in the Header for an unauthorized user",""
"passed","Fri Mar 07 01:06:57 GMT 2025","Fri Mar 07 01:06:58 GMT 2025","384","tests","exercises_ru_words_page_test","TestExercisesRuWordsPage","","","Verify if breadcrumbs link3 leads to the correct page after clicking",""
"passed","Fri Mar 07 01:21:46 GMT 2025","Fri Mar 07 01:21:47 GMT 2025","635","tests","start_unauthorized_page_test","TestStartUnauthorizedPage","","","Verify presence, visibility, clickability, href, status code 
                         of the 'Login' link in the section 1",""
"passed","Fri Mar 07 01:19:50 GMT 2025","Fri Mar 07 01:19:55 GMT 2025","5341","tests","specialists_page_test","TestSpecialistsPage","","","Verify presence, visibility of the title, text, link, grid, cards and images  
        on the 2nd, 3rd, 5th, 6th levels of nesting on the page",""
"passed","Fri Mar 07 01:19:01 GMT 2025","Fri Mar 07 01:19:02 GMT 2025","711","tests","registration_page_test","TestRegistrationPage","","","Check registration with new email and empty email",""
"passed","Fri Mar 07 01:01:14 GMT 2025","Fri Mar 07 01:01:18 GMT 2025","3692","tests","contributors_page_test","TestContributorsPage","","","Verify presence, visibility of titles/subtitles, cards, descriptions, links, images on the page",""
"passed","Fri Mar 07 01:01:32 GMT 2025","Fri Mar 07 01:01:32 GMT 2025","19","tests","contributors_page_test","TestContributorsPage","","","Verify content of the text on the page",""
"passed","Fri Mar 07 01:28:36 GMT 2025","Fri Mar 07 01:28:37 GMT 2025","1106","tests","used_resources_page_test","TestUsedResourcesPage","","","Verify that links in the sections lead to the correct pages after clicking",""
"passed","Fri Mar 07 01:20:06 GMT 2025","Fri Mar 07 01:20:06 GMT 2025","32","tests","specialists_page_test","TestSpecialistsPage","","","Verify value of title with tag 'h2' on the page",""
"passed","Fri Mar 07 01:14:55 GMT 2025","Fri Mar 07 01:14:55 GMT 2025","38","tests","header_test","TestHeaderPage","","","Verify presence, visibility of the user name in the Header for an authorized user",""
"passed","Fri Mar 07 01:00:38 GMT 2025","Fri Mar 07 01:00:38 GMT 2025","28","tests","contacts_page_test","TestContactsPage","","","Verify text in links in the section 2",""
"passed","Fri Mar 07 01:01:08 GMT 2025","Fri Mar 07 01:01:09 GMT 2025","1674","tests","contributors_page_test","TestContributorsPage","","","Verify the composition and visibility of elements 
        on the 1st-5th levels of nesting on the page",""
"passed","Fri Mar 07 01:23:34 GMT 2025","Fri Mar 07 01:23:46 GMT 2025","11480","tests","Речевые упражнения.","TestCardsRU","","","Select random card from group ""Слова"" and compare UI vs BACKEND data.",""
"passed","Fri Mar 07 01:12:24 GMT 2025","Fri Mar 07 01:12:32 GMT 2025","8228","tests","groups_page_test","TestGroupsPage","","","Verify attributes of images in links on the page",""
"passed","Fri Mar 07 01:00:44 GMT 2025","Fri Mar 07 01:00:45 GMT 2025","1084","tests","contacts_page_test","TestContactsPage","","","Verify presence, visibility, clickability, href, prefix, status code of links in the section 2",""
"passed","Fri Mar 07 01:02:21 GMT 2025","Fri Mar 07 01:02:23 GMT 2025","1903","tests","description_page_test","TestDescriptionPage","","","Verify redirection to donate page not authorized user.",""
"passed","Fri Mar 07 01:13:51 GMT 2025","Fri Mar 07 01:13:51 GMT 2025","292","tests","header_test","TestHeaderPage","","","Verify the dropdown opens/closes after clicking on the 'More' button in the Header 
            on the Start Unauthorized Page",""
"passed","Fri Mar 07 01:14:00 GMT 2025","Fri Mar 07 01:14:00 GMT 2025","48","tests","header_test","TestHeaderPage","","","Verify presence, visibility and attributes of the image in the 'Logo' link in the Header 
               on the Start Unauthorized Page",""
"passed","Fri Mar 07 01:10:32 GMT 2025","Fri Mar 07 01:10:48 GMT 2025","16370","tests","groups_page_test","TestGroupsPage","","","Verify value of the title and subtitles on the page",""
"broken","Fri Mar 07 01:07:28 GMT 2025","Fri Mar 07 01:07:50 GMT 2025","21624","tests","exercises_ru_words_page_test","TestExercisesRuWordsPage","","","Verify if subgroup links 1-4 lead to correct pages after clicking",""
"passed","Fri Mar 07 01:02:38 GMT 2025","Fri Mar 07 01:02:40 GMT 2025","1864","tests","description_page_test","TestDescriptionPage","","","Verify redirection to github not authorized user.",""
"passed","Fri Mar 07 01:17:03 GMT 2025","Fri Mar 07 01:17:04 GMT 2025","1714","tests","main_page_test","TestMainPage","","","Verify redirection to telegram page not authorized user.",""
"passed","Fri Mar 07 01:16:46 GMT 2025","Fri Mar 07 01:16:46 GMT 2025","52","tests","header_test","TestHeaderPage","","","Verify presence, visibility and attributes of the profile avatar in the Header 
               for an authorized user",""
"passed","Fri Mar 07 01:10:56 GMT 2025","Fri Mar 07 01:11:23 GMT 2025","26906","tests","groups_page_test","TestGroupsPage","","","Verify clickability, title, href, status code of links on the page",""
"passed","Fri Mar 07 01:13:09 GMT 2025","Fri Mar 07 01:13:10 GMT 2025","368","tests","header_test","TestHeaderPage","","","Verify presence, visibility of links, buttons in the Header for an unauthorized user",""
"passed","Fri Mar 07 01:21:28 GMT 2025","Fri Mar 07 01:21:28 GMT 2025","14","tests","start_unauthorized_page_test","TestStartUnauthorizedPage","","","Verify value of the title of the tab",""
"passed","Fri Mar 07 01:21:14 GMT 2025","Fri Mar 07 01:21:14 GMT 2025","33","tests","start_unauthorized_page_test","TestStartUnauthorizedPage","","","Verify amount and visibility of sections with content on the page",""
"passed","Fri Mar 07 01:00:32 GMT 2025","Fri Mar 07 01:00:32 GMT 2025","29","tests","contacts_page_test","TestContactsPage","","","Verify content of the text in the section 2",""
"passed","Fri Mar 07 01:16:58 GMT 2025","Fri Mar 07 01:16:58 GMT 2025","131","tests","main_page_test","TestMainPage","","","Verify redirection to description page not authorized user.",""
"passed","Fri Mar 07 01:28:28 GMT 2025","Fri Mar 07 01:28:30 GMT 2025","2020","tests","used_resources_page_test","TestUsedResourcesPage","","","Verify presence, visibility, clickability, href, status code of links in sections",""
"passed","Fri Mar 07 01:16:22 GMT 2025","Fri Mar 07 01:16:22 GMT 2025","38","tests","header_test","TestHeaderPage","","","Verify presence, visibility and attributes of the image in the 'Logo' link in the Header 
               for an authorized user",""
"passed","Fri Mar 07 01:18:56 GMT 2025","Fri Mar 07 01:18:57 GMT 2025","716","tests","registration_page_test","TestRegistrationPage","","","Check registration with new email and empty birthday",""
"passed","Fri Mar 07 01:20:42 GMT 2025","Fri Mar 07 01:20:42 GMT 2025","656","tests","specialists_page_test","TestSpecialistsPage","","","Verify that the 'All Specialists' link leads an unauthorized user 
                         to the correct page after clicking",""
"passed","Fri Mar 07 01:20:12 GMT 2025","Fri Mar 07 01:20:12 GMT 2025","33","tests","specialists_page_test","TestSpecialistsPage","","","Verify value of text on the page",""
"passed","Fri Mar 07 01:09:31 GMT 2025","Fri Mar 07 01:09:37 GMT 2025","6618","tests","footer_test","TestFooter","","","Verify Footer invisibility through the modal window with the exercise",""
"passed","Fri Mar 07 01:14:21 GMT 2025","Fri Mar 07 01:14:31 GMT 2025","10234","tests","header_test","TestHeaderPage","","","Verify composition, visibility of elements on the 1st-6th levels of nesting in the Header
            for an authorized user",""
"passed","Fri Mar 07 01:08:32 GMT 2025","Fri Mar 07 01:08:32 GMT 2025","135","tests","footer_test","TestFooter","","","Verify presence, visibility of text, links, images in the Footer",""
"passed","Fri Mar 07 01:17:45 GMT 2025","Fri Mar 07 01:17:46 GMT 2025","121","tests","main_page_test","TestMainPage","","","Checking the clickability of the Registration button.",""
"skipped","Fri Mar 07 01:23:06 GMT 2025","Fri Mar 07 01:23:27 GMT 2025","20627","tests","Speech exercises EN.","TestCardsEN","","","Select a random card from ""Similar phrases"" group and compare UI vs BACKEND data",""
"passed","Fri Mar 07 01:01:53 GMT 2025","Fri Mar 07 01:01:54 GMT 2025","760","tests","contributors_page_test","TestContributorsPage","","","Verify href, status code of the 'All Team' link",""
"passed","Fri Mar 07 01:08:23 GMT 2025","Fri Mar 07 01:08:23 GMT 2025","40","tests","footer_test","TestFooter","","","Verify presence and visibility of the Footer",""
"passed","Fri Mar 07 01:08:36 GMT 2025","Fri Mar 07 01:08:36 GMT 2025","49","tests","footer_test","TestFooter","","","Verify content of text in the Footer",""
"passed","Fri Mar 07 01:09:18 GMT 2025","Fri Mar 07 01:09:18 GMT 2025","76","tests","footer_test","TestFooter","","","Verify attributes of images in links in the Footer",""
"passed","Fri Mar 07 01:20:01 GMT 2025","Fri Mar 07 01:20:01 GMT 2025","13","tests","specialists_page_test","TestSpecialistsPage","","","Verify value of the title of the tab",""
"passed","Fri Mar 07 01:00:26 GMT 2025","Fri Mar 07 01:00:26 GMT 2025","49","tests","contacts_page_test","TestContactsPage","","","Verify values of the title and subtitles with tags h1, h2 on the page",""
"passed","Fri Mar 07 01:02:15 GMT 2025","Fri Mar 07 01:02:17 GMT 2025","1770","tests","description_page_test","TestDescriptionPage","","","Verify redirection to telegram page not authorized user.",""
"skipped","Fri Mar 07 01:27:32 GMT 2025","Fri Mar 07 01:27:39 GMT 2025","7050","tests","Речевые упражнения.","TestCardsRU","","","Solutions to a random task in the ""Слова"" group and comparison of statics.",""
"passed","Fri Mar 07 01:08:41 GMT 2025","Fri Mar 07 01:08:41 GMT 2025","45","tests","footer_test","TestFooter","","","Verify text in the 'Contact us' link in the Footer",""
"passed","Fri Mar 07 01:06:46 GMT 2025","Fri Mar 07 01:06:46 GMT 2025","141","tests","exercises_ru_words_page_test","TestExercisesRuWordsPage","","","Verify if breadcrumbs link2 leads to the correct page after clicking",""
"passed","Fri Mar 07 01:15:57 GMT 2025","Fri Mar 07 01:15:58 GMT 2025","242","tests","header_test","TestHeaderPage","","","Verify the dropdown opens/closes after clicking on the 'More' button in the Header 
               for an authorized user",""
"passed","Fri Mar 07 01:09:45 GMT 2025","Fri Mar 07 01:09:45 GMT 2025","26","tests","groups_page_test","TestGroupsPage","","","Verify presence and visibility of content on the page",""
"passed","Fri Mar 07 01:04:13 GMT 2025","Fri Mar 07 01:04:16 GMT 2025","3447","tests","exercises_ru_words_page_test","TestExercisesRuWordsPage","","","Verify composition, visibility of elements on the 1st-6th levels of nesting on the page",""
"passed","Fri Mar 07 01:15:03 GMT 2025","Fri Mar 07 01:15:10 GMT 2025","6417","tests","header_test","TestHeaderPage","","","Verify clickability, href, status code of links in the Header for an authorized user",""
"passed","Fri Mar 07 01:24:14 GMT 2025","Fri Mar 07 01:24:26 GMT 2025","11932","tests","Речевые упражнения.","TestCardsRU","","","Select a random card from ""Похожие фразы"" group and compare UI vs BACKEND data.",""
"passed","Fri Mar 07 01:01:03 GMT 2025","Fri Mar 07 01:01:03 GMT 2025","51","tests","contributors_page_test","TestContributorsPage","","","Verify presence, visibility and structure of content on the page",""
"passed","Fri Mar 07 01:02:50 GMT 2025","Fri Mar 07 01:02:50 GMT 2025","176","tests","description_page_test","TestDescriptionPage","","","Verify redirection to used resources page not authorized user.",""
"passed","Fri Mar 07 01:16:30 GMT 2025","Fri Mar 07 01:16:30 GMT 2025","50","tests","header_test","TestHeaderPage","","","Verify size of the image in the 'Logo' link in the Header for an authorized user",""
"passed","Fri Mar 07 01:08:13 GMT 2025","Fri Mar 07 01:08:18 GMT 2025","5146","tests","exercises_ru_words_page_test","TestExercisesRuWordsPage","","","Verify sizes of background-images in links on the page",""
"passed","Fri Mar 07 01:02:32 GMT 2025","Fri Mar 07 01:02:34 GMT 2025","1681","tests","description_page_test","TestDescriptionPage","","","Verify redirection to specialists page not authorized user.",""
"passed","Fri Mar 07 01:27:54 GMT 2025","Fri Mar 07 01:27:54 GMT 2025","29","tests","used_resources_page_test","TestUsedResourcesPage","","","Verify presence and visibility of content on the page",""
"passed","Fri Mar 07 01:17:30 GMT 2025","Fri Mar 07 01:17:31 GMT 2025","677","tests","main_page_test","TestMainPage","","","Verify redirection to contributors page not authorized user.",""
"passed","Fri Mar 07 01:28:17 GMT 2025","Fri Mar 07 01:28:17 GMT 2025","33","tests","used_resources_page_test","TestUsedResourcesPage","","","Verify content of the text on the page",""
"passed","Fri Mar 07 01:13:19 GMT 2025","Fri Mar 07 01:13:25 GMT 2025","6294","tests","header_test","TestHeaderPage","","","Verify clickability, href, status code of links in the Header for an unauthorized user",""
"passed","Fri Mar 07 01:06:31 GMT 2025","Fri Mar 07 01:06:34 GMT 2025","3147","tests","exercises_ru_words_page_test","TestExercisesRuWordsPage","","","Verify if breadcrumbs link1 leads to the correct page after clicking",""
"passed","Fri Mar 07 01:21:23 GMT 2025","Fri Mar 07 01:21:23 GMT 2025","122","tests","start_unauthorized_page_test","TestStartUnauthorizedPage","","","Verify the composition and visibility of elements 
        on the 1st-3rd levels of nesting in the section 2",""
"passed","Fri Mar 07 01:16:05 GMT 2025","Fri Mar 07 01:16:06 GMT 2025","186","tests","header_test","TestHeaderPage","","","Verify switching of the 'ru', 'en' buttons in the Header for an authorized user",""
"passed","Fri Mar 07 01:09:13 GMT 2025","Fri Mar 07 01:09:13 GMT 2025","113","tests","footer_test","TestFooter","","","Verify that the 'Contact us' link in the Footer calls an email client",""
"passed","Fri Mar 07 01:12:55 GMT 2025","Fri Mar 07 01:13:05 GMT 2025","10206","tests","header_test","TestHeaderPage","","","Verify composition, visibility of elements on the 1st-6th levels of nesting in the Header
            for an unauthorized user",""
"passed","Fri Mar 07 01:16:14 GMT 2025","Fri Mar 07 01:16:14 GMT 2025","433","tests","header_test","TestHeaderPage","","","Verify user logout after clicking the 'Logout' button in the Header for an authorized user",""
"passed","Fri Mar 07 01:00:15 GMT 2025","Fri Mar 07 01:00:15 GMT 2025","163","tests","contacts_page_test","TestContactsPage","","","Verify presence, visibility of sections, the dividing line and elements with text on the page",""
"passed","Fri Mar 07 01:17:09 GMT 2025","Fri Mar 07 01:17:10 GMT 2025","1284","tests","main_page_test","TestMainPage","","","Verify redirection to donate page not authorized user.",""
"passed","Fri Mar 07 01:14:13 GMT 2025","Fri Mar 07 01:14:13 GMT 2025","26","tests","header_test","TestHeaderPage","","","Verify presence and visibility of the Header for an authorized user",""
"passed","Fri Mar 07 01:18:51 GMT 2025","Fri Mar 07 01:18:52 GMT 2025","740","tests","registration_page_test","TestRegistrationPage","","","Check registration with new email and empty first name",""
"passed","Fri Mar 07 01:19:44 GMT 2025","Fri Mar 07 01:19:44 GMT 2025","329","tests","specialists_page_test","TestSpecialistsPage","","","Verify the composition and visibility of elements 
        on the 1st-6th levels of nesting on the page",""
"passed","Fri Mar 07 01:13:30 GMT 2025","Fri Mar 07 01:13:35 GMT 2025","4955","tests","header_test","TestHeaderPage","","","Verify if internal links in the Header for an unauthorized user 
            lead to correct pages after click",""
"passed","Fri Mar 07 01:20:29 GMT 2025","Fri Mar 07 01:20:30 GMT 2025","571","tests","specialists_page_test","TestSpecialistsPage","","","Verify clickability, href, status code of the 'All Specialists' link",""
"passed","Fri Mar 07 01:20:59 GMT 2025","Fri Mar 07 01:20:59 GMT 2025","102","tests","specialists_page_test","TestSpecialistsPage","","","Verify attributes of images in specialist cards in the grid",""
"passed","Fri Mar 07 01:22:01 GMT 2025","Fri Mar 07 01:22:01 GMT 2025","61","tests","start_unauthorized_page_test","TestStartUnauthorizedPage","","","Verify size of the image in the section 1",""
"passed","Fri Mar 07 01:05:28 GMT 2025","Fri Mar 07 01:05:30 GMT 2025","2330","tests","exercises_ru_words_page_test","TestExercisesRuWordsPage","","","Verify clickability, href, status code of links in breadcrumbs on the page",""
"skipped","Fri Mar 07 01:22:09 GMT 2025","Fri Mar 07 01:22:30 GMT 2025","20632","tests","Speech exercises EN.","TestCardsEN","","","Select random card from ""Word"" group and compare UI vs BACKEND data",""
"passed","Fri Mar 07 01:14:39 GMT 2025","Fri Mar 07 01:14:39 GMT 2025","361","tests","header_test","TestHeaderPage","","","Verify presence, visibility of links, buttons in the Header for an authorized user",""
"skipped","Fri Mar 07 01:24:54 GMT 2025","Fri Mar 07 01:25:18 GMT 2025","23486","tests","Речевые упражнения.","TestCardsRU","","","Select a random card from ""Предложения"" group and compare UI vs BACKEND data.",""
"passed","Fri Mar 07 01:24:34 GMT 2025","Fri Mar 07 01:24:46 GMT 2025","12240","tests","Речевые упражнения.","TestCardsRU","","","Select a random card from ""Группа слов"" group and compare UI vs BACKEND data.",""
"passed","Fri Mar 07 01:14:05 GMT 2025","Fri Mar 07 01:14:05 GMT 2025","53","tests","header_test","TestHeaderPage","","","Verify size of the image in the 'Logo' link in the Header on the Start Unauthorized Page",""
"passed","Fri Mar 07 01:20:24 GMT 2025","Fri Mar 07 01:20:24 GMT 2025","48","tests","specialists_page_test","TestSpecialistsPage","","","Verify text in the 'All Specialists' link",""
"passed","Fri Mar 07 01:01:58 GMT 2025","Fri Mar 07 01:01:59 GMT 2025","815","tests","contributors_page_test","TestContributorsPage","","","Verify attribute values of images in contributors cards in grids",""
"passed","Fri Mar 07 01:28:22 GMT 2025","Fri Mar 07 01:28:22 GMT 2025","28","tests","used_resources_page_test","TestUsedResourcesPage","","","Verify text in links in sections",""
"passed","Fri Mar 07 01:17:24 GMT 2025","Fri Mar 07 01:17:26 GMT 2025","1561","tests","main_page_test","TestMainPage","","","Verify redirection to github not authorized user.",""
"passed","Fri Mar 07 01:00:58 GMT 2025","Fri Mar 07 01:00:58 GMT 2025","102","tests","contacts_page_test","TestContactsPage","","","Verify that the email link calls an email client",""
"passed","Fri Mar 07 01:00:09 GMT 2025","Fri Mar 07 01:00:09 GMT 2025","133","tests","contacts_page_test","TestContactsPage","","","Verify the composition and visibility of elements 
        on the 1st-5th levels of nesting in the section 2",""
"passed","Fri Mar 07 01:03:15 GMT 2025","Fri Mar 07 01:03:18 GMT 2025","3375","tests","exercises_ru_similar_phrases_page_test","TestExercisesRuSimilarPhrasesPage","","","Verify composition, visibility of elements on the 1st-7th levels of nesting on the page",""
"passed","Fri Mar 07 01:28:00 GMT 2025","Fri Mar 07 01:28:00 GMT 2025","118","tests","used_resources_page_test","TestUsedResourcesPage","","","Verify the composition and visibility of elements 
        on the 1st-4th levels of nesting on the page",""
"passed","Fri Mar 07 01:21:05 GMT 2025","Fri Mar 07 01:21:05 GMT 2025","153","tests","specialists_page_test","TestSpecialistsPage","","","Verify sizes of images in specialist cards in the grid",""
"passed","Fri Mar 07 01:04:41 GMT 2025","Fri Mar 07 01:04:41 GMT 2025","160","tests","exercises_ru_words_page_test","TestExercisesRuWordsPage","","","Verify value of the title of the tab",""
"passed","Fri Mar 07 01:13:55 GMT 2025","Fri Mar 07 01:13:56 GMT 2025","216","tests","header_test","TestHeaderPage","","","Verify switching of the 'ru', 'en' buttons in the Header on the Start Unauthorized Page",""
"passed","Fri Mar 07 01:08:01 GMT 2025","Fri Mar 07 01:08:02 GMT 2025","545","tests","exercises_ru_words_page_test","TestExercisesRuWordsPage","","","Verify attributes of images in links on the page",""
"passed","Fri Mar 07 01:07:09 GMT 2025","Fri Mar 07 01:07:17 GMT 2025","7831","tests","exercises_ru_words_page_test","TestExercisesRuWordsPage","","","Verify if group links lead to correct pages after clicking",""
"skipped","Fri Mar 07 01:17:46 GMT 2025","Fri Mar 07 01:17:46 GMT 2025","0","tests","main_page_test","TestMainPage","","","Checking the ip is available",""
"passed","Fri Mar 07 01:04:53 GMT 2025","Fri Mar 07 01:04:53 GMT 2025","95","tests","exercises_ru_words_page_test","TestExercisesRuWordsPage","","","Verify value of the breadcrumbs on the page",""
"passed","Fri Mar 07 01:04:28 GMT 2025","Fri Mar 07 01:04:30 GMT 2025","2014","tests","exercises_ru_words_page_test","TestExercisesRuWordsPage","","","Verify presence, visibility of lists on the page",""
"passed","Fri Mar 07 01:12:40 GMT 2025","Fri Mar 07 01:12:46 GMT 2025","6065","tests","groups_page_test","TestGroupsPage","","","Verify sizes of images in links on the page",""
"passed","Fri Mar 07 01:01:37 GMT 2025","Fri Mar 07 01:01:38 GMT 2025","1363","tests","contributors_page_test","TestContributorsPage","","","Verify values of the text in card descriptions",""
