"Status","Start Time","Stop Time","Duration in ms","Parent Suite","Suite","Sub Suite","Test Class","Test Method","Name","Description"
"passed","Fri Mar 07 00:59:57 GMT 2025","Fri Mar 07 00:59:58 GMT 2025","27","tests","contacts_page_test","TestContactsPage","","","Verify presence and visibility of content on the page",""
"passed","Fri Mar 07 01:08:55 GMT 2025","Fri Mar 07 01:09:09 GMT 2025","13419","tests","footer_test","TestFooter","","","Verify that links in the Footer lead to correct pages after clicking",""
"passed","Fri Mar 07 01:28:48 GMT 2025","Fri Mar 07 01:28:48 GMT 2025","76","tests","used_resources_page_test","TestUsedResourcesPage","","","Verify sizes of icons in sections",""
"passed","Fri Mar 07 01:14:47 GMT 2025","Fri Mar 07 01:14:47 GMT 2025","188","tests","header_test","TestHeaderPage","","","Verify values of the text in links, buttons in the Header for an authorized user",""
"passed","Fri Mar 07 01:05:41 GMT 2025","Fri Mar 07 01:05:42 GMT 2025","263","tests","exercises_ru_words_page_test","TestExercisesRuWordsPage","","","Verify clickability, titles, attributes of group links on the page",""
"passed","Fri Mar 07 00:59:51 GMT 2025","Fri Mar 07 00:59:52 GMT 2025","925","tests","authorisation_page_test","TestAuthorizedUserPage","","","Checking the possibility of authorization with incorrect data",""
"passed","Fri Mar 07 01:00:21 GMT 2025","Fri Mar 07 01:00:21 GMT 2025","11","tests","contacts_page_test","TestContactsPage","","","Verify value of the title of the tab",""
"passed","Fri Mar 07 01:19:12 GMT 2025","Fri Mar 07 01:19:32 GMT 2025","20783","tests","registration_page_test","TestRegistrationPage","","","Check registration without choosing agreement",""
"passed","Fri Mar 07 01:01:23 GMT 2025","Fri Mar 07 01:01:23 GMT 2025","12","tests","contributors_page_test","TestContributorsPage","","","Verify value of the title of the tab",""
"passed","Fri Mar 07 01:03:03 GMT 2025","Fri Mar 07 01:03:05 GMT 2025","2131","tests","exercises_ru_similar_phrases_page_test","TestExercisesRuSimilarPhrasesPage","","","Verify presence and visibility of content on the page",""
"passed","Fri Mar 07 01:20:50 GMT 2025","Fri Mar 07 01:20:53 GMT 2025","2672","tests","specialists_page_test","TestSpecialistsPage","","","Verify that the 'All Specialists' link leads an authorized user 
                         to the correct page after clicking",""
"passed","Fri Mar 07 01:11:31 GMT 2025","Fri Mar 07 01:11:49 GMT 2025","18311","tests","groups_page_test","TestGroupsPage","","","Verify if links on the 'ru' local lead to correct pages after clicking",""
"passed","Fri Mar 07 01:10:15 GMT 2025","Fri Mar 07 01:10:24 GMT 2025","8175","tests","groups_page_test","TestGroupsPage","","","Verify value of the title of the tab",""
"skipped","Fri Mar 07 01:25:26 GMT 2025","Fri Mar 07 01:25:49 GMT 2025","23511","tests","Речевые упражнения.","TestCardsRU","","","Select a random card from ""Слова с частотной группировкой"" group and compare UI vs BACKEND data.",""
"passed","Fri Mar 07 01:21:41 GMT 2025","Fri Mar 07 01:21:41 GMT 2025","38","tests","start_unauthorized_page_test","TestStartUnauthorizedPage","","","Verify text in the 'Login' link in the section 1",""
"passed","Fri Mar 07 01:17:46 GMT 2025","Fri Mar 07 01:17:46 GMT 2025","724","tests","main_page_test","TestMainPage","","","Checking the domain is available",""
"passed","Fri Mar 07 01:02:10 GMT 2025","Fri Mar 07 01:02:10 GMT 2025","111","tests","description_page_test","TestDescriptionPage","","","Verify return main page from description page.",""
"passed","Fri Mar 07 01:01:43 GMT 2025","Fri Mar 07 01:01:43 GMT 2025","429","tests","contributors_page_test","TestContributorsPage","","","Verify text in card links and the 'All Team' link",""
"passed","Fri Mar 07 01:16:38 GMT 2025","Fri Mar 07 01:16:38 GMT 2025","43","tests","header_test","TestHeaderPage","","","Verify presence, visibility, attributes of icons in the Header for an authorized user",""
"passed","Fri Mar 07 01:13:46 GMT 2025","Fri Mar 07 01:13:46 GMT 2025","143","tests","header_test","TestHeaderPage","","","Verify that the 'Logo' link on the Start Unauthorized Page 
                             doesn't refresh the current page or lead to other pages after clicking",""
"passed","Fri Mar 07 01:28:05 GMT 2025","Fri Mar 07 01:28:05 GMT 2025","11","tests","used_resources_page_test","TestUsedResourcesPage","","","Verify value of the title of the tab",""
"passed","Fri Mar 07 01:15:40 GMT 2025","Fri Mar 07 01:15:42 GMT 2025","2034","tests","header_test","TestHeaderPage","","","Verify if external links in the Header for an authorized user 
            lead to correct pages after click",""
"passed","Fri Mar 07 01:21:37 GMT 2025","Fri Mar 07 01:21:37 GMT 2025","68","tests","start_unauthorized_page_test","TestStartUnauthorizedPage","","","Verify content of the text in sections 1, 2",""
"passed","Fri Mar 07 01:17:19 GMT 2025","Fri Mar 07 01:17:20 GMT 2025","673","tests","main_page_test","TestMainPage","","","Verify redirection to specialists page not authorized user.",""
"passed","Fri Mar 07 01:01:48 GMT 2025","Fri Mar 07 01:01:48 GMT 2025","736","tests","contributors_page_test","TestContributorsPage","","","Verify clickability, href of links on the page",""
"passed","Fri Mar 07 01:09:53 GMT 2025","Fri Mar 07 01:09:56 GMT 2025","3162","tests","groups_page_test","TestGroupsPage","","","Verify composition, visibility of elements on the 1st-6th levels of nesting on the page",""
"passed","Fri Mar 07 01:27:46 GMT 2025","Fri Mar 07 01:27:48 GMT 2025","1846","tests","Statistic.","TestCardsRU","","","Check statistic table.",""
"passed","Fri Mar 07 01:02:45 GMT 2025","Fri Mar 07 01:02:46 GMT 2025","704","tests","description_page_test","TestDescriptionPage","","","Verify redirection to contributors page not authorized user.",""
"passed","Fri Mar 07 01:21:09 GMT 2025","Fri Mar 07 01:21:09 GMT 2025","34","tests","start_unauthorized_page_test","TestStartUnauthorizedPage","","","Verify presence and visibility of content on the page",""
"passed","Fri Mar 07 01:03:41 GMT 2025","Fri Mar 07 01:04:01 GMT 2025","19551","tests","exercises_ru_words_page_test","TestExercisesRuWordsPage","","","Verify presence and visibility of content on the page",""
"passed","Fri Mar 07 01:19:38 GMT 2025","Fri Mar 07 01:19:38 GMT 2025","29","tests","specialists_page_test","TestSpecialistsPage","","","Verify presence and visibility of content on the page",""
"passed","Fri Mar 07 01:18:23 GMT 2025","Fri Mar 07 01:18:30 GMT 2025","6773","tests","registration_page_test","TestRegistrationPage","","","Check registration with new email",""
"passed","Fri Mar 07 01:28:11 GMT 2025","Fri Mar 07 01:28:11 GMT 2025","33","tests","used_resources_page_test","TestUsedResourcesPage","","","Verify value of title with tag 'h1' on the page",""
"passed","Fri Mar 07 01:16:54 GMT 2025","Fri Mar 07 01:16:54 GMT 2025","2","tests","login_page_test","TestLoginPage","","","Test for authorization customer.",""
"passed","Fri Mar 07 01:21:51 GMT 2025","Fri Mar 07 01:21:51 GMT 2025","145","tests","start_unauthorized_page_test","TestStartUnauthorizedPage","","","Verify that the 'Login' link leads to the correct page after clicking",""
"passed","Fri Mar 07 01:17:36 GMT 2025","Fri Mar 07 01:17:36 GMT 2025","182","tests","main_page_test","TestMainPage","","","Verify redirection to used resources page not authorized user.",""
"passed","Fri Mar 07 01:17:41 GMT 2025","Fri Mar 07 01:17:41 GMT 2025","102","tests","main_page_test","TestMainPage","","","Checking the clickability of the Start button.",""
"passed","Fri Mar 07 01:18:40 GMT 2025","Fri Mar 07 01:18:41 GMT 2025","721","tests","registration_page_test","TestRegistrationPage","","","Check registration with new email and empty confirm password",""
"passed","Fri Mar 07 01:00:51 GMT 2025","Fri Mar 07 01:00:52 GMT 2025","1753","tests","contacts_page_test","TestContactsPage","","","Verify if links in the section 2 lead to the correct pages after clicking",""
"passed","Fri Mar 07 01:08:27 GMT 2025","Fri Mar 07 01:08:27 GMT 2025","226","tests","footer_test","TestFooter","","","Verify composition and visibility of elements on the 1st-7th levels of nesting in the Footer",""
"passed","Fri Mar 07 01:01:27 GMT 2025","Fri Mar 07 01:01:27 GMT 2025","42","tests","contributors_page_test","TestContributorsPage","","","Verify values of title and subtitles with tags h2, h3 on the page",""
"passed","Fri Mar 07 01:02:04 GMT 2025","Fri Mar 07 01:02:06 GMT 2025","1096","tests","contributors_page_test","TestContributorsPage","","","Verify sizes of images in contributor cards in grids",""
"passed","Fri Mar 07 01:18:46 GMT 2025","Fri Mar 07 01:18:46 GMT 2025","747","tests","registration_page_test","TestRegistrationPage","","","Check registration with new email and empty password",""
"passed","Fri Mar 07 01:08:46 GMT 2025","Fri Mar 07 01:08:51 GMT 2025","4923","tests","footer_test","TestFooter","","","Verify clickability, href, prefix and subject, status code of links in the Footer",""
"passed","Fri Mar 07 01:21:56 GMT 2025","Fri Mar 07 01:21:56 GMT 2025","79","tests","start_unauthorized_page_test","TestStartUnauthorizedPage","","","Verify presence, visibility and attributes of the image in the section 1",""
"passed","Fri Mar 07 01:15:18 GMT 2025","Fri Mar 07 01:15:32 GMT 2025","13993","tests","header_test","TestHeaderPage","","","Verify if internal links in the Header for an authorized user 
            lead to correct pages after click",""
"passed","Fri Mar 07 01:21:32 GMT 2025","Fri Mar 07 01:21:32 GMT 2025","46","tests","start_unauthorized_page_test","TestStartUnauthorizedPage","","","Verify values of titles and subtitles with tags h2, h4 on the page",""
"passed","Fri Mar 07 01:25:57 GMT 2025","Fri Mar 07 01:26:48 GMT 2025","50497","tests","Речевые упражнения.","TestCardsRU","","","Solutions to a random task in the ""Слова"" .",""
"passed","Fri Mar 07 01:12:50 GMT 2025","Fri Mar 07 01:12:50 GMT 2025","33","tests","header_test","TestHeaderPage","","","Verify presence and visibility of the Header for an unauthorized user",""
"passed","Fri Mar 07 01:21:18 GMT 2025","Fri Mar 07 01:21:18 GMT 2025","83","tests","start_unauthorized_page_test","TestStartUnauthorizedPage","","","Verify the composition and visibility of elements 
        on the 1st-3rd levels of nesting in the section 1",""
"passed","Fri Mar 07 00:59:45 GMT 2025","Fri Mar 07 00:59:46 GMT 2025","1098","tests","authorisation_page_test","TestAuthorizedUserPage","","","Checking the possibility of authorization with the correct data",""
