"Status","Start Time","Stop Time","Duration in ms","Parent Suite","Suite","Sub Suite","Test Class","Test Method","Name","Description"
"passed","Sun Feb 09 20:58:56 GMT 2025","Sun Feb 09 20:59:04 GMT 2025","7897","tests","Речевые упражнения.","TestCardsRU","","","Select random card from group ""Слова"" and compare UI vs BACKEND data.",""
"passed","Sun Feb 09 21:03:41 GMT 2025","Sun Feb 09 21:03:41 GMT 2025","75","tests","used_resources_page_test","TestUsedResourcesPage","","","Verify sizes of icons in sections",""
"passed","Sun Feb 09 20:49:59 GMT 2025","Sun Feb 09 20:50:09 GMT 2025","10212","tests","header_test","TestHeaderPage","","","Verify composition, visibility of elements on the 1st-6th levels of nesting in the Header
            for an unauthorized user",""
"passed","Sun Feb 09 20:46:43 GMT 2025","Sun Feb 09 20:46:43 GMT 2025","107","tests","footer_test","TestFooter","","","Verify that the 'Contact us' link in the Footer calls an email client",""
"passed","Sun Feb 09 20:46:51 GMT 2025","Sun Feb 09 20:46:51 GMT 2025","106","tests","footer_test","TestFooter","","","Verify sizes of images in links in the Footer",""
"passed","Sun Feb 09 20:54:11 GMT 2025","Sun Feb 09 20:54:20 GMT 2025","9287","tests","profile_page_test","TestProfilePage","","","Change the password by receiving an email link",""
"passed","Sun Feb 09 21:03:23 GMT 2025","Sun Feb 09 21:03:25 GMT 2025","1657","tests","used_resources_page_test","TestUsedResourcesPage","","","Verify presence, visibility, clickability, href, status code of links in sections",""
"passed","Sun Feb 09 20:54:34 GMT 2025","Sun Feb 09 20:54:35 GMT 2025","1269","tests","registration_page_test","TestRegistrationPage","","","Check registration with an existing email",""
"passed","Sun Feb 09 20:40:18 GMT 2025","Sun Feb 09 20:40:18 GMT 2025","131","tests","contacts_page_test","TestContactsPage","","","Verify the composition and visibility of elements 
        on the 1st-5th levels of nesting in the section 2",""
"passed","Sun Feb 09 20:52:44 GMT 2025","Sun Feb 09 20:52:44 GMT 2025","199","tests","header_test","TestHeaderPage","","","Verify switching of the 'ru', 'en' buttons in the Header for an authorized user",""
"passed","Sun Feb 09 20:53:36 GMT 2025","Sun Feb 09 20:53:37 GMT 2025","1182","tests","main_page_test","TestMainPage","","","Verify redirection to donate page not authorized user.",""
"passed","Sun Feb 09 20:49:45 GMT 2025","Sun Feb 09 20:49:51 GMT 2025","6063","tests","groups_page_test","TestGroupsPage","","","Verify sizes of images in links on the page",""
"passed","Sun Feb 09 20:41:30 GMT 2025","Sun Feb 09 20:41:30 GMT 2025","19","tests","contributors_page_test","TestContributorsPage","","","Verify content of the text on the page",""
"passed","Sun Feb 09 20:54:39 GMT 2025","Sun Feb 09 20:54:40 GMT 2025","734","tests","registration_page_test","TestRegistrationPage","","","Check registration with new email and empty confirm password",""
"passed","Sun Feb 09 20:56:42 GMT 2025","Sun Feb 09 20:56:42 GMT 2025","155","tests","specialists_page_test","TestSpecialistsPage","","","Verify sizes of images in specialist cards in the grid",""
"passed","Sun Feb 09 20:41:52 GMT 2025","Sun Feb 09 20:41:53 GMT 2025","791","tests","contributors_page_test","TestContributorsPage","","","Verify attribute values of images in contributors cards in grids",""
"passed","Sun Feb 09 20:43:05 GMT 2025","Sun Feb 09 20:43:05 GMT 2025","49","tests","exercises_ru_words_page_test","TestExercisesRuWordsPage","","","Verify presence and visibility of content on the page",""
"passed","Sun Feb 09 20:44:09 GMT 2025","Sun Feb 09 20:44:10 GMT 2025","1564","tests","exercises_ru_words_page_test","TestExercisesRuWordsPage","","","Verify clickability, href, status code of links in breadcrumbs on the page",""
"passed","Sun Feb 09 20:55:02 GMT 2025","Sun Feb 09 20:55:02 GMT 2025","681","tests","registration_page_test","TestRegistrationPage","","","Check registration without choosing gender",""
"passed","Sun Feb 09 20:46:47 GMT 2025","Sun Feb 09 20:46:47 GMT 2025","75","tests","footer_test","TestFooter","","","Verify attributes of images in links in the Footer",""
"passed","Sun Feb 09 20:43:33 GMT 2025","Sun Feb 09 20:43:33 GMT 2025","13","tests","exercises_ru_words_page_test","TestExercisesRuWordsPage","","","Verify value of the title of the tab",""
"passed","Sun Feb 09 20:43:59 GMT 2025","Sun Feb 09 20:44:00 GMT 2025","854","tests","exercises_ru_words_page_test","TestExercisesRuWordsPage","","","Verify text in cards on the page",""
"passed","Sun Feb 09 20:41:43 GMT 2025","Sun Feb 09 20:41:44 GMT 2025","732","tests","contributors_page_test","TestContributorsPage","","","Verify clickability, href of links on the page",""
"passed","Sun Feb 09 20:54:07 GMT 2025","Sun Feb 09 20:54:07 GMT 2025","446","tests","main_page_test","TestMainPage","","","Checking the domain is available",""
"passed","Sun Feb 09 20:45:12 GMT 2025","Sun Feb 09 20:45:20 GMT 2025","7458","tests","exercises_ru_words_page_test","TestExercisesRuWordsPage","","","Verify if group links lead to correct pages after clicking",""
"passed","Sun Feb 09 20:42:55 GMT 2025","Sun Feb 09 20:42:57 GMT 2025","1612","tests","exercises_ru_similar_phrases_page_test","TestExercisesRuSimilarPhrasesPage","","","Verify composition, visibility of elements on the 1st level of nesting on the page",""
"passed","Sun Feb 09 20:54:48 GMT 2025","Sun Feb 09 20:54:49 GMT 2025","739","tests","registration_page_test","TestRegistrationPage","","","Check registration with new email and empty first name",""
"passed","Sun Feb 09 20:59:38 GMT 2025","Sun Feb 09 20:59:46 GMT 2025","7822","tests","Речевые упражнения.","TestCardsRU","","","Select a random card from ""Группа слов"" group and compare UI vs BACKEND data.",""
"skipped","Sun Feb 09 20:58:29 GMT 2025","Sun Feb 09 20:58:50 GMT 2025","20640","tests","Speech exercises EN.","TestCardsEN","","","Select a random card from ""Similar phrases"" group and compare UI vs BACKEND data",""
"passed","Sun Feb 09 20:49:06 GMT 2025","Sun Feb 09 20:49:24 GMT 2025","18238","tests","groups_page_test","TestGroupsPage","","","Verify if links on the 'en' local lead to correct pages after clicking",""
"passed","Sun Feb 09 20:57:02 GMT 2025","Sun Feb 09 20:57:02 GMT 2025","12","tests","start_unauthorized_page_test","TestStartUnauthorizedPage","","","Verify value of the title of the tab",""
"passed","Sun Feb 09 20:57:22 GMT 2025","Sun Feb 09 20:57:22 GMT 2025","146","tests","start_unauthorized_page_test","TestStartUnauthorizedPage","","","Verify that the 'Login' link leads to the correct page after clicking",""
"passed","Sun Feb 09 20:51:37 GMT 2025","Sun Feb 09 20:51:37 GMT 2025","189","tests","header_test","TestHeaderPage","","","Verify values of the text in links, buttons in the Header for an authorized user",""
"passed","Sun Feb 09 20:50:18 GMT 2025","Sun Feb 09 20:50:18 GMT 2025","209","tests","header_test","TestHeaderPage","","","Verify values of the text in links, buttons in the Header for an unauthorized user",""
"passed","Sun Feb 09 20:44:19 GMT 2025","Sun Feb 09 20:44:19 GMT 2025","143","tests","exercises_ru_words_page_test","TestExercisesRuWordsPage","","","Verify clickability, titles, attributes of group links on the page",""
"passed","Sun Feb 09 20:57:30 GMT 2025","Sun Feb 09 20:57:30 GMT 2025","57","tests","start_unauthorized_page_test","TestStartUnauthorizedPage","","","Verify size of the image in the section 1",""
"passed","Sun Feb 09 20:46:07 GMT 2025","Sun Feb 09 20:46:07 GMT 2025","222","tests","footer_test","TestFooter","","","Verify composition and visibility of elements on the 1st-7th levels of nesting in the Footer",""
"passed","Sun Feb 09 20:42:27 GMT 2025","Sun Feb 09 20:42:28 GMT 2025","1423","tests","description_page_test","TestDescriptionPage","","","Verify redirection to github not authorized user.",""
"passed","Sun Feb 09 20:54:43 GMT 2025","Sun Feb 09 20:54:44 GMT 2025","736","tests","registration_page_test","TestRegistrationPage","","","Check registration with new email and empty password",""
"passed","Sun Feb 09 20:51:30 GMT 2025","Sun Feb 09 20:51:31 GMT 2025","382","tests","header_test","TestHeaderPage","","","Verify presence, visibility of links, buttons in the Header for an authorized user",""
"passed","Sun Feb 09 20:42:32 GMT 2025","Sun Feb 09 20:42:33 GMT 2025","690","tests","description_page_test","TestDescriptionPage","","","Verify redirection to contributors page not authorized user.",""
"passed","Sun Feb 09 21:03:36 GMT 2025","Sun Feb 09 21:03:36 GMT 2025","55","tests","used_resources_page_test","TestUsedResourcesPage","","","Verify presence, visibility and attributes of icons in sections",""
"passed","Sun Feb 09 20:55:42 GMT 2025","Sun Feb 09 20:55:48 GMT 2025","5357","tests","specialists_page_test","TestSpecialistsPage","","","Verify presence, visibility of the title, text, link, grid, cards and images  
        on the 2nd, 3rd, 5th, 6th levels of nesting on the page",""
"passed","Sun Feb 09 20:43:42 GMT 2025","Sun Feb 09 20:43:42 GMT 2025","37","tests","exercises_ru_words_page_test","TestExercisesRuWordsPage","","","Verify value of the breadcrumbs on the page",""
"passed","Sun Feb 09 21:03:18 GMT 2025","Sun Feb 09 21:03:18 GMT 2025","28","tests","used_resources_page_test","TestUsedResourcesPage","","","Verify text in links in sections",""
"passed","Sun Feb 09 20:41:34 GMT 2025","Sun Feb 09 20:41:35 GMT 2025","1362","tests","contributors_page_test","TestContributorsPage","","","Verify values of the text in card descriptions",""
"passed","Sun Feb 09 20:40:02 GMT 2025","Sun Feb 09 20:40:03 GMT 2025","943","tests","authorisation_page_test","TestAuthorizedUserPage","","","Checking the possibility of authorization with incorrect data",""
