"Status","Start Time","Stop Time","Duration in ms","Parent Suite","Suite","Sub Suite","Test Class","Test Method","Name","Description"
"passed","Sun Feb 09 20:41:09 GMT 2025","Sun Feb 09 20:41:11 GMT 2025","1648","tests","contributors_page_test","TestContributorsPage","","","Verify the composition and visibility of elements 
        on the 1st-5th levels of nesting on the page",""
"passed","Sun Feb 09 20:40:38 GMT 2025","Sun Feb 09 20:40:38 GMT 2025","29","tests","contacts_page_test","TestContactsPage","","","Verify content of the text in the section 2",""
"passed","Sun Feb 09 20:55:32 GMT 2025","Sun Feb 09 20:55:32 GMT 2025","29","tests","specialists_page_test","TestSpecialistsPage","","","Verify presence and visibility of content on the page",""
"passed","Sun Feb 09 20:46:19 GMT 2025","Sun Feb 09 20:46:19 GMT 2025","45","tests","footer_test","TestFooter","","","Verify text in the 'Contact us' link in the Footer",""
"passed","Sun Feb 09 20:42:17 GMT 2025","Sun Feb 09 20:42:18 GMT 2025","218","tests","description_page_test","TestDescriptionPage","","","Verify redirection to contacts page not authorized user.",""
"passed","Sun Feb 09 20:47:22 GMT 2025","Sun Feb 09 20:47:25 GMT 2025","3118","tests","groups_page_test","TestGroupsPage","","","Verify presence, visibility of the title, tiles, links, images, subtitles on the page",""
"passed","Sun Feb 09 20:56:58 GMT 2025","Sun Feb 09 20:56:58 GMT 2025","110","tests","start_unauthorized_page_test","TestStartUnauthorizedPage","","","Verify the composition and visibility of elements 
        on the 1st-3rd levels of nesting in the section 2",""
"passed","Sun Feb 09 20:52:31 GMT 2025","Sun Feb 09 20:52:31 GMT 2025","84","tests","header_test","TestHeaderPage","","","Verify that the 'Logo' link on the Start Authorized Page 
                             doesn't refresh the current page or lead to other pages after clicking",""
"passed","Sun Feb 09 20:56:18 GMT 2025","Sun Feb 09 20:56:19 GMT 2025","488","tests","specialists_page_test","TestSpecialistsPage","","","Verify clickability, href, status code of the 'All Specialists' link",""
"passed","Sun Feb 09 21:02:57 GMT 2025","Sun Feb 09 21:02:57 GMT 2025","118","tests","used_resources_page_test","TestUsedResourcesPage","","","Verify the composition and visibility of elements 
        on the 1st-4th levels of nesting on the page",""
"passed","Sun Feb 09 20:56:37 GMT 2025","Sun Feb 09 20:56:37 GMT 2025","110","tests","specialists_page_test","TestSpecialistsPage","","","Verify attributes of images in specialist cards in the grid",""
"passed","Sun Feb 09 20:56:13 GMT 2025","Sun Feb 09 20:56:13 GMT 2025","43","tests","specialists_page_test","TestSpecialistsPage","","","Verify text in the 'All Specialists' link",""
"passed","Sun Feb 09 20:55:53 GMT 2025","Sun Feb 09 20:55:53 GMT 2025","12","tests","specialists_page_test","TestSpecialistsPage","","","Verify value of the title of the tab",""
"passed","Sun Feb 09 20:40:08 GMT 2025","Sun Feb 09 20:40:08 GMT 2025","27","tests","contacts_page_test","TestContactsPage","","","Verify presence and visibility of content on the page",""
"passed","Sun Feb 09 20:46:15 GMT 2025","Sun Feb 09 20:46:15 GMT 2025","46","tests","footer_test","TestFooter","","","Verify content of text in the Footer",""
"passed","Sun Feb 09 20:52:02 GMT 2025","Sun Feb 09 20:52:16 GMT 2025","13988","tests","header_test","TestHeaderPage","","","Verify if internal links in the Header for an authorized user 
            lead to correct pages after click",""
"passed","Sun Feb 09 20:40:48 GMT 2025","Sun Feb 09 20:40:49 GMT 2025","897","tests","contacts_page_test","TestContactsPage","","","Verify presence, visibility, clickability, href, prefix, status code of links in the section 2",""
"passed","Sun Feb 09 20:57:14 GMT 2025","Sun Feb 09 20:57:14 GMT 2025","52","tests","start_unauthorized_page_test","TestStartUnauthorizedPage","","","Verify text in the 'Login' link in the section 1",""
"passed","Sun Feb 09 21:01:43 GMT 2025","Sun Feb 09 21:02:21 GMT 2025","37247","tests","Речевые упражнения.","TestCardsRU","","","Solutions to a random task in the ""Слова Королёвой"" .",""
"passed","Sun Feb 09 20:46:23 GMT 2025","Sun Feb 09 20:46:26 GMT 2025","3154","tests","footer_test","TestFooter","","","Verify clickability, href, prefix and subject, status code of links in the Footer",""
"passed","Sun Feb 09 20:41:01 GMT 2025","Sun Feb 09 20:41:01 GMT 2025","93","tests","contacts_page_test","TestContactsPage","","","Verify that the email link calls an email client",""
"passed","Sun Feb 09 20:40:28 GMT 2025","Sun Feb 09 20:40:28 GMT 2025","12","tests","contacts_page_test","TestContactsPage","","","Verify value of the title of the tab",""
"passed","Sun Feb 09 20:42:12 GMT 2025","Sun Feb 09 20:42:14 GMT 2025","1224","tests","description_page_test","TestDescriptionPage","","","Verify redirection to donate page not authorized user.",""
"passed","Sun Feb 09 20:53:04 GMT 2025","Sun Feb 09 20:53:04 GMT 2025","51","tests","header_test","TestHeaderPage","","","Verify size of the image in the 'Logo' link in the Header for an authorized user",""
"passed","Sun Feb 09 21:03:08 GMT 2025","Sun Feb 09 21:03:08 GMT 2025","32","tests","used_resources_page_test","TestUsedResourcesPage","","","Verify value of title with tag 'h1' on the page",""
"passed","Sun Feb 09 21:00:51 GMT 2025","Sun Feb 09 21:01:37 GMT 2025","46001","tests","Речевые упражнения.","TestCardsRU","","","Solutions to a random task in the ""Слова"" .",""
"passed","Sun Feb 09 20:47:12 GMT 2025","Sun Feb 09 20:47:15 GMT 2025","3156","tests","groups_page_test","TestGroupsPage","","","Verify composition, visibility of elements on the 1st-6th levels of nesting on the page",""
"passed","Sun Feb 09 21:03:30 GMT 2025","Sun Feb 09 21:03:31 GMT 2025","985","tests","used_resources_page_test","TestUsedResourcesPage","","","Verify that links in the sections lead to the correct pages after clicking",""
"passed","Sun Feb 09 20:47:31 GMT 2025","Sun Feb 09 20:47:40 GMT 2025","8195","tests","groups_page_test","TestGroupsPage","","","Verify value of the title of the tab",""
"passed","Sun Feb 09 20:56:50 GMT 2025","Sun Feb 09 20:56:50 GMT 2025","32","tests","start_unauthorized_page_test","TestStartUnauthorizedPage","","","Verify amount and visibility of sections with content on the page",""
"skipped","Sun Feb 09 21:02:28 GMT 2025","Sun Feb 09 21:02:35 GMT 2025","7078","tests","Речевые упражнения.","TestCardsRU","","","Solutions to a random task in the ""Слова"" group and comparison of statics.",""
"passed","Sun Feb 09 20:40:54 GMT 2025","Sun Feb 09 20:40:55 GMT 2025","1351","tests","contacts_page_test","TestContactsPage","","","Verify if links in the section 2 lead to the correct pages after clicking",""
"passed","Sun Feb 09 20:53:54 GMT 2025","Sun Feb 09 20:53:55 GMT 2025","711","tests","main_page_test","TestMainPage","","","Verify redirection to contributors page not authorized user.",""
"passed","Sun Feb 09 20:46:57 GMT 2025","Sun Feb 09 20:47:00 GMT 2025","3056","tests","footer_test","TestFooter","","","Verify Footer invisibility through the modal window with the exercise",""
"passed","Sun Feb 09 20:42:06 GMT 2025","Sun Feb 09 20:42:08 GMT 2025","2088","tests","description_page_test","TestDescriptionPage","","","Verify redirection to telegram page not authorized user.",""
"passed","Sun Feb 09 20:53:45 GMT 2025","Sun Feb 09 20:53:45 GMT 2025","691","tests","main_page_test","TestMainPage","","","Verify redirection to specialists page not authorized user.",""
"passed","Sun Feb 09 20:56:31 GMT 2025","Sun Feb 09 20:56:32 GMT 2025","1620","tests","specialists_page_test","TestSpecialistsPage","","","Verify that the 'All Specialists' link leads an authorized user 
                         to the correct page after clicking",""
"passed","Sun Feb 09 20:57:10 GMT 2025","Sun Feb 09 20:57:10 GMT 2025","68","tests","start_unauthorized_page_test","TestStartUnauthorizedPage","","","Verify content of the text in sections 1, 2",""
"passed","Sun Feb 09 20:59:10 GMT 2025","Sun Feb 09 20:59:18 GMT 2025","7770","tests","Речевые упражнения.","TestCardsRU","","","Select random card from group ""Слова Королёвой"" and compare UI vs BACKEND data.",""
"passed","Sun Feb 09 20:45:28 GMT 2025","Sun Feb 09 20:45:36 GMT 2025","7994","tests","exercises_ru_words_page_test","TestExercisesRuWordsPage","","","Verify if subgroup links 1-4 lead to correct pages after clicking",""
"passed","Sun Feb 09 20:43:25 GMT 2025","Sun Feb 09 20:43:25 GMT 2025","136","tests","exercises_ru_words_page_test","TestExercisesRuWordsPage","","","Verify presence, visibility of lists on the page",""
"passed","Sun Feb 09 20:54:03 GMT 2025","Sun Feb 09 20:54:03 GMT 2025","100","tests","main_page_test","TestMainPage","","","Checking the clickability of the Start button.",""
"passed","Sun Feb 09 20:40:13 GMT 2025","Sun Feb 09 20:40:13 GMT 2025","19","tests","contacts_page_test","TestContactsPage","","","Verify the composition and visibility of elements on the 1st level of nesting in the section 1",""
"passed","Sun Feb 09 20:51:01 GMT 2025","Sun Feb 09 20:51:01 GMT 2025","65","tests","header_test","TestHeaderPage","","","Verify size of the image in the 'Logo' link in the Header on the Start Unauthorized Page",""
"passed","Sun Feb 09 21:03:02 GMT 2025","Sun Feb 09 21:03:02 GMT 2025","11","tests","used_resources_page_test","TestUsedResourcesPage","","","Verify value of the title of the tab",""
"passed","Sun Feb 09 20:54:53 GMT 2025","Sun Feb 09 20:54:53 GMT 2025","745","tests","registration_page_test","TestRegistrationPage","","","Check registration with new email and empty birthday",""
"passed","Sun Feb 09 20:54:07 GMT 2025","Sun Feb 09 20:54:07 GMT 2025","119","tests","main_page_test","TestMainPage","","","Checking the clickability of the Registration button.",""
"passed","Sun Feb 09 20:51:50 GMT 2025","Sun Feb 09 20:51:56 GMT 2025","6089","tests","header_test","TestHeaderPage","","","Verify clickability, href, status code of links in the Header for an authorized user",""
"passed","Sun Feb 09 20:46:03 GMT 2025","Sun Feb 09 20:46:03 GMT 2025","40","tests","footer_test","TestFooter","","","Verify presence and visibility of the Footer",""
"skipped","Sun Feb 09 20:59:53 GMT 2025","Sun Feb 09 21:00:15 GMT 2025","22683","tests","Речевые упражнения.","TestCardsRU","","","Select a random card from ""Предложения"" group and compare UI vs BACKEND data.",""
"passed","Sun Feb 09 20:46:11 GMT 2025","Sun Feb 09 20:46:11 GMT 2025","130","tests","footer_test","TestFooter","","","Verify presence, visibility of text, links, images in the Footer",""
"skipped","Sun Feb 09 21:00:22 GMT 2025","Sun Feb 09 21:00:44 GMT 2025","22554","tests","Речевые упражнения.","TestCardsRU","","","Select a random card from ""Слова с частотной группировкой"" group and compare UI vs BACKEND data.",""
"passed","Sun Feb 09 20:51:14 GMT 2025","Sun Feb 09 20:51:24 GMT 2025","10249","tests","header_test","TestHeaderPage","","","Verify composition, visibility of elements on the 1st-6th levels of nesting in the Header
            for an authorized user",""
"passed","Sun Feb 09 20:40:23 GMT 2025","Sun Feb 09 20:40:23 GMT 2025","164","tests","contacts_page_test","TestContactsPage","","","Verify presence, visibility of sections, the dividing line and elements with text on the page",""
"passed","Sun Feb 09 20:54:57 GMT 2025","Sun Feb 09 20:54:58 GMT 2025","730","tests","registration_page_test","TestRegistrationPage","","","Check registration with new email and empty email",""
"passed","Sun Feb 09 20:57:18 GMT 2025","Sun Feb 09 20:57:18 GMT 2025","518","tests","start_unauthorized_page_test","TestStartUnauthorizedPage","","","Verify presence, visibility, clickability, href, status code 
                         of the 'Login' link in the section 1",""
"passed","Sun Feb 09 20:41:57 GMT 2025","Sun Feb 09 20:41:58 GMT 2025","1157","tests","contributors_page_test","TestContributorsPage","","","Verify sizes of images in contributor cards in grids",""
"passed","Sun Feb 09 20:53:30 GMT 2025","Sun Feb 09 20:53:32 GMT 2025","1329","tests","main_page_test","TestMainPage","","","Verify redirection to telegram page not authorized user.",""
"passed","Sun Feb 09 20:53:49 GMT 2025","Sun Feb 09 20:53:50 GMT 2025","1214","tests","main_page_test","TestMainPage","","","Verify redirection to github not authorized user.",""
"passed","Sun Feb 09 20:52:57 GMT 2025","Sun Feb 09 20:52:57 GMT 2025","40","tests","header_test","TestHeaderPage","","","Verify presence, visibility and attributes of the image in the 'Logo' link in the Header 
               for an authorized user",""
"passed","Sun Feb 09 20:45:45 GMT 2025","Sun Feb 09 20:45:46 GMT 2025","500","tests","exercises_ru_words_page_test","TestExercisesRuWordsPage","","","Verify attributes of images in links on the page",""
"passed","Sun Feb 09 20:43:14 GMT 2025","Sun Feb 09 20:43:16 GMT 2025","2001","tests","exercises_ru_words_page_test","TestExercisesRuWordsPage","","","Verify composition, visibility of elements on the 1st-6th levels of nesting on the page",""
"passed","Sun Feb 09 20:53:59 GMT 2025","Sun Feb 09 20:53:59 GMT 2025","187","tests","main_page_test","TestMainPage","","","Verify redirection to used resources page not authorized user.",""
"passed","Sun Feb 09 20:54:24 GMT 2025","Sun Feb 09 20:54:30 GMT 2025","5796","tests","registration_page_test","TestRegistrationPage","","","Check registration with new email",""
"passed","Sun Feb 09 20:50:49 GMT 2025","Sun Feb 09 20:50:49 GMT 2025","288","tests","header_test","TestHeaderPage","","","Verify the dropdown opens/closes after clicking on the 'More' button in the Header 
            on the Start Unauthorized Page",""
"passed","Sun Feb 09 20:59:24 GMT 2025","Sun Feb 09 20:59:32 GMT 2025","8071","tests","Речевые упражнения.","TestCardsRU","","","Select a random card from ""Похожие фразы"" group and compare UI vs BACKEND data.",""
"passed","Sun Feb 09 20:40:33 GMT 2025","Sun Feb 09 20:40:33 GMT 2025","50","tests","contacts_page_test","TestContactsPage","","","Verify values of the title and subtitles with tags h1, h2 on the page",""
"passed","Sun Feb 09 20:50:13 GMT 2025","Sun Feb 09 20:50:14 GMT 2025","367","tests","header_test","TestHeaderPage","","","Verify presence, visibility of links, buttons in the Header for an unauthorized user",""
"passed","Sun Feb 09 20:56:03 GMT 2025","Sun Feb 09 20:56:03 GMT 2025","37","tests","specialists_page_test","TestSpecialistsPage","","","Verify value of text on the page",""
"passed","Sun Feb 09 20:40:43 GMT 2025","Sun Feb 09 20:40:43 GMT 2025","28","tests","contacts_page_test","TestContactsPage","","","Verify text in links in the section 2",""
"passed","Sun Feb 09 20:55:58 GMT 2025","Sun Feb 09 20:55:58 GMT 2025","34","tests","specialists_page_test","TestSpecialistsPage","","","Verify value of title with tag 'h2' on the page",""
"passed","Sun Feb 09 20:43:51 GMT 2025","Sun Feb 09 20:43:51 GMT 2025","50","tests","exercises_ru_words_page_test","TestExercisesRuWordsPage","","","Verify text in group links on the page",""
"passed","Sun Feb 09 20:53:26 GMT 2025","Sun Feb 09 20:53:27 GMT 2025","200","tests","main_page_test","TestMainPage","","","Verify redirection to description page not authorized user.",""
"passed","Sun Feb 09 21:03:13 GMT 2025","Sun Feb 09 21:03:13 GMT 2025","32","tests","used_resources_page_test","TestUsedResourcesPage","","","Verify content of the text on the page",""
"passed","Sun Feb 09 20:41:39 GMT 2025","Sun Feb 09 20:41:39 GMT 2025","423","tests","contributors_page_test","TestContributorsPage","","","Verify text in card links and the 'All Team' link",""
"passed","Sun Feb 09 20:50:40 GMT 2025","Sun Feb 09 20:50:41 GMT 2025","1876","tests","header_test","TestHeaderPage","","","Verify if external links in the Header for an unauthorized user 
            lead to correct pages after click",""
"passed","Sun Feb 09 20:48:41 GMT 2025","Sun Feb 09 20:49:00 GMT 2025","18321","tests","groups_page_test","TestGroupsPage","","","Verify if links on the 'ru' local lead to correct pages after clicking",""
"passed","Sun Feb 09 20:56:46 GMT 2025","Sun Feb 09 20:56:46 GMT 2025","32","tests","start_unauthorized_page_test","TestStartUnauthorizedPage","","","Verify presence and visibility of content on the page",""
"passed","Sun Feb 09 20:39:57 GMT 2025","Sun Feb 09 20:39:58 GMT 2025","951","tests","authorisation_page_test","TestAuthorizedUserPage","","","Checking the possibility of authorization with the correct data",""
"passed","Sun Feb 09 20:41:48 GMT 2025","Sun Feb 09 20:41:49 GMT 2025","633","tests","contributors_page_test","TestContributorsPage","","","Verify href, status code of the 'All Team' link",""
"passed","Sun Feb 09 20:50:31 GMT 2025","Sun Feb 09 20:50:36 GMT 2025","4917","tests","header_test","TestHeaderPage","","","Verify if internal links in the Header for an unauthorized user 
            lead to correct pages after click",""
"passed","Sun Feb 09 20:44:59 GMT 2025","Sun Feb 09 20:45:03 GMT 2025","3964","tests","exercises_ru_words_page_test","TestExercisesRuWordsPage","","","Verify if breadcrumbs links lead to correct pages after clicking",""
"passed","Sun Feb 09 20:57:06 GMT 2025","Sun Feb 09 20:57:06 GMT 2025","46","tests","start_unauthorized_page_test","TestStartUnauthorizedPage","","","Verify values of titles and subtitles with tags h2, h4 on the page",""
"passed","Sun Feb 09 20:42:46 GMT 2025","Sun Feb 09 20:42:48 GMT 2025","2123","tests","exercises_ru_similar_phrases_page_test","TestExercisesRuSimilarPhrasesPage","","","Verify presence and visibility of content on the page",""
"passed","Sun Feb 09 20:47:06 GMT 2025","Sun Feb 09 20:47:06 GMT 2025","25","tests","groups_page_test","TestGroupsPage","","","Verify presence and visibility of content on the page",""
"skipped","Sun Feb 09 20:58:03 GMT 2025","Sun Feb 09 20:58:23 GMT 2025","20219","tests","Speech exercises EN.","TestCardsEN","","","Check progres-bar and buttons.",""
"passed","Sun Feb 09 20:42:36 GMT 2025","Sun Feb 09 20:42:37 GMT 2025","207","tests","description_page_test","TestDescriptionPage","","","Verify redirection to used resources page not authorized user.",""
"passed","Sun Feb 09 20:41:14 GMT 2025","Sun Feb 09 20:41:18 GMT 2025","3639","tests","contributors_page_test","TestContributorsPage","","","Verify presence, visibility of titles/subtitles, cards, descriptions, links, images on the page",""
"passed","Sun Feb 09 20:51:08 GMT 2025","Sun Feb 09 20:51:08 GMT 2025","26","tests","header_test","TestHeaderPage","","","Verify presence and visibility of the Header for an authorized user",""
"passed","Sun Feb 09 20:42:02 GMT 2025","Sun Feb 09 20:42:02 GMT 2025","152","tests","description_page_test","TestDescriptionPage","","","Verify return main page from description page.",""
"passed","Sun Feb 09 20:53:23 GMT 2025","Sun Feb 09 20:53:23 GMT 2025","3","tests","login_page_test","TestLoginPage","","","Test for authorization customer.",""
"skipped","Sun Feb 09 20:57:36 GMT 2025","Sun Feb 09 20:57:56 GMT 2025","20160","tests","Speech exercises EN.","TestCardsEN","","","Select random card from ""Word"" group and compare UI vs BACKEND data",""
"passed","Sun Feb 09 20:55:06 GMT 2025","Sun Feb 09 20:55:27 GMT 2025","20781","tests","registration_page_test","TestRegistrationPage","","","Check registration without choosing agreement",""
"passed","Sun Feb 09 20:50:45 GMT 2025","Sun Feb 09 20:50:45 GMT 2025","122","tests","header_test","TestHeaderPage","","","Verify that the 'Logo' link on the Start Unauthorized Page 
                             doesn't refresh the current page or lead to other pages after clicking",""
"passed","Sun Feb 09 20:53:41 GMT 2025","Sun Feb 09 20:53:41 GMT 2025","207","tests","main_page_test","TestMainPage","","","Verify redirection to contacts page not authorized user.",""
"passed","Sun Feb 09 20:52:37 GMT 2025","Sun Feb 09 20:52:37 GMT 2025","252","tests","header_test","TestHeaderPage","","","Verify the dropdown opens/closes after clicking on the 'More' button in the Header 
               for an authorized user",""
"passed","Sun Feb 09 20:56:54 GMT 2025","Sun Feb 09 20:56:54 GMT 2025","83","tests","start_unauthorized_page_test","TestStartUnauthorizedPage","","","Verify the composition and visibility of elements 
        on the 1st-3rd levels of nesting in the section 1",""
"passed","Sun Feb 09 20:53:10 GMT 2025","Sun Feb 09 20:53:10 GMT 2025","54","tests","header_test","TestHeaderPage","","","Verify presence, visibility, attributes of icons in the Header for an authorized user",""
"passed","Sun Feb 09 21:02:46 GMT 2025","Sun Feb 09 21:02:47 GMT 2025","1336","tests","Statistic.","TestCardsRU","","","Check statistic table.",""
"passed","Sun Feb 09 20:45:54 GMT 2025","Sun Feb 09 20:45:59 GMT 2025","5075","tests","exercises_ru_words_page_test","TestExercisesRuWordsPage","","","Verify sizes of background-images in links on the page",""
"passed","Sun Feb 09 20:41:22 GMT 2025","Sun Feb 09 20:41:22 GMT 2025","12","tests","contributors_page_test","TestContributorsPage","","","Verify value of the title of the tab",""
"passed","Sun Feb 09 20:47:46 GMT 2025","Sun Feb 09 20:48:02 GMT 2025","16370","tests","groups_page_test","TestGroupsPage","","","Verify value of the title and subtitles on the page",""
"passed","Sun Feb 09 20:50:22 GMT 2025","Sun Feb 09 20:50:27 GMT 2025","5177","tests","header_test","TestHeaderPage","","","Verify clickability, href, status code of links in the Header for an unauthorized user",""
"passed","Sun Feb 09 20:51:44 GMT 2025","Sun Feb 09 20:51:44 GMT 2025","26","tests","header_test","TestHeaderPage","","","Verify presence, visibility of the user name in the Header for an authorized user",""
"passed","Sun Feb 09 20:50:57 GMT 2025","Sun Feb 09 20:50:57 GMT 2025","55","tests","header_test","TestHeaderPage","","","Verify presence, visibility and attributes of the image in the 'Logo' link in the Header 
               on the Start Unauthorized Page",""
"passed","Sun Feb 09 20:44:28 GMT 2025","Sun Feb 09 20:44:51 GMT 2025","23026","tests","exercises_ru_words_page_test","TestExercisesRuWordsPage","","","Verify clickability, titles, href, status code of subgroup links on the page",""
"passed","Sun Feb 09 20:41:26 GMT 2025","Sun Feb 09 20:41:26 GMT 2025","41","tests","contributors_page_test","TestContributorsPage","","","Verify values of title and subtitles with tags h2, h3 on the page",""
"passed","Sun Feb 09 20:42:22 GMT 2025","Sun Feb 09 20:42:22 GMT 2025","699","tests","description_page_test","TestDescriptionPage","","","Verify redirection to specialists page not authorized user.",""
"passed","Sun Feb 09 20:49:31 GMT 2025","Sun Feb 09 20:49:39 GMT 2025","8207","tests","groups_page_test","TestGroupsPage","","","Verify attributes of images in links on the page",""
"passed","Sun Feb 09 20:55:37 GMT 2025","Sun Feb 09 20:55:37 GMT 2025","316","tests","specialists_page_test","TestSpecialistsPage","","","Verify the composition and visibility of elements 
        on the 1st-6th levels of nesting on the page",""
"passed","Sun Feb 09 21:02:52 GMT 2025","Sun Feb 09 21:02:52 GMT 2025","26","tests","used_resources_page_test","TestUsedResourcesPage","","","Verify presence and visibility of content on the page",""
"skipped","Sun Feb 09 20:54:07 GMT 2025","Sun Feb 09 20:54:07 GMT 2025","0","tests","main_page_test","TestMainPage","","","Checking the ip is available",""
"passed","Sun Feb 09 20:48:09 GMT 2025","Sun Feb 09 20:48:35 GMT 2025","26342","tests","groups_page_test","TestGroupsPage","","","Verify clickability, title, href, status code of links on the page",""
"passed","Sun Feb 09 20:50:53 GMT 2025","Sun Feb 09 20:50:54 GMT 2025","228","tests","header_test","TestHeaderPage","","","Verify switching of the 'ru', 'en' buttons in the Header on the Start Unauthorized Page",""
"passed","Sun Feb 09 20:56:08 GMT 2025","Sun Feb 09 20:56:08 GMT 2025","106","tests","specialists_page_test","TestSpecialistsPage","","","Verify values of names and professions in specialist cards in the grid",""
"passed","Sun Feb 09 20:46:30 GMT 2025","Sun Feb 09 20:46:39 GMT 2025","8973","tests","footer_test","TestFooter","","","Verify that links in the Footer lead to correct pages after clicking",""
"passed","Sun Feb 09 20:49:55 GMT 2025","Sun Feb 09 20:49:55 GMT 2025","32","tests","header_test","TestHeaderPage","","","Verify presence and visibility of the Header for an unauthorized user",""
"passed","Sun Feb 09 20:41:05 GMT 2025","Sun Feb 09 20:41:05 GMT 2025","571","tests","contributors_page_test","TestContributorsPage","","","Verify presence, visibility and structure of content on the page",""
"passed","Sun Feb 09 20:57:26 GMT 2025","Sun Feb 09 20:57:26 GMT 2025","78","tests","start_unauthorized_page_test","TestStartUnauthorizedPage","","","Verify presence, visibility and attributes of the image in the section 1",""
"passed","Sun Feb 09 20:53:16 GMT 2025","Sun Feb 09 20:53:16 GMT 2025","57","tests","header_test","TestHeaderPage","","","Verify presence, visibility and attributes of the profile avatar in the Header 
               for an authorized user",""
"passed","Sun Feb 09 20:52:23 GMT 2025","Sun Feb 09 20:52:24 GMT 2025","1777","tests","header_test","TestHeaderPage","","","Verify if external links in the Header for an authorized user 
            lead to correct pages after click",""
"passed","Sun Feb 09 20:52:50 GMT 2025","Sun Feb 09 20:52:50 GMT 2025","386","tests","header_test","TestHeaderPage","","","Verify user logout after clicking the 'Logout' button in the Header for an authorized user",""
"passed","Sun Feb 09 20:56:24 GMT 2025","Sun Feb 09 20:56:24 GMT 2025","611","tests","specialists_page_test","TestSpecialistsPage","","","Verify that the 'All Specialists' link leads an unauthorized user 
                         to the correct page after clicking",""
