"DESCRIPTION","DURATION IN MS","NAME","PARENT SUITE","START TIME","STATUS","STOP TIME","SUB SUITE","SUITE","TEST CLASS","TEST METHOD"
"","1367","Verify sizes of images in contributor cards in grids","tests","2026-07-07","passed","2026-07-07","TestContributorsPage","contributors_page_test","",""
"","141","Verify the composition and visibility of elements 
        on the 1st-4th levels of nesting on the page","tests","2026-07-07","passed","2026-07-07","TestURPage","used_resources_page_test","",""
"","692","Verify redirection to contributors page not authorized user.","tests","2026-07-07","passed","2026-07-07","TestMainPage","main_page_test","",""
"","2151","Verify if external GitHub link in the Header for an unauthorized user 
            leads to a correct page after click","tests","2026-07-07","passed","2026-07-07","TestHeaderPage","header_test","",""
"","23","Verify value of the 'en' subtitles on the page","tests","2026-07-07","passed","2026-07-07","TestGroupsPage","groups_page_test","",""
"","1692","Verify that links in the sections lead to the correct pages after clicking","tests","2026-07-07","passed","2026-07-07","TestURPage","used_resources_page_test","",""
"","882","test_hpa.03.02.01 Verify if direct internal links in the Header for an authorized user 
            lead to correct pages after clicking","tests","2026-07-07","passed","2026-07-07","TestHeaderPage","header_test","",""
"","37","Verify value of the 'ru' subtitles on the page","tests","2026-07-07","passed","2026-07-07","TestGroupsPage","groups_page_test","",""
"","36","Verify amount and visibility of sections with content on the page","tests","2026-07-07","passed","2026-07-07","TestStartUnauthorizedPage","start_unauthorized_page_test","",""
"","28","Verify presence and visibility of content on the page","tests","2026-07-07","passed","2026-07-07","TestExercisesRuWordsPage","exercises_ru_words_page_test","",""
"","1499","test_hpa.03.03.02 Verify if external Donate link in the Header for an authorized user 
            leads to the correct page after clicking","tests","2026-07-07","passed","2026-07-07","TestHeaderPage","header_test","",""
"","2252","test_hpa.03.03.03 Verify if external GitHub link in the Header for an authorized user 
            leads to the correct page after clicking","tests","2026-07-07","passed","2026-07-07","TestHeaderPage","header_test","",""
"","683","Verify that the 'All Specialists' link leads an unauthorized user 
                         to the correct page after clicking","tests","2026-07-07","passed","2026-07-07","TestSpecialistsPage","specialists_page_test","",""
"","119","Verify redirection to description page not authorized user.","tests","2026-07-07","passed","2026-07-07","TestMainPage","main_page_test","",""
"","125","Verify presence, visibility of the title, tiles, links, images, subtitles on the page","tests","2026-07-07","passed","2026-07-07","TestGroupsPage","groups_page_test","",""
"","1374","Verify if breadcrumbs links lead to correct pages after clicking","tests","2026-07-07","passed","2026-07-07","TestExercisesRuWordsPage","exercises_ru_words_page_test","",""
"","2356","Verify if links on the 'ru' local lead to correct pages after clicking","tests","2026-07-07","passed","2026-07-07","TestGroupsPage","groups_page_test","",""
"","1641","Verify redirection to donate page not authorized user.","tests","2026-07-07","passed","2026-07-07","TestMainPage","main_page_test","",""
"","80","Verify presence, visibility and attributes of the image in the section 1","tests","2026-07-07","passed","2026-07-07","TestStartUnauthorizedPage","start_unauthorized_page_test","",""
"","7351","Check registration with new email","tests","2026-07-07","passed","2026-07-07","TestRegistrationPage","registration_page_test","",""
"","151","Verify that the 'Logo' link on the Start Unauthorized Page 
                             doesn't refresh the current page or lead to other pages after clicking","tests","2026-07-07","passed","2026-07-07","TestHeaderPage","header_test","",""
"","119","Verify sizes of images in links in the Footer","tests","2026-07-07","passed","2026-07-07","TestFooter","footer_test","",""
"","39","Verify content of the text on the page","tests","2026-07-07","passed","2026-07-07","TestURPage","used_resources_page_test","",""
"","37","Verify value of title with tag 'h1' on the page","tests","2026-07-07","passed","2026-07-07","TestURPage","used_resources_page_test","",""
"","29","Verify presence and visibility of content on the page","tests","2026-07-07","passed","2026-07-07","TestContactsPage","contacts_page_test","",""
"","12","Verify value of the title of the tab","tests","2026-07-07","passed","2026-07-07","TestSpecialistsPage","specialists_page_test","",""
"","122","Verify attributes of images in specialist cards in the grid","tests","2026-07-07","passed","2026-07-07","TestSpecialistsPage","specialists_page_test","",""
"","14246","Change the password by receiving an email link","tests","2026-07-07","broken","2026-07-07","TestProfilePage","profile_page_test","",""
"","13","Verify value of the title of the tab","tests","2026-07-07","passed","2026-07-07","TestExercisesRuWordsPage","exercises_ru_words_page_test","",""
"","132","Verify presence, visibility of text, links, images in the Footer","tests","2026-07-07","passed","2026-07-07","TestFooter","footer_test","",""
"","561","Verify presence and visibility of content on the page","tests","2026-07-07","passed","2026-07-07","TestExercisesRuWordsFamilyPage","exercises_ru_words_family_page_test","",""
"","96","Verify return main page from description page.","tests","2026-07-07","passed","2026-07-07","TestDescriptionPage","description_page_test","",""
"","119","Verify that the Logo link on the Start Authorized Page 
                             refreshes the current page and doesn't lead to other pages after clicking","tests","2026-07-07","passed","2026-07-07","TestHeaderPage","header_test","",""
"","1683","Verify presence, visibility, clickability, href, status code of links in sections","tests","2026-07-07","passed","2026-07-07","TestURPage","used_resources_page_test","",""
"","10917","Select a random card from ""Похожие фразы"" group and compare UI vs BACKEND data.","tests","2026-07-07","skipped","2026-07-07","TestCardsRU","Речевые упражнения.","",""
"","99","Verify size of the image in the 'Logo' link in the Header for an authorized user","tests","2026-07-07","passed","2026-07-07","TestHeaderPage","header_test","",""
"","551","Checking the domain is available","tests","2026-07-07","passed","2026-07-07","TestMainPage","main_page_test","",""
"","23","Verify attribute 'alt' of images in links on the 'ru' local","tests","2026-07-07","passed","2026-07-07","TestGroupsPage","groups_page_test","",""
"","10866","Select random card from ""Word"" group and compare UI vs BACKEND data","tests","2026-07-07","skipped","2026-07-07","TestCardsEN","Speech exercises EN.","",""
"","107","Verify content of the text in sections 1, 2, 3","tests","2026-07-07","passed","2026-07-07","TestStartUnauthorizedPage","start_unauthorized_page_test","",""
"","1901","Verify redirection to telegram page not authorized user.","tests","2026-07-07","passed","2026-07-07","TestMainPage","main_page_test","",""
"","1899","Verify if links in the section 2 lead to the correct pages after clicking","tests","2026-07-07","passed","2026-07-07","TestContactsPage","contacts_page_test","",""
"","910","Checking the possibility of authorization with incorrect data","tests","2026-07-07","passed","2026-07-07","TestAuthorizedUserPage","authorisation_page_test","",""
"","1944","Verify if external Telegram link in the Header for an unauthorized user 
            leads to a correct page after click","tests","2026-07-07","passed","2026-07-07","TestHeaderPage","header_test","",""
"","1195","Verify composition, visibility of elements on the 6st-10th levels of nesting on the page","tests","2026-07-07","passed","2026-07-07","TestExercisesRuWordsFamilyPage","exercises_ru_words_family_page_test","",""
"","532","Verify presence, visibility of links, buttons in the Header for an authorized user","tests","2026-07-07","passed","2026-07-07","TestHeaderPage","header_test","",""
"","37","Verify presence and visibility of the Footer","tests","2026-07-07","passed","2026-07-07","TestFooter","footer_test","",""
"","10920","Select random card from group ""Слова"" and compare UI vs BACKEND data.","tests","2026-07-07","skipped","2026-07-07","TestCardsRU","Речевые упражнения.","",""
"","11","Verify value of the 'ru' title of the tab","tests","2026-07-07","passed","2026-07-07","TestGroupsPage","groups_page_test","",""
"","32","Verify content of the text in the section 2","tests","2026-07-07","passed","2026-07-07","TestContactsPage","contacts_page_test","",""
"","0","Verify if external links in the Header for an authorized user 
            lead to correct pages after click","tests","2026-07-07","skipped","2026-07-07","TestHeaderPage","header_test","",""
"","4169","Verify clickability, href, status code of series links on the page","tests","2026-07-07","passed","2026-07-07","TestExercisesRuSimilarPhrasesPage","exercises_ru_similar_phrases_page_test","",""
"","23","Verify attribute 'src' of images in links on the page","tests","2026-07-07","passed","2026-07-07","TestGroupsPage","groups_page_test","",""
"","42","Verify text in the 'Contact us' link in the Footer","tests","2026-07-07","passed","2026-07-07","TestFooter","footer_test","",""
"","44","Verify text in group links on the page","tests","2026-07-07","passed","2026-07-07","TestExercisesRuSimilarPhrasesPage","exercises_ru_similar_phrases_page_test","",""
"","1243","Verify if breadcrumbs links lead to correct pages after clicking","tests","2026-07-07","passed","2026-07-07","TestExercisesRuSimilarPhrasesPage","exercises_ru_similar_phrases_page_test","",""
"","30","Verify presence and visibility of content on the page","tests","2026-07-07","passed","2026-07-07","TestSpecialistsPage","specialists_page_test","",""
"","1233","Verify switching of the 'ru', 'en' buttons in the Header for an authorized user","tests","2026-07-07","passed","2026-07-07","TestHeaderPage","header_test","",""
"","1312","Verify presence, visibility of lists on the page","tests","2026-07-07","passed","2026-07-07","TestExercisesRuWordsFamilyPage","exercises_ru_words_family_page_test","",""
"","10932","Select a random card from ""Предложения"" group and compare UI vs BACKEND data.","tests","2026-07-07","skipped","2026-07-07","TestCardsRU","Речевые упражнения.","",""
