"Status","Start Time","Stop Time","Duration in ms","Parent Suite","Suite","Sub Suite","Test Class","Test Method","Name","Description"
"passed","Mon Jun 16 09:17:46 GMT 2025","Mon Jun 16 09:17:54 GMT 2025","7814","tests","groups_page_test","TestGroupsPage","","","Verify if links on the 'ru' local lead to correct pages after clicking",""
"passed","Mon Jun 16 09:17:08 GMT 2025","Mon Jun 16 09:17:08 GMT 2025","22","tests","groups_page_test","TestGroupsPage","","","Verify value of the 'en' subtitles on the page",""
"passed","Mon Jun 16 09:23:49 GMT 2025","Mon Jun 16 09:23:50 GMT 2025","774","tests","registration_page_test","TestRegistrationPage","","","Check registration with new email and empty confirm password",""
"passed","Mon Jun 16 09:15:00 GMT 2025","Mon Jun 16 09:15:00 GMT 2025","43","tests","footer_test","TestFooter","","","Verify presence and visibility of the Footer",""
"passed","Mon Jun 16 09:08:34 GMT 2025","Mon Jun 16 09:08:35 GMT 2025","696","tests","description_page_test","TestDescriptionPage","","","Verify redirection to specialists page not authorized user.",""
"passed","Mon Jun 16 09:12:20 GMT 2025","Mon Jun 16 09:12:21 GMT 2025","888","tests","exercises_ru_words_page_test","TestExercisesRuWordsPage","","","Verify clickability, titles, attributes of group links on the page",""
"passed","Mon Jun 16 09:15:04 GMT 2025","Mon Jun 16 09:15:04 GMT 2025","252","tests","footer_test","TestFooter","","","Verify composition and visibility of elements on the 1st-7th levels of nesting in the Footer",""
"passed","Mon Jun 16 09:25:47 GMT 2025","Mon Jun 16 09:25:47 GMT 2025","40","tests","start_unauthorized_page_test","TestStartUnauthorizedPage","","","Verify presence and visibility of content on the page",""
"passed","Mon Jun 16 09:16:08 GMT 2025","Mon Jun 16 09:16:08 GMT 2025","27","tests","groups_page_test","TestGroupsPage","","","Verify presence and visibility of content on the page",""
"passed","Mon Jun 16 09:22:21 GMT 2025","Mon Jun 16 09:22:21 GMT 2025","184","tests","main_page_test","TestMainPage","","","Verify redirection to description page not authorized user.",""
"passed","Mon Jun 16 09:11:43 GMT 2025","Mon Jun 16 09:11:43 GMT 2025","575","tests","exercises_ru_words_page_test","TestExercisesRuWordsPage","","","Verify text in group links on the page",""
"passed","Mon Jun 16 09:19:37 GMT 2025","Mon Jun 16 09:19:37 GMT 2025","295","tests","header_test","TestHeaderPage","","","Verify the dropdown opens/closes after clicking on the 'More' button in the Header 
            on the Start Unauthorized Page",""
"passed","Mon Jun 16 09:07:55 GMT 2025","Mon Jun 16 09:07:56 GMT 2025","448","tests","contributors_page_test","TestContributorsPage","","","Verify text in card links and the 'All Team' link",""
"passed","Mon Jun 16 09:09:54 GMT 2025","Mon Jun 16 09:09:54 GMT 2025","73","tests","exercises_ru_similar_phrases_page_test","TestExercisesRuSimilarPhrasesPage","","","Verify text in group links on the page",""
"passed","Mon Jun 16 09:06:41 GMT 2025","Mon Jun 16 09:06:41 GMT 2025","22","tests","contacts_page_test","TestContactsPage","","","Verify the composition and visibility of elements on the 1st level of nesting in the section 1",""
"passed","Mon Jun 16 09:22:25 GMT 2025","Mon Jun 16 09:22:26 GMT 2025","1151","tests","main_page_test","TestMainPage","","","Verify redirection to telegram page not authorized user.",""
"passed","Mon Jun 16 09:22:30 GMT 2025","Mon Jun 16 09:22:31 GMT 2025","980","tests","main_page_test","TestMainPage","","","Verify redirection to donate page not authorized user.",""
"passed","Mon Jun 16 09:12:07 GMT 2025","Mon Jun 16 09:12:09 GMT 2025","2037","tests","exercises_ru_words_page_test","TestExercisesRuWordsPage","","","Verify clickability, href, status code of links in breadcrumbs on the page",""
"passed","Mon Jun 16 09:21:24 GMT 2025","Mon Jun 16 09:21:24 GMT 2025","88","tests","header_test","TestHeaderPage","","","Verify that the Logo link on the Start Authorized Page 
                             doesn't refresh the current page or lead to other pages after clicking",""
"passed","Mon Jun 16 09:27:55 GMT 2025","Mon Jun 16 09:28:06 GMT 2025","10625","tests","Речевые упражнения.","TestCardsRU","","","Select random card from group ""Слова"" and compare UI vs BACKEND data.",""
"passed","Mon Jun 16 09:09:33 GMT 2025","Mon Jun 16 09:09:33 GMT 2025","12","tests","exercises_ru_similar_phrases_page_test","TestExercisesRuSimilarPhrasesPage","","","Verify value of the title of the tab",""
"passed","Mon Jun 16 09:26:13 GMT 2025","Mon Jun 16 09:26:13 GMT 2025","42","tests","start_unauthorized_page_test","TestStartUnauthorizedPage","","","Verify text in the 'Login' link in the section 1",""
"skipped","Mon Jun 16 09:29:05 GMT 2025","Mon Jun 16 09:29:28 GMT 2025","23225","tests","Речевые упражнения.","TestCardsRU","","","Select a random card from ""Предложения"" group and compare UI vs BACKEND data.",""
"passed","Mon Jun 16 09:07:50 GMT 2025","Mon Jun 16 09:07:51 GMT 2025","1385","tests","contributors_page_test","TestContributorsPage","","","Verify values of the text in card descriptions",""
"passed","Mon Jun 16 09:17:00 GMT 2025","Mon Jun 16 09:17:01 GMT 2025","1017","tests","groups_page_test","TestGroupsPage","","","Verify value of the 'ru' subtitles on the page",""
"skipped","Mon Jun 16 09:30:05 GMT 2025","Mon Jun 16 09:30:25 GMT 2025","20109","tests","Речевые упражнения.","TestCardsRU","","","Solutions to a random task in the ""Слова"" .",""
"skipped","Mon Jun 16 09:27:02 GMT 2025","Mon Jun 16 09:27:22 GMT 2025","20239","tests","Speech exercises EN.","TestCardsEN","","","Check progres-bar and buttons.",""
"passed","Mon Jun 16 09:11:06 GMT 2025","Mon Jun 16 09:11:08 GMT 2025","1961","tests","exercises_ru_words_page_test","TestExercisesRuWordsPage","","","Verify presence, visibility of lists on the page",""
"passed","Mon Jun 16 09:20:02 GMT 2025","Mon Jun 16 09:20:12 GMT 2025","10241","tests","header_test","TestHeaderPage","","","Verify composition, visibility of elements on the 1st-6th levels of nesting in the Header
            for an authorized user",""
"passed","Mon Jun 16 09:13:05 GMT 2025","Mon Jun 16 09:13:09 GMT 2025","3794","tests","exercises_ru_words_page_test","TestExercisesRuWordsPage","","","Verify if breadcrumbs link1 leads to the correct page after clicking",""
"passed","Mon Jun 16 09:24:02 GMT 2025","Mon Jun 16 09:24:03 GMT 2025","790","tests","registration_page_test","TestRegistrationPage","","","Check registration with new email and empty birthday",""
"skipped","Mon Jun 16 09:30:59 GMT 2025","Mon Jun 16 09:31:19 GMT 2025","20146","tests","Речевые упражнения.","TestCardsRU","","","Solutions to a random task in the ""Слова"" group and comparison of statics.",""
"passed","Mon Jun 16 09:16:15 GMT 2025","Mon Jun 16 09:16:15 GMT 2025","157","tests","groups_page_test","TestGroupsPage","","","Verify composition, visibility of elements on the 1st-6th levels of nesting on the page",""
"passed","Mon Jun 16 09:11:19 GMT 2025","Mon Jun 16 09:11:19 GMT 2025","659","tests","exercises_ru_words_page_test","TestExercisesRuWordsPage","","","Verify value of the title of the tab",""
"passed","Mon Jun 16 09:10:51 GMT 2025","Mon Jun 16 09:10:54 GMT 2025","3343","tests","exercises_ru_words_page_test","TestExercisesRuWordsPage","","","Verify composition, visibility of elements on the 1st-6th levels of nesting on the page",""
"skipped","Mon Jun 16 09:26:35 GMT 2025","Mon Jun 16 09:26:55 GMT 2025","20175","tests","Speech exercises EN.","TestCardsEN","","","Select random card from ""Word"" group and compare UI vs BACKEND data",""
"passed","Mon Jun 16 09:23:54 GMT 2025","Mon Jun 16 09:23:54 GMT 2025","786","tests","registration_page_test","TestRegistrationPage","","","Check registration with new email and empty password",""
"passed","Mon Jun 16 09:23:00 GMT 2025","Mon Jun 16 09:23:00 GMT 2025","120","tests","main_page_test","TestMainPage","","","Checking the clickability of the Registration button.",""
"passed","Mon Jun 16 09:22:48 GMT 2025","Mon Jun 16 09:22:49 GMT 2025","676","tests","main_page_test","TestMainPage","","","Verify redirection to contributors page not authorized user.",""
"passed","Mon Jun 16 09:07:39 GMT 2025","Mon Jun 16 09:07:39 GMT 2025","11","tests","contributors_page_test","TestContributorsPage","","","Verify value of the title of the tab",""
"passed","Mon Jun 16 09:15:25 GMT 2025","Mon Jun 16 09:15:37 GMT 2025","11596","tests","footer_test","TestFooter","","","Verify that links in the Footer lead to correct pages after clicking",""
"passed","Mon Jun 16 09:07:09 GMT 2025","Mon Jun 16 09:07:09 GMT 2025","829","tests","contacts_page_test","TestContactsPage","","","Verify presence, visibility, clickability, href, prefix, status code of links in the section 2",""
"passed","Mon Jun 16 09:32:34 GMT 2025","Mon Jun 16 09:32:34 GMT 2025","68","tests","used_resources_page_test","TestURPage","","","Verify presence, visibility and attributes of icons in sections",""
"passed","Mon Jun 16 09:24:11 GMT 2025","Mon Jun 16 09:24:12 GMT 2025","699","tests","registration_page_test","TestRegistrationPage","","","Check registration without choosing gender",""
"passed","Mon Jun 16 09:11:54 GMT 2025","Mon Jun 16 09:11:56 GMT 2025","1036","tests","exercises_ru_words_page_test","TestExercisesRuWordsPage","","","Verify text in cards on the page",""
"passed","Mon Jun 16 09:16:38 GMT 2025","Mon Jun 16 09:16:38 GMT 2025","11","tests","groups_page_test","TestGroupsPage","","","Verify value of the 'en' title of the tab",""
"passed","Mon Jun 16 09:07:13 GMT 2025","Mon Jun 16 09:07:15 GMT 2025","1328","tests","contacts_page_test","TestContactsPage","","","Verify if links in the section 2 lead to the correct pages after clicking",""
"passed","Mon Jun 16 09:09:43 GMT 2025","Mon Jun 16 09:09:44 GMT 2025","38","tests","exercises_ru_similar_phrases_page_test","TestExercisesRuSimilarPhrasesPage","","","Verify value of the breadcrumbs on the page",""
"passed","Mon Jun 16 09:21:16 GMT 2025","Mon Jun 16 09:21:18 GMT 2025","1805","tests","header_test","TestHeaderPage","","","Verify if external links in the Header for an authorized user 
            lead to correct pages after click",""
"passed","Mon Jun 16 09:26:09 GMT 2025","Mon Jun 16 09:26:09 GMT 2025","76","tests","start_unauthorized_page_test","TestStartUnauthorizedPage","","","Verify content of the text in sections 1, 2",""
"passed","Mon Jun 16 09:10:05 GMT 2025","Mon Jun 16 09:10:05 GMT 2025","58","tests","exercises_ru_similar_phrases_page_test","TestExercisesRuSimilarPhrasesPage","","","Verify text in cards on the page",""
"passed","Mon Jun 16 09:10:16 GMT 2025","Mon Jun 16 09:10:17 GMT 2025","1609","tests","exercises_ru_similar_phrases_page_test","TestExercisesRuSimilarPhrasesPage","","","Verify clickability, href of links in breadcrumbs on the page",""
"passed","Mon Jun 16 09:19:55 GMT 2025","Mon Jun 16 09:19:55 GMT 2025","27","tests","header_test","TestHeaderPage","","","Verify presence and visibility of the Header for an authorized user",""
"passed","Mon Jun 16 09:08:03 GMT 2025","Mon Jun 16 09:08:04 GMT 2025","568","tests","contributors_page_test","TestContributorsPage","","","Verify href, status code of the 'All Team' link",""
"passed","Mon Jun 16 09:24:07 GMT 2025","Mon Jun 16 09:24:08 GMT 2025","764","tests","registration_page_test","TestRegistrationPage","","","Check registration with new email and empty email",""
"passed","Mon Jun 16 09:21:52 GMT 2025","Mon Jun 16 09:21:52 GMT 2025","43","tests","header_test","TestHeaderPage","","","Verify presence, visibility and attributes of the image in the Logo link in the Header 
               for an authorized user",""
"skipped","Mon Jun 16 09:29:35 GMT 2025","Mon Jun 16 09:29:57 GMT 2025","22837","tests","Речевые упражнения.","TestCardsRU","","","Select a random card from ""Слова с частотной группировкой"" group and compare UI vs BACKEND data.",""
"passed","Mon Jun 16 09:22:18 GMT 2025","Mon Jun 16 09:22:18 GMT 2025","3","tests","login_page_test","TestLoginPage","","","Test for authorization customer.",""
"passed","Mon Jun 16 09:24:54 GMT 2025","Mon Jun 16 09:24:54 GMT 2025","13","tests","specialists_page_test","TestSpecialistsPage","","","Verify value of the title of the tab",""
"passed","Mon Jun 16 09:23:34 GMT 2025","Mon Jun 16 09:23:40 GMT 2025","6030","tests","registration_page_test","TestRegistrationPage","","","Check registration with new email",""
"passed","Mon Jun 16 09:32:21 GMT 2025","Mon Jun 16 09:32:23 GMT 2025","2466","tests","used_resources_page_test","TestURPage","","","Verify presence, visibility, clickability, href, status code of links in sections",""
"passed","Mon Jun 16 09:15:56 GMT 2025","Mon Jun 16 09:16:00 GMT 2025","4472","tests","footer_test","TestFooter","","","Verify Footer invisibility through the modal window with the exercise",""
"passed","Mon Jun 16 09:14:09 GMT 2025","Mon Jun 16 09:14:27 GMT 2025","18098","tests","exercises_ru_words_page_test","TestExercisesRuWordsPage","","","Verify if subgroup links 1-4 lead to correct pages after clicking",""
"passed","Mon Jun 16 09:23:58 GMT 2025","Mon Jun 16 09:23:59 GMT 2025","755","tests","registration_page_test","TestRegistrationPage","","","Check registration with new email and empty first name",""
"passed","Mon Jun 16 09:14:50 GMT 2025","Mon Jun 16 09:14:56 GMT 2025","5933","tests","exercises_ru_words_page_test","TestExercisesRuWordsPage","","","Verify sizes of background-images in links on the page",""
"passed","Mon Jun 16 09:18:49 GMT 2025","Mon Jun 16 09:18:59 GMT 2025","10248","tests","header_test","TestHeaderPage","","","Verify composition, visibility of elements on the 1st-6th levels of nesting in the Header
            for an unauthorized user",""
"passed","Mon Jun 16 09:25:55 GMT 2025","Mon Jun 16 09:25:55 GMT 2025","96","tests","start_unauthorized_page_test","TestStartUnauthorizedPage","","","Verify the composition and visibility of elements 
        on the 1st-3rd levels of nesting in the section 1",""
"passed","Mon Jun 16 09:15:18 GMT 2025","Mon Jun 16 09:15:22 GMT 2025","3488","tests","footer_test","TestFooter","","","Verify clickability, href, prefix and subject, status code of links in the Footer",""
"passed","Mon Jun 16 09:18:20 GMT 2025","Mon Jun 16 09:18:20 GMT 2025","22","tests","groups_page_test","TestGroupsPage","","","Verify attribute 'src' of images in links on the page",""
"passed","Mon Jun 16 09:06:57 GMT 2025","Mon Jun 16 09:06:57 GMT 2025","52","tests","contacts_page_test","TestContactsPage","","","Verify values of the title and subtitles with tags h1, h2 on the page",""
"passed","Mon Jun 16 09:08:17 GMT 2025","Mon Jun 16 09:08:17 GMT 2025","115","tests","description_page_test","TestDescriptionPage","","","Verify return main page from description page.",""
"passed","Mon Jun 16 09:20:19 GMT 2025","Mon Jun 16 09:20:19 GMT 2025","369","tests","header_test","TestHeaderPage","","","Verify presence, visibility of links, buttons in the Header for an authorized user",""
"passed","Mon Jun 16 09:12:32 GMT 2025","Mon Jun 16 09:12:54 GMT 2025","21611","tests","exercises_ru_words_page_test","TestExercisesRuWordsPage","","","Verify clickability, titles, href, status code of subgroup links on the page",""
"passed","Mon Jun 16 09:13:43 GMT 2025","Mon Jun 16 09:13:58 GMT 2025","15066","tests","exercises_ru_words_page_test","TestExercisesRuWordsPage","","","Verify if group links lead to correct pages after clicking",""
"passed","Mon Jun 16 09:18:42 GMT 2025","Mon Jun 16 09:18:42 GMT 2025","69","tests","groups_page_test","TestGroupsPage","","","Verify sizes of images in links on the page",""
"passed","Mon Jun 16 09:18:45 GMT 2025","Mon Jun 16 09:18:45 GMT 2025","33","tests","header_test","TestHeaderPage","","","Verify presence and visibility of the Header for an unauthorized user",""
"passed","Mon Jun 16 09:06:53 GMT 2025","Mon Jun 16 09:06:53 GMT 2025","13","tests","contacts_page_test","TestContactsPage","","","Verify value of the title of the tab",""
"passed","Mon Jun 16 09:19:48 GMT 2025","Mon Jun 16 09:19:48 GMT 2025","53","tests","header_test","TestHeaderPage","","","Verify size of the image in the Logo link in the Header on the Start Unauthorized Page",""
"passed","Mon Jun 16 09:10:39 GMT 2025","Mon Jun 16 09:10:40 GMT 2025","750","tests","exercises_ru_words_page_test","TestExercisesRuWordsPage","","","Verify presence and visibility of content on the page",""
"passed","Mon Jun 16 09:24:49 GMT 2025","Mon Jun 16 09:24:50 GMT 2025","912","tests","specialists_page_test","TestSpecialistsPage","","","Verify presence, visibility of the title, text, link, grid, cards and images  
        on the 2nd, 3rd, 5th, 6th levels of nesting on the page",""
"passed","Mon Jun 16 09:32:38 GMT 2025","Mon Jun 16 09:32:39 GMT 2025","80","tests","used_resources_page_test","TestURPage","","","Verify sizes of icons in sections",""
"passed","Mon Jun 16 09:21:31 GMT 2025","Mon Jun 16 09:21:31 GMT 2025","256","tests","header_test","TestHeaderPage","","","Verify the dropdown opens/closes after clicking on the 'More' button in the Header 
               for an authorized user",""
"passed","Mon Jun 16 09:15:49 GMT 2025","Mon Jun 16 09:15:49 GMT 2025","113","tests","footer_test","TestFooter","","","Verify sizes of images in links in the Footer",""
"passed","Mon Jun 16 09:07:18 GMT 2025","Mon Jun 16 09:07:19 GMT 2025","117","tests","contacts_page_test","TestContactsPage","","","Verify that the email link calls an email client",""
"passed","Mon Jun 16 09:06:28 GMT 2025","Mon Jun 16 09:06:29 GMT 2025","1208","tests","authorisation_page_test","TestAuthorizedUserPage","","","Checking the possibility of authorization with the correct data",""
"passed","Mon Jun 16 09:15:14 GMT 2025","Mon Jun 16 09:15:15 GMT 2025","60","tests","footer_test","TestFooter","","","Verify text in the 'Contact us' link in the Footer",""
"passed","Mon Jun 16 09:07:22 GMT 2025","Mon Jun 16 09:07:22 GMT 2025","40","tests","contributors_page_test","TestContributorsPage","","","Verify presence, visibility and structure of content on the page",""
"passed","Mon Jun 16 09:17:32 GMT 2025","Mon Jun 16 09:17:32 GMT 2025","23","tests","groups_page_test","TestGroupsPage","","","Verify href of links on the 'ru' local",""
"passed","Mon Jun 16 09:31:56 GMT 2025","Mon Jun 16 09:31:56 GMT 2025","130","tests","used_resources_page_test","TestURPage","","","Verify the composition and visibility of elements 
        on the 1st-4th levels of nesting on the page",""
"passed","Mon Jun 16 09:20:55 GMT 2025","Mon Jun 16 09:21:09 GMT 2025","14264","tests","header_test","TestHeaderPage","","","Verify if internal links in the Header for an authorized user 
            lead to correct pages after click",""
"passed","Mon Jun 16 09:24:16 GMT 2025","Mon Jun 16 09:24:36 GMT 2025","20828","tests","registration_page_test","TestRegistrationPage","","","Check registration without choosing agreement",""
"passed","Mon Jun 16 09:22:35 GMT 2025","Mon Jun 16 09:22:35 GMT 2025","191","tests","main_page_test","TestMainPage","","","Verify redirection to contacts page not authorized user.",""
"passed","Mon Jun 16 09:08:59 GMT 2025","Mon Jun 16 09:08:59 GMT 2025","38","tests","exercises_ru_similar_phrases_page_test","TestExercisesRuSimilarPhrasesPage","","","Verify presence and visibility of content on the page",""
"passed","Mon Jun 16 09:19:11 GMT 2025","Mon Jun 16 09:19:15 GMT 2025","4647","tests","header_test","TestHeaderPage","","","Verify clickability, href, status code of links in the Header for an unauthorized user",""
"passed","Mon Jun 16 09:15:11 GMT 2025","Mon Jun 16 09:15:11 GMT 2025","51","tests","footer_test","TestFooter","","","Verify content of text in the Footer",""
"passed","Mon Jun 16 09:21:45 GMT 2025","Mon Jun 16 09:21:45 GMT 2025","383","tests","header_test","TestHeaderPage","","","Verify user logout after clicking the 'Logout' button in the Header for an authorized user",""
"passed","Mon Jun 16 09:06:37 GMT 2025","Mon Jun 16 09:06:37 GMT 2025","30","tests","contacts_page_test","TestContactsPage","","","Verify presence and visibility of content on the page",""
"passed","Mon Jun 16 09:25:42 GMT 2025","Mon Jun 16 09:25:43 GMT 2025","165","tests","specialists_page_test","TestSpecialistsPage","","","Verify sizes of images in specialist cards in the grid",""
"passed","Mon Jun 16 09:19:27 GMT 2025","Mon Jun 16 09:19:29 GMT 2025","2065","tests","header_test","TestHeaderPage","","","Verify if external links in the Header for an unauthorized user 
            lead to correct pages after click",""
"passed","Mon Jun 16 09:18:00 GMT 2025","Mon Jun 16 09:18:12 GMT 2025","11719","tests","groups_page_test","TestGroupsPage","","","Verify if links on the 'en' local lead to correct pages after clicking",""
"passed","Mon Jun 16 09:25:18 GMT 2025","Mon Jun 16 09:25:19 GMT 2025","551","tests","specialists_page_test","TestSpecialistsPage","","","Verify clickability, href, status code of the 'All Specialists' link",""
"passed","Mon Jun 16 09:20:25 GMT 2025","Mon Jun 16 09:20:26 GMT 2025","192","tests","header_test","TestHeaderPage","","","Verify values of the text in links, buttons in the Header for an authorized user",""
"passed","Mon Jun 16 09:25:00 GMT 2025","Mon Jun 16 09:25:00 GMT 2025","35","tests","specialists_page_test","TestSpecialistsPage","","","Verify value of title with tag 'h2' on the page",""
"passed","Mon Jun 16 09:07:46 GMT 2025","Mon Jun 16 09:07:46 GMT 2025","19","tests","contributors_page_test","TestContributorsPage","","","Verify content of the text on the page",""
"passed","Mon Jun 16 09:22:05 GMT 2025","Mon Jun 16 09:22:05 GMT 2025","45","tests","header_test","TestHeaderPage","","","Verify presence, visibility, attributes of icons in the Header for an authorized user",""
"skipped","Mon Jun 16 09:23:00 GMT 2025","Mon Jun 16 09:23:00 GMT 2025","0","tests","main_page_test","TestMainPage","","","Checking the ip is available",""
"passed","Mon Jun 16 09:11:31 GMT 2025","Mon Jun 16 09:11:31 GMT 2025","549","tests","exercises_ru_words_page_test","TestExercisesRuWordsPage","","","Verify value of the breadcrumbs on the page",""
"passed","Mon Jun 16 09:23:00 GMT 2025","Mon Jun 16 09:23:00 GMT 2025","351","tests","main_page_test","TestMainPage","","","Checking the domain is available",""
"passed","Mon Jun 16 09:22:38 GMT 2025","Mon Jun 16 09:22:39 GMT 2025","681","tests","main_page_test","TestMainPage","","","Verify redirection to specialists page not authorized user.",""
"passed","Mon Jun 16 09:25:58 GMT 2025","Mon Jun 16 09:25:58 GMT 2025","127","tests","start_unauthorized_page_test","TestStartUnauthorizedPage","","","Verify the composition and visibility of elements 
        on the 1st-3rd levels of nesting in the section 2",""
"passed","Mon Jun 16 09:22:56 GMT 2025","Mon Jun 16 09:22:56 GMT 2025","114","tests","main_page_test","TestMainPage","","","Checking the clickability of the Start button.",""
"passed","Mon Jun 16 09:15:45 GMT 2025","Mon Jun 16 09:15:45 GMT 2025","74","tests","footer_test","TestFooter","","","Verify attributes of images in links in the Footer",""
"passed","Mon Jun 16 09:20:39 GMT 2025","Mon Jun 16 09:20:48 GMT 2025","9317","tests","header_test","TestHeaderPage","","","Verify clickability, href, status code of links in the Header for an authorized user",""
"passed","Mon Jun 16 09:28:13 GMT 2025","Mon Jun 16 09:28:24 GMT 2025","10502","tests","Речевые упражнения.","TestCardsRU","","","Select random card from group ""Слова Королёвой"" and compare UI vs BACKEND data.",""
"passed","Mon Jun 16 09:16:31 GMT 2025","Mon Jun 16 09:16:31 GMT 2025","12","tests","groups_page_test","TestGroupsPage","","","Verify value of the 'ru' title of the tab",""
"skipped","Mon Jun 16 09:31:26 GMT 2025","Mon Jun 16 09:31:46 GMT 2025","20087","tests","Statistic.","TestCardsRU","","","Check statistic table.",""
"passed","Mon Jun 16 09:32:01 GMT 2025","Mon Jun 16 09:32:01 GMT 2025","13","tests","used_resources_page_test","TestURPage","","","Verify value of the title of the tab",""
"passed","Mon Jun 16 09:32:10 GMT 2025","Mon Jun 16 09:32:10 GMT 2025","35","tests","used_resources_page_test","TestURPage","","","Verify content of the text on the page",""
"passed","Mon Jun 16 09:26:21 GMT 2025","Mon Jun 16 09:26:21 GMT 2025","188","tests","start_unauthorized_page_test","TestStartUnauthorizedPage","","","Verify that the 'Login' link leads to the correct page after clicking",""
"passed","Mon Jun 16 09:06:49 GMT 2025","Mon Jun 16 09:06:49 GMT 2025","197","tests","contacts_page_test","TestContactsPage","","","Verify presence, visibility of sections, the dividing line and elements with text on the page",""
"passed","Mon Jun 16 09:26:02 GMT 2025","Mon Jun 16 09:26:02 GMT 2025","13","tests","start_unauthorized_page_test","TestStartUnauthorizedPage","","","Verify value of the title of the tab",""
"skipped","Mon Jun 16 09:27:29 GMT 2025","Mon Jun 16 09:27:49 GMT 2025","20188","tests","Speech exercises EN.","TestCardsEN","","","Select a random card from ""Similar phrases"" group and compare UI vs BACKEND data",""
"passed","Mon Jun 16 09:10:28 GMT 2025","Mon Jun 16 09:10:28 GMT 2025","201","tests","exercises_ru_similar_phrases_page_test","TestExercisesRuSimilarPhrasesPage","","","Verify clickability, titles, attributes of group links on the page",""
"passed","Mon Jun 16 09:13:20 GMT 2025","Mon Jun 16 09:13:20 GMT 2025","658","tests","exercises_ru_words_page_test","TestExercisesRuWordsPage","","","Verify if breadcrumbs link2 leads to the correct page after clicking",""
"passed","Mon Jun 16 09:26:05 GMT 2025","Mon Jun 16 09:26:05 GMT 2025","53","tests","start_unauthorized_page_test","TestStartUnauthorizedPage","","","Verify values of titles and subtitles with tags h2, h4 on the page",""
