"Status","Start Time","Stop Time","Duration in ms","Parent Suite","Suite","Sub Suite","Test Class","Test Method","Name","Description"
"passed","Mon Jun 16 09:26:25 GMT 2025","Mon Jun 16 09:26:25 GMT 2025","78","tests","start_unauthorized_page_test","TestStartUnauthorizedPage","","","Verify presence, visibility and attributes of the image in the section 1",""
"passed","Mon Jun 16 09:21:58 GMT 2025","Mon Jun 16 09:21:58 GMT 2025","51","tests","header_test","TestHeaderPage","","","Verify size of the image in the 'Logo' link in the Header for an authorized user",""
"passed","Mon Jun 16 09:07:04 GMT 2025","Mon Jun 16 09:07:05 GMT 2025","30","tests","contacts_page_test","TestContactsPage","","","Verify text in links in the section 2",""
"passed","Mon Jun 16 09:16:45 GMT 2025","Mon Jun 16 09:16:45 GMT 2025","27","tests","groups_page_test","TestGroupsPage","","","Verify value of the 'ru' title on the page",""
"passed","Mon Jun 16 09:07:26 GMT 2025","Mon Jun 16 09:07:28 GMT 2025","1698","tests","contributors_page_test","TestContributorsPage","","","Verify the composition and visibility of elements 
        on the 1st-5th levels of nesting on the page",""
"passed","Mon Jun 16 09:08:08 GMT 2025","Mon Jun 16 09:08:08 GMT 2025","837","tests","contributors_page_test","TestContributorsPage","","","Verify attribute values of images in contributors cards in grids",""
"skipped","Mon Jun 16 09:30:32 GMT 2025","Mon Jun 16 09:30:52 GMT 2025","20155","tests","Речевые упражнения.","TestCardsRU","","","Solutions to a random task in the ""Слова Королёвой"" .",""
"passed","Mon Jun 16 09:26:28 GMT 2025","Mon Jun 16 09:26:29 GMT 2025","64","tests","start_unauthorized_page_test","TestStartUnauthorizedPage","","","Verify size of the image in the section 1",""
"passed","Mon Jun 16 09:19:07 GMT 2025","Mon Jun 16 09:19:07 GMT 2025","232","tests","header_test","TestHeaderPage","","","Verify values of the text in links, buttons in the Header for an unauthorized user",""
"passed","Mon Jun 16 09:15:07 GMT 2025","Mon Jun 16 09:15:08 GMT 2025","151","tests","footer_test","TestFooter","","","Verify presence, visibility of text, links, images in the Footer",""
"passed","Mon Jun 16 09:07:59 GMT 2025","Mon Jun 16 09:08:00 GMT 2025","783","tests","contributors_page_test","TestContributorsPage","","","Verify clickability, href of links on the page",""
"passed","Mon Jun 16 09:31:51 GMT 2025","Mon Jun 16 09:31:51 GMT 2025","29","tests","used_resources_page_test","TestURPage","","","Verify presence and visibility of content on the page",""
"passed","Mon Jun 16 09:15:41 GMT 2025","Mon Jun 16 09:15:41 GMT 2025","128","tests","footer_test","TestFooter","","","Verify that the 'Contact us' link in the Footer calls an email client",""
"passed","Mon Jun 16 09:25:38 GMT 2025","Mon Jun 16 09:25:38 GMT 2025","116","tests","specialists_page_test","TestSpecialistsPage","","","Verify attributes of images in specialist cards in the grid",""
"passed","Mon Jun 16 09:28:48 GMT 2025","Mon Jun 16 09:28:58 GMT 2025","10143","tests","Речевые упражнения.","TestCardsRU","","","Select a random card from ""Группа слов"" group and compare UI vs BACKEND data.",""
"passed","Mon Jun 16 09:25:31 GMT 2025","Mon Jun 16 09:25:33 GMT 2025","2692","tests","specialists_page_test","TestSpecialistsPage","","","Verify that the 'All Specialists' link leads an authorized user 
                         to the correct page after clicking",""
"passed","Mon Jun 16 09:19:40 GMT 2025","Mon Jun 16 09:19:41 GMT 2025","201","tests","header_test","TestHeaderPage","","","Verify switching of the 'ru', 'en' buttons in the Header on the Start Unauthorized Page",""
"passed","Mon Jun 16 09:24:45 GMT 2025","Mon Jun 16 09:24:45 GMT 2025","334","tests","specialists_page_test","TestSpecialistsPage","","","Verify the composition and visibility of elements 
        on the 1st-6th levels of nesting on the page",""
"passed","Mon Jun 16 09:22:43 GMT 2025","Mon Jun 16 09:22:44 GMT 2025","1519","tests","main_page_test","TestMainPage","","","Verify redirection to github not authorized user.",""
"passed","Mon Jun 16 09:08:26 GMT 2025","Mon Jun 16 09:08:27 GMT 2025","1194","tests","description_page_test","TestDescriptionPage","","","Verify redirection to donate page not authorized user.",""
"passed","Mon Jun 16 09:14:38 GMT 2025","Mon Jun 16 09:14:39 GMT 2025","1062","tests","exercises_ru_words_page_test","TestExercisesRuWordsPage","","","Verify attributes of images in links on the page",""
"passed","Mon Jun 16 09:22:52 GMT 2025","Mon Jun 16 09:22:53 GMT 2025","176","tests","main_page_test","TestMainPage","","","Verify redirection to used resources page not authorized user.",""
"passed","Mon Jun 16 09:09:22 GMT 2025","Mon Jun 16 09:09:22 GMT 2025","326","tests","exercises_ru_similar_phrases_page_test","TestExercisesRuSimilarPhrasesPage","","","Verify presence, visibility of lists on the page",""
"passed","Mon Jun 16 09:17:24 GMT 2025","Mon Jun 16 09:17:24 GMT 2025","22","tests","groups_page_test","TestGroupsPage","","","Verify title of links on the 'ru' local",""
"passed","Mon Jun 16 09:08:21 GMT 2025","Mon Jun 16 09:08:22 GMT 2025","1143","tests","description_page_test","TestDescriptionPage","","","Verify redirection to telegram page not authorized user.",""
"passed","Mon Jun 16 09:08:48 GMT 2025","Mon Jun 16 09:08:48 GMT 2025","223","tests","description_page_test","TestDescriptionPage","","","Verify redirection to used resources page not authorized user.",""
"passed","Mon Jun 16 09:16:23 GMT 2025","Mon Jun 16 09:16:23 GMT 2025","118","tests","groups_page_test","TestGroupsPage","","","Verify presence, visibility of the title, tiles, links, images, subtitles on the page",""
"passed","Mon Jun 16 09:08:44 GMT 2025","Mon Jun 16 09:08:45 GMT 2025","685","tests","description_page_test","TestDescriptionPage","","","Verify redirection to contributors page not authorized user.",""
"passed","Mon Jun 16 09:24:41 GMT 2025","Mon Jun 16 09:24:41 GMT 2025","31","tests","specialists_page_test","TestSpecialistsPage","","","Verify presence and visibility of content on the page",""
"passed","Mon Jun 16 09:08:31 GMT 2025","Mon Jun 16 09:08:31 GMT 2025","216","tests","description_page_test","TestDescriptionPage","","","Verify redirection to contacts page not authorized user.",""
"passed","Mon Jun 16 09:22:11 GMT 2025","Mon Jun 16 09:22:11 GMT 2025","54","tests","header_test","TestHeaderPage","","","Verify presence, visibility and attributes of the profile avatar in the Header 
               for an authorized user",""
"passed","Mon Jun 16 09:13:31 GMT 2025","Mon Jun 16 09:13:32 GMT 2025","712","tests","exercises_ru_words_page_test","TestExercisesRuWordsPage","","","Verify if breadcrumbs link3 leads to the correct page after clicking",""
"passed","Mon Jun 16 09:06:45 GMT 2025","Mon Jun 16 09:06:45 GMT 2025","153","tests","contacts_page_test","TestContactsPage","","","Verify the composition and visibility of elements 
        on the 1st-5th levels of nesting in the section 2",""
"passed","Mon Jun 16 09:19:03 GMT 2025","Mon Jun 16 09:19:03 GMT 2025","386","tests","header_test","TestHeaderPage","","","Verify presence, visibility of links, buttons in the Header for an unauthorized user",""
"passed","Mon Jun 16 09:16:52 GMT 2025","Mon Jun 16 09:16:52 GMT 2025","29","tests","groups_page_test","TestGroupsPage","","","Verify value of the 'en' title on the page",""
"passed","Mon Jun 16 09:07:31 GMT 2025","Mon Jun 16 09:07:35 GMT 2025","3688","tests","contributors_page_test","TestContributorsPage","","","Verify presence, visibility of titles/subtitles, cards, descriptions, links, images on the page",""
"passed","Mon Jun 16 09:21:38 GMT 2025","Mon Jun 16 09:21:38 GMT 2025","201","tests","header_test","TestHeaderPage","","","Verify switching of the 'ru', 'en' buttons in the Header for an authorized user",""
"passed","Mon Jun 16 09:08:39 GMT 2025","Mon Jun 16 09:08:40 GMT 2025","1563","tests","description_page_test","TestDescriptionPage","","","Verify redirection to github not authorized user.",""
"passed","Mon Jun 16 09:18:35 GMT 2025","Mon Jun 16 09:18:35 GMT 2025","24","tests","groups_page_test","TestGroupsPage","","","test_gp_04_03_verify_images_alt_en",""
"passed","Mon Jun 16 09:25:08 GMT 2025","Mon Jun 16 09:25:08 GMT 2025","118","tests","specialists_page_test","TestSpecialistsPage","","","Verify values of names and professions in specialist cards in the grid",""
"passed","Mon Jun 16 09:25:51 GMT 2025","Mon Jun 16 09:25:51 GMT 2025","40","tests","start_unauthorized_page_test","TestStartUnauthorizedPage","","","Verify amount and visibility of sections with content on the page",""
"passed","Mon Jun 16 09:25:23 GMT 2025","Mon Jun 16 09:25:24 GMT 2025","630","tests","specialists_page_test","TestSpecialistsPage","","","Verify that the 'All Specialists' link leads an unauthorized user 
                         to the correct page after clicking",""
"passed","Mon Jun 16 09:08:12 GMT 2025","Mon Jun 16 09:08:13 GMT 2025","1243","tests","contributors_page_test","TestContributorsPage","","","Verify sizes of images in contributor cards in grids",""
"passed","Mon Jun 16 09:32:05 GMT 2025","Mon Jun 16 09:32:05 GMT 2025","37","tests","used_resources_page_test","TestURPage","","","Verify value of title with tag 'h1' on the page",""
"passed","Mon Jun 16 09:26:17 GMT 2025","Mon Jun 16 09:26:17 GMT 2025","575","tests","start_unauthorized_page_test","TestStartUnauthorizedPage","","","Verify presence, visibility, clickability, href, status code 
                         of the 'Login' link in the section 1",""
"passed","Mon Jun 16 09:09:10 GMT 2025","Mon Jun 16 09:09:11 GMT 2025","999","tests","exercises_ru_similar_phrases_page_test","TestExercisesRuSimilarPhrasesPage","","","Verify composition, visibility of elements on the 1st-7th levels of nesting on the page",""
"passed","Mon Jun 16 09:23:44 GMT 2025","Mon Jun 16 09:23:46 GMT 2025","1279","tests","registration_page_test","TestRegistrationPage","","","Check registration with an existing email",""
"passed","Mon Jun 16 09:32:28 GMT 2025","Mon Jun 16 09:32:29 GMT 2025","1168","tests","used_resources_page_test","TestURPage","","","Verify that links in the sections lead to the correct pages after clicking",""
"passed","Mon Jun 16 09:32:16 GMT 2025","Mon Jun 16 09:32:16 GMT 2025","31","tests","used_resources_page_test","TestURPage","","","Verify text in links in sections",""
"passed","Mon Jun 16 09:17:38 GMT 2025","Mon Jun 16 09:17:38 GMT 2025","39","tests","groups_page_test","TestGroupsPage","","","Verify title, href of links on the 'en' local",""
"passed","Mon Jun 16 09:19:45 GMT 2025","Mon Jun 16 09:19:45 GMT 2025","47","tests","header_test","TestHeaderPage","","","Verify presence, visibility and attributes of the image in the Logo link in the Header 
               on the Start Unauthorized Page",""
"passed","Mon Jun 16 09:23:04 GMT 2025","Mon Jun 16 09:23:31 GMT 2025","26623","tests","profile_page_test","TestProfilePage","","","Change the password by receiving an email link",""
"passed","Mon Jun 16 09:18:28 GMT 2025","Mon Jun 16 09:18:28 GMT 2025","25","tests","groups_page_test","TestGroupsPage","","","Verify attribute 'alt' of images in links on the 'ru' local",""
"passed","Mon Jun 16 09:06:32 GMT 2025","Mon Jun 16 09:06:33 GMT 2025","958","tests","authorisation_page_test","TestAuthorizedUserPage","","","Checking the possibility of authorization with incorrect data",""
"passed","Mon Jun 16 09:25:04 GMT 2025","Mon Jun 16 09:25:04 GMT 2025","35","tests","specialists_page_test","TestSpecialistsPage","","","Verify value of text on the page",""
"passed","Mon Jun 16 09:07:43 GMT 2025","Mon Jun 16 09:07:43 GMT 2025","40","tests","contributors_page_test","TestContributorsPage","","","Verify values of title and subtitles with tags h2, h3 on the page",""
"passed","Mon Jun 16 09:28:30 GMT 2025","Mon Jun 16 09:28:41 GMT 2025","11263","tests","Речевые упражнения.","TestCardsRU","","","Select a random card from ""Похожие фразы"" group and compare UI vs BACKEND data.",""
"passed","Mon Jun 16 09:19:33 GMT 2025","Mon Jun 16 09:19:33 GMT 2025","115","tests","header_test","TestHeaderPage","","","Verify that the 'Logo' link on the Start Unauthorized Page 
                             doesn't refresh the current page or lead to other pages after clicking",""
"passed","Mon Jun 16 09:20:32 GMT 2025","Mon Jun 16 09:20:32 GMT 2025","27","tests","header_test","TestHeaderPage","","","Verify presence, visibility of the user name in the Header for an authorized user",""
"passed","Mon Jun 16 09:25:13 GMT 2025","Mon Jun 16 09:25:13 GMT 2025","45","tests","specialists_page_test","TestSpecialistsPage","","","Verify text in the 'All Specialists' link",""
"passed","Mon Jun 16 09:07:00 GMT 2025","Mon Jun 16 09:07:01 GMT 2025","32","tests","contacts_page_test","TestContactsPage","","","Verify content of the text in the section 2",""
"passed","Mon Jun 16 09:17:15 GMT 2025","Mon Jun 16 09:17:16 GMT 2025","745","tests","groups_page_test","TestGroupsPage","","","Verify clickability, status code of links on the page",""
"passed","Mon Jun 16 09:19:19 GMT 2025","Mon Jun 16 09:19:24 GMT 2025","4945","tests","header_test","TestHeaderPage","","","Verify if internal links in the Header for an unauthorized user 
            lead to correct pages after click",""
