"Status","Start Time","Stop Time","Duration in ms","Parent Suite","Suite","Sub Suite","Test Class","Test Method","Name","Description"
"passed","Sun Jul 21 06:52:19 GMT 2024","Sun Jul 21 06:52:20 GMT 2024","588","tests","specialists_page_test","TestSpecialistsPage","","","Verify clickability, href, status code of the 'All Specialists' link",""
"passed","Sun Jul 21 06:46:32 GMT 2024","Sun Jul 21 06:46:32 GMT 2024","83","tests","footer_test","TestFooter","","","Verify presence, visibility and accuracy of the Contact us link in Footer",""
"passed","Sun Jul 21 06:47:57 GMT 2024","Sun Jul 21 06:47:57 GMT 2024","69","tests","footer_test","TestFooter","","","Verify presence, visibility and accuracy of the ARASAAC link's image in Footer",""
"passed","Sun Jul 21 06:58:19 GMT 2024","Sun Jul 21 06:58:20 GMT 2024","772","tests","used_resources_page_test","TestUsedResourcesPage","","","Verify content of the text on the page",""
"passed","Sun Jul 21 06:52:09 GMT 2024","Sun Jul 21 06:52:09 GMT 2024","112","tests","specialists_page_test","TestSpecialistsPage","","","Verify values of names and professions in specialist cards in the grid",""
"passed","Sun Jul 21 06:52:37 GMT 2024","Sun Jul 21 06:52:37 GMT 2024","113","tests","specialists_page_test","TestSpecialistsPage","","","Verify attributes of images in specialist cards in the grid",""
"passed","Sun Jul 21 06:53:33 GMT 2024","Sun Jul 21 06:53:41 GMT 2024","8371","tests","Speech exercises EN.","TestCardsEN","","","Select random card from ""Word"" group and compare UI vs BACKEND data",""
"passed","Sun Jul 21 06:55:16 GMT 2024","Sun Jul 21 06:55:25 GMT 2024","9166","tests","Речевые упражнения.","TestCardsRU","","","Select a random card from ""Предложения"" group and compare UI vs BACKEND data.",""
"passed","Sun Jul 21 06:44:10 GMT 2024","Sun Jul 21 06:44:12 GMT 2024","1631","tests","contributors_page_test","TestContributorsPage","","","Verify the composition and visibility of elements 
        on the 1st-5th levels of nesting on the page",""
"passed","Sun Jul 21 06:54:45 GMT 2024","Sun Jul 21 06:54:55 GMT 2024","9516","tests","Речевые упражнения.","TestCardsRU","","","Select a random card from ""Похожие фразы"" group and compare UI vs BACKEND data.",""
"passed","Sun Jul 21 06:49:13 GMT 2024","Sun Jul 21 06:49:13 GMT 2024","94","tests","header_test","TestHeaderPage","","","Verify that the 'Logo' link on the 'Contacts' page leads an unauthorized user 
                             to the Start Unauthorized Page after clicking",""
"passed","Sun Jul 21 06:51:45 GMT 2024","Sun Jul 21 06:51:45 GMT 2024","348","tests","specialists_page_test","TestSpecialistsPage","","","Verify the composition and visibility of elements 
        on the 1st-6th levels of nesting on the page",""
"passed","Sun Jul 21 06:46:11 GMT 2024","Sun Jul 21 06:46:11 GMT 2024","597","tests","footer_test","TestFooter","","","Verify presence, visibility, clickability, href, status code of the ARASAAC link in Footer",""
"passed","Sun Jul 21 06:57:53 GMT 2024","Sun Jul 21 06:57:54 GMT 2024","763","tests","used_resources_page_test","TestUsedResourcesPage","","","Verify presence and visibility of content on the page",""
"passed","Sun Jul 21 06:52:49 GMT 2024","Sun Jul 21 06:52:49 GMT 2024","32","tests","start_unauthorized_page_test","TestStartUnauthorizedPage","","","Verify amount and visibility of sections with content on the page",""
"passed","Sun Jul 21 06:46:23 GMT 2024","Sun Jul 21 06:46:24 GMT 2024","725","tests","footer_test","TestFooter","","","Verify presence, visibility, clickability, href, status code of the REG.RU link in Footer",""
"passed","Sun Jul 21 06:45:45 GMT 2024","Sun Jul 21 06:45:48 GMT 2024","2804","tests","footer_test","TestFooter","","","Verify presence and visibility of Footer on each page specified in the kit",""
"passed","Sun Jul 21 06:52:24 GMT 2024","Sun Jul 21 06:52:25 GMT 2024","592","tests","specialists_page_test","TestSpecialistsPage","","","Verify that the 'All Specialists' link leads an unauthorized user 
                         to the correct page after clicking",""
"passed","Sun Jul 21 06:52:46 GMT 2024","Sun Jul 21 06:52:46 GMT 2024","35","tests","start_unauthorized_page_test","TestStartUnauthorizedPage","","","Verify presence and visibility of content on the page",""
"passed","Sun Jul 21 06:53:04 GMT 2024","Sun Jul 21 06:53:04 GMT 2024","49","tests","start_unauthorized_page_test","TestStartUnauthorizedPage","","","Verify values of titles and subtitles with tags h2, h4 on the page",""
"passed","Sun Jul 21 06:44:32 GMT 2024","Sun Jul 21 06:44:33 GMT 2024","404","tests","contributors_page_test","TestContributorsPage","","","Verify values of the text in card descriptions",""
"passed","Sun Jul 21 06:43:18 GMT 2024","Sun Jul 21 06:43:18 GMT 2024","28","tests","contacts_page_test","TestContactsPage","","","Verify presence and visibility of content on the page",""
"passed","Sun Jul 21 06:51:01 GMT 2024","Sun Jul 21 06:51:02 GMT 2024","661","tests","registration_page_test","TestRegistrationPage","","","Check registration with new email and empty birthday",""
"passed","Sun Jul 21 06:51:14 GMT 2024","Sun Jul 21 06:51:35 GMT 2024","20707","tests","registration_page_test","TestRegistrationPage","","","Check registration without choosing agreement",""
"passed","Sun Jul 21 06:43:42 GMT 2024","Sun Jul 21 06:43:42 GMT 2024","50","tests","contacts_page_test","TestContactsPage","","","Verify values of the title and subtitles with tags h1, h2 on the page",""
"skipped","Sun Jul 21 06:55:46 GMT 2024","Sun Jul 21 06:56:58 GMT 2024","71384","tests","Речевые упражнения.","TestCardsRU","","","Solutions to a random task in the ""Слова"" .",""
"passed","Sun Jul 21 06:48:26 GMT 2024","Sun Jul 21 06:48:27 GMT 2024","82","tests","footer_test","TestFooter","","","Verify changes of visible sizes of the JETBRAINS link's image in Footer",""
"passed","Sun Jul 21 06:48:15 GMT 2024","Sun Jul 21 06:48:15 GMT 2024","87","tests","footer_test","TestFooter","","","Verify changes of visible sizes of the EPAM link's image in Footer",""
"passed","Sun Jul 21 06:46:05 GMT 2024","Sun Jul 21 06:46:07 GMT 2024","2722","tests","footer_test","TestFooter","","","Verify accuracy of texts in Footer on each page specified in the kit",""
"passed","Sun Jul 21 06:54:31 GMT 2024","Sun Jul 21 06:54:39 GMT 2024","7783","tests","Речевые упражнения.","TestCardsRU","","","Select random card from group ""Слова Королёвой"" and compare UI vs BACKEND data.",""
"passed","Sun Jul 21 06:45:03 GMT 2024","Sun Jul 21 06:45:05 GMT 2024","1269","tests","description_page_test","TestDescriptionPage","","","Verify redirection to donate page not authorized user.",""
"passed","Sun Jul 21 06:49:39 GMT 2024","Sun Jul 21 06:49:39 GMT 2024","121","tests","main_page_test","TestMainPage","","","Verify redirection to description page not authorized user.",""
"passed","Sun Jul 21 06:49:48 GMT 2024","Sun Jul 21 06:49:49 GMT 2024","949","tests","main_page_test","TestMainPage","","","Verify redirection to donate page not authorized user.",""
"skipped","Sun Jul 21 06:57:34 GMT 2024","Sun Jul 21 06:57:40 GMT 2024","5578","tests","Речевые упражнения.","TestCardsRU","","","Solutions to a random task in the ""Слова"" group and comparison of statics.",""
"passed","Sun Jul 21 06:49:04 GMT 2024","Sun Jul 21 06:49:05 GMT 2024","728","tests","header_test","TestHeaderPage","","","Verify presence, visibility, clickability, href, status code  
                             of the 'Logo' link in the section 1 in the Header",""
"passed","Sun Jul 21 06:58:06 GMT 2024","Sun Jul 21 06:58:07 GMT 2024","237","tests","used_resources_page_test","TestUsedResourcesPage","","","Verify value of the title of the tab",""
"passed","Sun Jul 21 06:46:00 GMT 2024","Sun Jul 21 06:46:04 GMT 2024","3509","tests","footer_test","TestFooter","","","Verify accuracy of texts in Footer on each page specified in the kit",""
"passed","Sun Jul 21 06:44:40 GMT 2024","Sun Jul 21 06:44:41 GMT 2024","707","tests","contributors_page_test","TestContributorsPage","","","Verify presence, visibility, clickability, href of links in the section",""
"passed","Sun Jul 21 06:51:50 GMT 2024","Sun Jul 21 06:51:50 GMT 2024","367","tests","specialists_page_test","TestSpecialistsPage","","","Verify presence, visibility of the title, text, link, grid, cards and images  
        on the 2nd, 3rd, 5th, 6th levels of nesting on the page",""
"passed","Sun Jul 21 06:53:11 GMT 2024","Sun Jul 21 06:53:11 GMT 2024","39","tests","start_unauthorized_page_test","TestStartUnauthorizedPage","","","Verify text in the 'Login' link in the section 1",""
"passed","Sun Jul 21 06:55:31 GMT 2024","Sun Jul 21 06:55:40 GMT 2024","9004","tests","Речевые упражнения.","TestCardsRU","","","Select a random card from ""Слова с частотной группировкой"" group and compare UI vs BACKEND data.",""
"passed","Sun Jul 21 06:52:00 GMT 2024","Sun Jul 21 06:52:00 GMT 2024","38","tests","specialists_page_test","TestSpecialistsPage","","","Verify value of title with tag 'h2' on the page",""
"passed","Sun Jul 21 06:45:16 GMT 2024","Sun Jul 21 06:45:18 GMT 2024","1556","tests","description_page_test","TestDescriptionPage","","","Verify redirection to github not authorized user.",""
"passed","Sun Jul 21 06:48:23 GMT 2024","Sun Jul 21 06:48:23 GMT 2024","47","tests","footer_test","TestFooter","","","Verify visible sizes of the JETBRAINS link's image in Footer",""
"passed","Sun Jul 21 06:45:38 GMT 2024","Sun Jul 21 06:45:41 GMT 2024","2787","tests","footer_test","TestFooter","","","Verify presence and visibility of Footer on each page specified in the kit",""
"passed","Sun Jul 21 06:49:00 GMT 2024","Sun Jul 21 06:49:00 GMT 2024","38","tests","header_test","TestHeaderPage","","","Verify the section with the 'ru' and 'en' buttons in the Header",""
"passed","Sun Jul 21 06:50:36 GMT 2024","Sun Jul 21 06:50:40 GMT 2024","4188","tests","registration_page_test","TestRegistrationPage","","","Check registration with new email",""
"passed","Sun Jul 21 06:50:53 GMT 2024","Sun Jul 21 06:50:53 GMT 2024","646","tests","registration_page_test","TestRegistrationPage","","","Check registration with new email and empty password",""
"passed","Sun Jul 21 06:48:30 GMT 2024","Sun Jul 21 06:48:30 GMT 2024","69","tests","footer_test","TestFooter","","","Verify presence, visibility and accuracy of the REG.RU link's image in Footer",""
"passed","Sun Jul 21 06:48:12 GMT 2024","Sun Jul 21 06:48:12 GMT 2024","46","tests","footer_test","TestFooter","","","Verify visible sizes of the EPAM link's image in Footer",""
"passed","Sun Jul 21 06:49:52 GMT 2024","Sun Jul 21 06:49:52 GMT 2024","150","tests","main_page_test","TestMainPage","","","Verify redirection to contacts page not authorized user.",""
"passed","Sun Jul 21 06:50:21 GMT 2024","Sun Jul 21 06:50:32 GMT 2024","11503","tests","profile_page_test","TestProfilePage","","","Change the password by receiving an email link",""
"passed","Sun Jul 21 06:49:25 GMT 2024","Sun Jul 21 06:49:26 GMT 2024","1234","tests","header_test","TestHeaderPage","","","Verify if the 'About' and the 'Telegram' links in the Section 2 
                          lead to the correct pages after click",""
"passed","Sun Jul 21 06:48:45 GMT 2024","Sun Jul 21 06:48:45 GMT 2024","47","tests","footer_test","TestFooter","","","Verify visible sizes of the Selectel link's image in Footer",""
"passed","Sun Jul 21 06:46:15 GMT 2024","Sun Jul 21 06:46:15 GMT 2024","252","tests","footer_test","TestFooter","","","Verify presence, visibility, clickability, href, status code of the EPAM link in Footer",""
"passed","Sun Jul 21 06:48:56 GMT 2024","Sun Jul 21 06:48:56 GMT 2024","288","tests","header_test","TestHeaderPage","","","Verify the composition and visibility of elements on the 1-6th levels of the Header",""
"passed","Sun Jul 21 06:47:09 GMT 2024","Sun Jul 21 06:47:40 GMT 2024","30239","tests","footer_test","TestFooter","","","Verify that the REG.RU link in Footer leads to the correct page after click",""
"passed","Sun Jul 21 06:44:36 GMT 2024","Sun Jul 21 06:44:37 GMT 2024","394","tests","contributors_page_test","TestContributorsPage","","","Verify text in links in card links",""
"passed","Sun Jul 21 06:53:00 GMT 2024","Sun Jul 21 06:53:00 GMT 2024","12","tests","start_unauthorized_page_test","TestStartUnauthorizedPage","","","Verify value of the title of the tab",""
"passed","Sun Jul 21 06:46:45 GMT 2024","Sun Jul 21 06:46:48 GMT 2024","2517","tests","footer_test","TestFooter","","","Verify that the ARASAAC link in Footer leads to the correct page after click",""
"passed","Sun Jul 21 06:46:38 GMT 2024","Sun Jul 21 06:46:42 GMT 2024","3443","tests","footer_test","TestFooter","","","Verify Footer invisibility through the modal window with the exercise",""
"passed","Sun Jul 21 06:45:26 GMT 2024","Sun Jul 21 06:45:26 GMT 2024","144","tests","description_page_test","TestDescriptionPage","","","Verify redirection to used resources page not authorized user.",""
"passed","Sun Jul 21 06:47:43 GMT 2024","Sun Jul 21 06:47:49 GMT 2024","6179","tests","footer_test","TestFooter","","","Verify that the SELECTEL link in Footer leads to the correct page after click",""
"passed","Sun Jul 21 06:49:56 GMT 2024","Sun Jul 21 06:49:57 GMT 2024","646","tests","main_page_test","TestMainPage","","","Verify redirection to specialists page not authorized user.",""
"passed","Sun Jul 21 06:45:30 GMT 2024","Sun Jul 21 06:45:33 GMT 2024","2653","tests","footer_test","TestFooter","","","Verify presence and visibility of Footer on each page specified in the kit",""
"passed","Sun Jul 21 06:48:01 GMT 2024","Sun Jul 21 06:48:01 GMT 2024","49","tests","footer_test","TestFooter","","","Verify visible sizes of the ARASAAC link's image in Footer",""
"passed","Sun Jul 21 06:49:08 GMT 2024","Sun Jul 21 06:49:08 GMT 2024","101","tests","header_test","TestHeaderPage","","","Verify that the 'Logo' link on the Start Unauthorized Page 
                             doesn't refresh the current page or lead to other pages after clicking",""
"passed","Sun Jul 21 06:45:34 GMT 2024","Sun Jul 21 06:45:37 GMT 2024","2886","tests","footer_test","TestFooter","","","Verify presence and visibility of Footer on each page specified in the kit",""
"passed","Sun Jul 21 06:47:53 GMT 2024","Sun Jul 21 06:47:53 GMT 2024","82","tests","footer_test","TestFooter","","","Verify that the Contact us link in Footer calls an email client",""
"passed","Sun Jul 21 06:50:00 GMT 2024","Sun Jul 21 06:50:02 GMT 2024","1431","tests","main_page_test","TestMainPage","","","Verify redirection to github not authorized user.",""
"passed","Sun Jul 21 06:48:38 GMT 2024","Sun Jul 21 06:48:38 GMT 2024","84","tests","footer_test","TestFooter","","","Verify changes of visible sizes of the REG.RU link's image in Footer",""
"passed","Sun Jul 21 06:50:17 GMT 2024","Sun Jul 21 06:50:17 GMT 2024","103","tests","main_page_test","TestMainPage","","","Checking the clickability of the Registration button.",""
"passed","Sun Jul 21 06:51:06 GMT 2024","Sun Jul 21 06:51:07 GMT 2024","635","tests","registration_page_test","TestRegistrationPage","","","Check registration with new email and empty email",""
"passed","Sun Jul 21 06:44:21 GMT 2024","Sun Jul 21 06:44:21 GMT 2024","13","tests","contributors_page_test","TestContributorsPage","","","Verify value of the title of the tab",""
"passed","Sun Jul 21 06:58:00 GMT 2024","Sun Jul 21 06:58:01 GMT 2024","857","tests","used_resources_page_test","TestUsedResourcesPage","","","Verify the composition and visibility of elements 
            on the 1st-4th levels of nesting on the page",""
"passed","Sun Jul 21 06:43:08 GMT 2024","Sun Jul 21 06:43:09 GMT 2024","1062","tests","authorisation_page_test","TestAuthorizedUserPage","","","Checking the possibility of authorization with the correct data",""
"passed","Sun Jul 21 06:48:08 GMT 2024","Sun Jul 21 06:48:08 GMT 2024","72","tests","footer_test","TestFooter","","","Verify presence, visibility and accuracy of the EPAM link's image in Footer",""
"passed","Sun Jul 21 06:49:43 GMT 2024","Sun Jul 21 06:49:44 GMT 2024","1107","tests","main_page_test","TestMainPage","","","Verify redirection to telegram page not authorized user.",""
"passed","Sun Jul 21 06:52:53 GMT 2024","Sun Jul 21 06:52:53 GMT 2024","86","tests","start_unauthorized_page_test","TestStartUnauthorizedPage","","","Verify the composition and visibility of elements 
        on the 1st-3rd levels of nesting in the section 1",""
"passed","Sun Jul 21 06:44:16 GMT 2024","Sun Jul 21 06:44:17 GMT 2024","1620","tests","contributors_page_test","TestContributorsPage","","","Verify presence, visibility of titles/subtitles, cards, descriptions, links, images on the page",""
"passed","Sun Jul 21 06:43:52 GMT 2024","Sun Jul 21 06:43:52 GMT 2024","29","tests","contacts_page_test","TestContactsPage","","","Verify text in links in the section 2",""
"passed","Sun Jul 21 06:53:15 GMT 2024","Sun Jul 21 06:53:16 GMT 2024","610","tests","start_unauthorized_page_test","TestStartUnauthorizedPage","","","Verify presence, visibility, clickability, href, status code 
                         of the 'Login' link in the section 1",""
"passed","Sun Jul 21 06:43:28 GMT 2024","Sun Jul 21 06:43:28 GMT 2024","139","tests","contacts_page_test","TestContactsPage","","","Verify the composition and visibility of elements 
        on the 1st-5th levels of nesting in the section 2",""
"passed","Sun Jul 21 06:52:14 GMT 2024","Sun Jul 21 06:52:14 GMT 2024","47","tests","specialists_page_test","TestSpecialistsPage","","","Verify text in the 'All Specialists' link",""
"passed","Sun Jul 21 06:57:04 GMT 2024","Sun Jul 21 06:57:28 GMT 2024","24023","tests","Речевые упражнения.","TestCardsRU","","","Solutions to a random task in the ""Слова Королёвой"" .",""
"passed","Sun Jul 21 06:48:34 GMT 2024","Sun Jul 21 06:48:34 GMT 2024","48","tests","footer_test","TestFooter","","","Verify visible sizes of the REG.RU link's image in Footer",""
"passed","Sun Jul 21 06:45:08 GMT 2024","Sun Jul 21 06:45:08 GMT 2024","143","tests","description_page_test","TestDescriptionPage","","","Verify redirection to contacts page not authorized user.",""
"passed","Sun Jul 21 06:45:56 GMT 2024","Sun Jul 21 06:45:59 GMT 2024","2740","tests","footer_test","TestFooter","","","Verify presence and visibility of Footer on each page specified in the kit",""
"passed","Sun Jul 21 06:53:19 GMT 2024","Sun Jul 21 06:53:19 GMT 2024","127","tests","start_unauthorized_page_test","TestStartUnauthorizedPage","","","Verify that the 'Login' link leads to the correct page after clicking",""
"passed","Sun Jul 21 06:58:33 GMT 2024","Sun Jul 21 06:58:35 GMT 2024","2326","tests","used_resources_page_test","TestUsedResourcesPage","","","Verify presence, visibility, clickability, href, status code of links in the sections",""
"passed","Sun Jul 21 06:58:56 GMT 2024","Sun Jul 21 06:58:57 GMT 2024","805","tests","used_resources_page_test","TestUsedResourcesPage","","","Verify sizes of icons in the sections",""
"passed","Sun Jul 21 06:43:56 GMT 2024","Sun Jul 21 06:43:57 GMT 2024","791","tests","contacts_page_test","TestContactsPage","","","Verify presence, visibility, clickability, href, prefix, status code of links in the section 2",""
"passed","Sun Jul 21 06:58:41 GMT 2024","Sun Jul 21 06:58:43 GMT 2024","1885","tests","used_resources_page_test","TestUsedResourcesPage","","","Verify that links in the sections lead to the correct pages after clicking",""
"passed","Sun Jul 21 06:49:17 GMT 2024","Sun Jul 21 06:49:17 GMT 2024","97","tests","header_test","TestHeaderPage","","","Verify presence, visibility, attributes and sizes of the 'Logo' image",""
"passed","Sun Jul 21 06:44:49 GMT 2024","Sun Jul 21 06:44:50 GMT 2024","1457","tests","contributors_page_test","TestContributorsPage","","","Verify attribute values and sizes of images in contributors cards in the grid",""
"passed","Sun Jul 21 06:51:40 GMT 2024","Sun Jul 21 06:51:40 GMT 2024","33","tests","specialists_page_test","TestSpecialistsPage","","","Verify presence and visibility of content on the page",""
"passed","Sun Jul 21 06:45:53 GMT 2024","Sun Jul 21 06:45:55 GMT 2024","2683","tests","footer_test","TestFooter","","","Verify presence and visibility of Footer on each page specified in the kit",""
"passed","Sun Jul 21 06:45:27 GMT 2024","Sun Jul 21 06:45:29 GMT 2024","2706","tests","footer_test","TestFooter","","","Verify presence and visibility of Footer on each page specified in the kit",""
"passed","Sun Jul 21 06:43:38 GMT 2024","Sun Jul 21 06:43:38 GMT 2024","11","tests","contacts_page_test","TestContactsPage","","","Verify value of the title of the tab",""
"passed","Sun Jul 21 06:49:30 GMT 2024","Sun Jul 21 06:49:30 GMT 2024","25","tests","header_test","TestHeaderPage","","","Verify values of the text in the 'About' and the 'Telegram' links 
                          in the Section 2 in the Header",""
"passed","Sun Jul 21 06:45:42 GMT 2024","Sun Jul 21 06:45:44 GMT 2024","2647","tests","footer_test","TestFooter","","","Verify presence and visibility of Footer on each page specified in the kit",""
"passed","Sun Jul 21 06:45:49 GMT 2024","Sun Jul 21 06:45:52 GMT 2024","2787","tests","footer_test","TestFooter","","","Verify presence and visibility of Footer on each page specified in the kit",""
"passed","Sun Jul 21 06:49:36 GMT 2024","Sun Jul 21 06:49:36 GMT 2024","3","tests","login_page_test","TestLoginPage","","","Test for authorization customer.",""
"passed","Sun Jul 21 06:52:31 GMT 2024","Sun Jul 21 06:52:32 GMT 2024","1568","tests","specialists_page_test","TestSpecialistsPage","","","Verify that the 'All Specialists' link leads an authorized user 
                         to the correct page after clicking",""
"passed","Sun Jul 21 06:47:01 GMT 2024","Sun Jul 21 06:47:06 GMT 2024","5122","tests","footer_test","TestFooter","","","Verify that the JETBRAINS link in Footer leads to the correct page after click",""
"passed","Sun Jul 21 06:50:05 GMT 2024","Sun Jul 21 06:50:06 GMT 2024","646","tests","main_page_test","TestMainPage","","","Verify redirection to contributors page not authorized user.",""
"passed","Sun Jul 21 06:50:13 GMT 2024","Sun Jul 21 06:50:13 GMT 2024","84","tests","main_page_test","TestMainPage","","","Checking the clickability of the Start button.",""
"passed","Sun Jul 21 06:44:02 GMT 2024","Sun Jul 21 06:44:03 GMT 2024","1149","tests","contacts_page_test","TestContactsPage","","","Verify if links in the section 2 lead to the correct pages after clicking",""
"passed","Sun Jul 21 06:43:47 GMT 2024","Sun Jul 21 06:43:47 GMT 2024","30","tests","contacts_page_test","TestContactsPage","","","Verify content of the text in the section 2",""
"passed","Sun Jul 21 06:48:49 GMT 2024","Sun Jul 21 06:48:49 GMT 2024","82","tests","footer_test","TestFooter","","","Verify changes of visible sizes of the Selectel link's image in Footer",""
"passed","Sun Jul 21 06:54:01 GMT 2024","Sun Jul 21 06:54:10 GMT 2024","8925","tests","Speech exercises EN.","TestCardsEN","","","Select a random card from ""Similar phrases"" group and compare UI vs BACKEND data",""
"passed","Sun Jul 21 06:53:08 GMT 2024","Sun Jul 21 06:53:08 GMT 2024","69","tests","start_unauthorized_page_test","TestStartUnauthorizedPage","","","Verify content of the text in sections 1, 2",""
"passed","Sun Jul 21 06:50:09 GMT 2024","Sun Jul 21 06:50:09 GMT 2024","148","tests","main_page_test","TestMainPage","","","Verify redirection to used resources page not authorized user.",""
"passed","Sun Jul 21 06:46:19 GMT 2024","Sun Jul 21 06:46:19 GMT 2024","161","tests","footer_test","TestFooter","","","Verify presence, visibility, clickability, href, status code of the JETBRAINS link in Footer",""
"passed","Sun Jul 21 06:57:46 GMT 2024","Sun Jul 21 06:57:47 GMT 2024","1351","tests","Statistic.","TestCardsRU","","","Check statistic table.",""
"passed","Sun Jul 21 06:44:25 GMT 2024","Sun Jul 21 06:44:25 GMT 2024","40","tests","contributors_page_test","TestContributorsPage","","","Verify values of title and subtitles with tags hw, h3 on the page",""
"passed","Sun Jul 21 06:44:58 GMT 2024","Sun Jul 21 06:44:59 GMT 2024","1101","tests","description_page_test","TestDescriptionPage","","","Verify redirection to telegram page not authorized user.",""
"passed","Sun Jul 21 06:44:29 GMT 2024","Sun Jul 21 06:44:29 GMT 2024","18","tests","contributors_page_test","TestContributorsPage","","","Verify content of the text on the page",""
"passed","Sun Jul 21 06:43:33 GMT 2024","Sun Jul 21 06:43:33 GMT 2024","162","tests","contacts_page_test","TestContactsPage","","","Verify presence, visibility of sections, the dividing line and elements with text on the page",""
"passed","Sun Jul 21 06:58:26 GMT 2024","Sun Jul 21 06:58:27 GMT 2024","762","tests","used_resources_page_test","TestUsedResourcesPage","","","Verify text in links in the sections",""
"passed","Sun Jul 21 06:51:55 GMT 2024","Sun Jul 21 06:51:55 GMT 2024","12","tests","specialists_page_test","TestSpecialistsPage","","","Verify value of the title of the tab",""
"passed","Sun Jul 21 06:44:07 GMT 2024","Sun Jul 21 06:44:07 GMT 2024","37","tests","contributors_page_test","TestContributorsPage","","","Verify presence, visibility and structure of content on the page",""
"passed","Sun Jul 21 06:53:47 GMT 2024","Sun Jul 21 06:53:55 GMT 2024","7976","tests","Speech exercises EN.","TestCardsEN","","","Check progres-bar and buttons.",""
"passed","Sun Jul 21 06:46:27 GMT 2024","Sun Jul 21 06:46:28 GMT 2024","1148","tests","footer_test","TestFooter","","","Verify presence, visibility, clickability, href, status code of the Selectel link in Footer",""
"passed","Sun Jul 21 06:45:21 GMT 2024","Sun Jul 21 06:45:22 GMT 2024","639","tests","description_page_test","TestDescriptionPage","","","Verify redirection to contributors page not authorized user.",""
