"Status","Start Time","Stop Time","Duration in ms","Parent Suite","Suite","Sub Suite","Test Class","Test Method","Name","Description"
"passed","Sun Jul 21 06:50:57 GMT 2024","Sun Jul 21 06:50:58 GMT 2024","637","tests","registration_page_test","TestRegistrationPage","","","Check registration with new email and empty first name",""
"passed","Sun Jul 21 06:52:05 GMT 2024","Sun Jul 21 06:52:05 GMT 2024","39","tests","specialists_page_test","TestSpecialistsPage","","","Verify value of text on the page",""
"passed","Sun Jul 21 06:54:16 GMT 2024","Sun Jul 21 06:54:25 GMT 2024","9403","tests","Речевые упражнения.","TestCardsRU","","","Select random card from group ""Слова"" and compare UI vs BACKEND data.",""
"passed","Sun Jul 21 06:53:23 GMT 2024","Sun Jul 21 06:53:23 GMT 2024","79","tests","start_unauthorized_page_test","TestStartUnauthorizedPage","","","Verify presence, visibility and attributes of the image in the section 1",""
"passed","Sun Jul 21 06:52:57 GMT 2024","Sun Jul 21 06:52:57 GMT 2024","122","tests","start_unauthorized_page_test","TestStartUnauthorizedPage","","","Verify the composition and visibility of elements 
        on the 1st-3rd levels of nesting in the section 2",""
"passed","Sun Jul 21 06:58:13 GMT 2024","Sun Jul 21 06:58:13 GMT 2024","776","tests","used_resources_page_test","TestUsedResourcesPage","","","Verify value of title with tag 'h1' on the page",""
"passed","Sun Jul 21 06:43:23 GMT 2024","Sun Jul 21 06:43:23 GMT 2024","20","tests","contacts_page_test","TestContactsPage","","","Verify the composition and visibility of elements on the 1st level of nesting in the section 1",""
"passed","Sun Jul 21 06:44:54 GMT 2024","Sun Jul 21 06:44:54 GMT 2024","118","tests","description_page_test","TestDescriptionPage","","","Verify return main page from description page.",""
"passed","Sun Jul 21 06:55:01 GMT 2024","Sun Jul 21 06:55:10 GMT 2024","9420","tests","Речевые упражнения.","TestCardsRU","","","Select a random card from ""Группа слов"" group and compare UI vs BACKEND data.",""
"passed","Sun Jul 21 06:50:48 GMT 2024","Sun Jul 21 06:50:49 GMT 2024","633","tests","registration_page_test","TestRegistrationPage","","","Check registration with new email and empty confirm password",""
"passed","Sun Jul 21 06:48:52 GMT 2024","Sun Jul 21 06:48:52 GMT 2024","33","tests","header_test","TestHeaderPage","","","Verify presence and visibility of content in the Header",""
"passed","Sun Jul 21 06:46:52 GMT 2024","Sun Jul 21 06:46:57 GMT 2024","5307","tests","footer_test","TestFooter","","","Verify that the EPAM link in Footer leads to the correct page after click",""
"passed","Sun Jul 21 06:44:45 GMT 2024","Sun Jul 21 06:44:45 GMT 2024","658","tests","contributors_page_test","TestContributorsPage","","","Verify href, status code, text of the 'All Team' link on the page",""
"passed","Sun Jul 21 06:48:04 GMT 2024","Sun Jul 21 06:48:04 GMT 2024","82","tests","footer_test","TestFooter","","","Verify changes of visible sizes of the ARASAAC link's image in Footer",""
"passed","Sun Jul 21 06:50:44 GMT 2024","Sun Jul 21 06:50:45 GMT 2024","1170","tests","registration_page_test","TestRegistrationPage","","","Check registration with an existing email",""
"passed","Sun Jul 21 06:58:49 GMT 2024","Sun Jul 21 06:58:50 GMT 2024","792","tests","used_resources_page_test","TestUsedResourcesPage","","","Verify presence, visibility and attributes of icons in the sections",""
"passed","Sun Jul 21 06:53:27 GMT 2024","Sun Jul 21 06:53:27 GMT 2024","56","tests","start_unauthorized_page_test","TestStartUnauthorizedPage","","","Verify size of the image in the section 1",""
"passed","Sun Jul 21 06:48:41 GMT 2024","Sun Jul 21 06:48:41 GMT 2024","71","tests","footer_test","TestFooter","","","Verify presence, visibility and accuracy of the Selectel link's image in Footer",""
"passed","Sun Jul 21 06:49:20 GMT 2024","Sun Jul 21 06:49:22 GMT 2024","1094","tests","header_test","TestHeaderPage","","","Verify presence, visibility, clickability, href, status code of the 'About' and the 'Telegram' links in the Section 2 in the Header",""
"passed","Sun Jul 21 06:51:10 GMT 2024","Sun Jul 21 06:51:11 GMT 2024","610","tests","registration_page_test","TestRegistrationPage","","","Check registration without choosing gender",""
"passed","Sun Jul 21 06:43:13 GMT 2024","Sun Jul 21 06:43:14 GMT 2024","861","tests","authorisation_page_test","TestAuthorizedUserPage","","","Checking the possibility of authorization with incorrect data",""
"passed","Sun Jul 21 06:45:12 GMT 2024","Sun Jul 21 06:45:13 GMT 2024","638","tests","description_page_test","TestDescriptionPage","","","Verify redirection to specialists page not authorized user.",""
"passed","Sun Jul 21 06:52:42 GMT 2024","Sun Jul 21 06:52:42 GMT 2024","154","tests","specialists_page_test","TestSpecialistsPage","","","Verify sizes of images in specialist cards in the grid",""
"passed","Sun Jul 21 06:48:19 GMT 2024","Sun Jul 21 06:48:19 GMT 2024","71","tests","footer_test","TestFooter","","","Verify presence, visibility and accuracy of the JETBRAINS link's image in Footer",""
