"Status","Start Time","Stop Time","Duration in ms","Parent Suite","Suite","Sub Suite","Test Class","Test Method","Name","Description"
"passed","Sat Oct 04 21:48:58 GMT 2025","Sat Oct 04 21:48:59 GMT 2025","721","tests","registration_page_test","TestRegistrationPage","","","Check registration without choosing gender",""
"passed","Sat Oct 04 21:52:44 GMT 2025","Sat Oct 04 21:52:53 GMT 2025","9260","tests","Речевые упражнения.","TestCardsRU","","","Select random card from group ""Слова Королёвой"" and compare UI vs BACKEND data.",""
"passed","Sat Oct 04 21:40:17 GMT 2025","Sat Oct 04 21:40:17 GMT 2025","120","tests","footer_test","TestFooter","","","Verify that the 'Contact us' link in the Footer calls an email client",""
"passed","Sat Oct 04 21:32:42 GMT 2025","Sat Oct 04 21:32:42 GMT 2025","27","tests","exercises_ru_similar_phrases_page_test","TestExercisesRuSimilarPhrasesPage","","","Verify presence and visibility of content on the page",""
"passed","Sat Oct 04 21:37:26 GMT 2025","Sat Oct 04 21:37:28 GMT 2025","1672","tests","exercises_ru_words_page_test","TestExercisesRuWordsPage","","","Verify clickability, href, status code of links in breadcrumbs on the page",""
"passed","Sat Oct 04 21:39:45 GMT 2025","Sat Oct 04 21:39:45 GMT 2025","62","tests","footer_test","TestFooter","","","Verify text in the 'Contact us' link in the Footer",""
"passed","Sat Oct 04 21:31:54 GMT 2025","Sat Oct 04 21:31:55 GMT 2025","1579","tests","description_page_test","TestDescriptionPage","","","Verify redirection to telegram page not authorized user.",""
"passed","Sat Oct 04 21:31:44 GMT 2025","Sat Oct 04 21:31:45 GMT 2025","1215","tests","contributors_page_test","TestContributorsPage","","","Verify sizes of images in contributor cards in grids",""
"passed","Sat Oct 04 21:40:47 GMT 2025","Sat Oct 04 21:40:47 GMT 2025","33","tests","groups_page_test","TestGroupsPage","","","Verify presence and visibility of content on the page",""
"passed","Sat Oct 04 21:37:50 GMT 2025","Sat Oct 04 21:38:13 GMT 2025","23133","tests","exercises_ru_words_page_test","TestExercisesRuWordsPage","","","Verify clickability, titles, href, status code of subgroup links on the page",""
"passed","Sat Oct 04 21:46:18 GMT 2025","Sat Oct 04 21:46:18 GMT 2025","401","tests","header_test","TestHeaderPage","","","Verify user logout after clicking the 'Logout' button in the Header for an authorized user",""
"passed","Sat Oct 04 21:39:36 GMT 2025","Sat Oct 04 21:39:36 GMT 2025","138","tests","footer_test","TestFooter","","","Verify presence, visibility of text, links, images in the Footer",""
"passed","Sat Oct 04 21:44:31 GMT 2025","Sat Oct 04 21:44:31 GMT 2025","51","tests","header_test","TestHeaderPage","","","Verify size of the image in the Logo link in the Header on the Start Unauthorized Page",""
"skipped","Sat Oct 04 21:54:48 GMT 2025","Sat Oct 04 21:54:58 GMT 2025","10383","tests","Речевые упражнения.","TestCardsRU","","","Solutions to a random task in the ""Слова"" group and comparison of statics.",""
"passed","Sat Oct 04 21:32:12 GMT 2025","Sat Oct 04 21:32:13 GMT 2025","695","tests","description_page_test","TestDescriptionPage","","","Verify redirection to specialists page not authorized user.",""
"passed","Sat Oct 04 21:45:10 GMT 2025","Sat Oct 04 21:45:10 GMT 2025","26","tests","header_test","TestHeaderPage","","","Verify presence, visibility of the user name in the Header for an authorized user",""
"passed","Sat Oct 04 21:39:40 GMT 2025","Sat Oct 04 21:39:40 GMT 2025","49","tests","footer_test","TestFooter","","","Verify content of text in the Footer",""
"passed","Sat Oct 04 21:45:18 GMT 2025","Sat Oct 04 21:45:24 GMT 2025","6067","tests","header_test","TestHeaderPage","","","Verify clickability, href, status code of links in the Header for an authorized user",""
"passed","Sat Oct 04 21:35:43 GMT 2025","Sat Oct 04 21:35:43 GMT 2025","45","tests","exercises_ru_similar_phrases_page_test","TestExercisesRuSimilarPhrasesPage","","","Verify attributes of images in links on the page",""
"passed","Sat Oct 04 21:42:12 GMT 2025","Sat Oct 04 21:42:12 GMT 2025","22","tests","groups_page_test","TestGroupsPage","","","Verify title of links on the 'ru' local",""
"passed","Sat Oct 04 21:48:26 GMT 2025","Sat Oct 04 21:48:27 GMT 2025","1288","tests","registration_page_test","TestRegistrationPage","","","Check registration with an existing email",""
"passed","Sat Oct 04 21:51:27 GMT 2025","Sat Oct 04 21:51:27 GMT 2025","63","tests","start_unauthorized_page_test","TestStartUnauthorizedPage","","","Verify size of the image in the section 1",""
"passed","Sat Oct 04 21:30:48 GMT 2025","Sat Oct 04 21:30:48 GMT 2025","36","tests","contributors_page_test","TestContributorsPage","","","Verify presence, visibility and structure of content on the page",""
"passed","Sat Oct 04 21:43:28 GMT 2025","Sat Oct 04 21:43:29 GMT 2025","34","tests","header_test","TestHeaderPage","","","Verify presence and visibility of the Header for an unauthorized user",""
"passed","Sat Oct 04 21:31:14 GMT 2025","Sat Oct 04 21:31:14 GMT 2025","20","tests","contributors_page_test","TestContributorsPage","","","Verify content of the text on the page",""
"passed","Sat Oct 04 21:47:53 GMT 2025","Sat Oct 04 21:48:10 GMT 2025","17216","tests","profile_page_test","TestProfilePage","","","Change the password by receiving an email link",""
"skipped","Sat Oct 04 21:53:33 GMT 2025","Sat Oct 04 21:53:45 GMT 2025","12489","tests","Речевые упражнения.","TestCardsRU","","","Select a random card from ""Предложения"" group and compare UI vs BACKEND data.",""
"passed","Sat Oct 04 21:55:56 GMT 2025","Sat Oct 04 21:55:59 GMT 2025","3693","tests","used_resources_page_test","TestURPage","","","Verify that links in the sections lead to the correct pages after clicking",""
"passed","Sat Oct 04 21:39:31 GMT 2025","Sat Oct 04 21:39:32 GMT 2025","234","tests","footer_test","TestFooter","","","Verify composition and visibility of elements on the 1st-7th levels of nesting in the Footer",""
"passed","Sat Oct 04 21:47:34 GMT 2025","Sat Oct 04 21:47:35 GMT 2025","682","tests","main_page_test","TestMainPage","","","Verify redirection to contributors page not authorized user.",""
"passed","Sat Oct 04 21:55:40 GMT 2025","Sat Oct 04 21:55:40 GMT 2025","39","tests","used_resources_page_test","TestURPage","","","Verify content of the text on the page",""
"passed","Sat Oct 04 21:49:30 GMT 2025","Sat Oct 04 21:49:31 GMT 2025","932","tests","specialists_page_test","TestSpecialistsPage","","","Verify presence, visibility of the title, text, link, grid, cards and images  
        on the 2nd, 3rd, 5th, 6th levels of nesting on the page",""
"passed","Sat Oct 04 21:38:38 GMT 2025","Sat Oct 04 21:38:41 GMT 2025","2903","tests","exercises_ru_words_page_test","TestExercisesRuWordsPage","","","Verify if group links lead to correct pages after clicking",""
"passed","Sat Oct 04 21:32:29 GMT 2025","Sat Oct 04 21:32:29 GMT 2025","189","tests","description_page_test","TestDescriptionPage","","","Verify redirection to used resources page not authorized user.",""
"passed","Sat Oct 04 21:35:09 GMT 2025","Sat Oct 04 21:35:12 GMT 2025","3458","tests","exercises_ru_similar_phrases_page_test","TestExercisesRuSimilarPhrasesPage","","","Verify if group links lead to correct pages after clicking",""
"passed","Sat Oct 04 21:49:47 GMT 2025","Sat Oct 04 21:49:47 GMT 2025","34","tests","specialists_page_test","TestSpecialistsPage","","","Verify value of text on the page",""
"passed","Sat Oct 04 21:49:19 GMT 2025","Sat Oct 04 21:49:20 GMT 2025","30","tests","specialists_page_test","TestSpecialistsPage","","","Verify presence and visibility of content on the page",""
"passed","Sat Oct 04 21:37:04 GMT 2025","Sat Oct 04 21:37:04 GMT 2025","51","tests","exercises_ru_words_page_test","TestExercisesRuWordsPage","","","Verify text in group links on the page",""
"passed","Sat Oct 04 21:33:04 GMT 2025","Sat Oct 04 21:33:04 GMT 2025","176","tests","exercises_ru_similar_phrases_page_test","TestExercisesRuSimilarPhrasesPage","","","Verify presence, visibility of lists on the page",""
"passed","Sat Oct 04 21:56:04 GMT 2025","Sat Oct 04 21:56:04 GMT 2025","61","tests","used_resources_page_test","TestURPage","","","Verify presence, visibility and attributes of icons in sections",""
"passed","Sat Oct 04 21:39:50 GMT 2025","Sat Oct 04 21:39:55 GMT 2025","4509","tests","footer_test","TestFooter","","","Verify clickability, href, prefix and subject, status code of links in the Footer",""
"passed","Sat Oct 04 21:41:04 GMT 2025","Sat Oct 04 21:41:04 GMT 2025","125","tests","groups_page_test","TestGroupsPage","","","Verify presence, visibility of the title, tiles, links, images, subtitles on the page",""
"passed","Sat Oct 04 21:55:35 GMT 2025","Sat Oct 04 21:55:35 GMT 2025","38","tests","used_resources_page_test","TestURPage","","","Verify value of title with tag 'h1' on the page",""
"passed","Sat Oct 04 21:40:56 GMT 2025","Sat Oct 04 21:40:56 GMT 2025","154","tests","groups_page_test","TestGroupsPage","","","Verify composition, visibility of elements on the 1st-6th levels of nesting on the page",""
"passed","Sat Oct 04 21:56:08 GMT 2025","Sat Oct 04 21:56:08 GMT 2025","83","tests","used_resources_page_test","TestURPage","","","Verify sizes of icons in sections",""
"passed","Sat Oct 04 21:30:11 GMT 2025","Sat Oct 04 21:30:11 GMT 2025","20","tests","contacts_page_test","TestContactsPage","","","Verify value of the title of the tab",""
"passed","Sat Oct 04 21:31:18 GMT 2025","Sat Oct 04 21:31:19 GMT 2025","786","tests","contributors_page_test","TestContributorsPage","","","Verify values of the text in card descriptions",""
"passed","Sat Oct 04 21:31:38 GMT 2025","Sat Oct 04 21:31:39 GMT 2025","808","tests","contributors_page_test","TestContributorsPage","","","Verify attribute values of images in contributors cards in grids",""
"passed","Sat Oct 04 21:55:26 GMT 2025","Sat Oct 04 21:55:26 GMT 2025","140","tests","used_resources_page_test","TestURPage","","","Verify the composition and visibility of elements 
        on the 1st-4th levels of nesting on the page",""
"passed","Sat Oct 04 21:41:46 GMT 2025","Sat Oct 04 21:41:46 GMT 2025","30","tests","groups_page_test","TestGroupsPage","","","Verify value of the 'ru' subtitles on the page",""
"passed","Sat Oct 04 21:34:18 GMT 2025","Sat Oct 04 21:34:20 GMT 2025","2008","tests","exercises_ru_similar_phrases_page_test","TestExercisesRuSimilarPhrasesPage","","","Verify clickability, href of links in breadcrumbs on the page",""
"passed","Sat Oct 04 21:50:09 GMT 2025","Sat Oct 04 21:50:10 GMT 2025","646","tests","specialists_page_test","TestSpecialistsPage","","","Verify that the 'All Specialists' link leads an unauthorized user 
                         to the correct page after clicking",""
"broken","Sat Oct 04 21:33:15 GMT 2025","Sat Oct 04 21:33:15 GMT 2025","0","tests","exercises_ru_similar_phrases_page_test","TestExercisesRuSimilarPhrasesPage","","","Verify value of the breadcrumbs on the page",""
"passed","Sat Oct 04 21:41:21 GMT 2025","Sat Oct 04 21:41:21 GMT 2025","10","tests","groups_page_test","TestGroupsPage","","","Verify value of the 'en' title of the tab",""
"passed","Sat Oct 04 21:37:38 GMT 2025","Sat Oct 04 21:37:38 GMT 2025","133","tests","exercises_ru_words_page_test","TestExercisesRuWordsPage","","","Verify clickability, titles, attributes of group links on the page",""
"passed","Sat Oct 04 21:31:49 GMT 2025","Sat Oct 04 21:31:49 GMT 2025","137","tests","description_page_test","TestDescriptionPage","","","Verify return main page from description page.",""
"passed","Sat Oct 04 21:44:12 GMT 2025","Sat Oct 04 21:44:12 GMT 2025","117","tests","header_test","TestHeaderPage","","","Verify that the 'Logo' link on the Start Unauthorized Page 
                             doesn't refresh the current page or lead to other pages after clicking",""
"passed","Sat Oct 04 21:36:53 GMT 2025","Sat Oct 04 21:36:53 GMT 2025","31","tests","exercises_ru_words_page_test","TestExercisesRuWordsPage","","","Verify value of the breadcrumbs on the page",""
"passed","Sat Oct 04 21:36:42 GMT 2025","Sat Oct 04 21:36:42 GMT 2025","11","tests","exercises_ru_words_page_test","TestExercisesRuWordsPage","","","Verify value of the title of the tab",""
"passed","Sat Oct 04 21:42:21 GMT 2025","Sat Oct 04 21:42:21 GMT 2025","22","tests","groups_page_test","TestGroupsPage","","","Verify href of links on the 'ru' local",""
"passed","Sat Oct 04 21:46:25 GMT 2025","Sat Oct 04 21:46:25 GMT 2025","40","tests","header_test","TestHeaderPage","","","Verify presence, visibility and attributes of the image in the Logo link in the Header 
               for an authorized user",""
"passed","Sat Oct 04 21:32:06 GMT 2025","Sat Oct 04 21:32:07 GMT 2025","205","tests","description_page_test","TestDescriptionPage","","","Verify redirection to contacts page not authorized user.",""
"passed","Sat Oct 04 21:35:23 GMT 2025","Sat Oct 04 21:35:31 GMT 2025","7928","tests","exercises_ru_similar_phrases_page_test","TestExercisesRuSimilarPhrasesPage","","","Verify if subgroup links lead to correct pages after clicking",""
"passed","Sat Oct 04 21:30:36 GMT 2025","Sat Oct 04 21:30:38 GMT 2025","1776","tests","contacts_page_test","TestContactsPage","","","Verify if links in the section 2 lead to the correct pages after clicking",""
"passed","Sat Oct 04 21:31:59 GMT 2025","Sat Oct 04 21:32:01 GMT 2025","2032","tests","description_page_test","TestDescriptionPage","","","Verify redirection to donate page not authorized user.",""
"passed","Sat Oct 04 21:45:45 GMT 2025","Sat Oct 04 21:45:47 GMT 2025","2258","tests","header_test","TestHeaderPage","","","Verify if external links in the Header for an authorized user 
            lead to correct pages after click",""
"passed","Sat Oct 04 21:50:40 GMT 2025","Sat Oct 04 21:50:40 GMT 2025","32","tests","start_unauthorized_page_test","TestStartUnauthorizedPage","","","Verify amount and visibility of sections with content on the page",""
"passed","Sat Oct 04 21:36:17 GMT 2025","Sat Oct 04 21:36:19 GMT 2025","1926","tests","exercises_ru_words_page_test","TestExercisesRuWordsPage","","","Verify composition, visibility of elements on the 1st-6th levels of nesting on the page",""
"passed","Sat Oct 04 21:43:44 GMT 2025","Sat Oct 04 21:43:44 GMT 2025","214","tests","header_test","TestHeaderPage","","","Verify values of the text in links, buttons in the Header for an unauthorized user",""
"passed","Sat Oct 04 21:31:23 GMT 2025","Sat Oct 04 21:31:23 GMT 2025","394","tests","contributors_page_test","TestContributorsPage","","","Verify text in card links and the 'All Team' link",""
"passed","Sat Oct 04 21:39:21 GMT 2025","Sat Oct 04 21:39:23 GMT 2025","1313","tests","exercises_ru_words_page_test","TestExercisesRuWordsPage","","","Verify sizes of background-images in links on the page",""
"passed","Sat Oct 04 21:32:52 GMT 2025","Sat Oct 04 21:32:53 GMT 2025","487","tests","exercises_ru_similar_phrases_page_test","TestExercisesRuSimilarPhrasesPage","","","Verify composition, visibility of elements on the 1st-7th levels of nesting on the page",""
"passed","Sat Oct 04 21:42:47 GMT 2025","Sat Oct 04 21:42:51 GMT 2025","3221","tests","groups_page_test","TestGroupsPage","","","Verify if links on the 'en' local lead to correct pages after clicking",""
"passed","Sat Oct 04 21:50:17 GMT 2025","Sat Oct 04 21:50:20 GMT 2025","2643","tests","specialists_page_test","TestSpecialistsPage","","","Verify that the 'All Specialists' link leads an authorized user 
                         to the correct page after clicking",""
"passed","Sat Oct 04 21:47:28 GMT 2025","Sat Oct 04 21:47:30 GMT 2025","1657","tests","main_page_test","TestMainPage","","","Verify redirection to github not authorized user.",""
"passed","Sat Oct 04 21:30:25 GMT 2025","Sat Oct 04 21:30:25 GMT 2025","31","tests","contacts_page_test","TestContactsPage","","","Verify text in links in the section 2",""
"passed","Sat Oct 04 21:49:52 GMT 2025","Sat Oct 04 21:49:52 GMT 2025","123","tests","specialists_page_test","TestSpecialistsPage","","","Verify values of names and professions in specialist cards in the grid",""
"passed","Sat Oct 04 21:40:21 GMT 2025","Sat Oct 04 21:40:21 GMT 2025","78","tests","footer_test","TestFooter","","","Verify attributes of images in links in the Footer",""
"passed","Sat Oct 04 21:55:45 GMT 2025","Sat Oct 04 21:55:45 GMT 2025","34","tests","used_resources_page_test","TestURPage","","","Verify text in links in sections",""
"passed","Sat Oct 04 21:50:59 GMT 2025","Sat Oct 04 21:50:59 GMT 2025","53","tests","start_unauthorized_page_test","TestStartUnauthorizedPage","","","Verify values of titles and subtitles with tags h2, h4 on the page",""
"passed","Sat Oct 04 21:52:28 GMT 2025","Sat Oct 04 21:52:37 GMT 2025","8821","tests","Речевые упражнения.","TestCardsRU","","","Select random card from group ""Слова"" and compare UI vs BACKEND data.",""
"passed","Sat Oct 04 21:51:13 GMT 2025","Sat Oct 04 21:51:13 GMT 2025","776","tests","start_unauthorized_page_test","TestStartUnauthorizedPage","","","Verify presence, visibility, clickability, href, status code 
                         of the 'Login' link in the section 1",""
"passed","Sat Oct 04 21:31:05 GMT 2025","Sat Oct 04 21:31:05 GMT 2025","13","tests","contributors_page_test","TestContributorsPage","","","Verify value of the title of the tab",""
"passed","Sat Oct 04 21:31:33 GMT 2025","Sat Oct 04 21:31:34 GMT 2025","678","tests","contributors_page_test","TestContributorsPage","","","Verify href, status code of the 'All Team' link",""
"passed","Sat Oct 04 21:46:41 GMT 2025","Sat Oct 04 21:46:41 GMT 2025","43","tests","header_test","TestHeaderPage","","","Verify presence, visibility, attributes of icons in the Header for an authorized user",""
"passed","Sat Oct 04 21:47:48 GMT 2025","Sat Oct 04 21:47:48 GMT 2025","126","tests","main_page_test","TestMainPage","","","Checking the clickability of the Registration button.",""
"passed","Sat Oct 04 21:49:25 GMT 2025","Sat Oct 04 21:49:25 GMT 2025","334","tests","specialists_page_test","TestSpecialistsPage","","","Verify the composition and visibility of elements 
        on the 1st-6th levels of nesting on the page",""
"passed","Sat Oct 04 21:32:17 GMT 2025","Sat Oct 04 21:32:19 GMT 2025","1729","tests","description_page_test","TestDescriptionPage","","","Verify redirection to github not authorized user.",""
"passed","Sat Oct 04 21:30:16 GMT 2025","Sat Oct 04 21:30:16 GMT 2025","64","tests","contacts_page_test","TestContactsPage","","","Verify values of the title and subtitles with tags h1, h2 on the page",""
"passed","Sat Oct 04 21:34:07 GMT 2025","Sat Oct 04 21:34:07 GMT 2025","38","tests","exercises_ru_similar_phrases_page_test","TestExercisesRuSimilarPhrasesPage","","","Verify text in cards on the page",""
"passed","Sat Oct 04 21:43:48 GMT 2025","Sat Oct 04 21:43:54 GMT 2025","5601","tests","header_test","TestHeaderPage","","","Verify clickability, href, status code of links in the Header for an unauthorized user",""
"passed","Sat Oct 04 21:29:52 GMT 2025","Sat Oct 04 21:29:52 GMT 2025","43","tests","contacts_page_test","TestContactsPage","","","Verify presence and visibility of content on the page",""
"passed","Sat Oct 04 21:30:05 GMT 2025","Sat Oct 04 21:30:06 GMT 2025","168","tests","contacts_page_test","TestContactsPage","","","Verify presence, visibility of sections, the dividing line and elements with text on the page",""
"passed","Sat Oct 04 21:47:44 GMT 2025","Sat Oct 04 21:47:44 GMT 2025","104","tests","main_page_test","TestMainPage","","","Checking the clickability of the Start button.",""
"passed","Sat Oct 04 21:50:25 GMT 2025","Sat Oct 04 21:50:26 GMT 2025","105","tests","specialists_page_test","TestSpecialistsPage","","","Verify attributes of images in specialist cards in the grid",""
"passed","Sat Oct 04 21:30:30 GMT 2025","Sat Oct 04 21:30:31 GMT 2025","1254","tests","contacts_page_test","TestContactsPage","","","Verify presence, visibility, clickability, href, prefix, status code of links in the section 2",""
"passed","Sat Oct 04 21:46:56 GMT 2025","Sat Oct 04 21:46:56 GMT 2025","3","tests","login_page_test","TestLoginPage","","","Test for authorization customer.",""
"passed","Sat Oct 04 21:29:40 GMT 2025","Sat Oct 04 21:29:41 GMT 2025","1392","tests","authorisation_page_test","TestAuthorizedUserPage","","","Checking the possibility of authorization with the correct data",""
"passed","Sat Oct 04 21:49:42 GMT 2025","Sat Oct 04 21:49:42 GMT 2025","33","tests","specialists_page_test","TestSpecialistsPage","","","Verify value of title with tag 'h2' on the page",""
"passed","Sat Oct 04 21:42:29 GMT 2025","Sat Oct 04 21:42:29 GMT 2025","38","tests","groups_page_test","TestGroupsPage","","","Verify title, href of links on the 'en' local",""
"passed","Sat Oct 04 21:38:25 GMT 2025","Sat Oct 04 21:38:28 GMT 2025","2804","tests","exercises_ru_words_page_test","TestExercisesRuWordsPage","","","Verify if breadcrumbs links lead to correct pages after clicking",""
"passed","Sat Oct 04 21:46:09 GMT 2025","Sat Oct 04 21:46:09 GMT 2025","205","tests","header_test","TestHeaderPage","","","Verify switching of the 'ru', 'en' buttons in the Header for an authorized user",""
"passed","Sat Oct 04 21:48:15 GMT 2025","Sat Oct 04 21:48:21 GMT 2025","6308","tests","registration_page_test","TestRegistrationPage","","","Check registration with new email",""
"passed","Sat Oct 04 21:42:37 GMT 2025","Sat Oct 04 21:42:40 GMT 2025","3296","tests","groups_page_test","TestGroupsPage","","","Verify if links on the 'ru' local lead to correct pages after clicking",""
"passed","Sat Oct 04 21:37:15 GMT 2025","Sat Oct 04 21:37:15 GMT 2025","306","tests","exercises_ru_words_page_test","TestExercisesRuWordsPage","","","Verify text in cards on the page",""
"skipped","Sat Oct 04 21:54:12 GMT 2025","Sat Oct 04 21:54:23 GMT 2025","10269","tests","Речевые упражнения.","TestCardsRU","","","Solutions to a random task in the ""Слова"" .",""
"passed","Sat Oct 04 21:55:50 GMT 2025","Sat Oct 04 21:55:51 GMT 2025","1603","tests","used_resources_page_test","TestURPage","","","Verify presence, visibility, clickability, href, status code of links in sections",""
"passed","Sat Oct 04 21:41:30 GMT 2025","Sat Oct 04 21:41:30 GMT 2025","27","tests","groups_page_test","TestGroupsPage","","","Verify value of the 'ru' title on the page",""
"passed","Sat Oct 04 21:53:00 GMT 2025","Sat Oct 04 21:53:09 GMT 2025","9040","tests","Речевые упражнения.","TestCardsRU","","","Select a random card from ""Похожие фразы"" group and compare UI vs BACKEND data.",""
"passed","Sat Oct 04 21:45:02 GMT 2025","Sat Oct 04 21:45:02 GMT 2025","189","tests","header_test","TestHeaderPage","","","Verify values of the text in links, buttons in the Header for an authorized user",""
"skipped","Sat Oct 04 21:52:10 GMT 2025","Sat Oct 04 21:52:20 GMT 2025","10348","tests","Speech exercises EN.","TestCardsEN","","","Select a random card from ""Similar phrases"" group and compare UI vs BACKEND data",""
"passed","Sat Oct 04 21:29:57 GMT 2025","Sat Oct 04 21:29:57 GMT 2025","23","tests","contacts_page_test","TestContactsPage","","","Verify the composition and visibility of elements on the 1st level of nesting in the section 1",""
"skipped","Sat Oct 04 21:54:30 GMT 2025","Sat Oct 04 21:54:40 GMT 2025","10365","tests","Речевые упражнения.","TestCardsRU","","","Solutions to a random task in the ""Слова Королёвой"" .",""
"passed","Sat Oct 04 21:46:48 GMT 2025","Sat Oct 04 21:46:48 GMT 2025","52","tests","header_test","TestHeaderPage","","","Verify presence, visibility and attributes of the profile avatar in the Header 
               for an authorized user",""
"passed","Sat Oct 04 21:39:59 GMT 2025","Sat Oct 04 21:40:12 GMT 2025","12918","tests","footer_test","TestFooter","","","Verify that links in the Footer lead to correct pages after clicking",""
"passed","Sat Oct 04 21:34:42 GMT 2025","Sat Oct 04 21:34:45 GMT 2025","3288","tests","exercises_ru_similar_phrases_page_test","TestExercisesRuSimilarPhrasesPage","","","Verify clickability, href, status code of subgroup links on the page",""
"passed","Sat Oct 04 21:51:23 GMT 2025","Sat Oct 04 21:51:23 GMT 2025","88","tests","start_unauthorized_page_test","TestStartUnauthorizedPage","","","Verify presence, visibility and attributes of the image in the section 1",""
"passed","Sat Oct 04 21:45:55 GMT 2025","Sat Oct 04 21:45:55 GMT 2025","91","tests","header_test","TestHeaderPage","","","Verify that the Logo link on the Start Authorized Page 
                             doesn't refresh the current page or lead to other pages after clicking",""
"passed","Sat Oct 04 21:30:01 GMT 2025","Sat Oct 04 21:30:01 GMT 2025","142","tests","contacts_page_test","TestContactsPage","","","Verify the composition and visibility of elements 
        on the 1st-5th levels of nesting in the section 2",""
"passed","Sat Oct 04 21:50:49 GMT 2025","Sat Oct 04 21:50:50 GMT 2025","117","tests","start_unauthorized_page_test","TestStartUnauthorizedPage","","","Verify the composition and visibility of elements 
        on the 1st-3rd levels of nesting in the section 2",""
"passed","Sat Oct 04 21:33:15 GMT 2025","Sat Oct 04 21:33:15 GMT 2025","14","tests","exercises_ru_similar_phrases_page_test","TestExercisesRuSimilarPhrasesPage","","","Verify value of the title of the tab",""
"passed","Sat Oct 04 21:30:42 GMT 2025","Sat Oct 04 21:30:43 GMT 2025","100","tests","contacts_page_test","TestContactsPage","","","Verify that the email link calls an email client",""
"passed","Sat Oct 04 21:42:02 GMT 2025","Sat Oct 04 21:42:04 GMT 2025","1329","tests","groups_page_test","TestGroupsPage","","","Verify clickability, status code of links on the page",""
