"Status","Start Time","Stop Time","Duration in ms","Parent Suite","Suite","Sub Suite","Test Class","Test Method","Name","Description"
"passed","Sat Oct 04 21:43:09 GMT 2025","Sat Oct 04 21:43:09 GMT 2025","22","tests","groups_page_test","TestGroupsPage","","","Verify attribute 'alt' of images in links on the 'ru' local",""
"passed","Sat Oct 04 21:46:33 GMT 2025","Sat Oct 04 21:46:33 GMT 2025","52","tests","header_test","TestHeaderPage","","","Verify size of the image in the 'Logo' link in the Header for an authorized user",""
"passed","Sat Oct 04 21:43:34 GMT 2025","Sat Oct 04 21:43:34 GMT 2025","263","tests","header_test","TestHeaderPage","","","Verify composition, visibility of elements on the 1st-6th levels of nesting in the Header
            for an unauthorized user",""
"passed","Sat Oct 04 21:40:26 GMT 2025","Sat Oct 04 21:40:26 GMT 2025","140","tests","footer_test","TestFooter","","","Verify sizes of images in links in the Footer",""
"passed","Sat Oct 04 21:41:54 GMT 2025","Sat Oct 04 21:41:54 GMT 2025","35","tests","groups_page_test","TestGroupsPage","","","Verify value of the 'en' subtitles on the page",""
"passed","Sat Oct 04 21:51:18 GMT 2025","Sat Oct 04 21:51:18 GMT 2025","155","tests","start_unauthorized_page_test","TestStartUnauthorizedPage","","","Verify that the 'Login' link leads to the correct page after clicking",""
"passed","Sat Oct 04 21:34:55 GMT 2025","Sat Oct 04 21:34:58 GMT 2025","2765","tests","exercises_ru_similar_phrases_page_test","TestExercisesRuSimilarPhrasesPage","","","Verify if breadcrumbs links lead to correct pages after clicking",""
"passed","Sat Oct 04 21:50:45 GMT 2025","Sat Oct 04 21:50:45 GMT 2025","101","tests","start_unauthorized_page_test","TestStartUnauthorizedPage","","","Verify the composition and visibility of elements 
        on the 1st-3rd levels of nesting in the section 1",""
"passed","Sat Oct 04 21:30:58 GMT 2025","Sat Oct 04 21:31:01 GMT 2025","2497","tests","contributors_page_test","TestContributorsPage","","","Verify presence, visibility of titles/subtitles, cards, descriptions, links, images on the page",""
"passed","Sat Oct 04 21:47:05 GMT 2025","Sat Oct 04 21:47:06 GMT 2025","1596","tests","main_page_test","TestMainPage","","","Verify redirection to telegram page not authorized user.",""
"passed","Sat Oct 04 21:55:21 GMT 2025","Sat Oct 04 21:55:21 GMT 2025","32","tests","used_resources_page_test","TestURPage","","","Verify presence and visibility of content on the page",""
"passed","Sat Oct 04 21:48:32 GMT 2025","Sat Oct 04 21:48:32 GMT 2025","715","tests","registration_page_test","TestRegistrationPage","","","Check registration with new email and empty confirm password",""
"skipped","Sat Oct 04 21:53:52 GMT 2025","Sat Oct 04 21:54:05 GMT 2025","12438","tests","Речевые упражнения.","TestCardsRU","","","Select a random card from ""Слова с частотной группировкой"" group and compare UI vs BACKEND data.",""
"passed","Sat Oct 04 21:41:13 GMT 2025","Sat Oct 04 21:41:13 GMT 2025","11","tests","groups_page_test","TestGroupsPage","","","Verify value of the 'ru' title of the tab",""
"passed","Sat Oct 04 21:34:30 GMT 2025","Sat Oct 04 21:34:31 GMT 2025","122","tests","exercises_ru_similar_phrases_page_test","TestExercisesRuSimilarPhrasesPage","","","Verify clickability, titles, attributes of group links on the page",""
"passed","Sat Oct 04 21:47:48 GMT 2025","Sat Oct 04 21:47:49 GMT 2025","474","tests","main_page_test","TestMainPage","","","Checking the domain is available",""
"passed","Sat Oct 04 21:44:38 GMT 2025","Sat Oct 04 21:44:38 GMT 2025","35","tests","header_test","TestHeaderPage","","","Verify presence and visibility of the Header for an authorized user",""
"passed","Sat Oct 04 21:51:08 GMT 2025","Sat Oct 04 21:51:08 GMT 2025","40","tests","start_unauthorized_page_test","TestStartUnauthorizedPage","","","Verify text in the 'Login' link in the section 1",""
"passed","Sat Oct 04 21:45:32 GMT 2025","Sat Oct 04 21:45:37 GMT 2025","4816","tests","header_test","TestHeaderPage","","","Verify if internal links in the Header for an authorized user 
            lead to correct pages after click",""
"passed","Sat Oct 04 21:39:10 GMT 2025","Sat Oct 04 21:39:10 GMT 2025","298","tests","exercises_ru_words_page_test","TestExercisesRuWordsPage","","","Verify attributes of images in links on the page",""
"passed","Sat Oct 04 21:43:23 GMT 2025","Sat Oct 04 21:43:23 GMT 2025","65","tests","groups_page_test","TestGroupsPage","","","Verify sizes of images in links on the page",""
"passed","Sat Oct 04 21:51:53 GMT 2025","Sat Oct 04 21:52:01 GMT 2025","8429","tests","Speech exercises EN.","TestCardsEN","","","Check progres-bar and buttons.",""
"passed","Sat Oct 04 21:43:38 GMT 2025","Sat Oct 04 21:43:39 GMT 2025","344","tests","header_test","TestHeaderPage","","","Verify presence, visibility of links, buttons in the Header for an unauthorized user",""
"passed","Sat Oct 04 21:51:04 GMT 2025","Sat Oct 04 21:51:04 GMT 2025","87","tests","start_unauthorized_page_test","TestStartUnauthorizedPage","","","Verify content of the text in sections 1, 2",""
"passed","Sat Oct 04 21:46:02 GMT 2025","Sat Oct 04 21:46:02 GMT 2025","262","tests","header_test","TestHeaderPage","","","Verify the dropdown opens/closes after clicking on the 'More' button in the Header 
               for an authorized user",""
"passed","Sat Oct 04 21:47:39 GMT 2025","Sat Oct 04 21:47:39 GMT 2025","182","tests","main_page_test","TestMainPage","","","Verify redirection to used resources page not authorized user.",""
"passed","Sat Oct 04 21:29:46 GMT 2025","Sat Oct 04 21:29:47 GMT 2025","1001","tests","authorisation_page_test","TestAuthorizedUserPage","","","Checking the possibility of authorization with incorrect data",""
"passed","Sat Oct 04 21:49:59 GMT 2025","Sat Oct 04 21:49:59 GMT 2025","44","tests","specialists_page_test","TestSpecialistsPage","","","Verify text in the 'All Specialists' link",""
"passed","Sat Oct 04 21:35:54 GMT 2025","Sat Oct 04 21:35:55 GMT 2025","133","tests","exercises_ru_similar_phrases_page_test","TestExercisesRuSimilarPhrasesPage","","","Verify sizes of background-images in links on the page",""
"passed","Sat Oct 04 21:50:55 GMT 2025","Sat Oct 04 21:50:55 GMT 2025","13","tests","start_unauthorized_page_test","TestStartUnauthorizedPage","","","Verify value of the title of the tab",""
"passed","Sat Oct 04 21:44:17 GMT 2025","Sat Oct 04 21:44:17 GMT 2025","271","tests","header_test","TestHeaderPage","","","Verify the dropdown opens/closes after clicking on the 'More' button in the Header 
            on the Start Unauthorized Page",""
"passed","Sat Oct 04 21:36:06 GMT 2025","Sat Oct 04 21:36:06 GMT 2025","48","tests","exercises_ru_words_page_test","TestExercisesRuWordsPage","","","Verify presence and visibility of content on the page",""
"passed","Sat Oct 04 21:44:53 GMT 2025","Sat Oct 04 21:44:53 GMT 2025","369","tests","header_test","TestHeaderPage","","","Verify presence, visibility of links, buttons in the Header for an authorized user",""
"passed","Sat Oct 04 21:50:31 GMT 2025","Sat Oct 04 21:50:31 GMT 2025","155","tests","specialists_page_test","TestSpecialistsPage","","","Verify sizes of images in specialist cards in the grid",""
"passed","Sat Oct 04 21:47:00 GMT 2025","Sat Oct 04 21:47:01 GMT 2025","197","tests","main_page_test","TestMainPage","","","Verify redirection to description page not authorized user.",""
"passed","Sat Oct 04 21:53:17 GMT 2025","Sat Oct 04 21:53:25 GMT 2025","8685","tests","Речевые упражнения.","TestCardsRU","","","Select a random card from ""Группа слов"" group and compare UI vs BACKEND data.",""
"passed","Sat Oct 04 21:44:22 GMT 2025","Sat Oct 04 21:44:22 GMT 2025","243","tests","header_test","TestHeaderPage","","","Verify switching of the 'ru', 'en' buttons in the Header on the Start Unauthorized Page",""
"passed","Sat Oct 04 21:48:42 GMT 2025","Sat Oct 04 21:48:43 GMT 2025","719","tests","registration_page_test","TestRegistrationPage","","","Check registration with new email and empty first name",""
"passed","Sat Oct 04 21:30:52 GMT 2025","Sat Oct 04 21:30:54 GMT 2025","1777","tests","contributors_page_test","TestContributorsPage","","","Verify the composition and visibility of elements 
        on the 1st-5th levels of nesting on the page",""
"passed","Sat Oct 04 21:47:12 GMT 2025","Sat Oct 04 21:47:13 GMT 2025","1566","tests","main_page_test","TestMainPage","","","Verify redirection to donate page not authorized user.",""
"passed","Sat Oct 04 21:55:31 GMT 2025","Sat Oct 04 21:55:31 GMT 2025","13","tests","used_resources_page_test","TestURPage","","","Verify value of the title of the tab",""
"passed","Sat Oct 04 21:36:30 GMT 2025","Sat Oct 04 21:36:30 GMT 2025","933","tests","exercises_ru_words_page_test","TestExercisesRuWordsPage","","","Verify presence, visibility of lists on the page",""
"passed","Sat Oct 04 21:49:03 GMT 2025","Sat Oct 04 21:49:14 GMT 2025","10698","tests","registration_page_test","TestRegistrationPage","","","Check registration without choosing agreement",""
"passed","Sat Oct 04 21:44:46 GMT 2025","Sat Oct 04 21:44:46 GMT 2025","295","tests","header_test","TestHeaderPage","","","Verify composition, visibility of elements on the 1st-6th levels of nesting in the Header
            for an authorized user",""
"passed","Sat Oct 04 21:50:36 GMT 2025","Sat Oct 04 21:50:36 GMT 2025","36","tests","start_unauthorized_page_test","TestStartUnauthorizedPage","","","Verify presence and visibility of content on the page",""
"skipped","Sat Oct 04 21:47:49 GMT 2025","Sat Oct 04 21:47:49 GMT 2025","0","tests","main_page_test","TestMainPage","","","Checking the ip is available",""
"passed","Sat Oct 04 21:31:10 GMT 2025","Sat Oct 04 21:31:10 GMT 2025","47","tests","contributors_page_test","TestContributorsPage","","","Verify values of title and subtitles with tags h2, h3 on the page",""
"passed","Sat Oct 04 21:44:05 GMT 2025","Sat Oct 04 21:44:08 GMT 2025","2492","tests","header_test","TestHeaderPage","","","Verify if external links in the Header for an unauthorized user 
            lead to correct pages after click",""
"passed","Sat Oct 04 21:39:27 GMT 2025","Sat Oct 04 21:39:27 GMT 2025","39","tests","footer_test","TestFooter","","","Verify presence and visibility of the Footer",""
"passed","Sat Oct 04 21:48:37 GMT 2025","Sat Oct 04 21:48:38 GMT 2025","779","tests","registration_page_test","TestRegistrationPage","","","Check registration with new email and empty password",""
"passed","Sat Oct 04 21:40:34 GMT 2025","Sat Oct 04 21:40:38 GMT 2025","3953","tests","footer_test","TestFooter","","","Verify Footer invisibility through the modal window with the exercise",""
"passed","Sat Oct 04 21:30:20 GMT 2025","Sat Oct 04 21:30:20 GMT 2025","30","tests","contacts_page_test","TestContactsPage","","","Verify content of the text in the section 2",""
"passed","Sat Oct 04 21:47:18 GMT 2025","Sat Oct 04 21:47:18 GMT 2025","208","tests","main_page_test","TestMainPage","","","Verify redirection to contacts page not authorized user.",""
"passed","Sat Oct 04 21:43:16 GMT 2025","Sat Oct 04 21:43:16 GMT 2025","22","tests","groups_page_test","TestGroupsPage","","","test_gp_04_03_verify_images_alt_en",""
"passed","Sat Oct 04 21:48:52 GMT 2025","Sat Oct 04 21:48:53 GMT 2025","695","tests","registration_page_test","TestRegistrationPage","","","Check registration with new email and empty email",""
"passed","Sat Oct 04 21:31:28 GMT 2025","Sat Oct 04 21:31:28 GMT 2025","719","tests","contributors_page_test","TestContributorsPage","","","Verify clickability, href of links on the page",""
"skipped","Sat Oct 04 21:55:07 GMT 2025","Sat Oct 04 21:55:17 GMT 2025","10256","tests","Statistic.","TestCardsRU","","","Check statistic table.",""
"passed","Sat Oct 04 21:44:27 GMT 2025","Sat Oct 04 21:44:27 GMT 2025","48","tests","header_test","TestHeaderPage","","","Verify presence, visibility and attributes of the image in the Logo link in the Header 
               on the Start Unauthorized Page",""
"passed","Sat Oct 04 21:48:47 GMT 2025","Sat Oct 04 21:48:48 GMT 2025","717","tests","registration_page_test","TestRegistrationPage","","","Check registration with new email and empty birthday",""
"passed","Sat Oct 04 21:32:23 GMT 2025","Sat Oct 04 21:32:24 GMT 2025","1700","tests","description_page_test","TestDescriptionPage","","","Verify redirection to contributors page not authorized user.",""
"skipped","Sat Oct 04 21:51:35 GMT 2025","Sat Oct 04 21:51:45 GMT 2025","10380","tests","Speech exercises EN.","TestCardsEN","","","Select random card from ""Word"" group and compare UI vs BACKEND data",""
"passed","Sat Oct 04 21:41:38 GMT 2025","Sat Oct 04 21:41:38 GMT 2025","29","tests","groups_page_test","TestGroupsPage","","","Verify value of the 'en' title on the page",""
"passed","Sat Oct 04 21:43:58 GMT 2025","Sat Oct 04 21:44:00 GMT 2025","2083","tests","header_test","TestHeaderPage","","","Verify if internal links in the Header for an unauthorized user 
            lead to correct pages after click",""
"passed","Sat Oct 04 21:47:23 GMT 2025","Sat Oct 04 21:47:24 GMT 2025","696","tests","main_page_test","TestMainPage","","","Verify redirection to specialists page not authorized user.",""
"passed","Sat Oct 04 21:50:04 GMT 2025","Sat Oct 04 21:50:04 GMT 2025","516","tests","specialists_page_test","TestSpecialistsPage","","","Verify clickability, href, status code of the 'All Specialists' link",""
"passed","Sat Oct 04 21:49:36 GMT 2025","Sat Oct 04 21:49:36 GMT 2025","11","tests","specialists_page_test","TestSpecialistsPage","","","Verify value of the title of the tab",""
"passed","Sat Oct 04 21:33:54 GMT 2025","Sat Oct 04 21:33:54 GMT 2025","38","tests","exercises_ru_similar_phrases_page_test","TestExercisesRuSimilarPhrasesPage","","","Verify text in group links on the page",""
"passed","Sat Oct 04 21:38:53 GMT 2025","Sat Oct 04 21:38:58 GMT 2025","5099","tests","exercises_ru_words_page_test","TestExercisesRuWordsPage","","","Verify if subgroup links 1-4 lead to correct pages after clicking",""
"passed","Sat Oct 04 21:43:00 GMT 2025","Sat Oct 04 21:43:00 GMT 2025","22","tests","groups_page_test","TestGroupsPage","","","Verify attribute 'src' of images in links on the page",""
