"Status","Start Time","Stop Time","Duration in ms","Parent Suite","Suite","Sub Suite","Test Class","Test Method","Name","Description"
"passed","Sun Dec 08 01:22:13 GMT 2024","Sun Dec 08 01:22:13 GMT 2024","106","tests","specialists_page_test","TestSpecialistsPage","","","Verify attributes of images in specialist cards in the grid",""
"passed","Sun Dec 08 01:22:06 GMT 2024","Sun Dec 08 01:22:07 GMT 2024","1807","tests","specialists_page_test","TestSpecialistsPage","","","Verify that the 'All Specialists' link leads an authorized user 
                         to the correct page after clicking",""
"passed","Sun Dec 08 01:10:34 GMT 2024","Sun Dec 08 01:10:34 GMT 2024","46","tests","footer_test","TestFooter","","","Verify text in the 'Contact us' link in the Footer",""
"passed","Sun Dec 08 01:08:57 GMT 2024","Sun Dec 08 01:08:59 GMT 2024","1609","tests","description_page_test","TestDescriptionPage","","","Verify redirection to donate page not authorized user.",""
"skipped","Sun Dec 08 01:19:21 GMT 2024","Sun Dec 08 01:19:21 GMT 2024","0","tests","main_page_test","TestMainPage","","","Checking the ip is available",""
"passed","Sun Dec 08 01:07:48 GMT 2024","Sun Dec 08 01:07:51 GMT 2024","3668","tests","contributors_page_test","TestContributorsPage","","","Verify presence, visibility of titles/subtitles, cards, descriptions, links, images on the page",""
"passed","Sun Dec 08 01:15:55 GMT 2024","Sun Dec 08 01:15:55 GMT 2024","37","tests","header_test","TestHeaderPage","","","Verify presence and visibility of the Header for an authorized user",""
"passed","Sun Dec 08 01:27:47 GMT 2024","Sun Dec 08 01:28:11 GMT 2024","24060","tests","Речевые упражнения.","TestCardsRU","","","Solutions to a random task in the ""Слова Королёвой"" .",""
"passed","Sun Dec 08 01:18:31 GMT 2024","Sun Dec 08 01:18:31 GMT 2024","189","tests","main_page_test","TestMainPage","","","Verify redirection to description page not authorized user.",""
"passed","Sun Dec 08 01:06:53 GMT 2024","Sun Dec 08 01:06:53 GMT 2024","11","tests","contacts_page_test","TestContactsPage","","","Verify value of the title of the tab",""
"passed","Sun Dec 08 01:07:37 GMT 2024","Sun Dec 08 01:07:37 GMT 2024","38","tests","contributors_page_test","TestContributorsPage","","","Verify presence, visibility and structure of content on the page",""
"passed","Sun Dec 08 01:14:31 GMT 2024","Sun Dec 08 01:14:31 GMT 2024","32","tests","header_test","TestHeaderPage","","","Verify presence and visibility of the Header for an unauthorized user",""
"passed","Sun Dec 08 01:12:39 GMT 2024","Sun Dec 08 01:13:06 GMT 2024","27050","tests","groups_page_test","TestGroupsPage","","","Verify clickability, title, href, status code of links on the page",""
"passed","Sun Dec 08 01:11:59 GMT 2024","Sun Dec 08 01:12:08 GMT 2024","8177","tests","groups_page_test","TestGroupsPage","","","Verify value of the title of the tab",""
"passed","Sun Dec 08 01:29:21 GMT 2024","Sun Dec 08 01:29:24 GMT 2024","2308","tests","used_resources_page_test","TestUsedResourcesPage","","","Verify that links in the sections lead to the correct pages after clicking",""
"passed","Sun Dec 08 01:14:20 GMT 2024","Sun Dec 08 01:14:26 GMT 2024","6062","tests","groups_page_test","TestGroupsPage","","","Verify sizes of images in links on the page",""
"passed","Sun Dec 08 01:06:17 GMT 2024","Sun Dec 08 01:06:18 GMT 2024","1241","tests","authorisation_page_test","TestAuthorizedUserPage","","","Checking the possibility of authorization with the correct data",""
"passed","Sun Dec 08 01:16:02 GMT 2024","Sun Dec 08 01:16:12 GMT 2024","10240","tests","header_test","TestHeaderPage","","","Verify composition, visibility of elements on the 1st-6th levels of nesting in the Header
            for an authorized user",""
"passed","Sun Dec 08 01:16:57 GMT 2024","Sun Dec 08 01:17:11 GMT 2024","14150","tests","header_test","TestHeaderPage","","","Verify if internal links in the Header for an authorized user 
            lead to correct pages after click",""
"passed","Sun Dec 08 01:07:17 GMT 2024","Sun Dec 08 01:07:18 GMT 2024","1162","tests","contacts_page_test","TestContactsPage","","","Verify presence, visibility, clickability, href, prefix, status code of links in the section 2",""
"passed","Sun Dec 08 01:20:15 GMT 2024","Sun Dec 08 01:20:16 GMT 2024","731","tests","registration_page_test","TestRegistrationPage","","","Check registration with new email and empty birthday",""
"passed","Sun Dec 08 01:06:59 GMT 2024","Sun Dec 08 01:06:59 GMT 2024","51","tests","contacts_page_test","TestContactsPage","","","Verify values of the title and subtitles with tags h1, h2 on the page",""
"passed","Sun Dec 08 01:20:32 GMT 2024","Sun Dec 08 01:20:53 GMT 2024","20765","tests","registration_page_test","TestRegistrationPage","","","Check registration without choosing agreement",""
"skipped","Sun Dec 08 01:25:52 GMT 2024","Sun Dec 08 01:26:14 GMT 2024","22570","tests","Речевые упражнения.","TestCardsRU","","","Select a random card from ""Предложения"" group and compare UI vs BACKEND data.",""
"passed","Sun Dec 08 01:17:28 GMT 2024","Sun Dec 08 01:17:28 GMT 2024","110","tests","header_test","TestHeaderPage","","","Verify that the 'Logo' link on the Start Authorized Page 
                             doesn't refresh the current page or lead to other pages after clicking",""
"passed","Sun Dec 08 01:07:24 GMT 2024","Sun Dec 08 01:07:26 GMT 2024","1932","tests","contacts_page_test","TestContactsPage","","","Verify if links in the section 2 lead to the correct pages after clicking",""
"passed","Sun Dec 08 01:15:48 GMT 2024","Sun Dec 08 01:15:48 GMT 2024","50","tests","header_test","TestHeaderPage","","","Verify size of the image in the 'Logo' link in the Header on the Start Unauthorized Page",""
"passed","Sun Dec 08 01:23:14 GMT 2024","Sun Dec 08 01:23:14 GMT 2024","84","tests","start_unauthorized_page_test","TestStartUnauthorizedPage","","","Verify presence, visibility and attributes of the image in the section 1",""
"passed","Sun Dec 08 01:22:24 GMT 2024","Sun Dec 08 01:22:24 GMT 2024","34","tests","start_unauthorized_page_test","TestStartUnauthorizedPage","","","Verify presence and visibility of content on the page",""
"passed","Sun Dec 08 01:22:58 GMT 2024","Sun Dec 08 01:22:58 GMT 2024","40","tests","start_unauthorized_page_test","TestStartUnauthorizedPage","","","Verify text in the 'Login' link in the section 1",""
"passed","Sun Dec 08 01:10:39 GMT 2024","Sun Dec 08 01:10:43 GMT 2024","4028","tests","footer_test","TestFooter","","","Verify clickability, href, prefix and subject, status code of links in the Footer",""
"passed","Sun Dec 08 01:20:10 GMT 2024","Sun Dec 08 01:20:11 GMT 2024","766","tests","registration_page_test","TestRegistrationPage","","","Check registration with new email and empty first name",""
"passed","Sun Dec 08 01:18:59 GMT 2024","Sun Dec 08 01:19:00 GMT 2024","1476","tests","main_page_test","TestMainPage","","","Verify redirection to github not authorized user.",""
