"Status","Start Time","Stop Time","Duration in ms","Parent Suite","Suite","Sub Suite","Test Class","Test Method","Name","Description"
"passed","Sun Dec 08 01:19:15 GMT 2024","Sun Dec 08 01:19:15 GMT 2024","100","tests","main_page_test","TestMainPage","","","Checking the clickability of the Start button.",""
"passed","Sun Dec 08 01:25:36 GMT 2024","Sun Dec 08 01:25:44 GMT 2024","8609","tests","Речевые упражнения.","TestCardsRU","","","Select a random card from ""Группа слов"" group and compare UI vs BACKEND data.",""
"passed","Sun Dec 08 01:14:35 GMT 2024","Sun Dec 08 01:14:46 GMT 2024","10209","tests","header_test","TestHeaderPage","","","Verify composition, visibility of elements on the 1st-6th levels of nesting in the Header
            for an unauthorized user",""
"passed","Sun Dec 08 01:10:15 GMT 2024","Sun Dec 08 01:10:15 GMT 2024","39","tests","footer_test","TestFooter","","","Verify presence and visibility of the Footer",""
"passed","Sun Dec 08 01:28:31 GMT 2024","Sun Dec 08 01:28:32 GMT 2024","1506","tests","Statistic.","TestCardsRU","","","Check statistic table.",""
"passed","Sun Dec 08 01:19:05 GMT 2024","Sun Dec 08 01:19:05 GMT 2024","671","tests","main_page_test","TestMainPage","","","Verify redirection to contributors page not authorized user.",""
"passed","Sun Dec 08 01:19:10 GMT 2024","Sun Dec 08 01:19:10 GMT 2024","175","tests","main_page_test","TestMainPage","","","Verify redirection to used resources page not authorized user.",""
"passed","Sun Dec 08 01:17:50 GMT 2024","Sun Dec 08 01:17:51 GMT 2024","436","tests","header_test","TestHeaderPage","","","Verify user logout after clicking the 'Logout' button in the Header for an authorized user",""
"passed","Sun Dec 08 01:17:58 GMT 2024","Sun Dec 08 01:17:58 GMT 2024","41","tests","header_test","TestHeaderPage","","","Verify presence, visibility and attributes of the image in the 'Logo' link in the Header 
               for an authorized user",""
"passed","Sun Dec 08 01:10:20 GMT 2024","Sun Dec 08 01:10:20 GMT 2024","236","tests","footer_test","TestFooter","","","Verify composition and visibility of elements on the 1st-7th levels of nesting in the Footer",""
"passed","Sun Dec 08 01:06:29 GMT 2024","Sun Dec 08 01:06:29 GMT 2024","27","tests","contacts_page_test","TestContactsPage","","","Verify presence and visibility of content on the page",""
"passed","Sun Dec 08 01:09:26 GMT 2024","Sun Dec 08 01:09:26 GMT 2024","206","tests","description_page_test","TestDescriptionPage","","","Verify redirection to used resources page not authorized user.",""
"passed","Sun Dec 08 01:28:44 GMT 2024","Sun Dec 08 01:28:44 GMT 2024","127","tests","used_resources_page_test","TestUsedResourcesPage","","","Verify the composition and visibility of elements 
        on the 1st-4th levels of nesting on the page",""
"passed","Sun Dec 08 01:19:43 GMT 2024","Sun Dec 08 01:19:48 GMT 2024","5373","tests","registration_page_test","TestRegistrationPage","","","Check registration with new email",""
"passed","Sun Dec 08 01:18:12 GMT 2024","Sun Dec 08 01:18:12 GMT 2024","46","tests","header_test","TestHeaderPage","","","Verify presence, visibility, attributes of icons in the Header for an authorized user",""
"passed","Sun Dec 08 01:20:21 GMT 2024","Sun Dec 08 01:20:21 GMT 2024","723","tests","registration_page_test","TestRegistrationPage","","","Check registration with new email and empty email",""
"passed","Sun Dec 08 01:11:32 GMT 2024","Sun Dec 08 01:11:32 GMT 2024","26","tests","groups_page_test","TestGroupsPage","","","Verify presence and visibility of content on the page",""
"passed","Sun Dec 08 01:11:08 GMT 2024","Sun Dec 08 01:11:08 GMT 2024","76","tests","footer_test","TestFooter","","","Verify attributes of images in links in the Footer",""
"passed","Sun Dec 08 01:22:29 GMT 2024","Sun Dec 08 01:22:29 GMT 2024","32","tests","start_unauthorized_page_test","TestStartUnauthorizedPage","","","Verify amount and visibility of sections with content on the page",""
"skipped","Sun Dec 08 01:28:18 GMT 2024","Sun Dec 08 01:28:24 GMT 2024","5719","tests","Речевые упражнения.","TestCardsRU","","","Solutions to a random task in the ""Слова"" group and comparison of statics.",""
"passed","Sun Dec 08 01:29:08 GMT 2024","Sun Dec 08 01:29:08 GMT 2024","28","tests","used_resources_page_test","TestUsedResourcesPage","","","Verify text in links in sections",""
"passed","Sun Dec 08 01:18:05 GMT 2024","Sun Dec 08 01:18:05 GMT 2024","50","tests","header_test","TestHeaderPage","","","Verify size of the image in the 'Logo' link in the Header for an authorized user",""
"passed","Sun Dec 08 01:09:04 GMT 2024","Sun Dec 08 01:09:04 GMT 2024","188","tests","description_page_test","TestDescriptionPage","","","Verify redirection to contacts page not authorized user.",""
"passed","Sun Dec 08 01:11:03 GMT 2024","Sun Dec 08 01:11:03 GMT 2024","110","tests","footer_test","TestFooter","","","Verify that the 'Contact us' link in the Footer calls an email client",""
"passed","Sun Dec 08 01:21:45 GMT 2024","Sun Dec 08 01:21:45 GMT 2024","44","tests","specialists_page_test","TestSpecialistsPage","","","Verify text in the 'All Specialists' link",""
"passed","Sun Dec 08 01:15:00 GMT 2024","Sun Dec 08 01:15:07 GMT 2024","6893","tests","header_test","TestHeaderPage","","","Verify clickability, href, status code of links in the Header for an unauthorized user",""
"passed","Sun Dec 08 01:15:33 GMT 2024","Sun Dec 08 01:15:33 GMT 2024","269","tests","header_test","TestHeaderPage","","","Verify the dropdown opens/closes after clicking on the 'More' button in the Header 
            on the Start Unauthorized Page",""
"skipped","Sun Dec 08 01:23:25 GMT 2024","Sun Dec 08 01:23:46 GMT 2024","20282","tests","Speech exercises EN.","TestCardsEN","","","Select random card from ""Word"" group and compare UI vs BACKEND data",""
"passed","Sun Dec 08 01:09:48 GMT 2024","Sun Dec 08 01:09:49 GMT 2024","812","tests","exercises_ru_words_page_test","TestExercisesRuWordsPage","","","Verify composition, visibility of elements on the 1st-6th levels of nesting on the page",""
"passed","Sun Dec 08 01:17:19 GMT 2024","Sun Dec 08 01:17:21 GMT 2024","2057","tests","header_test","TestHeaderPage","","","Verify if external links in the Header for an authorized user 
            lead to correct pages after click",""
"passed","Sun Dec 08 01:18:35 GMT 2024","Sun Dec 08 01:18:37 GMT 2024","1947","tests","main_page_test","TestMainPage","","","Verify redirection to telegram page not authorized user.",""
"passed","Sun Dec 08 01:15:38 GMT 2024","Sun Dec 08 01:15:38 GMT 2024","226","tests","header_test","TestHeaderPage","","","Verify switching of the 'ru', 'en' buttons in the Header on the Start Unauthorized Page",""
"passed","Sun Dec 08 01:28:56 GMT 2024","Sun Dec 08 01:28:56 GMT 2024","36","tests","used_resources_page_test","TestUsedResourcesPage","","","Verify value of title with tag 'h1' on the page",""
"passed","Sun Dec 08 01:21:51 GMT 2024","Sun Dec 08 01:21:52 GMT 2024","813","tests","specialists_page_test","TestSpecialistsPage","","","Verify clickability, href, status code of the 'All Specialists' link",""
"passed","Sun Dec 08 01:22:39 GMT 2024","Sun Dec 08 01:22:39 GMT 2024","116","tests","start_unauthorized_page_test","TestStartUnauthorizedPage","","","Verify the composition and visibility of elements 
        on the 1st-3rd levels of nesting in the section 2",""
"passed","Sun Dec 08 01:18:26 GMT 2024","Sun Dec 08 01:18:26 GMT 2024","3","tests","login_page_test","TestLoginPage","","","Test for authorization customer.",""
"passed","Sun Dec 08 01:10:10 GMT 2024","Sun Dec 08 01:10:10 GMT 2024","12","tests","exercises_ru_words_page_test","TestExercisesRuWordsPage","","","Verify value of the title of the tab",""
"passed","Sun Dec 08 01:18:42 GMT 2024","Sun Dec 08 01:18:43 GMT 2024","1385","tests","main_page_test","TestMainPage","","","Verify redirection to donate page not authorized user.",""
"passed","Sun Dec 08 01:22:19 GMT 2024","Sun Dec 08 01:22:20 GMT 2024","154","tests","specialists_page_test","TestSpecialistsPage","","","Verify sizes of images in specialist cards in the grid",""
"passed","Sun Dec 08 01:08:06 GMT 2024","Sun Dec 08 01:08:06 GMT 2024","19","tests","contributors_page_test","TestContributorsPage","","","Verify content of the text on the page",""
"passed","Sun Dec 08 01:06:23 GMT 2024","Sun Dec 08 01:06:24 GMT 2024","1003","tests","authorisation_page_test","TestAuthorizedUserPage","","","Checking the possibility of authorization with incorrect data",""
"skipped","Sun Dec 08 01:23:53 GMT 2024","Sun Dec 08 01:24:13 GMT 2024","20277","tests","Speech exercises EN.","TestCardsEN","","","Check progres-bar and buttons.",""
"passed","Sun Dec 08 01:06:47 GMT 2024","Sun Dec 08 01:06:47 GMT 2024","158","tests","contacts_page_test","TestContactsPage","","","Verify presence, visibility of sections, the dividing line and elements with text on the page",""
"passed","Sun Dec 08 01:09:09 GMT 2024","Sun Dec 08 01:09:09 GMT 2024","673","tests","description_page_test","TestDescriptionPage","","","Verify redirection to specialists page not authorized user.",""
"passed","Sun Dec 08 01:19:20 GMT 2024","Sun Dec 08 01:19:20 GMT 2024","120","tests","main_page_test","TestMainPage","","","Checking the clickability of the Registration button.",""
"passed","Sun Dec 08 01:08:33 GMT 2024","Sun Dec 08 01:08:34 GMT 2024","815","tests","contributors_page_test","TestContributorsPage","","","Verify attribute values of images in contributors cards in grids",""
"passed","Sun Dec 08 01:22:48 GMT 2024","Sun Dec 08 01:22:48 GMT 2024","49","tests","start_unauthorized_page_test","TestStartUnauthorizedPage","","","Verify values of titles and subtitles with tags h2, h4 on the page",""
"passed","Sun Dec 08 01:23:18 GMT 2024","Sun Dec 08 01:23:18 GMT 2024","60","tests","start_unauthorized_page_test","TestStartUnauthorizedPage","","","Verify size of the image in the section 1",""
"passed","Sun Dec 08 01:23:09 GMT 2024","Sun Dec 08 01:23:09 GMT 2024","149","tests","start_unauthorized_page_test","TestStartUnauthorizedPage","","","Verify that the 'Login' link leads to the correct page after clicking",""
"passed","Sun Dec 08 01:07:56 GMT 2024","Sun Dec 08 01:07:56 GMT 2024","13","tests","contributors_page_test","TestContributorsPage","","","Verify value of the title of the tab",""
"passed","Sun Dec 08 01:19:26 GMT 2024","Sun Dec 08 01:19:38 GMT 2024","12819","tests","profile_page_test","TestProfilePage","","","Change the password by receiving an email link",""
"passed","Sun Dec 08 01:11:39 GMT 2024","Sun Dec 08 01:11:42 GMT 2024","3161","tests","groups_page_test","TestGroupsPage","","","Verify composition, visibility of elements on the 1st-6th levels of nesting on the page",""
"passed","Sun Dec 08 01:19:59 GMT 2024","Sun Dec 08 01:20:00 GMT 2024","758","tests","registration_page_test","TestRegistrationPage","","","Check registration with new email and empty confirm password",""
"skipped","Sun Dec 08 01:26:21 GMT 2024","Sun Dec 08 01:26:44 GMT 2024","22692","tests","Речевые упражнения.","TestCardsRU","","","Select a random card from ""Слова с частотной группировкой"" group and compare UI vs BACKEND data.",""
"passed","Sun Dec 08 01:12:16 GMT 2024","Sun Dec 08 01:12:32 GMT 2024","16379","tests","groups_page_test","TestGroupsPage","","","Verify value of the title and subtitles on the page",""
"passed","Sun Dec 08 01:26:52 GMT 2024","Sun Dec 08 01:27:40 GMT 2024","48271","tests","Речевые упражнения.","TestCardsRU","","","Solutions to a random task in the ""Слова"" .",""
"passed","Sun Dec 08 01:16:34 GMT 2024","Sun Dec 08 01:16:34 GMT 2024","26","tests","header_test","TestHeaderPage","","","Verify presence, visibility of the user name in the Header for an authorized user",""
"passed","Sun Dec 08 01:13:39 GMT 2024","Sun Dec 08 01:13:58 GMT 2024","18273","tests","groups_page_test","TestGroupsPage","","","Verify if links on the 'en' local lead to correct pages after clicking",""
"passed","Sun Dec 08 01:24:48 GMT 2024","Sun Dec 08 01:24:56 GMT 2024","8596","tests","Речевые упражнения.","TestCardsRU","","","Select random card from group ""Слова"" and compare UI vs BACKEND data.",""
"passed","Sun Dec 08 01:10:29 GMT 2024","Sun Dec 08 01:10:29 GMT 2024","44","tests","footer_test","TestFooter","","","Verify content of text in the Footer",""
"passed","Sun Dec 08 01:20:04 GMT 2024","Sun Dec 08 01:20:05 GMT 2024","751","tests","registration_page_test","TestRegistrationPage","","","Check registration with new email and empty password",""
"passed","Sun Dec 08 01:19:53 GMT 2024","Sun Dec 08 01:19:54 GMT 2024","1305","tests","registration_page_test","TestRegistrationPage","","","Check registration with an existing email",""
"passed","Sun Dec 08 01:13:13 GMT 2024","Sun Dec 08 01:13:32 GMT 2024","18312","tests","groups_page_test","TestGroupsPage","","","Verify if links on the 'ru' local lead to correct pages after clicking",""
"passed","Sun Dec 08 01:08:10 GMT 2024","Sun Dec 08 01:08:12 GMT 2024","1364","tests","contributors_page_test","TestContributorsPage","","","Verify values of the text in card descriptions",""
"passed","Sun Dec 08 01:14:05 GMT 2024","Sun Dec 08 01:14:13 GMT 2024","8224","tests","groups_page_test","TestGroupsPage","","","Verify attributes of images in links on the page",""
"passed","Sun Dec 08 01:07:05 GMT 2024","Sun Dec 08 01:07:05 GMT 2024","29","tests","contacts_page_test","TestContactsPage","","","Verify content of the text in the section 2",""
"passed","Sun Dec 08 01:18:19 GMT 2024","Sun Dec 08 01:18:19 GMT 2024","52","tests","header_test","TestHeaderPage","","","Verify presence, visibility and attributes of the profile avatar in the Header 
               for an authorized user",""
"passed","Sun Dec 08 01:23:03 GMT 2024","Sun Dec 08 01:23:04 GMT 2024","851","tests","start_unauthorized_page_test","TestStartUnauthorizedPage","","","Verify presence, visibility, clickability, href, status code 
                         of the 'Login' link in the section 1",""
"passed","Sun Dec 08 01:09:38 GMT 2024","Sun Dec 08 01:09:38 GMT 2024","27","tests","exercises_ru_words_page_test","TestExercisesRuWordsPage","","","Verify presence and visibility of content on the page",""
"passed","Sun Dec 08 01:11:20 GMT 2024","Sun Dec 08 01:11:24 GMT 2024","4043","tests","footer_test","TestFooter","","","Verify Footer invisibility through the modal window with the exercise",""
"passed","Sun Dec 08 01:15:43 GMT 2024","Sun Dec 08 01:15:43 GMT 2024","47","tests","header_test","TestHeaderPage","","","Verify presence, visibility and attributes of the image in the 'Logo' link in the Header 
               on the Start Unauthorized Page",""
"passed","Sun Dec 08 01:17:35 GMT 2024","Sun Dec 08 01:17:35 GMT 2024","284","tests","header_test","TestHeaderPage","","","Verify the dropdown opens/closes after clicking on the 'More' button in the Header 
               for an authorized user",""
"passed","Sun Dec 08 01:25:03 GMT 2024","Sun Dec 08 01:25:12 GMT 2024","8827","tests","Речевые упражнения.","TestCardsRU","","","Select random card from group ""Слова Королёвой"" and compare UI vs BACKEND data.",""
"passed","Sun Dec 08 01:22:44 GMT 2024","Sun Dec 08 01:22:44 GMT 2024","13","tests","start_unauthorized_page_test","TestStartUnauthorizedPage","","","Verify value of the title of the tab",""
"passed","Sun Dec 08 01:08:45 GMT 2024","Sun Dec 08 01:08:45 GMT 2024","151","tests","description_page_test","TestDescriptionPage","","","Verify return main page from description page.",""
"passed","Sun Dec 08 01:15:12 GMT 2024","Sun Dec 08 01:15:17 GMT 2024","4922","tests","header_test","TestHeaderPage","","","Verify if internal links in the Header for an unauthorized user 
            lead to correct pages after click",""
"passed","Sun Dec 08 01:28:50 GMT 2024","Sun Dec 08 01:28:50 GMT 2024","12","tests","used_resources_page_test","TestUsedResourcesPage","","","Verify value of the title of the tab",""
"passed","Sun Dec 08 01:11:13 GMT 2024","Sun Dec 08 01:11:13 GMT 2024","108","tests","footer_test","TestFooter","","","Verify sizes of images in links in the Footer",""
"passed","Sun Dec 08 01:21:11 GMT 2024","Sun Dec 08 01:21:16 GMT 2024","5357","tests","specialists_page_test","TestSpecialistsPage","","","Verify presence, visibility of the title, text, link, grid, cards and images  
        on the 2nd, 3rd, 5th, 6th levels of nesting on the page",""
"passed","Sun Dec 08 01:28:38 GMT 2024","Sun Dec 08 01:28:38 GMT 2024","27","tests","used_resources_page_test","TestUsedResourcesPage","","","Verify presence and visibility of content on the page",""
"passed","Sun Dec 08 01:17:43 GMT 2024","Sun Dec 08 01:17:43 GMT 2024","202","tests","header_test","TestHeaderPage","","","Verify switching of the 'ru', 'en' buttons in the Header for an authorized user",""
"passed","Sun Dec 08 01:08:16 GMT 2024","Sun Dec 08 01:08:17 GMT 2024","429","tests","contributors_page_test","TestContributorsPage","","","Verify text in card links and the 'All Team' link",""
"passed","Sun Dec 08 01:06:35 GMT 2024","Sun Dec 08 01:06:35 GMT 2024","20","tests","contacts_page_test","TestContactsPage","","","Verify the composition and visibility of elements on the 1st level of nesting in the section 1",""
"passed","Sun Dec 08 01:14:50 GMT 2024","Sun Dec 08 01:14:51 GMT 2024","367","tests","header_test","TestHeaderPage","","","Verify presence, visibility of links, buttons in the Header for an unauthorized user",""
"passed","Sun Dec 08 01:29:14 GMT 2024","Sun Dec 08 01:29:16 GMT 2024","1555","tests","used_resources_page_test","TestUsedResourcesPage","","","Verify presence, visibility, clickability, href, status code of links in sections",""
"passed","Sun Dec 08 01:20:26 GMT 2024","Sun Dec 08 01:20:27 GMT 2024","684","tests","registration_page_test","TestRegistrationPage","","","Check registration without choosing gender",""
"passed","Sun Dec 08 01:22:53 GMT 2024","Sun Dec 08 01:22:53 GMT 2024","68","tests","start_unauthorized_page_test","TestStartUnauthorizedPage","","","Verify content of the text in sections 1, 2",""
"passed","Sun Dec 08 01:25:20 GMT 2024","Sun Dec 08 01:25:29 GMT 2024","8973","tests","Речевые упражнения.","TestCardsRU","","","Select a random card from ""Похожие фразы"" group and compare UI vs BACKEND data.",""
"passed","Sun Dec 08 01:19:20 GMT 2024","Sun Dec 08 01:19:21 GMT 2024","793","tests","main_page_test","TestMainPage","","","Checking the domain is available",""
"passed","Sun Dec 08 01:21:58 GMT 2024","Sun Dec 08 01:21:58 GMT 2024","702","tests","specialists_page_test","TestSpecialistsPage","","","Verify that the 'All Specialists' link leads an unauthorized user 
                         to the correct page after clicking",""
"passed","Sun Dec 08 01:06:41 GMT 2024","Sun Dec 08 01:06:41 GMT 2024","136","tests","contacts_page_test","TestContactsPage","","","Verify the composition and visibility of elements 
        on the 1st-5th levels of nesting in the section 2",""
"passed","Sun Dec 08 01:16:42 GMT 2024","Sun Dec 08 01:16:50 GMT 2024","7466","tests","header_test","TestHeaderPage","","","Verify clickability, href, status code of links in the Header for an authorized user",""
"passed","Sun Dec 08 01:10:25 GMT 2024","Sun Dec 08 01:10:25 GMT 2024","130","tests","footer_test","TestFooter","","","Verify presence, visibility of text, links, images in the Footer",""
"passed","Sun Dec 08 01:07:32 GMT 2024","Sun Dec 08 01:07:32 GMT 2024","99","tests","contacts_page_test","TestContactsPage","","","Verify that the email link calls an email client",""
"passed","Sun Dec 08 01:08:50 GMT 2024","Sun Dec 08 01:08:52 GMT 2024","1744","tests","description_page_test","TestDescriptionPage","","","Verify redirection to telegram page not authorized user.",""
"passed","Sun Dec 08 01:09:14 GMT 2024","Sun Dec 08 01:09:16 GMT 2024","1555","tests","description_page_test","TestDescriptionPage","","","Verify redirection to github not authorized user.",""
"passed","Sun Dec 08 01:16:27 GMT 2024","Sun Dec 08 01:16:27 GMT 2024","195","tests","header_test","TestHeaderPage","","","Verify values of the text in links, buttons in the Header for an authorized user",""
"passed","Sun Dec 08 01:10:00 GMT 2024","Sun Dec 08 01:10:00 GMT 2024","92","tests","exercises_ru_words_page_test","TestExercisesRuWordsPage","","","Verify presence, visibility of lists on the page",""
"passed","Sun Dec 08 01:18:48 GMT 2024","Sun Dec 08 01:18:49 GMT 2024","188","tests","main_page_test","TestMainPage","","","Verify redirection to contacts page not authorized user.",""
"passed","Sun Dec 08 01:10:48 GMT 2024","Sun Dec 08 01:10:58 GMT 2024","10895","tests","footer_test","TestFooter","","","Verify that links in the Footer lead to correct pages after clicking",""
"passed","Sun Dec 08 01:08:27 GMT 2024","Sun Dec 08 01:08:28 GMT 2024","808","tests","contributors_page_test","TestContributorsPage","","","Verify href, status code of the 'All Team' link",""
"passed","Sun Dec 08 01:09:20 GMT 2024","Sun Dec 08 01:09:21 GMT 2024","680","tests","description_page_test","TestDescriptionPage","","","Verify redirection to contributors page not authorized user.",""
"passed","Sun Dec 08 01:15:28 GMT 2024","Sun Dec 08 01:15:28 GMT 2024","114","tests","header_test","TestHeaderPage","","","Verify that the 'Logo' link on the Start Unauthorized Page 
                             doesn't refresh the current page or lead to other pages after clicking",""
"passed","Sun Dec 08 01:29:30 GMT 2024","Sun Dec 08 01:29:30 GMT 2024","58","tests","used_resources_page_test","TestUsedResourcesPage","","","Verify presence, visibility and attributes of icons in sections",""
"passed","Sun Dec 08 01:21:33 GMT 2024","Sun Dec 08 01:21:33 GMT 2024","33","tests","specialists_page_test","TestSpecialistsPage","","","Verify value of text on the page",""
"passed","Sun Dec 08 01:21:28 GMT 2024","Sun Dec 08 01:21:28 GMT 2024","32","tests","specialists_page_test","TestSpecialistsPage","","","Verify value of title with tag 'h2' on the page",""
"passed","Sun Dec 08 01:18:53 GMT 2024","Sun Dec 08 01:18:54 GMT 2024","671","tests","main_page_test","TestMainPage","","","Verify redirection to specialists page not authorized user.",""
"passed","Sun Dec 08 01:08:01 GMT 2024","Sun Dec 08 01:08:01 GMT 2024","42","tests","contributors_page_test","TestContributorsPage","","","Verify values of title and subtitles with tags h2, h3 on the page",""
"passed","Sun Dec 08 01:07:41 GMT 2024","Sun Dec 08 01:07:43 GMT 2024","1690","tests","contributors_page_test","TestContributorsPage","","","Verify the composition and visibility of elements 
        on the 1st-5th levels of nesting on the page",""
"skipped","Sun Dec 08 01:24:20 GMT 2024","Sun Dec 08 01:24:41 GMT 2024","20224","tests","Speech exercises EN.","TestCardsEN","","","Select a random card from ""Similar phrases"" group and compare UI vs BACKEND data",""
"passed","Sun Dec 08 01:15:21 GMT 2024","Sun Dec 08 01:15:24 GMT 2024","2100","tests","header_test","TestHeaderPage","","","Verify if external links in the Header for an unauthorized user 
            lead to correct pages after click",""
"passed","Sun Dec 08 01:21:39 GMT 2024","Sun Dec 08 01:21:39 GMT 2024","104","tests","specialists_page_test","TestSpecialistsPage","","","Verify values of names and professions in specialist cards in the grid",""
"passed","Sun Dec 08 01:11:49 GMT 2024","Sun Dec 08 01:11:52 GMT 2024","3121","tests","groups_page_test","TestGroupsPage","","","Verify presence, visibility of the title, tiles, links, images, subtitles on the page",""
"passed","Sun Dec 08 01:16:20 GMT 2024","Sun Dec 08 01:16:20 GMT 2024","367","tests","header_test","TestHeaderPage","","","Verify presence, visibility of links, buttons in the Header for an authorized user",""
"passed","Sun Dec 08 01:14:55 GMT 2024","Sun Dec 08 01:14:56 GMT 2024","192","tests","header_test","TestHeaderPage","","","Verify values of the text in links, buttons in the Header for an unauthorized user",""
"passed","Sun Dec 08 01:29:36 GMT 2024","Sun Dec 08 01:29:36 GMT 2024","81","tests","used_resources_page_test","TestUsedResourcesPage","","","Verify sizes of icons in sections",""
"passed","Sun Dec 08 01:22:34 GMT 2024","Sun Dec 08 01:22:34 GMT 2024","85","tests","start_unauthorized_page_test","TestStartUnauthorizedPage","","","Verify the composition and visibility of elements 
        on the 1st-3rd levels of nesting in the section 1",""
"passed","Sun Dec 08 01:08:22 GMT 2024","Sun Dec 08 01:08:22 GMT 2024","724","tests","contributors_page_test","TestContributorsPage","","","Verify clickability, href of links on the page",""
"passed","Sun Dec 08 01:21:04 GMT 2024","Sun Dec 08 01:21:05 GMT 2024","349","tests","specialists_page_test","TestSpecialistsPage","","","Verify the composition and visibility of elements 
        on the 1st-6th levels of nesting on the page",""
"passed","Sun Dec 08 01:20:58 GMT 2024","Sun Dec 08 01:20:58 GMT 2024","35","tests","specialists_page_test","TestSpecialistsPage","","","Verify presence and visibility of content on the page",""
"passed","Sun Dec 08 01:08:38 GMT 2024","Sun Dec 08 01:08:40 GMT 2024","1151","tests","contributors_page_test","TestContributorsPage","","","Verify sizes of images in contributor cards in grids",""
"passed","Sun Dec 08 01:21:22 GMT 2024","Sun Dec 08 01:21:22 GMT 2024","11","tests","specialists_page_test","TestSpecialistsPage","","","Verify value of the title of the tab",""
"passed","Sun Dec 08 01:29:02 GMT 2024","Sun Dec 08 01:29:02 GMT 2024","32","tests","used_resources_page_test","TestUsedResourcesPage","","","Verify content of the text on the page",""
"passed","Sun Dec 08 01:07:11 GMT 2024","Sun Dec 08 01:07:11 GMT 2024","27","tests","contacts_page_test","TestContactsPage","","","Verify text in links in the section 2",""
