"Status","Start Time","Stop Time","Duration in ms","Parent Suite","Suite","Sub Suite","Test Class","Test Method","Name","Description"
"passed","Sun Oct 19 12:07:49 GMT 2025","Sun Oct 19 12:07:49 GMT 2025","40","tests","contributors_page_test","TestContributorsPage","","","Verify values of title and subtitles with tags h2, h3 on the page",""
"passed","Sun Oct 19 12:12:06 GMT 2025","Sun Oct 19 12:12:06 GMT 2025","150","tests","exercises_ru_similar_phrases_page_test","TestExercisesRuSimilarPhrasesPage","","","Verify sizes of background-images in links on the page",""
"passed","Sun Oct 19 12:25:43 GMT 2025","Sun Oct 19 12:25:43 GMT 2025","121","tests","start_unauthorized_page_test","TestStartUnauthorizedPage","","","Verify the composition and visibility of elements 
        on the 1st-3rd levels of nesting in the section 2",""
"passed","Sun Oct 19 12:24:56 GMT 2025","Sun Oct 19 12:24:56 GMT 2025","45","tests","specialists_page_test","TestSpecialistsPage","","","Verify text in the 'All Specialists' link",""
"passed","Sun Oct 19 12:24:29 GMT 2025","Sun Oct 19 12:24:30 GMT 2025","895","tests","specialists_page_test","TestSpecialistsPage","","","Verify presence, visibility of the title, text, link, grid, cards and images  
        on the 2nd, 3rd, 5th, 6th levels of nesting on the page",""
"passed","Sun Oct 19 12:15:48 GMT 2025","Sun Oct 19 12:15:50 GMT 2025","2500","tests","footer_test","TestFooter","","","Verify clickability, href, prefix and subject, status code of links in the Footer",""
"passed","Sun Oct 19 12:24:40 GMT 2025","Sun Oct 19 12:24:40 GMT 2025","56","tests","specialists_page_test","TestSpecialistsPage","","","Verify value of title with tag 'h2' on the page",""
"passed","Sun Oct 19 12:21:38 GMT 2025","Sun Oct 19 12:21:39 GMT 2025","425","tests","header_test","TestHeaderPage","","","Verify user logout after clicking the 'Logout' button in the Header for an authorized user",""
"passed","Sun Oct 19 12:10:12 GMT 2025","Sun Oct 19 12:10:12 GMT 2025","41","tests","exercises_ru_similar_phrases_page_test","TestExercisesRuSimilarPhrasesPage","","","Verify text in group links on the page",""
"passed","Sun Oct 19 12:06:26 GMT 2025","Sun Oct 19 12:06:27 GMT 2025","1170","tests","authorisation_page_test","TestAuthorizedUserPage","","","Checking the possibility of authorization with the correct data",""
"skipped","Sun Oct 19 12:28:21 GMT 2025","Sun Oct 19 12:28:33 GMT 2025","12435","tests","Речевые упражнения.","TestCardsRU","","","Select a random card from ""Предложения"" group and compare UI vs BACKEND data.",""
"passed","Sun Oct 19 12:26:09 GMT 2025","Sun Oct 19 12:26:09 GMT 2025","157","tests","start_unauthorized_page_test","TestStartUnauthorizedPage","","","Verify that the 'Login' link leads to the correct page after clicking",""
"passed","Sun Oct 19 12:25:01 GMT 2025","Sun Oct 19 12:25:01 GMT 2025","659","tests","specialists_page_test","TestSpecialistsPage","","","Verify clickability, href, status code of the 'All Specialists' link",""
"passed","Sun Oct 19 12:12:16 GMT 2025","Sun Oct 19 12:12:16 GMT 2025","43","tests","exercises_ru_words_page_test","TestExercisesRuWordsPage","","","Verify presence and visibility of content on the page",""
"passed","Sun Oct 19 12:18:10 GMT 2025","Sun Oct 19 12:18:10 GMT 2025","40","tests","groups_page_test","TestGroupsPage","","","Verify title, href of links on the 'en' local",""
"passed","Sun Oct 19 12:12:51 GMT 2025","Sun Oct 19 12:12:51 GMT 2025","12","tests","exercises_ru_words_page_test","TestExercisesRuWordsPage","","","Verify value of the title of the tab",""
"passed","Sun Oct 19 12:06:54 GMT 2025","Sun Oct 19 12:06:54 GMT 2025","13","tests","contacts_page_test","TestContactsPage","","","Verify value of the title of the tab",""
"passed","Sun Oct 19 12:23:59 GMT 2025","Sun Oct 19 12:23:59 GMT 2025","682","tests","registration_page_test","TestRegistrationPage","","","Check registration without choosing gender",""
"passed","Sun Oct 19 12:13:23 GMT 2025","Sun Oct 19 12:13:23 GMT 2025","322","tests","exercises_ru_words_page_test","TestExercisesRuWordsPage","","","Verify text in cards on the page",""
"passed","Sun Oct 19 12:30:04 GMT 2025","Sun Oct 19 12:30:04 GMT 2025","34","tests","used_resources_page_test","TestURPage","","","Verify presence and visibility of content on the page",""
"passed","Sun Oct 19 12:13:45 GMT 2025","Sun Oct 19 12:13:45 GMT 2025","130","tests","exercises_ru_words_page_test","TestExercisesRuWordsPage","","","Verify clickability, titles, attributes of group links on the page",""
"passed","Sun Oct 19 12:13:55 GMT 2025","Sun Oct 19 12:14:18 GMT 2025","22534","tests","exercises_ru_words_page_test","TestExercisesRuWordsPage","","","Verify clickability, titles, href, status code of subgroup links on the page",""
"passed","Sun Oct 19 12:11:38 GMT 2025","Sun Oct 19 12:11:45 GMT 2025","6872","tests","exercises_ru_similar_phrases_page_test","TestExercisesRuSimilarPhrasesPage","","","Verify if subgroup links lead to correct pages after clicking",""
"passed","Sun Oct 19 12:20:11 GMT 2025","Sun Oct 19 12:20:11 GMT 2025","28","tests","header_test","TestHeaderPage","","","Verify presence and visibility of the Header for an authorized user",""
"skipped","Sun Oct 19 12:28:40 GMT 2025","Sun Oct 19 12:28:53 GMT 2025","12437","tests","Речевые упражнения.","TestCardsRU","","","Select a random card from ""Слова с частотной группировкой"" group and compare UI vs BACKEND data.",""
"passed","Sun Oct 19 12:26:14 GMT 2025","Sun Oct 19 12:26:14 GMT 2025","88","tests","start_unauthorized_page_test","TestStartUnauthorizedPage","","","Verify presence, visibility and attributes of the image in the section 1",""
"passed","Sun Oct 19 12:19:55 GMT 2025","Sun Oct 19 12:19:56 GMT 2025","254","tests","header_test","TestHeaderPage","","","Verify switching of the 'ru', 'en' buttons in the Header on the Start Unauthorized Page",""
"passed","Sun Oct 19 12:21:31 GMT 2025","Sun Oct 19 12:21:32 GMT 2025","206","tests","header_test","TestHeaderPage","","","Verify switching of the 'ru', 'en' buttons in the Header for an authorized user",""
"passed","Sun Oct 19 12:18:55 GMT 2025","Sun Oct 19 12:18:55 GMT 2025","33","tests","groups_page_test","TestGroupsPage","","","test_gp_04_03_verify_images_alt_en",""
"passed","Sun Oct 19 12:26:18 GMT 2025","Sun Oct 19 12:26:18 GMT 2025","61","tests","start_unauthorized_page_test","TestStartUnauthorizedPage","","","Verify size of the image in the section 1",""
"passed","Sun Oct 19 12:14:54 GMT 2025","Sun Oct 19 12:14:59 GMT 2025","4594","tests","exercises_ru_words_page_test","TestExercisesRuWordsPage","","","Verify if subgroup links 1-4 lead to correct pages after clicking",""
"passed","Sun Oct 19 12:22:55 GMT 2025","Sun Oct 19 12:22:55 GMT 2025","130","tests","main_page_test","TestMainPage","","","Checking the clickability of the Start button.",""
"passed","Sun Oct 19 12:27:18 GMT 2025","Sun Oct 19 12:27:27 GMT 2025","8817","tests","Речевые упражнения.","TestCardsRU","","","Select random card from group ""Слова"" and compare UI vs BACKEND data.",""
"passed","Sun Oct 19 12:10:57 GMT 2025","Sun Oct 19 12:11:00 GMT 2025","3404","tests","exercises_ru_similar_phrases_page_test","TestExercisesRuSimilarPhrasesPage","","","Verify clickability, href, status code of subgroup links on the page",""
"passed","Sun Oct 19 12:24:03 GMT 2025","Sun Oct 19 12:24:14 GMT 2025","10717","tests","registration_page_test","TestRegistrationPage","","","Check registration without choosing agreement",""
"passed","Sun Oct 19 12:25:39 GMT 2025","Sun Oct 19 12:25:39 GMT 2025","99","tests","start_unauthorized_page_test","TestStartUnauthorizedPage","","","Verify the composition and visibility of elements 
        on the 1st-3rd levels of nesting in the section 1",""
"passed","Sun Oct 19 12:09:00 GMT 2025","Sun Oct 19 12:09:01 GMT 2025","706","tests","description_page_test","TestDescriptionPage","","","Verify redirection to contributors page not authorized user.",""
"passed","Sun Oct 19 12:07:28 GMT 2025","Sun Oct 19 12:07:28 GMT 2025","39","tests","contributors_page_test","TestContributorsPage","","","Verify presence, visibility and structure of content on the page",""
"passed","Sun Oct 19 12:17:09 GMT 2025","Sun Oct 19 12:17:09 GMT 2025","11","tests","groups_page_test","TestGroupsPage","","","Verify value of the 'en' title of the tab",""
"passed","Sun Oct 19 12:08:03 GMT 2025","Sun Oct 19 12:08:03 GMT 2025","453","tests","contributors_page_test","TestContributorsPage","","","Verify text in card links and the 'All Team' link",""
"passed","Sun Oct 19 12:30:26 GMT 2025","Sun Oct 19 12:30:26 GMT 2025","36","tests","used_resources_page_test","TestURPage","","","Verify text in links in sections",""
"passed","Sun Oct 19 12:23:34 GMT 2025","Sun Oct 19 12:23:35 GMT 2025","783","tests","registration_page_test","TestRegistrationPage","","","Check registration with new email and empty confirm password",""
"passed","Sun Oct 19 12:09:06 GMT 2025","Sun Oct 19 12:09:06 GMT 2025","214","tests","description_page_test","TestDescriptionPage","","","Verify redirection to used resources page not authorized user.",""
"passed","Sun Oct 19 12:16:15 GMT 2025","Sun Oct 19 12:16:16 GMT 2025","94","tests","footer_test","TestFooter","","","Verify attributes of images in links in the Footer",""
"passed","Sun Oct 19 12:25:30 GMT 2025","Sun Oct 19 12:25:30 GMT 2025","38","tests","start_unauthorized_page_test","TestStartUnauthorizedPage","","","Verify presence and visibility of content on the page",""
"passed","Sun Oct 19 12:09:50 GMT 2025","Sun Oct 19 12:09:50 GMT 2025","11","tests","exercises_ru_similar_phrases_page_test","TestExercisesRuSimilarPhrasesPage","","","Verify value of the title of the tab",""
"passed","Sun Oct 19 12:06:49 GMT 2025","Sun Oct 19 12:06:49 GMT 2025","177","tests","contacts_page_test","TestContactsPage","","","Verify presence, visibility of sections, the dividing line and elements with text on the page",""
"passed","Sun Oct 19 12:15:26 GMT 2025","Sun Oct 19 12:15:26 GMT 2025","44","tests","footer_test","TestFooter","","","Verify presence and visibility of the Footer",""
"passed","Sun Oct 19 12:22:14 GMT 2025","Sun Oct 19 12:22:14 GMT 2025","3","tests","login_page_test","TestLoginPage","","","Test for authorization customer.",""
"passed","Sun Oct 19 12:13:02 GMT 2025","Sun Oct 19 12:13:02 GMT 2025","38","tests","exercises_ru_words_page_test","TestExercisesRuWordsPage","","","Verify value of the breadcrumbs on the page",""
"passed","Sun Oct 19 12:08:45 GMT 2025","Sun Oct 19 12:08:45 GMT 2025","222","tests","description_page_test","TestDescriptionPage","","","Verify redirection to contacts page not authorized user.",""
"passed","Sun Oct 19 12:26:00 GMT 2025","Sun Oct 19 12:26:00 GMT 2025","41","tests","start_unauthorized_page_test","TestStartUnauthorizedPage","","","Verify text in the 'Login' link in the section 1",""
"passed","Sun Oct 19 12:21:46 GMT 2025","Sun Oct 19 12:21:46 GMT 2025","44","tests","header_test","TestHeaderPage","","","Verify presence, visibility and attributes of the image in the Logo link in the Header 
               for an authorized user",""
"passed","Sun Oct 19 12:19:06 GMT 2025","Sun Oct 19 12:19:06 GMT 2025","35","tests","header_test","TestHeaderPage","","","Verify presence and visibility of the Header for an unauthorized user",""
"passed","Sun Oct 19 12:07:02 GMT 2025","Sun Oct 19 12:07:02 GMT 2025","43","tests","contacts_page_test","TestContactsPage","","","Verify content of the text in the section 2",""
"passed","Sun Oct 19 12:07:24 GMT 2025","Sun Oct 19 12:07:24 GMT 2025","120","tests","contacts_page_test","TestContactsPage","","","Verify that the email link calls an email client",""
"passed","Sun Oct 19 12:23:39 GMT 2025","Sun Oct 19 12:23:40 GMT 2025","801","tests","registration_page_test","TestRegistrationPage","","","Check registration with new email and empty password",""
"passed","Sun Oct 19 12:15:30 GMT 2025","Sun Oct 19 12:15:30 GMT 2025","259","tests","footer_test","TestFooter","","","Verify composition and visibility of elements on the 1st-7th levels of nesting in the Footer",""
"passed","Sun Oct 19 12:23:04 GMT 2025","Sun Oct 19 12:23:13 GMT 2025","8952","tests","profile_page_test","TestProfilePage","","","Change the password by receiving an email link",""
"passed","Sun Oct 19 12:10:46 GMT 2025","Sun Oct 19 12:10:46 GMT 2025","120","tests","exercises_ru_similar_phrases_page_test","TestExercisesRuSimilarPhrasesPage","","","Verify clickability, titles, attributes of group links on the page",""
"passed","Sun Oct 19 12:20:32 GMT 2025","Sun Oct 19 12:20:32 GMT 2025","199","tests","header_test","TestHeaderPage","","","Verify values of the text in links, buttons in the Header for an authorized user",""
"passed","Sun Oct 19 12:07:33 GMT 2025","Sun Oct 19 12:07:35 GMT 2025","1831","tests","contributors_page_test","TestContributorsPage","","","Verify the composition and visibility of elements 
        on the 1st-5th levels of nesting on the page",""
"passed","Sun Oct 19 12:30:42 GMT 2025","Sun Oct 19 12:30:44 GMT 2025","1523","tests","used_resources_page_test","TestURPage","","","Verify that links in the sections lead to the correct pages after clicking",""
"passed","Sun Oct 19 12:08:18 GMT 2025","Sun Oct 19 12:08:19 GMT 2025","872","tests","contributors_page_test","TestContributorsPage","","","Verify attribute values of images in contributors cards in grids",""
"passed","Sun Oct 19 12:15:55 GMT 2025","Sun Oct 19 12:16:07 GMT 2025","12150","tests","footer_test","TestFooter","","","Verify that links in the Footer lead to correct pages after clicking",""
"passed","Sun Oct 19 12:24:35 GMT 2025","Sun Oct 19 12:24:35 GMT 2025","12","tests","specialists_page_test","TestSpecialistsPage","","","Verify value of the title of the tab",""
"passed","Sun Oct 19 12:24:50 GMT 2025","Sun Oct 19 12:24:50 GMT 2025","111","tests","specialists_page_test","TestSpecialistsPage","","","Verify values of names and professions in specialist cards in the grid",""
"passed","Sun Oct 19 12:06:35 GMT 2025","Sun Oct 19 12:06:36 GMT 2025","31","tests","contacts_page_test","TestContactsPage","","","Verify presence and visibility of content on the page",""
