"Status","Start Time","Stop Time","Duration in ms","Parent Suite","Suite","Sub Suite","Test Class","Test Method","Name","Description"
"passed","Sun Oct 27 09:28:29 GMT 2024","Sun Oct 27 09:28:34 GMT 2024","4281","tests","registration_page_test","TestRegistrationPage","","","Check registration with new email",""
"passed","Sun Oct 27 09:31:03 GMT 2024","Sun Oct 27 09:31:03 GMT 2024","48","tests","start_unauthorized_page_test","TestStartUnauthorizedPage","","","Verify values of titles and subtitles with tags h2, h4 on the page",""
"passed","Sun Oct 27 09:24:56 GMT 2024","Sun Oct 27 09:24:56 GMT 2024","99","tests","header_test","TestHeaderPage","","","Verify that the 'Logo' link on the Start Unauthorized Page 
                             doesn't refresh the current page or lead to other pages after clicking",""
"passed","Sun Oct 27 09:31:18 GMT 2024","Sun Oct 27 09:31:18 GMT 2024","129","tests","start_unauthorized_page_test","TestStartUnauthorizedPage","","","Verify that the 'Login' link leads to the correct page after clicking",""
"passed","Sun Oct 27 09:25:41 GMT 2024","Sun Oct 27 09:25:41 GMT 2024","348","tests","header_test","TestHeaderPage","","","Verify presence, visibility of links, buttons in the Header for an authorized user",""
"passed","Sun Oct 27 09:27:46 GMT 2024","Sun Oct 27 09:27:46 GMT 2024","148","tests","main_page_test","TestMainPage","","","Verify redirection to contacts page not authorized user.",""
"passed","Sun Oct 27 09:26:58 GMT 2024","Sun Oct 27 09:26:59 GMT 2024","348","tests","header_test","TestHeaderPage","","","Verify user logout after clicking the 'Logout' button in the Header for an authorized user",""
"passed","Sun Oct 27 09:20:16 GMT 2024","Sun Oct 27 09:20:17 GMT 2024","1098","tests","contributors_page_test","TestContributorsPage","","","Verify sizes of images in contributor cards in grids",""
"passed","Sun Oct 27 09:39:19 GMT 2024","Sun Oct 27 09:39:22 GMT 2024","2647","tests","used_resources_page_test","TestUsedResourcesPage","","","Verify that links in the sections lead to the correct pages after clicking",""
"passed","Sun Oct 27 09:20:03 GMT 2024","Sun Oct 27 09:20:03 GMT 2024","716","tests","contributors_page_test","TestContributorsPage","","","Verify clickability, href of links on the page",""
"passed","Sun Oct 27 09:19:59 GMT 2024","Sun Oct 27 09:19:59 GMT 2024","436","tests","contributors_page_test","TestContributorsPage","","","Verify text in card links and the 'All Team' link",""
"passed","Sun Oct 27 09:37:50 GMT 2024","Sun Oct 27 09:38:16 GMT 2024","26057","tests","Речевые упражнения.","TestCardsRU","","","Solutions to a random task in the ""Слова Королёвой"" .",""
"passed","Sun Oct 27 09:20:11 GMT 2024","Sun Oct 27 09:20:12 GMT 2024","792","tests","contributors_page_test","TestContributorsPage","","","Verify attribute values of images in contributors cards in grids",""
"passed","Sun Oct 27 09:30:29 GMT 2024","Sun Oct 27 09:30:32 GMT 2024","2634","tests","specialists_page_test","TestSpecialistsPage","","","Verify that the 'All Specialists' link leads an authorized user 
                         to the correct page after clicking",""
"passed","Sun Oct 27 09:20:55 GMT 2024","Sun Oct 27 09:20:55 GMT 2024","36","tests","footer_test","TestFooter","","","Verify presence and visibility of the Footer",""
"passed","Sun Oct 27 09:31:10 GMT 2024","Sun Oct 27 09:31:10 GMT 2024","50","tests","start_unauthorized_page_test","TestStartUnauthorizedPage","","","Verify text in the 'Login' link in the section 1",""
"skipped","Sun Oct 27 09:32:08 GMT 2024","Sun Oct 27 09:32:37 GMT 2024","28750","tests","Speech exercises EN.","TestCardsEN","","","Check progres-bar and buttons.",""
"passed","Sun Oct 27 09:27:23 GMT 2024","Sun Oct 27 09:27:23 GMT 2024","53","tests","header_test","TestHeaderPage","","","Verify presence, visibility and attributes of the profile avatar in the Header 
               for an authorized user",""
"passed","Sun Oct 27 09:19:23 GMT 2024","Sun Oct 27 09:19:23 GMT 2024","85","tests","contacts_page_test","TestContactsPage","","","Verify that the email link calls an email client",""
"passed","Sun Oct 27 09:27:29 GMT 2024","Sun Oct 27 09:27:29 GMT 2024","2","tests","login_page_test","TestLoginPage","","","Test for authorization customer.",""
"passed","Sun Oct 27 09:24:09 GMT 2024","Sun Oct 27 09:24:09 GMT 2024","45","tests","header_test","TestHeaderPage","","","Verify presence and visibility of the Header for an unauthorized user",""
"passed","Sun Oct 27 09:39:11 GMT 2024","Sun Oct 27 09:39:14 GMT 2024","2709","tests","used_resources_page_test","TestUsedResourcesPage","","","Verify presence, visibility, clickability, href, status code of links in sections",""
"passed","Sun Oct 27 09:20:07 GMT 2024","Sun Oct 27 09:20:07 GMT 2024","557","tests","contributors_page_test","TestContributorsPage","","","Verify href, status code of the 'All Team' link",""
"passed","Sun Oct 27 09:26:40 GMT 2024","Sun Oct 27 09:26:40 GMT 2024","68","tests","header_test","TestHeaderPage","","","Verify that the 'Logo' link on the Start Authorized Page 
                             doesn't refresh the current page or lead to other pages after clicking",""
"passed","Sun Oct 27 09:24:59 GMT 2024","Sun Oct 27 09:24:59 GMT 2024","267","tests","header_test","TestHeaderPage","","","Verify the dropdown opens/closes after clicking on the 'More' button in the Header 
            on the Start Unauthorized Page",""
"passed","Sun Oct 27 09:19:07 GMT 2024","Sun Oct 27 09:19:07 GMT 2024","28","tests","contacts_page_test","TestContactsPage","","","Verify text in links in the section 2",""
"passed","Sun Oct 27 09:24:26 GMT 2024","Sun Oct 27 09:24:26 GMT 2024","345","tests","header_test","TestHeaderPage","","","Verify presence, visibility of links, buttons in the Header for an unauthorized user",""
