"Status","Start Time","Stop Time","Duration in ms","Parent Suite","Suite","Sub Suite","Test Class","Test Method","Name","Description"
"passed","Fri Mar 21 21:45:48 GMT 2025","Fri Mar 21 21:45:49 GMT 2025","720","tests","registration_page_test","TestRegistrationPage","","","Check registration without choosing gender",""
"passed","Fri Mar 21 21:29:42 GMT 2025","Fri Mar 21 21:29:42 GMT 2025","12","tests","contributors_page_test","TestContributorsPage","","","Verify value of the title of the tab",""
"passed","Fri Mar 21 21:39:05 GMT 2025","Fri Mar 21 21:39:24 GMT 2025","18335","tests","groups_page_test","TestGroupsPage","","","Verify if links on the 'ru' local lead to correct pages after clicking",""
"passed","Fri Mar 21 21:46:40 GMT 2025","Fri Mar 21 21:46:40 GMT 2025","17","tests","specialists_page_test","TestSpecialistsPage","","","Verify value of the title of the tab",""
"passed","Fri Mar 21 21:44:24 GMT 2025","Fri Mar 21 21:44:25 GMT 2025","706","tests","main_page_test","TestMainPage","","","Verify redirection to contributors page not authorized user.",""
"passed","Fri Mar 21 21:30:48 GMT 2025","Fri Mar 21 21:30:50 GMT 2025","1993","tests","description_page_test","TestDescriptionPage","","","Verify redirection to github not authorized user.",""
"passed","Fri Mar 21 21:32:30 GMT 2025","Fri Mar 21 21:32:30 GMT 2025","132","tests","exercises_ru_words_page_test","TestExercisesRuWordsPage","","","Verify presence and visibility of content on the page",""
"passed","Fri Mar 21 21:45:25 GMT 2025","Fri Mar 21 21:45:26 GMT 2025","748","tests","registration_page_test","TestRegistrationPage","","","Check registration with new email and empty confirm password",""
"passed","Fri Mar 21 21:43:33 GMT 2025","Fri Mar 21 21:43:33 GMT 2025","50","tests","header_test","TestHeaderPage","","","Verify size of the image in the 'Logo' link in the Header for an authorized user",""
"passed","Fri Mar 21 21:41:42 GMT 2025","Fri Mar 21 21:41:52 GMT 2025","10243","tests","header_test","TestHeaderPage","","","Verify composition, visibility of elements on the 1st-6th levels of nesting in the Header
            for an authorized user",""
"passed","Fri Mar 21 21:36:12 GMT 2025","Fri Mar 21 21:36:17 GMT 2025","5158","tests","exercises_ru_words_page_test","TestExercisesRuWordsPage","","","Verify sizes of background-images in links on the page",""
"passed","Fri Mar 21 21:30:54 GMT 2025","Fri Mar 21 21:30:55 GMT 2025","677","tests","description_page_test","TestDescriptionPage","","","Verify redirection to contributors page not authorized user.",""
"passed","Fri Mar 21 21:36:29 GMT 2025","Fri Mar 21 21:36:29 GMT 2025","132","tests","footer_test","TestFooter","","","Verify presence, visibility of text, links, images in the Footer",""
"passed","Fri Mar 21 21:32:20 GMT 2025","Fri Mar 21 21:32:20 GMT 2025","76","tests","exercises_ru_similar_phrases_page_test","TestExercisesRuSimilarPhrasesPage","","","Verify clickability of links in breadcrumbs on the page",""
"passed","Fri Mar 21 21:43:13 GMT 2025","Fri Mar 21 21:43:14 GMT 2025","193","tests","header_test","TestHeaderPage","","","Verify switching of the 'ru', 'en' buttons in the Header for an authorized user",""
"passed","Fri Mar 21 21:50:16 GMT 2025","Fri Mar 21 21:50:25 GMT 2025","9137","tests","Речевые упражнения.","TestCardsRU","","","Select a random card from ""Похожие фразы"" group and compare UI vs BACKEND data.",""
"passed","Fri Mar 21 21:52:38 GMT 2025","Fri Mar 21 21:53:25 GMT 2025","46506","tests","Речевые упражнения.","TestCardsRU","","","Solutions to a random task in the ""Слова Королёвой"" .",""
"passed","Fri Mar 21 21:44:37 GMT 2025","Fri Mar 21 21:44:38 GMT 2025","437","tests","main_page_test","TestMainPage","","","Checking the domain is available",""
"passed","Fri Mar 21 21:30:28 GMT 2025","Fri Mar 21 21:30:29 GMT 2025","1517","tests","description_page_test","TestDescriptionPage","","","Verify redirection to telegram page not authorized user.",""
"passed","Fri Mar 21 21:30:38 GMT 2025","Fri Mar 21 21:30:39 GMT 2025","210","tests","description_page_test","TestDescriptionPage","","","Verify redirection to contacts page not authorized user.",""
"passed","Fri Mar 21 21:37:36 GMT 2025","Fri Mar 21 21:37:40 GMT 2025","3169","tests","groups_page_test","TestGroupsPage","","","Verify composition, visibility of elements on the 1st-6th levels of nesting on the page",""
"passed","Fri Mar 21 21:44:15 GMT 2025","Fri Mar 21 21:44:15 GMT 2025","703","tests","main_page_test","TestMainPage","","","Verify redirection to specialists page not authorized user.",""
"passed","Fri Mar 21 21:51:44 GMT 2025","Fri Mar 21 21:52:32 GMT 2025","47125","tests","Речевые упражнения.","TestCardsRU","","","Solutions to a random task in the ""Слова"" .",""
"passed","Fri Mar 21 21:45:34 GMT 2025","Fri Mar 21 21:45:35 GMT 2025","768","tests","registration_page_test","TestRegistrationPage","","","Check registration with new email and empty first name",""
"passed","Fri Mar 21 21:48:11 GMT 2025","Fri Mar 21 21:48:11 GMT 2025","151","tests","start_unauthorized_page_test","TestStartUnauthorizedPage","","","Verify that the 'Login' link leads to the correct page after clicking",""
"passed","Fri Mar 21 21:46:50 GMT 2025","Fri Mar 21 21:46:50 GMT 2025","36","tests","specialists_page_test","TestSpecialistsPage","","","Verify value of text on the page",""
"passed","Fri Mar 21 21:39:30 GMT 2025","Fri Mar 21 21:39:51 GMT 2025","21268","tests","groups_page_test","TestGroupsPage","","","Verify if links on the 'en' local lead to correct pages after clicking",""
"passed","Fri Mar 21 21:34:05 GMT 2025","Fri Mar 21 21:34:27 GMT 2025","22647","tests","exercises_ru_words_page_test","TestExercisesRuWordsPage","","","Verify clickability, titles, href, status code of subgroup links on the page",""
"passed","Fri Mar 21 21:40:22 GMT 2025","Fri Mar 21 21:40:22 GMT 2025","32","tests","header_test","TestHeaderPage","","","Verify presence and visibility of the Header for an unauthorized user",""
"passed","Fri Mar 21 21:42:19 GMT 2025","Fri Mar 21 21:42:25 GMT 2025","6165","tests","header_test","TestHeaderPage","","","Verify clickability, href, status code of links in the Header for an authorized user",""
"passed","Fri Mar 21 21:32:40 GMT 2025","Fri Mar 21 21:32:42 GMT 2025","2877","tests","exercises_ru_words_page_test","TestExercisesRuWordsPage","","","Verify composition, visibility of elements on the 1st-6th levels of nesting on the page",""
"passed","Fri Mar 21 21:35:00 GMT 2025","Fri Mar 21 21:35:00 GMT 2025","389","tests","exercises_ru_words_page_test","TestExercisesRuWordsPage","","","Verify if breadcrumbs link3 leads to the correct page after clicking",""
"passed","Fri Mar 21 21:37:30 GMT 2025","Fri Mar 21 21:37:30 GMT 2025","26","tests","groups_page_test","TestGroupsPage","","","Verify presence and visibility of content on the page",""
"passed","Fri Mar 21 21:46:45 GMT 2025","Fri Mar 21 21:46:45 GMT 2025","38","tests","specialists_page_test","TestSpecialistsPage","","","Verify value of title with tag 'h2' on the page",""
"passed","Fri Mar 21 21:40:12 GMT 2025","Fri Mar 21 21:40:18 GMT 2025","6074","tests","groups_page_test","TestGroupsPage","","","Verify sizes of images in links on the page",""
"passed","Fri Mar 21 21:41:59 GMT 2025","Fri Mar 21 21:41:59 GMT 2025","390","tests","header_test","TestHeaderPage","","","Verify presence, visibility of links, buttons in the Header for an authorized user",""
"passed","Fri Mar 21 21:47:01 GMT 2025","Fri Mar 21 21:47:01 GMT 2025","47","tests","specialists_page_test","TestSpecialistsPage","","","Verify text in the 'All Specialists' link",""
"passed","Fri Mar 21 21:46:55 GMT 2025","Fri Mar 21 21:46:55 GMT 2025","111","tests","specialists_page_test","TestSpecialistsPage","","","Verify values of names and professions in specialist cards in the grid",""
"passed","Fri Mar 21 21:31:20 GMT 2025","Fri Mar 21 21:31:20 GMT 2025","844","tests","exercises_ru_similar_phrases_page_test","TestExercisesRuSimilarPhrasesPage","","","Verify composition, visibility of elements on the 1st-7th levels of nesting on the page",""
"passed","Fri Mar 21 21:46:30 GMT 2025","Fri Mar 21 21:46:35 GMT 2025","5359","tests","specialists_page_test","TestSpecialistsPage","","","Verify presence, visibility of the title, text, link, grid, cards and images  
        on the 2nd, 3rd, 5th, 6th levels of nesting on the page",""
"passed","Fri Mar 21 21:54:01 GMT 2025","Fri Mar 21 21:54:01 GMT 2025","11","tests","used_resources_page_test","TestUsedResourcesPage","","","Verify value of the title of the tab",""
"passed","Fri Mar 21 21:44:37 GMT 2025","Fri Mar 21 21:44:37 GMT 2025","120","tests","main_page_test","TestMainPage","","","Checking the clickability of the Registration button.",""
"broken","Fri Mar 21 21:28:26 GMT 2025","Fri Mar 21 21:28:26 GMT 2025","0","tests","contacts_page_test","TestContactsPage","","","Verify the composition and visibility of elements on the 1st level of nesting in the section 1",""
"passed","Fri Mar 21 21:37:46 GMT 2025","Fri Mar 21 21:37:49 GMT 2025","3129","tests","groups_page_test","TestGroupsPage","","","Verify presence, visibility of the title, tiles, links, images, subtitles on the page",""
"passed","Fri Mar 21 21:50:02 GMT 2025","Fri Mar 21 21:50:10 GMT 2025","8260","tests","Речевые упражнения.","TestCardsRU","","","Select random card from group ""Слова Королёвой"" and compare UI vs BACKEND data.",""
"skipped","Fri Mar 21 21:53:44 GMT 2025","Fri Mar 21 21:53:45 GMT 2025","1335","tests","Statistic.","TestCardsRU","","","Check statistic table.",""
"passed","Fri Mar 21 21:38:33 GMT 2025","Fri Mar 21 21:38:59 GMT 2025","26342","tests","groups_page_test","TestGroupsPage","","","Verify clickability, title, href, status code of links on the page",""
"passed","Fri Mar 21 21:33:13 GMT 2025","Fri Mar 21 21:33:13 GMT 2025","98","tests","exercises_ru_words_page_test","TestExercisesRuWordsPage","","","Verify value of the breadcrumbs on the page",""
"passed","Fri Mar 21 21:34:37 GMT 2025","Fri Mar 21 21:34:40 GMT 2025","3167","tests","exercises_ru_words_page_test","TestExercisesRuWordsPage","","","Verify if breadcrumbs link1 leads to the correct page after clicking",""
"passed","Fri Mar 21 21:34:50 GMT 2025","Fri Mar 21 21:34:50 GMT 2025","210","tests","exercises_ru_words_page_test","TestExercisesRuWordsPage","","","Verify if breadcrumbs link2 leads to the correct page after clicking",""
"passed","Fri Mar 21 21:29:46 GMT 2025","Fri Mar 21 21:29:46 GMT 2025","43","tests","contributors_page_test","TestContributorsPage","","","Verify values of title and subtitles with tags h2, h3 on the page",""
"passed","Fri Mar 21 21:28:37 GMT 2025","Fri Mar 21 21:28:37 GMT 2025","138","tests","contacts_page_test","TestContactsPage","","","Verify the composition and visibility of elements 
        on the 1st-5th levels of nesting in the section 2",""
"passed","Fri Mar 21 21:45:20 GMT 2025","Fri Mar 21 21:45:21 GMT 2025","1265","tests","registration_page_test","TestRegistrationPage","","","Check registration with an existing email",""
"passed","Fri Mar 21 21:47:19 GMT 2025","Fri Mar 21 21:47:20 GMT 2025","1703","tests","specialists_page_test","TestSpecialistsPage","","","Verify that the 'All Specialists' link leads an authorized user 
                         to the correct page after clicking",""
"passed","Fri Mar 21 21:40:58 GMT 2025","Fri Mar 21 21:41:03 GMT 2025","4884","tests","header_test","TestHeaderPage","","","Verify if internal links in the Header for an unauthorized user 
            lead to correct pages after click",""
