"Status","Start Time","Stop Time","Duration in ms","Parent Suite","Suite","Sub Suite","Test Class","Test Method","Name","Description"
"passed","Fri Mar 21 21:38:10 GMT 2025","Fri Mar 21 21:38:26 GMT 2025","16365","tests","groups_page_test","TestGroupsPage","","","Verify value of the title and subtitles on the page",""
"passed","Fri Mar 21 21:42:12 GMT 2025","Fri Mar 21 21:42:12 GMT 2025","27","tests","header_test","TestHeaderPage","","","Verify presence, visibility of the user name in the Header for an authorized user",""
"passed","Fri Mar 21 21:43:46 GMT 2025","Fri Mar 21 21:43:46 GMT 2025","55","tests","header_test","TestHeaderPage","","","Verify presence, visibility and attributes of the profile avatar in the Header 
               for an authorized user",""
"passed","Fri Mar 21 21:43:27 GMT 2025","Fri Mar 21 21:43:27 GMT 2025","40","tests","header_test","TestHeaderPage","","","Verify presence, visibility and attributes of the image in the 'Logo' link in the Header 
               for an authorized user",""
"passed","Fri Mar 21 21:36:41 GMT 2025","Fri Mar 21 21:36:45 GMT 2025","3434","tests","footer_test","TestFooter","","","Verify clickability, href, prefix and subject, status code of links in the Footer",""
"passed","Fri Mar 21 21:29:14 GMT 2025","Fri Mar 21 21:29:16 GMT 2025","1627","tests","contacts_page_test","TestContactsPage","","","Verify if links in the section 2 lead to the correct pages after clicking",""
"passed","Fri Mar 21 21:47:58 GMT 2025","Fri Mar 21 21:47:58 GMT 2025","95","tests","start_unauthorized_page_test","TestStartUnauthorizedPage","","","Verify content of the text in sections 1, 2",""
"passed","Fri Mar 21 21:35:35 GMT 2025","Fri Mar 21 21:35:52 GMT 2025","17706","tests","exercises_ru_words_page_test","TestExercisesRuWordsPage","","","Verify if subgroup links 1-4 lead to correct pages after clicking",""
"passed","Fri Mar 21 21:30:33 GMT 2025","Fri Mar 21 21:30:35 GMT 2025","1315","tests","description_page_test","TestDescriptionPage","","","Verify redirection to donate page not authorized user.",""
"passed","Fri Mar 21 21:40:41 GMT 2025","Fri Mar 21 21:40:41 GMT 2025","360","tests","header_test","TestHeaderPage","","","Verify presence, visibility of links, buttons in the Header for an unauthorized user",""
"passed","Fri Mar 21 21:53:50 GMT 2025","Fri Mar 21 21:53:50 GMT 2025","28","tests","used_resources_page_test","TestUsedResourcesPage","","","Verify presence and visibility of content on the page",""
"passed","Fri Mar 21 21:47:31 GMT 2025","Fri Mar 21 21:47:31 GMT 2025","158","tests","specialists_page_test","TestSpecialistsPage","","","Verify sizes of images in specialist cards in the grid",""
"skipped","Fri Mar 21 21:50:46 GMT 2025","Fri Mar 21 21:51:09 GMT 2025","22566","tests","Речевые упражнения.","TestCardsRU","","","Select a random card from ""Предложения"" group and compare UI vs BACKEND data.",""
"passed","Fri Mar 21 21:46:19 GMT 2025","Fri Mar 21 21:46:19 GMT 2025","32","tests","specialists_page_test","TestSpecialistsPage","","","Verify presence and visibility of content on the page",""
"passed","Fri Mar 21 21:30:44 GMT 2025","Fri Mar 21 21:30:44 GMT 2025","679","tests","description_page_test","TestDescriptionPage","","","Verify redirection to specialists page not authorized user.",""
"passed","Fri Mar 21 21:30:18 GMT 2025","Fri Mar 21 21:30:20 GMT 2025","1126","tests","contributors_page_test","TestContributorsPage","","","Verify sizes of images in contributor cards in grids",""
"passed","Fri Mar 21 21:43:52 GMT 2025","Fri Mar 21 21:43:52 GMT 2025","3","tests","login_page_test","TestLoginPage","","","Test for authorization customer.",""
"passed","Fri Mar 21 21:29:51 GMT 2025","Fri Mar 21 21:29:51 GMT 2025","19","tests","contributors_page_test","TestContributorsPage","","","Verify content of the text on the page",""
"passed","Fri Mar 21 21:30:04 GMT 2025","Fri Mar 21 21:30:05 GMT 2025","742","tests","contributors_page_test","TestContributorsPage","","","Verify clickability, href of links on the page",""
"passed","Fri Mar 21 21:30:58 GMT 2025","Fri Mar 21 21:30:59 GMT 2025","211","tests","description_page_test","TestDescriptionPage","","","Verify redirection to used resources page not authorized user.",""
"passed","Fri Mar 21 21:30:09 GMT 2025","Fri Mar 21 21:30:10 GMT 2025","640","tests","contributors_page_test","TestContributorsPage","","","Verify href, status code of the 'All Team' link",""
"passed","Fri Mar 21 21:37:55 GMT 2025","Fri Mar 21 21:38:04 GMT 2025","8188","tests","groups_page_test","TestGroupsPage","","","Verify value of the title of the tab",""
"passed","Fri Mar 21 21:50:32 GMT 2025","Fri Mar 21 21:50:40 GMT 2025","7990","tests","Речевые упражнения.","TestCardsRU","","","Select a random card from ""Группа слов"" group and compare UI vs BACKEND data.",""
"passed","Fri Mar 21 21:30:00 GMT 2025","Fri Mar 21 21:30:00 GMT 2025","456","tests","contributors_page_test","TestContributorsPage","","","Verify text in card links and the 'All Team' link",""
"passed","Fri Mar 21 21:37:20 GMT 2025","Fri Mar 21 21:37:24 GMT 2025","3427","tests","footer_test","TestFooter","","","Verify Footer invisibility through the modal window with the exercise",""
"passed","Fri Mar 21 21:36:25 GMT 2025","Fri Mar 21 21:36:25 GMT 2025","248","tests","footer_test","TestFooter","","","Verify composition and visibility of elements on the 1st-7th levels of nesting in the Footer",""
"passed","Fri Mar 21 21:44:06 GMT 2025","Fri Mar 21 21:44:07 GMT 2025","1099","tests","main_page_test","TestMainPage","","","Verify redirection to donate page not authorized user.",""
"passed","Fri Mar 21 21:44:33 GMT 2025","Fri Mar 21 21:44:33 GMT 2025","103","tests","main_page_test","TestMainPage","","","Checking the clickability of the Start button.",""
"passed","Fri Mar 21 21:44:29 GMT 2025","Fri Mar 21 21:44:29 GMT 2025","178","tests","main_page_test","TestMainPage","","","Verify redirection to used resources page not authorized user.",""
"passed","Fri Mar 21 21:37:10 GMT 2025","Fri Mar 21 21:37:10 GMT 2025","90","tests","footer_test","TestFooter","","","Verify attributes of images in links in the Footer",""
"passed","Fri Mar 21 21:29:08 GMT 2025","Fri Mar 21 21:29:09 GMT 2025","962","tests","contacts_page_test","TestContactsPage","","","Verify presence, visibility, clickability, href, prefix, status code of links in the section 2",""
"passed","Fri Mar 21 21:54:28 GMT 2025","Fri Mar 21 21:54:29 GMT 2025","1172","tests","used_resources_page_test","TestUsedResourcesPage","","","Verify that links in the sections lead to the correct pages after clicking",""
"passed","Fri Mar 21 21:46:24 GMT 2025","Fri Mar 21 21:46:25 GMT 2025","328","tests","specialists_page_test","TestSpecialistsPage","","","Verify the composition and visibility of elements 
        on the 1st-6th levels of nesting on the page",""
"passed","Fri Mar 21 21:54:34 GMT 2025","Fri Mar 21 21:54:34 GMT 2025","59","tests","used_resources_page_test","TestUsedResourcesPage","","","Verify presence, visibility and attributes of icons in sections",""
"passed","Fri Mar 21 21:41:25 GMT 2025","Fri Mar 21 21:41:25 GMT 2025","47","tests","header_test","TestHeaderPage","","","Verify presence, visibility and attributes of the image in the 'Logo' link in the Header 
               on the Start Unauthorized Page",""
"passed","Fri Mar 21 21:28:52 GMT 2025","Fri Mar 21 21:28:52 GMT 2025","51","tests","contacts_page_test","TestContactsPage","","","Verify values of the title and subtitles with tags h1, h2 on the page",""
"passed","Fri Mar 21 21:29:25 GMT 2025","Fri Mar 21 21:29:25 GMT 2025","272","tests","contributors_page_test","TestContributorsPage","","","Verify presence, visibility and structure of content on the page",""
"passed","Fri Mar 21 21:43:00 GMT 2025","Fri Mar 21 21:43:00 GMT 2025","85","tests","header_test","TestHeaderPage","","","Verify that the 'Logo' link on the Start Authorized Page 
                             doesn't refresh the current page or lead to other pages after clicking",""
"passed","Fri Mar 21 21:32:10 GMT 2025","Fri Mar 21 21:32:10 GMT 2025","109","tests","exercises_ru_similar_phrases_page_test","TestExercisesRuSimilarPhrasesPage","","","Verify text in cards on the page",""
"passed","Fri Mar 21 21:33:43 GMT 2025","Fri Mar 21 21:33:45 GMT 2025","2003","tests","exercises_ru_words_page_test","TestExercisesRuWordsPage","","","Verify clickability, href, status code of links in breadcrumbs on the page",""
"skipped","Fri Mar 21 21:51:16 GMT 2025","Fri Mar 21 21:51:38 GMT 2025","22478","tests","Речевые упражнения.","TestCardsRU","","","Select a random card from ""Слова с частотной группировкой"" group and compare UI vs BACKEND data.",""
"passed","Fri Mar 21 21:54:39 GMT 2025","Fri Mar 21 21:54:39 GMT 2025","75","tests","used_resources_page_test","TestUsedResourcesPage","","","Verify sizes of icons in sections",""
"passed","Fri Mar 21 21:33:23 GMT 2025","Fri Mar 21 21:33:23 GMT 2025","149","tests","exercises_ru_words_page_test","TestExercisesRuWordsPage","","","Verify text in group links on the page",""
"passed","Fri Mar 21 21:28:42 GMT 2025","Fri Mar 21 21:28:42 GMT 2025","181","tests","contacts_page_test","TestContactsPage","","","Verify presence, visibility of sections, the dividing line and elements with text on the page",""
"passed","Fri Mar 21 21:36:37 GMT 2025","Fri Mar 21 21:36:37 GMT 2025","49","tests","footer_test","TestFooter","","","Verify text in the 'Contact us' link in the Footer",""
"passed","Fri Mar 21 21:44:41 GMT 2025","Fri Mar 21 21:45:07 GMT 2025","25581","tests","profile_page_test","TestProfilePage","","","Change the password by receiving an email link",""
"passed","Fri Mar 21 21:40:26 GMT 2025","Fri Mar 21 21:40:37 GMT 2025","10218","tests","header_test","TestHeaderPage","","","Verify composition, visibility of elements on the 1st-6th levels of nesting in the Header
            for an unauthorized user",""
"passed","Fri Mar 21 21:47:50 GMT 2025","Fri Mar 21 21:47:50 GMT 2025","12","tests","start_unauthorized_page_test","TestStartUnauthorizedPage","","","Verify value of the title of the tab",""
"passed","Fri Mar 21 21:45:11 GMT 2025","Fri Mar 21 21:45:16 GMT 2025","5111","tests","registration_page_test","TestRegistrationPage","","","Check registration with new email",""
"passed","Fri Mar 21 21:44:10 GMT 2025","Fri Mar 21 21:44:11 GMT 2025","210","tests","main_page_test","TestMainPage","","","Verify redirection to contacts page not authorized user.",""
"passed","Fri Mar 21 21:54:06 GMT 2025","Fri Mar 21 21:54:06 GMT 2025","32","tests","used_resources_page_test","TestUsedResourcesPage","","","Verify value of title with tag 'h1' on the page",""
"passed","Fri Mar 21 21:30:24 GMT 2025","Fri Mar 21 21:30:24 GMT 2025","157","tests","description_page_test","TestDescriptionPage","","","Verify return main page from description page.",""
"passed","Fri Mar 21 21:40:49 GMT 2025","Fri Mar 21 21:40:54 GMT 2025","5269","tests","header_test","TestHeaderPage","","","Verify clickability, href, status code of links in the Header for an unauthorized user",""
"passed","Fri Mar 21 21:35:10 GMT 2025","Fri Mar 21 21:35:25 GMT 2025","14486","tests","exercises_ru_words_page_test","TestExercisesRuWordsPage","","","Verify if group links lead to correct pages after clicking",""
"passed","Fri Mar 21 21:47:35 GMT 2025","Fri Mar 21 21:47:35 GMT 2025","34","tests","start_unauthorized_page_test","TestStartUnauthorizedPage","","","Verify presence and visibility of content on the page",""
"passed","Fri Mar 21 21:44:19 GMT 2025","Fri Mar 21 21:44:20 GMT 2025","1261","tests","main_page_test","TestMainPage","","","Verify redirection to github not authorized user.",""
"passed","Fri Mar 21 21:36:33 GMT 2025","Fri Mar 21 21:36:33 GMT 2025","61","tests","footer_test","TestFooter","","","Verify content of text in the Footer",""
"passed","Fri Mar 21 21:29:55 GMT 2025","Fri Mar 21 21:29:56 GMT 2025","1368","tests","contributors_page_test","TestContributorsPage","","","Verify values of the text in card descriptions",""
"passed","Fri Mar 21 21:36:49 GMT 2025","Fri Mar 21 21:37:01 GMT 2025","12500","tests","footer_test","TestFooter","","","Verify that links in the Footer lead to correct pages after clicking",""
"passed","Fri Mar 21 21:31:40 GMT 2025","Fri Mar 21 21:31:40 GMT 2025","56","tests","exercises_ru_similar_phrases_page_test","TestExercisesRuSimilarPhrasesPage","","","Verify value of the title of the tab",""
"passed","Fri Mar 21 21:43:20 GMT 2025","Fri Mar 21 21:43:20 GMT 2025","384","tests","header_test","TestHeaderPage","","","Verify user logout after clicking the 'Logout' button in the Header for an authorized user",""
"passed","Fri Mar 21 21:31:50 GMT 2025","Fri Mar 21 21:31:50 GMT 2025","83","tests","exercises_ru_similar_phrases_page_test","TestExercisesRuSimilarPhrasesPage","","","Verify value of the breadcrumbs on the page",""
"passed","Fri Mar 21 21:43:56 GMT 2025","Fri Mar 21 21:43:56 GMT 2025","136","tests","main_page_test","TestMainPage","","","Verify redirection to description page not authorized user.",""
"passed","Fri Mar 21 21:41:13 GMT 2025","Fri Mar 21 21:41:13 GMT 2025","132","tests","header_test","TestHeaderPage","","","Verify that the 'Logo' link on the Start Unauthorized Page 
                             doesn't refresh the current page or lead to other pages after clicking",""
"passed","Fri Mar 21 21:41:17 GMT 2025","Fri Mar 21 21:41:17 GMT 2025","294","tests","header_test","TestHeaderPage","","","Verify the dropdown opens/closes after clicking on the 'More' button in the Header 
            on the Start Unauthorized Page",""
"skipped","Fri Mar 21 21:48:53 GMT 2025","Fri Mar 21 21:49:14 GMT 2025","20167","tests","Speech exercises EN.","TestCardsEN","","","Check progres-bar and buttons.",""
"skipped","Fri Mar 21 21:44:38 GMT 2025","Fri Mar 21 21:44:38 GMT 2025","0","tests","main_page_test","TestMainPage","","","Checking the ip is available",""
"passed","Fri Mar 21 21:40:45 GMT 2025","Fri Mar 21 21:40:45 GMT 2025","193","tests","header_test","TestHeaderPage","","","Verify values of the text in links, buttons in the Header for an unauthorized user",""
"passed","Fri Mar 21 21:47:06 GMT 2025","Fri Mar 21 21:47:06 GMT 2025","645","tests","specialists_page_test","TestSpecialistsPage","","","Verify clickability, href, status code of the 'All Specialists' link",""
"passed","Fri Mar 21 21:41:36 GMT 2025","Fri Mar 21 21:41:36 GMT 2025","36","tests","header_test","TestHeaderPage","","","Verify presence and visibility of the Header for an authorized user",""
"passed","Fri Mar 21 21:28:47 GMT 2025","Fri Mar 21 21:28:47 GMT 2025","11","tests","contacts_page_test","TestContactsPage","","","Verify value of the title of the tab",""
"passed","Fri Mar 21 21:30:14 GMT 2025","Fri Mar 21 21:30:14 GMT 2025","823","tests","contributors_page_test","TestContributorsPage","","","Verify attribute values of images in contributors cards in grids",""
"passed","Fri Mar 21 21:33:03 GMT 2025","Fri Mar 21 21:33:03 GMT 2025","70","tests","exercises_ru_words_page_test","TestExercisesRuWordsPage","","","Verify value of the title of the tab",""
"passed","Fri Mar 21 21:48:02 GMT 2025","Fri Mar 21 21:48:02 GMT 2025","41","tests","start_unauthorized_page_test","TestStartUnauthorizedPage","","","Verify text in the 'Login' link in the section 1",""
"passed","Fri Mar 21 21:28:20 GMT 2025","Fri Mar 21 21:28:21 GMT 2025","960","tests","authorisation_page_test","TestAuthorizedUserPage","","","Checking the possibility of authorization with incorrect data",""
"passed","Fri Mar 21 21:54:21 GMT 2025","Fri Mar 21 21:54:22 GMT 2025","1218","tests","used_resources_page_test","TestUsedResourcesPage","","","Verify presence, visibility, clickability, href, status code of links in sections",""
"passed","Fri Mar 21 21:47:12 GMT 2025","Fri Mar 21 21:47:12 GMT 2025","633","tests","specialists_page_test","TestSpecialistsPage","","","Verify that the 'All Specialists' link leads an unauthorized user 
                         to the correct page after clicking",""
"passed","Fri Mar 21 21:49:47 GMT 2025","Fri Mar 21 21:49:55 GMT 2025","8120","tests","Речевые упражнения.","TestCardsRU","","","Select random card from group ""Слова"" and compare UI vs BACKEND data.",""
"skipped","Fri Mar 21 21:49:20 GMT 2025","Fri Mar 21 21:49:40 GMT 2025","20211","tests","Speech exercises EN.","TestCardsEN","","","Select a random card from ""Similar phrases"" group and compare UI vs BACKEND data",""
"passed","Fri Mar 21 21:47:25 GMT 2025","Fri Mar 21 21:47:26 GMT 2025","110","tests","specialists_page_test","TestSpecialistsPage","","","Verify attributes of images in specialist cards in the grid",""
"passed","Fri Mar 21 21:45:39 GMT 2025","Fri Mar 21 21:45:40 GMT 2025","750","tests","registration_page_test","TestRegistrationPage","","","Check registration with new email and empty birthday",""
"passed","Fri Mar 21 21:42:51 GMT 2025","Fri Mar 21 21:42:53 GMT 2025","1865","tests","header_test","TestHeaderPage","","","Verify if external links in the Header for an authorized user 
            lead to correct pages after click",""
"passed","Fri Mar 21 21:47:42 GMT 2025","Fri Mar 21 21:47:43 GMT 2025","84","tests","start_unauthorized_page_test","TestStartUnauthorizedPage","","","Verify the composition and visibility of elements 
        on the 1st-3rd levels of nesting in the section 1",""
"passed","Fri Mar 21 21:28:15 GMT 2025","Fri Mar 21 21:28:16 GMT 2025","952","tests","authorisation_page_test","TestAuthorizedUserPage","","","Checking the possibility of authorization with the correct data",""
"passed","Fri Mar 21 21:31:09 GMT 2025","Fri Mar 21 21:31:09 GMT 2025","73","tests","exercises_ru_similar_phrases_page_test","TestExercisesRuSimilarPhrasesPage","","","Verify presence and visibility of content on the page",""
"passed","Fri Mar 21 21:28:58 GMT 2025","Fri Mar 21 21:28:58 GMT 2025","29","tests","contacts_page_test","TestContactsPage","","","Verify content of the text in the section 2",""
"passed","Fri Mar 21 21:32:00 GMT 2025","Fri Mar 21 21:32:00 GMT 2025","111","tests","exercises_ru_similar_phrases_page_test","TestExercisesRuSimilarPhrasesPage","","","Verify text in group links on the page",""
"passed","Fri Mar 21 21:47:46 GMT 2025","Fri Mar 21 21:47:46 GMT 2025","114","tests","start_unauthorized_page_test","TestStartUnauthorizedPage","","","Verify the composition and visibility of elements 
        on the 1st-3rd levels of nesting in the section 2",""
"passed","Fri Mar 21 21:44:00 GMT 2025","Fri Mar 21 21:44:02 GMT 2025","1491","tests","main_page_test","TestMainPage","","","Verify redirection to telegram page not authorized user.",""
"passed","Fri Mar 21 21:43:07 GMT 2025","Fri Mar 21 21:43:07 GMT 2025","268","tests","header_test","TestHeaderPage","","","Verify the dropdown opens/closes after clicking on the 'More' button in the Header 
               for an authorized user",""
"passed","Fri Mar 21 21:33:33 GMT 2025","Fri Mar 21 21:33:33 GMT 2025","530","tests","exercises_ru_words_page_test","TestExercisesRuWordsPage","","","Verify text in cards on the page",""
"passed","Fri Mar 21 21:29:03 GMT 2025","Fri Mar 21 21:29:03 GMT 2025","28","tests","contacts_page_test","TestContactsPage","","","Verify text in links in the section 2",""
"passed","Fri Mar 21 21:48:19 GMT 2025","Fri Mar 21 21:48:19 GMT 2025","61","tests","start_unauthorized_page_test","TestStartUnauthorizedPage","","","Verify size of the image in the section 1",""
"passed","Fri Mar 21 21:48:07 GMT 2025","Fri Mar 21 21:48:07 GMT 2025","683","tests","start_unauthorized_page_test","TestStartUnauthorizedPage","","","Verify presence, visibility, clickability, href, status code 
                         of the 'Login' link in the section 1",""
"passed","Fri Mar 21 21:33:55 GMT 2025","Fri Mar 21 21:33:55 GMT 2025","313","tests","exercises_ru_words_page_test","TestExercisesRuWordsPage","","","Verify clickability, titles, attributes of group links on the page",""
"passed","Fri Mar 21 21:36:21 GMT 2025","Fri Mar 21 21:36:21 GMT 2025","41","tests","footer_test","TestFooter","","","Verify presence and visibility of the Footer",""
"passed","Fri Mar 21 21:41:21 GMT 2025","Fri Mar 21 21:41:21 GMT 2025","203","tests","header_test","TestHeaderPage","","","Verify switching of the 'ru', 'en' buttons in the Header on the Start Unauthorized Page",""
"passed","Fri Mar 21 21:54:11 GMT 2025","Fri Mar 21 21:54:11 GMT 2025","32","tests","used_resources_page_test","TestUsedResourcesPage","","","Verify content of the text on the page",""
"passed","Fri Mar 21 21:31:30 GMT 2025","Fri Mar 21 21:31:30 GMT 2025","303","tests","exercises_ru_similar_phrases_page_test","TestExercisesRuSimilarPhrasesPage","","","Verify presence, visibility of lists on the page",""
"passed","Fri Mar 21 21:39:58 GMT 2025","Fri Mar 21 21:40:06 GMT 2025","8207","tests","groups_page_test","TestGroupsPage","","","Verify attributes of images in links on the page",""
"passed","Fri Mar 21 21:29:21 GMT 2025","Fri Mar 21 21:29:21 GMT 2025","105","tests","contacts_page_test","TestContactsPage","","","Verify that the email link calls an email client",""
"passed","Fri Mar 21 21:42:31 GMT 2025","Fri Mar 21 21:42:45 GMT 2025","13935","tests","header_test","TestHeaderPage","","","Verify if internal links in the Header for an authorized user 
            lead to correct pages after click",""
"skipped","Fri Mar 21 21:48:26 GMT 2025","Fri Mar 21 21:48:46 GMT 2025","20648","tests","Speech exercises EN.","TestCardsEN","","","Select random card from ""Word"" group and compare UI vs BACKEND data",""
"passed","Fri Mar 21 21:48:15 GMT 2025","Fri Mar 21 21:48:15 GMT 2025","78","tests","start_unauthorized_page_test","TestStartUnauthorizedPage","","","Verify presence, visibility and attributes of the image in the section 1",""
"passed","Fri Mar 21 21:47:39 GMT 2025","Fri Mar 21 21:47:39 GMT 2025","40","tests","start_unauthorized_page_test","TestStartUnauthorizedPage","","","Verify amount and visibility of sections with content on the page",""
"passed","Fri Mar 21 21:32:52 GMT 2025","Fri Mar 21 21:32:54 GMT 2025","1364","tests","exercises_ru_words_page_test","TestExercisesRuWordsPage","","","Verify presence, visibility of lists on the page",""
"passed","Fri Mar 21 21:53:55 GMT 2025","Fri Mar 21 21:53:55 GMT 2025","119","tests","used_resources_page_test","TestUsedResourcesPage","","","Verify the composition and visibility of elements 
        on the 1st-4th levels of nesting on the page",""
"passed","Fri Mar 21 21:42:06 GMT 2025","Fri Mar 21 21:42:06 GMT 2025","194","tests","header_test","TestHeaderPage","","","Verify values of the text in links, buttons in the Header for an authorized user",""
"passed","Fri Mar 21 21:37:14 GMT 2025","Fri Mar 21 21:37:14 GMT 2025","108","tests","footer_test","TestFooter","","","Verify sizes of images in links in the Footer",""
"passed","Fri Mar 21 21:45:44 GMT 2025","Fri Mar 21 21:45:44 GMT 2025","736","tests","registration_page_test","TestRegistrationPage","","","Check registration with new email and empty email",""
"passed","Fri Mar 21 21:37:05 GMT 2025","Fri Mar 21 21:37:06 GMT 2025","120","tests","footer_test","TestFooter","","","Verify that the 'Contact us' link in the Footer calls an email client",""
"passed","Fri Mar 21 21:28:26 GMT 2025","Fri Mar 21 21:28:26 GMT 2025","27","tests","contacts_page_test","TestContactsPage","","","Verify presence and visibility of content on the page",""
"passed","Fri Mar 21 21:43:39 GMT 2025","Fri Mar 21 21:43:39 GMT 2025","46","tests","header_test","TestHeaderPage","","","Verify presence, visibility, attributes of icons in the Header for an authorized user",""
"passed","Fri Mar 21 21:41:07 GMT 2025","Fri Mar 21 21:41:09 GMT 2025","1920","tests","header_test","TestHeaderPage","","","Verify if external links in the Header for an unauthorized user 
            lead to correct pages after click",""
"passed","Fri Mar 21 21:45:30 GMT 2025","Fri Mar 21 21:45:30 GMT 2025","747","tests","registration_page_test","TestRegistrationPage","","","Check registration with new email and empty password",""
"passed","Fri Mar 21 21:29:35 GMT 2025","Fri Mar 21 21:29:38 GMT 2025","3675","tests","contributors_page_test","TestContributorsPage","","","Verify presence, visibility of titles/subtitles, cards, descriptions, links, images on the page",""
"passed","Fri Mar 21 21:54:16 GMT 2025","Fri Mar 21 21:54:16 GMT 2025","28","tests","used_resources_page_test","TestUsedResourcesPage","","","Verify text in links in sections",""
"passed","Fri Mar 21 21:29:29 GMT 2025","Fri Mar 21 21:29:31 GMT 2025","1708","tests","contributors_page_test","TestContributorsPage","","","Verify the composition and visibility of elements 
        on the 1st-5th levels of nesting on the page",""
"passed","Fri Mar 21 21:41:29 GMT 2025","Fri Mar 21 21:41:29 GMT 2025","51","tests","header_test","TestHeaderPage","","","Verify size of the image in the 'Logo' link in the Header on the Start Unauthorized Page",""
"passed","Fri Mar 21 21:47:54 GMT 2025","Fri Mar 21 21:47:54 GMT 2025","50","tests","start_unauthorized_page_test","TestStartUnauthorizedPage","","","Verify values of titles and subtitles with tags h2, h4 on the page",""
"skipped","Fri Mar 21 21:53:31 GMT 2025","Fri Mar 21 21:53:37 GMT 2025","5467","tests","Речевые упражнения.","TestCardsRU","","","Solutions to a random task in the ""Слова"" group and comparison of statics.",""
"passed","Fri Mar 21 21:45:53 GMT 2025","Fri Mar 21 21:46:14 GMT 2025","20803","tests","registration_page_test","TestRegistrationPage","","","Check registration without choosing agreement",""
"passed","Fri Mar 21 21:36:02 GMT 2025","Fri Mar 21 21:36:02 GMT 2025","537","tests","exercises_ru_words_page_test","TestExercisesRuWordsPage","","","Verify attributes of images in links on the page",""
