"Status","Start Time","Stop Time","Duration in ms","Parent Suite","Suite","Sub Suite","Test Class","Test Method","Name","Description"
"passed","Fri Apr 04 20:10:25 GMT 2025","Fri Apr 04 20:10:26 GMT 2025","772","tests","registration_page_test","TestRegistrationPage","","","Check registration with new email and empty password",""
"skipped","Fri Apr 04 20:13:49 GMT 2025","Fri Apr 04 20:14:10 GMT 2025","20178","tests","Speech exercises EN.","TestCardsEN","","","Check progres-bar and buttons.",""
"passed","Fri Apr 04 19:53:15 GMT 2025","Fri Apr 04 19:53:15 GMT 2025","19","tests","contacts_page_test","TestContactsPage","","","Verify the composition and visibility of elements on the 1st level of nesting in the section 1",""
"passed","Fri Apr 04 20:06:45 GMT 2025","Fri Apr 04 20:06:55 GMT 2025","10248","tests","header_test","TestHeaderPage","","","Verify composition, visibility of elements on the 1st-6th levels of nesting in the Header
            for an authorized user",""
"passed","Fri Apr 04 20:04:07 GMT 2025","Fri Apr 04 20:04:25 GMT 2025","18315","tests","groups_page_test","TestGroupsPage","","","Verify if links on the 'ru' local lead to correct pages after clicking",""
"passed","Fri Apr 04 19:54:08 GMT 2025","Fri Apr 04 19:54:09 GMT 2025","1270","tests","contributors_page_test","TestContributorsPage","","","Verify presence, visibility and structure of content on the page",""
"passed","Fri Apr 04 19:54:47 GMT 2025","Fri Apr 04 19:54:48 GMT 2025","752","tests","contributors_page_test","TestContributorsPage","","","Verify clickability, href of links on the page",""
"passed","Fri Apr 04 20:03:11 GMT 2025","Fri Apr 04 20:03:27 GMT 2025","16370","tests","groups_page_test","TestGroupsPage","","","Verify value of the title and subtitles on the page",""
"passed","Fri Apr 04 20:05:42 GMT 2025","Fri Apr 04 20:05:43 GMT 2025","370","tests","header_test","TestHeaderPage","","","Verify presence, visibility of links, buttons in the Header for an unauthorized user",""
"passed","Fri Apr 04 20:11:45 GMT 2025","Fri Apr 04 20:11:45 GMT 2025","33","tests","specialists_page_test","TestSpecialistsPage","","","Verify value of text on the page",""
"passed","Fri Apr 04 20:08:30 GMT 2025","Fri Apr 04 20:08:30 GMT 2025","41","tests","header_test","TestHeaderPage","","","Verify presence, visibility and attributes of the image in the 'Logo' link in the Header 
               for an authorized user",""
"passed","Fri Apr 04 20:06:23 GMT 2025","Fri Apr 04 20:06:23 GMT 2025","225","tests","header_test","TestHeaderPage","","","Verify switching of the 'ru', 'en' buttons in the Header on the Start Unauthorized Page",""
"passed","Fri Apr 04 19:55:30 GMT 2025","Fri Apr 04 19:55:32 GMT 2025","1534","tests","description_page_test","TestDescriptionPage","","","Verify redirection to github not authorized user.",""
"passed","Fri Apr 04 20:01:32 GMT 2025","Fri Apr 04 20:01:32 GMT 2025","47","tests","footer_test","TestFooter","","","Verify text in the 'Contact us' link in the Footer",""
"passed","Fri Apr 04 20:01:20 GMT 2025","Fri Apr 04 20:01:20 GMT 2025","253","tests","footer_test","TestFooter","","","Verify composition and visibility of elements on the 1st-7th levels of nesting in the Footer",""
"passed","Fri Apr 04 20:09:27 GMT 2025","Fri Apr 04 20:09:28 GMT 2025","1250","tests","main_page_test","TestMainPage","","","Verify redirection to github not authorized user.",""
"passed","Fri Apr 04 20:09:44 GMT 2025","Fri Apr 04 20:09:45 GMT 2025","123","tests","main_page_test","TestMainPage","","","Checking the clickability of the Registration button.",""
"passed","Fri Apr 04 20:12:06 GMT 2025","Fri Apr 04 20:12:07 GMT 2025","636","tests","specialists_page_test","TestSpecialistsPage","","","Verify that the 'All Specialists' link leads an unauthorized user 
                         to the correct page after clicking",""
"passed","Fri Apr 04 19:53:36 GMT 2025","Fri Apr 04 19:53:36 GMT 2025","51","tests","contacts_page_test","TestContactsPage","","","Verify values of the title and subtitles with tags h1, h2 on the page",""
"passed","Fri Apr 04 19:54:30 GMT 2025","Fri Apr 04 19:54:30 GMT 2025","42","tests","contributors_page_test","TestContributorsPage","","","Verify values of title and subtitles with tags h2, h3 on the page",""
"passed","Fri Apr 04 20:07:55 GMT 2025","Fri Apr 04 20:07:57 GMT 2025","2021","tests","header_test","TestHeaderPage","","","Verify if external links in the Header for an authorized user 
            lead to correct pages after click",""
"passed","Fri Apr 04 20:06:15 GMT 2025","Fri Apr 04 20:06:15 GMT 2025","149","tests","header_test","TestHeaderPage","","","Verify that the 'Logo' link on the Start Unauthorized Page 
                             doesn't refresh the current page or lead to other pages after clicking",""
"passed","Fri Apr 04 20:01:36 GMT 2025","Fri Apr 04 20:01:44 GMT 2025","8150","tests","footer_test","TestFooter","","","Verify clickability, href, prefix and subject, status code of links in the Footer",""
"passed","Fri Apr 04 20:13:02 GMT 2025","Fri Apr 04 20:13:02 GMT 2025","708","tests","start_unauthorized_page_test","TestStartUnauthorizedPage","","","Verify presence, visibility, clickability, href, status code 
                         of the 'Login' link in the section 1",""
"passed","Fri Apr 04 20:13:15 GMT 2025","Fri Apr 04 20:13:15 GMT 2025","60","tests","start_unauthorized_page_test","TestStartUnauthorizedPage","","","Verify size of the image in the section 1",""
"passed","Fri Apr 04 20:18:27 GMT 2025","Fri Apr 04 20:18:27 GMT 2025","32","tests","used_resources_page_test","TestUsedResourcesPage","","","Verify content of the text on the page",""
"passed","Fri Apr 04 19:53:57 GMT 2025","Fri Apr 04 19:53:58 GMT 2025","1526","tests","contacts_page_test","TestContactsPage","","","Verify if links in the section 2 lead to the correct pages after clicking",""
"skipped","Fri Apr 04 20:14:16 GMT 2025","Fri Apr 04 20:14:36 GMT 2025","20156","tests","Speech exercises EN.","TestCardsEN","","","Select a random card from ""Similar phrases"" group and compare UI vs BACKEND data",""
"passed","Fri Apr 04 20:08:03 GMT 2025","Fri Apr 04 20:08:03 GMT 2025","90","tests","header_test","TestHeaderPage","","","Verify that the 'Logo' link on the Start Authorized Page 
                             doesn't refresh the current page or lead to other pages after clicking",""
"passed","Fri Apr 04 19:53:04 GMT 2025","Fri Apr 04 19:53:05 GMT 2025","954","tests","authorisation_page_test","TestAuthorizedUserPage","","","Checking the possibility of authorization with incorrect data",""
"passed","Fri Apr 04 19:58:58 GMT 2025","Fri Apr 04 19:59:21 GMT 2025","23159","tests","exercises_ru_words_page_test","TestExercisesRuWordsPage","","","Verify clickability, titles, href, status code of subgroup links on the page",""
"passed","Fri Apr 04 19:54:04 GMT 2025","Fri Apr 04 19:54:04 GMT 2025","103","tests","contacts_page_test","TestContactsPage","","","Verify that the email link calls an email client",""
"passed","Fri Apr 04 19:58:16 GMT 2025","Fri Apr 04 19:58:16 GMT 2025","303","tests","exercises_ru_words_page_test","TestExercisesRuWordsPage","","","Verify text in group links on the page",""
"passed","Fri Apr 04 20:07:35 GMT 2025","Fri Apr 04 20:07:49 GMT 2025","14137","tests","header_test","TestHeaderPage","","","Verify if internal links in the Header for an authorized user 
            lead to correct pages after click",""
"passed","Fri Apr 04 20:08:23 GMT 2025","Fri Apr 04 20:08:24 GMT 2025","404","tests","header_test","TestHeaderPage","","","Verify user logout after clicking the 'Logout' button in the Header for an authorized user",""
"passed","Fri Apr 04 19:56:41 GMT 2025","Fri Apr 04 19:56:41 GMT 2025","114","tests","exercises_ru_similar_phrases_page_test","TestExercisesRuSimilarPhrasesPage","","","Verify text in group links on the page",""
"passed","Fri Apr 04 19:56:51 GMT 2025","Fri Apr 04 19:56:51 GMT 2025","120","tests","exercises_ru_similar_phrases_page_test","TestExercisesRuSimilarPhrasesPage","","","Verify text in cards on the page",""
"passed","Fri Apr 04 19:57:45 GMT 2025","Fri Apr 04 19:57:46 GMT 2025","1505","tests","exercises_ru_words_page_test","TestExercisesRuWordsPage","","","Verify presence, visibility of lists on the page",""
"passed","Fri Apr 04 20:06:00 GMT 2025","Fri Apr 04 20:06:05 GMT 2025","4871","tests","header_test","TestHeaderPage","","","Verify if internal links in the Header for an unauthorized user 
            lead to correct pages after click",""
"passed","Fri Apr 04 20:17:59 GMT 2025","Fri Apr 04 20:18:01 GMT 2025","1488","tests","Statistic.","TestCardsRU","","","Check statistic table.",""
"skipped","Fri Apr 04 20:13:22 GMT 2025","Fri Apr 04 20:13:43 GMT 2025","20659","tests","Speech exercises EN.","TestCardsEN","","","Select random card from ""Word"" group and compare UI vs BACKEND data",""
"passed","Fri Apr 04 19:57:22 GMT 2025","Fri Apr 04 19:57:23 GMT 2025","348","tests","exercises_ru_words_page_test","TestExercisesRuWordsPage","","","Verify presence and visibility of content on the page",""
"skipped","Fri Apr 04 20:17:46 GMT 2025","Fri Apr 04 20:17:53 GMT 2025","6807","tests","Речевые упражнения.","TestCardsRU","","","Solutions to a random task in the ""Слова"" group and comparison of statics.",""
"passed","Fri Apr 04 20:00:04 GMT 2025","Fri Apr 04 20:00:19 GMT 2025","14578","tests","exercises_ru_words_page_test","TestExercisesRuWordsPage","","","Verify if group links lead to correct pages after clicking",""
"passed","Fri Apr 04 20:00:56 GMT 2025","Fri Apr 04 20:00:57 GMT 2025","614","tests","exercises_ru_words_page_test","TestExercisesRuWordsPage","","","Verify attributes of images in links on the page",""
"passed","Fri Apr 04 20:03:34 GMT 2025","Fri Apr 04 20:04:00 GMT 2025","26344","tests","groups_page_test","TestGroupsPage","","","Verify clickability, title, href, status code of links on the page",""
"passed","Fri Apr 04 20:05:00 GMT 2025","Fri Apr 04 20:05:08 GMT 2025","8236","tests","groups_page_test","TestGroupsPage","","","Verify attributes of images in links on the page",""
"passed","Fri Apr 04 20:09:13 GMT 2025","Fri Apr 04 20:09:14 GMT 2025","1172","tests","main_page_test","TestMainPage","","","Verify redirection to donate page not authorized user.",""
"passed","Fri Apr 04 19:58:36 GMT 2025","Fri Apr 04 19:58:38 GMT 2025","1872","tests","exercises_ru_words_page_test","TestExercisesRuWordsPage","","","Verify clickability, href, status code of links in breadcrumbs on the page",""
"passed","Fri Apr 04 19:56:12 GMT 2025","Fri Apr 04 19:56:12 GMT 2025","294","tests","exercises_ru_similar_phrases_page_test","TestExercisesRuSimilarPhrasesPage","","","Verify presence, visibility of lists on the page",""
"passed","Fri Apr 04 19:57:01 GMT 2025","Fri Apr 04 19:57:03 GMT 2025","1963","tests","exercises_ru_similar_phrases_page_test","TestExercisesRuSimilarPhrasesPage","","","Verify clickability, href of links in breadcrumbs on the page",""
"passed","Fri Apr 04 20:18:51 GMT 2025","Fri Apr 04 20:18:52 GMT 2025","57","tests","used_resources_page_test","TestUsedResourcesPage","","","Verify presence, visibility and attributes of icons in sections",""
"passed","Fri Apr 04 20:10:48 GMT 2025","Fri Apr 04 20:11:09 GMT 2025","20836","tests","registration_page_test","TestRegistrationPage","","","Check registration without choosing agreement",""
"passed","Fri Apr 04 20:06:31 GMT 2025","Fri Apr 04 20:06:31 GMT 2025","53","tests","header_test","TestHeaderPage","","","Verify size of the image in the 'Logo' link in the Header on the Start Unauthorized Page",""
"passed","Fri Apr 04 20:10:30 GMT 2025","Fri Apr 04 20:10:30 GMT 2025","791","tests","registration_page_test","TestRegistrationPage","","","Check registration with new email and empty first name",""
