"Status","Start Time","Stop Time","Duration in ms","Parent Suite","Suite","Sub Suite","Test Class","Test Method","Name","Description"
"passed","Sun Mar 23 01:21:38 GMT 2025","Sun Mar 23 01:21:38 GMT 2025","165","tests","main_page_test","TestMainPage","","","Checking the clickability of the Registration button.",""
"passed","Sun Mar 23 01:11:17 GMT 2025","Sun Mar 23 01:11:17 GMT 2025","270","tests","exercises_ru_words_page_test","TestExercisesRuWordsPage","","","Verify clickability, titles, attributes of group links on the page",""
"passed","Sun Mar 23 01:15:21 GMT 2025","Sun Mar 23 01:15:38 GMT 2025","16386","tests","groups_page_test","TestGroupsPage","","","Verify value of the title and subtitles on the page",""
"passed","Sun Mar 23 01:13:31 GMT 2025","Sun Mar 23 01:13:36 GMT 2025","5105","tests","exercises_ru_words_page_test","TestExercisesRuWordsPage","","","Verify sizes of background-images in links on the page",""
"passed","Sun Mar 23 01:07:16 GMT 2025","Sun Mar 23 01:07:17 GMT 2025","1278","tests","description_page_test","TestDescriptionPage","","","Verify redirection to telegram page not authorized user.",""
"passed","Sun Mar 23 01:22:09 GMT 2025","Sun Mar 23 01:22:09 GMT 2025","784","tests","registration_page_test","TestRegistrationPage","","","Check registration with new email and empty confirm password",""
"passed","Sun Mar 23 01:14:20 GMT 2025","Sun Mar 23 01:14:20 GMT 2025","122","tests","footer_test","TestFooter","","","Verify that the 'Contact us' link in the Footer calls an email client",""
"passed","Sun Mar 23 01:18:49 GMT 2025","Sun Mar 23 01:18:59 GMT 2025","10240","tests","header_test","TestHeaderPage","","","Verify composition, visibility of elements on the 1st-6th levels of nesting in the Header
            for an authorized user",""
"passed","Sun Mar 23 01:14:43 GMT 2025","Sun Mar 23 01:14:43 GMT 2025","27","tests","groups_page_test","TestGroupsPage","","","Verify presence and visibility of content on the page",""
"passed","Sun Mar 23 01:18:21 GMT 2025","Sun Mar 23 01:18:22 GMT 2025","135","tests","header_test","TestHeaderPage","","","Verify that the 'Logo' link on the Start Unauthorized Page 
                             doesn't refresh the current page or lead to other pages after clicking",""
"passed","Sun Mar 23 01:09:44 GMT 2025","Sun Mar 23 01:09:44 GMT 2025","75","tests","exercises_ru_similar_phrases_page_test","TestExercisesRuSimilarPhrasesPage","","","Verify clickability of links in breadcrumbs on the page",""
"passed","Sun Mar 23 01:24:21 GMT 2025","Sun Mar 23 01:24:21 GMT 2025","85","tests","start_unauthorized_page_test","TestStartUnauthorizedPage","","","Verify the composition and visibility of elements 
        on the 1st-3rd levels of nesting in the section 1",""
"passed","Sun Mar 23 01:15:07 GMT 2025","Sun Mar 23 01:15:15 GMT 2025","8167","tests","groups_page_test","TestGroupsPage","","","Verify value of the title of the tab",""
"passed","Sun Mar 23 01:20:59 GMT 2025","Sun Mar 23 01:20:59 GMT 2025","206","tests","main_page_test","TestMainPage","","","Verify redirection to description page not authorized user.",""
"passed","Sun Mar 23 01:23:36 GMT 2025","Sun Mar 23 01:23:36 GMT 2025","105","tests","specialists_page_test","TestSpecialistsPage","","","Verify values of names and professions in specialist cards in the grid",""
"passed","Sun Mar 23 01:14:58 GMT 2025","Sun Mar 23 01:15:01 GMT 2025","3131","tests","groups_page_test","TestGroupsPage","","","Verify presence, visibility of the title, tiles, links, images, subtitles on the page",""
"passed","Sun Mar 23 01:21:21 GMT 2025","Sun Mar 23 01:21:22 GMT 2025","1388","tests","main_page_test","TestMainPage","","","Verify redirection to github not authorized user.",""
"passed","Sun Mar 23 01:12:11 GMT 2025","Sun Mar 23 01:12:11 GMT 2025","184","tests","exercises_ru_words_page_test","TestExercisesRuWordsPage","","","Verify if breadcrumbs link2 leads to the correct page after clicking",""
"passed","Sun Mar 23 01:06:33 GMT 2025","Sun Mar 23 01:06:33 GMT 2025","23","tests","contributors_page_test","TestContributorsPage","","","Verify value of the title of the tab",""
"passed","Sun Mar 23 01:24:36 GMT 2025","Sun Mar 23 01:24:36 GMT 2025","87","tests","start_unauthorized_page_test","TestStartUnauthorizedPage","","","Verify content of the text in sections 1, 2",""
"passed","Sun Mar 23 01:23:58 GMT 2025","Sun Mar 23 01:24:00 GMT 2025","1643","tests","specialists_page_test","TestSpecialistsPage","","","Verify that the 'All Specialists' link leads an authorized user 
                         to the correct page after clicking",""
"passed","Sun Mar 23 01:10:03 GMT 2025","Sun Mar 23 01:10:06 GMT 2025","3124","tests","exercises_ru_words_page_test","TestExercisesRuWordsPage","","","Verify composition, visibility of elements on the 1st-6th levels of nesting on the page",""
"passed","Sun Mar 23 01:23:45 GMT 2025","Sun Mar 23 01:23:46 GMT 2025","577","tests","specialists_page_test","TestSpecialistsPage","","","Verify clickability, href, status code of the 'All Specialists' link",""
"passed","Sun Mar 23 01:24:17 GMT 2025","Sun Mar 23 01:24:17 GMT 2025","33","tests","start_unauthorized_page_test","TestStartUnauthorizedPage","","","Verify amount and visibility of sections with content on the page",""
"passed","Sun Mar 23 01:09:54 GMT 2025","Sun Mar 23 01:09:54 GMT 2025","92","tests","exercises_ru_words_page_test","TestExercisesRuWordsPage","","","Verify presence and visibility of content on the page",""
"passed","Sun Mar 23 01:06:45 GMT 2025","Sun Mar 23 01:06:46 GMT 2025","1364","tests","contributors_page_test","TestContributorsPage","","","Verify values of the text in card descriptions",""
"passed","Sun Mar 23 01:23:01 GMT 2025","Sun Mar 23 01:23:01 GMT 2025","30","tests","specialists_page_test","TestSpecialistsPage","","","Verify presence and visibility of content on the page",""
"passed","Sun Mar 23 01:06:16 GMT 2025","Sun Mar 23 01:06:17 GMT 2025","551","tests","contributors_page_test","TestContributorsPage","","","Verify presence, visibility and structure of content on the page",""
"passed","Sun Mar 23 01:23:06 GMT 2025","Sun Mar 23 01:23:06 GMT 2025","319","tests","specialists_page_test","TestSpecialistsPage","","","Verify the composition and visibility of elements 
        on the 1st-6th levels of nesting on the page",""
"passed","Sun Mar 23 01:30:46 GMT 2025","Sun Mar 23 01:30:46 GMT 2025","29","tests","used_resources_page_test","TestUsedResourcesPage","","","Verify text in links in sections",""
"passed","Sun Mar 23 01:21:12 GMT 2025","Sun Mar 23 01:21:13 GMT 2025","180","tests","main_page_test","TestMainPage","","","Verify redirection to contacts page not authorized user.",""
"passed","Sun Mar 23 01:23:21 GMT 2025","Sun Mar 23 01:23:21 GMT 2025","14","tests","specialists_page_test","TestSpecialistsPage","","","Verify value of the title of the tab",""
"passed","Sun Mar 23 01:14:05 GMT 2025","Sun Mar 23 01:14:16 GMT 2025","11222","tests","footer_test","TestFooter","","","Verify that links in the Footer lead to correct pages after clicking",""
"passed","Sun Mar 23 01:11:05 GMT 2025","Sun Mar 23 01:11:07 GMT 2025","1786","tests","exercises_ru_words_page_test","TestExercisesRuWordsPage","","","Verify clickability, href, status code of links in breadcrumbs on the page",""
"passed","Sun Mar 23 01:06:54 GMT 2025","Sun Mar 23 01:06:55 GMT 2025","744","tests","contributors_page_test","TestContributorsPage","","","Verify clickability, href of links on the page",""
"passed","Sun Mar 23 01:06:13 GMT 2025","Sun Mar 23 01:06:13 GMT 2025","105","tests","contacts_page_test","TestContactsPage","","","Verify that the email link calls an email client",""
"passed","Sun Mar 23 01:13:40 GMT 2025","Sun Mar 23 01:13:40 GMT 2025","41","tests","footer_test","TestFooter","","","Verify presence and visibility of the Footer",""
"passed","Sun Mar 23 01:24:51 GMT 2025","Sun Mar 23 01:24:51 GMT 2025","78","tests","start_unauthorized_page_test","TestStartUnauthorizedPage","","","Verify presence, visibility and attributes of the image in the section 1",""
"passed","Sun Mar 23 01:18:16 GMT 2025","Sun Mar 23 01:18:18 GMT 2025","1780","tests","header_test","TestHeaderPage","","","Verify if external links in the Header for an unauthorized user 
            lead to correct pages after click",""
"passed","Sun Mar 23 01:30:32 GMT 2025","Sun Mar 23 01:30:32 GMT 2025","11","tests","used_resources_page_test","TestUsedResourcesPage","","","Verify value of the title of the tab",""
"passed","Sun Mar 23 01:22:13 GMT 2025","Sun Mar 23 01:22:14 GMT 2025","764","tests","registration_page_test","TestRegistrationPage","","","Check registration with new email and empty password",""
"passed","Sun Mar 23 01:16:41 GMT 2025","Sun Mar 23 01:17:02 GMT 2025","21270","tests","groups_page_test","TestGroupsPage","","","Verify if links on the 'en' local lead to correct pages after clicking",""
"passed","Sun Mar 23 01:17:33 GMT 2025","Sun Mar 23 01:17:33 GMT 2025","33","tests","header_test","TestHeaderPage","","","Verify presence and visibility of the Header for an unauthorized user",""
"passed","Sun Mar 23 01:19:12 GMT 2025","Sun Mar 23 01:19:12 GMT 2025","204","tests","header_test","TestHeaderPage","","","Verify values of the text in links, buttons in the Header for an authorized user",""
"passed","Sun Mar 23 01:05:42 GMT 2025","Sun Mar 23 01:05:42 GMT 2025","12","tests","contacts_page_test","TestContactsPage","","","Verify value of the title of the tab",""
"passed","Sun Mar 23 01:07:36 GMT 2025","Sun Mar 23 01:07:37 GMT 2025","694","tests","description_page_test","TestDescriptionPage","","","Verify redirection to specialists page not authorized user.",""
"passed","Sun Mar 23 01:10:16 GMT 2025","Sun Mar 23 01:10:17 GMT 2025","1301","tests","exercises_ru_words_page_test","TestExercisesRuWordsPage","","","Verify presence, visibility of lists on the page",""
"passed","Sun Mar 23 01:09:06 GMT 2025","Sun Mar 23 01:09:06 GMT 2025","56","tests","exercises_ru_similar_phrases_page_test","TestExercisesRuSimilarPhrasesPage","","","Verify value of the title of the tab",""
"passed","Sun Mar 23 01:05:16 GMT 2025","Sun Mar 23 01:05:17 GMT 2025","960","tests","authorisation_page_test","TestAuthorizedUserPage","","","Checking the possibility of authorization with incorrect data",""
"passed","Sun Mar 23 01:22:04 GMT 2025","Sun Mar 23 01:22:05 GMT 2025","1269","tests","registration_page_test","TestRegistrationPage","","","Check registration with an existing email",""
"passed","Sun Mar 23 01:11:27 GMT 2025","Sun Mar 23 01:11:49 GMT 2025","22589","tests","exercises_ru_words_page_test","TestExercisesRuWordsPage","","","Verify clickability, titles, href, status code of subgroup links on the page",""
"skipped","Sun Mar 23 01:28:11 GMT 2025","Sun Mar 23 01:28:34 GMT 2025","22474","tests","Речевые упражнения.","TestCardsRU","","","Select a random card from ""Слова с частотной группировкой"" group and compare UI vs BACKEND data.",""
"passed","Sun Mar 23 01:17:37 GMT 2025","Sun Mar 23 01:17:47 GMT 2025","10206","tests","header_test","TestHeaderPage","","","Verify composition, visibility of elements on the 1st-6th levels of nesting in the Header
            for an unauthorized user",""
"passed","Sun Mar 23 01:24:04 GMT 2025","Sun Mar 23 01:24:05 GMT 2025","111","tests","specialists_page_test","TestSpecialistsPage","","","Verify attributes of images in specialist cards in the grid",""
"passed","Sun Mar 23 01:06:21 GMT 2025","Sun Mar 23 01:06:22 GMT 2025","1667","tests","contributors_page_test","TestContributorsPage","","","Verify the composition and visibility of elements 
        on the 1st-5th levels of nesting on the page",""
"passed","Sun Mar 23 01:10:36 GMT 2025","Sun Mar 23 01:10:37 GMT 2025","102","tests","exercises_ru_words_page_test","TestExercisesRuWordsPage","","","Verify value of the breadcrumbs on the page",""
"passed","Sun Mar 23 01:20:23 GMT 2025","Sun Mar 23 01:20:23 GMT 2025","376","tests","header_test","TestHeaderPage","","","Verify user logout after clicking the 'Logout' button in the Header for an authorized user",""
"passed","Sun Mar 23 01:30:51 GMT 2025","Sun Mar 23 01:30:52 GMT 2025","1409","tests","used_resources_page_test","TestUsedResourcesPage","","","Verify presence, visibility, clickability, href, status code of links in sections",""
"skipped","Sun Mar 23 01:30:02 GMT 2025","Sun Mar 23 01:30:09 GMT 2025","6537","tests","Речевые упражнения.","TestCardsRU","","","Solutions to a random task in the ""Слова"" group and comparison of statics.",""
"passed","Sun Mar 23 01:24:09 GMT 2025","Sun Mar 23 01:24:10 GMT 2025","152","tests","specialists_page_test","TestSpecialistsPage","","","Verify sizes of images in specialist cards in the grid",""
"passed","Sun Mar 23 01:13:21 GMT 2025","Sun Mar 23 01:13:22 GMT 2025","491","tests","exercises_ru_words_page_test","TestExercisesRuWordsPage","","","Verify attributes of images in links on the page",""
"passed","Sun Mar 23 01:17:55 GMT 2025","Sun Mar 23 01:17:55 GMT 2025","197","tests","header_test","TestHeaderPage","","","Verify values of the text in links, buttons in the Header for an unauthorized user",""
"passed","Sun Mar 23 01:12:21 GMT 2025","Sun Mar 23 01:12:21 GMT 2025","355","tests","exercises_ru_words_page_test","TestExercisesRuWordsPage","","","Verify if breadcrumbs link3 leads to the correct page after clicking",""
"passed","Sun Mar 23 01:05:51 GMT 2025","Sun Mar 23 01:05:51 GMT 2025","29","tests","contacts_page_test","TestContactsPage","","","Verify content of the text in the section 2",""
"passed","Sun Mar 23 01:05:46 GMT 2025","Sun Mar 23 01:05:46 GMT 2025","50","tests","contacts_page_test","TestContactsPage","","","Verify values of the title and subtitles with tags h1, h2 on the page",""
"passed","Sun Mar 23 01:24:13 GMT 2025","Sun Mar 23 01:24:13 GMT 2025","48","tests","start_unauthorized_page_test","TestStartUnauthorizedPage","","","Verify presence and visibility of content on the page",""
"passed","Sun Mar 23 01:20:48 GMT 2025","Sun Mar 23 01:20:49 GMT 2025","52","tests","header_test","TestHeaderPage","","","Verify presence, visibility and attributes of the profile avatar in the Header 
               for an authorized user",""
"passed","Sun Mar 23 01:29:33 GMT 2025","Sun Mar 23 01:29:56 GMT 2025","22791","tests","Речевые упражнения.","TestCardsRU","","","Solutions to a random task in the ""Слова Королёвой"" .",""
"passed","Sun Mar 23 01:19:24 GMT 2025","Sun Mar 23 01:19:30 GMT 2025","5785","tests","header_test","TestHeaderPage","","","Verify clickability, href, status code of links in the Header for an authorized user",""
"skipped","Sun Mar 23 01:26:50 GMT 2025","Sun Mar 23 01:27:15 GMT 2025","24198","tests","Речевые упражнения.","TestCardsRU","","","Select a random card from ""Похожие фразы"" group and compare UI vs BACKEND data.",""
"passed","Sun Mar 23 01:17:08 GMT 2025","Sun Mar 23 01:17:16 GMT 2025","8216","tests","groups_page_test","TestGroupsPage","","","Verify attributes of images in links on the page",""
"passed","Sun Mar 23 01:19:18 GMT 2025","Sun Mar 23 01:19:18 GMT 2025","26","tests","header_test","TestHeaderPage","","","Verify presence, visibility of the user name in the Header for an authorized user",""
"passed","Sun Mar 23 01:07:02 GMT 2025","Sun Mar 23 01:07:03 GMT 2025","810","tests","contributors_page_test","TestContributorsPage","","","Verify attribute values of images in contributors cards in grids",""
"passed","Sun Mar 23 01:21:26 GMT 2025","Sun Mar 23 01:21:26 GMT 2025","683","tests","main_page_test","TestMainPage","","","Verify redirection to contributors page not authorized user.",""
"passed","Sun Mar 23 01:06:37 GMT 2025","Sun Mar 23 01:06:38 GMT 2025","553","tests","contributors_page_test","TestContributorsPage","","","Verify values of title and subtitles with tags h2, h3 on the page",""
"passed","Sun Mar 23 01:07:50 GMT 2025","Sun Mar 23 01:07:51 GMT 2025","191","tests","description_page_test","TestDescriptionPage","","","Verify redirection to used resources page not authorized user.",""
"passed","Sun Mar 23 01:06:06 GMT 2025","Sun Mar 23 01:06:08 GMT 2025","1375","tests","contacts_page_test","TestContactsPage","","","Verify if links in the section 2 lead to the correct pages after clicking",""
"passed","Sun Mar 23 01:19:05 GMT 2025","Sun Mar 23 01:19:06 GMT 2025","375","tests","header_test","TestHeaderPage","","","Verify presence, visibility of links, buttons in the Header for an authorized user",""
"passed","Sun Mar 23 01:20:17 GMT 2025","Sun Mar 23 01:20:17 GMT 2025","200","tests","header_test","TestHeaderPage","","","Verify switching of the 'ru', 'en' buttons in the Header for an authorized user",""
"passed","Sun Mar 23 01:13:58 GMT 2025","Sun Mar 23 01:14:01 GMT 2025","2959","tests","footer_test","TestFooter","","","Verify clickability, href, prefix and subject, status code of links in the Footer",""
"passed","Sun Mar 23 01:14:49 GMT 2025","Sun Mar 23 01:14:52 GMT 2025","3157","tests","groups_page_test","TestGroupsPage","","","Verify composition, visibility of elements on the 1st-6th levels of nesting on the page",""
"passed","Sun Mar 23 01:30:22 GMT 2025","Sun Mar 23 01:30:22 GMT 2025","27","tests","used_resources_page_test","TestUsedResourcesPage","","","Verify presence and visibility of content on the page",""
"passed","Sun Mar 23 01:21:30 GMT 2025","Sun Mar 23 01:21:30 GMT 2025","219","tests","main_page_test","TestMainPage","","","Verify redirection to used resources page not authorized user.",""
"passed","Sun Mar 23 01:18:25 GMT 2025","Sun Mar 23 01:18:26 GMT 2025","289","tests","header_test","TestHeaderPage","","","Verify the dropdown opens/closes after clicking on the 'More' button in the Header 
            on the Start Unauthorized Page",""
"passed","Sun Mar 23 01:24:55 GMT 2025","Sun Mar 23 01:24:55 GMT 2025","74","tests","start_unauthorized_page_test","TestStartUnauthorizedPage","","","Verify size of the image in the section 1",""
"passed","Sun Mar 23 01:22:36 GMT 2025","Sun Mar 23 01:22:56 GMT 2025","20819","tests","registration_page_test","TestRegistrationPage","","","Check registration without choosing agreement",""
"passed","Sun Mar 23 01:20:36 GMT 2025","Sun Mar 23 01:20:36 GMT 2025","56","tests","header_test","TestHeaderPage","","","Verify size of the image in the 'Logo' link in the Header for an authorized user",""
"passed","Sun Mar 23 01:21:02 GMT 2025","Sun Mar 23 01:21:04 GMT 2025","1244","tests","main_page_test","TestMainPage","","","Verify redirection to telegram page not authorized user.",""
"passed","Sun Mar 23 01:06:26 GMT 2025","Sun Mar 23 01:06:30 GMT 2025","3677","tests","contributors_page_test","TestContributorsPage","","","Verify presence, visibility of titles/subtitles, cards, descriptions, links, images on the page",""
"passed","Sun Mar 23 01:23:31 GMT 2025","Sun Mar 23 01:23:31 GMT 2025","33","tests","specialists_page_test","TestSpecialistsPage","","","Verify value of text on the page",""
"passed","Sun Mar 23 01:11:59 GMT 2025","Sun Mar 23 01:12:02 GMT 2025","3188","tests","exercises_ru_words_page_test","TestExercisesRuWordsPage","","","Verify if breadcrumbs link1 leads to the correct page after clicking",""
"passed","Sun Mar 23 01:09:34 GMT 2025","Sun Mar 23 01:09:35 GMT 2025","119","tests","exercises_ru_similar_phrases_page_test","TestExercisesRuSimilarPhrasesPage","","","Verify text in cards on the page",""
"passed","Sun Mar 23 01:21:38 GMT 2025","Sun Mar 23 01:21:38 GMT 2025","537","tests","main_page_test","TestMainPage","","","Checking the domain is available",""
"passed","Sun Mar 23 01:14:34 GMT 2025","Sun Mar 23 01:14:37 GMT 2025","3101","tests","footer_test","TestFooter","","","Verify Footer invisibility through the modal window with the exercise",""
"passed","Sun Mar 23 01:24:47 GMT 2025","Sun Mar 23 01:24:47 GMT 2025","184","tests","start_unauthorized_page_test","TestStartUnauthorizedPage","","","Verify that the 'Login' link leads to the correct page after clicking",""
"passed","Sun Mar 23 01:05:37 GMT 2025","Sun Mar 23 01:05:37 GMT 2025","167","tests","contacts_page_test","TestContactsPage","","","Verify presence, visibility of sections, the dividing line and elements with text on the page",""
"passed","Sun Mar 23 01:20:04 GMT 2025","Sun Mar 23 01:20:04 GMT 2025","83","tests","header_test","TestHeaderPage","","","Verify that the 'Logo' link on the Start Authorized Page 
                             doesn't refresh the current page or lead to other pages after clicking",""
"passed","Sun Mar 23 01:05:11 GMT 2025","Sun Mar 23 01:05:12 GMT 2025","1632","tests","authorisation_page_test","TestAuthorizedUserPage","","","Checking the possibility of authorization with the correct data",""
"passed","Sun Mar 23 01:05:27 GMT 2025","Sun Mar 23 01:05:27 GMT 2025","19","tests","contacts_page_test","TestContactsPage","","","Verify the composition and visibility of elements on the 1st level of nesting in the section 1",""
"broken","Sun Mar 23 01:08:12 GMT 2025","Sun Mar 23 01:08:12 GMT 2025","0","tests","exercises_ru_similar_phrases_page_test","TestExercisesRuSimilarPhrasesPage","","","Verify presence, visibility of lists on the page",""
"skipped","Sun Mar 23 01:25:54 GMT 2025","Sun Mar 23 01:26:14 GMT 2025","20668","tests","Speech exercises EN.","TestCardsEN","","","Select a random card from ""Similar phrases"" group and compare UI vs BACKEND data",""
"passed","Sun Mar 23 01:26:36 GMT 2025","Sun Mar 23 01:26:44 GMT 2025","8588","tests","Речевые упражнения.","TestCardsRU","","","Select random card from group ""Слова Королёвой"" and compare UI vs BACKEND data.",""
"passed","Sun Mar 23 01:22:22 GMT 2025","Sun Mar 23 01:22:23 GMT 2025","783","tests","registration_page_test","TestRegistrationPage","","","Check registration with new email and empty birthday",""
"passed","Sun Mar 23 01:17:51 GMT 2025","Sun Mar 23 01:17:51 GMT 2025","373","tests","header_test","TestHeaderPage","","","Verify presence, visibility of links, buttons in the Header for an unauthorized user",""
"passed","Sun Mar 23 01:14:24 GMT 2025","Sun Mar 23 01:14:24 GMT 2025","85","tests","footer_test","TestFooter","","","Verify attributes of images in links in the Footer",""
"passed","Sun Mar 23 01:23:51 GMT 2025","Sun Mar 23 01:23:52 GMT 2025","614","tests","specialists_page_test","TestSpecialistsPage","","","Verify that the 'All Specialists' link leads an unauthorized user 
                         to the correct page after clicking",""
"passed","Sun Mar 23 01:24:32 GMT 2025","Sun Mar 23 01:24:32 GMT 2025","48","tests","start_unauthorized_page_test","TestStartUnauthorizedPage","","","Verify values of titles and subtitles with tags h2, h4 on the page",""
"passed","Sun Mar 23 01:21:42 GMT 2025","Sun Mar 23 01:21:51 GMT 2025","9278","tests","profile_page_test","TestProfilePage","","","Change the password by receiving an email link",""
"passed","Sun Mar 23 01:08:11 GMT 2025","Sun Mar 23 01:08:12 GMT 2025","841","tests","exercises_ru_similar_phrases_page_test","TestExercisesRuSimilarPhrasesPage","","","Verify composition, visibility of elements on the 1st-7th levels of nesting on the page",""
"passed","Sun Mar 23 01:20:10 GMT 2025","Sun Mar 23 01:20:11 GMT 2025","273","tests","header_test","TestHeaderPage","","","Verify the dropdown opens/closes after clicking on the 'More' button in the Header 
               for an authorized user",""
"passed","Sun Mar 23 01:09:25 GMT 2025","Sun Mar 23 01:09:25 GMT 2025","113","tests","exercises_ru_similar_phrases_page_test","TestExercisesRuSimilarPhrasesPage","","","Verify text in group links on the page",""
"skipped","Sun Mar 23 01:27:42 GMT 2025","Sun Mar 23 01:28:04 GMT 2025","22489","tests","Речевые упражнения.","TestCardsRU","","","Select a random card from ""Предложения"" group and compare UI vs BACKEND data.",""
"passed","Sun Mar 23 01:13:55 GMT 2025","Sun Mar 23 01:13:55 GMT 2025","50","tests","footer_test","TestFooter","","","Verify text in the 'Contact us' link in the Footer",""
"passed","Sun Mar 23 01:24:24 GMT 2025","Sun Mar 23 01:24:24 GMT 2025","123","tests","start_unauthorized_page_test","TestStartUnauthorizedPage","","","Verify the composition and visibility of elements 
        on the 1st-3rd levels of nesting in the section 2",""
"passed","Sun Mar 23 01:30:58 GMT 2025","Sun Mar 23 01:30:59 GMT 2025","1232","tests","used_resources_page_test","TestUsedResourcesPage","","","Verify that links in the sections lead to the correct pages after clicking",""
"passed","Sun Mar 23 01:05:56 GMT 2025","Sun Mar 23 01:05:56 GMT 2025","28","tests","contacts_page_test","TestContactsPage","","","Verify text in links in the section 2",""
"passed","Sun Mar 23 01:24:39 GMT 2025","Sun Mar 23 01:24:39 GMT 2025","41","tests","start_unauthorized_page_test","TestStartUnauthorizedPage","","","Verify text in the 'Login' link in the section 1",""
"passed","Sun Mar 23 01:07:07 GMT 2025","Sun Mar 23 01:07:08 GMT 2025","1130","tests","contributors_page_test","TestContributorsPage","","","Verify sizes of images in contributor cards in grids",""
"passed","Sun Mar 23 01:23:11 GMT 2025","Sun Mar 23 01:23:16 GMT 2025","5345","tests","specialists_page_test","TestSpecialistsPage","","","Verify presence, visibility of the title, text, link, grid, cards and images  
        on the 2nd, 3rd, 5th, 6th levels of nesting on the page",""
"passed","Sun Mar 23 01:21:08 GMT 2025","Sun Mar 23 01:21:09 GMT 2025","981","tests","main_page_test","TestMainPage","","","Verify redirection to donate page not authorized user.",""
"passed","Sun Mar 23 01:17:58 GMT 2025","Sun Mar 23 01:18:04 GMT 2025","5078","tests","header_test","TestHeaderPage","","","Verify clickability, href, status code of links in the Header for an unauthorized user",""
