"Status","Start Time","Stop Time","Duration in ms","Parent Suite","Suite","Sub Suite","Test Class","Test Method","Name","Description"
"passed","Sun Mar 23 01:20:30 GMT 2025","Sun Mar 23 01:20:30 GMT 2025","41","tests","header_test","TestHeaderPage","","","Verify presence, visibility and attributes of the image in the 'Logo' link in the Header 
               for an authorized user",""
"passed","Sun Mar 23 01:10:27 GMT 2025","Sun Mar 23 01:10:27 GMT 2025","62","tests","exercises_ru_words_page_test","TestExercisesRuWordsPage","","","Verify value of the title of the tab",""
"passed","Sun Mar 23 01:06:58 GMT 2025","Sun Mar 23 01:06:59 GMT 2025","600","tests","contributors_page_test","TestContributorsPage","","","Verify href, status code of the 'All Team' link",""
"passed","Sun Mar 23 01:07:12 GMT 2025","Sun Mar 23 01:07:12 GMT 2025","145","tests","description_page_test","TestDescriptionPage","","","Verify return main page from description page.",""
"passed","Sun Mar 23 01:15:44 GMT 2025","Sun Mar 23 01:16:10 GMT 2025","26259","tests","groups_page_test","TestGroupsPage","","","Verify clickability, title, href, status code of links on the page",""
"passed","Sun Mar 23 01:18:37 GMT 2025","Sun Mar 23 01:18:37 GMT 2025","51","tests","header_test","TestHeaderPage","","","Verify size of the image in the 'Logo' link in the Header on the Start Unauthorized Page",""
"passed","Sun Mar 23 01:21:34 GMT 2025","Sun Mar 23 01:21:34 GMT 2025","111","tests","main_page_test","TestMainPage","","","Checking the clickability of the Start button.",""
"passed","Sun Mar 23 01:24:43 GMT 2025","Sun Mar 23 01:24:44 GMT 2025","621","tests","start_unauthorized_page_test","TestStartUnauthorizedPage","","","Verify presence, visibility, clickability, href, status code 
                         of the 'Login' link in the section 1",""
"passed","Sun Mar 23 01:16:16 GMT 2025","Sun Mar 23 01:16:35 GMT 2025","18316","tests","groups_page_test","TestGroupsPage","","","Verify if links on the 'ru' local lead to correct pages after clicking",""
"passed","Sun Mar 23 01:10:56 GMT 2025","Sun Mar 23 01:10:56 GMT 2025","528","tests","exercises_ru_words_page_test","TestExercisesRuWordsPage","","","Verify text in cards on the page",""
"passed","Sun Mar 23 01:09:15 GMT 2025","Sun Mar 23 01:09:15 GMT 2025","83","tests","exercises_ru_similar_phrases_page_test","TestExercisesRuSimilarPhrasesPage","","","Verify value of the breadcrumbs on the page",""
"passed","Sun Mar 23 01:27:27 GMT 2025","Sun Mar 23 01:27:36 GMT 2025","9055","tests","Речевые упражнения.","TestCardsRU","","","Select a random card from ""Группа слов"" group and compare UI vs BACKEND data.",""
"passed","Sun Mar 23 01:22:18 GMT 2025","Sun Mar 23 01:22:18 GMT 2025","784","tests","registration_page_test","TestRegistrationPage","","","Check registration with new email and empty first name",""
"passed","Sun Mar 23 01:18:07 GMT 2025","Sun Mar 23 01:18:12 GMT 2025","4997","tests","header_test","TestHeaderPage","","","Verify if internal links in the Header for an unauthorized user 
            lead to correct pages after click",""
"passed","Sun Mar 23 01:06:41 GMT 2025","Sun Mar 23 01:06:41 GMT 2025","21","tests","contributors_page_test","TestContributorsPage","","","Verify content of the text on the page",""
"passed","Sun Mar 23 01:07:32 GMT 2025","Sun Mar 23 01:07:33 GMT 2025","212","tests","description_page_test","TestDescriptionPage","","","Verify redirection to contacts page not authorized user.",""
"passed","Sun Mar 23 01:13:51 GMT 2025","Sun Mar 23 01:13:51 GMT 2025","46","tests","footer_test","TestFooter","","","Verify content of text in the Footer",""
"passed","Sun Mar 23 01:18:43 GMT 2025","Sun Mar 23 01:18:43 GMT 2025","27","tests","header_test","TestHeaderPage","","","Verify presence and visibility of the Header for an authorized user",""
"passed","Sun Mar 23 01:17:23 GMT 2025","Sun Mar 23 01:17:29 GMT 2025","6066","tests","groups_page_test","TestGroupsPage","","","Verify sizes of images in links on the page",""
"passed","Sun Mar 23 01:28:40 GMT 2025","Sun Mar 23 01:29:27 GMT 2025","47626","tests","Речевые упражнения.","TestCardsRU","","","Solutions to a random task in the ""Слова"" .",""
"passed","Sun Mar 23 01:20:42 GMT 2025","Sun Mar 23 01:20:42 GMT 2025","52","tests","header_test","TestHeaderPage","","","Verify presence, visibility, attributes of icons in the Header for an authorized user",""
"skipped","Sun Mar 23 01:21:38 GMT 2025","Sun Mar 23 01:21:38 GMT 2025","0","tests","main_page_test","TestMainPage","","","Checking the ip is available",""
"passed","Sun Mar 23 01:13:47 GMT 2025","Sun Mar 23 01:13:48 GMT 2025","152","tests","footer_test","TestFooter","","","Verify presence, visibility of text, links, images in the Footer",""
"passed","Sun Mar 23 01:23:41 GMT 2025","Sun Mar 23 01:23:41 GMT 2025","45","tests","specialists_page_test","TestSpecialistsPage","","","Verify text in the 'All Specialists' link",""
"passed","Sun Mar 23 01:30:41 GMT 2025","Sun Mar 23 01:30:41 GMT 2025","33","tests","used_resources_page_test","TestUsedResourcesPage","","","Verify content of the text on the page",""
"passed","Sun Mar 23 01:19:56 GMT 2025","Sun Mar 23 01:19:58 GMT 2025","1814","tests","header_test","TestHeaderPage","","","Verify if external links in the Header for an authorized user 
            lead to correct pages after click",""
"passed","Sun Mar 23 01:31:04 GMT 2025","Sun Mar 23 01:31:04 GMT 2025","55","tests","used_resources_page_test","TestUsedResourcesPage","","","Verify presence, visibility and attributes of icons in sections",""
"skipped","Sun Mar 23 01:25:27 GMT 2025","Sun Mar 23 01:25:48 GMT 2025","20657","tests","Speech exercises EN.","TestCardsEN","","","Check progres-bar and buttons.",""
"passed","Sun Mar 23 01:31:09 GMT 2025","Sun Mar 23 01:31:09 GMT 2025","77","tests","used_resources_page_test","TestUsedResourcesPage","","","Verify sizes of icons in sections",""
"passed","Sun Mar 23 01:30:15 GMT 2025","Sun Mar 23 01:30:17 GMT 2025","2024","tests","Statistic.","TestCardsRU","","","Check statistic table.",""
"passed","Sun Mar 23 01:30:27 GMT 2025","Sun Mar 23 01:30:27 GMT 2025","120","tests","used_resources_page_test","TestUsedResourcesPage","","","Verify the composition and visibility of elements 
        on the 1st-4th levels of nesting on the page",""
"passed","Sun Mar 23 01:21:55 GMT 2025","Sun Mar 23 01:22:00 GMT 2025","5191","tests","registration_page_test","TestRegistrationPage","","","Check registration with new email",""
"passed","Sun Mar 23 01:22:27 GMT 2025","Sun Mar 23 01:22:27 GMT 2025","731","tests","registration_page_test","TestRegistrationPage","","","Check registration with new email and empty email",""
"passed","Sun Mar 23 01:07:46 GMT 2025","Sun Mar 23 01:07:47 GMT 2025","681","tests","description_page_test","TestDescriptionPage","","","Verify redirection to contributors page not authorized user.",""
"passed","Sun Mar 23 01:13:43 GMT 2025","Sun Mar 23 01:13:44 GMT 2025","250","tests","footer_test","TestFooter","","","Verify composition and visibility of elements on the 1st-7th levels of nesting in the Footer",""
"passed","Sun Mar 23 01:05:22 GMT 2025","Sun Mar 23 01:05:22 GMT 2025","28","tests","contacts_page_test","TestContactsPage","","","Verify presence and visibility of content on the page",""
"passed","Sun Mar 23 01:30:36 GMT 2025","Sun Mar 23 01:30:36 GMT 2025","32","tests","used_resources_page_test","TestUsedResourcesPage","","","Verify value of title with tag 'h1' on the page",""
"passed","Sun Mar 23 01:07:41 GMT 2025","Sun Mar 23 01:07:42 GMT 2025","1622","tests","description_page_test","TestDescriptionPage","","","Verify redirection to github not authorized user.",""
"passed","Sun Mar 23 01:05:32 GMT 2025","Sun Mar 23 01:05:32 GMT 2025","136","tests","contacts_page_test","TestContactsPage","","","Verify the composition and visibility of elements 
        on the 1st-5th levels of nesting in the section 2",""
"passed","Sun Mar 23 01:21:16 GMT 2025","Sun Mar 23 01:21:17 GMT 2025","693","tests","main_page_test","TestMainPage","","","Verify redirection to specialists page not authorized user.",""
"passed","Sun Mar 23 01:06:01 GMT 2025","Sun Mar 23 01:06:02 GMT 2025","831","tests","contacts_page_test","TestContactsPage","","","Verify presence, visibility, clickability, href, prefix, status code of links in the section 2",""
"passed","Sun Mar 23 01:20:55 GMT 2025","Sun Mar 23 01:20:55 GMT 2025","2","tests","login_page_test","TestLoginPage","","","Test for authorization customer.",""
"skipped","Sun Mar 23 01:25:01 GMT 2025","Sun Mar 23 01:25:21 GMT 2025","20153","tests","Speech exercises EN.","TestCardsEN","","","Select random card from ""Word"" group and compare UI vs BACKEND data",""
"passed","Sun Mar 23 01:24:28 GMT 2025","Sun Mar 23 01:24:28 GMT 2025","13","tests","start_unauthorized_page_test","TestStartUnauthorizedPage","","","Verify value of the title of the tab",""
"passed","Sun Mar 23 01:08:02 GMT 2025","Sun Mar 23 01:08:02 GMT 2025","106","tests","exercises_ru_similar_phrases_page_test","TestExercisesRuSimilarPhrasesPage","","","Verify presence and visibility of content on the page",""
"passed","Sun Mar 23 01:18:29 GMT 2025","Sun Mar 23 01:18:29 GMT 2025","228","tests","header_test","TestHeaderPage","","","Verify switching of the 'ru', 'en' buttons in the Header on the Start Unauthorized Page",""
"passed","Sun Mar 23 01:07:21 GMT 2025","Sun Mar 23 01:07:29 GMT 2025","8299","tests","description_page_test","TestDescriptionPage","","","Verify redirection to donate page not authorized user.",""
"passed","Sun Mar 23 01:12:31 GMT 2025","Sun Mar 23 01:12:46 GMT 2025","14774","tests","exercises_ru_words_page_test","TestExercisesRuWordsPage","","","Verify if group links lead to correct pages after clicking",""
"passed","Sun Mar 23 01:10:46 GMT 2025","Sun Mar 23 01:10:46 GMT 2025","147","tests","exercises_ru_words_page_test","TestExercisesRuWordsPage","","","Verify text in group links on the page",""
"passed","Sun Mar 23 01:12:55 GMT 2025","Sun Mar 23 01:13:12 GMT 2025","16668","tests","exercises_ru_words_page_test","TestExercisesRuWordsPage","","","Verify if subgroup links 1-4 lead to correct pages after clicking",""
"passed","Sun Mar 23 01:18:33 GMT 2025","Sun Mar 23 01:18:33 GMT 2025","59","tests","header_test","TestHeaderPage","","","Verify presence, visibility and attributes of the image in the 'Logo' link in the Header 
               on the Start Unauthorized Page",""
"passed","Sun Mar 23 01:22:31 GMT 2025","Sun Mar 23 01:22:32 GMT 2025","708","tests","registration_page_test","TestRegistrationPage","","","Check registration without choosing gender",""
"passed","Sun Mar 23 01:06:50 GMT 2025","Sun Mar 23 01:06:50 GMT 2025","422","tests","contributors_page_test","TestContributorsPage","","","Verify text in card links and the 'All Team' link",""
"passed","Sun Mar 23 01:19:36 GMT 2025","Sun Mar 23 01:19:50 GMT 2025","14024","tests","header_test","TestHeaderPage","","","Verify if internal links in the Header for an authorized user 
            lead to correct pages after click",""
"passed","Sun Mar 23 01:14:27 GMT 2025","Sun Mar 23 01:14:27 GMT 2025","122","tests","footer_test","TestFooter","","","Verify sizes of images in links in the Footer",""
"passed","Sun Mar 23 01:23:26 GMT 2025","Sun Mar 23 01:23:26 GMT 2025","34","tests","specialists_page_test","TestSpecialistsPage","","","Verify value of title with tag 'h2' on the page",""
"passed","Sun Mar 23 01:26:21 GMT 2025","Sun Mar 23 01:26:29 GMT 2025","8371","tests","Речевые упражнения.","TestCardsRU","","","Select random card from group ""Слова"" and compare UI vs BACKEND data.",""
