"Status","Start Time","Stop Time","Duration in ms","Parent Suite","Suite","Sub Suite","Test Class","Test Method","Name","Description"
"passed","Sat Nov 23 01:08:15 GMT 2024","Sat Nov 23 01:08:15 GMT 2024","188","tests","header_test","TestHeaderPage","","","Verify values of the text in links, buttons in the Header for an authorized user",""
"passed","Sat Nov 23 01:24:02 GMT 2024","Sat Nov 23 01:24:02 GMT 2024","34","tests","used_resources_page_test","TestUsedResourcesPage","","","Verify content of the text on the page",""
"passed","Sat Nov 23 00:59:48 GMT 2024","Sat Nov 23 00:59:49 GMT 2024","1143","tests","contributors_page_test","TestContributorsPage","","","Verify sizes of images in contributor cards in grids",""
"passed","Sat Nov 23 00:58:06 GMT 2024","Sat Nov 23 00:58:06 GMT 2024","11","tests","contacts_page_test","TestContactsPage","","","Verify value of the title of the tab",""
"passed","Sat Nov 23 01:02:47 GMT 2024","Sat Nov 23 01:02:50 GMT 2024","3161","tests","groups_page_test","TestGroupsPage","","","Verify composition, visibility of elements on the 1st-6th levels of nesting on the page",""
"passed","Sat Nov 23 01:10:54 GMT 2024","Sat Nov 23 01:10:54 GMT 2024","3","tests","login_page_test","TestLoginPage","","","Test for authorization customer.",""
"passed","Sat Nov 23 00:59:26 GMT 2024","Sat Nov 23 00:59:27 GMT 2024","419","tests","contributors_page_test","TestContributorsPage","","","Verify text in card links and the 'All Team' link",""
"passed","Sat Nov 23 01:00:28 GMT 2024","Sat Nov 23 01:00:29 GMT 2024","675","tests","description_page_test","TestDescriptionPage","","","Verify redirection to contributors page not authorized user.",""
"passed","Sat Nov 23 01:09:51 GMT 2024","Sat Nov 23 01:09:51 GMT 2024","191","tests","header_test","TestHeaderPage","","","Verify switching of the 'ru', 'en' buttons in the Header for an authorized user",""
"passed","Sat Nov 23 01:05:54 GMT 2024","Sat Nov 23 01:06:00 GMT 2024","6065","tests","groups_page_test","TestGroupsPage","","","Verify sizes of images in links on the page",""
"passed","Sat Nov 23 01:03:15 GMT 2024","Sat Nov 23 01:03:23 GMT 2024","8166","tests","groups_page_test","TestGroupsPage","","","Verify value of the title of the tab",""
"passed","Sat Nov 23 01:10:23 GMT 2024","Sat Nov 23 01:10:23 GMT 2024","52","tests","header_test","TestHeaderPage","","","Verify size of the image in the 'Logo' link in the Header for an authorized user",""
"passed","Sat Nov 23 01:12:57 GMT 2024","Sat Nov 23 01:12:58 GMT 2024","732","tests","registration_page_test","TestRegistrationPage","","","Check registration with new email and empty birthday",""
"passed","Sat Nov 23 01:14:51 GMT 2024","Sat Nov 23 01:14:55 GMT 2024","4686","tests","specialists_page_test","TestSpecialistsPage","","","Verify that the 'All Specialists' link leads an authorized user 
                         to the correct page after clicking",""
"passed","Sat Nov 23 01:16:05 GMT 2024","Sat Nov 23 01:16:05 GMT 2024","59","tests","start_unauthorized_page_test","TestStartUnauthorizedPage","","","Verify size of the image in the section 1",""
"passed","Sat Nov 23 00:59:37 GMT 2024","Sat Nov 23 00:59:37 GMT 2024","768","tests","contributors_page_test","TestContributorsPage","","","Verify href, status code of the 'All Team' link",""
"passed","Sat Nov 23 01:13:09 GMT 2024","Sat Nov 23 01:13:09 GMT 2024","687","tests","registration_page_test","TestRegistrationPage","","","Check registration without choosing gender",""
"skipped","Sat Nov 23 01:16:47 GMT 2024","Sat Nov 23 01:17:07 GMT 2024","20205","tests","Speech exercises EN.","TestCardsEN","","","Check progres-bar and buttons.",""
"skipped","Sat Nov 23 01:17:17 GMT 2024","Sat Nov 23 01:17:37 GMT 2024","20207","tests","Speech exercises EN.","TestCardsEN","","","Select a random card from ""Similar phrases"" group and compare UI vs BACKEND data",""
"passed","Sat Nov 23 00:58:17 GMT 2024","Sat Nov 23 00:58:17 GMT 2024","29","tests","contacts_page_test","TestContactsPage","","","Verify content of the text in the section 2",""
"passed","Sat Nov 23 01:08:04 GMT 2024","Sat Nov 23 01:08:04 GMT 2024","366","tests","header_test","TestHeaderPage","","","Verify presence, visibility of links, buttons in the Header for an authorized user",""
"passed","Sat Nov 23 00:57:53 GMT 2024","Sat Nov 23 00:57:54 GMT 2024","138","tests","contacts_page_test","TestContactsPage","","","Verify the composition and visibility of elements 
        on the 1st-5th levels of nesting in the section 2",""
"passed","Sat Nov 23 01:07:16 GMT 2024","Sat Nov 23 01:07:16 GMT 2024","45","tests","header_test","TestHeaderPage","","","Verify presence, visibility and attributes of the image in the 'Logo' link in the Header 
               on the Start Unauthorized Page",""
"skipped","Sat Nov 23 01:11:52 GMT 2024","Sat Nov 23 01:11:52 GMT 2024","0","tests","main_page_test","TestMainPage","","","Checking the ip is available",""
"passed","Sat Nov 23 01:24:28 GMT 2024","Sat Nov 23 01:24:29 GMT 2024","57","tests","used_resources_page_test","TestUsedResourcesPage","","","Verify presence, visibility and attributes of icons in sections",""
"passed","Sat Nov 23 01:15:40 GMT 2024","Sat Nov 23 01:15:40 GMT 2024","78","tests","start_unauthorized_page_test","TestStartUnauthorizedPage","","","Verify content of the text in sections 1, 2",""
"passed","Sat Nov 23 00:58:00 GMT 2024","Sat Nov 23 00:58:00 GMT 2024","164","tests","contacts_page_test","TestContactsPage","","","Verify presence, visibility of sections, the dividing line and elements with text on the page",""
"passed","Sat Nov 23 01:04:37 GMT 2024","Sat Nov 23 01:04:55 GMT 2024","18325","tests","groups_page_test","TestGroupsPage","","","Verify if links on the 'ru' local lead to correct pages after clicking",""
"passed","Sat Nov 23 00:59:42 GMT 2024","Sat Nov 23 00:59:43 GMT 2024","805","tests","contributors_page_test","TestContributorsPage","","","Verify attribute values of images in contributors cards in grids",""
"passed","Sat Nov 23 01:07:21 GMT 2024","Sat Nov 23 01:07:21 GMT 2024","53","tests","header_test","TestHeaderPage","","","Verify size of the image in the 'Logo' link in the Header on the Start Unauthorized Page",""
"passed","Sat Nov 23 01:15:16 GMT 2024","Sat Nov 23 01:15:16 GMT 2024","31","tests","start_unauthorized_page_test","TestStartUnauthorizedPage","","","Verify amount and visibility of sections with content on the page",""
"passed","Sat Nov 23 01:01:54 GMT 2024","Sat Nov 23 01:01:55 GMT 2024","120","tests","footer_test","TestFooter","","","Verify that the 'Contact us' link in the Footer calls an email client",""
