"Status","Start Time","Stop Time","Duration in ms","Parent Suite","Suite","Sub Suite","Test Class","Test Method","Name","Description"
"passed","Sat Nov 23 01:05:06 GMT 2024","Sat Nov 23 01:05:24 GMT 2024","18243","tests","groups_page_test","TestGroupsPage","","","Verify if links on the 'en' local lead to correct pages after clicking",""
"passed","Sat Nov 23 01:19:28 GMT 2024","Sat Nov 23 01:19:50 GMT 2024","22703","tests","Речевые упражнения.","TestCardsRU","","","Select a random card from ""Группа слов"" group and compare UI vs BACKEND data.",""
"passed","Sat Nov 23 01:14:09 GMT 2024","Sat Nov 23 01:14:09 GMT 2024","34","tests","specialists_page_test","TestSpecialistsPage","","","Verify value of title with tag 'h2' on the page",""
"passed","Sat Nov 23 01:00:34 GMT 2024","Sat Nov 23 01:00:34 GMT 2024","198","tests","description_page_test","TestDescriptionPage","","","Verify redirection to used resources page not authorized user.",""
"passed","Sat Nov 23 01:11:47 GMT 2024","Sat Nov 23 01:11:47 GMT 2024","102","tests","main_page_test","TestMainPage","","","Checking the clickability of the Start button.",""
"passed","Sat Nov 23 01:10:33 GMT 2024","Sat Nov 23 01:10:33 GMT 2024","45","tests","header_test","TestHeaderPage","","","Verify presence, visibility, attributes of icons in the Header for an authorized user",""
"passed","Sat Nov 23 01:11:03 GMT 2024","Sat Nov 23 01:11:10 GMT 2024","6930","tests","main_page_test","TestMainPage","","","Verify redirection to telegram page not authorized user.",""
"passed","Sat Nov 23 01:14:04 GMT 2024","Sat Nov 23 01:14:04 GMT 2024","11","tests","specialists_page_test","TestSpecialistsPage","","","Verify value of the title of the tab",""
"passed","Sat Nov 23 01:10:44 GMT 2024","Sat Nov 23 01:10:44 GMT 2024","52","tests","header_test","TestHeaderPage","","","Verify presence, visibility and attributes of the profile avatar in the Header 
               for an authorized user",""
"passed","Sat Nov 23 01:00:17 GMT 2024","Sat Nov 23 01:00:17 GMT 2024","699","tests","description_page_test","TestDescriptionPage","","","Verify redirection to specialists page not authorized user.",""
"passed","Sat Nov 23 01:18:54 GMT 2024","Sat Nov 23 01:19:17 GMT 2024","22921","tests","Речевые упражнения.","TestCardsRU","","","Select a random card from ""Похожие фразы"" group and compare UI vs BACKEND data.",""
"passed","Sat Nov 23 01:13:04 GMT 2024","Sat Nov 23 01:13:04 GMT 2024","716","tests","registration_page_test","TestRegistrationPage","","","Check registration with new email and empty email",""
"passed","Sat Nov 23 00:59:31 GMT 2024","Sat Nov 23 00:59:32 GMT 2024","729","tests","contributors_page_test","TestContributorsPage","","","Verify clickability, href of links on the page",""
"passed","Sat Nov 23 01:11:37 GMT 2024","Sat Nov 23 01:11:38 GMT 2024","701","tests","main_page_test","TestMainPage","","","Verify redirection to contributors page not authorized user.",""
"passed","Sat Nov 23 01:07:07 GMT 2024","Sat Nov 23 01:07:07 GMT 2024","296","tests","header_test","TestHeaderPage","","","Verify the dropdown opens/closes after clicking on the 'More' button in the Header 
            on the Start Unauthorized Page",""
"passed","Sat Nov 23 01:12:34 GMT 2024","Sat Nov 23 01:12:36 GMT 2024","1266","tests","registration_page_test","TestRegistrationPage","","","Check registration with an existing email",""
"passed","Sat Nov 23 01:15:12 GMT 2024","Sat Nov 23 01:15:12 GMT 2024","32","tests","start_unauthorized_page_test","TestStartUnauthorizedPage","","","Verify presence and visibility of content on the page",""
"passed","Sat Nov 23 01:03:33 GMT 2024","Sat Nov 23 01:03:50 GMT 2024","16389","tests","groups_page_test","TestGroupsPage","","","Verify value of the title and subtitles on the page",""
"passed","Sat Nov 23 01:15:56 GMT 2024","Sat Nov 23 01:15:56 GMT 2024","156","tests","start_unauthorized_page_test","TestStartUnauthorizedPage","","","Verify that the 'Login' link leads to the correct page after clicking",""
"passed","Sat Nov 23 01:00:22 GMT 2024","Sat Nov 23 01:00:23 GMT 2024","1508","tests","description_page_test","TestDescriptionPage","","","Verify redirection to github not authorized user.",""
"passed","Sat Nov 23 00:58:43 GMT 2024","Sat Nov 23 00:58:43 GMT 2024","102","tests","contacts_page_test","TestContactsPage","","","Verify that the email link calls an email client",""
"passed","Sat Nov 23 01:12:51 GMT 2024","Sat Nov 23 01:12:52 GMT 2024","727","tests","registration_page_test","TestRegistrationPage","","","Check registration with new email and empty first name",""
"passed","Sat Nov 23 01:23:39 GMT 2024","Sat Nov 23 01:23:39 GMT 2024","27","tests","used_resources_page_test","TestUsedResourcesPage","","","Verify presence and visibility of content on the page",""
"passed","Sat Nov 23 00:59:20 GMT 2024","Sat Nov 23 00:59:22 GMT 2024","1363","tests","contributors_page_test","TestContributorsPage","","","Verify values of the text in card descriptions",""
"passed","Sat Nov 23 01:15:07 GMT 2024","Sat Nov 23 01:15:07 GMT 2024","181","tests","specialists_page_test","TestSpecialistsPage","","","Verify sizes of images in specialist cards in the grid",""
"passed","Sat Nov 23 01:13:53 GMT 2024","Sat Nov 23 01:13:58 GMT 2024","5351","tests","specialists_page_test","TestSpecialistsPage","","","Verify presence, visibility of the title, text, link, grid, cards and images  
        on the 2nd, 3rd, 5th, 6th levels of nesting on the page",""
"skipped","Sat Nov 23 01:20:38 GMT 2024","Sat Nov 23 01:21:04 GMT 2024","26611","tests","Речевые упражнения.","TestCardsRU","","","Select a random card from ""Слова с частотной группировкой"" group and compare UI vs BACKEND data.",""
"passed","Sat Nov 23 01:06:46 GMT 2024","Sat Nov 23 01:06:51 GMT 2024","4951","tests","header_test","TestHeaderPage","","","Verify if internal links in the Header for an unauthorized user 
            lead to correct pages after click",""
"passed","Sat Nov 23 01:01:07 GMT 2024","Sat Nov 23 01:01:07 GMT 2024","40","tests","footer_test","TestFooter","","","Verify presence and visibility of the Footer",""
"passed","Sat Nov 23 01:23:56 GMT 2024","Sat Nov 23 01:23:56 GMT 2024","32","tests","used_resources_page_test","TestUsedResourcesPage","","","Verify value of title with tag 'h1' on the page",""
"skipped","Sat Nov 23 01:23:07 GMT 2024","Sat Nov 23 01:23:19 GMT 2024","12295","tests","Речевые упражнения.","TestCardsRU","","","Solutions to a random task in the ""Слова"" group and comparison of statics.",""
"passed","Sat Nov 23 01:13:47 GMT 2024","Sat Nov 23 01:13:47 GMT 2024","337","tests","specialists_page_test","TestSpecialistsPage","","","Verify the composition and visibility of elements 
        on the 1st-6th levels of nesting on the page",""
"passed","Sat Nov 23 00:58:58 GMT 2024","Sat Nov 23 00:59:02 GMT 2024","3663","tests","contributors_page_test","TestContributorsPage","","","Verify presence, visibility of titles/subtitles, cards, descriptions, links, images on the page",""
"passed","Sat Nov 23 01:23:44 GMT 2024","Sat Nov 23 01:23:45 GMT 2024","121","tests","used_resources_page_test","TestUsedResourcesPage","","","Verify the composition and visibility of elements 
        on the 1st-4th levels of nesting on the page",""
"passed","Sat Nov 23 00:58:23 GMT 2024","Sat Nov 23 00:58:23 GMT 2024","29","tests","contacts_page_test","TestContactsPage","","","Verify text in links in the section 2",""
"passed","Sat Nov 23 01:06:05 GMT 2024","Sat Nov 23 01:06:05 GMT 2024","32","tests","header_test","TestHeaderPage","","","Verify presence and visibility of the Header for an unauthorized user",""
"passed","Sat Nov 23 01:00:50 GMT 2024","Sat Nov 23 01:00:50 GMT 2024","27","tests","exercises_ru_words_page_test","TestExercisesRuWordsPage","","","Verify presence and visibility of content on the page",""
"passed","Sat Nov 23 00:57:35 GMT 2024","Sat Nov 23 00:57:36 GMT 2024","930","tests","authorisation_page_test","TestAuthorizedUserPage","","","Checking the possibility of authorization with incorrect data",""
"passed","Sat Nov 23 01:12:19 GMT 2024","Sat Nov 23 01:12:30 GMT 2024","10566","tests","registration_page_test","TestRegistrationPage","","","Check registration with new email",""
"passed","Sat Nov 23 01:11:51 GMT 2024","Sat Nov 23 01:11:52 GMT 2024","124","tests","main_page_test","TestMainPage","","","Checking the clickability of the Registration button.",""
"skipped","Sat Nov 23 01:16:16 GMT 2024","Sat Nov 23 01:16:36 GMT 2024","20223","tests","Speech exercises EN.","TestCardsEN","","","Select random card from ""Word"" group and compare UI vs BACKEND data",""
"passed","Sat Nov 23 01:14:21 GMT 2024","Sat Nov 23 01:14:21 GMT 2024","107","tests","specialists_page_test","TestSpecialistsPage","","","Verify values of names and professions in specialist cards in the grid",""
"passed","Sat Nov 23 01:09:18 GMT 2024","Sat Nov 23 01:09:20 GMT 2024","2000","tests","header_test","TestHeaderPage","","","Verify if external links in the Header for an authorized user 
            lead to correct pages after click",""
"passed","Sat Nov 23 01:01:39 GMT 2024","Sat Nov 23 01:01:50 GMT 2024","11193","tests","footer_test","TestFooter","","","Verify that links in the Footer lead to correct pages after clicking",""
"passed","Sat Nov 23 01:11:15 GMT 2024","Sat Nov 23 01:11:16 GMT 2024","1509","tests","main_page_test","TestMainPage","","","Verify redirection to donate page not authorized user.",""
"passed","Sat Nov 23 01:15:45 GMT 2024","Sat Nov 23 01:15:45 GMT 2024","41","tests","start_unauthorized_page_test","TestStartUnauthorizedPage","","","Verify text in the 'Login' link in the section 1",""
"passed","Sat Nov 23 01:08:53 GMT 2024","Sat Nov 23 01:09:07 GMT 2024","14008","tests","header_test","TestHeaderPage","","","Verify if internal links in the Header for an authorized user 
            lead to correct pages after click",""
"passed","Sat Nov 23 01:15:21 GMT 2024","Sat Nov 23 01:15:21 GMT 2024","84","tests","start_unauthorized_page_test","TestStartUnauthorizedPage","","","Verify the composition and visibility of elements 
        on the 1st-3rd levels of nesting in the section 1",""
"passed","Sat Nov 23 01:14:15 GMT 2024","Sat Nov 23 01:14:15 GMT 2024","34","tests","specialists_page_test","TestSpecialistsPage","","","Verify value of text on the page",""
"passed","Sat Nov 23 01:12:40 GMT 2024","Sat Nov 23 01:12:41 GMT 2024","712","tests","registration_page_test","TestRegistrationPage","","","Check registration with new email and empty confirm password",""
"passed","Sat Nov 23 00:59:16 GMT 2024","Sat Nov 23 00:59:16 GMT 2024","19","tests","contributors_page_test","TestContributorsPage","","","Verify content of the text on the page",""
"passed","Sat Nov 23 01:09:40 GMT 2024","Sat Nov 23 01:09:40 GMT 2024","247","tests","header_test","TestHeaderPage","","","Verify the dropdown opens/closes after clicking on the 'More' button in the Header 
               for an authorized user",""
"skipped","Sat Nov 23 01:20:01 GMT 2024","Sat Nov 23 01:20:27 GMT 2024","26601","tests","Речевые упражнения.","TestCardsRU","","","Select a random card from ""Предложения"" group and compare UI vs BACKEND data.",""
"passed","Sat Nov 23 01:01:03 GMT 2024","Sat Nov 23 01:01:03 GMT 2024","252","tests","exercises_ru_words_page_test","TestExercisesRuWordsPage","","","Verify composition, visibility of elements on the 1st-6th levels of nesting on the page",""
"passed","Sat Nov 23 00:57:48 GMT 2024","Sat Nov 23 00:57:48 GMT 2024","19","tests","contacts_page_test","TestContactsPage","","","Verify the composition and visibility of elements on the 1st level of nesting in the section 1",""
"passed","Sat Nov 23 01:23:29 GMT 2024","Sat Nov 23 01:23:33 GMT 2024","3325","tests","Statistic.","TestCardsRU","","","Check statistic table.",""
"passed","Sat Nov 23 01:03:59 GMT 2024","Sat Nov 23 01:04:26 GMT 2024","26767","tests","groups_page_test","TestGroupsPage","","","Verify clickability, title, href, status code of links on the page",""
"passed","Sat Nov 23 01:02:15 GMT 2024","Sat Nov 23 01:02:26 GMT 2024","11170","tests","footer_test","TestFooter","","","Verify Footer invisibility through the modal window with the exercise",""
"passed","Sat Nov 23 01:07:43 GMT 2024","Sat Nov 23 01:07:53 GMT 2024","10250","tests","header_test","TestHeaderPage","","","Verify composition, visibility of elements on the 1st-6th levels of nesting in the Header
            for an authorized user",""
"passed","Sat Nov 23 01:10:58 GMT 2024","Sat Nov 23 01:10:58 GMT 2024","133","tests","main_page_test","TestMainPage","","","Verify redirection to description page not authorized user.",""
"passed","Sat Nov 23 00:57:42 GMT 2024","Sat Nov 23 00:57:42 GMT 2024","27","tests","contacts_page_test","TestContactsPage","","","Verify presence and visibility of content on the page",""
"passed","Sat Nov 23 01:13:14 GMT 2024","Sat Nov 23 01:13:35 GMT 2024","20767","tests","registration_page_test","TestRegistrationPage","","","Check registration without choosing agreement",""
"passed","Sat Nov 23 00:59:07 GMT 2024","Sat Nov 23 00:59:07 GMT 2024","14","tests","contributors_page_test","TestContributorsPage","","","Verify value of the title of the tab",""
"passed","Sat Nov 23 01:01:17 GMT 2024","Sat Nov 23 01:01:17 GMT 2024","155","tests","footer_test","TestFooter","","","Verify presence, visibility of text, links, images in the Footer",""
"passed","Sat Nov 23 01:15:01 GMT 2024","Sat Nov 23 01:15:01 GMT 2024","108","tests","specialists_page_test","TestSpecialistsPage","","","Verify attributes of images in specialist cards in the grid",""
"passed","Sat Nov 23 01:01:59 GMT 2024","Sat Nov 23 01:01:59 GMT 2024","80","tests","footer_test","TestFooter","","","Verify attributes of images in links in the Footer",""
"passed","Sat Nov 23 00:58:48 GMT 2024","Sat Nov 23 00:58:48 GMT 2024","37","tests","contributors_page_test","TestContributorsPage","","","Verify presence, visibility and structure of content on the page",""
"passed","Sat Nov 23 01:00:05 GMT 2024","Sat Nov 23 01:00:07 GMT 2024","1753","tests","description_page_test","TestDescriptionPage","","","Verify redirection to donate page not authorized user.",""
"passed","Sat Nov 23 01:06:25 GMT 2024","Sat Nov 23 01:06:25 GMT 2024","375","tests","header_test","TestHeaderPage","","","Verify presence, visibility of links, buttons in the Header for an unauthorized user",""
"passed","Sat Nov 23 01:24:34 GMT 2024","Sat Nov 23 01:24:34 GMT 2024","76","tests","used_resources_page_test","TestUsedResourcesPage","","","Verify sizes of icons in sections",""
"passed","Sat Nov 23 01:11:42 GMT 2024","Sat Nov 23 01:11:42 GMT 2024","180","tests","main_page_test","TestMainPage","","","Verify redirection to used resources page not authorized user.",""
"passed","Sat Nov 23 00:58:35 GMT 2024","Sat Nov 23 00:58:37 GMT 2024","1837","tests","contacts_page_test","TestContactsPage","","","Verify if links in the section 2 lead to the correct pages after clicking",""
"passed","Sat Nov 23 00:58:29 GMT 2024","Sat Nov 23 00:58:30 GMT 2024","1148","tests","contacts_page_test","TestContactsPage","","","Verify presence, visibility, clickability, href, prefix, status code of links in the section 2",""
"passed","Sat Nov 23 01:10:01 GMT 2024","Sat Nov 23 01:10:02 GMT 2024","452","tests","header_test","TestHeaderPage","","","Verify user logout after clicking the 'Logout' button in the Header for an authorized user",""
"passed","Sat Nov 23 01:01:22 GMT 2024","Sat Nov 23 01:01:22 GMT 2024","45","tests","footer_test","TestFooter","","","Verify content of text in the Footer",""
"passed","Sat Nov 23 00:59:54 GMT 2024","Sat Nov 23 00:59:54 GMT 2024","166","tests","description_page_test","TestDescriptionPage","","","Verify return main page from description page.",""
"passed","Sat Nov 23 01:00:12 GMT 2024","Sat Nov 23 01:00:12 GMT 2024","206","tests","description_page_test","TestDescriptionPage","","","Verify redirection to contacts page not authorized user.",""
"passed","Sat Nov 23 01:01:26 GMT 2024","Sat Nov 23 01:01:26 GMT 2024","45","tests","footer_test","TestFooter","","","Verify text in the 'Contact us' link in the Footer",""
"passed","Sat Nov 23 01:14:33 GMT 2024","Sat Nov 23 01:14:33 GMT 2024","804","tests","specialists_page_test","TestSpecialistsPage","","","Verify clickability, href, status code of the 'All Specialists' link",""
"passed","Sat Nov 23 01:15:26 GMT 2024","Sat Nov 23 01:15:26 GMT 2024","135","tests","start_unauthorized_page_test","TestStartUnauthorizedPage","","","Verify the composition and visibility of elements 
        on the 1st-3rd levels of nesting in the section 2",""
"passed","Sat Nov 23 01:07:12 GMT 2024","Sat Nov 23 01:07:12 GMT 2024","217","tests","header_test","TestHeaderPage","","","Verify switching of the 'ru', 'en' buttons in the Header on the Start Unauthorized Page",""
"passed","Sat Nov 23 01:24:13 GMT 2024","Sat Nov 23 01:24:15 GMT 2024","1554","tests","used_resources_page_test","TestUsedResourcesPage","","","Verify presence, visibility, clickability, href, status code of links in sections",""
"passed","Sat Nov 23 01:08:35 GMT 2024","Sat Nov 23 01:08:42 GMT 2024","7101","tests","header_test","TestHeaderPage","","","Verify clickability, href, status code of links in the Header for an authorized user",""
"passed","Sat Nov 23 01:05:35 GMT 2024","Sat Nov 23 01:05:44 GMT 2024","8211","tests","groups_page_test","TestGroupsPage","","","Verify attributes of images in links on the page",""
"passed","Sat Nov 23 00:58:52 GMT 2024","Sat Nov 23 00:58:54 GMT 2024","1642","tests","contributors_page_test","TestContributorsPage","","","Verify the composition and visibility of elements 
        on the 1st-5th levels of nesting on the page",""
"passed","Sat Nov 23 00:58:11 GMT 2024","Sat Nov 23 00:58:11 GMT 2024","49","tests","contacts_page_test","TestContactsPage","","","Verify values of the title and subtitles with tags h1, h2 on the page",""
"passed","Sat Nov 23 01:14:39 GMT 2024","Sat Nov 23 01:14:40 GMT 2024","657","tests","specialists_page_test","TestSpecialistsPage","","","Verify that the 'All Specialists' link leads an unauthorized user 
                         to the correct page after clicking",""
"passed","Sat Nov 23 00:57:29 GMT 2024","Sat Nov 23 00:57:30 GMT 2024","1389","tests","authorisation_page_test","TestAuthorizedUserPage","","","Checking the possibility of authorization with the correct data",""
"passed","Sat Nov 23 01:17:48 GMT 2024","Sat Nov 23 01:18:10 GMT 2024","21787","tests","Речевые упражнения.","TestCardsRU","","","Select random card from group ""Слова"" and compare UI vs BACKEND data.",""
"passed","Sat Nov 23 01:15:50 GMT 2024","Sat Nov 23 01:15:50 GMT 2024","821","tests","start_unauthorized_page_test","TestStartUnauthorizedPage","","","Verify presence, visibility, clickability, href, status code 
                         of the 'Login' link in the section 1",""
"passed","Sat Nov 23 01:16:01 GMT 2024","Sat Nov 23 01:16:01 GMT 2024","80","tests","start_unauthorized_page_test","TestStartUnauthorizedPage","","","Verify presence, visibility and attributes of the image in the section 1",""
"passed","Sat Nov 23 01:07:02 GMT 2024","Sat Nov 23 01:07:02 GMT 2024","123","tests","header_test","TestHeaderPage","","","Verify that the 'Logo' link on the Start Unauthorized Page 
                             doesn't refresh the current page or lead to other pages after clicking",""
"passed","Sat Nov 23 00:59:59 GMT 2024","Sat Nov 23 01:00:00 GMT 2024","1706","tests","description_page_test","TestDescriptionPage","","","Verify redirection to telegram page not authorized user.",""
"passed","Sat Nov 23 01:02:04 GMT 2024","Sat Nov 23 01:02:04 GMT 2024","108","tests","footer_test","TestFooter","","","Verify sizes of images in links in the Footer",""
"passed","Sat Nov 23 01:12:46 GMT 2024","Sat Nov 23 01:12:46 GMT 2024","745","tests","registration_page_test","TestRegistrationPage","","","Check registration with new email and empty password",""
"passed","Sat Nov 23 01:23:50 GMT 2024","Sat Nov 23 01:23:50 GMT 2024","11","tests","used_resources_page_test","TestUsedResourcesPage","","","Verify value of the title of the tab",""
"passed","Sat Nov 23 01:06:55 GMT 2024","Sat Nov 23 01:06:57 GMT 2024","1999","tests","header_test","TestHeaderPage","","","Verify if external links in the Header for an unauthorized user 
            lead to correct pages after click",""
"passed","Sat Nov 23 01:11:31 GMT 2024","Sat Nov 23 01:11:32 GMT 2024","1373","tests","main_page_test","TestMainPage","","","Verify redirection to github not authorized user.",""
"passed","Sat Nov 23 01:15:35 GMT 2024","Sat Nov 23 01:15:35 GMT 2024","46","tests","start_unauthorized_page_test","TestStartUnauthorizedPage","","","Verify values of titles and subtitles with tags h2, h4 on the page",""
"passed","Sat Nov 23 01:10:12 GMT 2024","Sat Nov 23 01:10:12 GMT 2024","40","tests","header_test","TestHeaderPage","","","Verify presence, visibility and attributes of the image in the 'Logo' link in the Header 
               for an authorized user",""
"passed","Sat Nov 23 01:13:41 GMT 2024","Sat Nov 23 01:13:41 GMT 2024","28","tests","specialists_page_test","TestSpecialistsPage","","","Verify presence and visibility of content on the page",""
"passed","Sat Nov 23 01:02:37 GMT 2024","Sat Nov 23 01:02:37 GMT 2024","26","tests","groups_page_test","TestGroupsPage","","","Verify presence and visibility of content on the page",""
"passed","Sat Nov 23 01:18:20 GMT 2024","Sat Nov 23 01:18:43 GMT 2024","23029","tests","Речевые упражнения.","TestCardsRU","","","Select random card from group ""Слова Королёвой"" and compare UI vs BACKEND data.",""
"passed","Sat Nov 23 01:11:26 GMT 2024","Sat Nov 23 01:11:26 GMT 2024","705","tests","main_page_test","TestMainPage","","","Verify redirection to specialists page not authorized user.",""
"passed","Sat Nov 23 01:24:20 GMT 2024","Sat Nov 23 01:24:23 GMT 2024","2401","tests","used_resources_page_test","TestUsedResourcesPage","","","Verify that links in the sections lead to the correct pages after clicking",""
"passed","Sat Nov 23 01:15:30 GMT 2024","Sat Nov 23 01:15:31 GMT 2024","12","tests","start_unauthorized_page_test","TestStartUnauthorizedPage","","","Verify value of the title of the tab",""
"passed","Sat Nov 23 01:06:10 GMT 2024","Sat Nov 23 01:06:20 GMT 2024","10208","tests","header_test","TestHeaderPage","","","Verify composition, visibility of elements on the 1st-6th levels of nesting in the Header
            for an unauthorized user",""
"passed","Sat Nov 23 01:06:34 GMT 2024","Sat Nov 23 01:06:41 GMT 2024","6460","tests","header_test","TestHeaderPage","","","Verify clickability, href, status code of links in the Header for an unauthorized user",""
"passed","Sat Nov 23 01:06:30 GMT 2024","Sat Nov 23 01:06:30 GMT 2024","224","tests","header_test","TestHeaderPage","","","Verify values of the text in links, buttons in the Header for an unauthorized user",""
"passed","Sat Nov 23 01:03:01 GMT 2024","Sat Nov 23 01:03:04 GMT 2024","3122","tests","groups_page_test","TestGroupsPage","","","Verify presence, visibility of the title, tiles, links, images, subtitles on the page",""
"passed","Sat Nov 23 01:21:15 GMT 2024","Sat Nov 23 01:22:11 GMT 2024","56395","tests","Речевые упражнения.","TestCardsRU","","","Solutions to a random task in the ""Слова"" .",""
"passed","Sat Nov 23 01:11:21 GMT 2024","Sat Nov 23 01:11:21 GMT 2024","179","tests","main_page_test","TestMainPage","","","Verify redirection to contacts page not authorized user.",""
"passed","Sat Nov 23 01:07:32 GMT 2024","Sat Nov 23 01:07:32 GMT 2024","27","tests","header_test","TestHeaderPage","","","Verify presence and visibility of the Header for an authorized user",""
"passed","Sat Nov 23 01:01:12 GMT 2024","Sat Nov 23 01:01:12 GMT 2024","251","tests","footer_test","TestFooter","","","Verify composition and visibility of elements on the 1st-7th levels of nesting in the Footer",""
"passed","Sat Nov 23 00:59:11 GMT 2024","Sat Nov 23 00:59:11 GMT 2024","42","tests","contributors_page_test","TestContributorsPage","","","Verify values of title and subtitles with tags h2, h3 on the page",""
"passed","Sat Nov 23 01:11:52 GMT 2024","Sat Nov 23 01:11:52 GMT 2024","755","tests","main_page_test","TestMainPage","","","Checking the domain is available",""
"passed","Sat Nov 23 01:01:31 GMT 2024","Sat Nov 23 01:01:34 GMT 2024","3033","tests","footer_test","TestFooter","","","Verify clickability, href, prefix and subject, status code of links in the Footer",""
"passed","Sat Nov 23 01:11:57 GMT 2024","Sat Nov 23 01:12:14 GMT 2024","17635","tests","profile_page_test","TestProfilePage","","","Change the password by receiving an email link",""
"passed","Sat Nov 23 01:09:30 GMT 2024","Sat Nov 23 01:09:30 GMT 2024","85","tests","header_test","TestHeaderPage","","","Verify that the 'Logo' link on the Start Authorized Page 
                             doesn't refresh the current page or lead to other pages after clicking",""
"passed","Sat Nov 23 01:24:07 GMT 2024","Sat Nov 23 01:24:08 GMT 2024","28","tests","used_resources_page_test","TestUsedResourcesPage","","","Verify text in links in sections",""
"passed","Sat Nov 23 01:14:27 GMT 2024","Sat Nov 23 01:14:27 GMT 2024","43","tests","specialists_page_test","TestSpecialistsPage","","","Verify text in the 'All Specialists' link",""
"passed","Sat Nov 23 01:22:21 GMT 2024","Sat Nov 23 01:22:57 GMT 2024","35647","tests","Речевые упражнения.","TestCardsRU","","","Solutions to a random task in the ""Слова Королёвой"" .",""
"passed","Sat Nov 23 01:08:25 GMT 2024","Sat Nov 23 01:08:25 GMT 2024","26","tests","header_test","TestHeaderPage","","","Verify presence, visibility of the user name in the Header for an authorized user",""
