"DESCRIPTION","DURATION IN MS","NAME","PARENT SUITE","START TIME","STATUS","STOP TIME","SUB SUITE","SUITE","TEST CLASS","TEST METHOD"
"","1049","Verify presence, visibility, clickability, href, status code of links in sections","tests","2026-06-21","passed","2026-06-21","TestURPage","used_resources_page_test","",""
"","109","Verify that the 'Contact us' link in the Footer calls an email client","tests","2026-06-21","passed","2026-06-21","TestFooter","footer_test","",""
"","692","Verify redirection to contributors page not authorized user.","tests","2026-06-21","passed","2026-06-21","TestDescriptionPage","description_page_test","",""
"","11","Verify value of the title of the tab","tests","2026-06-21","passed","2026-06-21","TestContactsPage","contacts_page_test","",""
"","27","Verify value of the breadcrumbs on the page","tests","2026-06-21","passed","2026-06-21","TestExercisesRuWordsPage","exercises_ru_words_page_test","",""
"","117","Verify redirection to description page not authorized user.","tests","2026-06-21","passed","2026-06-21","TestMainPage","main_page_test","",""
"","24","Verify title of links on the 'ru' local","tests","2026-06-21","passed","2026-06-21","TestGroupsPage","groups_page_test","",""
"","1368","Verify presence, visibility of lists on the page","tests","2026-06-21","passed","2026-06-21","TestExercisesRuWordsFamilyPage","exercises_ru_words_family_page_test","",""
"","27","Verify value of the breadcrumbs on the page","tests","2026-06-21","passed","2026-06-21","TestExercisesRuSimilarPhrasesPage","exercises_ru_similar_phrases_page_test","",""
"","2102","Verify redirection to github not authorized user.","tests","2026-06-21","passed","2026-06-21","TestDescriptionPage","description_page_test","",""
"","1996","Verify redirection to github not authorized user.","tests","2026-06-21","passed","2026-06-21","TestMainPage","main_page_test","",""
"","655","Check registration without choosing agreement","tests","2026-06-21","passed","2026-06-21","TestRegistrationPage","registration_page_test","",""
"","534","Verify clickability, href, status code of the 'All Specialists' link","tests","2026-06-21","passed","2026-06-21","TestSpecialistsPage","specialists_page_test","",""
"","1767","Verify if links on the 'en' local lead to correct pages after clicking","tests","2026-06-21","passed","2026-06-21","TestGroupsPage","groups_page_test","",""
"","1418","Verify that links in the sections lead to the correct pages after clicking","tests","2026-06-21","passed","2026-06-21","TestURPage","used_resources_page_test","",""
"","2578","Verify presence, visibility of titles/subtitles, cards, descriptions, links, images on the page","tests","2026-06-21","passed","2026-06-21","TestContributorsPage","contributors_page_test","",""
"","1300","Verify sizes of background-images in links on the page","tests","2026-06-21","passed","2026-06-21","TestExercisesRuWordsPage","exercises_ru_words_page_test","",""
"","31","Verify presence and visibility of content on the page","tests","2026-06-21","passed","2026-06-21","TestExercisesRuWordsPage","exercises_ru_words_page_test","",""
"","790","Verify values of the text in card descriptions","tests","2026-06-21","passed","2026-06-21","TestContributorsPage","contributors_page_test","",""
"","20981","Check registration with new email and empty first name","tests","2026-06-21","passed","2026-06-21","TestRegistrationPage","registration_page_test","",""
"","212","Verify values of the text in links, buttons in the Header for an unauthorized user","tests","2026-06-21","passed","2026-06-21","TestHeaderPage","header_test","",""
"","904","Verify if direct internal links in the Header for an authorized user 
            lead to correct pages after click","tests","2026-06-21","passed","2026-06-21","TestHeaderPage","header_test","",""
"","986","Checking the possibility of authorization with the correct data","tests","2026-06-21","passed","2026-06-21","TestAuthorizedUserPage","authorisation_page_test","",""
"","435","Verify text in card links and the 'All Team' link","tests","2026-06-21","passed","2026-06-21","TestContributorsPage","contributors_page_test","",""
"","772","Check registration with new email and empty password","tests","2026-06-21","passed","2026-06-21","TestRegistrationPage","registration_page_test","",""
"","262","Verify values of the text in links, buttons in the Header for an authorized user","tests","2026-06-21","passed","2026-06-21","TestHeaderPage","header_test","",""
"","743","Check registration without choosing gender","tests","2026-06-21","passed","2026-06-21","TestRegistrationPage","registration_page_test","",""
"","862","Verify attribute values of images in contributors cards in grids","tests","2026-06-21","passed","2026-06-21","TestContributorsPage","contributors_page_test","",""
"","45","Verify text in group links on the page","tests","2026-06-21","passed","2026-06-21","TestExercisesRuWordsPage","exercises_ru_words_page_test","",""
"","124","Verify sizes of images in links in the Footer","tests","2026-06-21","passed","2026-06-21","TestFooter","footer_test","",""
"","2917","Verify if group links lead to correct pages after clicking","tests","2026-06-21","passed","2026-06-21","TestExercisesRuWordsPage","exercises_ru_words_page_test","",""
"","1207","Verify sizes of images in contributor cards in grids","tests","2026-06-21","passed","2026-06-21","TestContributorsPage","contributors_page_test","",""
"","41","Verify value of title with tag 'h1' on the page","tests","2026-06-21","passed","2026-06-21","TestURPage","used_resources_page_test","",""
"","3860","Check registration with new email","tests","2026-06-21","passed","2026-06-21","TestRegistrationPage","registration_page_test","",""
"","10818","Solutions to a random task in the ""Слова Королёвой"" .","tests","2026-06-21","skipped","2026-06-21","TestCardsRU","Речевые упражнения.","",""
"","42","Verify text in the 'Login' link in the section 1","tests","2026-06-21","passed","2026-06-21","TestStartUnauthorizedPage","start_unauthorized_page_test","",""
"","59","Verify size of the image in the Logo link in the Header on the Start Unauthorized Page","tests","2026-06-21","passed","2026-06-21","TestHeaderPage","header_test","",""
"","932","Verify presence, visibility of the title, text, link, grid, cards and images  
        on the 2nd, 3rd, 5th, 6th levels of nesting on the page","tests","2026-06-21","passed","2026-06-21","TestSpecialistsPage","specialists_page_test","",""
"","35","Verify presence and visibility of the Footer","tests","2026-06-21","passed","2026-06-21","TestFooter","footer_test","",""
"","1866","Verify if internal links in the Header for an unauthorized user 
            lead to correct pages after click","tests","2026-06-21","passed","2026-06-21","TestHeaderPage","header_test","",""
"","46","Verify content of text in the Footer","tests","2026-06-21","passed","2026-06-21","TestFooter","footer_test","",""
"","69","Verify sizes of images in links on the page","tests","2026-06-21","passed","2026-06-21","TestGroupsPage","groups_page_test","",""
"","39","Verify values of title and subtitles with tags h2, h3 on the page","tests","2026-06-21","passed","2026-06-21","TestContributorsPage","contributors_page_test","",""
"","165","Verify presence, visibility of lists on the page","tests","2026-06-21","passed","2026-06-21","TestExercisesRuSimilarPhrasesPage","exercises_ru_similar_phrases_page_test","",""
"","1229","Verify redirection to telegram page not authorized user.","tests","2026-06-21","passed","2026-06-21","TestDescriptionPage","description_page_test","",""
"","1214","Verify if links in the section 2 lead to the correct pages after clicking","tests","2026-06-21","passed","2026-06-21","TestContactsPage","contacts_page_test","",""
"","237","Verify switching of the 'ru', 'en' buttons in the Header on the Start Unauthorized Page","tests","2026-06-21","passed","2026-06-21","TestHeaderPage","header_test","",""
"","36","Verify amount and visibility of sections with content on the page","tests","2026-06-21","passed","2026-06-21","TestStartUnauthorizedPage","start_unauthorized_page_test","",""
"","23","Verify attribute 'alt' of images in links on the 'ru' local","tests","2026-06-21","passed","2026-06-21","TestGroupsPage","groups_page_test","",""
"","137","Verify presence, visibility of text, links, images in the Footer","tests","2026-06-21","passed","2026-06-21","TestFooter","footer_test","",""
"","33","Verify presence and visibility of content on the page","tests","2026-06-21","passed","2026-06-21","TestContactsPage","contacts_page_test","",""
"","1657","Verify if external links in the Header for an authorized user 
            lead to correct pages after click","tests","2026-06-21","passed","2026-06-21","TestHeaderPage","header_test","",""
"","1223","Verify redirection to donate page not authorized user.","tests","2026-06-21","passed","2026-06-21","TestDescriptionPage","description_page_test","",""
"","660","Verify that the 'All Specialists' link leads an unauthorized user 
                         to the correct page after clicking","tests","2026-06-21","passed","2026-06-21","TestSpecialistsPage","specialists_page_test","",""
