"Status","Start Time","Stop Time","Duration in ms","Parent Suite","Suite","Sub Suite","Test Class","Test Method","Name","Description"
"passed","Thu Jul 04 05:48:05 GMT 2024","Thu Jul 04 05:48:06 GMT 2024","1292","tests","header_test","TestHeaderPage","","","Verify if the 'About' and the 'Telegram' links in the Section 2 
                          lead to the correct pages after click",""
"passed","Thu Jul 04 05:46:57 GMT 2024","Thu Jul 04 05:46:57 GMT 2024","81","tests","footer_test","TestFooter","","","Verify changes of visible sizes of the EPAM link's image in Footer",""
"passed","Thu Jul 04 05:41:44 GMT 2024","Thu Jul 04 05:41:45 GMT 2024","904","tests","authorisation_page_test","TestAuthorizedUserPage","","","Checking the possibility of authorization with the correct data",""
"passed","Thu Jul 04 05:56:28 GMT 2024","Thu Jul 04 05:56:29 GMT 2024","862","tests","used_resources_page_test","TestUsedResourcesPage","","","Verify the composition and visibility of elements 
            on the 1st-4th levels of nesting on the page",""
"passed","Thu Jul 04 05:57:10 GMT 2024","Thu Jul 04 05:57:15 GMT 2024","5153","tests","used_resources_page_test","TestUsedResourcesPage","","","Verify that links in the sections lead to the correct pages after clicking",""
"passed","Thu Jul 04 05:43:41 GMT 2024","Thu Jul 04 05:43:41 GMT 2024","108","tests","description_page_test","TestDescriptionPage","","","Verify return main page from description page.",""
"passed","Thu Jul 04 05:43:28 GMT 2024","Thu Jul 04 05:43:28 GMT 2024","664","tests","contributors_page_test","TestContributorsPage","","","Verify href, status code, text of the 'All Team' link on the page",""
"passed","Thu Jul 04 05:56:22 GMT 2024","Thu Jul 04 05:56:22 GMT 2024","762","tests","used_resources_page_test","TestUsedResourcesPage","","","Verify presence and visibility of content on the page",""
"passed","Thu Jul 04 05:48:16 GMT 2024","Thu Jul 04 05:48:16 GMT 2024","3","tests","login_page_test","TestLoginPage","","","Test for authorization customer.",""
"passed","Thu Jul 04 05:45:07 GMT 2024","Thu Jul 04 05:45:08 GMT 2024","710","tests","footer_test","TestFooter","","","Verify presence, visibility, clickability, href, status code of the REG.RU link in Footer",""
"passed","Thu Jul 04 05:54:35 GMT 2024","Thu Jul 04 05:55:24 GMT 2024","49129","tests","Речевые упражнения.","TestCardsRU","","","Solutions to a random task in the ""Слова"" .",""
"passed","Thu Jul 04 05:42:04 GMT 2024","Thu Jul 04 05:42:04 GMT 2024","22","tests","contacts_page_test","TestContactsPage","","","Verify the composition and visibility of elements on the 1st level of nesting in the section 1",""
"passed","Thu Jul 04 05:51:27 GMT 2024","Thu Jul 04 05:51:27 GMT 2024","89","tests","specialists_page_test","TestSpecialistsPage","","","Verify presence, visibility and accuracy of the 1th card's image in the grid",""
"passed","Thu Jul 04 05:43:45 GMT 2024","Thu Jul 04 05:43:46 GMT 2024","1163","tests","description_page_test","TestDescriptionPage","","","Verify redirection to telegram page not authorized user.",""
"passed","Thu Jul 04 05:52:47 GMT 2024","Thu Jul 04 05:52:55 GMT 2024","8202","tests","Speech exercises EN.","TestCardsEN","","","Select a random card from ""Similar phrases"" group and compare UI vs BACKEND data",""
"passed","Thu Jul 04 05:44:07 GMT 2024","Thu Jul 04 05:44:08 GMT 2024","634","tests","description_page_test","TestDescriptionPage","","","Verify redirection to contributors page not authorized user.",""
"passed","Thu Jul 04 05:46:43 GMT 2024","Thu Jul 04 05:46:43 GMT 2024","45","tests","footer_test","TestFooter","","","Verify visible sizes of the ARASAAC link's image in Footer",""
"passed","Thu Jul 04 05:49:22 GMT 2024","Thu Jul 04 05:49:24 GMT 2024","1151","tests","registration_page_test","TestRegistrationPage","","","Check registration with an existing email",""
"passed","Thu Jul 04 05:50:37 GMT 2024","Thu Jul 04 05:50:37 GMT 2024","34","tests","specialists_page_test","TestSpecialistsPage","","","Verify value of title with tag 'h2' on the page",""
"passed","Thu Jul 04 05:53:01 GMT 2024","Thu Jul 04 05:53:12 GMT 2024","11837","tests","Речевые упражнения.","TestCardsRU","","","Select random card from group ""Слова"" and compare UI vs BACKEND data.",""
"passed","Thu Jul 04 05:47:45 GMT 2024","Thu Jul 04 05:47:45 GMT 2024","620","tests","header_test","TestHeaderPage","","","Verify presence, visibility, clickability, href, status code  
                             of the 'Logo' link in the section 1 in the Header",""
"passed","Thu Jul 04 05:43:15 GMT 2024","Thu Jul 04 05:43:15 GMT 2024","399","tests","contributors_page_test","TestContributorsPage","","","Verify values of the text in card descriptions",""
"passed","Thu Jul 04 05:45:52 GMT 2024","Thu Jul 04 05:46:23 GMT 2024","30232","tests","footer_test","TestFooter","","","Verify that the REG.RU link in Footer leads to the correct page after click",""
"passed","Thu Jul 04 05:47:30 GMT 2024","Thu Jul 04 05:47:30 GMT 2024","79","tests","footer_test","TestFooter","","","Verify changes of visible sizes of the Selectel link's image in Footer",""
"passed","Thu Jul 04 05:49:48 GMT 2024","Thu Jul 04 05:49:48 GMT 2024","593","tests","registration_page_test","TestRegistrationPage","","","Check registration without choosing gender",""
"passed","Thu Jul 04 05:57:21 GMT 2024","Thu Jul 04 05:57:22 GMT 2024","788","tests","used_resources_page_test","TestUsedResourcesPage","","","Verify presence, visibility and attributes of icons in the sections",""
"passed","Thu Jul 04 05:45:22 GMT 2024","Thu Jul 04 05:45:26 GMT 2024","3981","tests","footer_test","TestFooter","","","Verify Footer invisibility through the modal window with the exercise",""
"passed","Thu Jul 04 05:47:01 GMT 2024","Thu Jul 04 05:47:01 GMT 2024","68","tests","footer_test","TestFooter","","","Verify presence, visibility and accuracy of the JETBRAINS link's image in Footer",""
"passed","Thu Jul 04 05:47:34 GMT 2024","Thu Jul 04 05:47:34 GMT 2024","31","tests","header_test","TestHeaderPage","","","Verify presence and visibility of content in the Header",""
"passed","Thu Jul 04 05:43:11 GMT 2024","Thu Jul 04 05:43:11 GMT 2024","18","tests","contributors_page_test","TestContributorsPage","","","Verify values of the text in the slogan on the page",""
"passed","Thu Jul 04 05:51:42 GMT 2024","Thu Jul 04 05:51:42 GMT 2024","110","tests","start_unauthorized_page_test","TestStartUnauthorizedPage","","","Verify the composition and visibility of elements 
        on the 1st-3rd levels of nesting in the section 2",""
"passed","Thu Jul 04 05:42:22 GMT 2024","Thu Jul 04 05:42:22 GMT 2024","22","tests","contacts_page_test","TestContactsPage","","","Verify values of subtitles with tag 'h2' on the page",""
"passed","Thu Jul 04 05:47:26 GMT 2024","Thu Jul 04 05:47:26 GMT 2024","44","tests","footer_test","TestFooter","","","Verify visible sizes of the Selectel link's image in Footer",""
"passed","Thu Jul 04 05:43:50 GMT 2024","Thu Jul 04 05:43:51 GMT 2024","1112","tests","description_page_test","TestDescriptionPage","","","Verify redirection to donate page not authorized user.",""
"passed","Thu Jul 04 05:48:01 GMT 2024","Thu Jul 04 05:48:02 GMT 2024","938","tests","header_test","TestHeaderPage","","","Verify presence, visibility, clickability, href, status code of the 'About' and the 'Telegram' links in the Section 2 in the Header",""
"passed","Thu Jul 04 05:44:34 GMT 2024","Thu Jul 04 05:44:37 GMT 2024","2763","tests","footer_test","TestFooter","","","Verify presence and visibility of Footer on each page specified in the kit",""
"passed","Thu Jul 04 05:47:23 GMT 2024","Thu Jul 04 05:47:23 GMT 2024","65","tests","footer_test","TestFooter","","","Verify presence, visibility and accuracy of the Selectel link's image in Footer",""
"passed","Thu Jul 04 05:50:51 GMT 2024","Thu Jul 04 05:50:51 GMT 2024","46","tests","specialists_page_test","TestSpecialistsPage","","","Verify text in the 'All Specialists' link",""
"skipped","Thu Jul 04 05:56:01 GMT 2024","Thu Jul 04 05:56:07 GMT 2024","6528","tests","Речевые упражнения.","TestCardsRU","","","Solutions to a random task in the ""Слова"" group and comparison of statics.",""
"passed","Thu Jul 04 05:56:41 GMT 2024","Thu Jul 04 05:56:42 GMT 2024","764","tests","used_resources_page_test","TestUsedResourcesPage","","","Verify value of title with tag 'h1' on the page",""
"passed","Thu Jul 04 05:48:10 GMT 2024","Thu Jul 04 05:48:10 GMT 2024","23","tests","header_test","TestHeaderPage","","","Verify values of the text in the 'About' and the 'Telegram' links 
                          in the Section 2 in the Header",""
"passed","Thu Jul 04 05:46:46 GMT 2024","Thu Jul 04 05:46:46 GMT 2024","81","tests","footer_test","TestFooter","","","Verify changes of visible sizes of the ARASAAC link's image in Footer",""
"passed","Thu Jul 04 05:46:50 GMT 2024","Thu Jul 04 05:46:50 GMT 2024","67","tests","footer_test","TestFooter","","","Verify presence, visibility and accuracy of the EPAM link's image in Footer",""
"passed","Thu Jul 04 05:44:02 GMT 2024","Thu Jul 04 05:44:04 GMT 2024","1426","tests","description_page_test","TestDescriptionPage","","","Verify redirection to github not authorized user.",""
"passed","Thu Jul 04 05:48:32 GMT 2024","Thu Jul 04 05:48:32 GMT 2024","143","tests","main_page_test","TestMainPage","","","Verify redirection to contacts page not authorized user.",""
"passed","Thu Jul 04 05:43:58 GMT 2024","Thu Jul 04 05:43:59 GMT 2024","636","tests","description_page_test","TestDescriptionPage","","","Verify redirection to specialists page not authorized user.",""
"passed","Thu Jul 04 05:42:36 GMT 2024","Thu Jul 04 05:42:37 GMT 2024","750","tests","contacts_page_test","TestContactsPage","","","Verify presence, visibility, clickability, href, prefix, status code 
        of links in sections 1, 2 on the page",""
"passed","Thu Jul 04 05:50:32 GMT 2024","Thu Jul 04 05:50:32 GMT 2024","11","tests","specialists_page_test","TestSpecialistsPage","","","Verify value of the title of the tab",""
"passed","Thu Jul 04 05:53:49 GMT 2024","Thu Jul 04 05:53:58 GMT 2024","9345","tests","Речевые упражнения.","TestCardsRU","","","Select a random card from ""Группа слов"" group and compare UI vs BACKEND data.",""
"passed","Thu Jul 04 05:47:54 GMT 2024","Thu Jul 04 05:47:54 GMT 2024","90","tests","header_test","TestHeaderPage","","","Verify that the 'Logo' link on the 'Contacts' page leads an unauthorized user 
                             to the Start Unauthorized Page after clicking",""
"passed","Thu Jul 04 05:48:23 GMT 2024","Thu Jul 04 05:48:24 GMT 2024","1184","tests","main_page_test","TestMainPage","","","Verify redirection to telegram page not authorized user.",""
"passed","Thu Jul 04 05:49:52 GMT 2024","Thu Jul 04 05:50:13 GMT 2024","20689","tests","registration_page_test","TestRegistrationPage","","","Check registration without choosing agreement",""
"passed","Thu Jul 04 05:46:54 GMT 2024","Thu Jul 04 05:46:54 GMT 2024","46","tests","footer_test","TestFooter","","","Verify visible sizes of the EPAM link's image in Footer",""
"passed","Thu Jul 04 05:45:03 GMT 2024","Thu Jul 04 05:45:03 GMT 2024","167","tests","footer_test","TestFooter","","","Verify presence, visibility, clickability, href, status code of the JETBRAINS link in Footer",""
"passed","Thu Jul 04 05:49:00 GMT 2024","Thu Jul 04 05:49:11 GMT 2024","11194","tests","profile_page_test","TestProfilePage","","","Change the password by receiving an email link",""
"passed","Thu Jul 04 05:43:00 GMT 2024","Thu Jul 04 05:43:00 GMT 2024","37","tests","contributors_page_test","TestContributorsPage","","","Verify amount of contributor cards with images, links and descriptions in the section grid",""
"passed","Thu Jul 04 05:47:12 GMT 2024","Thu Jul 04 05:47:12 GMT 2024","67","tests","footer_test","TestFooter","","","Verify presence, visibility and accuracy of the REG.RU link's image in Footer",""
"passed","Thu Jul 04 05:42:27 GMT 2024","Thu Jul 04 05:42:27 GMT 2024","28","tests","contacts_page_test","TestContactsPage","","","Verify values of the text in sections 1, 2 on the page",""
"passed","Thu Jul 04 05:50:46 GMT 2024","Thu Jul 04 05:50:46 GMT 2024","110","tests","specialists_page_test","TestSpecialistsPage","","","Verify values of names and professions in specialist cards in the grid",""
"passed","Thu Jul 04 05:50:55 GMT 2024","Thu Jul 04 05:50:56 GMT 2024","745","tests","specialists_page_test","TestSpecialistsPage","","","Verify clickability, href, status code of the 'All Specialists' link",""
"passed","Thu Jul 04 05:47:19 GMT 2024","Thu Jul 04 05:47:19 GMT 2024","82","tests","footer_test","TestFooter","","","Verify changes of visible sizes of the REG.RU link's image in Footer",""
"passed","Thu Jul 04 05:50:22 GMT 2024","Thu Jul 04 05:50:22 GMT 2024","332","tests","specialists_page_test","TestSpecialistsPage","","","Verify the composition and visibility of elements 
        on the 1st-6th levels of nesting on the page",""
"passed","Thu Jul 04 05:43:36 GMT 2024","Thu Jul 04 05:43:37 GMT 2024","1447","tests","contributors_page_test","TestContributorsPage","","","Verify attribute values and sizes of images in contributors cards in the grid",""
"passed","Thu Jul 04 05:50:27 GMT 2024","Thu Jul 04 05:50:27 GMT 2024","348","tests","specialists_page_test","TestSpecialistsPage","","","Verify presence, visibility of the title, text, link, grid, cards and images  
        on the 2nd, 3rd, 5th, 6th levels of nesting on the page",""
"passed","Thu Jul 04 05:49:27 GMT 2024","Thu Jul 04 05:49:28 GMT 2024","614","tests","registration_page_test","TestRegistrationPage","","","Check registration with new email and empty confirm password",""
"passed","Thu Jul 04 05:43:08 GMT 2024","Thu Jul 04 05:43:08 GMT 2024","28","tests","contributors_page_test","TestContributorsPage","","","Verify values of subtitles with tag 'h3' on the page",""
"passed","Thu Jul 04 05:57:01 GMT 2024","Thu Jul 04 05:57:04 GMT 2024","2710","tests","used_resources_page_test","TestUsedResourcesPage","","","Verify presence, visibility, clickability, href, status code of links in the sections",""
"passed","Thu Jul 04 05:45:29 GMT 2024","Thu Jul 04 05:45:31 GMT 2024","2139","tests","footer_test","TestFooter","","","Verify that the ARASAAC link in Footer leads to the correct page after click",""
"passed","Thu Jul 04 05:54:04 GMT 2024","Thu Jul 04 05:54:13 GMT 2024","9443","tests","Речевые упражнения.","TestCardsRU","","","Select a random card from ""Предложения"" group and compare UI vs BACKEND data.",""
"passed","Thu Jul 04 05:42:50 GMT 2024","Thu Jul 04 05:42:50 GMT 2024","21","tests","contributors_page_test","TestContributorsPage","","","Verify amount and visibility of sections with content on the page",""
"passed","Thu Jul 04 05:56:13 GMT 2024","Thu Jul 04 05:56:15 GMT 2024","1336","tests","Statistic.","TestCardsRU","","","Check statistic table.",""
"passed","Thu Jul 04 05:55:31 GMT 2024","Thu Jul 04 05:55:55 GMT 2024","23956","tests","Речевые упражнения.","TestCardsRU","","","Solutions to a random task in the ""Слова Королёвой"" .",""
"passed","Thu Jul 04 05:49:31 GMT 2024","Thu Jul 04 05:49:32 GMT 2024","627","tests","registration_page_test","TestRegistrationPage","","","Check registration with new email and empty password",""
"passed","Thu Jul 04 05:44:23 GMT 2024","Thu Jul 04 05:44:26 GMT 2024","2419","tests","footer_test","TestFooter","","","Verify presence and visibility of Footer on each page specified in the kit",""
"passed","Thu Jul 04 05:44:55 GMT 2024","Thu Jul 04 05:44:56 GMT 2024","667","tests","footer_test","TestFooter","","","Verify presence, visibility, clickability, href, status code of the ARASAAC link in Footer",""
"passed","Thu Jul 04 05:42:42 GMT 2024","Thu Jul 04 05:42:43 GMT 2024","1238","tests","contacts_page_test","TestContactsPage","","","Verify that links in sections 1, 2 lead to the correct pages after click",""
"passed","Thu Jul 04 05:46:35 GMT 2024","Thu Jul 04 05:46:35 GMT 2024","81","tests","footer_test","TestFooter","","","Verify that the Contact us link in Footer calls an email client",""
"passed","Thu Jul 04 05:47:16 GMT 2024","Thu Jul 04 05:47:16 GMT 2024","46","tests","footer_test","TestFooter","","","Verify visible sizes of the REG.RU link's image in Footer",""
"passed","Thu Jul 04 05:44:38 GMT 2024","Thu Jul 04 05:44:40 GMT 2024","2586","tests","footer_test","TestFooter","","","Verify presence and visibility of Footer on each page specified in the kit",""
"passed","Thu Jul 04 05:48:40 GMT 2024","Thu Jul 04 05:48:41 GMT 2024","1418","tests","main_page_test","TestMainPage","","","Verify redirection to github not authorized user.",""
"passed","Thu Jul 04 05:45:11 GMT 2024","Thu Jul 04 05:45:12 GMT 2024","751","tests","footer_test","TestFooter","","","Verify presence, visibility, clickability, href, status code of the Selectel link in Footer",""
"passed","Thu Jul 04 05:44:59 GMT 2024","Thu Jul 04 05:44:59 GMT 2024","164","tests","footer_test","TestFooter","","","Verify presence, visibility, clickability, href, status code of the EPAM link in Footer",""
"passed","Thu Jul 04 05:54:19 GMT 2024","Thu Jul 04 05:54:29 GMT 2024","10017","tests","Речевые упражнения.","TestCardsRU","","","Select a random card from ""Слова с частотной группировкой"" group and compare UI vs BACKEND data.",""
"passed","Thu Jul 04 05:49:35 GMT 2024","Thu Jul 04 05:49:36 GMT 2024","612","tests","registration_page_test","TestRegistrationPage","","","Check registration with new email and empty first name",""
"passed","Thu Jul 04 05:57:28 GMT 2024","Thu Jul 04 05:57:28 GMT 2024","798","tests","used_resources_page_test","TestUsedResourcesPage","","","Verify sizes of icons in the sections",""
"passed","Thu Jul 04 05:47:41 GMT 2024","Thu Jul 04 05:47:41 GMT 2024","40","tests","header_test","TestHeaderPage","","","Verify the section with the 'ru' and 'en' buttons in the Header",""
"passed","Thu Jul 04 05:46:26 GMT 2024","Thu Jul 04 05:46:31 GMT 2024","5462","tests","footer_test","TestFooter","","","Verify that the SELECTEL link in Footer leads to the correct page after click",""
"passed","Thu Jul 04 05:42:54 GMT 2024","Thu Jul 04 05:42:57 GMT 2024","2828","tests","contributors_page_test","TestContributorsPage","","","Verify the composition and visibility of elements on the 1st, 2nd, 3rd, 4th levels of nesting in the section",""
"passed","Thu Jul 04 05:48:45 GMT 2024","Thu Jul 04 05:48:46 GMT 2024","640","tests","main_page_test","TestMainPage","","","Verify redirection to contributors page not authorized user.",""
"passed","Thu Jul 04 05:51:53 GMT 2024","Thu Jul 04 05:51:53 GMT 2024","64","tests","start_unauthorized_page_test","TestStartUnauthorizedPage","","","Verify content of the text in the sections 1, 2",""
"passed","Thu Jul 04 05:46:39 GMT 2024","Thu Jul 04 05:46:39 GMT 2024","69","tests","footer_test","TestFooter","","","Verify presence, visibility and accuracy of the ARASAAC link's image in Footer",""
"passed","Thu Jul 04 05:45:44 GMT 2024","Thu Jul 04 05:45:49 GMT 2024","5124","tests","footer_test","TestFooter","","","Verify that the JETBRAINS link in Footer leads to the correct page after click",""
"passed","Thu Jul 04 05:53:33 GMT 2024","Thu Jul 04 05:53:43 GMT 2024","10292","tests","Речевые упражнения.","TestCardsRU","","","Select a random card from ""Похожие фразы"" group and compare UI vs BACKEND data.",""
"passed","Thu Jul 04 05:42:13 GMT 2024","Thu Jul 04 05:42:13 GMT 2024","27","tests","contacts_page_test","TestContactsPage","","","Verify presence and visibility of the dividing line on the page",""
"passed","Thu Jul 04 05:51:38 GMT 2024","Thu Jul 04 05:51:38 GMT 2024","82","tests","start_unauthorized_page_test","TestStartUnauthorizedPage","","","Verify the composition and visibility of elements 
        on the 1st-3rd levels of nesting in the section 1",""
"passed","Thu Jul 04 05:47:05 GMT 2024","Thu Jul 04 05:47:05 GMT 2024","45","tests","footer_test","TestFooter","","","Verify visible sizes of the JETBRAINS link's image in Footer",""
"passed","Thu Jul 04 05:51:31 GMT 2024","Thu Jul 04 05:51:31 GMT 2024","31","tests","start_unauthorized_page_test","TestStartUnauthorizedPage","","","Verify presence and visibility of content on the page",""
"passed","Thu Jul 04 05:44:12 GMT 2024","Thu Jul 04 05:44:15 GMT 2024","2725","tests","footer_test","TestFooter","","","Verify presence and visibility of Footer on each page specified in the kit",""
"passed","Thu Jul 04 05:51:35 GMT 2024","Thu Jul 04 05:51:35 GMT 2024","30","tests","start_unauthorized_page_test","TestStartUnauthorizedPage","","","Verify amount and visibility of sections with content on the page",""
"passed","Thu Jul 04 05:49:39 GMT 2024","Thu Jul 04 05:49:40 GMT 2024","618","tests","registration_page_test","TestRegistrationPage","","","Check registration with new email and empty birthday",""
"passed","Thu Jul 04 05:45:35 GMT 2024","Thu Jul 04 05:45:40 GMT 2024","5266","tests","footer_test","TestFooter","","","Verify that the EPAM link in Footer leads to the correct page after click",""
"passed","Thu Jul 04 05:48:49 GMT 2024","Thu Jul 04 05:48:49 GMT 2024","143","tests","main_page_test","TestMainPage","","","Verify redirection to used resources page not authorized user.",""
"passed","Thu Jul 04 05:43:23 GMT 2024","Thu Jul 04 05:43:24 GMT 2024","1077","tests","contributors_page_test","TestContributorsPage","","","Verify presence, visibility, clickability, href of links in the section",""
"passed","Thu Jul 04 05:56:48 GMT 2024","Thu Jul 04 05:56:48 GMT 2024","786","tests","used_resources_page_test","TestUsedResourcesPage","","","Verify content of the text on the page",""
"passed","Thu Jul 04 05:44:49 GMT 2024","Thu Jul 04 05:44:51 GMT 2024","2636","tests","footer_test","TestFooter","","","Verify accuracy of texts in Footer on each page specified in the kit",""
"passed","Thu Jul 04 05:43:04 GMT 2024","Thu Jul 04 05:43:04 GMT 2024","35","tests","contributors_page_test","TestContributorsPage","","","Verify value of title with tag 'h2' on the page",""
"passed","Thu Jul 04 05:49:44 GMT 2024","Thu Jul 04 05:49:44 GMT 2024","621","tests","registration_page_test","TestRegistrationPage","","","Check registration with new email and empty email",""
"passed","Thu Jul 04 05:52:18 GMT 2024","Thu Jul 04 05:52:27 GMT 2024","8751","tests","Speech exercises EN.","TestCardsEN","","","Select random card from ""Word"" group and compare UI vs BACKEND data",""
"passed","Thu Jul 04 05:53:18 GMT 2024","Thu Jul 04 05:53:27 GMT 2024","8421","tests","Речевые упражнения.","TestCardsRU","","","Select random card from group ""Слова Королёвой"" and compare UI vs BACKEND data.",""
"passed","Thu Jul 04 05:51:57 GMT 2024","Thu Jul 04 05:51:57 GMT 2024","36","tests","start_unauthorized_page_test","TestStartUnauthorizedPage","","","Verify text in the 'Login' link in the section 1",""
"passed","Thu Jul 04 05:48:56 GMT 2024","Thu Jul 04 05:48:56 GMT 2024","102","tests","main_page_test","TestMainPage","","","Checking the clickability of the Registration button.",""
"passed","Thu Jul 04 05:47:08 GMT 2024","Thu Jul 04 05:47:08 GMT 2024","81","tests","footer_test","TestFooter","","","Verify changes of visible sizes of the JETBRAINS link's image in Footer",""
"passed","Thu Jul 04 05:48:36 GMT 2024","Thu Jul 04 05:48:36 GMT 2024","639","tests","main_page_test","TestMainPage","","","Verify redirection to specialists page not authorized user.",""
"passed","Thu Jul 04 05:42:32 GMT 2024","Thu Jul 04 05:42:32 GMT 2024","28","tests","contacts_page_test","TestContactsPage","","","Verify values of the text in links in sections 1, 2 on the page",""
"passed","Thu Jul 04 05:56:54 GMT 2024","Thu Jul 04 05:56:55 GMT 2024","756","tests","used_resources_page_test","TestUsedResourcesPage","","","Verify values of the text in links in the sections",""
"passed","Thu Jul 04 05:43:55 GMT 2024","Thu Jul 04 05:43:55 GMT 2024","138","tests","description_page_test","TestDescriptionPage","","","Verify redirection to contacts page not authorized user.",""
"passed","Thu Jul 04 05:51:12 GMT 2024","Thu Jul 04 05:51:18 GMT 2024","5881","tests","specialists_page_test","TestSpecialistsPage","","","Verify that the 'All Specialists' link leads an authorized user 
                         to the correct page after clicking",""
"passed","Thu Jul 04 05:48:19 GMT 2024","Thu Jul 04 05:48:19 GMT 2024","110","tests","main_page_test","TestMainPage","","","Verify redirection to description page not authorized user.",""
"passed","Thu Jul 04 05:42:08 GMT 2024","Thu Jul 04 05:42:09 GMT 2024","130","tests","contacts_page_test","TestContactsPage","","","Verify the composition and visibility of elements 
        on the 1st, 2nd, 3rd, 4th, 5th levels of nesting in the section 2",""
"passed","Thu Jul 04 05:48:27 GMT 2024","Thu Jul 04 05:48:28 GMT 2024","990","tests","main_page_test","TestMainPage","","","Verify redirection to donate page not authorized user.",""
"passed","Thu Jul 04 05:44:45 GMT 2024","Thu Jul 04 05:44:48 GMT 2024","2718","tests","footer_test","TestFooter","","","Verify accuracy of texts in Footer on each page specified in the kit",""
"passed","Thu Jul 04 05:42:18 GMT 2024","Thu Jul 04 05:42:18 GMT 2024","31","tests","contacts_page_test","TestContactsPage","","","Verify value of title with tag 'h1' on the page",""
"passed","Thu Jul 04 05:44:11 GMT 2024","Thu Jul 04 05:44:11 GMT 2024","137","tests","description_page_test","TestDescriptionPage","","","Verify redirection to used resources page not authorized user.",""
"passed","Thu Jul 04 05:42:47 GMT 2024","Thu Jul 04 05:42:47 GMT 2024","73","tests","contributors_page_test","TestContributorsPage","","","Verify presence, visibility and structure of content on the page",""
