"Status","Start Time","Stop Time","Duration in ms","Parent Suite","Suite","Sub Suite","Test Class","Test Method","Name","Description"
"passed","Thu Jul 04 05:45:16 GMT 2024","Thu Jul 04 05:45:16 GMT 2024","78","tests","footer_test","TestFooter","","","Verify presence, visibility and accuracy of the Contact us link in Footer",""
"passed","Thu Jul 04 05:51:01 GMT 2024","Thu Jul 04 05:51:06 GMT 2024","5234","tests","specialists_page_test","TestSpecialistsPage","","","Verify that the 'All Specialists' link leads an unauthorized user 
                         to the correct page after clicking",""
"passed","Thu Jul 04 05:51:49 GMT 2024","Thu Jul 04 05:51:49 GMT 2024","45","tests","start_unauthorized_page_test","TestStartUnauthorizedPage","","","Verify values of titles and subtitles with tags h2, h4",""
"passed","Thu Jul 04 05:51:22 GMT 2024","Thu Jul 04 05:51:22 GMT 2024","212","tests","specialists_page_test","TestSpecialistsPage","","","Verify attribute values and sizes of images in specialist cards in the grid",""
"passed","Thu Jul 04 05:52:00 GMT 2024","Thu Jul 04 05:52:01 GMT 2024","630","tests","start_unauthorized_page_test","TestStartUnauthorizedPage","","","Verify presence, visibility, clickability, href, status code 
                         of the 'Login' link in the section 1",""
"passed","Thu Jul 04 05:43:19 GMT 2024","Thu Jul 04 05:43:19 GMT 2024","395","tests","contributors_page_test","TestContributorsPage","","","Verify text in links in card links",""
"passed","Thu Jul 04 05:52:12 GMT 2024","Thu Jul 04 05:52:12 GMT 2024","54","tests","start_unauthorized_page_test","TestStartUnauthorizedPage","","","Verify size of the image in the section 1",""
"passed","Thu Jul 04 05:48:53 GMT 2024","Thu Jul 04 05:48:53 GMT 2024","81","tests","main_page_test","TestMainPage","","","Checking the clickability of the Start button.",""
"passed","Thu Jul 04 05:44:27 GMT 2024","Thu Jul 04 05:44:29 GMT 2024","2603","tests","footer_test","TestFooter","","","Verify presence and visibility of Footer on each page specified in the kit",""
"passed","Thu Jul 04 05:47:49 GMT 2024","Thu Jul 04 05:47:49 GMT 2024","99","tests","header_test","TestHeaderPage","","","Verify that the 'Logo' link on the Start Unauthorized Page 
                             doesn't refresh the current page or lead to other pages after clicking",""
"passed","Thu Jul 04 05:44:30 GMT 2024","Thu Jul 04 05:44:33 GMT 2024","2699","tests","footer_test","TestFooter","","","Verify presence and visibility of Footer on each page specified in the kit",""
"passed","Thu Jul 04 05:50:41 GMT 2024","Thu Jul 04 05:50:42 GMT 2024","36","tests","specialists_page_test","TestSpecialistsPage","","","Verify value of text on the page",""
"passed","Thu Jul 04 05:43:32 GMT 2024","Thu Jul 04 05:43:32 GMT 2024","412","tests","contributors_page_test","TestContributorsPage","","","Verify presence and visibility of images in contributors cards in the grid",""
"passed","Thu Jul 04 05:52:32 GMT 2024","Thu Jul 04 05:52:41 GMT 2024","8139","tests","Speech exercises EN.","TestCardsEN","","","Check progres-bar and buttons.",""
"passed","Thu Jul 04 05:41:49 GMT 2024","Thu Jul 04 05:41:50 GMT 2024","850","tests","authorisation_page_test","TestAuthorizedUserPage","","","Checking the possibility of authorization with incorrect data",""
"passed","Thu Jul 04 05:52:08 GMT 2024","Thu Jul 04 05:52:08 GMT 2024","77","tests","start_unauthorized_page_test","TestStartUnauthorizedPage","","","Verify presence, visibility and attributes of the image in the section 1",""
"passed","Thu Jul 04 05:47:37 GMT 2024","Thu Jul 04 05:47:37 GMT 2024","279","tests","header_test","TestHeaderPage","","","Verify the composition and visibility of elements on the 1-6th levels of the Header",""
"passed","Thu Jul 04 05:41:59 GMT 2024","Thu Jul 04 05:41:59 GMT 2024","19","tests","contacts_page_test","TestContactsPage","","","Verify amount and visibility of sections with content on the page",""
"passed","Thu Jul 04 05:50:17 GMT 2024","Thu Jul 04 05:50:17 GMT 2024","31","tests","specialists_page_test","TestSpecialistsPage","","","Verify presence and visibility of content on the page",""
"passed","Thu Jul 04 05:56:35 GMT 2024","Thu Jul 04 05:56:35 GMT 2024","236","tests","used_resources_page_test","TestUsedResourcesPage","","","Verify value of the title of the tab",""
"passed","Thu Jul 04 05:44:16 GMT 2024","Thu Jul 04 05:44:19 GMT 2024","2741","tests","footer_test","TestFooter","","","Verify presence and visibility of Footer on each page specified in the kit",""
"passed","Thu Jul 04 05:41:55 GMT 2024","Thu Jul 04 05:41:55 GMT 2024","53","tests","contacts_page_test","TestContactsPage","","","Verify presence, visibility and structure of content on the page",""
"passed","Thu Jul 04 05:49:15 GMT 2024","Thu Jul 04 05:49:19 GMT 2024","4168","tests","registration_page_test","TestRegistrationPage","","","Check registration with new email",""
"passed","Thu Jul 04 05:44:20 GMT 2024","Thu Jul 04 05:44:22 GMT 2024","2658","tests","footer_test","TestFooter","","","Verify presence and visibility of Footer on each page specified in the kit",""
"passed","Thu Jul 04 05:51:45 GMT 2024","Thu Jul 04 05:51:45 GMT 2024","11","tests","start_unauthorized_page_test","TestStartUnauthorizedPage","","","Verify value of the title of the tab",""
"passed","Thu Jul 04 05:52:05 GMT 2024","Thu Jul 04 05:52:05 GMT 2024","120","tests","start_unauthorized_page_test","TestStartUnauthorizedPage","","","Verify that the 'Login' link leads to the correct page after clicking",""
"passed","Thu Jul 04 05:47:57 GMT 2024","Thu Jul 04 05:47:57 GMT 2024","92","tests","header_test","TestHeaderPage","","","Verify presence, visibility, attributes and sizes of the 'Logo' image",""
"passed","Thu Jul 04 05:44:41 GMT 2024","Thu Jul 04 05:44:44 GMT 2024","2788","tests","footer_test","TestFooter","","","Verify presence and visibility of Footer on each page specified in the kit",""
