"Status","Start Time","Stop Time","Duration in ms","Parent Suite","Suite","Sub Suite","Test Class","Test Method","Name","Description"
"passed","Tue Jul 30 06:56:08 GMT 2024","Tue Jul 30 06:56:44 GMT 2024","35811","tests","Речевые упражнения.","TestCardsRU","","","Solutions to a random task in the ""Слова"" .",""
"passed","Tue Jul 30 06:43:46 GMT 2024","Tue Jul 30 06:43:46 GMT 2024","17","tests","contributors_page_test","TestContributorsPage","","","Verify content of the text on the page",""
"passed","Tue Jul 30 06:45:39 GMT 2024","Tue Jul 30 06:45:41 GMT 2024","1472","tests","footer_test","TestFooter","","","Verify clickability, href, status code of the Selectel link in Footer",""
"passed","Tue Jul 30 06:52:55 GMT 2024","Tue Jul 30 06:52:55 GMT 2024","11","tests","start_unauthorized_page_test","TestStartUnauthorizedPage","","","Verify value of the title of the tab",""
"passed","Tue Jul 30 06:42:39 GMT 2024","Tue Jul 30 06:42:40 GMT 2024","137","tests","contacts_page_test","TestContactsPage","","","Verify the composition and visibility of elements 
        on the 1st-5th levels of nesting in the section 2",""
"passed","Tue Jul 30 06:49:28 GMT 2024","Tue Jul 30 06:49:29 GMT 2024","639","tests","main_page_test","TestMainPage","","","Verify redirection to specialists page not authorized user.",""
"passed","Tue Jul 30 06:49:56 GMT 2024","Tue Jul 30 06:50:08 GMT 2024","11872","tests","profile_page_test","TestProfilePage","","","Change the password by receiving an email link",""
"passed","Tue Jul 30 06:48:34 GMT 2024","Tue Jul 30 06:48:35 GMT 2024","98","tests","header_test","TestHeaderPage","","","Verify that the 'Logo' link on the Start Unauthorized Page 
                             doesn't refresh the current page or lead to other pages after clicking",""
"passed","Tue Jul 30 06:44:00 GMT 2024","Tue Jul 30 06:44:01 GMT 2024","701","tests","contributors_page_test","TestContributorsPage","","","Verify clickability, href of links on the page",""
"passed","Tue Jul 30 06:49:14 GMT 2024","Tue Jul 30 06:49:15 GMT 2024","1221","tests","main_page_test","TestMainPage","","","Verify redirection to telegram page not authorized user.",""
"passed","Tue Jul 30 06:52:14 GMT 2024","Tue Jul 30 06:52:15 GMT 2024","606","tests","specialists_page_test","TestSpecialistsPage","","","Verify that the 'All Specialists' link leads an unauthorized user 
                         to the correct page after clicking",""
"passed","Tue Jul 30 06:45:30 GMT 2024","Tue Jul 30 06:45:31 GMT 2024","119","tests","footer_test","TestFooter","","","Verify clickability, href, status code of the JETBRAINS link in Footer",""
"passed","Tue Jul 30 06:48:21 GMT 2024","Tue Jul 30 06:48:21 GMT 2024","282","tests","header_test","TestHeaderPage","","","Verify the composition and visibility of elements on the 1-6th levels of the Header",""
"passed","Tue Jul 30 06:58:26 GMT 2024","Tue Jul 30 06:58:29 GMT 2024","2431","tests","used_resources_page_test","TestUsedResourcesPage","","","Verify presence, visibility, clickability, href, status code of links in the sections",""
"passed","Tue Jul 30 06:47:01 GMT 2024","Tue Jul 30 06:47:08 GMT 2024","6675","tests","footer_test","TestFooter","","","Verify that the SELECTEL link in Footer leads to the correct page after click",""
"passed","Tue Jul 30 06:44:44 GMT 2024","Tue Jul 30 06:44:45 GMT 2024","1417","tests","description_page_test","TestDescriptionPage","","","Verify redirection to github not authorized user.",""
"passed","Tue Jul 30 06:44:39 GMT 2024","Tue Jul 30 06:44:40 GMT 2024","635","tests","description_page_test","TestDescriptionPage","","","Verify redirection to specialists page not authorized user.",""
"passed","Tue Jul 30 06:49:09 GMT 2024","Tue Jul 30 06:49:10 GMT 2024","111","tests","main_page_test","TestMainPage","","","Verify redirection to description page not authorized user.",""
"passed","Tue Jul 30 06:58:35 GMT 2024","Tue Jul 30 06:58:37 GMT 2024","1752","tests","used_resources_page_test","TestUsedResourcesPage","","","Verify that links in the sections lead to the correct pages after clicking",""
"passed","Tue Jul 30 06:42:50 GMT 2024","Tue Jul 30 06:42:50 GMT 2024","11","tests","contacts_page_test","TestContactsPage","","","Verify value of the title of the tab",""
"passed","Tue Jul 30 06:53:04 GMT 2024","Tue Jul 30 06:53:04 GMT 2024","67","tests","start_unauthorized_page_test","TestStartUnauthorizedPage","","","Verify content of the text in sections 1, 2",""
"passed","Tue Jul 30 06:43:06 GMT 2024","Tue Jul 30 06:43:06 GMT 2024","28","tests","contacts_page_test","TestContactsPage","","","Verify text in links in the section 2",""
"passed","Tue Jul 30 06:49:05 GMT 2024","Tue Jul 30 06:49:05 GMT 2024","3","tests","login_page_test","TestLoginPage","","","Test for authorization customer.",""
"passed","Tue Jul 30 06:47:12 GMT 2024","Tue Jul 30 06:47:12 GMT 2024","79","tests","footer_test","TestFooter","","","Verify that the Contact us link in Footer calls an email client",""
"passed","Tue Jul 30 06:44:30 GMT 2024","Tue Jul 30 06:44:31 GMT 2024","1091","tests","description_page_test","TestDescriptionPage","","","Verify redirection to donate page not authorized user.",""
"passed","Tue Jul 30 06:46:01 GMT 2024","Tue Jul 30 06:46:04 GMT 2024","2958","tests","footer_test","TestFooter","","","Verify that the ARASAAC link in Footer leads to the correct page after click",""
"passed","Tue Jul 30 06:48:13 GMT 2024","Tue Jul 30 06:48:13 GMT 2024","79","tests","footer_test","TestFooter","","","Verify changes of visible sizes of the Selectel link's image in Footer",""
"passed","Tue Jul 30 06:47:24 GMT 2024","Tue Jul 30 06:47:25 GMT 2024","79","tests","footer_test","TestFooter","","","Verify changes of visible sizes of the ARASAAC link's image in Footer",""
"passed","Tue Jul 30 06:42:18 GMT 2024","Tue Jul 30 06:42:19 GMT 2024","1021","tests","authorisation_page_test","TestAuthorizedUserPage","","","Checking the possibility of authorization with the correct data",""
"passed","Tue Jul 30 06:57:57 GMT 2024","Tue Jul 30 06:57:57 GMT 2024","255","tests","used_resources_page_test","TestUsedResourcesPage","","","Verify value of the title of the tab",""
"passed","Tue Jul 30 06:48:53 GMT 2024","Tue Jul 30 06:48:55 GMT 2024","1448","tests","header_test","TestHeaderPage","","","Verify if the 'About' and the 'Telegram' links in the Section 2 
                          lead to the correct pages after click",""
"passed","Tue Jul 30 06:52:08 GMT 2024","Tue Jul 30 06:52:09 GMT 2024","790","tests","specialists_page_test","TestSpecialistsPage","","","Verify clickability, href, status code of the 'All Specialists' link",""
"passed","Tue Jul 30 06:47:49 GMT 2024","Tue Jul 30 06:47:49 GMT 2024","78","tests","footer_test","TestFooter","","","Verify changes of visible sizes of the JETBRAINS link's image in Footer",""
"passed","Tue Jul 30 06:52:38 GMT 2024","Tue Jul 30 06:52:38 GMT 2024","32","tests","start_unauthorized_page_test","TestStartUnauthorizedPage","","","Verify presence and visibility of content on the page",""
"passed","Tue Jul 30 06:42:45 GMT 2024","Tue Jul 30 06:42:45 GMT 2024","159","tests","contacts_page_test","TestContactsPage","","","Verify presence, visibility of sections, the dividing line and elements with text on the page",""
"passed","Tue Jul 30 06:43:17 GMT 2024","Tue Jul 30 06:43:18 GMT 2024","1342","tests","contacts_page_test","TestContactsPage","","","Verify if links in the section 2 lead to the correct pages after clicking",""
"passed","Tue Jul 30 06:47:45 GMT 2024","Tue Jul 30 06:47:45 GMT 2024","46","tests","footer_test","TestFooter","","","Verify visible sizes of the JETBRAINS link's image in Footer",""
"passed","Tue Jul 30 06:50:26 GMT 2024","Tue Jul 30 06:50:27 GMT 2024","608","tests","registration_page_test","TestRegistrationPage","","","Check registration with new email and empty confirm password",""
"passed","Tue Jul 30 06:47:53 GMT 2024","Tue Jul 30 06:47:53 GMT 2024","31","tests","footer_test","TestFooter","","","Verify accuracy of the REG.RU link's image in Footer",""
"passed","Tue Jul 30 06:49:48 GMT 2024","Tue Jul 30 06:49:48 GMT 2024","79","tests","main_page_test","TestMainPage","","","Checking the clickability of the Start button.",""
"passed","Tue Jul 30 06:48:05 GMT 2024","Tue Jul 30 06:48:05 GMT 2024","32","tests","footer_test","TestFooter","","","Verify accuracy of the Selectel link's image in Footer",""
"passed","Tue Jul 30 06:50:12 GMT 2024","Tue Jul 30 06:50:17 GMT 2024","4652","tests","registration_page_test","TestRegistrationPage","","","Check registration with new email",""
"passed","Tue Jul 30 06:51:32 GMT 2024","Tue Jul 30 06:51:37 GMT 2024","5368","tests","specialists_page_test","TestSpecialistsPage","","","Verify presence, visibility of the title, text, link, grid, cards and images  
        on the 2nd, 3rd, 5th, 6th levels of nesting on the page",""
"passed","Tue Jul 30 06:57:50 GMT 2024","Tue Jul 30 06:57:51 GMT 2024","880","tests","used_resources_page_test","TestUsedResourcesPage","","","Verify the composition and visibility of elements 
            on the 1st-4th levels of nesting on the page",""
"passed","Tue Jul 30 06:48:44 GMT 2024","Tue Jul 30 06:48:44 GMT 2024","94","tests","header_test","TestHeaderPage","","","Verify presence, visibility, attributes and sizes of the 'Logo' image",""
"passed","Tue Jul 30 06:52:42 GMT 2024","Tue Jul 30 06:52:42 GMT 2024","30","tests","start_unauthorized_page_test","TestStartUnauthorizedPage","","","Verify amount and visibility of sections with content on the page",""
"passed","Tue Jul 30 06:58:12 GMT 2024","Tue Jul 30 06:58:13 GMT 2024","785","tests","used_resources_page_test","TestUsedResourcesPage","","","Verify content of the text on the page",""
"passed","Tue Jul 30 06:46:18 GMT 2024","Tue Jul 30 06:46:23 GMT 2024","5107","tests","footer_test","TestFooter","","","Verify that the JETBRAINS link in Footer leads to the correct page after click",""
"passed","Tue Jul 30 06:54:24 GMT 2024","Tue Jul 30 06:54:38 GMT 2024","13180","tests","Речевые упражнения.","TestCardsRU","","","Select random card from group ""Слова"" and compare UI vs BACKEND data.",""
"passed","Tue Jul 30 06:44:05 GMT 2024","Tue Jul 30 06:44:06 GMT 2024","796","tests","contributors_page_test","TestContributorsPage","","","Verify href, status code of the 'All Team' link",""
"passed","Tue Jul 30 06:45:12 GMT 2024","Tue Jul 30 06:45:15 GMT 2024","3205","tests","footer_test","TestFooter","","","Verify accuracy of texts in Footer on each page specified in the kit",""
"passed","Tue Jul 30 06:52:33 GMT 2024","Tue Jul 30 06:52:34 GMT 2024","155","tests","specialists_page_test","TestSpecialistsPage","","","Verify sizes of images in specialist cards in the grid",""
"passed","Tue Jul 30 06:42:23 GMT 2024","Tue Jul 30 06:42:24 GMT 2024","847","tests","authorisation_page_test","TestAuthorizedUserPage","","","Checking the possibility of authorization with incorrect data",""
"passed","Tue Jul 30 06:45:02 GMT 2024","Tue Jul 30 06:45:03 GMT 2024","226","tests","footer_test","TestFooter","","","Verify composition and visibility of elements on the 1st-7th levels of nesting in the Footer",""
"passed","Tue Jul 30 06:53:16 GMT 2024","Tue Jul 30 06:53:16 GMT 2024","122","tests","start_unauthorized_page_test","TestStartUnauthorizedPage","","","Verify that the 'Login' link leads to the correct page after clicking",""
"passed","Tue Jul 30 06:50:54 GMT 2024","Tue Jul 30 06:51:15 GMT 2024","20701","tests","registration_page_test","TestRegistrationPage","","","Check registration without choosing agreement",""
"passed","Tue Jul 30 06:44:58 GMT 2024","Tue Jul 30 06:44:58 GMT 2024","38","tests","footer_test","TestFooter","","","Verify presence and visibility of the Footer",""
"passed","Tue Jul 30 06:47:16 GMT 2024","Tue Jul 30 06:47:16 GMT 2024","30","tests","footer_test","TestFooter","","","Verify accuracy of the ARASAAC link's image in Footer",""
"passed","Tue Jul 30 06:48:17 GMT 2024","Tue Jul 30 06:48:17 GMT 2024","31","tests","header_test","TestHeaderPage","","","Verify presence and visibility of content in the Header",""
"passed","Tue Jul 30 06:43:32 GMT 2024","Tue Jul 30 06:43:34 GMT 2024","1617","tests","contributors_page_test","TestContributorsPage","","","Verify presence, visibility of titles/subtitles, cards, descriptions, links, images on the page",""
"passed","Tue Jul 30 06:54:44 GMT 2024","Tue Jul 30 06:54:53 GMT 2024","9320","tests","Речевые упражнения.","TestCardsRU","","","Select random card from group ""Слова Королёвой"" and compare UI vs BACKEND data.",""
"passed","Tue Jul 30 06:45:07 GMT 2024","Tue Jul 30 06:45:07 GMT 2024","130","tests","footer_test","TestFooter","","","Verify presence, visibility of text, links, images in the Footer",""
"passed","Tue Jul 30 06:43:55 GMT 2024","Tue Jul 30 06:43:55 GMT 2024","428","tests","contributors_page_test","TestContributorsPage","","","Verify text in card links and the 'All Team' link",""
"passed","Tue Jul 30 06:48:30 GMT 2024","Tue Jul 30 06:48:30 GMT 2024","986","tests","header_test","TestHeaderPage","","","Verify presence, visibility, clickability, href, status code  
                             of the 'Logo' link in the section 1 in the Header",""
"passed","Tue Jul 30 06:49:24 GMT 2024","Tue Jul 30 06:49:24 GMT 2024","139","tests","main_page_test","TestMainPage","","","Verify redirection to contacts page not authorized user.",""
"passed","Tue Jul 30 06:50:45 GMT 2024","Tue Jul 30 06:50:46 GMT 2024","614","tests","registration_page_test","TestRegistrationPage","","","Check registration with new email and empty email",""
"passed","Tue Jul 30 06:42:29 GMT 2024","Tue Jul 30 06:42:29 GMT 2024","28","tests","contacts_page_test","TestContactsPage","","","Verify presence and visibility of content on the page",""
"passed","Tue Jul 30 06:45:52 GMT 2024","Tue Jul 30 06:45:57 GMT 2024","5144","tests","footer_test","TestFooter","","","Verify Footer invisibility through the modal window with the exercise",""
"passed","Tue Jul 30 06:44:24 GMT 2024","Tue Jul 30 06:44:26 GMT 2024","1314","tests","description_page_test","TestDescriptionPage","","","Verify redirection to telegram page not authorized user.",""
"passed","Tue Jul 30 06:53:08 GMT 2024","Tue Jul 30 06:53:08 GMT 2024","37","tests","start_unauthorized_page_test","TestStartUnauthorizedPage","","","Verify text in the 'Login' link in the section 1",""
"passed","Tue Jul 30 06:58:05 GMT 2024","Tue Jul 30 06:58:06 GMT 2024","789","tests","used_resources_page_test","TestUsedResourcesPage","","","Verify value of title with tag 'h1' on the page",""
"passed","Tue Jul 30 06:55:20 GMT 2024","Tue Jul 30 06:55:30 GMT 2024","10024","tests","Речевые упражнения.","TestCardsRU","","","Select a random card from ""Группа слов"" group and compare UI vs BACKEND data.",""
"passed","Tue Jul 30 06:52:03 GMT 2024","Tue Jul 30 06:52:03 GMT 2024","49","tests","specialists_page_test","TestSpecialistsPage","","","Verify text in the 'All Specialists' link",""
"passed","Tue Jul 30 06:53:20 GMT 2024","Tue Jul 30 06:53:20 GMT 2024","82","tests","start_unauthorized_page_test","TestStartUnauthorizedPage","","","Verify presence, visibility and attributes of the image in the section 1",""
"passed","Tue Jul 30 06:48:09 GMT 2024","Tue Jul 30 06:48:09 GMT 2024","45","tests","footer_test","TestFooter","","","Verify visible sizes of the Selectel link's image in Footer",""
"passed","Tue Jul 30 06:44:20 GMT 2024","Tue Jul 30 06:44:20 GMT 2024","100","tests","description_page_test","TestDescriptionPage","","","Verify return main page from description page.",""
"passed","Tue Jul 30 06:47:57 GMT 2024","Tue Jul 30 06:47:57 GMT 2024","44","tests","footer_test","TestFooter","","","Verify visible sizes of the REG.RU link's image in Footer",""
"passed","Tue Jul 30 06:53:31 GMT 2024","Tue Jul 30 06:53:41 GMT 2024","10175","tests","Speech exercises EN.","TestCardsEN","","","Select random card from ""Word"" group and compare UI vs BACKEND data",""
"passed","Tue Jul 30 06:47:41 GMT 2024","Tue Jul 30 06:47:41 GMT 2024","31","tests","footer_test","TestFooter","","","Verify accuracy of the JETBRAINS link's image in Footer",""
"passed","Tue Jul 30 06:48:48 GMT 2024","Tue Jul 30 06:48:49 GMT 2024","1119","tests","header_test","TestHeaderPage","","","Verify presence, visibility, clickability, href, status code of the 'About' and the 'Telegram' links in the Section 2 in the Header",""
"passed","Tue Jul 30 06:50:36 GMT 2024","Tue Jul 30 06:50:36 GMT 2024","614","tests","registration_page_test","TestRegistrationPage","","","Check registration with new email and empty first name",""
"passed","Tue Jul 30 06:52:28 GMT 2024","Tue Jul 30 06:52:28 GMT 2024","116","tests","specialists_page_test","TestSpecialistsPage","","","Verify attributes of images in specialist cards in the grid",""
"skipped","Tue Jul 30 06:57:18 GMT 2024","Tue Jul 30 06:57:28 GMT 2024","9511","tests","Речевые упражнения.","TestCardsRU","","","Solutions to a random task in the ""Слова"" group and comparison of statics.",""
"passed","Tue Jul 30 06:48:01 GMT 2024","Tue Jul 30 06:48:01 GMT 2024","78","tests","footer_test","TestFooter","","","Verify changes of visible sizes of the REG.RU link's image in Footer",""
"passed","Tue Jul 30 06:52:50 GMT 2024","Tue Jul 30 06:52:51 GMT 2024","112","tests","start_unauthorized_page_test","TestStartUnauthorizedPage","","","Verify the composition and visibility of elements 
        on the 1st-3rd levels of nesting in the section 2",""
"passed","Tue Jul 30 06:49:44 GMT 2024","Tue Jul 30 06:49:44 GMT 2024","138","tests","main_page_test","TestMainPage","","","Verify redirection to used resources page not authorized user.",""
"passed","Tue Jul 30 06:47:37 GMT 2024","Tue Jul 30 06:47:37 GMT 2024","79","tests","footer_test","TestFooter","","","Verify changes of visible sizes of the EPAM link's image in Footer",""
"passed","Tue Jul 30 06:50:21 GMT 2024","Tue Jul 30 06:50:22 GMT 2024","1136","tests","registration_page_test","TestRegistrationPage","","","Check registration with an existing email",""
"passed","Tue Jul 30 06:47:28 GMT 2024","Tue Jul 30 06:47:28 GMT 2024","32","tests","footer_test","TestFooter","","","Verify accuracy of the EPAM link's image in Footer",""
"passed","Tue Jul 30 06:43:01 GMT 2024","Tue Jul 30 06:43:01 GMT 2024","30","tests","contacts_page_test","TestContactsPage","","","Verify content of the text in the section 2",""
"passed","Tue Jul 30 06:49:33 GMT 2024","Tue Jul 30 06:49:35 GMT 2024","1424","tests","main_page_test","TestMainPage","","","Verify redirection to github not authorized user.",""
"passed","Tue Jul 30 06:52:59 GMT 2024","Tue Jul 30 06:52:59 GMT 2024","46","tests","start_unauthorized_page_test","TestStartUnauthorizedPage","","","Verify values of titles and subtitles with tags h2, h4 on the page",""
"passed","Tue Jul 30 06:49:19 GMT 2024","Tue Jul 30 06:49:20 GMT 2024","944","tests","main_page_test","TestMainPage","","","Verify redirection to donate page not authorized user.",""
"passed","Tue Jul 30 06:43:27 GMT 2024","Tue Jul 30 06:43:28 GMT 2024","1650","tests","contributors_page_test","TestContributorsPage","","","Verify the composition and visibility of elements 
        on the 1st-5th levels of nesting on the page",""
"passed","Tue Jul 30 06:43:11 GMT 2024","Tue Jul 30 06:43:12 GMT 2024","822","tests","contacts_page_test","TestContactsPage","","","Verify presence, visibility, clickability, href, prefix, status code of links in the section 2",""
"passed","Tue Jul 30 06:50:50 GMT 2024","Tue Jul 30 06:50:50 GMT 2024","596","tests","registration_page_test","TestRegistrationPage","","","Check registration without choosing gender",""
"passed","Tue Jul 30 06:52:46 GMT 2024","Tue Jul 30 06:52:46 GMT 2024","84","tests","start_unauthorized_page_test","TestStartUnauthorizedPage","","","Verify the composition and visibility of elements 
        on the 1st-3rd levels of nesting in the section 1",""
"passed","Tue Jul 30 06:51:21 GMT 2024","Tue Jul 30 06:51:21 GMT 2024","31","tests","specialists_page_test","TestSpecialistsPage","","","Verify presence and visibility of content on the page",""
"passed","Tue Jul 30 06:44:49 GMT 2024","Tue Jul 30 06:44:50 GMT 2024","679","tests","description_page_test","TestDescriptionPage","","","Verify redirection to contributors page not authorized user.",""
"passed","Tue Jul 30 06:57:43 GMT 2024","Tue Jul 30 06:57:43 GMT 2024","783","tests","used_resources_page_test","TestUsedResourcesPage","","","Verify presence and visibility of content on the page",""
"passed","Tue Jul 30 06:48:40 GMT 2024","Tue Jul 30 06:48:40 GMT 2024","91","tests","header_test","TestHeaderPage","","","Verify that the 'Logo' link on the 'Contacts' page leads an unauthorized user 
                             to the Start Unauthorized Page after clicking",""
"passed","Tue Jul 30 06:43:50 GMT 2024","Tue Jul 30 06:43:51 GMT 2024","357","tests","contributors_page_test","TestContributorsPage","","","Verify values of the text in card descriptions",""
"passed","Tue Jul 30 06:48:59 GMT 2024","Tue Jul 30 06:48:59 GMT 2024","23","tests","header_test","TestHeaderPage","","","Verify values of the text in the 'About' and the 'Telegram' links 
                          in the Section 2 in the Header",""
"passed","Tue Jul 30 06:43:38 GMT 2024","Tue Jul 30 06:43:38 GMT 2024","11","tests","contributors_page_test","TestContributorsPage","","","Verify value of the title of the tab",""
"passed","Tue Jul 30 06:49:39 GMT 2024","Tue Jul 30 06:49:39 GMT 2024","639","tests","main_page_test","TestMainPage","","","Verify redirection to contributors page not authorized user.",""
"passed","Tue Jul 30 06:44:15 GMT 2024","Tue Jul 30 06:44:16 GMT 2024","1061","tests","contributors_page_test","TestContributorsPage","","","Verify sizes of images in contributor cards in grids",""
"passed","Tue Jul 30 06:47:20 GMT 2024","Tue Jul 30 06:47:20 GMT 2024","44","tests","footer_test","TestFooter","","","Verify visible sizes of the ARASAAC link's image in Footer",""
"passed","Tue Jul 30 06:46:27 GMT 2024","Tue Jul 30 06:46:57 GMT 2024","30252","tests","footer_test","TestFooter","","","Verify that the REG.RU link in Footer leads to the correct page after click",""
"passed","Tue Jul 30 06:45:19 GMT 2024","Tue Jul 30 06:45:20 GMT 2024","629","tests","footer_test","TestFooter","","","Verify clickability, href, status code of the ARASAAC link in Footer",""
"passed","Tue Jul 30 06:51:42 GMT 2024","Tue Jul 30 06:51:42 GMT 2024","12","tests","specialists_page_test","TestSpecialistsPage","","","Verify value of the title of the tab",""
"passed","Tue Jul 30 06:50:31 GMT 2024","Tue Jul 30 06:50:32 GMT 2024","655","tests","registration_page_test","TestRegistrationPage","","","Check registration with new email and empty password",""
"passed","Tue Jul 30 06:42:55 GMT 2024","Tue Jul 30 06:42:55 GMT 2024","50","tests","contacts_page_test","TestContactsPage","","","Verify values of the title and subtitles with tags h1, h2 on the page",""
"passed","Tue Jul 30 06:45:35 GMT 2024","Tue Jul 30 06:45:35 GMT 2024","752","tests","footer_test","TestFooter","","","Verify clickability, href, status code of the REG.RU link in Footer",""
"passed","Tue Jul 30 06:44:54 GMT 2024","Tue Jul 30 06:44:54 GMT 2024","138","tests","description_page_test","TestDescriptionPage","","","Verify redirection to used resources page not authorized user.",""
"passed","Tue Jul 30 06:42:34 GMT 2024","Tue Jul 30 06:42:34 GMT 2024","20","tests","contacts_page_test","TestContactsPage","","","Verify the composition and visibility of elements on the 1st level of nesting in the section 1",""
"passed","Tue Jul 30 06:43:22 GMT 2024","Tue Jul 30 06:43:22 GMT 2024","40","tests","contributors_page_test","TestContributorsPage","","","Verify presence, visibility and structure of content on the page",""
"passed","Tue Jul 30 06:51:58 GMT 2024","Tue Jul 30 06:51:58 GMT 2024","113","tests","specialists_page_test","TestSpecialistsPage","","","Verify values of names and professions in specialist cards in the grid",""
"passed","Tue Jul 30 06:58:44 GMT 2024","Tue Jul 30 06:58:45 GMT 2024","818","tests","used_resources_page_test","TestUsedResourcesPage","","","Verify presence, visibility and attributes of icons in the sections",""
"passed","Tue Jul 30 06:58:51 GMT 2024","Tue Jul 30 06:58:52 GMT 2024","835","tests","used_resources_page_test","TestUsedResourcesPage","","","Verify sizes of icons in the sections",""
"passed","Tue Jul 30 06:55:00 GMT 2024","Tue Jul 30 06:55:13 GMT 2024","13634","tests","Речевые упражнения.","TestCardsRU","","","Select a random card from ""Похожие фразы"" group and compare UI vs BACKEND data.",""
"passed","Tue Jul 30 06:50:40 GMT 2024","Tue Jul 30 06:50:41 GMT 2024","630","tests","registration_page_test","TestRegistrationPage","","","Check registration with new email and empty birthday",""
"passed","Tue Jul 30 06:51:53 GMT 2024","Tue Jul 30 06:51:53 GMT 2024","33","tests","specialists_page_test","TestSpecialistsPage","","","Verify value of text on the page",""
"passed","Tue Jul 30 06:45:45 GMT 2024","Tue Jul 30 06:45:45 GMT 2024","51","tests","footer_test","TestFooter","","","Verify accuracy of the Contact us link in Footer",""
"passed","Tue Jul 30 06:52:21 GMT 2024","Tue Jul 30 06:52:23 GMT 2024","1632","tests","specialists_page_test","TestSpecialistsPage","","","Verify that the 'All Specialists' link leads an authorized user 
                         to the correct page after clicking",""
"passed","Tue Jul 30 06:44:35 GMT 2024","Tue Jul 30 06:44:35 GMT 2024","139","tests","description_page_test","TestDescriptionPage","","","Verify redirection to contacts page not authorized user.",""
"passed","Tue Jul 30 06:53:25 GMT 2024","Tue Jul 30 06:53:25 GMT 2024","58","tests","start_unauthorized_page_test","TestStartUnauthorizedPage","","","Verify size of the image in the section 1",""
