"Status","Start Time","Stop Time","Duration in ms","Parent Suite","Suite","Sub Suite","Test Class","Test Method","Name","Description"
"passed","Tue Jul 30 06:48:25 GMT 2024","Tue Jul 30 06:48:25 GMT 2024","38","tests","header_test","TestHeaderPage","","","Verify the section with the 'ru' and 'en' buttons in the Header",""
"skipped","Tue Jul 30 06:56:50 GMT 2024","Tue Jul 30 06:57:12 GMT 2024","21425","tests","Речевые упражнения.","TestCardsRU","","","Solutions to a random task in the ""Слова Королёвой"" .",""
"passed","Tue Jul 30 06:45:26 GMT 2024","Tue Jul 30 06:45:26 GMT 2024","109","tests","footer_test","TestFooter","","","Verify clickability, href, status code of the EPAM link in Footer",""
"passed","Tue Jul 30 06:47:33 GMT 2024","Tue Jul 30 06:47:33 GMT 2024","45","tests","footer_test","TestFooter","","","Verify visible sizes of the EPAM link's image in Footer",""
"passed","Tue Jul 30 06:51:48 GMT 2024","Tue Jul 30 06:51:48 GMT 2024","32","tests","specialists_page_test","TestSpecialistsPage","","","Verify value of title with tag 'h2' on the page",""
"passed","Tue Jul 30 06:49:52 GMT 2024","Tue Jul 30 06:49:52 GMT 2024","99","tests","main_page_test","TestMainPage","","","Checking the clickability of the Registration button.",""
"passed","Tue Jul 30 06:46:08 GMT 2024","Tue Jul 30 06:46:14 GMT 2024","5260","tests","footer_test","TestFooter","","","Verify that the EPAM link in Footer leads to the correct page after click",""
"passed","Tue Jul 30 06:54:05 GMT 2024","Tue Jul 30 06:54:18 GMT 2024","13314","tests","Speech exercises EN.","TestCardsEN","","","Select a random card from ""Similar phrases"" group and compare UI vs BACKEND data",""
"passed","Tue Jul 30 06:53:12 GMT 2024","Tue Jul 30 06:53:12 GMT 2024","732","tests","start_unauthorized_page_test","TestStartUnauthorizedPage","","","Verify presence, visibility, clickability, href, status code 
                         of the 'Login' link in the section 1",""
"passed","Tue Jul 30 06:58:19 GMT 2024","Tue Jul 30 06:58:20 GMT 2024","792","tests","used_resources_page_test","TestUsedResourcesPage","","","Verify text in links in the sections",""
"passed","Tue Jul 30 06:43:42 GMT 2024","Tue Jul 30 06:43:42 GMT 2024","40","tests","contributors_page_test","TestContributorsPage","","","Verify values of title and subtitles with tags h2, h3 on the page",""
"passed","Tue Jul 30 06:44:10 GMT 2024","Tue Jul 30 06:44:11 GMT 2024","778","tests","contributors_page_test","TestContributorsPage","","","Verify attribute values of images in contributors cards in grids",""
"passed","Tue Jul 30 06:53:49 GMT 2024","Tue Jul 30 06:53:58 GMT 2024","9505","tests","Speech exercises EN.","TestCardsEN","","","Check progres-bar and buttons.",""
"passed","Tue Jul 30 06:55:36 GMT 2024","Tue Jul 30 06:55:46 GMT 2024","9440","tests","Речевые упражнения.","TestCardsRU","","","Select a random card from ""Предложения"" group and compare UI vs BACKEND data.",""
"passed","Tue Jul 30 06:45:08 GMT 2024","Tue Jul 30 06:45:11 GMT 2024","3179","tests","footer_test","TestFooter","","","Verify accuracy of texts in Footer on each page specified in the kit",""
"passed","Tue Jul 30 06:51:26 GMT 2024","Tue Jul 30 06:51:27 GMT 2024","347","tests","specialists_page_test","TestSpecialistsPage","","","Verify the composition and visibility of elements 
        on the 1st-6th levels of nesting on the page",""
"passed","Tue Jul 30 06:57:34 GMT 2024","Tue Jul 30 06:57:36 GMT 2024","1532","tests","Statistic.","TestCardsRU","","","Check statistic table.",""
"passed","Tue Jul 30 06:55:52 GMT 2024","Tue Jul 30 06:56:02 GMT 2024","9563","tests","Речевые упражнения.","TestCardsRU","","","Select a random card from ""Слова с частотной группировкой"" group and compare UI vs BACKEND data.",""
