"Status","Start Time","Stop Time","Duration in ms","Parent Suite","Suite","Sub Suite","Test Class","Test Method","Name","Description"
"passed","Fri Sep 13 08:06:31 GMT 2024","Fri Sep 13 08:06:31 GMT 2024","11","tests","contacts_page_test","TestContactsPage","","","Verify value of the title of the tab",""
"passed","Fri Sep 13 08:20:45 GMT 2024","Fri Sep 13 08:20:46 GMT 2024","867","tests","used_resources_page_test","TestUsedResourcesPage","","","Verify the composition and visibility of elements 
            on the 1st-4th levels of nesting on the page",""
"passed","Fri Sep 13 08:14:03 GMT 2024","Fri Sep 13 08:14:04 GMT 2024","579","tests","specialists_page_test","TestSpecialistsPage","","","Verify that the 'All Specialists' link leads an unauthorized user 
                         to the correct page after clicking",""
"passed","Fri Sep 13 08:11:29 GMT 2024","Fri Sep 13 08:11:30 GMT 2024","644","tests","main_page_test","TestMainPage","","","Verify redirection to specialists page not authorized user.",""
"passed","Fri Sep 13 08:06:11 GMT 2024","Fri Sep 13 08:06:11 GMT 2024","27","tests","contacts_page_test","TestContactsPage","","","Verify presence and visibility of content on the page",""
"passed","Fri Sep 13 08:14:32 GMT 2024","Fri Sep 13 08:14:32 GMT 2024","33","tests","start_unauthorized_page_test","TestStartUnauthorizedPage","","","Verify presence and visibility of content on the page",""
"passed","Fri Sep 13 08:15:15 GMT 2024","Fri Sep 13 08:15:15 GMT 2024","58","tests","start_unauthorized_page_test","TestStartUnauthorizedPage","","","Verify size of the image in the section 1",""
"passed","Fri Sep 13 08:19:24 GMT 2024","Fri Sep 13 08:20:02 GMT 2024","38662","tests","Речевые упражнения.","TestCardsRU","","","Solutions to a random task in the ""Слова Королёвой"" .",""
"passed","Fri Sep 13 08:13:18 GMT 2024","Fri Sep 13 08:13:18 GMT 2024","331","tests","specialists_page_test","TestSpecialistsPage","","","Verify the composition and visibility of elements 
        on the 1st-6th levels of nesting on the page",""
"passed","Fri Sep 13 08:08:46 GMT 2024","Fri Sep 13 08:08:46 GMT 2024","56","tests","footer_test","TestFooter","","","Verify content of text in the Footer",""
"passed","Fri Sep 13 08:13:43 GMT 2024","Fri Sep 13 08:13:43 GMT 2024","34","tests","specialists_page_test","TestSpecialistsPage","","","Verify value of text on the page",""
"skipped","Fri Sep 13 08:17:08 GMT 2024","Fri Sep 13 08:17:30 GMT 2024","21354","tests","Речевые упражнения.","TestCardsRU","","","Select a random card from ""Предложения"" group and compare UI vs BACKEND data.",""
"passed","Fri Sep 13 08:10:38 GMT 2024","Fri Sep 13 08:10:40 GMT 2024","1842","tests","header_test","TestHeaderPage","","","Verify if external links in the Header lead to correct pages after click",""
"passed","Fri Sep 13 08:11:16 GMT 2024","Fri Sep 13 08:11:17 GMT 2024","1183","tests","main_page_test","TestMainPage","","","Verify redirection to telegram page not authorized user.",""
"passed","Fri Sep 13 08:12:26 GMT 2024","Fri Sep 13 08:12:26 GMT 2024","681","tests","registration_page_test","TestRegistrationPage","","","Check registration with new email and empty password",""
"passed","Fri Sep 13 08:15:08 GMT 2024","Fri Sep 13 08:15:08 GMT 2024","155","tests","start_unauthorized_page_test","TestStartUnauthorizedPage","","","Verify that the 'Login' link leads to the correct page after clicking",""
"passed","Fri Sep 13 08:20:29 GMT 2024","Fri Sep 13 08:20:31 GMT 2024","2015","tests","Statistic.","TestCardsRU","","","Check statistic table.",""
"passed","Fri Sep 13 08:12:43 GMT 2024","Fri Sep 13 08:12:44 GMT 2024","634","tests","registration_page_test","TestRegistrationPage","","","Check registration without choosing gender",""
"passed","Fri Sep 13 08:11:08 GMT 2024","Fri Sep 13 08:11:08 GMT 2024","3","tests","login_page_test","TestLoginPage","","","Test for authorization customer.",""
"passed","Fri Sep 13 08:13:23 GMT 2024","Fri Sep 13 08:13:28 GMT 2024","5347","tests","specialists_page_test","TestSpecialistsPage","","","Verify presence, visibility of the title, text, link, grid, cards and images  
        on the 2nd, 3rd, 5th, 6th levels of nesting on the page",""
"passed","Fri Sep 13 08:08:42 GMT 2024","Fri Sep 13 08:08:42 GMT 2024","150","tests","footer_test","TestFooter","","","Verify presence, visibility of text, links, images in the Footer",""
"passed","Fri Sep 13 08:06:01 GMT 2024","Fri Sep 13 08:06:02 GMT 2024","1036","tests","authorisation_page_test","TestAuthorizedUserPage","","","Checking the possibility of authorization with the correct data",""
"passed","Fri Sep 13 08:09:25 GMT 2024","Fri Sep 13 08:09:28 GMT 2024","3485","tests","footer_test","TestFooter","","","Verify Footer invisibility through the modal window with the exercise",""
"passed","Fri Sep 13 08:07:36 GMT 2024","Fri Sep 13 08:07:36 GMT 2024","445","tests","contributors_page_test","TestContributorsPage","","","Verify text in card links and the 'All Team' link",""
"passed","Fri Sep 13 08:09:11 GMT 2024","Fri Sep 13 08:09:11 GMT 2024","96","tests","footer_test","TestFooter","","","Verify that the 'Contact us' link in the Footer calls an email client",""
"passed","Fri Sep 13 08:07:49 GMT 2024","Fri Sep 13 08:07:49 GMT 2024","772","tests","contributors_page_test","TestContributorsPage","","","Verify attribute values of images in contributors cards in grids",""
"passed","Fri Sep 13 08:13:48 GMT 2024","Fri Sep 13 08:13:48 GMT 2024","109","tests","specialists_page_test","TestSpecialistsPage","","","Verify values of names and professions in specialist cards in the grid",""
"passed","Fri Sep 13 08:08:12 GMT 2024","Fri Sep 13 08:08:12 GMT 2024","145","tests","description_page_test","TestDescriptionPage","","","Verify redirection to contacts page not authorized user.",""
"passed","Fri Sep 13 08:08:25 GMT 2024","Fri Sep 13 08:08:26 GMT 2024","646","tests","description_page_test","TestDescriptionPage","","","Verify redirection to contributors page not authorized user.",""
"passed","Fri Sep 13 08:12:48 GMT 2024","Fri Sep 13 08:13:08 GMT 2024","20732","tests","registration_page_test","TestRegistrationPage","","","Check registration without choosing agreement",""
"passed","Fri Sep 13 08:11:21 GMT 2024","Fri Sep 13 08:11:22 GMT 2024","827","tests","main_page_test","TestMainPage","","","Verify redirection to donate page not authorized user.",""
"passed","Fri Sep 13 08:08:59 GMT 2024","Fri Sep 13 08:09:07 GMT 2024","7729","tests","footer_test","TestFooter","","","Verify that links in the Footer lead to correct pages after clicking",""
"passed","Fri Sep 13 08:13:38 GMT 2024","Fri Sep 13 08:13:38 GMT 2024","35","tests","specialists_page_test","TestSpecialistsPage","","","Verify value of title with tag 'h2' on the page",""
"passed","Fri Sep 13 08:06:21 GMT 2024","Fri Sep 13 08:06:21 GMT 2024","131","tests","contacts_page_test","TestContactsPage","","","Verify the composition and visibility of elements 
        on the 1st-5th levels of nesting in the section 2",""
"passed","Fri Sep 13 08:14:10 GMT 2024","Fri Sep 13 08:14:12 GMT 2024","1587","tests","specialists_page_test","TestSpecialistsPage","","","Verify that the 'All Specialists' link leads an authorized user 
                         to the correct page after clicking",""
"passed","Fri Sep 13 08:11:25 GMT 2024","Fri Sep 13 08:11:26 GMT 2024","196","tests","main_page_test","TestMainPage","","","Verify redirection to contacts page not authorized user.",""
"passed","Fri Sep 13 08:12:35 GMT 2024","Fri Sep 13 08:12:35 GMT 2024","682","tests","registration_page_test","TestRegistrationPage","","","Check registration with new email and empty birthday",""
"passed","Fri Sep 13 08:10:29 GMT 2024","Fri Sep 13 08:10:34 GMT 2024","4775","tests","header_test","TestHeaderPage","","","Verify if internal links in the Header lead to correct pages after click",""
"passed","Fri Sep 13 08:21:12 GMT 2024","Fri Sep 13 08:21:13 GMT 2024","777","tests","used_resources_page_test","TestUsedResourcesPage","","","Verify text in links in sections",""
"passed","Fri Sep 13 08:06:56 GMT 2024","Fri Sep 13 08:06:57 GMT 2024","1312","tests","contacts_page_test","TestContactsPage","","","Verify if links in the section 2 lead to the correct pages after clicking",""
"passed","Fri Sep 13 08:11:54 GMT 2024","Fri Sep 13 08:12:06 GMT 2024","11538","tests","profile_page_test","TestProfilePage","","","Change the password by receiving an email link",""
"passed","Fri Sep 13 08:06:26 GMT 2024","Fri Sep 13 08:06:26 GMT 2024","165","tests","contacts_page_test","TestContactsPage","","","Verify presence, visibility of sections, the dividing line and elements with text on the page",""
"passed","Fri Sep 13 08:12:16 GMT 2024","Fri Sep 13 08:12:18 GMT 2024","1207","tests","registration_page_test","TestRegistrationPage","","","Check registration with an existing email",""
"passed","Fri Sep 13 08:20:52 GMT 2024","Fri Sep 13 08:20:52 GMT 2024","244","tests","used_resources_page_test","TestUsedResourcesPage","","","Verify value of the title of the tab",""
"passed","Fri Sep 13 08:14:48 GMT 2024","Fri Sep 13 08:14:48 GMT 2024","20","tests","start_unauthorized_page_test","TestStartUnauthorizedPage","","","Verify value of the title of the tab",""
"passed","Fri Sep 13 08:07:16 GMT 2024","Fri Sep 13 08:07:17 GMT 2024","1612","tests","contributors_page_test","TestContributorsPage","","","Verify presence, visibility of titles/subtitles, cards, descriptions, links, images on the page",""
"passed","Fri Sep 13 08:20:38 GMT 2024","Fri Sep 13 08:20:38 GMT 2024","807","tests","used_resources_page_test","TestUsedResourcesPage","","","Verify presence and visibility of content on the page",""
"passed","Fri Sep 13 08:14:44 GMT 2024","Fri Sep 13 08:14:44 GMT 2024","121","tests","start_unauthorized_page_test","TestStartUnauthorizedPage","","","Verify the composition and visibility of elements 
        on the 1st-3rd levels of nesting in the section 2",""
"skipped","Fri Sep 13 08:17:30 GMT 2024","Fri Sep 13 08:17:30 GMT 2024","0","tests","Речевые упражнения.","TestCardsRU","","","Select a random card from ""Слова с частотной группировкой"" group and compare UI vs BACKEND data.",""
"passed","Fri Sep 13 08:13:53 GMT 2024","Fri Sep 13 08:13:53 GMT 2024","42","tests","specialists_page_test","TestSpecialistsPage","","","Verify text in the 'All Specialists' link",""
"passed","Fri Sep 13 08:11:50 GMT 2024","Fri Sep 13 08:11:50 GMT 2024","143","tests","main_page_test","TestMainPage","","","Checking the clickability of the Registration button.",""
"skipped","Fri Sep 13 08:20:09 GMT 2024","Fri Sep 13 08:20:23 GMT 2024","13613","tests","Речевые упражнения.","TestCardsRU","","","Solutions to a random task in the ""Слова"" group and comparison of statics.",""
"passed","Fri Sep 13 08:07:06 GMT 2024","Fri Sep 13 08:07:06 GMT 2024","35","tests","contributors_page_test","TestContributorsPage","","","Verify presence, visibility and structure of content on the page",""
"passed","Fri Sep 13 08:07:53 GMT 2024","Fri Sep 13 08:07:54 GMT 2024","1082","tests","contributors_page_test","TestContributorsPage","","","Verify sizes of images in contributor cards in grids",""
"passed","Fri Sep 13 08:15:21 GMT 2024","Fri Sep 13 08:15:31 GMT 2024","10166","tests","Speech exercises EN.","TestCardsEN","","","Select random card from ""Word"" group and compare UI vs BACKEND data",""
"passed","Fri Sep 13 08:08:49 GMT 2024","Fri Sep 13 08:08:49 GMT 2024","45","tests","footer_test","TestFooter","","","Verify text in the 'Contact us' link in the Footer",""
"passed","Fri Sep 13 08:16:37 GMT 2024","Fri Sep 13 08:16:47 GMT 2024","10095","tests","Речевые упражнения.","TestCardsRU","","","Select a random card from ""Похожие фразы"" group and compare UI vs BACKEND data.",""
"passed","Fri Sep 13 08:13:13 GMT 2024","Fri Sep 13 08:13:13 GMT 2024","29","tests","specialists_page_test","TestSpecialistsPage","","","Verify presence and visibility of content on the page",""
"passed","Fri Sep 13 08:14:36 GMT 2024","Fri Sep 13 08:14:36 GMT 2024","30","tests","start_unauthorized_page_test","TestStartUnauthorizedPage","","","Verify amount and visibility of sections with content on the page",""
"passed","Fri Sep 13 08:06:36 GMT 2024","Fri Sep 13 08:06:36 GMT 2024","50","tests","contacts_page_test","TestContactsPage","","","Verify values of the title and subtitles with tags h1, h2 on the page",""
"passed","Fri Sep 13 08:16:53 GMT 2024","Fri Sep 13 08:17:02 GMT 2024","8948","tests","Речевые упражнения.","TestCardsRU","","","Select a random card from ""Группа слов"" group and compare UI vs BACKEND data.",""
"passed","Fri Sep 13 08:10:06 GMT 2024","Fri Sep 13 08:10:07 GMT 2024","345","tests","header_test","TestHeaderPage","","","Verify presence, visibility of links, buttons in the Header for an unauthorized user",""
"passed","Fri Sep 13 08:06:06 GMT 2024","Fri Sep 13 08:06:07 GMT 2024","897","tests","authorisation_page_test","TestAuthorizedUserPage","","","Checking the possibility of authorization with incorrect data",""
"passed","Fri Sep 13 08:21:43 GMT 2024","Fri Sep 13 08:21:44 GMT 2024","823","tests","used_resources_page_test","TestUsedResourcesPage","","","Verify sizes of icons in sections",""
"broken","Fri Sep 13 08:10:17 GMT 2024","Fri Sep 13 08:10:17 GMT 2024","9","tests","header_test","TestHeaderPage","","","Verify values of the text in links, buttons in the Header",""
"passed","Fri Sep 13 08:08:30 GMT 2024","Fri Sep 13 08:08:30 GMT 2024","171","tests","description_page_test","TestDescriptionPage","","","Verify redirection to used resources page not authorized user.",""
"passed","Fri Sep 13 08:08:02 GMT 2024","Fri Sep 13 08:08:03 GMT 2024","1191","tests","description_page_test","TestDescriptionPage","","","Verify redirection to telegram page not authorized user.",""
"passed","Fri Sep 13 08:15:03 GMT 2024","Fri Sep 13 08:15:04 GMT 2024","606","tests","start_unauthorized_page_test","TestStartUnauthorizedPage","","","Verify presence, visibility, clickability, href, status code 
                         of the 'Login' link in the section 1",""
"passed","Fri Sep 13 08:07:25 GMT 2024","Fri Sep 13 08:07:25 GMT 2024","52","tests","contributors_page_test","TestContributorsPage","","","Verify values of title and subtitles with tags h2, h3 on the page",""
"passed","Fri Sep 13 08:21:19 GMT 2024","Fri Sep 13 08:21:21 GMT 2024","2370","tests","used_resources_page_test","TestUsedResourcesPage","","","Verify presence, visibility, clickability, href, status code of links in sections",""
"passed","Fri Sep 13 08:10:59 GMT 2024","Fri Sep 13 08:10:59 GMT 2024","51","tests","header_test","TestHeaderPage","","","Verify size of the image in the 'Logo' link",""
"passed","Fri Sep 13 08:15:38 GMT 2024","Fri Sep 13 08:15:46 GMT 2024","8176","tests","Speech exercises EN.","TestCardsEN","","","Check progres-bar and buttons.",""
"passed","Fri Sep 13 08:10:43 GMT 2024","Fri Sep 13 08:10:44 GMT 2024","108","tests","header_test","TestHeaderPage","","","Verify that the 'Logo' link on the Start Unauthorized Page 
                             doesn't refresh the current page or lead to other pages after clicking",""
"passed","Fri Sep 13 08:12:39 GMT 2024","Fri Sep 13 08:12:40 GMT 2024","643","tests","registration_page_test","TestRegistrationPage","","","Check registration with new email and empty email",""
"passed","Fri Sep 13 08:14:17 GMT 2024","Fri Sep 13 08:14:17 GMT 2024","106","tests","specialists_page_test","TestSpecialistsPage","","","Verify attributes of images in specialist cards in the grid",""
"passed","Fri Sep 13 08:07:58 GMT 2024","Fri Sep 13 08:07:58 GMT 2024","156","tests","description_page_test","TestDescriptionPage","","","Verify return main page from description page.",""
"passed","Fri Sep 13 08:11:43 GMT 2024","Fri Sep 13 08:11:43 GMT 2024","145","tests","main_page_test","TestMainPage","","","Verify redirection to used resources page not authorized user.",""
"passed","Fri Sep 13 08:07:21 GMT 2024","Fri Sep 13 08:07:21 GMT 2024","12","tests","contributors_page_test","TestContributorsPage","","","Verify value of the title of the tab",""
"passed","Fri Sep 13 08:06:16 GMT 2024","Fri Sep 13 08:06:16 GMT 2024","20","tests","contacts_page_test","TestContactsPage","","","Verify the composition and visibility of elements on the 1st level of nesting in the section 1",""
"passed","Fri Sep 13 08:06:50 GMT 2024","Fri Sep 13 08:06:51 GMT 2024","757","tests","contacts_page_test","TestContactsPage","","","Verify presence, visibility, clickability, href, prefix, status code of links in the section 2",""
"passed","Fri Sep 13 08:11:12 GMT 2024","Fri Sep 13 08:11:12 GMT 2024","118","tests","main_page_test","TestMainPage","","","Verify redirection to description page not authorized user.",""
"passed","Fri Sep 13 08:09:15 GMT 2024","Fri Sep 13 08:09:15 GMT 2024","74","tests","footer_test","TestFooter","","","Verify attributes of images in links in the Footer",""
"passed","Fri Sep 13 08:11:39 GMT 2024","Fri Sep 13 08:11:39 GMT 2024","655","tests","main_page_test","TestMainPage","","","Verify redirection to contributors page not authorized user.",""
"passed","Fri Sep 13 08:09:19 GMT 2024","Fri Sep 13 08:09:19 GMT 2024","107","tests","footer_test","TestFooter","","","Verify sizes of images in links in the Footer",""
"passed","Fri Sep 13 08:08:20 GMT 2024","Fri Sep 13 08:08:22 GMT 2024","1582","tests","description_page_test","TestDescriptionPage","","","Verify redirection to github not authorized user.",""
"passed","Fri Sep 13 08:07:28 GMT 2024","Fri Sep 13 08:07:28 GMT 2024","19","tests","contributors_page_test","TestContributorsPage","","","Verify content of the text on the page",""
"passed","Fri Sep 13 08:10:13 GMT 2024","Fri Sep 13 08:10:13 GMT 2024","192","tests","header_test","TestHeaderPage","","","Verify presence, visibility of links, buttons in the Header for an authorized user",""
"passed","Fri Sep 13 08:06:41 GMT 2024","Fri Sep 13 08:06:41 GMT 2024","29","tests","contacts_page_test","TestContactsPage","","","Verify content of the text in the section 2",""
"passed","Fri Sep 13 08:08:34 GMT 2024","Fri Sep 13 08:08:34 GMT 2024","38","tests","footer_test","TestFooter","","","Verify presence and visibility of the Footer",""
"passed","Fri Sep 13 08:07:10 GMT 2024","Fri Sep 13 08:07:12 GMT 2024","1645","tests","contributors_page_test","TestContributorsPage","","","Verify the composition and visibility of elements 
        on the 1st-5th levels of nesting on the page",""
"passed","Fri Sep 13 08:14:59 GMT 2024","Fri Sep 13 08:14:59 GMT 2024","39","tests","start_unauthorized_page_test","TestStartUnauthorizedPage","","","Verify text in the 'Login' link in the section 1",""
"passed","Fri Sep 13 08:14:51 GMT 2024","Fri Sep 13 08:14:51 GMT 2024","47","tests","start_unauthorized_page_test","TestStartUnauthorizedPage","","","Verify values of titles and subtitles with tags h2, h4 on the page",""
"passed","Fri Sep 13 08:15:52 GMT 2024","Fri Sep 13 08:16:00 GMT 2024","8109","tests","Speech exercises EN.","TestCardsEN","","","Select a random card from ""Similar phrases"" group and compare UI vs BACKEND data",""
"passed","Fri Sep 13 08:09:36 GMT 2024","Fri Sep 13 08:09:46 GMT 2024","10367","tests","header_test","TestHeaderPage","","","Verify composition, visibility of elements on the 1st-6th levels of nesting in the Header
            for an unauthorized user",""
"passed","Fri Sep 13 08:07:44 GMT 2024","Fri Sep 13 08:07:45 GMT 2024","577","tests","contributors_page_test","TestContributorsPage","","","Verify href, status code of the 'All Team' link",""
"passed","Fri Sep 13 08:21:27 GMT 2024","Fri Sep 13 08:21:30 GMT 2024","2564","tests","used_resources_page_test","TestUsedResourcesPage","","","Verify that links in the sections lead to the correct pages after clicking",""
"passed","Fri Sep 13 08:07:40 GMT 2024","Fri Sep 13 08:07:41 GMT 2024","707","tests","contributors_page_test","TestContributorsPage","","","Verify clickability, href of links on the page",""
"failed","Fri Sep 13 08:14:21 GMT 2024","Fri Sep 13 08:14:29 GMT 2024","7165","tests","specialists_page_test","TestSpecialistsPage","","","Verify sizes of images in specialist cards in the grid",""
"passed","Fri Sep 13 08:12:09 GMT 2024","Fri Sep 13 08:12:13 GMT 2024","3323","tests","registration_page_test","TestRegistrationPage","","","Check registration with new email",""
"passed","Fri Sep 13 08:11:47 GMT 2024","Fri Sep 13 08:11:47 GMT 2024","102","tests","main_page_test","TestMainPage","","","Checking the clickability of the Start button.",""
"passed","Fri Sep 13 08:10:55 GMT 2024","Fri Sep 13 08:10:55 GMT 2024","56","tests","header_test","TestHeaderPage","","","Verify presence, visibility and attributes of the image in the 'Logo' link",""
"passed","Fri Sep 13 08:21:05 GMT 2024","Fri Sep 13 08:21:06 GMT 2024","780","tests","used_resources_page_test","TestUsedResourcesPage","","","Verify content of the text on the page",""
"passed","Fri Sep 13 08:11:33 GMT 2024","Fri Sep 13 08:11:35 GMT 2024","1394","tests","main_page_test","TestMainPage","","","Verify redirection to github not authorized user.",""
"broken","Fri Sep 13 08:10:47 GMT 2024","Fri Sep 13 08:10:47 GMT 2024","5","tests","header_test","TestHeaderPage","","","Verify the dropdown opens/closes after clicking on the 'More' button in the Header",""
"passed","Fri Sep 13 08:18:28 GMT 2024","Fri Sep 13 08:19:14 GMT 2024","46140","tests","Речевые упражнения.","TestCardsRU","","","Solutions to a random task in the ""Слова"" .",""
"passed","Fri Sep 13 08:13:33 GMT 2024","Fri Sep 13 08:13:33 GMT 2024","12","tests","specialists_page_test","TestSpecialistsPage","","","Verify value of the title of the tab",""
"passed","Fri Sep 13 08:07:02 GMT 2024","Fri Sep 13 08:07:02 GMT 2024","92","tests","contacts_page_test","TestContactsPage","","","Verify that the email link calls an email client",""
"passed","Fri Sep 13 08:13:58 GMT 2024","Fri Sep 13 08:13:58 GMT 2024","581","tests","specialists_page_test","TestSpecialistsPage","","","Verify clickability, href, status code of the 'All Specialists' link",""
"passed","Fri Sep 13 08:14:55 GMT 2024","Fri Sep 13 08:14:55 GMT 2024","71","tests","start_unauthorized_page_test","TestStartUnauthorizedPage","","","Verify content of the text in sections 1, 2",""
"passed","Fri Sep 13 08:21:36 GMT 2024","Fri Sep 13 08:21:37 GMT 2024","802","tests","used_resources_page_test","TestUsedResourcesPage","","","Verify presence, visibility and attributes of icons in sections",""
"passed","Fri Sep 13 08:14:40 GMT 2024","Fri Sep 13 08:14:40 GMT 2024","82","tests","start_unauthorized_page_test","TestStartUnauthorizedPage","","","Verify the composition and visibility of elements 
        on the 1st-3rd levels of nesting in the section 1",""
"passed","Fri Sep 13 08:12:30 GMT 2024","Fri Sep 13 08:12:31 GMT 2024","670","tests","registration_page_test","TestRegistrationPage","","","Check registration with new email and empty first name",""
"passed","Fri Sep 13 08:08:07 GMT 2024","Fri Sep 13 08:08:08 GMT 2024","1042","tests","description_page_test","TestDescriptionPage","","","Verify redirection to donate page not authorized user.",""
"passed","Fri Sep 13 08:10:51 GMT 2024","Fri Sep 13 08:10:51 GMT 2024","191","tests","header_test","TestHeaderPage","","","Verify switching of the 'ru' and 'en' buttons in the Header",""
"passed","Fri Sep 13 08:07:32 GMT 2024","Fri Sep 13 08:07:32 GMT 2024","374","tests","contributors_page_test","TestContributorsPage","","","Verify values of the text in card descriptions",""
"passed","Fri Sep 13 08:09:32 GMT 2024","Fri Sep 13 08:09:32 GMT 2024","31","tests","header_test","TestHeaderPage","","","Verify presence and visibility of the Header",""
"passed","Fri Sep 13 08:12:21 GMT 2024","Fri Sep 13 08:12:22 GMT 2024","678","tests","registration_page_test","TestRegistrationPage","","","Check registration with new email and empty confirm password",""
"passed","Fri Sep 13 08:08:15 GMT 2024","Fri Sep 13 08:08:16 GMT 2024","660","tests","description_page_test","TestDescriptionPage","","","Verify redirection to specialists page not authorized user.",""
"passed","Fri Sep 13 08:08:53 GMT 2024","Fri Sep 13 08:08:56 GMT 2024","2270","tests","footer_test","TestFooter","","","Verify clickability, href, prefix and subject, status code of links in the Footer",""
"passed","Fri Sep 13 08:08:38 GMT 2024","Fri Sep 13 08:08:38 GMT 2024","234","tests","footer_test","TestFooter","","","Verify composition and visibility of elements on the 1st-7th levels of nesting in the Footer",""
"passed","Fri Sep 13 08:15:11 GMT 2024","Fri Sep 13 08:15:11 GMT 2024","99","tests","start_unauthorized_page_test","TestStartUnauthorizedPage","","","Verify presence, visibility and attributes of the image in the section 1",""
"passed","Fri Sep 13 08:16:22 GMT 2024","Fri Sep 13 08:16:31 GMT 2024","8192","tests","Речевые упражнения.","TestCardsRU","","","Select random card from group ""Слова Королёвой"" and compare UI vs BACKEND data.",""
"passed","Fri Sep 13 08:10:21 GMT 2024","Fri Sep 13 08:10:26 GMT 2024","5128","tests","header_test","TestHeaderPage","","","Verify clickability, href, status code of links in the Header",""
"passed","Fri Sep 13 08:20:58 GMT 2024","Fri Sep 13 08:20:59 GMT 2024","780","tests","used_resources_page_test","TestUsedResourcesPage","","","Verify value of title with tag 'h1' on the page",""
"passed","Fri Sep 13 08:16:06 GMT 2024","Fri Sep 13 08:16:16 GMT 2024","9470","tests","Речевые упражнения.","TestCardsRU","","","Select random card from group ""Слова"" and compare UI vs BACKEND data.",""
"passed","Fri Sep 13 08:06:45 GMT 2024","Fri Sep 13 08:06:46 GMT 2024","29","tests","contacts_page_test","TestContactsPage","","","Verify text in links in the section 2",""
