"Status","Start Time","Stop Time","Duration in ms","Parent Suite","Suite","Sub Suite","Test Class","Test Method","Name","Description"
"passed","Fri Nov 22 21:06:06 GMT 2024","Fri Nov 22 21:06:06 GMT 2024","103","tests","contacts_page_test","TestContactsPage","","","Verify that the email link calls an email client",""
"passed","Fri Nov 22 21:21:13 GMT 2024","Fri Nov 22 21:21:17 GMT 2024","3722","tests","specialists_page_test","TestSpecialistsPage","","","Verify that the 'All Specialists' link leads an authorized user 
                         to the correct page after clicking",""
"passed","Fri Nov 22 21:18:15 GMT 2024","Fri Nov 22 21:18:16 GMT 2024","695","tests","main_page_test","TestMainPage","","","Verify redirection to specialists page not authorized user.",""
"passed","Fri Nov 22 21:22:12 GMT 2024","Fri Nov 22 21:22:12 GMT 2024","63","tests","start_unauthorized_page_test","TestStartUnauthorizedPage","","","Verify size of the image in the section 1",""
"passed","Fri Nov 22 21:10:37 GMT 2024","Fri Nov 22 21:10:45 GMT 2024","8174","tests","groups_page_test","TestGroupsPage","","","Verify value of the title of the tab",""
"skipped","Fri Nov 22 21:18:38 GMT 2024","Fri Nov 22 21:18:38 GMT 2024","0","tests","main_page_test","TestMainPage","","","Checking the ip is available",""
"skipped","Fri Nov 22 21:32:00 GMT 2024","Fri Nov 22 21:32:12 GMT 2024","12469","tests","Речевые упражнения.","TestCardsRU","","","Solutions to a random task in the ""Слова"" group and comparison of statics.",""
"passed","Fri Nov 22 21:06:26 GMT 2024","Fri Nov 22 21:06:26 GMT 2024","15","tests","contributors_page_test","TestContributorsPage","","","Verify value of the title of the tab",""
"passed","Fri Nov 22 21:18:07 GMT 2024","Fri Nov 22 21:18:08 GMT 2024","1135","tests","main_page_test","TestMainPage","","","Verify redirection to donate page not authorized user.",""
"passed","Fri Nov 22 21:08:23 GMT 2024","Fri Nov 22 21:08:23 GMT 2024","186","tests","description_page_test","TestDescriptionPage","","","Verify redirection to used resources page not authorized user.",""
"passed","Fri Nov 22 21:06:37 GMT 2024","Fri Nov 22 21:06:39 GMT 2024","1373","tests","contributors_page_test","TestContributorsPage","","","Verify values of the text in card descriptions",""
"passed","Fri Nov 22 21:08:34 GMT 2024","Fri Nov 22 21:08:34 GMT 2024","29","tests","exercises_ru_words_page_test","TestExercisesRuWordsPage","","","Verify presence and visibility of content on the page",""
"passed","Fri Nov 22 21:10:03 GMT 2024","Fri Nov 22 21:10:03 GMT 2024","29","tests","groups_page_test","TestGroupsPage","","","Verify presence and visibility of content on the page",""
"passed","Fri Nov 22 21:08:18 GMT 2024","Fri Nov 22 21:08:19 GMT 2024","701","tests","description_page_test","TestDescriptionPage","","","Verify redirection to contributors page not authorized user.",""
"passed","Fri Nov 22 21:33:14 GMT 2024","Fri Nov 22 21:33:14 GMT 2024","57","tests","used_resources_page_test","TestUsedResourcesPage","","","Verify presence, visibility and attributes of icons in sections",""
"passed","Fri Nov 22 21:10:55 GMT 2024","Fri Nov 22 21:11:11 GMT 2024","16392","tests","groups_page_test","TestGroupsPage","","","Verify value of the title and subtitles on the page",""
"passed","Fri Nov 22 21:19:30 GMT 2024","Fri Nov 22 21:19:31 GMT 2024","750","tests","registration_page_test","TestRegistrationPage","","","Check registration with new email and empty first name",""
"passed","Fri Nov 22 21:18:02 GMT 2024","Fri Nov 22 21:18:03 GMT 2024","1220","tests","main_page_test","TestMainPage","","","Verify redirection to telegram page not authorized user.",""
"passed","Fri Nov 22 21:13:22 GMT 2024","Fri Nov 22 21:13:33 GMT 2024","10229","tests","header_test","TestHeaderPage","","","Verify composition, visibility of elements on the 1st-6th levels of nesting in the Header
            for an unauthorized user",""
"passed","Fri Nov 22 21:05:30 GMT 2024","Fri Nov 22 21:05:30 GMT 2024","167","tests","contacts_page_test","TestContactsPage","","","Verify presence, visibility of sections, the dividing line and elements with text on the page",""
"passed","Fri Nov 22 21:12:23 GMT 2024","Fri Nov 22 21:12:41 GMT 2024","18270","tests","groups_page_test","TestGroupsPage","","","Verify if links on the 'en' local lead to correct pages after clicking",""
"passed","Fri Nov 22 21:06:46 GMT 2024","Fri Nov 22 21:06:47 GMT 2024","781","tests","contributors_page_test","TestContributorsPage","","","Verify clickability, href of links on the page",""
"passed","Fri Nov 22 21:09:34 GMT 2024","Fri Nov 22 21:09:34 GMT 2024","124","tests","footer_test","TestFooter","","","Verify sizes of images in links in the Footer",""
"passed","Fri Nov 22 21:07:09 GMT 2024","Fri Nov 22 21:07:12 GMT 2024","3386","tests","description_page_test","TestDescriptionPage","","","Verify redirection to telegram page not authorized user.",""
"passed","Fri Nov 22 21:14:07 GMT 2024","Fri Nov 22 21:14:07 GMT 2024","117","tests","header_test","TestHeaderPage","","","Verify that the 'Logo' link on the Start Unauthorized Page 
                             doesn't refresh the current page or lead to other pages after clicking",""
"passed","Fri Nov 22 21:15:11 GMT 2024","Fri Nov 22 21:15:11 GMT 2024","191","tests","header_test","TestHeaderPage","","","Verify values of the text in links, buttons in the Header for an authorized user",""
"passed","Fri Nov 22 21:20:48 GMT 2024","Fri Nov 22 21:20:49 GMT 2024","111","tests","specialists_page_test","TestSpecialistsPage","","","Verify values of names and professions in specialist cards in the grid",""
"passed","Fri Nov 22 21:08:05 GMT 2024","Fri Nov 22 21:08:05 GMT 2024","203","tests","description_page_test","TestDescriptionPage","","","Verify redirection to contacts page not authorized user.",""
"passed","Fri Nov 22 21:22:05 GMT 2024","Fri Nov 22 21:22:05 GMT 2024","177","tests","start_unauthorized_page_test","TestStartUnauthorizedPage","","","Verify that the 'Login' link leads to the correct page after clicking",""
"passed","Fri Nov 22 21:21:22 GMT 2024","Fri Nov 22 21:21:22 GMT 2024","113","tests","specialists_page_test","TestSpecialistsPage","","","Verify attributes of images in specialist cards in the grid",""
"passed","Fri Nov 22 21:18:41 GMT 2024","Fri Nov 22 21:18:58 GMT 2024","16824","tests","profile_page_test","TestProfilePage","","","Change the password by receiving an email link",""
"passed","Fri Nov 22 21:08:49 GMT 2024","Fri Nov 22 21:08:50 GMT 2024","54","tests","footer_test","TestFooter","","","Verify presence and visibility of the Footer",""
