"Status","Start Time","Stop Time","Duration in ms","Parent Suite","Suite","Sub Suite","Test Class","Test Method","Name","Description"
"passed","Fri Nov 22 21:18:37 GMT 2024","Fri Nov 22 21:18:38 GMT 2024","535","tests","main_page_test","TestMainPage","","","Checking the domain is available",""
"passed","Fri Nov 22 21:32:22 GMT 2024","Fri Nov 22 21:32:25 GMT 2024","3405","tests","Statistic.","TestCardsRU","","","Check statistic table.",""
"passed","Fri Nov 22 21:17:18 GMT 2024","Fri Nov 22 21:17:18 GMT 2024","41","tests","header_test","TestHeaderPage","","","Verify presence, visibility and attributes of the image in the 'Logo' link in the Header 
               for an authorized user",""
"passed","Fri Nov 22 21:19:39 GMT 2024","Fri Nov 22 21:19:39 GMT 2024","739","tests","registration_page_test","TestRegistrationPage","","","Check registration with new email and empty email",""
"passed","Fri Nov 22 21:17:58 GMT 2024","Fri Nov 22 21:17:58 GMT 2024","145","tests","main_page_test","TestMainPage","","","Verify redirection to description page not authorized user.",""
"passed","Fri Nov 22 21:05:50 GMT 2024","Fri Nov 22 21:05:50 GMT 2024","29","tests","contacts_page_test","TestContactsPage","","","Verify text in links in the section 2",""
"passed","Fri Nov 22 21:07:00 GMT 2024","Fri Nov 22 21:07:01 GMT 2024","1220","tests","contributors_page_test","TestContributorsPage","","","Verify sizes of images in contributor cards in grids",""
"passed","Fri Nov 22 21:20:13 GMT 2024","Fri Nov 22 21:20:13 GMT 2024","31","tests","specialists_page_test","TestSpecialistsPage","","","Verify presence and visibility of content on the page",""
"passed","Fri Nov 22 21:17:45 GMT 2024","Fri Nov 22 21:17:45 GMT 2024","59","tests","header_test","TestHeaderPage","","","Verify presence, visibility and attributes of the profile avatar in the Header 
               for an authorized user",""
"passed","Fri Nov 22 21:14:31 GMT 2024","Fri Nov 22 21:14:32 GMT 2024","28","tests","header_test","TestHeaderPage","","","Verify presence and visibility of the Header for an authorized user",""
"passed","Fri Nov 22 21:09:01 GMT 2024","Fri Nov 22 21:09:01 GMT 2024","70","tests","footer_test","TestFooter","","","Verify content of text in the Footer",""
"passed","Fri Nov 22 21:06:55 GMT 2024","Fri Nov 22 21:06:56 GMT 2024","828","tests","contributors_page_test","TestContributorsPage","","","Verify attribute values of images in contributors cards in grids",""
"passed","Fri Nov 22 21:14:22 GMT 2024","Fri Nov 22 21:14:22 GMT 2024","53","tests","header_test","TestHeaderPage","","","Verify size of the image in the 'Logo' link in the Header on the Start Unauthorized Page",""
"passed","Fri Nov 22 21:32:45 GMT 2024","Fri Nov 22 21:32:45 GMT 2024","33","tests","used_resources_page_test","TestUsedResourcesPage","","","Verify value of title with tag 'h1' on the page",""
"passed","Fri Nov 22 21:18:37 GMT 2024","Fri Nov 22 21:18:37 GMT 2024","168","tests","main_page_test","TestMainPage","","","Checking the clickability of the Registration button.",""
"skipped","Fri Nov 22 21:25:59 GMT 2024","Fri Nov 22 21:26:25 GMT 2024","26471","tests","Речевые упражнения.","TestCardsRU","","","Select a random card from ""Предложения"" group and compare UI vs BACKEND data.",""
"passed","Fri Nov 22 21:13:36 GMT 2024","Fri Nov 22 21:13:37 GMT 2024","367","tests","header_test","TestHeaderPage","","","Verify presence, visibility of links, buttons in the Header for an unauthorized user",""
"passed","Fri Nov 22 21:33:06 GMT 2024","Fri Nov 22 21:33:09 GMT 2024","2287","tests","used_resources_page_test","TestUsedResourcesPage","","","Verify that links in the sections lead to the correct pages after clicking",""
"passed","Fri Nov 22 21:11:56 GMT 2024","Fri Nov 22 21:12:14 GMT 2024","18373","tests","groups_page_test","TestGroupsPage","","","Verify if links on the 'ru' local lead to correct pages after clicking",""
"passed","Fri Nov 22 21:27:10 GMT 2024","Fri Nov 22 21:28:07 GMT 2024","56332","tests","Речевые упражнения.","TestCardsRU","","","Solutions to a random task in the ""Слова"" .",""
"passed","Fri Nov 22 21:23:50 GMT 2024","Fri Nov 22 21:24:12 GMT 2024","21916","tests","Речевые упражнения.","TestCardsRU","","","Select random card from group ""Слова"" and compare UI vs BACKEND data.",""
"passed","Fri Nov 22 21:20:58 GMT 2024","Fri Nov 22 21:20:59 GMT 2024","593","tests","specialists_page_test","TestSpecialistsPage","","","Verify clickability, href, status code of the 'All Specialists' link",""
"passed","Fri Nov 22 21:06:10 GMT 2024","Fri Nov 22 21:06:10 GMT 2024","39","tests","contributors_page_test","TestContributorsPage","","","Verify presence, visibility and structure of content on the page",""
"passed","Fri Nov 22 21:20:24 GMT 2024","Fri Nov 22 21:20:29 GMT 2024","5372","tests","specialists_page_test","TestSpecialistsPage","","","Verify presence, visibility of the title, text, link, grid, cards and images  
        on the 2nd, 3rd, 5th, 6th levels of nesting on the page",""
"skipped","Fri Nov 22 21:22:51 GMT 2024","Fri Nov 22 21:23:11 GMT 2024","20273","tests","Speech exercises EN.","TestCardsEN","","","Check progres-bar and buttons.",""
"passed","Fri Nov 22 21:05:45 GMT 2024","Fri Nov 22 21:05:45 GMT 2024","33","tests","contacts_page_test","TestContactsPage","","","Verify content of the text in the section 2",""
"passed","Fri Nov 22 21:18:33 GMT 2024","Fri Nov 22 21:18:33 GMT 2024","115","tests","main_page_test","TestMainPage","","","Checking the clickability of the Start button.",""
"passed","Fri Nov 22 21:08:09 GMT 2024","Fri Nov 22 21:08:09 GMT 2024","695","tests","description_page_test","TestDescriptionPage","","","Verify redirection to specialists page not authorized user.",""
"passed","Fri Nov 22 21:14:42 GMT 2024","Fri Nov 22 21:14:52 GMT 2024","10247","tests","header_test","TestHeaderPage","","","Verify composition, visibility of elements on the 1st-6th levels of nesting in the Header
            for an authorized user",""
"passed","Fri Nov 22 21:08:53 GMT 2024","Fri Nov 22 21:08:54 GMT 2024","257","tests","footer_test","TestFooter","","","Verify composition and visibility of elements on the 1st-7th levels of nesting in the Footer",""
"passed","Fri Nov 22 21:06:33 GMT 2024","Fri Nov 22 21:06:33 GMT 2024","19","tests","contributors_page_test","TestContributorsPage","","","Verify content of the text on the page",""
"passed","Fri Nov 22 21:17:36 GMT 2024","Fri Nov 22 21:17:36 GMT 2024","50","tests","header_test","TestHeaderPage","","","Verify presence, visibility, attributes of icons in the Header for an authorized user",""
"passed","Fri Nov 22 21:22:00 GMT 2024","Fri Nov 22 21:22:01 GMT 2024","506","tests","start_unauthorized_page_test","TestStartUnauthorizedPage","","","Verify presence, visibility, clickability, href, status code 
                         of the 'Login' link in the section 1",""
"passed","Fri Nov 22 21:14:11 GMT 2024","Fri Nov 22 21:14:11 GMT 2024","302","tests","header_test","TestHeaderPage","","","Verify the dropdown opens/closes after clicking on the 'More' button in the Header 
            on the Start Unauthorized Page",""
"passed","Fri Nov 22 21:19:16 GMT 2024","Fri Nov 22 21:19:17 GMT 2024","1299","tests","registration_page_test","TestRegistrationPage","","","Check registration with an existing email",""
"passed","Fri Nov 22 21:21:04 GMT 2024","Fri Nov 22 21:21:04 GMT 2024","628","tests","specialists_page_test","TestSpecialistsPage","","","Verify that the 'All Specialists' link leads an unauthorized user 
                         to the correct page after clicking",""
"passed","Fri Nov 22 21:21:53 GMT 2024","Fri Nov 22 21:21:53 GMT 2024","69","tests","start_unauthorized_page_test","TestStartUnauthorizedPage","","","Verify content of the text in sections 1, 2",""
"passed","Fri Nov 22 21:22:09 GMT 2024","Fri Nov 22 21:22:09 GMT 2024","95","tests","start_unauthorized_page_test","TestStartUnauthorizedPage","","","Verify presence, visibility and attributes of the image in the section 1",""
"passed","Fri Nov 22 21:32:30 GMT 2024","Fri Nov 22 21:32:30 GMT 2024","28","tests","used_resources_page_test","TestUsedResourcesPage","","","Verify presence and visibility of content on the page",""
"passed","Fri Nov 22 21:16:37 GMT 2024","Fri Nov 22 21:16:37 GMT 2024","120","tests","header_test","TestHeaderPage","","","Verify that the 'Logo' link on the Start Authorized Page 
                             doesn't refresh the current page or lead to other pages after clicking",""
"passed","Fri Nov 22 21:21:49 GMT 2024","Fri Nov 22 21:21:49 GMT 2024","51","tests","start_unauthorized_page_test","TestStartUnauthorizedPage","","","Verify values of titles and subtitles with tags h2, h4 on the page",""
"passed","Fri Nov 22 21:05:25 GMT 2024","Fri Nov 22 21:05:25 GMT 2024","137","tests","contacts_page_test","TestContactsPage","","","Verify the composition and visibility of elements 
        on the 1st-5th levels of nesting in the section 2",""
"passed","Fri Nov 22 21:32:35 GMT 2024","Fri Nov 22 21:32:35 GMT 2024","126","tests","used_resources_page_test","TestUsedResourcesPage","","","Verify the composition and visibility of elements 
        on the 1st-4th levels of nesting on the page",""
"passed","Fri Nov 22 21:05:15 GMT 2024","Fri Nov 22 21:05:15 GMT 2024","29","tests","contacts_page_test","TestContactsPage","","","Verify presence and visibility of content on the page",""
"passed","Fri Nov 22 21:05:40 GMT 2024","Fri Nov 22 21:05:40 GMT 2024","51","tests","contacts_page_test","TestContactsPage","","","Verify values of the title and subtitles with tags h1, h2 on the page",""
"passed","Fri Nov 22 21:16:48 GMT 2024","Fri Nov 22 21:16:48 GMT 2024","251","tests","header_test","TestHeaderPage","","","Verify the dropdown opens/closes after clicking on the 'More' button in the Header 
               for an authorized user",""
"passed","Fri Nov 22 21:21:27 GMT 2024","Fri Nov 22 21:21:27 GMT 2024","159","tests","specialists_page_test","TestSpecialistsPage","","","Verify sizes of images in specialist cards in the grid",""
"passed","Fri Nov 22 21:07:16 GMT 2024","Fri Nov 22 21:08:01 GMT 2024","45551","tests","description_page_test","TestDescriptionPage","","","Verify redirection to donate page not authorized user.",""
"passed","Fri Nov 22 21:16:01 GMT 2024","Fri Nov 22 21:16:15 GMT 2024","14049","tests","header_test","TestHeaderPage","","","Verify if internal links in the Header for an authorized user 
            lead to correct pages after click",""
"passed","Fri Nov 22 21:19:34 GMT 2024","Fri Nov 22 21:19:35 GMT 2024","773","tests","registration_page_test","TestRegistrationPage","","","Check registration with new email and empty birthday",""
"skipped","Fri Nov 22 21:26:35 GMT 2024","Fri Nov 22 21:27:01 GMT 2024","26614","tests","Речевые упражнения.","TestCardsRU","","","Select a random card from ""Слова с частотной группировкой"" group and compare UI vs BACKEND data.",""
"passed","Fri Nov 22 21:20:18 GMT 2024","Fri Nov 22 21:20:19 GMT 2024","350","tests","specialists_page_test","TestSpecialistsPage","","","Verify the composition and visibility of elements 
        on the 1st-6th levels of nesting on the page",""
"passed","Fri Nov 22 21:32:40 GMT 2024","Fri Nov 22 21:32:40 GMT 2024","12","tests","used_resources_page_test","TestUsedResourcesPage","","","Verify value of the title of the tab",""
"passed","Fri Nov 22 21:08:13 GMT 2024","Fri Nov 22 21:08:15 GMT 2024","1706","tests","description_page_test","TestDescriptionPage","","","Verify redirection to github not authorized user.",""
"passed","Fri Nov 22 21:21:38 GMT 2024","Fri Nov 22 21:21:38 GMT 2024","94","tests","start_unauthorized_page_test","TestStartUnauthorizedPage","","","Verify the composition and visibility of elements 
        on the 1st-3rd levels of nesting in the section 1",""
"passed","Fri Nov 22 21:08:45 GMT 2024","Fri Nov 22 21:08:46 GMT 2024","291","tests","exercises_ru_words_page_test","TestExercisesRuWordsPage","","","Verify composition, visibility of elements on the 1st-6th levels of nesting on the page",""
"passed","Fri Nov 22 21:05:09 GMT 2024","Fri Nov 22 21:05:10 GMT 2024","966","tests","authorisation_page_test","TestAuthorizedUserPage","","","Checking the possibility of authorization with incorrect data",""
"passed","Fri Nov 22 21:20:34 GMT 2024","Fri Nov 22 21:20:34 GMT 2024","14","tests","specialists_page_test","TestSpecialistsPage","","","Verify value of the title of the tab",""
"passed","Fri Nov 22 21:06:30 GMT 2024","Fri Nov 22 21:06:30 GMT 2024","43","tests","contributors_page_test","TestContributorsPage","","","Verify values of title and subtitles with tags h2, h3 on the page",""
"passed","Fri Nov 22 21:15:01 GMT 2024","Fri Nov 22 21:15:02 GMT 2024","382","tests","header_test","TestHeaderPage","","","Verify presence, visibility of links, buttons in the Header for an authorized user",""
"passed","Fri Nov 22 21:09:09 GMT 2024","Fri Nov 22 21:09:11 GMT 2024","2644","tests","footer_test","TestFooter","","","Verify clickability, href, prefix and subject, status code of links in the Footer",""
"passed","Fri Nov 22 21:14:15 GMT 2024","Fri Nov 22 21:14:15 GMT 2024","212","tests","header_test","TestHeaderPage","","","Verify switching of the 'ru', 'en' buttons in the Header on the Start Unauthorized Page",""
"passed","Fri Nov 22 21:20:53 GMT 2024","Fri Nov 22 21:20:53 GMT 2024","47","tests","specialists_page_test","TestSpecialistsPage","","","Verify text in the 'All Specialists' link",""
"passed","Fri Nov 22 21:21:34 GMT 2024","Fri Nov 22 21:21:34 GMT 2024","33","tests","start_unauthorized_page_test","TestStartUnauthorizedPage","","","Verify amount and visibility of sections with content on the page",""
"passed","Fri Nov 22 21:32:55 GMT 2024","Fri Nov 22 21:32:55 GMT 2024","30","tests","used_resources_page_test","TestUsedResourcesPage","","","Verify text in links in sections",""
"passed","Fri Nov 22 21:18:20 GMT 2024","Fri Nov 22 21:18:21 GMT 2024","1375","tests","main_page_test","TestMainPage","","","Verify redirection to github not authorized user.",""
"passed","Fri Nov 22 21:12:51 GMT 2024","Fri Nov 22 21:12:59 GMT 2024","8221","tests","groups_page_test","TestGroupsPage","","","Verify attributes of images in links on the page",""
"passed","Fri Nov 22 21:06:00 GMT 2024","Fri Nov 22 21:06:01 GMT 2024","1271","tests","contacts_page_test","TestContactsPage","","","Verify if links in the section 2 lead to the correct pages after clicking",""
"passed","Fri Nov 22 21:33:00 GMT 2024","Fri Nov 22 21:33:01 GMT 2024","1461","tests","used_resources_page_test","TestUsedResourcesPage","","","Verify presence, visibility, clickability, href, status code of links in sections",""
"passed","Fri Nov 22 21:21:46 GMT 2024","Fri Nov 22 21:21:46 GMT 2024","14","tests","start_unauthorized_page_test","TestStartUnauthorizedPage","","","Verify value of the title of the tab",""
"passed","Fri Nov 22 21:16:25 GMT 2024","Fri Nov 22 21:16:27 GMT 2024","1967","tests","header_test","TestHeaderPage","","","Verify if external links in the Header for an authorized user 
            lead to correct pages after click",""
"passed","Fri Nov 22 21:19:43 GMT 2024","Fri Nov 22 21:19:44 GMT 2024","726","tests","registration_page_test","TestRegistrationPage","","","Check registration without choosing gender",""
"passed","Fri Nov 22 21:09:05 GMT 2024","Fri Nov 22 21:09:05 GMT 2024","48","tests","footer_test","TestFooter","","","Verify text in the 'Contact us' link in the Footer",""
"passed","Fri Nov 22 21:20:39 GMT 2024","Fri Nov 22 21:20:39 GMT 2024","35","tests","specialists_page_test","TestSpecialistsPage","","","Verify value of title with tag 'h2' on the page",""
"passed","Fri Nov 22 21:14:19 GMT 2024","Fri Nov 22 21:14:19 GMT 2024","57","tests","header_test","TestHeaderPage","","","Verify presence, visibility and attributes of the image in the 'Logo' link in the Header 
               on the Start Unauthorized Page",""
"passed","Fri Nov 22 21:28:16 GMT 2024","Fri Nov 22 21:31:51 GMT 2024","214906","tests","Речевые упражнения.","TestCardsRU","","","Solutions to a random task in the ""Слова Королёвой"" .",""
"passed","Fri Nov 22 21:15:30 GMT 2024","Fri Nov 22 21:15:52 GMT 2024","22591","tests","header_test","TestHeaderPage","","","Verify clickability, href, status code of links in the Header for an authorized user",""
"passed","Fri Nov 22 21:20:44 GMT 2024","Fri Nov 22 21:20:44 GMT 2024","37","tests","specialists_page_test","TestSpecialistsPage","","","Verify value of text on the page",""
"passed","Fri Nov 22 21:14:02 GMT 2024","Fri Nov 22 21:14:03 GMT 2024","1850","tests","header_test","TestHeaderPage","","","Verify if external links in the Header for an unauthorized user 
            lead to correct pages after click",""
"passed","Fri Nov 22 21:21:42 GMT 2024","Fri Nov 22 21:21:42 GMT 2024","128","tests","start_unauthorized_page_test","TestStartUnauthorizedPage","","","Verify the composition and visibility of elements 
        on the 1st-3rd levels of nesting in the section 2",""
"passed","Fri Nov 22 21:17:54 GMT 2024","Fri Nov 22 21:17:54 GMT 2024","3","tests","login_page_test","TestLoginPage","","","Test for authorization customer.",""
"passed","Fri Nov 22 21:15:20 GMT 2024","Fri Nov 22 21:15:21 GMT 2024","28","tests","header_test","TestHeaderPage","","","Verify presence, visibility of the user name in the Header for an authorized user",""
"passed","Fri Nov 22 21:05:35 GMT 2024","Fri Nov 22 21:05:35 GMT 2024","12","tests","contacts_page_test","TestContactsPage","","","Verify value of the title of the tab",""
"passed","Fri Nov 22 21:06:51 GMT 2024","Fri Nov 22 21:06:52 GMT 2024","741","tests","contributors_page_test","TestContributorsPage","","","Verify href, status code of the 'All Team' link",""
"passed","Fri Nov 22 21:33:18 GMT 2024","Fri Nov 22 21:33:19 GMT 2024","78","tests","used_resources_page_test","TestUsedResourcesPage","","","Verify sizes of icons in sections",""
"passed","Fri Nov 22 21:06:19 GMT 2024","Fri Nov 22 21:06:23 GMT 2024","3717","tests","contributors_page_test","TestContributorsPage","","","Verify presence, visibility of titles/subtitles, cards, descriptions, links, images on the page",""
"passed","Fri Nov 22 21:17:27 GMT 2024","Fri Nov 22 21:17:27 GMT 2024","54","tests","header_test","TestHeaderPage","","","Verify size of the image in the 'Logo' link in the Header for an authorized user",""
"passed","Fri Nov 22 21:05:20 GMT 2024","Fri Nov 22 21:05:20 GMT 2024","23","tests","contacts_page_test","TestContactsPage","","","Verify the composition and visibility of elements on the 1st level of nesting in the section 1",""
"passed","Fri Nov 22 21:25:26 GMT 2024","Fri Nov 22 21:25:50 GMT 2024","23740","tests","Речевые упражнения.","TestCardsRU","","","Select a random card from ""Группа слов"" group and compare UI vs BACKEND data.",""
"passed","Fri Nov 22 21:21:57 GMT 2024","Fri Nov 22 21:21:57 GMT 2024","54","tests","start_unauthorized_page_test","TestStartUnauthorizedPage","","","Verify text in the 'Login' link in the section 1",""
"passed","Fri Nov 22 21:18:29 GMT 2024","Fri Nov 22 21:18:30 GMT 2024","219","tests","main_page_test","TestMainPage","","","Verify redirection to used resources page not authorized user.",""
"passed","Fri Nov 22 21:09:15 GMT 2024","Fri Nov 22 21:09:23 GMT 2024","7928","tests","footer_test","TestFooter","","","Verify that links in the Footer lead to correct pages after clicking",""
"passed","Fri Nov 22 21:05:54 GMT 2024","Fri Nov 22 21:05:55 GMT 2024","792","tests","contacts_page_test","TestContactsPage","","","Verify presence, visibility, clickability, href, prefix, status code of links in the section 2",""
"passed","Fri Nov 22 21:13:53 GMT 2024","Fri Nov 22 21:13:58 GMT 2024","4918","tests","header_test","TestHeaderPage","","","Verify if internal links in the Header for an unauthorized user 
            lead to correct pages after click",""
"passed","Fri Nov 22 21:18:25 GMT 2024","Fri Nov 22 21:18:26 GMT 2024","693","tests","main_page_test","TestMainPage","","","Verify redirection to contributors page not authorized user.",""
"passed","Fri Nov 22 21:08:57 GMT 2024","Fri Nov 22 21:08:57 GMT 2024","152","tests","footer_test","TestFooter","","","Verify presence, visibility of text, links, images in the Footer",""
"passed","Fri Nov 22 21:13:44 GMT 2024","Fri Nov 22 21:13:49 GMT 2024","4876","tests","header_test","TestHeaderPage","","","Verify clickability, href, status code of links in the Header for an unauthorized user",""
"passed","Fri Nov 22 21:13:40 GMT 2024","Fri Nov 22 21:13:41 GMT 2024","219","tests","header_test","TestHeaderPage","","","Verify values of the text in links, buttons in the Header for an unauthorized user",""
"skipped","Fri Nov 22 21:23:20 GMT 2024","Fri Nov 22 21:23:41 GMT 2024","20314","tests","Speech exercises EN.","TestCardsEN","","","Select a random card from ""Similar phrases"" group and compare UI vs BACKEND data",""
"passed","Fri Nov 22 21:24:54 GMT 2024","Fri Nov 22 21:25:17 GMT 2024","22752","tests","Речевые упражнения.","TestCardsRU","","","Select a random card from ""Похожие фразы"" group and compare UI vs BACKEND data.",""
"passed","Fri Nov 22 21:19:48 GMT 2024","Fri Nov 22 21:20:08 GMT 2024","20809","tests","registration_page_test","TestRegistrationPage","","","Check registration without choosing agreement",""
"passed","Fri Nov 22 21:16:57 GMT 2024","Fri Nov 22 21:16:57 GMT 2024","192","tests","header_test","TestHeaderPage","","","Verify switching of the 'ru', 'en' buttons in the Header for an authorized user",""
"passed","Fri Nov 22 21:19:21 GMT 2024","Fri Nov 22 21:19:22 GMT 2024","752","tests","registration_page_test","TestRegistrationPage","","","Check registration with new email and empty confirm password",""
"passed","Fri Nov 22 21:09:26 GMT 2024","Fri Nov 22 21:09:27 GMT 2024","118","tests","footer_test","TestFooter","","","Verify that the 'Contact us' link in the Footer calls an email client",""
"passed","Fri Nov 22 21:09:30 GMT 2024","Fri Nov 22 21:09:30 GMT 2024","95","tests","footer_test","TestFooter","","","Verify attributes of images in links in the Footer",""
"passed","Fri Nov 22 21:10:25 GMT 2024","Fri Nov 22 21:10:28 GMT 2024","3134","tests","groups_page_test","TestGroupsPage","","","Verify presence, visibility of the title, tiles, links, images, subtitles on the page",""
"passed","Fri Nov 22 21:13:19 GMT 2024","Fri Nov 22 21:13:19 GMT 2024","35","tests","header_test","TestHeaderPage","","","Verify presence and visibility of the Header for an unauthorized user",""
"passed","Fri Nov 22 21:06:14 GMT 2024","Fri Nov 22 21:06:15 GMT 2024","1710","tests","contributors_page_test","TestContributorsPage","","","Verify the composition and visibility of elements 
        on the 1st-5th levels of nesting on the page",""
"passed","Fri Nov 22 21:32:50 GMT 2024","Fri Nov 22 21:32:50 GMT 2024","33","tests","used_resources_page_test","TestUsedResourcesPage","","","Verify content of the text on the page",""
"passed","Fri Nov 22 21:24:22 GMT 2024","Fri Nov 22 21:24:45 GMT 2024","22798","tests","Речевые упражнения.","TestCardsRU","","","Select random card from group ""Слова Королёвой"" and compare UI vs BACKEND data.",""
"skipped","Fri Nov 22 21:22:22 GMT 2024","Fri Nov 22 21:22:42 GMT 2024","20317","tests","Speech exercises EN.","TestCardsEN","","","Select random card from ""Word"" group and compare UI vs BACKEND data",""
"passed","Fri Nov 22 21:05:04 GMT 2024","Fri Nov 22 21:05:06 GMT 2024","1161","tests","authorisation_page_test","TestAuthorizedUserPage","","","Checking the possibility of authorization with the correct data",""
"passed","Fri Nov 22 21:06:42 GMT 2024","Fri Nov 22 21:06:43 GMT 2024","419","tests","contributors_page_test","TestContributorsPage","","","Verify text in card links and the 'All Team' link",""
"passed","Fri Nov 22 21:19:26 GMT 2024","Fri Nov 22 21:19:26 GMT 2024","793","tests","registration_page_test","TestRegistrationPage","","","Check registration with new email and empty password",""
"passed","Fri Nov 22 21:10:12 GMT 2024","Fri Nov 22 21:10:15 GMT 2024","3174","tests","groups_page_test","TestGroupsPage","","","Verify composition, visibility of elements on the 1st-6th levels of nesting on the page",""
"passed","Fri Nov 22 21:19:02 GMT 2024","Fri Nov 22 21:19:12 GMT 2024","10372","tests","registration_page_test","TestRegistrationPage","","","Check registration with new email",""
"passed","Fri Nov 22 21:11:20 GMT 2024","Fri Nov 22 21:11:47 GMT 2024","26564","tests","groups_page_test","TestGroupsPage","","","Verify clickability, title, href, status code of links on the page",""
"passed","Fri Nov 22 21:09:43 GMT 2024","Fri Nov 22 21:09:54 GMT 2024","10315","tests","footer_test","TestFooter","","","Verify Footer invisibility through the modal window with the exercise",""
"passed","Fri Nov 22 21:13:09 GMT 2024","Fri Nov 22 21:13:15 GMT 2024","6065","tests","groups_page_test","TestGroupsPage","","","Verify sizes of images in links on the page",""
"passed","Fri Nov 22 21:07:05 GMT 2024","Fri Nov 22 21:07:05 GMT 2024","165","tests","description_page_test","TestDescriptionPage","","","Verify return main page from description page.",""
"passed","Fri Nov 22 21:17:08 GMT 2024","Fri Nov 22 21:17:08 GMT 2024","419","tests","header_test","TestHeaderPage","","","Verify user logout after clicking the 'Logout' button in the Header for an authorized user",""
"passed","Fri Nov 22 21:21:31 GMT 2024","Fri Nov 22 21:21:31 GMT 2024","36","tests","start_unauthorized_page_test","TestStartUnauthorizedPage","","","Verify presence and visibility of content on the page",""
"passed","Fri Nov 22 21:18:12 GMT 2024","Fri Nov 22 21:18:12 GMT 2024","208","tests","main_page_test","TestMainPage","","","Verify redirection to contacts page not authorized user.",""
