"Status","Start Time","Stop Time","Duration in ms","Parent Suite","Suite","Sub Suite","Test Class","Test Method","Name","Description"
"passed","Tue Jun 11 10:12:05 GMT 2024","Tue Jun 11 10:12:09 GMT 2024","3147","tests","footer_test","TestFooter","","","Verify accuracy of texts in Footer on each page specified in the kit",""
"passed","Tue Jun 11 10:15:53 GMT 2024","Tue Jun 11 10:15:53 GMT 2024","3","tests","login_page_test","TestLoginPage","","","Test for authorization customer.",""
"passed","Tue Jun 11 10:21:14 GMT 2024","Tue Jun 11 10:21:23 GMT 2024","8592","tests","Речевые упражнения.","TestCardsRU","","","Select random card from group ""Слова Королёвой"" and compare UI vs BACKEND data.",""
"passed","Tue Jun 11 10:26:20 GMT 2024","Tue Jun 11 10:26:21 GMT 2024","831","tests","used_resources_page_test","TestUsedResourcesPage","","","Verify sizes of icons in the sections",""
"passed","Tue Jun 11 10:14:25 GMT 2024","Tue Jun 11 10:14:25 GMT 2024","81","tests","footer_test","TestFooter","","","Verify changes of visible sizes of the EPAM link's image in Footer",""
"passed","Tue Jun 11 10:17:20 GMT 2024","Tue Jun 11 10:17:20 GMT 2024","633","tests","registration_page_test","TestRegistrationPage","","","Check registration with new email and empty first name",""
"passed","Tue Jun 11 10:18:08 GMT 2024","Tue Jun 11 10:18:08 GMT 2024","57","tests","specialists_page_test","TestSpecialistsPage","","","Verify presence, visibility and content accuracy of the text on the Specialists page",""
"passed","Tue Jun 11 10:12:51 GMT 2024","Tue Jun 11 10:12:53 GMT 2024","2334","tests","footer_test","TestFooter","","","Verify that the ARASAAC link in Footer leads to the correct page after click",""
"passed","Tue Jun 11 10:10:12 GMT 2024","Tue Jun 11 10:10:12 GMT 2024","27","tests","contributors_page_test","TestContributorsPage","","","Verify values of subtitles with tag 'h3' on the page",""
"passed","Tue Jun 11 10:20:10 GMT 2024","Tue Jun 11 10:20:21 GMT 2024","10315","tests","Speech exercises EN.","TestCardsEN","","","Select random card from ""Word"" group and compare UI vs BACKEND data",""
"passed","Tue Jun 11 10:10:29 GMT 2024","Tue Jun 11 10:10:30 GMT 2024","1070","tests","contributors_page_test","TestContributorsPage","","","Verify presence, visibility, clickability, href of links in the section",""
"passed","Tue Jun 11 10:12:26 GMT 2024","Tue Jun 11 10:12:27 GMT 2024","1334","tests","footer_test","TestFooter","","","Verify presence, visibility, clickability, href, status code of the REG.RU link in Footer",""
"passed","Tue Jun 11 10:15:18 GMT 2024","Tue Jun 11 10:15:18 GMT 2024","904","tests","header_test","TestHeaderPage","","","Verify presence, visibility, clickability, href, status code  
                             of the 'Logo' link in the section 1 in the Header",""
"passed","Tue Jun 11 10:14:45 GMT 2024","Tue Jun 11 10:14:45 GMT 2024","46","tests","footer_test","TestFooter","","","Verify visible sizes of the REG.RU link's image in Footer",""
"passed","Tue Jun 11 10:15:47 GMT 2024","Tue Jun 11 10:15:47 GMT 2024","24","tests","header_test","TestHeaderPage","","","Verify values of the text in the 'About' and the 'Telegram' links 
                          in the Section 2 in the Header",""
"passed","Tue Jun 11 10:08:57 GMT 2024","Tue Jun 11 10:08:57 GMT 2024","19","tests","contacts_page_test","TestContactsPage","","","Verify amount and visibility of sections with content on the page",""
"passed","Tue Jun 11 10:22:01 GMT 2024","Tue Jun 11 10:22:13 GMT 2024","11949","tests","Речевые упражнения.","TestCardsRU","","","Select a random card from ""Предложения"" group and compare UI vs BACKEND data.",""
"passed","Tue Jun 11 10:20:04 GMT 2024","Tue Jun 11 10:20:04 GMT 2024","120","tests","start_unauthorized_page_test","TestStartUnauthorizedPage","","","Verify that the 'Login' link leads to the correct page after clicking",""
"passed","Tue Jun 11 10:11:41 GMT 2024","Tue Jun 11 10:11:44 GMT 2024","3185","tests","footer_test","TestFooter","","","Verify presence and visibility of Footer on each page specified in the kit",""
"passed","Tue Jun 11 10:26:13 GMT 2024","Tue Jun 11 10:26:14 GMT 2024","823","tests","used_resources_page_test","TestUsedResourcesPage","","","Verify presence, visibility and attributes of icons in the sections",""
"passed","Tue Jun 11 10:23:55 GMT 2024","Tue Jun 11 10:23:56 GMT 2024","1352","tests","Statistic.","TestCardsRU","","","Check statistic table.",""
"passed","Tue Jun 11 10:14:29 GMT 2024","Tue Jun 11 10:14:29 GMT 2024","72","tests","footer_test","TestFooter","","","Verify presence, visibility and accuracy of the JETBRAINS link's image in Footer",""
"passed","Tue Jun 11 10:12:57 GMT 2024","Tue Jun 11 10:13:03 GMT 2024","5250","tests","footer_test","TestFooter","","","Verify that the EPAM link in Footer leads to the correct page after click",""
"passed","Tue Jun 11 10:11:28 GMT 2024","Tue Jun 11 10:11:31 GMT 2024","3090","tests","footer_test","TestFooter","","","Verify presence and visibility of Footer on each page specified in the kit",""
"passed","Tue Jun 11 10:19:35 GMT 2024","Tue Jun 11 10:19:35 GMT 2024","96","tests","start_unauthorized_page_test","TestStartUnauthorizedPage","","","Verify the composition and visibility of elements 
        on the 1st, 2nd, 3rd levels of nesting in the section 2",""
"passed","Tue Jun 11 10:17:10 GMT 2024","Tue Jun 11 10:17:11 GMT 2024","620","tests","registration_page_test","TestRegistrationPage","","","Check registration with new email and empty confirm password",""
"skipped","Tue Jun 11 10:23:42 GMT 2024","Tue Jun 11 10:23:48 GMT 2024","5879","tests","Речевые упражнения.","TestCardsRU","","","Solutions to a random task in the ""Слова"" group and comparison of statics.",""
"passed","Tue Jun 11 10:24:17 GMT 2024","Tue Jun 11 10:24:17 GMT 2024","798","tests","used_resources_page_test","TestUsedResourcesPage","","","Verify presence and visibility of the section with links on the page",""
"passed","Tue Jun 11 10:15:36 GMT 2024","Tue Jun 11 10:15:37 GMT 2024","1228","tests","header_test","TestHeaderPage","","","Verify presence, visibility, clickability, href, status code of the 'About' and the 'Telegram' links in the Section 2 in the Header",""
"passed","Tue Jun 11 10:08:52 GMT 2024","Tue Jun 11 10:08:52 GMT 2024","55","tests","contacts_page_test","TestContactsPage","","","Verify presence, visibility and structure of content on the page",""
"passed","Tue Jun 11 10:15:41 GMT 2024","Tue Jun 11 10:15:43 GMT 2024","1475","tests","header_test","TestHeaderPage","","","Verify if the 'About' and the 'Telegram' links in the Section 2 
                          lead to the correct pages after click",""
"passed","Tue Jun 11 10:12:01 GMT 2024","Tue Jun 11 10:12:04 GMT 2024","3175","tests","footer_test","TestFooter","","","Verify accuracy of texts in Footer on each page specified in the kit",""
"passed","Tue Jun 11 10:15:22 GMT 2024","Tue Jun 11 10:15:23 GMT 2024","99","tests","header_test","TestHeaderPage","","","Verify that the 'Logo' link on the Start Unauthorized Page 
                             doesn't refresh the current page or lead to other pages after clicking",""
