"Status","Start Time","Stop Time","Duration in ms","Parent Suite","Suite","Sub Suite","Test Class","Test Method","Name","Description"
"passed","Tue Jun 11 10:10:16 GMT 2024","Tue Jun 11 10:10:16 GMT 2024","17","tests","contributors_page_test","TestContributorsPage","","","Verify values of the text in the slogan on the page",""
"passed","Tue Jun 11 10:09:43 GMT 2024","Tue Jun 11 10:09:45 GMT 2024","1556","tests","contacts_page_test","TestContactsPage","","","Verify that links in sections 1, 2 lead to the correct pages after click",""
"passed","Tue Jun 11 10:16:20 GMT 2024","Tue Jun 11 10:16:21 GMT 2024","1268","tests","main_page_test","TestMainPage","","","Verify redirection to github not authorized user.",""
"passed","Tue Jun 11 10:21:45 GMT 2024","Tue Jun 11 10:21:55 GMT 2024","9369","tests","Речевые упражнения.","TestCardsRU","","","Select a random card from ""Группа слов"" group and compare UI vs BACKEND data.",""
"passed","Tue Jun 11 10:11:49 GMT 2024","Tue Jun 11 10:11:52 GMT 2024","3184","tests","footer_test","TestFooter","","","Verify presence and visibility of Footer on each page specified in the kit",""
"passed","Tue Jun 11 10:09:18 GMT 2024","Tue Jun 11 10:09:18 GMT 2024","32","tests","contacts_page_test","TestContactsPage","","","Verify value of title with tag 'h1' on the page",""
"passed","Tue Jun 11 10:09:57 GMT 2024","Tue Jun 11 10:10:00 GMT 2024","2823","tests","contributors_page_test","TestContributorsPage","","","Verify the composition and visibility of elements on the 1st, 2nd, 3rd, 4th levels of nesting in the section",""
"passed","Tue Jun 11 10:12:13 GMT 2024","Tue Jun 11 10:12:14 GMT 2024","795","tests","footer_test","TestFooter","","","Verify presence, visibility, clickability, href, status code of the ARASAAC link in Footer",""
"passed","Tue Jun 11 10:11:36 GMT 2024","Tue Jun 11 10:11:40 GMT 2024","3489","tests","footer_test","TestFooter","","","Verify presence and visibility of Footer on each page specified in the kit",""
"passed","Tue Jun 11 10:19:47 GMT 2024","Tue Jun 11 10:19:47 GMT 2024","38","tests","start_unauthorized_page_test","TestStartUnauthorizedPage","","","Verify values of the text in the section 1 on the page",""
"passed","Tue Jun 11 10:09:49 GMT 2024","Tue Jun 11 10:09:49 GMT 2024","74","tests","contributors_page_test","TestContributorsPage","","","Verify presence, visibility and structure of content on the page",""
"passed","Tue Jun 11 10:14:53 GMT 2024","Tue Jun 11 10:14:53 GMT 2024","66","tests","footer_test","TestFooter","","","Verify presence, visibility and accuracy of the Selectel link's image in Footer",""
"passed","Tue Jun 11 10:24:02 GMT 2024","Tue Jun 11 10:24:03 GMT 2024","796","tests","used_resources_page_test","TestUsedResourcesPage","","","Verify presence, visibility and text accuracy of the title on the page",""
"passed","Tue Jun 11 10:23:13 GMT 2024","Tue Jun 11 10:23:36 GMT 2024","23194","tests","Речевые упражнения.","TestCardsRU","","","Solutions to a random task in the ""Слова Королёвой"" .",""
"passed","Tue Jun 11 10:15:09 GMT 2024","Tue Jun 11 10:15:10 GMT 2024","280","tests","header_test","TestHeaderPage","","","Verify the composition and visibility of elements on the 1-6th levels of the Header",""
"passed","Tue Jun 11 10:18:03 GMT 2024","Tue Jun 11 10:18:03 GMT 2024","55","tests","specialists_page_test","TestSpecialistsPage","","","Verify presence, visibility and text accuracy of the title on the Specialists page",""
"passed","Tue Jun 11 10:09:32 GMT 2024","Tue Jun 11 10:09:33 GMT 2024","30","tests","contacts_page_test","TestContactsPage","","","Verify values of the text in links in sections 1, 2 on the page",""
"passed","Tue Jun 11 10:24:09 GMT 2024","Tue Jun 11 10:24:10 GMT 2024","792","tests","used_resources_page_test","TestUsedResourcesPage","","","Verify presence, visibility and content accuracy of the text on the page",""
"passed","Tue Jun 11 10:09:28 GMT 2024","Tue Jun 11 10:09:28 GMT 2024","29","tests","contacts_page_test","TestContactsPage","","","Verify values of the text in sections 1, 2 on the page",""
"passed","Tue Jun 11 10:09:53 GMT 2024","Tue Jun 11 10:09:53 GMT 2024","23","tests","contributors_page_test","TestContributorsPage","","","Verify amount and visibility of sections with content on the page",""
"passed","Tue Jun 11 10:10:34 GMT 2024","Tue Jun 11 10:10:35 GMT 2024","658","tests","contributors_page_test","TestContributorsPage","","","Verify href, status code, text of the 'All Team' link on the page",""
"passed","Tue Jun 11 10:19:51 GMT 2024","Tue Jun 11 10:19:51 GMT 2024","34","tests","start_unauthorized_page_test","TestStartUnauthorizedPage","","","Verify values of the text in the section 2 on the page",""
"passed","Tue Jun 11 10:14:09 GMT 2024","Tue Jun 11 10:14:09 GMT 2024","46","tests","footer_test","TestFooter","","","Verify visible sizes of the ARASAAC link's image in Footer",""
"passed","Tue Jun 11 10:08:41 GMT 2024","Tue Jun 11 10:08:42 GMT 2024","969","tests","authorisation_page_test","TestAuthorizedUserPage","","","Checking the possibility of authorization with the correct data",""
"passed","Tue Jun 11 10:17:34 GMT 2024","Tue Jun 11 10:17:34 GMT 2024","573","tests","registration_page_test","TestRegistrationPage","","","Check registration without choosing gender",""
"passed","Tue Jun 11 10:25:13 GMT 2024","Tue Jun 11 10:25:13 GMT 2024","796","tests","used_resources_page_test","TestUsedResourcesPage","","","Verify value of title with tag 'h1' on the page",""
"passed","Tue Jun 11 10:09:07 GMT 2024","Tue Jun 11 10:09:07 GMT 2024","129","tests","contacts_page_test","TestContactsPage","","","Verify the composition and visibility of elements 
        on the 1st, 2nd, 3rd, 4th, 5th levels of nesting in the section 2",""
"passed","Tue Jun 11 10:15:57 GMT 2024","Tue Jun 11 10:15:57 GMT 2024","117","tests","main_page_test","TestMainPage","","","Verify redirection to description page not authorized user.",""
"passed","Tue Jun 11 10:16:25 GMT 2024","Tue Jun 11 10:16:26 GMT 2024","637","tests","main_page_test","TestMainPage","","","Verify redirection to contributors page not authorized user.",""
"passed","Tue Jun 11 10:12:31 GMT 2024","Tue Jun 11 10:12:33 GMT 2024","1582","tests","footer_test","TestFooter","","","Verify presence, visibility, clickability, href, status code of the Selectel link in Footer",""
"passed","Tue Jun 11 10:14:49 GMT 2024","Tue Jun 11 10:14:49 GMT 2024","79","tests","footer_test","TestFooter","","","Verify changes of visible sizes of the REG.RU link's image in Footer",""
"passed","Tue Jun 11 10:10:08 GMT 2024","Tue Jun 11 10:10:08 GMT 2024","34","tests","contributors_page_test","TestContributorsPage","","","Verify value of title with tag 'h2' on the page",""
"passed","Tue Jun 11 10:14:41 GMT 2024","Tue Jun 11 10:14:41 GMT 2024","68","tests","footer_test","TestFooter","","","Verify presence, visibility and accuracy of the REG.RU link's image in Footer",""
"passed","Tue Jun 11 10:11:18 GMT 2024","Tue Jun 11 10:11:19 GMT 2024","634","tests","description_page_test","TestDescriptionPage","","","Verify redirection to contributors page not authorized user.",""
"passed","Tue Jun 11 10:19:27 GMT 2024","Tue Jun 11 10:19:27 GMT 2024","22","tests","start_unauthorized_page_test","TestStartUnauthorizedPage","","","Verify amount and visibility of sections with content on the page",""
"passed","Tue Jun 11 10:19:13 GMT 2024","Tue Jun 11 10:19:19 GMT 2024","6438","tests","specialists_page_test","TestSpecialistsPage","","","Verify that the 'All Specialists' link leads an authorized user 
                         to the correct page after clicking",""
"passed","Tue Jun 11 10:14:00 GMT 2024","Tue Jun 11 10:14:00 GMT 2024","78","tests","footer_test","TestFooter","","","Verify that the Contact us link in Footer calls an email client",""
"passed","Tue Jun 11 10:20:27 GMT 2024","Tue Jun 11 10:20:36 GMT 2024","9145","tests","Speech exercises EN.","TestCardsEN","","","Check progres-bar and buttons.",""
"passed","Tue Jun 11 10:16:30 GMT 2024","Tue Jun 11 10:16:30 GMT 2024","140","tests","main_page_test","TestMainPage","","","Verify redirection to used resources page not authorized user.",""
"passed","Tue Jun 11 10:11:57 GMT 2024","Tue Jun 11 10:12:00 GMT 2024","3047","tests","footer_test","TestFooter","","","Verify presence and visibility of Footer on each page specified in the kit",""
"passed","Tue Jun 11 10:17:24 GMT 2024","Tue Jun 11 10:17:25 GMT 2024","615","tests","registration_page_test","TestRegistrationPage","","","Check registration with new email and empty birthday",""
"passed","Tue Jun 11 10:24:38 GMT 2024","Tue Jun 11 10:24:38 GMT 2024","792","tests","used_resources_page_test","TestUsedResourcesPage","","","Verify presence and visibility of the section with the 'Plants' link on the page",""
"passed","Tue Jun 11 10:11:13 GMT 2024","Tue Jun 11 10:11:15 GMT 2024","1586","tests","description_page_test","TestDescriptionPage","","","Verify redirection to github not authorized user.",""
"passed","Tue Jun 11 10:13:50 GMT 2024","Tue Jun 11 10:13:56 GMT 2024","6011","tests","footer_test","TestFooter","","","Verify that the SELECTEL link in Footer leads to the correct page after click",""
"passed","Tue Jun 11 10:15:01 GMT 2024","Tue Jun 11 10:15:01 GMT 2024","79","tests","footer_test","TestFooter","","","Verify changes of visible sizes of the Selectel link's image in Footer",""
"passed","Tue Jun 11 10:12:18 GMT 2024","Tue Jun 11 10:12:18 GMT 2024","145","tests","footer_test","TestFooter","","","Verify presence, visibility, clickability, href, status code of the EPAM link in Footer",""
"passed","Tue Jun 11 10:10:53 GMT 2024","Tue Jun 11 10:10:55 GMT 2024","1232","tests","description_page_test","TestDescriptionPage","","","Verify redirection to telegram page not authorized user.",""
"passed","Tue Jun 11 10:16:06 GMT 2024","Tue Jun 11 10:16:07 GMT 2024","1044","tests","main_page_test","TestMainPage","","","Verify redirection to donate page not authorized user.",""
"passed","Tue Jun 11 10:11:23 GMT 2024","Tue Jun 11 10:11:23 GMT 2024","137","tests","description_page_test","TestDescriptionPage","","","Verify redirection to used resources page not authorized user.",""
"passed","Tue Jun 11 10:24:45 GMT 2024","Tue Jun 11 10:24:46 GMT 2024","783","tests","used_resources_page_test","TestUsedResourcesPage","","","Verify text of the 'Plants' link",""
"passed","Tue Jun 11 10:16:58 GMT 2024","Tue Jun 11 10:17:01 GMT 2024","3655","tests","registration_page_test","TestRegistrationPage","","","Check registration with new email",""
"passed","Tue Jun 11 10:12:43 GMT 2024","Tue Jun 11 10:12:47 GMT 2024","3932","tests","footer_test","TestFooter","","","Verify Footer invisibility through the modal window with the exercise",""
"passed","Tue Jun 11 10:15:32 GMT 2024","Tue Jun 11 10:15:32 GMT 2024","93","tests","header_test","TestHeaderPage","","","Verify presence, visibility, attributes and sizes of the 'Logo' image",""
"passed","Tue Jun 11 10:14:57 GMT 2024","Tue Jun 11 10:14:57 GMT 2024","45","tests","footer_test","TestFooter","","","Verify visible sizes of the Selectel link's image in Footer",""
"passed","Tue Jun 11 10:08:46 GMT 2024","Tue Jun 11 10:08:47 GMT 2024","848","tests","authorisation_page_test","TestAuthorizedUserPage","","","Checking the possibility of authorization with incorrect data",""
"passed","Tue Jun 11 10:18:56 GMT 2024","Tue Jun 11 10:18:56 GMT 2024","696","tests","specialists_page_test","TestSpecialistsPage","","","Verify presence, visibility, clickability, href, status code, text 
                         of the 'All Specialists' link on the Specialists page",""
"passed","Tue Jun 11 10:11:45 GMT 2024","Tue Jun 11 10:11:48 GMT 2024","3015","tests","footer_test","TestFooter","","","Verify presence and visibility of Footer on each page specified in the kit",""
"passed","Tue Jun 11 10:24:52 GMT 2024","Tue Jun 11 10:24:53 GMT 2024","803","tests","used_resources_page_test","TestUsedResourcesPage","","","Verify presence and visibility of the section with the 'Flora' link on the page",""
"passed","Tue Jun 11 10:22:20 GMT 2024","Tue Jun 11 10:22:29 GMT 2024","8896","tests","Речевые упражнения.","TestCardsRU","","","Select a random card from ""Слова с частотной группировкой"" group and compare UI vs BACKEND data.",""
"passed","Tue Jun 11 10:16:38 GMT 2024","Tue Jun 11 10:16:38 GMT 2024","100","tests","main_page_test","TestMainPage","","","Checking the clickability of the Registration button.",""
"passed","Tue Jun 11 10:14:33 GMT 2024","Tue Jun 11 10:14:33 GMT 2024","46","tests","footer_test","TestFooter","","","Verify visible sizes of the JETBRAINS link's image in Footer",""
"passed","Tue Jun 11 10:09:23 GMT 2024","Tue Jun 11 10:09:23 GMT 2024","22","tests","contacts_page_test","TestContactsPage","","","Verify values of subtitles with tag 'h2' on the page",""
"passed","Tue Jun 11 10:18:45 GMT 2024","Tue Jun 11 10:18:45 GMT 2024","59","tests","specialists_page_test","TestSpecialistsPage","","","Verify values of names in specialist cards in the grid",""
"passed","Tue Jun 11 10:10:59 GMT 2024","Tue Jun 11 10:11:00 GMT 2024","1191","tests","description_page_test","TestDescriptionPage","","","Verify redirection to donate page not authorized user.",""
"passed","Tue Jun 11 10:16:34 GMT 2024","Tue Jun 11 10:16:34 GMT 2024","82","tests","main_page_test","TestMainPage","","","Checking the clickability of the Start button.",""
"passed","Tue Jun 11 10:18:40 GMT 2024","Tue Jun 11 10:18:40 GMT 2024","48","tests","specialists_page_test","TestSpecialistsPage","","","Verify presence and visibility of text sections (including names and professions) 
         in specialist cards in the grid",""
"passed","Tue Jun 11 10:11:04 GMT 2024","Tue Jun 11 10:11:04 GMT 2024","137","tests","description_page_test","TestDescriptionPage","","","Verify redirection to contacts page not authorized user.",""
"passed","Tue Jun 11 10:19:23 GMT 2024","Tue Jun 11 10:19:23 GMT 2024","31","tests","start_unauthorized_page_test","TestStartUnauthorizedPage","","","Verify presence and visibility of content on the page",""
"passed","Tue Jun 11 10:15:14 GMT 2024","Tue Jun 11 10:15:14 GMT 2024","37","tests","header_test","TestHeaderPage","","","Verify the section with the 'ru' and 'en' buttons in the Header",""
"passed","Tue Jun 11 10:11:32 GMT 2024","Tue Jun 11 10:11:35 GMT 2024","2957","tests","footer_test","TestFooter","","","Verify presence and visibility of Footer on each page specified in the kit",""
"passed","Tue Jun 11 10:19:39 GMT 2024","Tue Jun 11 10:19:39 GMT 2024","23","tests","start_unauthorized_page_test","TestStartUnauthorizedPage","","","Verify values of titles with tag 'h2' on the page",""
"passed","Tue Jun 11 10:24:24 GMT 2024","Tue Jun 11 10:24:24 GMT 2024","798","tests","used_resources_page_test","TestUsedResourcesPage","","","Verify presence and visibility of the section with the freepik.com link on the page",""
"passed","Tue Jun 11 10:19:59 GMT 2024","Tue Jun 11 10:20:00 GMT 2024","747","tests","start_unauthorized_page_test","TestStartUnauthorizedPage","","","Verify presence, visibility, clickability, href, status code, text 
                         of the 'Login' link in the section 1 on the page",""
"passed","Tue Jun 11 10:16:11 GMT 2024","Tue Jun 11 10:16:11 GMT 2024","145","tests","main_page_test","TestMainPage","","","Verify redirection to contacts page not authorized user.",""
"passed","Tue Jun 11 10:09:02 GMT 2024","Tue Jun 11 10:09:02 GMT 2024","23","tests","contacts_page_test","TestContactsPage","","","Verify the composition and visibility of elements on the 1st level of nesting in the section 1",""
"passed","Tue Jun 11 10:14:13 GMT 2024","Tue Jun 11 10:14:13 GMT 2024","79","tests","footer_test","TestFooter","","","Verify changes of visible sizes of the ARASAAC link's image in Footer",""
"passed","Tue Jun 11 10:18:51 GMT 2024","Tue Jun 11 10:18:51 GMT 2024","63","tests","specialists_page_test","TestSpecialistsPage","","","Verify values of profession in specialist cards in the grid",""
"passed","Tue Jun 11 10:14:37 GMT 2024","Tue Jun 11 10:14:37 GMT 2024","79","tests","footer_test","TestFooter","","","Verify changes of visible sizes of the JETBRAINS link's image in Footer",""
"passed","Tue Jun 11 10:10:49 GMT 2024","Tue Jun 11 10:10:49 GMT 2024","100","tests","description_page_test","TestDescriptionPage","","","Verify return main page from description page.",""
"passed","Tue Jun 11 10:17:05 GMT 2024","Tue Jun 11 10:17:06 GMT 2024","1137","tests","registration_page_test","TestRegistrationPage","","","Check registration with an existing email",""
"passed","Tue Jun 11 10:16:15 GMT 2024","Tue Jun 11 10:16:16 GMT 2024","639","tests","main_page_test","TestMainPage","","","Verify redirection to specialists page not authorized user.",""
"passed","Tue Jun 11 10:09:12 GMT 2024","Tue Jun 11 10:09:12 GMT 2024","28","tests","contacts_page_test","TestContactsPage","","","Verify presence and visibility of the dividing line on the page",""
"passed","Tue Jun 11 10:10:39 GMT 2024","Tue Jun 11 10:10:39 GMT 2024","377","tests","contributors_page_test","TestContributorsPage","","","Verify presence and visibility of images in contributors cards in the grid",""
"passed","Tue Jun 11 10:21:29 GMT 2024","Tue Jun 11 10:21:39 GMT 2024","9896","tests","Речевые упражнения.","TestCardsRU","","","Select a random card from ""Похожие фразы"" group and compare UI vs BACKEND data.",""
"passed","Tue Jun 11 10:19:31 GMT 2024","Tue Jun 11 10:19:31 GMT 2024","83","tests","start_unauthorized_page_test","TestStartUnauthorizedPage","","","Verify the composition and visibility of elements 
        on the 1st, 2nd, 3rd levels of nesting in the section 1",""
"passed","Tue Jun 11 10:18:19 GMT 2024","Tue Jun 11 10:18:19 GMT 2024","16","tests","specialists_page_test","TestSpecialistsPage","","","Verify visibility of cards in the grid on the Specialists page",""
"passed","Tue Jun 11 10:13:06 GMT 2024","Tue Jun 11 10:13:12 GMT 2024","5113","tests","footer_test","TestFooter","","","Verify that the JETBRAINS link in Footer leads to the correct page after click",""
"passed","Tue Jun 11 10:10:20 GMT 2024","Tue Jun 11 10:10:20 GMT 2024","375","tests","contributors_page_test","TestContributorsPage","","","Verify values of the text in card descriptions",""
"passed","Tue Jun 11 10:12:37 GMT 2024","Tue Jun 11 10:12:37 GMT 2024","86","tests","footer_test","TestFooter","","","Verify presence, visibility and accuracy of the Contact us link in Footer",""
"passed","Tue Jun 11 10:14:21 GMT 2024","Tue Jun 11 10:14:21 GMT 2024","45","tests","footer_test","TestFooter","","","Verify visible sizes of the EPAM link's image in Footer",""
"passed","Tue Jun 11 10:20:43 GMT 2024","Tue Jun 11 10:20:51 GMT 2024","8332","tests","Speech exercises EN.","TestCardsEN","","","Select a random card from ""Similar phrases"" group and compare UI vs BACKEND data",""
"passed","Tue Jun 11 10:22:35 GMT 2024","Tue Jun 11 10:23:06 GMT 2024","31651","tests","Речевые упражнения.","TestCardsRU","","","Solutions to a random task in the ""Слова"" .",""
"passed","Tue Jun 11 10:18:35 GMT 2024","Tue Jun 11 10:18:35 GMT 2024","93","tests","specialists_page_test","TestSpecialistsPage","","","Verify presence, visibility and accuracy of the 1th card's image in the grid",""
"passed","Tue Jun 11 10:15:28 GMT 2024","Tue Jun 11 10:15:28 GMT 2024","106","tests","header_test","TestHeaderPage","","","Verify that the 'Logo' link on the 'Contacts' page leads an unauthorized user 
                             to the Start Unauthorized Page after clicking",""
"passed","Tue Jun 11 10:19:01 GMT 2024","Tue Jun 11 10:19:07 GMT 2024","5253","tests","specialists_page_test","TestSpecialistsPage","","","Verify that the 'All Specialists' link leads an unauthorized user 
                         to the correct page after clicking",""
"passed","Tue Jun 11 10:25:27 GMT 2024","Tue Jun 11 10:25:29 GMT 2024","2014","tests","used_resources_page_test","TestUsedResourcesPage","","","Verify presence, visibility, clickability, href, status code of links in the sections",""
"passed","Tue Jun 11 10:12:22 GMT 2024","Tue Jun 11 10:12:22 GMT 2024","133","tests","footer_test","TestFooter","","","Verify presence, visibility, clickability, href, status code of the JETBRAINS link in Footer",""
"passed","Tue Jun 11 10:17:38 GMT 2024","Tue Jun 11 10:17:59 GMT 2024","20662","tests","registration_page_test","TestRegistrationPage","","","Check registration without choosing agreement",""
"passed","Tue Jun 11 10:14:17 GMT 2024","Tue Jun 11 10:14:17 GMT 2024","68","tests","footer_test","TestFooter","","","Verify presence, visibility and accuracy of the EPAM link's image in Footer",""
"passed","Tue Jun 11 10:15:05 GMT 2024","Tue Jun 11 10:15:05 GMT 2024","31","tests","header_test","TestHeaderPage","","","Verify presence and visibility of content in the Header",""
"passed","Tue Jun 11 10:11:24 GMT 2024","Tue Jun 11 10:11:27 GMT 2024","3328","tests","footer_test","TestFooter","","","Verify presence and visibility of Footer on each page specified in the kit",""
"passed","Tue Jun 11 10:17:15 GMT 2024","Tue Jun 11 10:17:16 GMT 2024","615","tests","registration_page_test","TestRegistrationPage","","","Check registration with new email and empty password",""
"passed","Tue Jun 11 10:18:24 GMT 2024","Tue Jun 11 10:18:25 GMT 2024","1016","tests","specialists_page_test","TestSpecialistsPage","","","Verify presence and visibility of images in specialist cards in the grid",""
"passed","Tue Jun 11 10:16:42 GMT 2024","Tue Jun 11 10:16:54 GMT 2024","11464","tests","profile_page_test","TestProfilePage","","","Change the password by receiving an email link",""
"passed","Tue Jun 11 10:18:13 GMT 2024","Tue Jun 11 10:18:13 GMT 2024","42","tests","specialists_page_test","TestSpecialistsPage","","","Verify presence, visibility and size of the grid on the Specialists page",""
"passed","Tue Jun 11 10:24:31 GMT 2024","Tue Jun 11 10:24:31 GMT 2024","788","tests","used_resources_page_test","TestUsedResourcesPage","","","Verify text of the freepik.com link",""
"passed","Tue Jun 11 10:20:57 GMT 2024","Tue Jun 11 10:21:08 GMT 2024","10934","tests","Речевые упражнения.","TestCardsRU","","","Select random card from group ""Слова"" and compare UI vs BACKEND data.",""
"passed","Tue Jun 11 10:18:30 GMT 2024","Tue Jun 11 10:18:30 GMT 2024","221","tests","specialists_page_test","TestSpecialistsPage","","","Verify attribute values and sizes of images in specialist cards in the grid",""
"passed","Tue Jun 11 10:25:20 GMT 2024","Tue Jun 11 10:25:20 GMT 2024","804","tests","used_resources_page_test","TestUsedResourcesPage","","","Verify content of the text on the page",""
"passed","Tue Jun 11 10:24:59 GMT 2024","Tue Jun 11 10:25:00 GMT 2024","809","tests","used_resources_page_test","TestUsedResourcesPage","","","Verify text of the 'Flora' link",""
"passed","Tue Jun 11 10:11:08 GMT 2024","Tue Jun 11 10:11:09 GMT 2024","635","tests","description_page_test","TestDescriptionPage","","","Verify redirection to specialists page not authorized user.",""
"passed","Tue Jun 11 10:09:37 GMT 2024","Tue Jun 11 10:09:38 GMT 2024","1019","tests","contacts_page_test","TestContactsPage","","","Verify presence, visibility, clickability, href, prefix, status code 
        of links in sections 1, 2 on the page",""
"passed","Tue Jun 11 10:11:53 GMT 2024","Tue Jun 11 10:11:56 GMT 2024","3158","tests","footer_test","TestFooter","","","Verify presence and visibility of Footer on each page specified in the kit",""
"passed","Tue Jun 11 10:16:01 GMT 2024","Tue Jun 11 10:16:02 GMT 2024","1230","tests","main_page_test","TestMainPage","","","Verify redirection to telegram page not authorized user.",""
"passed","Tue Jun 11 10:13:15 GMT 2024","Tue Jun 11 10:13:46 GMT 2024","30254","tests","footer_test","TestFooter","","","Verify that the REG.RU link in Footer leads to the correct page after click",""
"passed","Tue Jun 11 10:25:06 GMT 2024","Tue Jun 11 10:25:06 GMT 2024","273","tests","used_resources_page_test","TestUsedResourcesPage","","","Verify value of the title of the tab",""
"passed","Tue Jun 11 10:10:24 GMT 2024","Tue Jun 11 10:10:25 GMT 2024","358","tests","contributors_page_test","TestContributorsPage","","","Verify text in links in card links",""
"failed","Tue Jun 11 10:25:35 GMT 2024","Tue Jun 11 10:26:07 GMT 2024","31174","tests","used_resources_page_test","TestUsedResourcesPage","","","Verify that links in the sections lead to the correct pages after clicking",""
"passed","Tue Jun 11 10:10:04 GMT 2024","Tue Jun 11 10:10:04 GMT 2024","37","tests","contributors_page_test","TestContributorsPage","","","Verify amount of contributor cards with images, links and descriptions in the section grid",""
"passed","Tue Jun 11 10:17:29 GMT 2024","Tue Jun 11 10:17:29 GMT 2024","603","tests","registration_page_test","TestRegistrationPage","","","Check registration with new email and empty email",""
"passed","Tue Jun 11 10:19:43 GMT 2024","Tue Jun 11 10:19:43 GMT 2024","27","tests","start_unauthorized_page_test","TestStartUnauthorizedPage","","","Verify values of subtitles with tag 'h4' on the page",""
"passed","Tue Jun 11 10:14:05 GMT 2024","Tue Jun 11 10:14:05 GMT 2024","72","tests","footer_test","TestFooter","","","Verify presence, visibility and accuracy of the ARASAAC link's image in Footer",""
"passed","Tue Jun 11 10:19:55 GMT 2024","Tue Jun 11 10:19:55 GMT 2024","91","tests","start_unauthorized_page_test","TestStartUnauthorizedPage","","","Verify attribute values and size of the image in the section 1 on the page",""
"passed","Tue Jun 11 10:10:43 GMT 2024","Tue Jun 11 10:10:45 GMT 2024","1435","tests","contributors_page_test","TestContributorsPage","","","Verify attribute values and sizes of images in contributors cards in the grid",""
