"Status","Start Time","Stop Time","Duration in ms","Parent Suite","Suite","Sub Suite","Test Class","Test Method","Name","Description"
"passed","Fri Jan 05 12:10:55 GMT 2024","Fri Jan 05 12:10:59 GMT 2024","3572","tests","authorized_user_test","TestAuthorizedUserPage","","","Checking the possibility of authorization with incorrect data",""
"passed","Fri Jan 05 12:11:00 GMT 2024","Fri Jan 05 12:11:02 GMT 2024","2669","tests","footer_test","TestFooter","","","Visibility of Footer on each page",""
"passed","Fri Jan 05 12:12:30 GMT 2024","Fri Jan 05 12:12:31 GMT 2024","1228","tests","main_page_test","TestMainPage","","","Verify redirection to telegram page not authorized user.",""
"passed","Fri Jan 05 12:12:26 GMT 2024","Fri Jan 05 12:12:26 GMT 2024","114","tests","main_page_test","TestMainPage","","","Verify redirection to description page not authorized user.",""
"passed","Fri Jan 05 12:11:07 GMT 2024","Fri Jan 05 12:11:10 GMT 2024","2706","tests","footer_test","TestFooter","","","Visibility of Footer on each page",""
"passed","Fri Jan 05 12:11:15 GMT 2024","Fri Jan 05 12:11:17 GMT 2024","2586","tests","footer_test","TestFooter","","","Visibility of Footer on each page",""
"passed","Fri Jan 05 12:12:57 GMT 2024","Fri Jan 05 12:12:57 GMT 2024","137","tests","main_page_test","TestMainPage","","","Verify redirection to used resources page not authorized user.",""
"passed","Fri Jan 05 12:11:51 GMT 2024","Fri Jan 05 12:11:51 GMT 2024","57","tests","footer_test","TestFooter","","","Verify visibility and accuracy of the image in the ARASAAC link in Footer on the Home Page",""
"passed","Fri Jan 05 12:13:29 GMT 2024","Fri Jan 05 12:13:32 GMT 2024","3710","tests","registration_page_test","TestRegistrationPage","","","Checking impossibility of registration with an existing email",""
"passed","Fri Jan 05 12:11:22 GMT 2024","Fri Jan 05 12:11:25 GMT 2024","2871","tests","footer_test","TestFooter","","","Visibility of Footer on each page",""
"passed","Fri Jan 05 12:13:16 GMT 2024","Fri Jan 05 12:13:28 GMT 2024","11971","tests","profile_page_test","TestProfilePage","","","Return the password by receiving an email link",""
"passed","Fri Jan 05 12:11:34 GMT 2024","Fri Jan 05 12:11:36 GMT 2024","2584","tests","footer_test","TestFooter","","","Correctness of texts in Footer on each page",""
"passed","Fri Jan 05 12:12:48 GMT 2024","Fri Jan 05 12:12:49 GMT 2024","1120","tests","main_page_test","TestMainPage","","","Verify redirection to github not authorized user.",""
"passed","Fri Jan 05 12:12:40 GMT 2024","Fri Jan 05 12:12:40 GMT 2024","143","tests","main_page_test","TestMainPage","","","Verify redirection to contacts page not authorized user.",""
"passed","Fri Jan 05 12:13:02 GMT 2024","Fri Jan 05 12:13:15 GMT 2024","12944","tests","profile_page_test","TestProfilePage","","","Change the password by receiving an email link",""
"passed","Fri Jan 05 12:11:44 GMT 2024","Fri Jan 05 12:11:44 GMT 2024","58","tests","footer_test","TestFooter","","","Verify presence, visibility and accuracy of the image in the JETBRAINS link in Footer",""
"passed","Fri Jan 05 12:11:03 GMT 2024","Fri Jan 05 12:11:06 GMT 2024","2613","tests","footer_test","TestFooter","","","Visibility of Footer on each page",""
"passed","Fri Jan 05 12:11:11 GMT 2024","Fri Jan 05 12:11:14 GMT 2024","2751","tests","footer_test","TestFooter","","","Visibility of Footer on each page",""
"passed","Fri Jan 05 12:12:43 GMT 2024","Fri Jan 05 12:12:44 GMT 2024","1142","tests","main_page_test","TestMainPage","","","Verify redirection to specialists page not authorized user.",""
"passed","Fri Jan 05 12:11:18 GMT 2024","Fri Jan 05 12:11:21 GMT 2024","2605","tests","footer_test","TestFooter","","","Visibility of Footer on each page",""
"passed","Fri Jan 05 12:11:26 GMT 2024","Fri Jan 05 12:11:29 GMT 2024","2708","tests","footer_test","TestFooter","","","Visibility of Footer on each page",""
"passed","Fri Jan 05 12:11:48 GMT 2024","Fri Jan 05 12:11:48 GMT 2024","57","tests","footer_test","TestFooter","","","Verify visibility and accuracy of the image in the РЕГ.РУ link in Footer on the Home Page",""
"passed","Fri Jan 05 12:12:05 GMT 2024","Fri Jan 05 12:12:08 GMT 2024","2311","tests","login_page_test","TestLoginPage","","","Test for authorization customer.",""
"passed","Fri Jan 05 12:11:30 GMT 2024","Fri Jan 05 12:11:32 GMT 2024","2692","tests","footer_test","TestFooter","","","Visibility of Footer on each page",""
"passed","Fri Jan 05 12:13:33 GMT 2024","Fri Jan 05 12:13:40 GMT 2024","6723","tests","registration_page_test","TestRegistrationPage","","","Checking possibility of registration with a new email",""
"passed","Fri Jan 05 12:12:11 GMT 2024","Fri Jan 05 12:12:23 GMT 2024","11420","tests","login_page_test","TestCards","","","Select random card from word group and compare UI vs BACKEND data",""
"passed","Fri Jan 05 12:11:55 GMT 2024","Fri Jan 05 12:12:01 GMT 2024","6239","tests","footer_test","TestFooter","","","Verify Footer invisibility through the modal window of the exercise",""
"passed","Fri Jan 05 12:12:53 GMT 2024","Fri Jan 05 12:12:53 GMT 2024","639","tests","main_page_test","TestMainPage","","","Verify redirection to contributors page not authorized user.",""
"passed","Fri Jan 05 12:13:01 GMT 2024","Fri Jan 05 12:13:01 GMT 2024","78","tests","main_page_test","TestMainPage","","","Checking the clickability of the Start button.",""
"passed","Fri Jan 05 12:12:35 GMT 2024","Fri Jan 05 12:12:36 GMT 2024","1023","tests","main_page_test","TestMainPage","","","Verify redirection to donate page not authorized user.",""
"passed","Fri Jan 05 12:11:37 GMT 2024","Fri Jan 05 12:11:40 GMT 2024","2670","tests","footer_test","TestFooter","","","Correctness of texts in Footer on each page",""
"passed","Fri Jan 05 12:10:50 GMT 2024","Fri Jan 05 12:10:54 GMT 2024","3723","tests","authorized_user_test","TestAuthorizedUserPage","","","Checking the possibility of authorization with the correct data",""
