"Status","Start Time","Stop Time","Duration in ms","Parent Suite","Suite","Sub Suite","Test Class","Test Method","Name","Description"
"passed","Wed Sep 25 09:20:44 GMT 2024","Wed Sep 25 09:20:45 GMT 2024","1053","tests","main_page_test","TestMainPage","","","Verify redirection to donate page not authorized user.",""
"passed","Wed Sep 25 09:24:19 GMT 2024","Wed Sep 25 09:24:19 GMT 2024","13","tests","start_unauthorized_page_test","TestStartUnauthorizedPage","","","Verify value of the title of the tab",""
"passed","Wed Sep 25 09:20:35 GMT 2024","Wed Sep 25 09:20:35 GMT 2024","123","tests","main_page_test","TestMainPage","","","Verify redirection to description page not authorized user.",""
"passed","Wed Sep 25 09:21:16 GMT 2024","Wed Sep 25 09:21:16 GMT 2024","115","tests","main_page_test","TestMainPage","","","Checking the clickability of the Registration button.",""
"passed","Wed Sep 25 09:14:50 GMT 2024","Wed Sep 25 09:14:51 GMT 2024","144","tests","footer_test","TestFooter","","","Verify presence, visibility of text, links, images in the Footer",""
"passed","Wed Sep 25 09:23:46 GMT 2024","Wed Sep 25 09:23:49 GMT 2024","2578","tests","specialists_page_test","TestSpecialistsPage","","","Verify that the 'All Specialists' link leads an authorized user 
                         to the correct page after clicking",""
"passed","Wed Sep 25 09:15:11 GMT 2024","Wed Sep 25 09:15:21 GMT 2024","10373","tests","footer_test","TestFooter","","","Verify that links in the Footer lead to correct pages after clicking",""
"passed","Wed Sep 25 09:13:23 GMT 2024","Wed Sep 25 09:13:23 GMT 2024","13","tests","contributors_page_test","TestContributorsPage","","","Verify value of the title of the tab",""
"passed","Wed Sep 25 09:22:57 GMT 2024","Wed Sep 25 09:23:02 GMT 2024","5372","tests","specialists_page_test","TestSpecialistsPage","","","Verify presence, visibility of the title, text, link, grid, cards and images  
        on the 2nd, 3rd, 5th, 6th levels of nesting on the page",""
"passed","Wed Sep 25 09:13:40 GMT 2024","Wed Sep 25 09:13:40 GMT 2024","494","tests","contributors_page_test","TestContributorsPage","","","Verify text in card links and the 'All Team' link",""
"passed","Wed Sep 25 09:35:04 GMT 2024","Wed Sep 25 09:35:05 GMT 2024","843","tests","used_resources_page_test","TestUsedResourcesPage","","","Verify sizes of icons in sections",""
