"Status","Start Time","Stop Time","Duration in ms","Parent Suite","Suite","Sub Suite","Test Class","Test Method","Name","Description"
"passed","Wed Sep 25 09:12:31 GMT 2024","Wed Sep 25 09:12:31 GMT 2024","13","tests","contacts_page_test","TestContactsPage","","","Verify value of the title of the tab",""
"passed","Wed Sep 25 09:28:50 GMT 2024","Wed Sep 25 09:29:03 GMT 2024","12805","tests","Речевые упражнения.","TestCardsRU","","","Select a random card from ""Похожие фразы"" group and compare UI vs BACKEND data.",""
"passed","Wed Sep 25 09:13:18 GMT 2024","Wed Sep 25 09:13:19 GMT 2024","1713","tests","contributors_page_test","TestContributorsPage","","","Verify presence, visibility of titles/subtitles, cards, descriptions, links, images on the page",""
"passed","Wed Sep 25 09:24:45 GMT 2024","Wed Sep 25 09:24:45 GMT 2024","83","tests","start_unauthorized_page_test","TestStartUnauthorizedPage","","","Verify presence, visibility and attributes of the image in the section 1",""
"passed","Wed Sep 25 09:12:41 GMT 2024","Wed Sep 25 09:12:41 GMT 2024","30","tests","contacts_page_test","TestContactsPage","","","Verify content of the text in the section 2",""
"passed","Wed Sep 25 09:14:34 GMT 2024","Wed Sep 25 09:14:34 GMT 2024","654","tests","description_page_test","TestDescriptionPage","","","Verify redirection to contributors page not authorized user.",""
"passed","Wed Sep 25 09:22:21 GMT 2024","Wed Sep 25 09:22:41 GMT 2024","20771","tests","registration_page_test","TestRegistrationPage","","","Check registration without choosing agreement",""
"passed","Wed Sep 25 09:24:49 GMT 2024","Wed Sep 25 09:24:49 GMT 2024","68","tests","start_unauthorized_page_test","TestStartUnauthorizedPage","","","Verify size of the image in the section 1",""
"broken","Wed Sep 25 09:19:39 GMT 2024","Wed Sep 25 09:19:39 GMT 2024","0","tests","header_test","TestHeaderPage","","","Verify switching of the 'ru', 'en' buttons in the Header on the Start Authorized Page",""
"passed","Wed Sep 25 09:22:11 GMT 2024","Wed Sep 25 09:22:12 GMT 2024","710","tests","registration_page_test","TestRegistrationPage","","","Check registration with new email and empty email",""
"passed","Wed Sep 25 09:34:16 GMT 2024","Wed Sep 25 09:34:17 GMT 2024","818","tests","used_resources_page_test","TestUsedResourcesPage","","","Verify value of title with tag 'h1' on the page",""
"passed","Wed Sep 25 09:21:04 GMT 2024","Wed Sep 25 09:21:04 GMT 2024","676","tests","main_page_test","TestMainPage","","","Verify redirection to contributors page not authorized user.",""
"passed","Wed Sep 25 09:24:23 GMT 2024","Wed Sep 25 09:24:23 GMT 2024","49","tests","start_unauthorized_page_test","TestStartUnauthorizedPage","","","Verify values of titles and subtitles with tags h2, h4 on the page",""
"passed","Wed Sep 25 09:18:22 GMT 2024","Wed Sep 25 09:18:28 GMT 2024","5923","tests","header_test","TestHeaderPage","","","Verify clickability, href, status code of links in the Header for an authorized user",""
"passed","Wed Sep 25 09:12:51 GMT 2024","Wed Sep 25 09:12:52 GMT 2024","915","tests","contacts_page_test","TestContactsPage","","","Verify presence, visibility, clickability, href, prefix, status code of links in the section 2",""
"passed","Wed Sep 25 09:16:26 GMT 2024","Wed Sep 25 09:16:26 GMT 2024","380","tests","header_test","TestHeaderPage","","","Verify presence, visibility of links, buttons in the Header for an unauthorized user",""
"passed","Wed Sep 25 09:23:54 GMT 2024","Wed Sep 25 09:23:54 GMT 2024","120","tests","specialists_page_test","TestSpecialistsPage","","","Verify attributes of images in specialist cards in the grid",""
"passed","Wed Sep 25 09:14:46 GMT 2024","Wed Sep 25 09:14:47 GMT 2024","262","tests","footer_test","TestFooter","","","Verify composition and visibility of elements on the 1st-7th levels of nesting in the Footer",""
"passed","Wed Sep 25 09:21:53 GMT 2024","Wed Sep 25 09:21:53 GMT 2024","711","tests","registration_page_test","TestRegistrationPage","","","Check registration with new email and empty confirm password",""
"passed","Wed Sep 25 09:18:37 GMT 2024","Wed Sep 25 09:18:51 GMT 2024","14041","tests","header_test","TestHeaderPage","","","Verify if internal links in the Header for an authorized user 
            lead to correct pages after click",""
"passed","Wed Sep 25 09:12:04 GMT 2024","Wed Sep 25 09:12:05 GMT 2024","942","tests","authorisation_page_test","TestAuthorizedUserPage","","","Checking the possibility of authorization with incorrect data",""
"passed","Wed Sep 25 09:22:16 GMT 2024","Wed Sep 25 09:22:17 GMT 2024","672","tests","registration_page_test","TestRegistrationPage","","","Check registration without choosing gender",""
"passed","Wed Sep 25 09:22:52 GMT 2024","Wed Sep 25 09:22:52 GMT 2024","348","tests","specialists_page_test","TestSpecialistsPage","","","Verify the composition and visibility of elements 
        on the 1st-6th levels of nesting on the page",""
"passed","Wed Sep 25 09:22:07 GMT 2024","Wed Sep 25 09:22:07 GMT 2024","717","tests","registration_page_test","TestRegistrationPage","","","Check registration with new email and empty birthday",""
"passed","Wed Sep 25 09:20:54 GMT 2024","Wed Sep 25 09:20:54 GMT 2024","674","tests","main_page_test","TestMainPage","","","Verify redirection to specialists page not authorized user.",""
"passed","Wed Sep 25 09:28:10 GMT 2024","Wed Sep 25 09:28:24 GMT 2024","14400","tests","Речевые упражнения.","TestCardsRU","","","Select random card from group ""Слова"" and compare UI vs BACKEND data.",""
"passed","Wed Sep 25 09:28:31 GMT 2024","Wed Sep 25 09:28:43 GMT 2024","11981","tests","Речевые упражнения.","TestCardsRU","","","Select random card from group ""Слова Королёвой"" and compare UI vs BACKEND data.",""
"passed","Wed Sep 25 09:23:07 GMT 2024","Wed Sep 25 09:23:07 GMT 2024","13","tests","specialists_page_test","TestSpecialistsPage","","","Verify value of the title of the tab",""
"passed","Wed Sep 25 09:23:28 GMT 2024","Wed Sep 25 09:23:28 GMT 2024","52","tests","specialists_page_test","TestSpecialistsPage","","","Verify text in the 'All Specialists' link",""
"broken","Wed Sep 25 09:15:41 GMT 2024","Wed Sep 25 09:16:01 GMT 2024","20269","tests","footer_test","TestFooter","","","Verify Footer invisibility through the modal window with the exercise",""
"passed","Wed Sep 25 09:22:46 GMT 2024","Wed Sep 25 09:22:47 GMT 2024","32","tests","specialists_page_test","TestSpecialistsPage","","","Verify presence and visibility of content on the page",""
"passed","Wed Sep 25 09:24:11 GMT 2024","Wed Sep 25 09:24:11 GMT 2024","85","tests","start_unauthorized_page_test","TestStartUnauthorizedPage","","","Verify the composition and visibility of elements 
        on the 1st-3rd levels of nesting in the section 1",""
"passed","Wed Sep 25 09:18:13 GMT 2024","Wed Sep 25 09:18:14 GMT 2024","202","tests","header_test","TestHeaderPage","","","Verify values of the text in links, buttons in the Header for an authorized user",""
"skipped","Wed Sep 25 09:26:07 GMT 2024","Wed Sep 25 09:26:47 GMT 2024","40049","tests","Speech exercises EN.","TestCardsEN","","","Check progres-bar and buttons.",""
"passed","Wed Sep 25 09:17:24 GMT 2024","Wed Sep 25 09:17:24 GMT 2024","29","tests","header_test","TestHeaderPage","","","Verify presence and visibility of the Header for an authorized user",""
"passed","Wed Sep 25 09:34:31 GMT 2024","Wed Sep 25 09:34:32 GMT 2024","805","tests","used_resources_page_test","TestUsedResourcesPage","","","Verify text in links in sections",""
"passed","Wed Sep 25 09:13:31 GMT 2024","Wed Sep 25 09:13:31 GMT 2024","19","tests","contributors_page_test","TestContributorsPage","","","Verify content of the text on the page",""
"passed","Wed Sep 25 09:24:27 GMT 2024","Wed Sep 25 09:24:27 GMT 2024","68","tests","start_unauthorized_page_test","TestStartUnauthorizedPage","","","Verify content of the text in sections 1, 2",""
"passed","Wed Sep 25 09:33:43 GMT 2024","Wed Sep 25 09:33:46 GMT 2024","3434","tests","Statistic.","TestCardsRU","","","Check statistic table.",""
"passed","Wed Sep 25 09:27:26 GMT 2024","Wed Sep 25 09:28:03 GMT 2024","36427","tests","Speech exercises EN.","TestCardsEN","","","Select a random card from ""Similar phrases"" group and compare UI vs BACKEND data",""
"passed","Wed Sep 25 09:34:09 GMT 2024","Wed Sep 25 09:34:09 GMT 2024","272","tests","used_resources_page_test","TestUsedResourcesPage","","","Verify value of the title of the tab",""
"passed","Wed Sep 25 09:13:54 GMT 2024","Wed Sep 25 09:13:54 GMT 2024","835","tests","contributors_page_test","TestContributorsPage","","","Verify attribute values of images in contributors cards in grids",""
"passed","Wed Sep 25 09:14:55 GMT 2024","Wed Sep 25 09:14:55 GMT 2024","47","tests","footer_test","TestFooter","","","Verify content of text in the Footer",""
"passed","Wed Sep 25 09:14:28 GMT 2024","Wed Sep 25 09:14:29 GMT 2024","1516","tests","description_page_test","TestDescriptionPage","","","Verify redirection to github not authorized user.",""
"passed","Wed Sep 25 09:12:20 GMT 2024","Wed Sep 25 09:12:21 GMT 2024","139","tests","contacts_page_test","TestContactsPage","","","Verify the composition and visibility of elements 
        on the 1st-5th levels of nesting in the section 2",""
"passed","Wed Sep 25 09:14:19 GMT 2024","Wed Sep 25 09:14:19 GMT 2024","185","tests","description_page_test","TestDescriptionPage","","","Verify redirection to contacts page not authorized user.",""
"passed","Wed Sep 25 09:14:38 GMT 2024","Wed Sep 25 09:14:38 GMT 2024","153","tests","description_page_test","TestDescriptionPage","","","Verify redirection to used resources page not authorized user.",""
"passed","Wed Sep 25 09:24:03 GMT 2024","Wed Sep 25 09:24:03 GMT 2024","34","tests","start_unauthorized_page_test","TestStartUnauthorizedPage","","","Verify presence and visibility of content on the page",""
"passed","Wed Sep 25 09:16:06 GMT 2024","Wed Sep 25 09:16:06 GMT 2024","35","tests","header_test","TestHeaderPage","","","Verify presence and visibility of the Header for an unauthorized user",""
"passed","Wed Sep 25 09:14:14 GMT 2024","Wed Sep 25 09:14:15 GMT 2024","1059","tests","description_page_test","TestDescriptionPage","","","Verify redirection to donate page not authorized user.",""
"passed","Wed Sep 25 09:16:11 GMT 2024","Wed Sep 25 09:16:22 GMT 2024","10390","tests","header_test","TestHeaderPage","","","Verify composition, visibility of elements on the 1st-6th levels of nesting in the Header
            for an unauthorized user",""
"skipped","Wed Sep 25 09:33:24 GMT 2024","Wed Sep 25 09:33:36 GMT 2024","12032","tests","Речевые упражнения.","TestCardsRU","","","Solutions to a random task in the ""Слова"" group and comparison of statics.",""
"passed","Wed Sep 25 09:20:49 GMT 2024","Wed Sep 25 09:20:50 GMT 2024","178","tests","main_page_test","TestMainPage","","","Verify redirection to contacts page not authorized user.",""
"passed","Wed Sep 25 09:13:27 GMT 2024","Wed Sep 25 09:13:27 GMT 2024","84","tests","contributors_page_test","TestContributorsPage","","","Verify values of title and subtitles with tags h2, h3 on the page",""
"passed","Wed Sep 25 09:34:39 GMT 2024","Wed Sep 25 09:34:40 GMT 2024","1822","tests","used_resources_page_test","TestUsedResourcesPage","","","Verify presence, visibility, clickability, href, status code of links in sections",""
"passed","Wed Sep 25 09:16:58 GMT 2024","Wed Sep 25 09:16:58 GMT 2024","102","tests","header_test","TestHeaderPage","","","Verify that the 'Logo' link on the Start Unauthorized Page 
                             doesn't refresh the current page or lead to other pages after clicking",""
"passed","Wed Sep 25 09:21:38 GMT 2024","Wed Sep 25 09:21:44 GMT 2024","5758","tests","registration_page_test","TestRegistrationPage","","","Check registration with new email",""
"passed","Wed Sep 25 09:24:36 GMT 2024","Wed Sep 25 09:24:36 GMT 2024","684","tests","start_unauthorized_page_test","TestStartUnauthorizedPage","","","Verify presence, visibility, clickability, href, status code 
                         of the 'Login' link in the section 1",""
"passed","Wed Sep 25 09:20:58 GMT 2024","Wed Sep 25 09:21:00 GMT 2024","1399","tests","main_page_test","TestMainPage","","","Verify redirection to github not authorized user.",""
"passed","Wed Sep 25 09:14:04 GMT 2024","Wed Sep 25 09:14:04 GMT 2024","141","tests","description_page_test","TestDescriptionPage","","","Verify return main page from description page.",""
"skipped","Wed Sep 25 09:31:09 GMT 2024","Wed Sep 25 09:33:14 GMT 2024","125255","tests","Речевые упражнения.","TestCardsRU","","","Solutions to a random task in the ""Слова Королёвой"" .",""
"passed","Wed Sep 25 09:13:44 GMT 2024","Wed Sep 25 09:13:45 GMT 2024","756","tests","contributors_page_test","TestContributorsPage","","","Verify clickability, href of links on the page",""
"passed","Wed Sep 25 09:24:40 GMT 2024","Wed Sep 25 09:24:40 GMT 2024","140","tests","start_unauthorized_page_test","TestStartUnauthorizedPage","","","Verify that the 'Login' link leads to the correct page after clicking",""
"passed","Wed Sep 25 09:17:14 GMT 2024","Wed Sep 25 09:17:14 GMT 2024","59","tests","header_test","TestHeaderPage","","","Verify size of the image in the 'Logo' link",""
"passed","Wed Sep 25 09:15:33 GMT 2024","Wed Sep 25 09:15:33 GMT 2024","116","tests","footer_test","TestFooter","","","Verify sizes of images in links in the Footer",""
"passed","Wed Sep 25 09:14:23 GMT 2024","Wed Sep 25 09:14:24 GMT 2024","650","tests","description_page_test","TestDescriptionPage","","","Verify redirection to specialists page not authorized user.",""
"passed","Wed Sep 25 09:30:12 GMT 2024","Wed Sep 25 09:31:02 GMT 2024","49679","tests","Речевые упражнения.","TestCardsRU","","","Solutions to a random task in the ""Слова"" .",""
"passed","Wed Sep 25 09:13:04 GMT 2024","Wed Sep 25 09:13:04 GMT 2024","90","tests","contacts_page_test","TestContactsPage","","","Verify that the email link calls an email client",""
"passed","Wed Sep 25 09:34:23 GMT 2024","Wed Sep 25 09:34:24 GMT 2024","817","tests","used_resources_page_test","TestUsedResourcesPage","","","Verify content of the text on the page",""
"passed","Wed Sep 25 09:16:30 GMT 2024","Wed Sep 25 09:16:30 GMT 2024","186","tests","header_test","TestHeaderPage","","","Verify values of the text in links, buttons in the Header for an unauthorized user",""
"passed","Wed Sep 25 09:12:36 GMT 2024","Wed Sep 25 09:12:36 GMT 2024","50","tests","contacts_page_test","TestContactsPage","","","Verify values of the title and subtitles with tags h1, h2 on the page",""
"passed","Wed Sep 25 09:23:23 GMT 2024","Wed Sep 25 09:23:23 GMT 2024","121","tests","specialists_page_test","TestSpecialistsPage","","","Verify values of names and professions in specialist cards in the grid",""
"passed","Wed Sep 25 09:17:06 GMT 2024","Wed Sep 25 09:17:06 GMT 2024","179","tests","header_test","TestHeaderPage","","","Verify switching of the 'ru', 'en' buttons in the Header on the Start Unauthorized Page",""
"passed","Wed Sep 25 09:13:35 GMT 2024","Wed Sep 25 09:13:36 GMT 2024","440","tests","contributors_page_test","TestContributorsPage","","","Verify values of the text in card descriptions",""
"passed","Wed Sep 25 09:12:57 GMT 2024","Wed Sep 25 09:12:59 GMT 2024","1350","tests","contacts_page_test","TestContactsPage","","","Verify if links in the section 2 lead to the correct pages after clicking",""
"passed","Wed Sep 25 09:13:12 GMT 2024","Wed Sep 25 09:13:14 GMT 2024","1775","tests","contributors_page_test","TestContributorsPage","","","Verify the composition and visibility of elements 
        on the 1st-5th levels of nesting on the page",""
"passed","Wed Sep 25 09:20:31 GMT 2024","Wed Sep 25 09:20:31 GMT 2024","3","tests","login_page_test","TestLoginPage","","","Test for authorization customer.",""
"passed","Wed Sep 25 09:15:03 GMT 2024","Wed Sep 25 09:15:07 GMT 2024","3741","tests","footer_test","TestFooter","","","Verify clickability, href, prefix and subject, status code of links in the Footer",""
"passed","Wed Sep 25 09:19:39 GMT 2024","Wed Sep 25 09:19:39 GMT 2024","224","tests","header_test","TestHeaderPage","","","Verify the dropdown opens/closes after clicking on the 'More' button in the Header 
               on the Start Authorized Page",""
"passed","Wed Sep 25 09:24:07 GMT 2024","Wed Sep 25 09:24:07 GMT 2024","31","tests","start_unauthorized_page_test","TestStartUnauthorizedPage","","","Verify amount and visibility of sections with content on the page",""
"passed","Wed Sep 25 09:34:02 GMT 2024","Wed Sep 25 09:34:03 GMT 2024","892","tests","used_resources_page_test","TestUsedResourcesPage","","","Verify the composition and visibility of elements 
            on the 1st-4th levels of nesting on the page",""
"passed","Wed Sep 25 09:21:08 GMT 2024","Wed Sep 25 09:21:08 GMT 2024","167","tests","main_page_test","TestMainPage","","","Verify redirection to used resources page not authorized user.",""
"passed","Wed Sep 25 09:23:33 GMT 2024","Wed Sep 25 09:23:33 GMT 2024","639","tests","specialists_page_test","TestSpecialistsPage","","","Verify clickability, href, status code of the 'All Specialists' link",""
"passed","Wed Sep 25 09:29:30 GMT 2024","Wed Sep 25 09:29:44 GMT 2024","14122","tests","Речевые упражнения.","TestCardsRU","","","Select a random card from ""Предложения"" group and compare UI vs BACKEND data.",""
"passed","Wed Sep 25 09:34:57 GMT 2024","Wed Sep 25 09:34:58 GMT 2024","828","tests","used_resources_page_test","TestUsedResourcesPage","","","Verify presence, visibility and attributes of icons in sections",""
"passed","Wed Sep 25 09:24:55 GMT 2024","Wed Sep 25 09:26:00 GMT 2024","64828","tests","Speech exercises EN.","TestCardsEN","","","Select random card from ""Word"" group and compare UI vs BACKEND data",""
"passed","Wed Sep 25 09:20:39 GMT 2024","Wed Sep 25 09:20:40 GMT 2024","1255","tests","main_page_test","TestMainPage","","","Verify redirection to telegram page not authorized user.",""
"passed","Wed Sep 25 09:12:10 GMT 2024","Wed Sep 25 09:12:10 GMT 2024","28","tests","contacts_page_test","TestContactsPage","","","Verify presence and visibility of content on the page",""
"passed","Wed Sep 25 09:12:26 GMT 2024","Wed Sep 25 09:12:26 GMT 2024","160","tests","contacts_page_test","TestContactsPage","","","Verify presence, visibility of sections, the dividing line and elements with text on the page",""
"passed","Wed Sep 25 09:17:49 GMT 2024","Wed Sep 25 09:17:49 GMT 2024","366","tests","header_test","TestHeaderPage","","","Verify presence, visibility of links, buttons in the Header for an authorized user",""
"passed","Wed Sep 25 09:17:02 GMT 2024","Wed Sep 25 09:17:02 GMT 2024","277","tests","header_test","TestHeaderPage","","","Verify the dropdown opens/closes after clicking on the 'More' button in the Header 
            on the Start Unauthorized Page",""
"passed","Wed Sep 25 09:14:08 GMT 2024","Wed Sep 25 09:14:09 GMT 2024","1252","tests","description_page_test","TestDescriptionPage","","","Verify redirection to telegram page not authorized user.",""
"passed","Wed Sep 25 09:17:10 GMT 2024","Wed Sep 25 09:17:10 GMT 2024","49","tests","header_test","TestHeaderPage","","","Verify presence, visibility and attributes of the image in the 'Logo' link",""
"passed","Wed Sep 25 09:34:47 GMT 2024","Wed Sep 25 09:34:50 GMT 2024","3565","tests","used_resources_page_test","TestUsedResourcesPage","","","Verify that links in the sections lead to the correct pages after clicking",""
"passed","Wed Sep 25 09:16:52 GMT 2024","Wed Sep 25 09:16:54 GMT 2024","1790","tests","header_test","TestHeaderPage","","","Verify if external links in the Header for an unauthorized user 
            lead to correct pages after click",""
"passed","Wed Sep 25 09:33:53 GMT 2024","Wed Sep 25 09:33:54 GMT 2024","811","tests","used_resources_page_test","TestUsedResourcesPage","","","Verify presence and visibility of content on the page",""
"passed","Wed Sep 25 09:24:15 GMT 2024","Wed Sep 25 09:24:16 GMT 2024","128","tests","start_unauthorized_page_test","TestStartUnauthorizedPage","","","Verify the composition and visibility of elements 
        on the 1st-3rd levels of nesting in the section 2",""
"passed","Wed Sep 25 09:16:34 GMT 2024","Wed Sep 25 09:16:39 GMT 2024","5007","tests","header_test","TestHeaderPage","","","Verify clickability, href, status code of links in the Header for an unauthorized user",""
"passed","Wed Sep 25 09:21:57 GMT 2024","Wed Sep 25 09:21:58 GMT 2024","696","tests","registration_page_test","TestRegistrationPage","","","Check registration with new email and empty password",""
"passed","Wed Sep 25 09:12:15 GMT 2024","Wed Sep 25 09:12:15 GMT 2024","21","tests","contacts_page_test","TestContactsPage","","","Verify the composition and visibility of elements on the 1st level of nesting in the section 1",""
"passed","Wed Sep 25 09:13:58 GMT 2024","Wed Sep 25 09:14:00 GMT 2024","1161","tests","contributors_page_test","TestContributorsPage","","","Verify sizes of images in contributor cards in grids",""
"passed","Wed Sep 25 09:23:59 GMT 2024","Wed Sep 25 09:23:59 GMT 2024","173","tests","specialists_page_test","TestSpecialistsPage","","","Verify sizes of images in specialist cards in the grid",""
"passed","Wed Sep 25 09:19:32 GMT 2024","Wed Sep 25 09:19:32 GMT 2024","79","tests","header_test","TestHeaderPage","","","Verify that the 'Logo' link on the Start Authorized Page 
                             doesn't refresh the current page or lead to other pages after clicking",""
"passed","Wed Sep 25 09:22:02 GMT 2024","Wed Sep 25 09:22:02 GMT 2024","692","tests","registration_page_test","TestRegistrationPage","","","Check registration with new email and empty first name",""
"passed","Wed Sep 25 09:24:31 GMT 2024","Wed Sep 25 09:24:31 GMT 2024","41","tests","start_unauthorized_page_test","TestStartUnauthorizedPage","","","Verify text in the 'Login' link in the section 1",""
"passed","Wed Sep 25 09:11:59 GMT 2024","Wed Sep 25 09:12:00 GMT 2024","985","tests","authorisation_page_test","TestAuthorizedUserPage","","","Checking the possibility of authorization with the correct data",""
"passed","Wed Sep 25 09:19:23 GMT 2024","Wed Sep 25 09:19:25 GMT 2024","1984","tests","header_test","TestHeaderPage","","","Verify if external links in the Header for an authorized user 
            lead to correct pages after click",""
"passed","Wed Sep 25 09:12:46 GMT 2024","Wed Sep 25 09:12:46 GMT 2024","30","tests","contacts_page_test","TestContactsPage","","","Verify text in links in the section 2",""
"passed","Wed Sep 25 09:21:47 GMT 2024","Wed Sep 25 09:21:49 GMT 2024","1225","tests","registration_page_test","TestRegistrationPage","","","Check registration with an existing email",""
"passed","Wed Sep 25 09:13:49 GMT 2024","Wed Sep 25 09:13:50 GMT 2024","623","tests","contributors_page_test","TestContributorsPage","","","Verify href, status code of the 'All Team' link",""
"passed","Wed Sep 25 09:14:59 GMT 2024","Wed Sep 25 09:14:59 GMT 2024","45","tests","footer_test","TestFooter","","","Verify text in the 'Contact us' link in the Footer",""
"passed","Wed Sep 25 09:13:08 GMT 2024","Wed Sep 25 09:13:08 GMT 2024","42","tests","contributors_page_test","TestContributorsPage","","","Verify presence, visibility and structure of content on the page",""
"passed","Wed Sep 25 09:16:43 GMT 2024","Wed Sep 25 09:16:48 GMT 2024","4684","tests","header_test","TestHeaderPage","","","Verify if internal links in the Header for an unauthorized user 
            lead to correct pages after click",""
"passed","Wed Sep 25 09:21:12 GMT 2024","Wed Sep 25 09:21:12 GMT 2024","87","tests","main_page_test","TestMainPage","","","Checking the clickability of the Start button.",""
"passed","Wed Sep 25 09:17:31 GMT 2024","Wed Sep 25 09:17:42 GMT 2024","10579","tests","header_test","TestHeaderPage","","","Verify composition, visibility of elements on the 1st-6th levels of nesting in the Header
            for an authorized user",""
"passed","Wed Sep 25 09:23:18 GMT 2024","Wed Sep 25 09:23:18 GMT 2024","35","tests","specialists_page_test","TestSpecialistsPage","","","Verify value of text on the page",""
"passed","Wed Sep 25 09:23:39 GMT 2024","Wed Sep 25 09:23:39 GMT 2024","630","tests","specialists_page_test","TestSpecialistsPage","","","Verify that the 'All Specialists' link leads an unauthorized user 
                         to the correct page after clicking",""
"passed","Wed Sep 25 09:15:28 GMT 2024","Wed Sep 25 09:15:29 GMT 2024","89","tests","footer_test","TestFooter","","","Verify attributes of images in links in the Footer",""
"passed","Wed Sep 25 09:15:25 GMT 2024","Wed Sep 25 09:15:25 GMT 2024","105","tests","footer_test","TestFooter","","","Verify that the 'Contact us' link in the Footer calls an email client",""
"passed","Wed Sep 25 09:21:20 GMT 2024","Wed Sep 25 09:21:34 GMT 2024","13581","tests","profile_page_test","TestProfilePage","","","Change the password by receiving an email link",""
"passed","Wed Sep 25 09:29:51 GMT 2024","Wed Sep 25 09:30:05 GMT 2024","13888","tests","Речевые упражнения.","TestCardsRU","","","Select a random card from ""Слова с частотной группировкой"" group and compare UI vs BACKEND data.",""
"passed","Wed Sep 25 09:29:10 GMT 2024","Wed Sep 25 09:29:23 GMT 2024","13124","tests","Речевые упражнения.","TestCardsRU","","","Select a random card from ""Группа слов"" group and compare UI vs BACKEND data.",""
"passed","Wed Sep 25 09:14:42 GMT 2024","Wed Sep 25 09:14:42 GMT 2024","49","tests","footer_test","TestFooter","","","Verify presence and visibility of the Footer",""
"passed","Wed Sep 25 09:23:12 GMT 2024","Wed Sep 25 09:23:13 GMT 2024","38","tests","specialists_page_test","TestSpecialistsPage","","","Verify value of title with tag 'h2' on the page",""
