"DESCRIPTION","DURATION IN MS","NAME","PARENT SUITE","START TIME","STATUS","STOP TIME","SUB SUITE","SUITE","TEST CLASS","TEST METHOD"
"","10869","Select a random card from ""Слова с частотной группировкой"" group and compare UI vs BACKEND data.","tests","2026-06-18","skipped","2026-06-18","TestCardsRU","Речевые упражнения.","",""
"","20844","Check registration with new email and empty confirm password","tests","2026-06-18","passed","2026-06-18","TestRegistrationPage","registration_page_test","",""
"","134","Verify the composition and visibility of elements 
        on the 1st-4th levels of nesting on the page","tests","2026-06-18","passed","2026-06-18","TestURPage","used_resources_page_test","",""
"","45","Verify presence, visibility and attributes of the image in the Logo link in the Header 
               on the Start Unauthorized Page","tests","2026-06-18","passed","2026-06-18","TestHeaderPage","header_test","",""
"","12","Verify value of the title of the tab","tests","2026-06-18","passed","2026-06-18","TestContactsPage","contacts_page_test","",""
"","1747","Verify redirection to telegram page not authorized user.","tests","2026-06-18","passed","2026-06-18","TestDescriptionPage","description_page_test","",""
"","810","Verify sizes of background-images in links on the page","tests","2026-06-18","passed","2026-06-18","TestExercisesRuWordsPage","exercises_ru_words_page_test","",""
"","1028","Verify presence, visibility, clickability, href, status code of links in sections","tests","2026-06-18","passed","2026-06-18","TestURPage","used_resources_page_test","",""
"","1379","Verify if breadcrumbs links lead to correct pages after clicking","tests","2026-06-18","passed","2026-06-18","TestExercisesRuWordsPage","exercises_ru_words_page_test","",""
"","0","Verify attribute 'alt' of images in links on the 'ru' local","tests","2026-06-18","broken","2026-06-18","TestGroupsPage","groups_page_test","",""
"","11050","Select a random card from ""Предложения"" group and compare UI vs BACKEND data.","tests","2026-06-18","skipped","2026-06-18","TestCardsRU","Речевые упражнения.","",""
"","222","Verify composition and visibility of elements on the 1st-7th levels of nesting in the Footer","tests","2026-06-18","passed","2026-06-18","TestFooter","footer_test","",""
"","794","Verify if internal links in the Header for an authorized user 
            lead to correct pages after click","tests","2026-06-18","skipped","2026-06-18","TestHeaderPage","header_test","",""
"","1523","Verify composition, visibility of elements on the 11st-14th levels of nesting on the page","tests","2026-06-18","passed","2026-06-18","TestExercisesRuWordsFamilyPage","exercises_ru_words_family_page_test","",""
"","3457","Verify if group links lead to correct pages after clicking","tests","2026-06-18","passed","2026-06-18","TestExercisesRuSimilarPhrasesPage","exercises_ru_similar_phrases_page_test","",""
"","1767","Verify redirection to telegram page not authorized user.","tests","2026-06-18","passed","2026-06-18","TestMainPage","main_page_test","",""
"","772","Verify attribute values of images in contributors cards in grids","tests","2026-06-18","passed","2026-06-18","TestContributorsPage","contributors_page_test","",""
"","1713","Verify redirection to donate page not authorized user.","tests","2026-06-18","passed","2026-06-18","TestDescriptionPage","description_page_test","",""
"","7837","Verify clickability, href, status code of links in the Header for an unauthorized user","tests","2026-06-18","passed","2026-06-18","TestHeaderPage","header_test","",""
"","23","Verify value of the 'en' subtitles on the page","tests","2026-06-18","passed","2026-06-18","TestGroupsPage","groups_page_test","",""
"","33","Verify value of text on the page","tests","2026-06-18","passed","2026-06-18","TestSpecialistsPage","specialists_page_test","",""
"","1199","Checking the possibility of authorization with the correct data","tests","2026-06-18","passed","2026-06-18","TestAuthorizedUserPage","authorisation_page_test","",""
"","120","Verify presence, visibility of icons in the Header for an authorized user","tests","2026-06-18","passed","2026-06-18","TestHeaderPage","header_test","",""
"","41","Verify attributes of images in links on the page","tests","2026-06-18","passed","2026-06-18","TestExercisesRuSimilarPhrasesPage","exercises_ru_similar_phrases_page_test","",""
"","672","Verify redirection to contributors page not authorized user.","tests","2026-06-18","passed","2026-06-18","TestDescriptionPage","description_page_test","",""
"","132","Verify that the 'Logo' link on the Start Unauthorized Page 
                             doesn't refresh the current page or lead to other pages after clicking","tests","2026-06-18","passed","2026-06-18","TestHeaderPage","header_test","",""
"","20835","Check registration with new email and empty first name","tests","2026-06-18","passed","2026-06-18","TestRegistrationPage","registration_page_test","",""
"","10878","Select random card from group ""Слова Королёвой"" and compare UI vs BACKEND data.","tests","2026-06-18","skipped","2026-06-18","TestCardsRU","Речевые упражнения.","",""
"","50","Verify values of titles and subtitles with tags h2, h4 on the page","tests","2026-06-18","passed","2026-06-18","TestStartUnauthorizedPage","start_unauthorized_page_test","",""
"","89","Verify size of the image in the 'Logo' link in the Header for an authorized user","tests","2026-06-18","passed","2026-06-18","TestHeaderPage","header_test","",""
"","737","Verify values of the text in card descriptions","tests","2026-06-18","passed","2026-06-18","TestContributorsPage","contributors_page_test","",""
"","685","Verify clickability, href of links on the page","tests","2026-06-18","passed","2026-06-18","TestContributorsPage","contributors_page_test","",""
"","32","Verify value of title with tag 'h2' on the page","tests","2026-06-18","passed","2026-06-18","TestSpecialistsPage","specialists_page_test","",""
"","40","Verify presence, visibility and structure of content on the page","tests","2026-06-18","passed","2026-06-18","TestContributorsPage","contributors_page_test","",""
"","31","Verify value of the 'ru' title on the page","tests","2026-06-18","passed","2026-06-18","TestGroupsPage","groups_page_test","",""
"","309","Verify composition, visibility of elements on the 1st-7th levels of nesting on the page","tests","2026-06-18","passed","2026-06-18","TestExercisesRuSimilarPhrasesPage","exercises_ru_similar_phrases_page_test","",""
"","832","Verify if direct internal links in the Header for an authorized user 
            lead to correct pages after click","tests","2026-06-18","passed","2026-06-18","TestHeaderPage","header_test","",""
"","20824","Check registration with new email and empty email","tests","2026-06-18","passed","2026-06-18","TestRegistrationPage","registration_page_test","",""
"","681","Verify redirection to specialists page not authorized user.","tests","2026-06-18","passed","2026-06-18","TestMainPage","main_page_test","",""
"","171","Verify redirection to used resources page not authorized user.","tests","2026-06-18","passed","2026-06-18","TestDescriptionPage","description_page_test","",""
"","1771","Verify if internal links in the Header for an unauthorized user 
            lead to correct pages after click","tests","2026-06-18","passed","2026-06-18","TestHeaderPage","header_test","",""
"","104","Verify that the 'Contact us' link in the Footer calls an email client","tests","2026-06-18","passed","2026-06-18","TestFooter","footer_test","",""
"","689","Check registration with new email and empty password","tests","2026-06-18","passed","2026-06-18","TestRegistrationPage","registration_page_test","",""
"","10862","Select a random card from ""Группа слов"" group and compare UI vs BACKEND data.","tests","2026-06-18","skipped","2026-06-18","TestCardsRU","Речевые упражнения.","",""
"","661","Verify that the 'All Specialists' link leads an unauthorized user 
                         to the correct page after clicking","tests","2026-06-18","passed","2026-06-18","TestSpecialistsPage","specialists_page_test","",""
"","669","Verify redirection to specialists page not authorized user.","tests","2026-06-18","passed","2026-06-18","TestDescriptionPage","description_page_test","",""
"","110","Verify clickability, titles, attributes of group links on the page","tests","2026-06-18","passed","2026-06-18","TestExercisesRuSimilarPhrasesPage","exercises_ru_similar_phrases_page_test","",""
"","3791","Verify clickability, href, status code of series links on the page","tests","2026-06-18","passed","2026-06-18","TestExercisesRuSimilarPhrasesPage","exercises_ru_similar_phrases_page_test","",""
"","323","Verify composition, visibility of elements on the 1st-6th levels of nesting in the Header
            for an authorized user","tests","2026-06-18","passed","2026-06-18","TestHeaderPage","header_test","",""
