"Status","Start Time","Stop Time","Duration in ms","Parent Suite","Suite","Sub Suite","Test Class","Test Method","Name","Description"
"passed","Sun May 19 01:09:12 GMT 2024","Sun May 19 01:09:13 GMT 2024","788","tests","used_resources_page_test","TestUsedResourcesPage","","","Verify presence, visibility and accuracy of the icon in the 'Flora' link's section",""
"passed","Sun May 19 00:58:05 GMT 2024","Sun May 19 00:58:05 GMT 2024","3","tests","login_page_test","TestLoginPage","","","Test for authorization customer.",""
"passed","Sun May 19 01:01:00 GMT 2024","Sun May 19 01:01:00 GMT 2024","49","tests","specialists_page_test","TestSpecialistsPage","","","Verify presence and visibility of text sections (including names and professions) 
         in specialist cards in the grid",""
"passed","Sun May 19 00:55:08 GMT 2024","Sun May 19 00:55:11 GMT 2024","2673","tests","footer_test","TestFooter","","","Verify presence and visibility of Footer on each page specified in the kit",""
"passed","Sun May 19 01:07:36 GMT 2024","Sun May 19 01:07:37 GMT 2024","773","tests","used_resources_page_test","TestUsedResourcesPage","","","Verify presence and visibility of the section with the freepik.com link on the page",""
"passed","Sun May 19 01:02:00 GMT 2024","Sun May 19 01:02:00 GMT 2024","40","tests","start_unauthorized_page_test","TestStartUnauthorizedPage","","","Verify values of the text in the section 1 on the page",""
"passed","Sun May 19 01:01:09 GMT 2024","Sun May 19 01:01:09 GMT 2024","66","tests","specialists_page_test","TestSpecialistsPage","","","Verify values of profession in specialist cards in the grid",""
"passed","Sun May 19 00:58:09 GMT 2024","Sun May 19 00:58:09 GMT 2024","121","tests","main_page_test","TestMainPage","","","Verify redirection to description page not authorized user.",""
"passed","Sun May 19 01:07:59 GMT 2024","Sun May 19 01:07:59 GMT 2024","788","tests","used_resources_page_test","TestUsedResourcesPage","","","Verify presence, visibility and accuracy of the icon in the freepik.com link's section",""
"passed","Sun May 19 00:53:07 GMT 2024","Sun May 19 00:53:07 GMT 2024","29","tests","contacts_page_test","TestContactsPage","","","Verify presence and visibility of the dividing line on the page",""
"passed","Sun May 19 01:01:05 GMT 2024","Sun May 19 01:01:05 GMT 2024","65","tests","specialists_page_test","TestSpecialistsPage","","","Verify values of names in specialist cards in the grid",""
"passed","Sun May 19 00:58:17 GMT 2024","Sun May 19 00:58:18 GMT 2024","980","tests","main_page_test","TestMainPage","","","Verify redirection to donate page not authorized user.",""
"passed","Sun May 19 01:00:26 GMT 2024","Sun May 19 01:00:26 GMT 2024","66","tests","specialists_page_test","TestSpecialistsPage","","","Verify presence, visibility and text accuracy of the title on the Specialists page",""
"passed","Sun May 19 00:57:52 GMT 2024","Sun May 19 00:57:52 GMT 2024","72","tests","footer_test","TestFooter","","","Verify presence, visibility and accuracy of the Selectel link's image in Footer",""
"passed","Sun May 19 00:56:00 GMT 2024","Sun May 19 00:56:02 GMT 2024","2641","tests","footer_test","TestFooter","","","Verify that the ARASAAC link in Footer leads to the correct page after click",""
"passed","Sun May 19 01:02:16 GMT 2024","Sun May 19 01:02:16 GMT 2024","133","tests","start_unauthorized_page_test","TestStartUnauthorizedPage","","","Verify that the 'Login' link leads to the correct page after clicking",""
"passed","Sun May 19 00:54:25 GMT 2024","Sun May 19 00:54:25 GMT 2024","151","tests","description_page_test","TestDescriptionPage","","","Verify redirection to contacts page not authorized user.",""
"passed","Sun May 19 01:02:08 GMT 2024","Sun May 19 01:02:08 GMT 2024","99","tests","start_unauthorized_page_test","TestStartUnauthorizedPage","","","Verify attribute values and size of the image in the section 1 on the page",""
"passed","Sun May 19 00:55:46 GMT 2024","Sun May 19 00:55:46 GMT 2024","86","tests","footer_test","TestFooter","","","Verify presence, visibility and accuracy of the Contact us link in Footer",""
"passed","Sun May 19 01:00:51 GMT 2024","Sun May 19 01:00:51 GMT 2024","228","tests","specialists_page_test","TestSpecialistsPage","","","Verify attribute values and sizes of images in specialist cards in the grid",""
"passed","Sun May 19 00:54:20 GMT 2024","Sun May 19 00:54:22 GMT 2024","1615","tests","description_page_test","TestDescriptionPage","","","Verify redirection to donate page not authorized user.",""
