"Status","Start Time","Stop Time","Duration in ms","Parent Suite","Suite","Sub Suite","Test Class","Test Method","Name","Description"
"passed","Sun May 19 01:07:43 GMT 2024","Sun May 19 01:07:44 GMT 2024","976","tests","used_resources_page_test","TestUsedResourcesPage","","","Verify presence, visibility, clickability, href, status code, text of the freepik.com link",""
"passed","Sun May 19 00:54:07 GMT 2024","Sun May 19 00:54:08 GMT 2024","417","tests","contributors_page_test","TestContributorsPage","","","Verify values of the text in card descriptions",""
"passed","Sun May 19 00:53:56 GMT 2024","Sun May 19 00:53:56 GMT 2024","38","tests","contributors_page_test","TestContributorsPage","","","Verify value of title with tag 'h2' on the page",""
"passed","Sun May 19 01:03:57 GMT 2024","Sun May 19 01:04:08 GMT 2024","11023","tests","Речевые упражнения.","TestCardsRU","","","Select a random card from ""Группа слов"" group and compare UI vs BACKEND data.",""
"passed","Sun May 19 01:04:28 GMT 2024","Sun May 19 01:04:38 GMT 2024","9960","tests","Речевые упражнения.","TestCardsRU","","","Select a random card from ""Слова с частотной группировкой"" group and compare UI vs BACKEND data.",""
"passed","Sun May 19 00:53:26 GMT 2024","Sun May 19 00:53:26 GMT 2024","31","tests","contacts_page_test","TestContactsPage","","","Verify values of the text in links in sections 1, 2 on the page",""
"passed","Sun May 19 00:58:42 GMT 2024","Sun May 19 00:58:42 GMT 2024","85","tests","main_page_test","TestMainPage","","","Checking the clickability of the Start button.",""
"passed","Sun May 19 00:53:12 GMT 2024","Sun May 19 00:53:12 GMT 2024","33","tests","contacts_page_test","TestContactsPage","","","Verify value of title with tag 'h1' on the page",""
"passed","Sun May 19 00:58:22 GMT 2024","Sun May 19 00:58:22 GMT 2024","149","tests","main_page_test","TestMainPage","","","Verify redirection to contacts page not authorized user.",""
"passed","Sun May 19 00:53:35 GMT 2024","Sun May 19 00:53:37 GMT 2024","1214","tests","contacts_page_test","TestContactsPage","","","Verify that links in sections 1, 2 lead to the correct pages after click",""
"passed","Sun May 19 01:07:50 GMT 2024","Sun May 19 01:07:53 GMT 2024","2384","tests","used_resources_page_test","TestUsedResourcesPage","","","Verify that the freepik.com link leads to the correct page after click",""
"passed","Sun May 19 00:59:44 GMT 2024","Sun May 19 00:59:45 GMT 2024","675","tests","registration_page_test","TestRegistrationPage","","","Check registration with new email and empty first name",""
"passed","Sun May 19 00:58:25 GMT 2024","Sun May 19 00:58:26 GMT 2024","646","tests","main_page_test","TestMainPage","","","Verify redirection to specialists page not authorized user.",""
"passed","Sun May 19 00:53:30 GMT 2024","Sun May 19 00:53:31 GMT 2024","718","tests","contacts_page_test","TestContactsPage","","","Verify presence, visibility, clickability, href, prefix, status code 
        of links in sections 1, 2 on the page",""
"passed","Sun May 19 00:53:21 GMT 2024","Sun May 19 00:53:21 GMT 2024","32","tests","contacts_page_test","TestContactsPage","","","Verify values of the text in sections 1, 2 on the page",""
"passed","Sun May 19 01:08:25 GMT 2024","Sun May 19 01:08:27 GMT 2024","1742","tests","used_resources_page_test","TestUsedResourcesPage","","","Verify that the 'Plants' link leads to the correct page after click",""
"passed","Sun May 19 00:57:49 GMT 2024","Sun May 19 00:57:49 GMT 2024","85","tests","footer_test","TestFooter","","","Verify changes of visible sizes of the REG.RU link's image in Footer",""
"passed","Sun May 19 01:02:11 GMT 2024","Sun May 19 01:02:12 GMT 2024","714","tests","start_unauthorized_page_test","TestStartUnauthorizedPage","","","Verify presence, visibility, clickability, href, status code, text 
                         of the 'Login' link in the section 1 on the page",""
"passed","Sun May 19 01:08:05 GMT 2024","Sun May 19 01:08:06 GMT 2024","780","tests","used_resources_page_test","TestUsedResourcesPage","","","Verify sizes of the icon in the freepik.com link's section",""
"passed","Sun May 19 00:53:16 GMT 2024","Sun May 19 00:53:16 GMT 2024","25","tests","contacts_page_test","TestContactsPage","","","Verify values of subtitles with tag 'h2' on the page",""
"passed","Sun May 19 01:09:04 GMT 2024","Sun May 19 01:09:07 GMT 2024","2438","tests","used_resources_page_test","TestUsedResourcesPage","","","Verify that the 'Flora' link leads to the correct page after click",""
"passed","Sun May 19 01:09:19 GMT 2024","Sun May 19 01:09:20 GMT 2024","776","tests","used_resources_page_test","TestUsedResourcesPage","","","Verify sizes of the icon in the 'Flora' link's section",""
"passed","Sun May 19 00:56:24 GMT 2024","Sun May 19 00:56:54 GMT 2024","30236","tests","footer_test","TestFooter","","","Verify that the REG.RU link in Footer leads to the correct page after click",""
"passed","Sun May 19 00:58:45 GMT 2024","Sun May 19 00:58:45 GMT 2024","105","tests","main_page_test","TestMainPage","","","Checking the clickability of the Registration button.",""
"passed","Sun May 19 00:57:56 GMT 2024","Sun May 19 00:57:56 GMT 2024","49","tests","footer_test","TestFooter","","","Verify visible sizes of the Selectel link's image in Footer",""
"passed","Sun May 19 00:57:45 GMT 2024","Sun May 19 00:57:45 GMT 2024","49","tests","footer_test","TestFooter","","","Verify visible sizes of the REG.RU link's image in Footer",""
"passed","Sun May 19 01:08:55 GMT 2024","Sun May 19 01:08:57 GMT 2024","2546","tests","used_resources_page_test","TestUsedResourcesPage","","","Verify presence, visibility, clickability, href, status code, text of the 'Flora' link",""
"passed","Sun May 19 00:59:56 GMT 2024","Sun May 19 00:59:57 GMT 2024","607","tests","registration_page_test","TestRegistrationPage","","","Check registration without choosing gender",""
"passed","Sun May 19 00:54:57 GMT 2024","Sun May 19 00:55:00 GMT 2024","2715","tests","footer_test","TestFooter","","","Verify presence and visibility of Footer on each page specified in the kit",""
"skipped","Sun May 19 01:04:44 GMT 2024","Sun May 19 01:05:11 GMT 2024","26269","tests","Речевые упражнения.","TestCardsRU","","","Solutions to a random task in the ""Слова"" .",""
"passed","Sun May 19 00:52:49 GMT 2024","Sun May 19 00:52:49 GMT 2024","62","tests","contacts_page_test","TestContactsPage","","","Verify presence, visibility and structure of content on the page",""
"passed","Sun May 19 01:04:14 GMT 2024","Sun May 19 01:04:23 GMT 2024","8346","tests","Речевые упражнения.","TestCardsRU","","","Select a random card from ""Предложения"" group and compare UI vs BACKEND data.",""
"skipped","Sun May 19 01:05:11 GMT 2024","Sun May 19 01:05:11 GMT 2024","0","tests","Речевые упражнения.","TestCardsRU","","","Solutions to a random task in the ""Слова Королёвой"" .",""
"passed","Sun May 19 00:57:10 GMT 2024","Sun May 19 00:57:10 GMT 2024","76","tests","footer_test","TestFooter","","","Verify presence, visibility and accuracy of the ARASAAC link's image in Footer",""
"passed","Sun May 19 01:08:40 GMT 2024","Sun May 19 01:08:41 GMT 2024","772","tests","used_resources_page_test","TestUsedResourcesPage","","","Verify sizes of the icon in the 'Plants' link's section",""
"passed","Sun May 19 01:01:43 GMT 2024","Sun May 19 01:01:43 GMT 2024","25","tests","start_unauthorized_page_test","TestStartUnauthorizedPage","","","Verify amount and visibility of sections with content on the page",""
"passed","Sun May 19 00:58:29 GMT 2024","Sun May 19 00:58:30 GMT 2024","1245","tests","main_page_test","TestMainPage","","","Verify redirection to github not authorized user.",""
"passed","Sun May 19 00:55:19 GMT 2024","Sun May 19 00:55:22 GMT 2024","2731","tests","footer_test","TestFooter","","","Verify accuracy of texts in Footer on each page specified in the kit",""
"passed","Sun May 19 01:00:35 GMT 2024","Sun May 19 01:00:35 GMT 2024","43","tests","specialists_page_test","TestSpecialistsPage","","","Verify presence, visibility and size of the grid on the Specialists page",""
"passed","Sun May 19 00:52:38 GMT 2024","Sun May 19 00:52:40 GMT 2024","1631","tests","authorisation_page_test","TestAuthorizedUserPage","","","Checking the possibility of authorization with the correct data",""
"passed","Sun May 19 00:58:13 GMT 2024","Sun May 19 00:58:14 GMT 2024","1164","tests","main_page_test","TestMainPage","","","Verify redirection to telegram page not authorized user.",""
"passed","Sun May 19 00:54:50 GMT 2024","Sun May 19 00:54:53 GMT 2024","2741","tests","footer_test","TestFooter","","","Verify presence and visibility of Footer on each page specified in the kit",""
"skipped","Sun May 19 01:06:38 GMT 2024","Sun May 19 01:06:59 GMT 2024","20594","tests","Statistic.","TestCardsRU","","","Check statistic table.",""
"passed","Sun May 19 00:54:11 GMT 2024","Sun May 19 00:54:12 GMT 2024","121","tests","description_page_test","TestDescriptionPage","","","Verify return main page from description page.",""
"passed","Sun May 19 00:58:49 GMT 2024","Sun May 19 00:59:19 GMT 2024","30537","tests","profile_page_test","TestProfilePage","","","Change the password by receiving an email link",""
"passed","Sun May 19 01:00:55 GMT 2024","Sun May 19 01:00:55 GMT 2024","98","tests","specialists_page_test","TestSpecialistsPage","","","Verify presence, visibility and accuracy of the 1th card's image in the grid",""
"passed","Sun May 19 00:55:12 GMT 2024","Sun May 19 00:55:14 GMT 2024","2531","tests","footer_test","TestFooter","","","Verify presence and visibility of Footer on each page specified in the kit",""
"passed","Sun May 19 01:01:39 GMT 2024","Sun May 19 01:01:39 GMT 2024","33","tests","start_unauthorized_page_test","TestStartUnauthorizedPage","","","Verify presence and visibility of content on the page",""
"passed","Sun May 19 01:01:53 GMT 2024","Sun May 19 01:01:53 GMT 2024","25","tests","start_unauthorized_page_test","TestStartUnauthorizedPage","","","Verify values of titles with tag 'h2' on the page",""
"passed","Sun May 19 00:53:52 GMT 2024","Sun May 19 00:53:52 GMT 2024","41","tests","contributors_page_test","TestContributorsPage","","","Verify amount of contributor cards with images, links and descriptions in the section grid",""
"passed","Sun May 19 01:07:17 GMT 2024","Sun May 19 01:07:17 GMT 2024","806","tests","used_resources_page_test","TestUsedResourcesPage","","","Verify presence, visibility and text accuracy of the title on the page",""
"passed","Sun May 19 00:54:54 GMT 2024","Sun May 19 00:54:56 GMT 2024","2371","tests","footer_test","TestFooter","","","Verify presence and visibility of Footer on each page specified in the kit",""
"passed","Sun May 19 00:52:58 GMT 2024","Sun May 19 00:52:58 GMT 2024","24","tests","contacts_page_test","TestContactsPage","","","Verify the composition and visibility of elements on the 1st level of nesting in the section 1",""
"passed","Sun May 19 00:55:01 GMT 2024","Sun May 19 00:55:04 GMT 2024","2831","tests","footer_test","TestFooter","","","Verify presence and visibility of Footer on each page specified in the kit",""
"passed","Sun May 19 00:55:33 GMT 2024","Sun May 19 00:55:34 GMT 2024","141","tests","footer_test","TestFooter","","","Verify presence, visibility, clickability, href, status code of the JETBRAINS link in Footer",""
"passed","Sun May 19 00:54:47 GMT 2024","Sun May 19 00:54:49 GMT 2024","2536","tests","footer_test","TestFooter","","","Verify presence and visibility of Footer on each page specified in the kit",""
"passed","Sun May 19 00:57:59 GMT 2024","Sun May 19 00:57:59 GMT 2024","85","tests","footer_test","TestFooter","","","Verify changes of visible sizes of the Selectel link's image in Footer",""
"passed","Sun May 19 00:59:36 GMT 2024","Sun May 19 00:59:37 GMT 2024","676","tests","registration_page_test","TestRegistrationPage","","","Check registration with new email and empty confirm password",""
"passed","Sun May 19 01:01:50 GMT 2024","Sun May 19 01:01:50 GMT 2024","102","tests","start_unauthorized_page_test","TestStartUnauthorizedPage","","","Verify the composition and visibility of elements 
        on the 1st, 2nd, 3rd levels of nesting in the section 2",""
"passed","Sun May 19 00:53:02 GMT 2024","Sun May 19 00:53:02 GMT 2024","143","tests","contacts_page_test","TestContactsPage","","","Verify the composition and visibility of elements 
        on the 1st, 2nd, 3rd, 4th, 5th levels of nesting in the section 2",""
"passed","Sun May 19 00:57:13 GMT 2024","Sun May 19 00:57:13 GMT 2024","48","tests","footer_test","TestFooter","","","Verify visible sizes of the ARASAAC link's image in Footer",""
"passed","Sun May 19 00:57:24 GMT 2024","Sun May 19 00:57:24 GMT 2024","47","tests","footer_test","TestFooter","","","Verify visible sizes of the EPAM link's image in Footer",""
"passed","Sun May 19 00:57:31 GMT 2024","Sun May 19 00:57:31 GMT 2024","71","tests","footer_test","TestFooter","","","Verify presence, visibility and accuracy of the JETBRAINS link's image in Footer",""
"passed","Sun May 19 01:01:19 GMT 2024","Sun May 19 01:01:24 GMT 2024","5243","tests","specialists_page_test","TestSpecialistsPage","","","Verify that the 'All Specialists' link leads an unauthorized user 
                         to the correct page after clicking",""
"passed","Sun May 19 01:01:30 GMT 2024","Sun May 19 01:01:36 GMT 2024","5909","tests","specialists_page_test","TestSpecialistsPage","","","Verify that the 'All Specialists' link leads an authorized user 
                         to the correct page after clicking",""
"passed","Sun May 19 01:00:40 GMT 2024","Sun May 19 01:00:40 GMT 2024","16","tests","specialists_page_test","TestSpecialistsPage","","","Verify visibility of cards in the grid on the Specialists page",""
"passed","Sun May 19 00:52:43 GMT 2024","Sun May 19 00:52:44 GMT 2024","896","tests","authorisation_page_test","TestAuthorizedUserPage","","","Checking the possibility of authorization with incorrect data",""
"passed","Sun May 19 01:02:22 GMT 2024","Sun May 19 01:02:32 GMT 2024","10630","tests","Speech exercises EN.","TestCardsEN","","","Select random card from ""Word"" group and compare UI vs BACKEND data",""
"passed","Sun May 19 01:00:45 GMT 2024","Sun May 19 01:00:46 GMT 2024","1018","tests","specialists_page_test","TestSpecialistsPage","","","Verify presence and visibility of images in specialist cards in the grid",""
"passed","Sun May 19 00:55:37 GMT 2024","Sun May 19 00:55:38 GMT 2024","702","tests","footer_test","TestFooter","","","Verify presence, visibility, clickability, href, status code of the REG.RU link in Footer",""
"passed","Sun May 19 00:53:47 GMT 2024","Sun May 19 00:53:48 GMT 2024","1427","tests","contributors_page_test","TestContributorsPage","","","Verify the composition and visibility of elements on the 1st, 2nd, 3rd, 4th levels of nesting in the section",""
"passed","Sun May 19 00:54:29 GMT 2024","Sun May 19 00:54:29 GMT 2024","642","tests","description_page_test","TestDescriptionPage","","","Verify redirection to specialists page not authorized user.",""
"passed","Sun May 19 00:55:25 GMT 2024","Sun May 19 00:55:26 GMT 2024","707","tests","footer_test","TestFooter","","","Verify presence, visibility, clickability, href, status code of the ARASAAC link in Footer",""
"passed","Sun May 19 01:01:57 GMT 2024","Sun May 19 01:01:57 GMT 2024","28","tests","start_unauthorized_page_test","TestStartUnauthorizedPage","","","Verify values of subtitles with tag 'h4' on the page",""
"passed","Sun May 19 00:53:44 GMT 2024","Sun May 19 00:53:44 GMT 2024","24","tests","contributors_page_test","TestContributorsPage","","","Verify amount and visibility of sections with content on the page",""
"passed","Sun May 19 00:58:38 GMT 2024","Sun May 19 00:58:38 GMT 2024","148","tests","main_page_test","TestMainPage","","","Verify redirection to used resources page not authorized user.",""
"passed","Sun May 19 00:57:06 GMT 2024","Sun May 19 00:57:06 GMT 2024","79","tests","footer_test","TestFooter","","","Verify that the Contact us link in Footer calls an email client",""
"passed","Sun May 19 00:54:42 GMT 2024","Sun May 19 00:54:42 GMT 2024","143","tests","description_page_test","TestDescriptionPage","","","Verify redirection to used resources page not authorized user.",""
"passed","Sun May 19 01:03:09 GMT 2024","Sun May 19 01:03:20 GMT 2024","10725","tests","Речевые упражнения.","TestCardsRU","","","Select random card from group ""Слова"" and compare UI vs BACKEND data.",""
"passed","Sun May 19 01:08:12 GMT 2024","Sun May 19 01:08:12 GMT 2024","775","tests","used_resources_page_test","TestUsedResourcesPage","","","Verify presence and visibility of the section with the 'Plants' link on the page",""
"passed","Sun May 19 00:57:38 GMT 2024","Sun May 19 00:57:38 GMT 2024","84","tests","footer_test","TestFooter","","","Verify changes of visible sizes of the JETBRAINS link's image in Footer",""
"passed","Sun May 19 01:00:31 GMT 2024","Sun May 19 01:00:31 GMT 2024","63","tests","specialists_page_test","TestSpecialistsPage","","","Verify presence, visibility and content accuracy of the text on the Specialists page",""
"passed","Sun May 19 00:54:38 GMT 2024","Sun May 19 00:54:38 GMT 2024","644","tests","description_page_test","TestDescriptionPage","","","Verify redirection to contributors page not authorized user.",""
"passed","Sun May 19 00:57:35 GMT 2024","Sun May 19 00:57:35 GMT 2024","50","tests","footer_test","TestFooter","","","Verify visible sizes of the JETBRAINS link's image in Footer",""
"passed","Sun May 19 01:01:14 GMT 2024","Sun May 19 01:01:15 GMT 2024","611","tests","specialists_page_test","TestSpecialistsPage","","","Verify presence, visibility, clickability, href, status code, text 
                         of the 'All Specialists' link on the Specialists page",""
"passed","Sun May 19 01:08:34 GMT 2024","Sun May 19 01:08:34 GMT 2024","795","tests","used_resources_page_test","TestUsedResourcesPage","","","Verify presence, visibility and accuracy of the icon in the 'Plants' link's section",""
"passed","Sun May 19 00:55:15 GMT 2024","Sun May 19 00:55:18 GMT 2024","2726","tests","footer_test","TestFooter","","","Verify accuracy of texts in Footer on each page specified in the kit",""
"passed","Sun May 19 01:07:30 GMT 2024","Sun May 19 01:07:31 GMT 2024","770","tests","used_resources_page_test","TestUsedResourcesPage","","","Verify presence and visibility of the section with links on the page",""
"passed","Sun May 19 00:56:15 GMT 2024","Sun May 19 00:56:20 GMT 2024","5111","tests","footer_test","TestFooter","","","Verify that the JETBRAINS link in Footer leads to the correct page after click",""
"passed","Sun May 19 01:02:54 GMT 2024","Sun May 19 01:03:03 GMT 2024","9312","tests","Speech exercises EN.","TestCardsEN","","","Select a random card from ""Similar phrases"" group and compare UI vs BACKEND data",""
"passed","Sun May 19 00:59:48 GMT 2024","Sun May 19 00:59:49 GMT 2024","675","tests","registration_page_test","TestRegistrationPage","","","Check registration with new email and empty birthday",""
"passed","Sun May 19 00:54:04 GMT 2024","Sun May 19 00:54:04 GMT 2024","19","tests","contributors_page_test","TestContributorsPage","","","Verify values of the text in the slogan on the page",""
"passed","Sun May 19 00:55:52 GMT 2024","Sun May 19 00:55:56 GMT 2024","4411","tests","footer_test","TestFooter","","","Verify Footer invisibility through the modal window with the exercise",""
"passed","Sun May 19 00:55:30 GMT 2024","Sun May 19 00:55:30 GMT 2024","189","tests","footer_test","TestFooter","","","Verify presence, visibility, clickability, href, status code of the EPAM link in Footer",""
"passed","Sun May 19 00:56:06 GMT 2024","Sun May 19 00:56:11 GMT 2024","5284","tests","footer_test","TestFooter","","","Verify that the EPAM link in Footer leads to the correct page after click",""
"passed","Sun May 19 00:52:53 GMT 2024","Sun May 19 00:52:53 GMT 2024","20","tests","contacts_page_test","TestContactsPage","","","Verify amount and visibility of sections with content on the page",""
"passed","Sun May 19 00:54:33 GMT 2024","Sun May 19 00:54:34 GMT 2024","1562","tests","description_page_test","TestDescriptionPage","","","Verify redirection to github not authorized user.",""
"skipped","Sun May 19 01:06:10 GMT 2024","Sun May 19 01:06:30 GMT 2024","20204","tests","Речевые упражнения.","TestCardsRU","","","Solutions to a random task in the ""Слова"" group and comparison of statics.",""
"passed","Sun May 19 01:08:18 GMT 2024","Sun May 19 01:08:19 GMT 2024","1187","tests","used_resources_page_test","TestUsedResourcesPage","","","Verify presence, visibility, clickability, href, status code, text of the 'Plants' link",""
"passed","Sun May 19 01:02:04 GMT 2024","Sun May 19 01:02:04 GMT 2024","38","tests","start_unauthorized_page_test","TestStartUnauthorizedPage","","","Verify values of the text in the section 2 on the page",""
"passed","Sun May 19 00:55:41 GMT 2024","Sun May 19 00:55:42 GMT 2024","762","tests","footer_test","TestFooter","","","Verify presence, visibility, clickability, href, status code of the Selectel link in Footer",""
"passed","Sun May 19 00:56:58 GMT 2024","Sun May 19 00:57:02 GMT 2024","4496","tests","footer_test","TestFooter","","","Verify that the SELECTEL link in Footer leads to the correct page after click",""
"passed","Sun May 19 00:58:34 GMT 2024","Sun May 19 00:58:35 GMT 2024","647","tests","main_page_test","TestMainPage","","","Verify redirection to contributors page not authorized user.",""
"passed","Sun May 19 00:57:42 GMT 2024","Sun May 19 00:57:42 GMT 2024","73","tests","footer_test","TestFooter","","","Verify presence, visibility and accuracy of the REG.RU link's image in Footer",""
"passed","Sun May 19 00:57:27 GMT 2024","Sun May 19 00:57:28 GMT 2024","88","tests","footer_test","TestFooter","","","Verify changes of visible sizes of the EPAM link's image in Footer",""
"passed","Sun May 19 01:03:41 GMT 2024","Sun May 19 01:03:52 GMT 2024","10269","tests","Речевые упражнения.","TestCardsRU","","","Select a random card from ""Похожие фразы"" group and compare UI vs BACKEND data.",""
"passed","Sun May 19 00:59:52 GMT 2024","Sun May 19 00:59:53 GMT 2024","647","tests","registration_page_test","TestRegistrationPage","","","Check registration with new email and empty email",""
"passed","Sun May 19 01:02:39 GMT 2024","Sun May 19 01:02:48 GMT 2024","9463","tests","Speech exercises EN.","TestCardsEN","","","Check progres-bar and buttons.",""
"passed","Sun May 19 01:00:01 GMT 2024","Sun May 19 01:00:21 GMT 2024","20729","tests","registration_page_test","TestRegistrationPage","","","Check registration without choosing agreement",""
"passed","Sun May 19 00:59:40 GMT 2024","Sun May 19 00:59:41 GMT 2024","660","tests","registration_page_test","TestRegistrationPage","","","Check registration with new email and empty password",""
"passed","Sun May 19 01:03:26 GMT 2024","Sun May 19 01:03:36 GMT 2024","9672","tests","Речевые упражнения.","TestCardsRU","","","Select random card from group ""Слова Королёвой"" and compare UI vs BACKEND data.",""
"passed","Sun May 19 00:53:59 GMT 2024","Sun May 19 00:53:59 GMT 2024","30","tests","contributors_page_test","TestContributorsPage","","","Verify values of subtitles with tag 'h3' on the page",""
"passed","Sun May 19 01:07:23 GMT 2024","Sun May 19 01:07:24 GMT 2024","805","tests","used_resources_page_test","TestUsedResourcesPage","","","Verify presence, visibility and content accuracy of the text on the page",""
"passed","Sun May 19 00:54:15 GMT 2024","Sun May 19 00:54:16 GMT 2024","1122","tests","description_page_test","TestDescriptionPage","","","Verify redirection to telegram page not authorized user.",""
"passed","Sun May 19 00:59:31 GMT 2024","Sun May 19 00:59:33 GMT 2024","1183","tests","registration_page_test","TestRegistrationPage","","","Check registration with an existing email",""
"passed","Sun May 19 00:59:23 GMT 2024","Sun May 19 00:59:28 GMT 2024","5226","tests","registration_page_test","TestRegistrationPage","","","Check registration with new email",""
"passed","Sun May 19 00:57:20 GMT 2024","Sun May 19 00:57:20 GMT 2024","73","tests","footer_test","TestFooter","","","Verify presence, visibility and accuracy of the EPAM link's image in Footer",""
"passed","Sun May 19 00:55:05 GMT 2024","Sun May 19 00:55:07 GMT 2024","2493","tests","footer_test","TestFooter","","","Verify presence and visibility of Footer on each page specified in the kit",""
"passed","Sun May 19 00:54:43 GMT 2024","Sun May 19 00:54:46 GMT 2024","2752","tests","footer_test","TestFooter","","","Verify presence and visibility of Footer on each page specified in the kit",""
"passed","Sun May 19 01:01:46 GMT 2024","Sun May 19 01:01:46 GMT 2024","91","tests","start_unauthorized_page_test","TestStartUnauthorizedPage","","","Verify the composition and visibility of elements 
        on the 1st, 2nd, 3rd levels of nesting in the section 1",""
"passed","Sun May 19 00:57:17 GMT 2024","Sun May 19 00:57:17 GMT 2024","84","tests","footer_test","TestFooter","","","Verify changes of visible sizes of the ARASAAC link's image in Footer",""
"passed","Sun May 19 00:53:40 GMT 2024","Sun May 19 00:53:40 GMT 2024","87","tests","contributors_page_test","TestContributorsPage","","","Verify presence, visibility and structure of content on the page",""
"passed","Sun May 19 01:08:48 GMT 2024","Sun May 19 01:08:49 GMT 2024","787","tests","used_resources_page_test","TestUsedResourcesPage","","","Verify presence and visibility of the section with the 'Flora' link on the page",""
