"Status","Start Time","Stop Time","Duration in ms","Parent Suite","Suite","Sub Suite","Test Class","Test Method","Name","Description"
"skipped","Fri Feb 28 01:18:49 GMT 2025","Fri Feb 28 01:19:10 GMT 2025","20156","tests","Speech exercises EN.","TestCardsEN","","","Select random card from ""Word"" group and compare UI vs BACKEND data",""
"passed","Fri Feb 28 01:06:37 GMT 2025","Fri Feb 28 01:06:37 GMT 2025","48","tests","footer_test","TestFooter","","","Verify content of text in the Footer",""
"passed","Fri Feb 28 01:18:35 GMT 2025","Fri Feb 28 01:18:35 GMT 2025","183","tests","start_unauthorized_page_test","TestStartUnauthorizedPage","","","Verify that the 'Login' link leads to the correct page after clicking",""
"passed","Fri Feb 28 01:17:23 GMT 2025","Fri Feb 28 01:17:23 GMT 2025","42","tests","specialists_page_test","TestSpecialistsPage","","","Verify text in the 'All Specialists' link",""
"passed","Fri Feb 28 01:08:17 GMT 2025","Fri Feb 28 01:08:34 GMT 2025","16389","tests","groups_page_test","TestGroupsPage","","","Verify value of the title and subtitles on the page",""
"passed","Fri Feb 28 01:00:07 GMT 2025","Fri Feb 28 01:00:09 GMT 2025","1355","tests","contributors_page_test","TestContributorsPage","","","Verify values of the text in card descriptions",""
"skipped","Fri Feb 28 01:21:56 GMT 2025","Fri Feb 28 01:22:19 GMT 2025","23516","tests","Речевые упражнения.","TestCardsRU","","","Select a random card from ""Слова с частотной группировкой"" group and compare UI vs BACKEND data.",""
"passed","Fri Feb 28 01:11:51 GMT 2025","Fri Feb 28 01:12:01 GMT 2025","10269","tests","header_test","TestHeaderPage","","","Verify composition, visibility of elements on the 1st-6th levels of nesting in the Header
            for an authorized user",""
"passed","Fri Feb 28 01:18:10 GMT 2025","Fri Feb 28 01:18:11 GMT 2025","122","tests","start_unauthorized_page_test","TestStartUnauthorizedPage","","","Verify the composition and visibility of elements 
        on the 1st-3rd levels of nesting in the section 2",""
"passed","Fri Feb 28 01:00:55 GMT 2025","Fri Feb 28 01:00:56 GMT 2025","707","tests","description_page_test","TestDescriptionPage","","","Verify redirection to specialists page not authorized user.",""
"passed","Fri Feb 28 00:58:50 GMT 2025","Fri Feb 28 00:58:50 GMT 2025","133","tests","contacts_page_test","TestContactsPage","","","Verify the composition and visibility of elements 
        on the 1st-5th levels of nesting in the section 2",""
"passed","Fri Feb 28 01:14:43 GMT 2025","Fri Feb 28 01:14:44 GMT 2025","689","tests","main_page_test","TestMainPage","","","Verify redirection to contributors page not authorized user.",""
"passed","Fri Feb 28 01:07:52 GMT 2025","Fri Feb 28 01:07:55 GMT 2025","3121","tests","groups_page_test","TestGroupsPage","","","Verify presence, visibility of the title, tiles, links, images, subtitles on the page",""
"passed","Fri Feb 28 01:18:26 GMT 2025","Fri Feb 28 01:18:26 GMT 2025","41","tests","start_unauthorized_page_test","TestStartUnauthorizedPage","","","Verify text in the 'Login' link in the section 1",""
"passed","Fri Feb 28 01:27:21 GMT 2025","Fri Feb 28 01:27:21 GMT 2025","37","tests","used_resources_page_test","TestUsedResourcesPage","","","Verify value of title with tag 'h1' on the page",""
"skipped","Fri Feb 28 01:26:43 GMT 2025","Fri Feb 28 01:26:51 GMT 2025","7314","tests","Речевые упражнения.","TestCardsRU","","","Solutions to a random task in the ""Слова"" group and comparison of statics.",""
"passed","Fri Feb 28 01:01:56 GMT 2025","Fri Feb 28 01:01:56 GMT 2025","78","tests","exercises_ru_words_page_test","TestExercisesRuWordsPage","","","Verify presence and visibility of content on the page",""
"passed","Fri Feb 28 01:20:30 GMT 2025","Fri Feb 28 01:20:41 GMT 2025","11648","tests","Речевые упражнения.","TestCardsRU","","","Select random card from group ""Слова Королёвой"" and compare UI vs BACKEND data.",""
"passed","Fri Feb 28 01:13:41 GMT 2025","Fri Feb 28 01:13:41 GMT 2025","44","tests","header_test","TestHeaderPage","","","Verify presence, visibility and attributes of the image in the 'Logo' link in the Header 
               for an authorized user",""
"passed","Fri Feb 28 01:18:06 GMT 2025","Fri Feb 28 01:18:07 GMT 2025","94","tests","start_unauthorized_page_test","TestStartUnauthorizedPage","","","Verify the composition and visibility of elements 
        on the 1st-3rd levels of nesting in the section 1",""
"passed","Fri Feb 28 01:14:56 GMT 2025","Fri Feb 28 01:14:56 GMT 2025","128","tests","main_page_test","TestMainPage","","","Checking the clickability of the Registration button.",""
"passed","Fri Feb 28 01:18:39 GMT 2025","Fri Feb 28 01:18:39 GMT 2025","80","tests","start_unauthorized_page_test","TestStartUnauthorizedPage","","","Verify presence, visibility and attributes of the image in the section 1",""
"passed","Fri Feb 28 01:14:48 GMT 2025","Fri Feb 28 01:14:48 GMT 2025","225","tests","main_page_test","TestMainPage","","","Verify redirection to used resources page not authorized user.",""
"passed","Fri Feb 28 01:13:48 GMT 2025","Fri Feb 28 01:13:48 GMT 2025","53","tests","header_test","TestHeaderPage","","","Verify size of the image in the 'Logo' link in the Header for an authorized user",""
"passed","Fri Feb 28 01:14:18 GMT 2025","Fri Feb 28 01:14:19 GMT 2025","1426","tests","main_page_test","TestMainPage","","","Verify redirection to telegram page not authorized user.",""
"passed","Fri Feb 28 01:07:42 GMT 2025","Fri Feb 28 01:07:45 GMT 2025","3163","tests","groups_page_test","TestGroupsPage","","","Verify composition, visibility of elements on the 1st-6th levels of nesting on the page",""
"passed","Fri Feb 28 01:14:14 GMT 2025","Fri Feb 28 01:14:14 GMT 2025","213","tests","main_page_test","TestMainPage","","","Verify redirection to description page not authorized user.",""
"passed","Fri Feb 28 01:20:12 GMT 2025","Fri Feb 28 01:20:23 GMT 2025","11479","tests","Речевые упражнения.","TestCardsRU","","","Select random card from group ""Слова"" and compare UI vs BACKEND data.",""
"passed","Fri Feb 28 00:59:34 GMT 2025","Fri Feb 28 00:59:34 GMT 2025","96","tests","contacts_page_test","TestContactsPage","","","Verify that the email link calls an email client",""
"passed","Fri Feb 28 01:26:57 GMT 2025","Fri Feb 28 01:27:00 GMT 2025","2966","tests","Statistic.","TestCardsRU","","","Check statistic table.",""
"passed","Fri Feb 28 01:10:29 GMT 2025","Fri Feb 28 01:10:29 GMT 2025","34","tests","header_test","TestHeaderPage","","","Verify presence and visibility of the Header for an unauthorized user",""
"passed","Fri Feb 28 01:03:35 GMT 2025","Fri Feb 28 01:03:37 GMT 2025","1168","tests","exercises_ru_words_page_test","TestExercisesRuWordsPage","","","Verify text in cards on the page",""
"passed","Fri Feb 28 01:15:48 GMT 2025","Fri Feb 28 01:15:49 GMT 2025","770","tests","registration_page_test","TestRegistrationPage","","","Check registration with new email and empty confirm password",""
"passed","Fri Feb 28 01:13:19 GMT 2025","Fri Feb 28 01:13:20 GMT 2025","255","tests","header_test","TestHeaderPage","","","Verify the dropdown opens/closes after clicking on the 'More' button in the Header 
               for an authorized user",""
"passed","Fri Feb 28 01:21:07 GMT 2025","Fri Feb 28 01:21:19 GMT 2025","11432","tests","Речевые упражнения.","TestCardsRU","","","Select a random card from ""Группа слов"" group and compare UI vs BACKEND data.",""
"passed","Fri Feb 28 01:14:10 GMT 2025","Fri Feb 28 01:14:10 GMT 2025","3","tests","login_page_test","TestLoginPage","","","Test for authorization customer.",""
"passed","Fri Feb 28 01:08:41 GMT 2025","Fri Feb 28 01:09:07 GMT 2025","26551","tests","groups_page_test","TestGroupsPage","","","Verify clickability, title, href, status code of links on the page",""
"passed","Fri Feb 28 01:16:12 GMT 2025","Fri Feb 28 01:16:12 GMT 2025","708","tests","registration_page_test","TestRegistrationPage","","","Check registration without choosing gender",""
"passed","Fri Feb 28 01:00:51 GMT 2025","Fri Feb 28 01:00:51 GMT 2025","180","tests","description_page_test","TestDescriptionPage","","","Verify redirection to contacts page not authorized user.",""
"passed","Fri Feb 28 01:07:12 GMT 2025","Fri Feb 28 01:07:12 GMT 2025","77","tests","footer_test","TestFooter","","","Verify attributes of images in links in the Footer",""
"passed","Fri Feb 28 01:15:32 GMT 2025","Fri Feb 28 01:15:39 GMT 2025","7029","tests","registration_page_test","TestRegistrationPage","","","Check registration with new email",""
"passed","Fri Feb 28 01:23:24 GMT 2025","Fri Feb 28 01:26:36 GMT 2025","191789","tests","Речевые упражнения.","TestCardsRU","","","Solutions to a random task in the ""Слова Королёвой"" .",""
"passed","Fri Feb 28 01:13:26 GMT 2025","Fri Feb 28 01:13:27 GMT 2025","197","tests","header_test","TestHeaderPage","","","Verify switching of the 'ru', 'en' buttons in the Header for an authorized user",""
"passed","Fri Feb 28 01:12:08 GMT 2025","Fri Feb 28 01:12:08 GMT 2025","396","tests","header_test","TestHeaderPage","","","Verify presence, visibility of links, buttons in the Header for an authorized user",""
"passed","Fri Feb 28 01:18:43 GMT 2025","Fri Feb 28 01:18:43 GMT 2025","75","tests","start_unauthorized_page_test","TestStartUnauthorizedPage","","","Verify size of the image in the section 1",""
"passed","Fri Feb 28 01:15:53 GMT 2025","Fri Feb 28 01:15:53 GMT 2025","748","tests","registration_page_test","TestRegistrationPage","","","Check registration with new email and empty password",""
"passed","Fri Feb 28 01:16:52 GMT 2025","Fri Feb 28 01:16:58 GMT 2025","5345","tests","specialists_page_test","TestSpecialistsPage","","","Verify presence, visibility of the title, text, link, grid, cards and images  
        on the 2nd, 3rd, 5th, 6th levels of nesting on the page",""
