"Status","Start Time","Stop Time","Duration in ms","Parent Suite","Suite","Sub Suite","Test Class","Test Method","Name","Description"
"passed","Fri Feb 28 01:11:20 GMT 2025","Fri Feb 28 01:11:20 GMT 2025","122","tests","header_test","TestHeaderPage","","","Verify that the 'Logo' link on the Start Unauthorized Page 
                             doesn't refresh the current page or lead to other pages after clicking",""
"passed","Fri Feb 28 01:17:13 GMT 2025","Fri Feb 28 01:17:13 GMT 2025","35","tests","specialists_page_test","TestSpecialistsPage","","","Verify value of text on the page",""
"passed","Fri Feb 28 00:58:55 GMT 2025","Fri Feb 28 00:58:55 GMT 2025","164","tests","contacts_page_test","TestContactsPage","","","Verify presence, visibility of sections, the dividing line and elements with text on the page",""
"passed","Fri Feb 28 01:27:26 GMT 2025","Fri Feb 28 01:27:26 GMT 2025","32","tests","used_resources_page_test","TestUsedResourcesPage","","","Verify content of the text on the page",""
"passed","Fri Feb 28 01:06:15 GMT 2025","Fri Feb 28 01:06:21 GMT 2025","5662","tests","exercises_ru_words_page_test","TestExercisesRuWordsPage","","","Verify sizes of background-images in links on the page",""
"passed","Fri Feb 28 00:59:42 GMT 2025","Fri Feb 28 00:59:44 GMT 2025","1675","tests","contributors_page_test","TestContributorsPage","","","Verify the composition and visibility of elements 
        on the 1st-5th levels of nesting on the page",""
"passed","Fri Feb 28 01:17:55 GMT 2025","Fri Feb 28 01:17:55 GMT 2025","160","tests","specialists_page_test","TestSpecialistsPage","","","Verify sizes of images in specialist cards in the grid",""
"passed","Fri Feb 28 01:27:31 GMT 2025","Fri Feb 28 01:27:31 GMT 2025","28","tests","used_resources_page_test","TestUsedResourcesPage","","","Verify text in links in sections",""
"passed","Fri Feb 28 01:27:16 GMT 2025","Fri Feb 28 01:27:16 GMT 2025","12","tests","used_resources_page_test","TestUsedResourcesPage","","","Verify value of the title of the tab",""
"passed","Fri Feb 28 01:16:42 GMT 2025","Fri Feb 28 01:16:42 GMT 2025","29","tests","specialists_page_test","TestSpecialistsPage","","","Verify presence and visibility of content on the page",""
"passed","Fri Feb 28 01:14:38 GMT 2025","Fri Feb 28 01:14:39 GMT 2025","1467","tests","main_page_test","TestMainPage","","","Verify redirection to github not authorized user.",""
"passed","Fri Feb 28 01:14:56 GMT 2025","Fri Feb 28 01:14:57 GMT 2025","437","tests","main_page_test","TestMainPage","","","Checking the domain is available",""
"passed","Fri Feb 28 01:14:33 GMT 2025","Fri Feb 28 01:14:34 GMT 2025","714","tests","main_page_test","TestMainPage","","","Verify redirection to specialists page not authorized user.",""
"passed","Fri Feb 28 01:06:29 GMT 2025","Fri Feb 28 01:06:29 GMT 2025","256","tests","footer_test","TestFooter","","","Verify composition and visibility of elements on the 1st-7th levels of nesting in the Footer",""
"passed","Fri Feb 28 00:59:48 GMT 2025","Fri Feb 28 00:59:52 GMT 2025","3694","tests","contributors_page_test","TestContributorsPage","","","Verify presence, visibility of titles/subtitles, cards, descriptions, links, images on the page",""
"passed","Fri Feb 28 01:10:52 GMT 2025","Fri Feb 28 01:10:52 GMT 2025","234","tests","header_test","TestHeaderPage","","","Verify values of the text in links, buttons in the Header for an unauthorized user",""
"passed","Fri Feb 28 01:00:04 GMT 2025","Fri Feb 28 01:00:04 GMT 2025","19","tests","contributors_page_test","TestContributorsPage","","","Verify content of the text on the page",""
"passed","Fri Feb 28 01:17:18 GMT 2025","Fri Feb 28 01:17:18 GMT 2025","107","tests","specialists_page_test","TestSpecialistsPage","","","Verify values of names and professions in specialist cards in the grid",""
"passed","Fri Feb 28 01:03:25 GMT 2025","Fri Feb 28 01:03:25 GMT 2025","117","tests","exercises_ru_words_page_test","TestExercisesRuWordsPage","","","Verify text in group links on the page",""
"passed","Fri Feb 28 01:11:14 GMT 2025","Fri Feb 28 01:11:16 GMT 2025","1809","tests","header_test","TestHeaderPage","","","Verify if external links in the Header for an unauthorized user 
            lead to correct pages after click",""
"passed","Fri Feb 28 01:07:23 GMT 2025","Fri Feb 28 01:07:28 GMT 2025","5243","tests","footer_test","TestFooter","","","Verify Footer invisibility through the modal window with the exercise",""
"passed","Fri Feb 28 01:06:25 GMT 2025","Fri Feb 28 01:06:25 GMT 2025","44","tests","footer_test","TestFooter","","","Verify presence and visibility of the Footer",""
"passed","Fri Feb 28 01:00:31 GMT 2025","Fri Feb 28 01:00:32 GMT 2025","1142","tests","contributors_page_test","TestContributorsPage","","","Verify sizes of images in contributor cards in grids",""
"passed","Fri Feb 28 01:05:15 GMT 2025","Fri Feb 28 01:05:22 GMT 2025","7529","tests","exercises_ru_words_page_test","TestExercisesRuWordsPage","","","Verify if group links lead to correct pages after clicking",""
"passed","Fri Feb 28 01:16:07 GMT 2025","Fri Feb 28 01:16:08 GMT 2025","719","tests","registration_page_test","TestRegistrationPage","","","Check registration with new email and empty email",""
"passed","Fri Feb 28 01:01:44 GMT 2025","Fri Feb 28 01:01:46 GMT 2025","1655","tests","exercises_ru_similar_phrases_page_test","TestExercisesRuSimilarPhrasesPage","","","Verify presence, visibility of lists on the page",""
"passed","Fri Feb 28 01:17:28 GMT 2025","Fri Feb 28 01:17:29 GMT 2025","653","tests","specialists_page_test","TestSpecialistsPage","","","Verify clickability, href, status code of the 'All Specialists' link",""
"passed","Fri Feb 28 01:00:26 GMT 2025","Fri Feb 28 01:00:27 GMT 2025","807","tests","contributors_page_test","TestContributorsPage","","","Verify attribute values of images in contributors cards in grids",""
"passed","Fri Feb 28 01:18:14 GMT 2025","Fri Feb 28 01:18:14 GMT 2025","13","tests","start_unauthorized_page_test","TestStartUnauthorizedPage","","","Verify value of the title of the tab",""
"passed","Fri Feb 28 01:11:24 GMT 2025","Fri Feb 28 01:11:24 GMT 2025","302","tests","header_test","TestHeaderPage","","","Verify the dropdown opens/closes after clicking on the 'More' button in the Header 
            on the Start Unauthorized Page",""
"passed","Fri Feb 28 01:13:12 GMT 2025","Fri Feb 28 01:13:13 GMT 2025","90","tests","header_test","TestHeaderPage","","","Verify that the 'Logo' link on the Start Authorized Page 
                             doesn't refresh the current page or lead to other pages after clicking",""
"passed","Fri Feb 28 01:06:45 GMT 2025","Fri Feb 28 01:06:48 GMT 2025","3526","tests","footer_test","TestFooter","","","Verify clickability, href, prefix and subject, status code of links in the Footer",""
"passed","Fri Feb 28 01:03:59 GMT 2025","Fri Feb 28 01:03:59 GMT 2025","257","tests","exercises_ru_words_page_test","TestExercisesRuWordsPage","","","Verify clickability, titles, attributes of group links on the page",""
"passed","Fri Feb 28 01:15:00 GMT 2025","Fri Feb 28 01:15:28 GMT 2025","27624","tests","profile_page_test","TestProfilePage","","","Change the password by receiving an email link",""
"passed","Fri Feb 28 01:14:24 GMT 2025","Fri Feb 28 01:14:25 GMT 2025","1314","tests","main_page_test","TestMainPage","","","Verify redirection to donate page not authorized user.",""
"passed","Fri Feb 28 01:27:44 GMT 2025","Fri Feb 28 01:27:45 GMT 2025","1156","tests","used_resources_page_test","TestUsedResourcesPage","","","Verify that links in the sections lead to the correct pages after clicking",""
"passed","Fri Feb 28 01:20:48 GMT 2025","Fri Feb 28 01:21:01 GMT 2025","12204","tests","Речевые упражнения.","TestCardsRU","","","Select a random card from ""Похожие фразы"" group and compare UI vs BACKEND data.",""
"passed","Fri Feb 28 01:01:00 GMT 2025","Fri Feb 28 01:01:01 GMT 2025","1805","tests","description_page_test","TestDescriptionPage","","","Verify redirection to github not authorized user.",""
"passed","Fri Feb 28 01:14:29 GMT 2025","Fri Feb 28 01:14:29 GMT 2025","206","tests","main_page_test","TestMainPage","","","Verify redirection to contacts page not authorized user.",""
"passed","Fri Feb 28 01:27:05 GMT 2025","Fri Feb 28 01:27:06 GMT 2025","31","tests","used_resources_page_test","TestUsedResourcesPage","","","Verify presence and visibility of content on the page",""
"passed","Fri Feb 28 01:06:41 GMT 2025","Fri Feb 28 01:06:41 GMT 2025","44","tests","footer_test","TestFooter","","","Verify text in the 'Contact us' link in the Footer",""
"passed","Fri Feb 28 01:09:14 GMT 2025","Fri Feb 28 01:09:32 GMT 2025","18323","tests","groups_page_test","TestGroupsPage","","","Verify if links on the 'ru' local lead to correct pages after clicking",""
"passed","Fri Feb 28 01:03:47 GMT 2025","Fri Feb 28 01:03:49 GMT 2025","1898","tests","exercises_ru_words_page_test","TestExercisesRuWordsPage","","","Verify clickability, href, status code of links in breadcrumbs on the page",""
"passed","Fri Feb 28 00:59:28 GMT 2025","Fri Feb 28 00:59:29 GMT 2025","1540","tests","contacts_page_test","TestContactsPage","","","Verify if links in the section 2 lead to the correct pages after clicking",""
"passed","Fri Feb 28 01:03:14 GMT 2025","Fri Feb 28 01:03:14 GMT 2025","84","tests","exercises_ru_words_page_test","TestExercisesRuWordsPage","","","Verify value of the breadcrumbs on the page",""
"passed","Fri Feb 28 01:13:04 GMT 2025","Fri Feb 28 01:13:06 GMT 2025","1869","tests","header_test","TestHeaderPage","","","Verify if external links in the Header for an authorized user 
            lead to correct pages after click",""
"passed","Fri Feb 28 01:13:55 GMT 2025","Fri Feb 28 01:13:55 GMT 2025","47","tests","header_test","TestHeaderPage","","","Verify presence, visibility, attributes of icons in the Header for an authorized user",""
"passed","Fri Feb 28 01:10:19 GMT 2025","Fri Feb 28 01:10:25 GMT 2025","6065","tests","groups_page_test","TestGroupsPage","","","Verify sizes of images in links on the page",""
"passed","Fri Feb 28 01:11:28 GMT 2025","Fri Feb 28 01:11:28 GMT 2025","237","tests","header_test","TestHeaderPage","","","Verify switching of the 'ru', 'en' buttons in the Header on the Start Unauthorized Page",""
"passed","Fri Feb 28 00:59:02 GMT 2025","Fri Feb 28 00:59:02 GMT 2025","12","tests","contacts_page_test","TestContactsPage","","","Verify value of the title of the tab",""
"passed","Fri Feb 28 01:11:36 GMT 2025","Fri Feb 28 01:11:36 GMT 2025","55","tests","header_test","TestHeaderPage","","","Verify size of the image in the 'Logo' link in the Header on the Start Unauthorized Page",""
"passed","Fri Feb 28 01:10:04 GMT 2025","Fri Feb 28 01:10:12 GMT 2025","8214","tests","groups_page_test","TestGroupsPage","","","Verify attributes of images in links on the page",""
"passed","Fri Feb 28 01:08:02 GMT 2025","Fri Feb 28 01:08:10 GMT 2025","8197","tests","groups_page_test","TestGroupsPage","","","Verify value of the title of the tab",""
"passed","Fri Feb 28 00:59:12 GMT 2025","Fri Feb 28 00:59:12 GMT 2025","28","tests","contacts_page_test","TestContactsPage","","","Verify content of the text in the section 2",""
"passed","Fri Feb 28 01:01:21 GMT 2025","Fri Feb 28 01:01:24 GMT 2025","2667","tests","exercises_ru_similar_phrases_page_test","TestExercisesRuSimilarPhrasesPage","","","Verify presence and visibility of content on the page",""
"passed","Fri Feb 28 01:10:33 GMT 2025","Fri Feb 28 01:10:43 GMT 2025","10203","tests","header_test","TestHeaderPage","","","Verify composition, visibility of elements on the 1st-6th levels of nesting in the Header
            for an unauthorized user",""
"passed","Fri Feb 28 00:59:07 GMT 2025","Fri Feb 28 00:59:07 GMT 2025","51","tests","contacts_page_test","TestContactsPage","","","Verify values of the title and subtitles with tags h1, h2 on the page",""
"passed","Fri Feb 28 01:12:43 GMT 2025","Fri Feb 28 01:12:57 GMT 2025","14032","tests","header_test","TestHeaderPage","","","Verify if internal links in the Header for an authorized user 
            lead to correct pages after click",""
"passed","Fri Feb 28 01:00:40 GMT 2025","Fri Feb 28 01:00:42 GMT 2025","1385","tests","description_page_test","TestDescriptionPage","","","Verify redirection to telegram page not authorized user.",""
"passed","Fri Feb 28 01:01:11 GMT 2025","Fri Feb 28 01:01:11 GMT 2025","190","tests","description_page_test","TestDescriptionPage","","","Verify redirection to used resources page not authorized user.",""
"passed","Fri Feb 28 01:03:04 GMT 2025","Fri Feb 28 01:03:04 GMT 2025","58","tests","exercises_ru_words_page_test","TestExercisesRuWordsPage","","","Verify value of the title of the tab",""
"passed","Fri Feb 28 01:15:57 GMT 2025","Fri Feb 28 01:15:58 GMT 2025","751","tests","registration_page_test","TestRegistrationPage","","","Check registration with new email and empty first name",""
"passed","Fri Feb 28 01:01:32 GMT 2025","Fri Feb 28 01:01:35 GMT 2025","2901","tests","exercises_ru_similar_phrases_page_test","TestExercisesRuSimilarPhrasesPage","","","Verify composition, visibility of elements on the 1st-7th levels of nesting on the page",""
"passed","Fri Feb 28 01:17:59 GMT 2025","Fri Feb 28 01:17:59 GMT 2025","36","tests","start_unauthorized_page_test","TestStartUnauthorizedPage","","","Verify presence and visibility of content on the page",""
"passed","Fri Feb 28 01:16:16 GMT 2025","Fri Feb 28 01:16:37 GMT 2025","20795","tests","registration_page_test","TestRegistrationPage","","","Check registration without choosing agreement",""
"passed","Fri Feb 28 01:12:16 GMT 2025","Fri Feb 28 01:12:16 GMT 2025","203","tests","header_test","TestHeaderPage","","","Verify values of the text in links, buttons in the Header for an authorized user",""
"passed","Fri Feb 28 01:02:52 GMT 2025","Fri Feb 28 01:02:53 GMT 2025","815","tests","exercises_ru_words_page_test","TestExercisesRuWordsPage","","","Verify presence, visibility of lists on the page",""
"passed","Fri Feb 28 01:00:17 GMT 2025","Fri Feb 28 01:00:18 GMT 2025","733","tests","contributors_page_test","TestContributorsPage","","","Verify clickability, href of links on the page",""
"passed","Fri Feb 28 01:15:43 GMT 2025","Fri Feb 28 01:15:44 GMT 2025","1270","tests","registration_page_test","TestRegistrationPage","","","Check registration with an existing email",""
"passed","Fri Feb 28 01:12:30 GMT 2025","Fri Feb 28 01:12:36 GMT 2025","6017","tests","header_test","TestHeaderPage","","","Verify clickability, href, status code of links in the Header for an authorized user",""
"passed","Fri Feb 28 00:59:56 GMT 2025","Fri Feb 28 00:59:56 GMT 2025","15","tests","contributors_page_test","TestContributorsPage","","","Verify value of the title of the tab",""
"passed","Fri Feb 28 01:07:08 GMT 2025","Fri Feb 28 01:07:08 GMT 2025","132","tests","footer_test","TestFooter","","","Verify that the 'Contact us' link in the Footer calls an email client",""
"skipped","Fri Feb 28 01:19:44 GMT 2025","Fri Feb 28 01:20:05 GMT 2025","20657","tests","Speech exercises EN.","TestCardsEN","","","Select a random card from ""Similar phrases"" group and compare UI vs BACKEND data",""
"skipped","Fri Feb 28 01:19:16 GMT 2025","Fri Feb 28 01:19:37 GMT 2025","20653","tests","Speech exercises EN.","TestCardsEN","","","Check progres-bar and buttons.",""
"passed","Fri Feb 28 01:27:50 GMT 2025","Fri Feb 28 01:27:50 GMT 2025","56","tests","used_resources_page_test","TestUsedResourcesPage","","","Verify presence, visibility and attributes of icons in sections",""
"passed","Fri Feb 28 01:01:05 GMT 2025","Fri Feb 28 01:01:07 GMT 2025","1727","tests","description_page_test","TestDescriptionPage","","","Verify redirection to contributors page not authorized user.",""
"passed","Fri Feb 28 01:00:13 GMT 2025","Fri Feb 28 01:00:13 GMT 2025","436","tests","contributors_page_test","TestContributorsPage","","","Verify text in card links and the 'All Team' link",""
"passed","Fri Feb 28 01:00:36 GMT 2025","Fri Feb 28 01:00:36 GMT 2025","174","tests","description_page_test","TestDescriptionPage","","","Verify return main page from description page.",""
"passed","Fri Feb 28 01:13:34 GMT 2025","Fri Feb 28 01:13:34 GMT 2025","418","tests","header_test","TestHeaderPage","","","Verify user logout after clicking the 'Logout' button in the Header for an authorized user",""
"passed","Fri Feb 28 01:18:03 GMT 2025","Fri Feb 28 01:18:03 GMT 2025","32","tests","start_unauthorized_page_test","TestStartUnauthorizedPage","","","Verify amount and visibility of sections with content on the page",""
"passed","Fri Feb 28 01:14:52 GMT 2025","Fri Feb 28 01:14:52 GMT 2025","144","tests","main_page_test","TestMainPage","","","Checking the clickability of the Start button.",""
"passed","Fri Feb 28 01:00:46 GMT 2025","Fri Feb 28 01:00:47 GMT 2025","1482","tests","description_page_test","TestDescriptionPage","","","Verify redirection to donate page not authorized user.",""
"passed","Fri Feb 28 00:58:29 GMT 2025","Fri Feb 28 00:58:30 GMT 2025","1332","tests","authorisation_page_test","TestAuthorizedUserPage","","","Checking the possibility of authorization with the correct data",""
"passed","Fri Feb 28 01:17:42 GMT 2025","Fri Feb 28 01:17:44 GMT 2025","2672","tests","specialists_page_test","TestSpecialistsPage","","","Verify that the 'All Specialists' link leads an authorized user 
                         to the correct page after clicking",""
"passed","Fri Feb 28 01:14:03 GMT 2025","Fri Feb 28 01:14:03 GMT 2025","58","tests","header_test","TestHeaderPage","","","Verify presence, visibility and attributes of the profile avatar in the Header 
               for an authorized user",""
"passed","Fri Feb 28 01:10:47 GMT 2025","Fri Feb 28 01:10:48 GMT 2025","401","tests","header_test","TestHeaderPage","","","Verify presence, visibility of links, buttons in the Header for an unauthorized user",""
"passed","Fri Feb 28 01:22:26 GMT 2025","Fri Feb 28 01:23:17 GMT 2025","50958","tests","Речевые упражнения.","TestCardsRU","","","Solutions to a random task in the ""Слова"" .",""
"passed","Fri Feb 28 01:17:34 GMT 2025","Fri Feb 28 01:17:35 GMT 2025","628","tests","specialists_page_test","TestSpecialistsPage","","","Verify that the 'All Specialists' link leads an unauthorized user 
                         to the correct page after clicking",""
"skipped","Fri Feb 28 01:21:26 GMT 2025","Fri Feb 28 01:21:49 GMT 2025","23509","tests","Речевые упражнения.","TestCardsRU","","","Select a random card from ""Предложения"" group and compare UI vs BACKEND data.",""
"passed","Fri Feb 28 01:18:18 GMT 2025","Fri Feb 28 01:18:18 GMT 2025","48","tests","start_unauthorized_page_test","TestStartUnauthorizedPage","","","Verify values of titles and subtitles with tags h2, h4 on the page",""
"passed","Fri Feb 28 01:18:30 GMT 2025","Fri Feb 28 01:18:31 GMT 2025","679","tests","start_unauthorized_page_test","TestStartUnauthorizedPage","","","Verify presence, visibility, clickability, href, status code 
                         of the 'Login' link in the section 1",""
"passed","Fri Feb 28 01:18:22 GMT 2025","Fri Feb 28 01:18:22 GMT 2025","82","tests","start_unauthorized_page_test","TestStartUnauthorizedPage","","","Verify content of the text in sections 1, 2",""
"broken","Fri Feb 28 01:01:56 GMT 2025","Fri Feb 28 01:01:56 GMT 2025","0","tests","exercises_ru_words_page_test","TestExercisesRuWordsPage","","","Verify composition, visibility of elements on the 1st-6th levels of nesting on the page",""
"broken","Fri Feb 28 01:05:32 GMT 2025","Fri Feb 28 01:05:54 GMT 2025","21415","tests","exercises_ru_words_page_test","TestExercisesRuWordsPage","","","Verify if subgroup links 1-4 lead to correct pages after clicking",""
"passed","Fri Feb 28 00:58:40 GMT 2025","Fri Feb 28 00:58:40 GMT 2025","27","tests","contacts_page_test","TestContactsPage","","","Verify presence and visibility of content on the page",""
"passed","Fri Feb 28 01:10:56 GMT 2025","Fri Feb 28 01:11:01 GMT 2025","5241","tests","header_test","TestHeaderPage","","","Verify clickability, href, status code of links in the Header for an unauthorized user",""
"passed","Fri Feb 28 01:27:55 GMT 2025","Fri Feb 28 01:27:55 GMT 2025","87","tests","used_resources_page_test","TestUsedResourcesPage","","","Verify sizes of icons in sections",""
"passed","Fri Feb 28 00:59:39 GMT 2025","Fri Feb 28 00:59:39 GMT 2025","38","tests","contributors_page_test","TestContributorsPage","","","Verify presence, visibility and structure of content on the page",""
"passed","Fri Feb 28 01:11:32 GMT 2025","Fri Feb 28 01:11:32 GMT 2025","60","tests","header_test","TestHeaderPage","","","Verify presence, visibility and attributes of the image in the 'Logo' link in the Header 
               on the Start Unauthorized Page",""
"passed","Fri Feb 28 01:16:47 GMT 2025","Fri Feb 28 01:16:47 GMT 2025","322","tests","specialists_page_test","TestSpecialistsPage","","","Verify the composition and visibility of elements 
        on the 1st-6th levels of nesting on the page",""
"passed","Fri Feb 28 00:59:17 GMT 2025","Fri Feb 28 00:59:17 GMT 2025","29","tests","contacts_page_test","TestContactsPage","","","Verify text in links in the section 2",""
"passed","Fri Feb 28 00:58:45 GMT 2025","Fri Feb 28 00:58:45 GMT 2025","19","tests","contacts_page_test","TestContactsPage","","","Verify the composition and visibility of elements on the 1st level of nesting in the section 1",""
"broken","Fri Feb 28 01:04:43 GMT 2025","Fri Feb 28 01:05:04 GMT 2025","21452","tests","exercises_ru_words_page_test","TestExercisesRuWordsPage","","","Verify if breadcrumbs links lead to correct pages after clicking",""
"passed","Fri Feb 28 00:58:34 GMT 2025","Fri Feb 28 00:58:35 GMT 2025","934","tests","authorisation_page_test","TestAuthorizedUserPage","","","Checking the possibility of authorization with incorrect data",""
"skipped","Fri Feb 28 01:14:57 GMT 2025","Fri Feb 28 01:14:57 GMT 2025","0","tests","main_page_test","TestMainPage","","","Checking the ip is available",""
"passed","Fri Feb 28 01:17:49 GMT 2025","Fri Feb 28 01:17:50 GMT 2025","113","tests","specialists_page_test","TestSpecialistsPage","","","Verify attributes of images in specialist cards in the grid",""
"passed","Fri Feb 28 00:59:22 GMT 2025","Fri Feb 28 00:59:23 GMT 2025","883","tests","contacts_page_test","TestContactsPage","","","Verify presence, visibility, clickability, href, prefix, status code of links in the section 2",""
"passed","Fri Feb 28 01:17:03 GMT 2025","Fri Feb 28 01:17:03 GMT 2025","12","tests","specialists_page_test","TestSpecialistsPage","","","Verify value of the title of the tab",""
"passed","Fri Feb 28 01:00:00 GMT 2025","Fri Feb 28 01:00:00 GMT 2025","42","tests","contributors_page_test","TestContributorsPage","","","Verify values of title and subtitles with tags h2, h3 on the page",""
"passed","Fri Feb 28 01:06:33 GMT 2025","Fri Feb 28 01:06:33 GMT 2025","134","tests","footer_test","TestFooter","","","Verify presence, visibility of text, links, images in the Footer",""
"passed","Fri Feb 28 01:07:35 GMT 2025","Fri Feb 28 01:07:35 GMT 2025","25","tests","groups_page_test","TestGroupsPage","","","Verify presence and visibility of content on the page",""
"passed","Fri Feb 28 01:16:02 GMT 2025","Fri Feb 28 01:16:03 GMT 2025","760","tests","registration_page_test","TestRegistrationPage","","","Check registration with new email and empty birthday",""
"passed","Fri Feb 28 01:06:04 GMT 2025","Fri Feb 28 01:06:05 GMT 2025","1062","tests","exercises_ru_words_page_test","TestExercisesRuWordsPage","","","Verify attributes of images in links on the page",""
"passed","Fri Feb 28 01:11:05 GMT 2025","Fri Feb 28 01:11:10 GMT 2025","4937","tests","header_test","TestHeaderPage","","","Verify if internal links in the Header for an unauthorized user 
            lead to correct pages after click",""
"passed","Fri Feb 28 01:00:22 GMT 2025","Fri Feb 28 01:00:22 GMT 2025","714","tests","contributors_page_test","TestContributorsPage","","","Verify href, status code of the 'All Team' link",""
"passed","Fri Feb 28 01:11:44 GMT 2025","Fri Feb 28 01:11:44 GMT 2025","27","tests","header_test","TestHeaderPage","","","Verify presence and visibility of the Header for an authorized user",""
"passed","Fri Feb 28 01:09:39 GMT 2025","Fri Feb 28 01:09:57 GMT 2025","18244","tests","groups_page_test","TestGroupsPage","","","Verify if links on the 'en' local lead to correct pages after clicking",""
"passed","Fri Feb 28 01:07:16 GMT 2025","Fri Feb 28 01:07:16 GMT 2025","131","tests","footer_test","TestFooter","","","Verify sizes of images in links in the Footer",""
"passed","Fri Feb 28 01:12:23 GMT 2025","Fri Feb 28 01:12:23 GMT 2025","27","tests","header_test","TestHeaderPage","","","Verify presence, visibility of the user name in the Header for an authorized user",""
"passed","Fri Feb 28 01:06:52 GMT 2025","Fri Feb 28 01:07:04 GMT 2025","11818","tests","footer_test","TestFooter","","","Verify that links in the Footer lead to correct pages after clicking",""
"passed","Fri Feb 28 01:27:37 GMT 2025","Fri Feb 28 01:27:38 GMT 2025","1867","tests","used_resources_page_test","TestUsedResourcesPage","","","Verify presence, visibility, clickability, href, status code of links in sections",""
"passed","Fri Feb 28 01:27:11 GMT 2025","Fri Feb 28 01:27:11 GMT 2025","121","tests","used_resources_page_test","TestUsedResourcesPage","","","Verify the composition and visibility of elements 
        on the 1st-4th levels of nesting on the page",""
"passed","Fri Feb 28 01:04:09 GMT 2025","Fri Feb 28 01:04:33 GMT 2025","23605","tests","exercises_ru_words_page_test","TestExercisesRuWordsPage","","","Verify clickability, titles, href, status code of subgroup links on the page",""
"passed","Fri Feb 28 01:17:08 GMT 2025","Fri Feb 28 01:17:08 GMT 2025","34","tests","specialists_page_test","TestSpecialistsPage","","","Verify value of title with tag 'h2' on the page",""
