"Status","Start Time","Stop Time","Duration in ms","Parent Suite","Suite","Sub Suite","Test Class","Test Method","Name","Description"
"passed","Thu Aug 29 08:56:14 GMT 2024","Thu Aug 29 08:56:15 GMT 2024","949","tests","used_resources_page_test","TestUsedResourcesPage","","","Verify the composition and visibility of elements 
            on the 1st-4th levels of nesting on the page",""
"skipped","Thu Aug 29 08:55:41 GMT 2024","Thu Aug 29 08:55:48 GMT 2024","7233","tests","Речевые упражнения.","TestCardsRU","","","Solutions to a random task in the ""Слова"" group and comparison of statics.",""
"passed","Thu Aug 29 08:52:48 GMT 2024","Thu Aug 29 08:53:00 GMT 2024","12354","tests","Речевые упражнения.","TestCardsRU","","","Select a random card from ""Похожие фразы"" group and compare UI vs BACKEND data.",""
"passed","Thu Aug 29 08:46:44 GMT 2024","Thu Aug 29 08:46:45 GMT 2024","670","tests","main_page_test","TestMainPage","","","Verify redirection to contributors page not authorized user.",""
"passed","Thu Aug 29 08:50:38 GMT 2024","Thu Aug 29 08:50:38 GMT 2024","48","tests","start_unauthorized_page_test","TestStartUnauthorizedPage","","","Verify values of titles and subtitles with tags h2, h4 on the page",""
"passed","Thu Aug 29 08:48:06 GMT 2024","Thu Aug 29 08:48:07 GMT 2024","667","tests","registration_page_test","TestRegistrationPage","","","Check registration without choosing gender",""
"passed","Thu Aug 29 08:44:22 GMT 2024","Thu Aug 29 08:44:33 GMT 2024","10792","tests","footer_test","TestFooter","","","Verify that links in the Footer lead to correct pages after clicking",""
"passed","Thu Aug 29 08:46:10 GMT 2024","Thu Aug 29 08:46:10 GMT 2024","129","tests","main_page_test","TestMainPage","","","Verify redirection to description page not authorized user.",""
"passed","Thu Aug 29 08:44:08 GMT 2024","Thu Aug 29 08:44:08 GMT 2024","51","tests","footer_test","TestFooter","","","Verify text in the 'Contact us' link in the Footer",""
"passed","Thu Aug 29 08:41:37 GMT 2024","Thu Aug 29 08:41:39 GMT 2024","1971","tests","contacts_page_test","TestContactsPage","","","Verify if links in the section 2 lead to the correct pages after clicking",""
"passed","Thu Aug 29 08:47:32 GMT 2024","Thu Aug 29 08:47:33 GMT 2024","1246","tests","registration_page_test","TestRegistrationPage","","","Check registration with an existing email",""
"passed","Thu Aug 29 08:43:24 GMT 2024","Thu Aug 29 08:43:25 GMT 2024","1180","tests","description_page_test","TestDescriptionPage","","","Verify redirection to specialists page not authorized user.",""
"passed","Thu Aug 29 08:44:56 GMT 2024","Thu Aug 29 08:45:01 GMT 2024","4684","tests","footer_test","TestFooter","","","Verify Footer invisibility through the modal window with the exercise",""
"passed","Thu Aug 29 08:40:53 GMT 2024","Thu Aug 29 08:40:53 GMT 2024","136","tests","contacts_page_test","TestContactsPage","","","Verify the composition and visibility of elements 
        on the 1st-5th levels of nesting in the section 2",""
"passed","Thu Aug 29 08:49:57 GMT 2024","Thu Aug 29 08:49:57 GMT 2024","110","tests","specialists_page_test","TestSpecialistsPage","","","Verify attributes of images in specialist cards in the grid",""
"passed","Thu Aug 29 08:46:38 GMT 2024","Thu Aug 29 08:46:39 GMT 2024","1400","tests","main_page_test","TestMainPage","","","Verify redirection to github not authorized user.",""
"passed","Thu Aug 29 08:40:59 GMT 2024","Thu Aug 29 08:41:00 GMT 2024","164","tests","contacts_page_test","TestContactsPage","","","Verify presence, visibility of sections, the dividing line and elements with text on the page",""
"passed","Thu Aug 29 08:46:05 GMT 2024","Thu Aug 29 08:46:05 GMT 2024","3","tests","login_page_test","TestLoginPage","","","Test for authorization customer.",""
"passed","Thu Aug 29 08:50:53 GMT 2024","Thu Aug 29 08:50:54 GMT 2024","844","tests","start_unauthorized_page_test","TestStartUnauthorizedPage","","","Verify presence, visibility, clickability, href, status code 
                         of the 'Login' link in the section 1",""
"passed","Thu Aug 29 08:57:05 GMT 2024","Thu Aug 29 08:57:06 GMT 2024","1911","tests","used_resources_page_test","TestUsedResourcesPage","","","Verify that links in the sections lead to the correct pages after clicking",""
"passed","Thu Aug 29 08:50:23 GMT 2024","Thu Aug 29 08:50:23 GMT 2024","83","tests","start_unauthorized_page_test","TestStartUnauthorizedPage","","","Verify the composition and visibility of elements 
        on the 1st-3rd levels of nesting in the section 1",""
"passed","Thu Aug 29 08:56:47 GMT 2024","Thu Aug 29 08:56:47 GMT 2024","853","tests","used_resources_page_test","TestUsedResourcesPage","","","Verify text in links in sections",""
"passed","Thu Aug 29 08:43:36 GMT 2024","Thu Aug 29 08:43:37 GMT 2024","650","tests","description_page_test","TestDescriptionPage","","","Verify redirection to contributors page not authorized user.",""
"passed","Thu Aug 29 08:42:02 GMT 2024","Thu Aug 29 08:42:04 GMT 2024","1663","tests","contributors_page_test","TestContributorsPage","","","Verify presence, visibility of titles/subtitles, cards, descriptions, links, images on the page",""
"passed","Thu Aug 29 08:57:23 GMT 2024","Thu Aug 29 08:57:24 GMT 2024","896","tests","used_resources_page_test","TestUsedResourcesPage","","","Verify sizes of icons in sections",""
"passed","Thu Aug 29 08:44:43 GMT 2024","Thu Aug 29 08:44:43 GMT 2024","77","tests","footer_test","TestFooter","","","Verify attributes of images in links in the Footer",""
"passed","Thu Aug 29 08:53:46 GMT 2024","Thu Aug 29 08:53:57 GMT 2024","10457","tests","Речевые упражнения.","TestCardsRU","","","Select a random card from ""Слова с частотной группировкой"" group and compare UI vs BACKEND data.",""
"passed","Thu Aug 29 08:45:57 GMT 2024","Thu Aug 29 08:45:57 GMT 2024","71","tests","header_test","TestHeaderPage","","","Verify attributes of the image in the 'Logo' link",""
"passed","Thu Aug 29 08:47:44 GMT 2024","Thu Aug 29 08:47:44 GMT 2024","720","tests","registration_page_test","TestRegistrationPage","","","Check registration with new email and empty password",""
"passed","Thu Aug 29 08:50:33 GMT 2024","Thu Aug 29 08:50:33 GMT 2024","13","tests","start_unauthorized_page_test","TestStartUnauthorizedPage","","","Verify value of the title of the tab",""
"passed","Thu Aug 29 08:50:18 GMT 2024","Thu Aug 29 08:50:18 GMT 2024","32","tests","start_unauthorized_page_test","TestStartUnauthorizedPage","","","Verify amount and visibility of sections with content on the page",""
"passed","Thu Aug 29 08:43:04 GMT 2024","Thu Aug 29 08:43:06 GMT 2024","1907","tests","description_page_test","TestDescriptionPage","","","Verify redirection to telegram page not authorized user.",""
"passed","Thu Aug 29 08:47:05 GMT 2024","Thu Aug 29 08:47:18 GMT 2024","13389","tests","profile_page_test","TestProfilePage","","","Change the password by receiving an email link",""
"passed","Thu Aug 29 08:42:35 GMT 2024","Thu Aug 29 08:42:36 GMT 2024","726","tests","contributors_page_test","TestContributorsPage","","","Verify clickability, href of links on the page",""
"passed","Thu Aug 29 08:54:05 GMT 2024","Thu Aug 29 08:54:59 GMT 2024","54098","tests","Речевые упражнения.","TestCardsRU","","","Solutions to a random task in the ""Слова"" .",""
"passed","Thu Aug 29 08:48:44 GMT 2024","Thu Aug 29 08:48:45 GMT 2024","339","tests","specialists_page_test","TestSpecialistsPage","","","Verify the composition and visibility of elements 
        on the 1st-6th levels of nesting on the page",""
"passed","Thu Aug 29 08:47:49 GMT 2024","Thu Aug 29 08:47:50 GMT 2024","692","tests","registration_page_test","TestRegistrationPage","","","Check registration with new email and empty first name",""
"passed","Thu Aug 29 08:40:41 GMT 2024","Thu Aug 29 08:40:41 GMT 2024","28","tests","contacts_page_test","TestContactsPage","","","Verify presence and visibility of content on the page",""
"passed","Thu Aug 29 08:51:34 GMT 2024","Thu Aug 29 08:51:44 GMT 2024","9677","tests","Speech exercises EN.","TestCardsEN","","","Check progres-bar and buttons.",""
"passed","Thu Aug 29 08:46:27 GMT 2024","Thu Aug 29 08:46:27 GMT 2024","150","tests","main_page_test","TestMainPage","","","Verify redirection to contacts page not authorized user.",""
"passed","Thu Aug 29 08:43:12 GMT 2024","Thu Aug 29 08:43:13 GMT 2024","1635","tests","description_page_test","TestDescriptionPage","","","Verify redirection to donate page not authorized user.",""
"passed","Thu Aug 29 08:55:06 GMT 2024","Thu Aug 29 08:55:34 GMT 2024","27246","tests","Речевые упражнения.","TestCardsRU","","","Solutions to a random task in the ""Слова Королёвой"" .",""
"passed","Thu Aug 29 08:42:14 GMT 2024","Thu Aug 29 08:42:14 GMT 2024","44","tests","contributors_page_test","TestContributorsPage","","","Verify values of title and subtitles with tags h2, h3 on the page",""
"passed","Thu Aug 29 08:42:24 GMT 2024","Thu Aug 29 08:42:24 GMT 2024","385","tests","contributors_page_test","TestContributorsPage","","","Verify values of the text in card descriptions",""
"passed","Thu Aug 29 08:56:38 GMT 2024","Thu Aug 29 08:56:39 GMT 2024","860","tests","used_resources_page_test","TestUsedResourcesPage","","","Verify content of the text on the page",""
"passed","Thu Aug 29 08:49:21 GMT 2024","Thu Aug 29 08:49:21 GMT 2024","116","tests","specialists_page_test","TestSpecialistsPage","","","Verify values of names and professions in specialist cards in the grid",""
"passed","Thu Aug 29 08:51:17 GMT 2024","Thu Aug 29 08:51:27 GMT 2024","10031","tests","Speech exercises EN.","TestCardsEN","","","Select random card from ""Word"" group and compare UI vs BACKEND data",""
"passed","Thu Aug 29 08:42:19 GMT 2024","Thu Aug 29 08:42:19 GMT 2024","19","tests","contributors_page_test","TestContributorsPage","","","Verify content of the text on the page",""
"passed","Thu Aug 29 08:53:07 GMT 2024","Thu Aug 29 08:53:19 GMT 2024","11913","tests","Речевые упражнения.","TestCardsRU","","","Select a random card from ""Группа слов"" group and compare UI vs BACKEND data.",""
"passed","Thu Aug 29 08:44:48 GMT 2024","Thu Aug 29 08:44:48 GMT 2024","111","tests","footer_test","TestFooter","","","Verify sizes of images in links in the Footer",""
"passed","Thu Aug 29 08:49:27 GMT 2024","Thu Aug 29 08:49:27 GMT 2024","44","tests","specialists_page_test","TestSpecialistsPage","","","Verify text in the 'All Specialists' link",""
"passed","Thu Aug 29 08:46:21 GMT 2024","Thu Aug 29 08:46:22 GMT 2024","854","tests","main_page_test","TestMainPage","","","Verify redirection to donate page not authorized user.",""
"passed","Thu Aug 29 08:48:51 GMT 2024","Thu Aug 29 08:48:56 GMT 2024","5372","tests","specialists_page_test","TestSpecialistsPage","","","Verify presence, visibility of the title, text, link, grid, cards and images  
        on the 2nd, 3rd, 5th, 6th levels of nesting on the page",""
"passed","Thu Aug 29 08:45:21 GMT 2024","Thu Aug 29 08:45:21 GMT 2024","74","tests","header_test","TestHeaderPage","","","Verify values of the text in links, buttons in the Header",""
"passed","Thu Aug 29 08:46:15 GMT 2024","Thu Aug 29 08:46:16 GMT 2024","1758","tests","main_page_test","TestMainPage","","","Verify redirection to telegram page not authorized user.",""
"passed","Thu Aug 29 08:48:11 GMT 2024","Thu Aug 29 08:48:32 GMT 2024","20770","tests","registration_page_test","TestRegistrationPage","","","Check registration without choosing agreement",""
"passed","Thu Aug 29 08:47:38 GMT 2024","Thu Aug 29 08:47:39 GMT 2024","687","tests","registration_page_test","TestRegistrationPage","","","Check registration with new email and empty confirm password",""
"passed","Thu Aug 29 08:43:42 GMT 2024","Thu Aug 29 08:43:42 GMT 2024","197","tests","description_page_test","TestDescriptionPage","","","Verify redirection to used resources page not authorized user.",""
"passed","Thu Aug 29 08:44:38 GMT 2024","Thu Aug 29 08:44:38 GMT 2024","142","tests","footer_test","TestFooter","","","Verify that the 'Contact us' link in the Footer calls an email client",""
"passed","Thu Aug 29 08:56:55 GMT 2024","Thu Aug 29 08:56:57 GMT 2024","2074","tests","used_resources_page_test","TestUsedResourcesPage","","","Verify presence, visibility, clickability, href, status code of links in sections",""
"passed","Thu Aug 29 08:42:59 GMT 2024","Thu Aug 29 08:42:59 GMT 2024","133","tests","description_page_test","TestDescriptionPage","","","Verify return main page from description page.",""
"passed","Thu Aug 29 08:40:34 GMT 2024","Thu Aug 29 08:40:35 GMT 2024","919","tests","authorisation_page_test","TestAuthorizedUserPage","","","Checking the possibility of authorization with incorrect data",""
"passed","Thu Aug 29 08:40:28 GMT 2024","Thu Aug 29 08:40:29 GMT 2024","1141","tests","authorisation_page_test","TestAuthorizedUserPage","","","Checking the possibility of authorization with the correct data",""
"passed","Thu Aug 29 08:41:18 GMT 2024","Thu Aug 29 08:41:18 GMT 2024","29","tests","contacts_page_test","TestContactsPage","","","Verify content of the text in the section 2",""
"passed","Thu Aug 29 08:49:02 GMT 2024","Thu Aug 29 08:49:02 GMT 2024","12","tests","specialists_page_test","TestSpecialistsPage","","","Verify value of the title of the tab",""
"passed","Thu Aug 29 08:49:40 GMT 2024","Thu Aug 29 08:49:41 GMT 2024","681","tests","specialists_page_test","TestSpecialistsPage","","","Verify that the 'All Specialists' link leads an unauthorized user 
                         to the correct page after clicking",""
"passed","Thu Aug 29 08:50:13 GMT 2024","Thu Aug 29 08:50:13 GMT 2024","33","tests","start_unauthorized_page_test","TestStartUnauthorizedPage","","","Verify presence and visibility of content on the page",""
"passed","Thu Aug 29 08:41:45 GMT 2024","Thu Aug 29 08:41:46 GMT 2024","94","tests","contacts_page_test","TestContactsPage","","","Verify that the email link calls an email client",""
"passed","Thu Aug 29 08:41:24 GMT 2024","Thu Aug 29 08:41:24 GMT 2024","30","tests","contacts_page_test","TestContactsPage","","","Verify text in links in the section 2",""
"passed","Thu Aug 29 08:47:00 GMT 2024","Thu Aug 29 08:47:00 GMT 2024","112","tests","main_page_test","TestMainPage","","","Checking the clickability of the Registration button.",""
"passed","Thu Aug 29 08:52:29 GMT 2024","Thu Aug 29 08:52:40 GMT 2024","10603","tests","Речевые упражнения.","TestCardsRU","","","Select random card from group ""Слова Королёвой"" and compare UI vs BACKEND data.",""
"passed","Thu Aug 29 08:45:39 GMT 2024","Thu Aug 29 08:45:39 GMT 2024","100","tests","header_test","TestHeaderPage","","","Verify that the 'Logo' link on the Start Unauthorized Page 
                             doesn't refresh the current page or lead to other pages after clicking",""
"passed","Thu Aug 29 08:42:53 GMT 2024","Thu Aug 29 08:42:54 GMT 2024","1125","tests","contributors_page_test","TestContributorsPage","","","Verify sizes of images in contributor cards in grids",""
"passed","Thu Aug 29 08:40:47 GMT 2024","Thu Aug 29 08:40:47 GMT 2024","20","tests","contacts_page_test","TestContactsPage","","","Verify the composition and visibility of elements on the 1st level of nesting in the section 1",""
"passed","Thu Aug 29 08:41:56 GMT 2024","Thu Aug 29 08:41:57 GMT 2024","1668","tests","contributors_page_test","TestContributorsPage","","","Verify the composition and visibility of elements 
        on the 1st-5th levels of nesting on the page",""
"passed","Thu Aug 29 08:41:51 GMT 2024","Thu Aug 29 08:41:51 GMT 2024","43","tests","contributors_page_test","TestContributorsPage","","","Verify presence, visibility and structure of content on the page",""
"passed","Thu Aug 29 08:52:10 GMT 2024","Thu Aug 29 08:52:22 GMT 2024","11973","tests","Речевые упражнения.","TestCardsRU","","","Select random card from group ""Слова"" and compare UI vs BACKEND data.",""
"passed","Thu Aug 29 08:41:05 GMT 2024","Thu Aug 29 08:41:06 GMT 2024","12","tests","contacts_page_test","TestContactsPage","","","Verify value of the title of the tab",""
"passed","Thu Aug 29 08:48:38 GMT 2024","Thu Aug 29 08:48:38 GMT 2024","30","tests","specialists_page_test","TestSpecialistsPage","","","Verify presence and visibility of content on the page",""
"passed","Thu Aug 29 08:43:19 GMT 2024","Thu Aug 29 08:43:19 GMT 2024","172","tests","description_page_test","TestDescriptionPage","","","Verify redirection to contacts page not authorized user.",""
"passed","Thu Aug 29 08:43:30 GMT 2024","Thu Aug 29 08:43:31 GMT 2024","1509","tests","description_page_test","TestDescriptionPage","","","Verify redirection to github not authorized user.",""
"passed","Thu Aug 29 08:45:06 GMT 2024","Thu Aug 29 08:45:06 GMT 2024","33","tests","header_test","TestHeaderPage","","","Verify presence and visibility of the Header",""
"passed","Thu Aug 29 08:46:55 GMT 2024","Thu Aug 29 08:46:55 GMT 2024","89","tests","main_page_test","TestMainPage","","","Checking the clickability of the Start button.",""
"passed","Thu Aug 29 08:45:50 GMT 2024","Thu Aug 29 08:45:52 GMT 2024","2210","tests","header_test","TestHeaderPage","","","Verify if the 'About', 'Telegram', 'Registration' links in the Header 
                             lead to correct pages after click",""
"passed","Thu Aug 29 08:51:04 GMT 2024","Thu Aug 29 08:51:04 GMT 2024","77","tests","start_unauthorized_page_test","TestStartUnauthorizedPage","","","Verify presence, visibility and attributes of the image in the section 1",""
"passed","Thu Aug 29 08:51:52 GMT 2024","Thu Aug 29 08:52:02 GMT 2024","9734","tests","Speech exercises EN.","TestCardsEN","","","Select a random card from ""Similar phrases"" group and compare UI vs BACKEND data",""
"passed","Thu Aug 29 08:45:27 GMT 2024","Thu Aug 29 08:45:34 GMT 2024","6703","tests","header_test","TestHeaderPage","","","Verify clickability, href, status code of links in the Header",""
"passed","Thu Aug 29 08:43:52 GMT 2024","Thu Aug 29 08:43:53 GMT 2024","262","tests","footer_test","TestFooter","","","Verify composition and visibility of elements on the 1st-7th levels of nesting in the Footer",""
"passed","Thu Aug 29 08:49:15 GMT 2024","Thu Aug 29 08:49:15 GMT 2024","35","tests","specialists_page_test","TestSpecialistsPage","","","Verify value of text on the page",""
"passed","Thu Aug 29 08:50:43 GMT 2024","Thu Aug 29 08:50:43 GMT 2024","79","tests","start_unauthorized_page_test","TestStartUnauthorizedPage","","","Verify content of the text in sections 1, 2",""
"passed","Thu Aug 29 08:49:33 GMT 2024","Thu Aug 29 08:49:34 GMT 2024","839","tests","specialists_page_test","TestSpecialistsPage","","","Verify clickability, href, status code of the 'All Specialists' link",""
"passed","Thu Aug 29 08:42:47 GMT 2024","Thu Aug 29 08:42:47 GMT 2024","788","tests","contributors_page_test","TestContributorsPage","","","Verify attribute values of images in contributors cards in grids",""
"passed","Thu Aug 29 08:45:45 GMT 2024","Thu Aug 29 08:45:45 GMT 2024","104","tests","header_test","TestHeaderPage","","","Verify that the 'Logo' link on the 'Contacts' page leads an unauthorized user 
                             to the Start Unauthorized Page after clicking",""
"passed","Thu Aug 29 08:44:03 GMT 2024","Thu Aug 29 08:44:03 GMT 2024","45","tests","footer_test","TestFooter","","","Verify content of text in the Footer",""
"passed","Thu Aug 29 08:44:13 GMT 2024","Thu Aug 29 08:44:17 GMT 2024","4061","tests","footer_test","TestFooter","","","Verify clickability, href, prefix and subject, status code of links in the Footer",""
"passed","Thu Aug 29 08:50:59 GMT 2024","Thu Aug 29 08:50:59 GMT 2024","165","tests","start_unauthorized_page_test","TestStartUnauthorizedPage","","","Verify that the 'Login' link leads to the correct page after clicking",""
"passed","Thu Aug 29 08:42:09 GMT 2024","Thu Aug 29 08:42:09 GMT 2024","13","tests","contributors_page_test","TestContributorsPage","","","Verify value of the title of the tab",""
"passed","Thu Aug 29 08:47:23 GMT 2024","Thu Aug 29 08:47:27 GMT 2024","3842","tests","registration_page_test","TestRegistrationPage","","","Check registration with new email",""
"passed","Thu Aug 29 08:42:29 GMT 2024","Thu Aug 29 08:42:30 GMT 2024","467","tests","contributors_page_test","TestContributorsPage","","","Verify text in card links and the 'All Team' link",""
"passed","Thu Aug 29 08:56:05 GMT 2024","Thu Aug 29 08:56:06 GMT 2024","866","tests","used_resources_page_test","TestUsedResourcesPage","","","Verify presence and visibility of content on the page",""
"passed","Thu Aug 29 08:41:12 GMT 2024","Thu Aug 29 08:41:12 GMT 2024","52","tests","contacts_page_test","TestContactsPage","","","Verify values of the title and subtitles with tags h1, h2 on the page",""
"passed","Thu Aug 29 08:47:55 GMT 2024","Thu Aug 29 08:47:55 GMT 2024","694","tests","registration_page_test","TestRegistrationPage","","","Check registration with new email and empty birthday",""
"passed","Thu Aug 29 08:41:30 GMT 2024","Thu Aug 29 08:41:31 GMT 2024","1157","tests","contacts_page_test","TestContactsPage","","","Verify presence, visibility, clickability, href, prefix, status code of links in the section 2",""
"passed","Thu Aug 29 08:45:11 GMT 2024","Thu Aug 29 08:45:11 GMT 2024","224","tests","header_test","TestHeaderPage","","","Verify composition, visibility of elements on the 1st-6th levels of nesting in the Header",""
"passed","Thu Aug 29 08:46:50 GMT 2024","Thu Aug 29 08:46:50 GMT 2024","150","tests","main_page_test","TestMainPage","","","Verify redirection to used resources page not authorized user.",""
"passed","Thu Aug 29 08:45:16 GMT 2024","Thu Aug 29 08:45:16 GMT 2024","194","tests","header_test","TestHeaderPage","","","Verify presence, visibility of links, buttons, images in the Header",""
"passed","Thu Aug 29 08:57:14 GMT 2024","Thu Aug 29 08:57:15 GMT 2024","883","tests","used_resources_page_test","TestUsedResourcesPage","","","Verify presence, visibility and attributes of icons in sections",""
"passed","Thu Aug 29 08:48:00 GMT 2024","Thu Aug 29 08:48:01 GMT 2024","687","tests","registration_page_test","TestRegistrationPage","","","Check registration with new email and empty email",""
"passed","Thu Aug 29 08:50:28 GMT 2024","Thu Aug 29 08:50:28 GMT 2024","111","tests","start_unauthorized_page_test","TestStartUnauthorizedPage","","","Verify the composition and visibility of elements 
        on the 1st-3rd levels of nesting in the section 2",""
"passed","Thu Aug 29 08:53:27 GMT 2024","Thu Aug 29 08:53:39 GMT 2024","11328","tests","Речевые упражнения.","TestCardsRU","","","Select a random card from ""Предложения"" group and compare UI vs BACKEND data.",""
"passed","Thu Aug 29 08:51:09 GMT 2024","Thu Aug 29 08:51:09 GMT 2024","60","tests","start_unauthorized_page_test","TestStartUnauthorizedPage","","","Verify size of the image in the section 1",""
"passed","Thu Aug 29 08:49:48 GMT 2024","Thu Aug 29 08:49:51 GMT 2024","2255","tests","specialists_page_test","TestSpecialistsPage","","","Verify that the 'All Specialists' link leads an authorized user 
                         to the correct page after clicking",""
"passed","Thu Aug 29 08:43:58 GMT 2024","Thu Aug 29 08:43:58 GMT 2024","158","tests","footer_test","TestFooter","","","Verify presence, visibility of text, links, images in the Footer",""
"passed","Thu Aug 29 08:42:40 GMT 2024","Thu Aug 29 08:42:41 GMT 2024","972","tests","contributors_page_test","TestContributorsPage","","","Verify href, status code of the 'All Team' link",""
"passed","Thu Aug 29 08:46:32 GMT 2024","Thu Aug 29 08:46:33 GMT 2024","646","tests","main_page_test","TestMainPage","","","Verify redirection to specialists page not authorized user.",""
"passed","Thu Aug 29 08:49:08 GMT 2024","Thu Aug 29 08:49:08 GMT 2024","35","tests","specialists_page_test","TestSpecialistsPage","","","Verify value of title with tag 'h2' on the page",""
"passed","Thu Aug 29 08:56:30 GMT 2024","Thu Aug 29 08:56:31 GMT 2024","862","tests","used_resources_page_test","TestUsedResourcesPage","","","Verify value of title with tag 'h1' on the page",""
"passed","Thu Aug 29 08:56:22 GMT 2024","Thu Aug 29 08:56:23 GMT 2024","323","tests","used_resources_page_test","TestUsedResourcesPage","","","Verify value of the title of the tab",""
"passed","Thu Aug 29 08:43:47 GMT 2024","Thu Aug 29 08:43:47 GMT 2024","41","tests","footer_test","TestFooter","","","Verify presence and visibility of the Footer",""
"passed","Thu Aug 29 08:50:03 GMT 2024","Thu Aug 29 08:50:08 GMT 2024","5170","tests","specialists_page_test","TestSpecialistsPage","","","Verify sizes of images in specialist cards in the grid",""
"passed","Thu Aug 29 08:55:56 GMT 2024","Thu Aug 29 08:55:58 GMT 2024","1882","tests","Statistic.","TestCardsRU","","","Check statistic table.",""
"passed","Thu Aug 29 08:50:48 GMT 2024","Thu Aug 29 08:50:48 GMT 2024","39","tests","start_unauthorized_page_test","TestStartUnauthorizedPage","","","Verify text in the 'Login' link in the section 1",""
