"Status","Start Time","Stop Time","Duration in ms","Parent Suite","Suite","Sub Suite","Test Class","Test Method","Name","Description"
"passed","Mon Jun 10 00:50:31 GMT 2024","Mon Jun 10 00:50:34 GMT 2024","2733","tests","footer_test","TestFooter","","","Verify presence and visibility of Footer on each page specified in the kit",""
"passed","Mon Jun 10 00:51:18 GMT 2024","Mon Jun 10 00:51:18 GMT 2024","752","tests","footer_test","TestFooter","","","Verify presence, visibility, clickability, href, status code of the REG.RU link in Footer",""
"passed","Mon Jun 10 00:49:47 GMT 2024","Mon Jun 10 00:49:48 GMT 2024","1446","tests","contributors_page_test","TestContributorsPage","","","Verify attribute values and sizes of images in contributors cards in the grid",""
"passed","Mon Jun 10 01:00:11 GMT 2024","Mon Jun 10 01:00:36 GMT 2024","24825","tests","Речевые упражнения.","TestCardsRU","","","Select a random card from ""Предложения"" group and compare UI vs BACKEND data.",""
"passed","Mon Jun 10 00:48:59 GMT 2024","Mon Jun 10 00:48:59 GMT 2024","74","tests","contributors_page_test","TestContributorsPage","","","Verify presence, visibility and structure of content on the page",""
"passed","Mon Jun 10 00:49:30 GMT 2024","Mon Jun 10 00:49:31 GMT 2024","402","tests","contributors_page_test","TestContributorsPage","","","Verify text in links in card links",""
"passed","Mon Jun 10 00:48:54 GMT 2024","Mon Jun 10 00:48:55 GMT 2024","1190","tests","contacts_page_test","TestContactsPage","","","Verify that links in sections 1, 2 lead to the correct pages after click",""
"passed","Mon Jun 10 00:57:57 GMT 2024","Mon Jun 10 00:57:57 GMT 2024","37","tests","start_unauthorized_page_test","TestStartUnauthorizedPage","","","Verify values of the text in the section 1 on the page",""
"passed","Mon Jun 10 01:04:33 GMT 2024","Mon Jun 10 01:04:34 GMT 2024","769","tests","used_resources_page_test","TestUsedResourcesPage","","","Verify value of title with tag 'h1' on the page",""
"passed","Mon Jun 10 00:53:29 GMT 2024","Mon Jun 10 00:53:29 GMT 2024","78","tests","footer_test","TestFooter","","","Verify changes of visible sizes of the REG.RU link's image in Footer",""
"passed","Mon Jun 10 01:00:43 GMT 2024","Mon Jun 10 01:00:54 GMT 2024","11096","tests","Речевые упражнения.","TestCardsRU","","","Select a random card from ""Слова с частотной группировкой"" group and compare UI vs BACKEND data.",""
"passed","Mon Jun 10 00:55:22 GMT 2024","Mon Jun 10 00:55:26 GMT 2024","4157","tests","registration_page_test","TestRegistrationPage","","","Check registration with new email",""
"passed","Mon Jun 10 00:57:36 GMT 2024","Mon Jun 10 00:57:36 GMT 2024","31","tests","start_unauthorized_page_test","TestStartUnauthorizedPage","","","Verify presence and visibility of content on the page",""
"passed","Mon Jun 10 00:50:14 GMT 2024","Mon Jun 10 00:50:15 GMT 2024","1524","tests","description_page_test","TestDescriptionPage","","","Verify redirection to github not authorized user.",""
"passed","Mon Jun 10 01:01:00 GMT 2024","Mon Jun 10 01:01:58 GMT 2024","58951","tests","Речевые упражнения.","TestCardsRU","","","Solutions to a random task in the ""Слова"" .",""
"passed","Mon Jun 10 01:05:02 GMT 2024","Mon Jun 10 01:05:03 GMT 2024","806","tests","used_resources_page_test","TestUsedResourcesPage","","","Verify sizes of icons in the sections",""
"passed","Mon Jun 10 00:58:01 GMT 2024","Mon Jun 10 00:58:01 GMT 2024","35","tests","start_unauthorized_page_test","TestStartUnauthorizedPage","","","Verify values of the text in the section 2 on the page",""
"passed","Mon Jun 10 00:54:03 GMT 2024","Mon Jun 10 00:54:03 GMT 2024","96","tests","header_test","TestHeaderPage","","","Verify that the 'Logo' link on the 'Contacts' page leads an unauthorized user 
                             to the Start Unauthorized Page after clicking",""
"passed","Mon Jun 10 00:54:19 GMT 2024","Mon Jun 10 00:54:19 GMT 2024","23","tests","header_test","TestHeaderPage","","","Verify values of the text in the 'About' and the 'Telegram' links 
                          in the Section 2 in the Header",""
"passed","Mon Jun 10 00:52:47 GMT 2024","Mon Jun 10 00:52:47 GMT 2024","77","tests","footer_test","TestFooter","","","Verify that the Contact us link in Footer calls an email client",""
"passed","Mon Jun 10 00:53:54 GMT 2024","Mon Jun 10 00:53:55 GMT 2024","589","tests","header_test","TestHeaderPage","","","Verify presence, visibility, clickability, href, status code  
                             of the 'Logo' link in the section 1 in the Header",""
"passed","Mon Jun 10 00:56:32 GMT 2024","Mon Jun 10 00:56:32 GMT 2024","39","tests","specialists_page_test","TestSpecialistsPage","","","Verify presence, visibility and size of the grid on the Specialists page",""
"passed","Mon Jun 10 00:55:08 GMT 2024","Mon Jun 10 00:55:18 GMT 2024","10535","tests","profile_page_test","TestProfilePage","","","Change the password by receiving an email link",""
"passed","Mon Jun 10 00:58:04 GMT 2024","Mon Jun 10 00:58:04 GMT 2024","92","tests","start_unauthorized_page_test","TestStartUnauthorizedPage","","","Verify attribute values and size of the image in the section 1 on the page",""
"passed","Mon Jun 10 00:55:46 GMT 2024","Mon Jun 10 00:55:47 GMT 2024","621","tests","registration_page_test","TestRegistrationPage","","","Check registration with new email and empty birthday",""
"passed","Mon Jun 10 00:57:15 GMT 2024","Mon Jun 10 00:57:21 GMT 2024","5229","tests","specialists_page_test","TestSpecialistsPage","","","Verify that the 'All Specialists' link leads an unauthorized user 
                         to the correct page after clicking",""
"passed","Mon Jun 10 00:53:50 GMT 2024","Mon Jun 10 00:53:50 GMT 2024","37","tests","header_test","TestHeaderPage","","","Verify the section with the 'ru' and 'en' buttons in the Header",""
"passed","Mon Jun 10 00:58:08 GMT 2024","Mon Jun 10 00:58:08 GMT 2024","712","tests","start_unauthorized_page_test","TestStartUnauthorizedPage","","","Verify presence, visibility, clickability, href, status code, text 
                         of the 'Login' link in the section 1 on the page",""
"passed","Mon Jun 10 00:48:12 GMT 2024","Mon Jun 10 00:48:12 GMT 2024","20","tests","contacts_page_test","TestContactsPage","","","Verify amount and visibility of sections with content on the page",""
"passed","Mon Jun 10 00:51:22 GMT 2024","Mon Jun 10 00:51:24 GMT 2024","1776","tests","footer_test","TestFooter","","","Verify presence, visibility, clickability, href, status code of the Selectel link in Footer",""
"passed","Mon Jun 10 00:50:24 GMT 2024","Mon Jun 10 00:50:27 GMT 2024","2623","tests","footer_test","TestFooter","","","Verify presence and visibility of Footer on each page specified in the kit",""
"passed","Mon Jun 10 00:53:40 GMT 2024","Mon Jun 10 00:53:40 GMT 2024","78","tests","footer_test","TestFooter","","","Verify changes of visible sizes of the Selectel link's image in Footer",""
