"Status","Start Time","Stop Time","Duration in ms","Parent Suite","Suite","Sub Suite","Test Class","Test Method","Name","Description"
"passed","Wed Mar 12 10:39:00 GMT 2025","Wed Mar 12 10:39:55 GMT 2025","55090","tests","Речевые упражнения.","TestCardsRU","","","Solutions to a random task in the ""Слова"" .",""
"passed","Wed Mar 12 10:32:21 GMT 2025","Wed Mar 12 10:32:22 GMT 2025","1314","tests","registration_page_test","TestRegistrationPage","","","Check registration with an existing email",""
"passed","Wed Mar 12 10:20:44 GMT 2025","Wed Mar 12 10:20:44 GMT 2025","602","tests","exercises_ru_words_page_test","TestExercisesRuWordsPage","","","Verify text in group links on the page",""
"passed","Wed Mar 12 10:31:45 GMT 2025","Wed Mar 12 10:31:46 GMT 2025","198","tests","main_page_test","TestMainPage","","","Verify redirection to used resources page not authorized user.",""
"passed","Wed Mar 12 10:23:21 GMT 2025","Wed Mar 12 10:23:22 GMT 2025","1075","tests","exercises_ru_words_page_test","TestExercisesRuWordsPage","","","Verify attributes of images in links on the page",""
"passed","Wed Mar 12 10:40:51 GMT 2025","Wed Mar 12 10:40:53 GMT 2025","2420","tests","Statistic.","TestCardsRU","","","Check statistic table.",""
"passed","Wed Mar 12 10:16:15 GMT 2025","Wed Mar 12 10:16:16 GMT 2025","942","tests","authorisation_page_test","TestAuthorizedUserPage","","","Checking the possibility of authorization with the correct data",""
"passed","Wed Mar 12 10:18:00 GMT 2025","Wed Mar 12 10:18:00 GMT 2025","555","tests","contributors_page_test","TestContributorsPage","","","Verify href, status code of the 'All Team' link",""
"passed","Wed Mar 12 10:27:13 GMT 2025","Wed Mar 12 10:27:22 GMT 2025","8237","tests","groups_page_test","TestGroupsPage","","","Verify attributes of images in links on the page",""
"passed","Wed Mar 12 10:17:19 GMT 2025","Wed Mar 12 10:17:19 GMT 2025","39","tests","contributors_page_test","TestContributorsPage","","","Verify presence, visibility and structure of content on the page",""
"skipped","Wed Mar 12 10:38:29 GMT 2025","Wed Mar 12 10:38:53 GMT 2025","23995","tests","Речевые упражнения.","TestCardsRU","","","Select a random card from ""Слова с частотной группировкой"" group and compare UI vs BACKEND data.",""
"passed","Wed Mar 12 10:16:59 GMT 2025","Wed Mar 12 10:16:59 GMT 2025","30","tests","contacts_page_test","TestContactsPage","","","Verify text in links in the section 2",""
"passed","Wed Mar 12 10:41:46 GMT 2025","Wed Mar 12 10:41:46 GMT 2025","84","tests","used_resources_page_test","TestUsedResourcesPage","","","Verify sizes of icons in sections",""
"passed","Wed Mar 12 10:31:23 GMT 2025","Wed Mar 12 10:31:24 GMT 2025","1045","tests","main_page_test","TestMainPage","","","Verify redirection to donate page not authorized user.",""
"passed","Wed Mar 12 10:27:42 GMT 2025","Wed Mar 12 10:27:52 GMT 2025","10225","tests","header_test","TestHeaderPage","","","Verify composition, visibility of elements on the 1st-6th levels of nesting in the Header
            for an unauthorized user",""
"passed","Wed Mar 12 10:32:26 GMT 2025","Wed Mar 12 10:32:27 GMT 2025","824","tests","registration_page_test","TestRegistrationPage","","","Check registration with new email and empty confirm password",""
"passed","Wed Mar 12 10:31:49 GMT 2025","Wed Mar 12 10:31:49 GMT 2025","125","tests","main_page_test","TestMainPage","","","Checking the clickability of the Start button.",""
"passed","Wed Mar 12 10:25:13 GMT 2025","Wed Mar 12 10:25:21 GMT 2025","8198","tests","groups_page_test","TestGroupsPage","","","Verify value of the title of the tab",""
"passed","Wed Mar 12 10:33:44 GMT 2025","Wed Mar 12 10:33:44 GMT 2025","39","tests","specialists_page_test","TestSpecialistsPage","","","Verify value of title with tag 'h2' on the page",""
"passed","Wed Mar 12 10:32:31 GMT 2025","Wed Mar 12 10:32:31 GMT 2025","837","tests","registration_page_test","TestRegistrationPage","","","Check registration with new email and empty password",""
"passed","Wed Mar 12 10:30:44 GMT 2025","Wed Mar 12 10:30:44 GMT 2025","44","tests","header_test","TestHeaderPage","","","Verify presence, visibility and attributes of the image in the 'Logo' link in the Header 
               for an authorized user",""
"passed","Wed Mar 12 10:16:45 GMT 2025","Wed Mar 12 10:16:45 GMT 2025","12","tests","contacts_page_test","TestContactsPage","","","Verify value of the title of the tab",""
"passed","Wed Mar 12 10:34:36 GMT 2025","Wed Mar 12 10:34:36 GMT 2025","42","tests","start_unauthorized_page_test","TestStartUnauthorizedPage","","","Verify amount and visibility of sections with content on the page",""
"passed","Wed Mar 12 10:28:12 GMT 2025","Wed Mar 12 10:28:17 GMT 2025","5059","tests","header_test","TestHeaderPage","","","Verify if internal links in the Header for an unauthorized user 
            lead to correct pages after click",""
"passed","Wed Mar 12 10:16:55 GMT 2025","Wed Mar 12 10:16:55 GMT 2025","32","tests","contacts_page_test","TestContactsPage","","","Verify content of the text in the section 2",""
"passed","Wed Mar 12 10:34:04 GMT 2025","Wed Mar 12 10:34:04 GMT 2025","440","tests","specialists_page_test","TestSpecialistsPage","","","Verify clickability, href, status code of the 'All Specialists' link",""
"passed","Wed Mar 12 10:28:21 GMT 2025","Wed Mar 12 10:28:23 GMT 2025","1875","tests","header_test","TestHeaderPage","","","Verify if external links in the Header for an unauthorized user 
            lead to correct pages after click",""
"passed","Wed Mar 12 10:17:43 GMT 2025","Wed Mar 12 10:17:43 GMT 2025","22","tests","contributors_page_test","TestContributorsPage","","","Verify content of the text on the page",""
"passed","Wed Mar 12 10:23:53 GMT 2025","Wed Mar 12 10:23:53 GMT 2025","63","tests","footer_test","TestFooter","","","Verify content of text in the Footer",""
"passed","Wed Mar 12 10:21:06 GMT 2025","Wed Mar 12 10:21:07 GMT 2025","1779","tests","exercises_ru_words_page_test","TestExercisesRuWordsPage","","","Verify clickability, href, status code of links in breadcrumbs on the page",""
"passed","Wed Mar 12 10:34:09 GMT 2025","Wed Mar 12 10:34:09 GMT 2025","653","tests","specialists_page_test","TestSpecialistsPage","","","Verify that the 'All Specialists' link leads an unauthorized user 
                         to the correct page after clicking",""
"passed","Wed Mar 12 10:25:51 GMT 2025","Wed Mar 12 10:26:17 GMT 2025","26304","tests","groups_page_test","TestGroupsPage","","","Verify clickability, title, href, status code of links on the page",""
"passed","Wed Mar 12 10:32:49 GMT 2025","Wed Mar 12 10:32:49 GMT 2025","760","tests","registration_page_test","TestRegistrationPage","","","Check registration without choosing gender",""
"passed","Wed Mar 12 10:34:46 GMT 2025","Wed Mar 12 10:34:46 GMT 2025","133","tests","start_unauthorized_page_test","TestStartUnauthorizedPage","","","Verify the composition and visibility of elements 
        on the 1st-3rd levels of nesting in the section 2",""
"passed","Wed Mar 12 10:31:04 GMT 2025","Wed Mar 12 10:31:04 GMT 2025","56","tests","header_test","TestHeaderPage","","","Verify presence, visibility and attributes of the profile avatar in the Header 
               for an authorized user",""
"passed","Wed Mar 12 10:35:10 GMT 2025","Wed Mar 12 10:35:10 GMT 2025","158","tests","start_unauthorized_page_test","TestStartUnauthorizedPage","","","Verify that the 'Login' link leads to the correct page after clicking",""
"passed","Wed Mar 12 10:41:13 GMT 2025","Wed Mar 12 10:41:13 GMT 2025","77","tests","used_resources_page_test","TestUsedResourcesPage","","","Verify value of title with tag 'h1' on the page",""
"passed","Wed Mar 12 10:35:06 GMT 2025","Wed Mar 12 10:35:06 GMT 2025","613","tests","start_unauthorized_page_test","TestStartUnauthorizedPage","","","Verify presence, visibility, clickability, href, status code 
                         of the 'Login' link in the section 1",""
"passed","Wed Mar 12 10:35:14 GMT 2025","Wed Mar 12 10:35:14 GMT 2025","91","tests","start_unauthorized_page_test","TestStartUnauthorizedPage","","","Verify presence, visibility and attributes of the image in the section 1",""
"passed","Wed Mar 12 10:28:00 GMT 2025","Wed Mar 12 10:28:00 GMT 2025","219","tests","header_test","TestHeaderPage","","","Verify values of the text in links, buttons in the Header for an unauthorized user",""
"passed","Wed Mar 12 10:37:04 GMT 2025","Wed Mar 12 10:37:15 GMT 2025","11355","tests","Речевые упражнения.","TestCardsRU","","","Select random card from group ""Слова Королёвой"" and compare UI vs BACKEND data.",""
"passed","Wed Mar 12 10:27:28 GMT 2025","Wed Mar 12 10:27:35 GMT 2025","6073","tests","groups_page_test","TestGroupsPage","","","Verify sizes of images in links on the page",""
"passed","Wed Mar 12 10:31:53 GMT 2025","Wed Mar 12 10:31:54 GMT 2025","524","tests","main_page_test","TestMainPage","","","Checking the domain is available",""
"passed","Wed Mar 12 10:20:11 GMT 2025","Wed Mar 12 10:20:13 GMT 2025","2101","tests","exercises_ru_words_page_test","TestExercisesRuWordsPage","","","Verify presence, visibility of lists on the page",""
"passed","Wed Mar 12 10:34:58 GMT 2025","Wed Mar 12 10:34:58 GMT 2025","75","tests","start_unauthorized_page_test","TestStartUnauthorizedPage","","","Verify content of the text in sections 1, 2",""
"passed","Wed Mar 12 10:33:54 GMT 2025","Wed Mar 12 10:33:54 GMT 2025","117","tests","specialists_page_test","TestSpecialistsPage","","","Verify values of names and professions in specialist cards in the grid",""
"passed","Wed Mar 12 10:34:54 GMT 2025","Wed Mar 12 10:34:54 GMT 2025","65","tests","start_unauthorized_page_test","TestStartUnauthorizedPage","","","Verify values of titles and subtitles with tags h2, h4 on the page",""
"passed","Wed Mar 12 10:21:28 GMT 2025","Wed Mar 12 10:21:52 GMT 2025","23612","tests","exercises_ru_words_page_test","TestExercisesRuWordsPage","","","Verify clickability, titles, href, status code of subgroup links on the page",""
"passed","Wed Mar 12 10:17:35 GMT 2025","Wed Mar 12 10:17:35 GMT 2025","13","tests","contributors_page_test","TestContributorsPage","","","Verify value of the title of the tab",""
"passed","Wed Mar 12 10:18:22 GMT 2025","Wed Mar 12 10:18:23 GMT 2025","991","tests","description_page_test","TestDescriptionPage","","","Verify redirection to donate page not authorized user.",""
"passed","Wed Mar 12 10:41:28 GMT 2025","Wed Mar 12 10:41:29 GMT 2025","1819","tests","used_resources_page_test","TestUsedResourcesPage","","","Verify presence, visibility, clickability, href, status code of links in sections",""
"passed","Wed Mar 12 10:35:02 GMT 2025","Wed Mar 12 10:35:02 GMT 2025","61","tests","start_unauthorized_page_test","TestStartUnauthorizedPage","","","Verify text in the 'Login' link in the section 1",""
"passed","Wed Mar 12 10:16:30 GMT 2025","Wed Mar 12 10:16:30 GMT 2025","22","tests","contacts_page_test","TestContactsPage","","","Verify the composition and visibility of elements on the 1st level of nesting in the section 1",""
"passed","Wed Mar 12 10:18:55 GMT 2025","Wed Mar 12 10:18:55 GMT 2025","77","tests","exercises_ru_similar_phrases_page_test","TestExercisesRuSimilarPhrasesPage","","","Verify presence and visibility of content on the page",""
"passed","Wed Mar 12 10:41:08 GMT 2025","Wed Mar 12 10:41:08 GMT 2025","13","tests","used_resources_page_test","TestUsedResourcesPage","","","Verify value of the title of the tab",""
"passed","Wed Mar 12 10:16:35 GMT 2025","Wed Mar 12 10:16:35 GMT 2025","150","tests","contacts_page_test","TestContactsPage","","","Verify the composition and visibility of elements 
        on the 1st-5th levels of nesting in the section 2",""
"passed","Wed Mar 12 10:28:04 GMT 2025","Wed Mar 12 10:28:09 GMT 2025","5029","tests","header_test","TestHeaderPage","","","Verify clickability, href, status code of links in the Header for an unauthorized user",""
"skipped","Wed Mar 12 10:35:51 GMT 2025","Wed Mar 12 10:36:12 GMT 2025","20213","tests","Speech exercises EN.","TestCardsEN","","","Check progres-bar and buttons.",""
"passed","Wed Mar 12 10:16:25 GMT 2025","Wed Mar 12 10:16:25 GMT 2025","28","tests","contacts_page_test","TestContactsPage","","","Verify presence and visibility of content on the page",""
"passed","Wed Mar 12 10:17:16 GMT 2025","Wed Mar 12 10:17:16 GMT 2025","104","tests","contacts_page_test","TestContactsPage","","","Verify that the email link calls an email client",""
"passed","Wed Mar 12 10:41:41 GMT 2025","Wed Mar 12 10:41:41 GMT 2025","63","tests","used_resources_page_test","TestUsedResourcesPage","","","Verify presence, visibility and attributes of icons in sections",""
"passed","Wed Mar 12 10:22:15 GMT 2025","Wed Mar 12 10:22:16 GMT 2025","794","tests","exercises_ru_words_page_test","TestExercisesRuWordsPage","","","Verify if breadcrumbs link2 leads to the correct page after clicking",""
"passed","Wed Mar 12 10:34:28 GMT 2025","Wed Mar 12 10:34:29 GMT 2025","216","tests","specialists_page_test","TestSpecialistsPage","","","Verify sizes of images in specialist cards in the grid",""
"passed","Wed Mar 12 10:24:47 GMT 2025","Wed Mar 12 10:24:47 GMT 2025","27","tests","groups_page_test","TestGroupsPage","","","Verify presence and visibility of content on the page",""
"passed","Wed Mar 12 10:36:46 GMT 2025","Wed Mar 12 10:36:57 GMT 2025","11444","tests","Речевые упражнения.","TestCardsRU","","","Select random card from group ""Слова"" and compare UI vs BACKEND data.",""
"passed","Wed Mar 12 10:24:08 GMT 2025","Wed Mar 12 10:24:17 GMT 2025","9716","tests","footer_test","TestFooter","","","Verify that links in the Footer lead to correct pages after clicking",""
"passed","Wed Mar 12 10:28:27 GMT 2025","Wed Mar 12 10:28:27 GMT 2025","131","tests","header_test","TestHeaderPage","","","Verify that the 'Logo' link on the Start Unauthorized Page 
                             doesn't refresh the current page or lead to other pages after clicking",""
"passed","Wed Mar 12 10:19:36 GMT 2025","Wed Mar 12 10:19:37 GMT 2025","88","tests","exercises_ru_similar_phrases_page_test","TestExercisesRuSimilarPhrasesPage","","","Verify value of the breadcrumbs on the page",""
"passed","Wed Mar 12 10:41:03 GMT 2025","Wed Mar 12 10:41:03 GMT 2025","134","tests","used_resources_page_test","TestUsedResourcesPage","","","Verify the composition and visibility of elements 
        on the 1st-4th levels of nesting on the page",""
"passed","Wed Mar 12 10:17:04 GMT 2025","Wed Mar 12 10:17:05 GMT 2025","773","tests","contacts_page_test","TestContactsPage","","","Verify presence, visibility, clickability, href, prefix, status code of links in the section 2",""
"passed","Wed Mar 12 10:23:49 GMT 2025","Wed Mar 12 10:23:50 GMT 2025","173","tests","footer_test","TestFooter","","","Verify presence, visibility of text, links, images in the Footer",""
"passed","Wed Mar 12 10:27:38 GMT 2025","Wed Mar 12 10:27:38 GMT 2025","34","tests","header_test","TestHeaderPage","","","Verify presence and visibility of the Header for an unauthorized user",""
"passed","Wed Mar 12 10:29:27 GMT 2025","Wed Mar 12 10:29:27 GMT 2025","28","tests","header_test","TestHeaderPage","","","Verify presence, visibility of the user name in the Header for an authorized user",""
"passed","Wed Mar 12 10:31:28 GMT 2025","Wed Mar 12 10:31:28 GMT 2025","228","tests","main_page_test","TestMainPage","","","Verify redirection to contacts page not authorized user.",""
"passed","Wed Mar 12 10:25:28 GMT 2025","Wed Mar 12 10:25:44 GMT 2025","16420","tests","groups_page_test","TestGroupsPage","","","Verify value of the title and subtitles on the page",""
"passed","Wed Mar 12 10:32:53 GMT 2025","Wed Mar 12 10:33:14 GMT 2025","20857","tests","registration_page_test","TestRegistrationPage","","","Check registration without choosing agreement",""
"passed","Wed Mar 12 10:29:34 GMT 2025","Wed Mar 12 10:29:39 GMT 2025","5681","tests","header_test","TestHeaderPage","","","Verify clickability, href, status code of links in the Header for an authorized user",""
"passed","Wed Mar 12 10:17:28 GMT 2025","Wed Mar 12 10:17:32 GMT 2025","3837","tests","contributors_page_test","TestContributorsPage","","","Verify presence, visibility of titles/subtitles, cards, descriptions, links, images on the page",""
"skipped","Wed Mar 12 10:31:54 GMT 2025","Wed Mar 12 10:31:54 GMT 2025","0","tests","main_page_test","TestMainPage","","","Checking the ip is available",""
"passed","Wed Mar 12 10:30:15 GMT 2025","Wed Mar 12 10:30:15 GMT 2025","89","tests","header_test","TestHeaderPage","","","Verify that the 'Logo' link on the Start Authorized Page 
                             doesn't refresh the current page or lead to other pages after clicking",""
"passed","Wed Mar 12 10:29:46 GMT 2025","Wed Mar 12 10:30:00 GMT 2025","14358","tests","header_test","TestHeaderPage","","","Verify if internal links in the Header for an authorized user 
            lead to correct pages after click",""
"passed","Wed Mar 12 10:21:18 GMT 2025","Wed Mar 12 10:21:18 GMT 2025","848","tests","exercises_ru_words_page_test","TestExercisesRuWordsPage","","","Verify clickability, titles, attributes of group links on the page",""
"passed","Wed Mar 12 10:27:56 GMT 2025","Wed Mar 12 10:27:56 GMT 2025","404","tests","header_test","TestHeaderPage","","","Verify presence, visibility of links, buttons in the Header for an unauthorized user",""
"passed","Wed Mar 12 10:31:14 GMT 2025","Wed Mar 12 10:31:14 GMT 2025","216","tests","main_page_test","TestMainPage","","","Verify redirection to description page not authorized user.",""
"passed","Wed Mar 12 10:24:53 GMT 2025","Wed Mar 12 10:24:56 GMT 2025","3170","tests","groups_page_test","TestGroupsPage","","","Verify composition, visibility of elements on the 1st-6th levels of nesting on the page",""
"passed","Wed Mar 12 10:33:29 GMT 2025","Wed Mar 12 10:33:34 GMT 2025","5378","tests","specialists_page_test","TestSpecialistsPage","","","Verify presence, visibility of the title, text, link, grid, cards and images  
        on the 2nd, 3rd, 5th, 6th levels of nesting on the page",""
"passed","Wed Mar 12 10:41:18 GMT 2025","Wed Mar 12 10:41:18 GMT 2025","38","tests","used_resources_page_test","TestUsedResourcesPage","","","Verify content of the text on the page",""
"passed","Wed Mar 12 10:20:33 GMT 2025","Wed Mar 12 10:20:34 GMT 2025","609","tests","exercises_ru_words_page_test","TestExercisesRuWordsPage","","","Verify value of the breadcrumbs on the page",""
"passed","Wed Mar 12 10:18:08 GMT 2025","Wed Mar 12 10:18:10 GMT 2025","1219","tests","contributors_page_test","TestContributorsPage","","","Verify sizes of images in contributor cards in grids",""
"passed","Wed Mar 12 10:33:24 GMT 2025","Wed Mar 12 10:33:24 GMT 2025","358","tests","specialists_page_test","TestSpecialistsPage","","","Verify the composition and visibility of elements 
        on the 1st-6th levels of nesting on the page",""
"skipped","Wed Mar 12 10:35:24 GMT 2025","Wed Mar 12 10:35:45 GMT 2025","20208","tests","Speech exercises EN.","TestCardsEN","","","Select random card from ""Word"" group and compare UI vs BACKEND data",""
"passed","Wed Mar 12 10:16:50 GMT 2025","Wed Mar 12 10:16:50 GMT 2025","52","tests","contacts_page_test","TestContactsPage","","","Verify values of the title and subtitles with tags h1, h2 on the page",""
"passed","Wed Mar 12 10:30:07 GMT 2025","Wed Mar 12 10:30:09 GMT 2025","1872","tests","header_test","TestHeaderPage","","","Verify if external links in the Header for an authorized user 
            lead to correct pages after click",""
"passed","Wed Mar 12 10:35:17 GMT 2025","Wed Mar 12 10:35:18 GMT 2025","75","tests","start_unauthorized_page_test","TestStartUnauthorizedPage","","","Verify size of the image in the section 1",""
"passed","Wed Mar 12 10:28:31 GMT 2025","Wed Mar 12 10:28:31 GMT 2025","306","tests","header_test","TestHeaderPage","","","Verify the dropdown opens/closes after clicking on the 'More' button in the Header 
            on the Start Unauthorized Page",""
"passed","Wed Mar 12 10:20:54 GMT 2025","Wed Mar 12 10:20:56 GMT 2025","1201","tests","exercises_ru_words_page_test","TestExercisesRuWordsPage","","","Verify text in cards on the page",""
"passed","Wed Mar 12 10:18:44 GMT 2025","Wed Mar 12 10:18:44 GMT 2025","208","tests","description_page_test","TestDescriptionPage","","","Verify redirection to used resources page not authorized user.",""
"passed","Wed Mar 12 10:18:17 GMT 2025","Wed Mar 12 10:18:18 GMT 2025","1168","tests","description_page_test","TestDescriptionPage","","","Verify redirection to telegram page not authorized user.",""
"passed","Wed Mar 12 10:34:43 GMT 2025","Wed Mar 12 10:34:43 GMT 2025","101","tests","start_unauthorized_page_test","TestStartUnauthorizedPage","","","Verify the composition and visibility of elements 
        on the 1st-3rd levels of nesting in the section 1",""
"skipped","Wed Mar 12 10:37:23 GMT 2025","Wed Mar 12 10:37:34 GMT 2025","11207","tests","Речевые упражнения.","TestCardsRU","","","Select a random card from ""Похожие фразы"" group and compare UI vs BACKEND data.",""
"passed","Wed Mar 12 10:34:24 GMT 2025","Wed Mar 12 10:34:24 GMT 2025","120","tests","specialists_page_test","TestSpecialistsPage","","","Verify attributes of images in specialist cards in the grid",""
"passed","Wed Mar 12 10:32:11 GMT 2025","Wed Mar 12 10:32:17 GMT 2025","6210","tests","registration_page_test","TestRegistrationPage","","","Check registration with new email",""
"passed","Wed Mar 12 10:31:36 GMT 2025","Wed Mar 12 10:31:37 GMT 2025","1401","tests","main_page_test","TestMainPage","","","Verify redirection to github not authorized user.",""
"passed","Wed Mar 12 10:33:39 GMT 2025","Wed Mar 12 10:33:39 GMT 2025","15","tests","specialists_page_test","TestSpecialistsPage","","","Verify value of the title of the tab",""
"passed","Wed Mar 12 10:30:50 GMT 2025","Wed Mar 12 10:30:51 GMT 2025","68","tests","header_test","TestHeaderPage","","","Verify size of the image in the 'Logo' link in the Header for an authorized user",""
"passed","Wed Mar 12 10:40:58 GMT 2025","Wed Mar 12 10:40:58 GMT 2025","30","tests","used_resources_page_test","TestUsedResourcesPage","","","Verify presence and visibility of content on the page",""
"passed","Wed Mar 12 10:32:40 GMT 2025","Wed Mar 12 10:32:41 GMT 2025","799","tests","registration_page_test","TestRegistrationPage","","","Check registration with new email and empty birthday",""
"passed","Wed Mar 12 10:29:20 GMT 2025","Wed Mar 12 10:29:20 GMT 2025","206","tests","header_test","TestHeaderPage","","","Verify values of the text in links, buttons in the Header for an authorized user",""
"passed","Wed Mar 12 10:23:57 GMT 2025","Wed Mar 12 10:23:57 GMT 2025","63","tests","footer_test","TestFooter","","","Verify text in the 'Contact us' link in the Footer",""
"passed","Wed Mar 12 10:29:13 GMT 2025","Wed Mar 12 10:29:13 GMT 2025","405","tests","header_test","TestHeaderPage","","","Verify presence, visibility of links, buttons in the Header for an authorized user",""
"passed","Wed Mar 12 10:34:50 GMT 2025","Wed Mar 12 10:34:50 GMT 2025","15","tests","start_unauthorized_page_test","TestStartUnauthorizedPage","","","Verify value of the title of the tab",""
"passed","Wed Mar 12 10:23:42 GMT 2025","Wed Mar 12 10:23:42 GMT 2025","58","tests","footer_test","TestFooter","","","Verify presence and visibility of the Footer",""
"passed","Wed Mar 12 10:24:21 GMT 2025","Wed Mar 12 10:24:21 GMT 2025","122","tests","footer_test","TestFooter","","","Verify that the 'Contact us' link in the Footer calls an email client",""
"passed","Wed Mar 12 10:30:57 GMT 2025","Wed Mar 12 10:30:57 GMT 2025","48","tests","header_test","TestHeaderPage","","","Verify presence, visibility, attributes of icons in the Header for an authorized user",""
"passed","Wed Mar 12 10:37:41 GMT 2025","Wed Mar 12 10:37:52 GMT 2025","11171","tests","Речевые упражнения.","TestCardsRU","","","Select a random card from ""Группа слов"" group and compare UI vs BACKEND data.",""
"passed","Wed Mar 12 10:28:39 GMT 2025","Wed Mar 12 10:28:39 GMT 2025","73","tests","header_test","TestHeaderPage","","","Verify presence, visibility and attributes of the image in the 'Logo' link in the Header 
               on the Start Unauthorized Page",""
"passed","Wed Mar 12 10:18:13 GMT 2025","Wed Mar 12 10:18:13 GMT 2025","185","tests","description_page_test","TestDescriptionPage","","","Verify return main page from description page.",""
"passed","Wed Mar 12 10:16:40 GMT 2025","Wed Mar 12 10:16:40 GMT 2025","176","tests","contacts_page_test","TestContactsPage","","","Verify presence, visibility of sections, the dividing line and elements with text on the page",""
"passed","Wed Mar 12 10:17:10 GMT 2025","Wed Mar 12 10:17:11 GMT 2025","1224","tests","contacts_page_test","TestContactsPage","","","Verify if links in the section 2 lead to the correct pages after clicking",""
"passed","Wed Mar 12 10:34:32 GMT 2025","Wed Mar 12 10:34:32 GMT 2025","40","tests","start_unauthorized_page_test","TestStartUnauthorizedPage","","","Verify presence and visibility of content on the page",""
"passed","Wed Mar 12 10:28:35 GMT 2025","Wed Mar 12 10:28:35 GMT 2025","228","tests","header_test","TestHeaderPage","","","Verify switching of the 'ru', 'en' buttons in the Header on the Start Unauthorized Page",""
"passed","Wed Mar 12 10:17:39 GMT 2025","Wed Mar 12 10:17:39 GMT 2025","44","tests","contributors_page_test","TestContributorsPage","","","Verify values of title and subtitles with tags h2, h3 on the page",""
"skipped","Wed Mar 12 10:36:19 GMT 2025","Wed Mar 12 10:36:39 GMT 2025","20257","tests","Speech exercises EN.","TestCardsEN","","","Select a random card from ""Similar phrases"" group and compare UI vs BACKEND data",""
