"Status","Start Time","Stop Time","Duration in ms","Parent Suite","Suite","Sub Suite","Test Class","Test Method","Name","Description"
"skipped","Wed Mar 12 10:40:36 GMT 2025","Wed Mar 12 10:40:44 GMT 2025","7924","tests","Речевые упражнения.","TestCardsRU","","","Solutions to a random task in the ""Слова"" group and comparison of statics.",""
"passed","Wed Mar 12 10:33:59 GMT 2025","Wed Mar 12 10:33:59 GMT 2025","51","tests","specialists_page_test","TestSpecialistsPage","","","Verify text in the 'All Specialists' link",""
"passed","Wed Mar 12 10:17:46 GMT 2025","Wed Mar 12 10:17:48 GMT 2025","1388","tests","contributors_page_test","TestContributorsPage","","","Verify values of the text in card descriptions",""
"passed","Wed Mar 12 10:22:38 GMT 2025","Wed Mar 12 10:22:53 GMT 2025","14956","tests","exercises_ru_words_page_test","TestExercisesRuWordsPage","","","Verify if group links lead to correct pages after clicking",""
"passed","Wed Mar 12 10:31:32 GMT 2025","Wed Mar 12 10:31:32 GMT 2025","692","tests","main_page_test","TestMainPage","","","Verify redirection to specialists page not authorized user.",""
"passed","Wed Mar 12 10:20:23 GMT 2025","Wed Mar 12 10:20:23 GMT 2025","76","tests","exercises_ru_words_page_test","TestExercisesRuWordsPage","","","Verify value of the title of the tab",""
"passed","Wed Mar 12 10:19:16 GMT 2025","Wed Mar 12 10:19:16 GMT 2025","320","tests","exercises_ru_similar_phrases_page_test","TestExercisesRuSimilarPhrasesPage","","","Verify presence, visibility of lists on the page",""
"passed","Wed Mar 12 10:22:27 GMT 2025","Wed Mar 12 10:22:28 GMT 2025","940","tests","exercises_ru_words_page_test","TestExercisesRuWordsPage","","","Verify if breadcrumbs link3 leads to the correct page after clicking",""
"passed","Wed Mar 12 10:17:55 GMT 2025","Wed Mar 12 10:17:56 GMT 2025","780","tests","contributors_page_test","TestContributorsPage","","","Verify clickability, href of links on the page",""
"passed","Wed Mar 12 10:19:47 GMT 2025","Wed Mar 12 10:19:47 GMT 2025","283","tests","exercises_ru_words_page_test","TestExercisesRuWordsPage","","","Verify presence and visibility of content on the page",""
"passed","Wed Mar 12 10:31:10 GMT 2025","Wed Mar 12 10:31:10 GMT 2025","3","tests","login_page_test","TestLoginPage","","","Test for authorization customer.",""
"passed","Wed Mar 12 10:30:30 GMT 2025","Wed Mar 12 10:30:30 GMT 2025","207","tests","header_test","TestHeaderPage","","","Verify switching of the 'ru', 'en' buttons in the Header for an authorized user",""
"passed","Wed Mar 12 10:19:26 GMT 2025","Wed Mar 12 10:19:26 GMT 2025","58","tests","exercises_ru_similar_phrases_page_test","TestExercisesRuSimilarPhrasesPage","","","Verify value of the title of the tab",""
"passed","Wed Mar 12 10:24:35 GMT 2025","Wed Mar 12 10:24:40 GMT 2025","4627","tests","footer_test","TestFooter","","","Verify Footer invisibility through the modal window with the exercise",""
"passed","Wed Mar 12 10:19:57 GMT 2025","Wed Mar 12 10:20:01 GMT 2025","3687","tests","exercises_ru_words_page_test","TestExercisesRuWordsPage","","","Verify composition, visibility of elements on the 1st-6th levels of nesting on the page",""
"passed","Wed Mar 12 10:25:03 GMT 2025","Wed Mar 12 10:25:06 GMT 2025","3137","tests","groups_page_test","TestGroupsPage","","","Verify presence, visibility of the title, tiles, links, images, subtitles on the page",""
"passed","Wed Mar 12 10:31:41 GMT 2025","Wed Mar 12 10:31:42 GMT 2025","705","tests","main_page_test","TestMainPage","","","Verify redirection to contributors page not authorized user.",""
"passed","Wed Mar 12 10:41:23 GMT 2025","Wed Mar 12 10:41:23 GMT 2025","31","tests","used_resources_page_test","TestUsedResourcesPage","","","Verify text in links in sections",""
"passed","Wed Mar 12 10:28:49 GMT 2025","Wed Mar 12 10:28:49 GMT 2025","28","tests","header_test","TestHeaderPage","","","Verify presence and visibility of the Header for an authorized user",""
"passed","Wed Mar 12 10:19:05 GMT 2025","Wed Mar 12 10:19:06 GMT 2025","963","tests","exercises_ru_similar_phrases_page_test","TestExercisesRuSimilarPhrasesPage","","","Verify composition, visibility of elements on the 1st-7th levels of nesting on the page",""
"passed","Wed Mar 12 10:31:53 GMT 2025","Wed Mar 12 10:31:53 GMT 2025","144","tests","main_page_test","TestMainPage","","","Checking the clickability of the Registration button.",""
"passed","Wed Mar 12 10:33:19 GMT 2025","Wed Mar 12 10:33:19 GMT 2025","33","tests","specialists_page_test","TestSpecialistsPage","","","Verify presence and visibility of content on the page",""
"passed","Wed Mar 12 10:31:18 GMT 2025","Wed Mar 12 10:31:19 GMT 2025","1180","tests","main_page_test","TestMainPage","","","Verify redirection to telegram page not authorized user.",""
"passed","Wed Mar 12 10:32:44 GMT 2025","Wed Mar 12 10:32:45 GMT 2025","782","tests","registration_page_test","TestRegistrationPage","","","Check registration with new email and empty email",""
"passed","Wed Mar 12 10:18:35 GMT 2025","Wed Mar 12 10:18:36 GMT 2025","1360","tests","description_page_test","TestDescriptionPage","","","Verify redirection to github not authorized user.",""
"passed","Wed Mar 12 10:23:32 GMT 2025","Wed Mar 12 10:23:38 GMT 2025","5856","tests","exercises_ru_words_page_test","TestExercisesRuWordsPage","","","Verify sizes of background-images in links on the page",""
"passed","Wed Mar 12 10:23:45 GMT 2025","Wed Mar 12 10:23:46 GMT 2025","252","tests","footer_test","TestFooter","","","Verify composition and visibility of elements on the 1st-7th levels of nesting in the Footer",""
"passed","Wed Mar 12 10:16:19 GMT 2025","Wed Mar 12 10:16:20 GMT 2025","978","tests","authorisation_page_test","TestAuthorizedUserPage","","","Checking the possibility of authorization with incorrect data",""
"passed","Wed Mar 12 10:24:29 GMT 2025","Wed Mar 12 10:24:29 GMT 2025","133","tests","footer_test","TestFooter","","","Verify sizes of images in links in the Footer",""
"passed","Wed Mar 12 10:28:56 GMT 2025","Wed Mar 12 10:29:06 GMT 2025","10257","tests","header_test","TestHeaderPage","","","Verify composition, visibility of elements on the 1st-6th levels of nesting in the Header
            for an authorized user",""
"passed","Wed Mar 12 10:33:49 GMT 2025","Wed Mar 12 10:33:49 GMT 2025","43","tests","specialists_page_test","TestSpecialistsPage","","","Verify value of text on the page",""
"passed","Wed Mar 12 10:31:57 GMT 2025","Wed Mar 12 10:32:07 GMT 2025","10061","tests","profile_page_test","TestProfilePage","","","Change the password by receiving an email link",""
"passed","Wed Mar 12 10:40:02 GMT 2025","Wed Mar 12 10:40:29 GMT 2025","27848","tests","Речевые упражнения.","TestCardsRU","","","Solutions to a random task in the ""Слова Королёвой"" .",""
"passed","Wed Mar 12 10:30:22 GMT 2025","Wed Mar 12 10:30:22 GMT 2025","277","tests","header_test","TestHeaderPage","","","Verify the dropdown opens/closes after clicking on the 'More' button in the Header 
               for an authorized user",""
"passed","Wed Mar 12 10:17:51 GMT 2025","Wed Mar 12 10:17:52 GMT 2025","457","tests","contributors_page_test","TestContributorsPage","","","Verify text in card links and the 'All Team' link",""
"passed","Wed Mar 12 10:23:03 GMT 2025","Wed Mar 12 10:23:11 GMT 2025","8257","tests","exercises_ru_words_page_test","TestExercisesRuWordsPage","","","Verify if subgroup links 1-4 lead to correct pages after clicking",""
"passed","Wed Mar 12 10:18:30 GMT 2025","Wed Mar 12 10:18:31 GMT 2025","707","tests","description_page_test","TestDescriptionPage","","","Verify redirection to specialists page not authorized user.",""
"passed","Wed Mar 12 10:26:49 GMT 2025","Wed Mar 12 10:27:07 GMT 2025","18277","tests","groups_page_test","TestGroupsPage","","","Verify if links on the 'en' local lead to correct pages after clicking",""
"skipped","Wed Mar 12 10:37:59 GMT 2025","Wed Mar 12 10:38:22 GMT 2025","23376","tests","Речевые упражнения.","TestCardsRU","","","Select a random card from ""Предложения"" group and compare UI vs BACKEND data.",""
"passed","Wed Mar 12 10:28:43 GMT 2025","Wed Mar 12 10:28:43 GMT 2025","69","tests","header_test","TestHeaderPage","","","Verify size of the image in the 'Logo' link in the Header on the Start Unauthorized Page",""
"passed","Wed Mar 12 10:34:16 GMT 2025","Wed Mar 12 10:34:19 GMT 2025","2709","tests","specialists_page_test","TestSpecialistsPage","","","Verify that the 'All Specialists' link leads an authorized user 
                         to the correct page after clicking",""
"passed","Wed Mar 12 10:30:37 GMT 2025","Wed Mar 12 10:30:37 GMT 2025","412","tests","header_test","TestHeaderPage","","","Verify user logout after clicking the 'Logout' button in the Header for an authorized user",""
"passed","Wed Mar 12 10:18:40 GMT 2025","Wed Mar 12 10:18:40 GMT 2025","683","tests","description_page_test","TestDescriptionPage","","","Verify redirection to contributors page not authorized user.",""
"passed","Wed Mar 12 10:24:01 GMT 2025","Wed Mar 12 10:24:04 GMT 2025","3077","tests","footer_test","TestFooter","","","Verify clickability, href, prefix and subject, status code of links in the Footer",""
"passed","Wed Mar 12 10:32:35 GMT 2025","Wed Mar 12 10:32:36 GMT 2025","817","tests","registration_page_test","TestRegistrationPage","","","Check registration with new email and empty first name",""
"passed","Wed Mar 12 10:24:25 GMT 2025","Wed Mar 12 10:24:25 GMT 2025","82","tests","footer_test","TestFooter","","","Verify attributes of images in links in the Footer",""
"passed","Wed Mar 12 10:18:27 GMT 2025","Wed Mar 12 10:18:27 GMT 2025","207","tests","description_page_test","TestDescriptionPage","","","Verify redirection to contacts page not authorized user.",""
"passed","Wed Mar 12 10:18:04 GMT 2025","Wed Mar 12 10:18:05 GMT 2025","849","tests","contributors_page_test","TestContributorsPage","","","Verify attribute values of images in contributors cards in grids",""
"passed","Wed Mar 12 10:22:02 GMT 2025","Wed Mar 12 10:22:05 GMT 2025","3157","tests","exercises_ru_words_page_test","TestExercisesRuWordsPage","","","Verify if breadcrumbs link1 leads to the correct page after clicking",""
"passed","Wed Mar 12 10:17:23 GMT 2025","Wed Mar 12 10:17:25 GMT 2025","1763","tests","contributors_page_test","TestContributorsPage","","","Verify the composition and visibility of elements 
        on the 1st-5th levels of nesting on the page",""
"passed","Wed Mar 12 10:41:34 GMT 2025","Wed Mar 12 10:41:36 GMT 2025","1357","tests","used_resources_page_test","TestUsedResourcesPage","","","Verify that links in the sections lead to the correct pages after clicking",""
"passed","Wed Mar 12 10:26:23 GMT 2025","Wed Mar 12 10:26:42 GMT 2025","18347","tests","groups_page_test","TestGroupsPage","","","Verify if links on the 'ru' local lead to correct pages after clicking",""
