"Status","Start Time","Stop Time","Duration in ms","Parent Suite","Suite","Sub Suite","Test Class","Test Method","Name","Description"
"passed","Fri Aug 16 06:44:17 GMT 2024","Fri Aug 16 06:44:34 GMT 2024","17688","tests","profile_page_test","TestProfilePage","","","Change the password by receiving an email link",""
"passed","Fri Aug 16 06:44:11 GMT 2024","Fri Aug 16 06:44:12 GMT 2024","96","tests","main_page_test","TestMainPage","","","Checking the clickability of the Registration button.",""
"passed","Fri Aug 16 06:45:27 GMT 2024","Fri Aug 16 06:45:27 GMT 2024","579","tests","registration_page_test","TestRegistrationPage","","","Check registration without choosing gender",""
"passed","Fri Aug 16 06:37:54 GMT 2024","Fri Aug 16 06:37:54 GMT 2024","12","tests","contributors_page_test","TestContributorsPage","","","Verify value of the title of the tab",""
"passed","Fri Aug 16 06:38:25 GMT 2024","Fri Aug 16 06:38:26 GMT 2024","1003","tests","contributors_page_test","TestContributorsPage","","","Verify href, status code of the 'All Team' link",""
"passed","Fri Aug 16 06:42:31 GMT 2024","Fri Aug 16 06:42:32 GMT 2024","983","tests","header_test","TestHeaderPage","","","Verify clickability, href, status code of the 'Logo' link in the Header",""
"passed","Fri Aug 16 06:43:50 GMT 2024","Fri Aug 16 06:43:51 GMT 2024","1632","tests","main_page_test","TestMainPage","","","Verify redirection to github not authorized user.",""
"passed","Fri Aug 16 06:47:00 GMT 2024","Fri Aug 16 06:47:01 GMT 2024","650","tests","specialists_page_test","TestSpecialistsPage","","","Verify that the 'All Specialists' link leads an unauthorized user 
                         to the correct page after clicking",""
"passed","Fri Aug 16 06:44:07 GMT 2024","Fri Aug 16 06:44:07 GMT 2024","79","tests","main_page_test","TestMainPage","","","Checking the clickability of the Start button.",""
"passed","Fri Aug 16 06:39:24 GMT 2024","Fri Aug 16 06:39:24 GMT 2024","136","tests","description_page_test","TestDescriptionPage","","","Verify redirection to used resources page not authorized user.",""
"passed","Fri Aug 16 06:38:04 GMT 2024","Fri Aug 16 06:38:04 GMT 2024","18","tests","contributors_page_test","TestContributorsPage","","","Verify content of the text on the page",""
"passed","Fri Aug 16 06:37:35 GMT 2024","Fri Aug 16 06:37:35 GMT 2024","39","tests","contributors_page_test","TestContributorsPage","","","Verify presence, visibility and structure of content on the page",""
"passed","Fri Aug 16 06:46:11 GMT 2024","Fri Aug 16 06:46:17 GMT 2024","5355","tests","specialists_page_test","TestSpecialistsPage","","","Verify presence, visibility of the title, text, link, grid, cards and images  
        on the 2nd, 3rd, 5th, 6th levels of nesting on the page",""
"passed","Fri Aug 16 06:49:51 GMT 2024","Fri Aug 16 06:50:13 GMT 2024","22347","tests","Speech exercises EN.","TestCardsEN","","","Select a random card from ""Similar phrases"" group and compare UI vs BACKEND data",""
"passed","Fri Aug 16 06:43:39 GMT 2024","Fri Aug 16 06:43:39 GMT 2024","139","tests","main_page_test","TestMainPage","","","Verify redirection to contacts page not authorized user.",""
"passed","Fri Aug 16 06:52:14 GMT 2024","Fri Aug 16 06:52:40 GMT 2024","25647","tests","Речевые упражнения.","TestCardsRU","","","Select a random card from ""Группа слов"" group and compare UI vs BACKEND data.",""
"passed","Fri Aug 16 06:46:47 GMT 2024","Fri Aug 16 06:46:47 GMT 2024","42","tests","specialists_page_test","TestSpecialistsPage","","","Verify text in the 'All Specialists' link",""
"passed","Fri Aug 16 06:44:02 GMT 2024","Fri Aug 16 06:44:02 GMT 2024","135","tests","main_page_test","TestMainPage","","","Verify redirection to used resources page not authorized user.",""
"passed","Fri Aug 16 06:38:14 GMT 2024","Fri Aug 16 06:38:14 GMT 2024","383","tests","contributors_page_test","TestContributorsPage","","","Verify text in card links and the 'All Team' link",""
"passed","Fri Aug 16 06:48:03 GMT 2024","Fri Aug 16 06:48:03 GMT 2024","45","tests","start_unauthorized_page_test","TestStartUnauthorizedPage","","","Verify values of titles and subtitles with tags h2, h4 on the page",""
"passed","Fri Aug 16 06:48:13 GMT 2024","Fri Aug 16 06:48:13 GMT 2024","37","tests","start_unauthorized_page_test","TestStartUnauthorizedPage","","","Verify text in the 'Login' link in the section 1",""
"passed","Fri Aug 16 06:39:02 GMT 2024","Fri Aug 16 06:39:02 GMT 2024","138","tests","description_page_test","TestDescriptionPage","","","Verify redirection to contacts page not authorized user.",""
"passed","Fri Aug 16 06:39:07 GMT 2024","Fri Aug 16 06:39:07 GMT 2024","635","tests","description_page_test","TestDescriptionPage","","","Verify redirection to specialists page not authorized user.",""
"passed","Fri Aug 16 06:37:09 GMT 2024","Fri Aug 16 06:37:09 GMT 2024","29","tests","contacts_page_test","TestContactsPage","","","Verify text in links in the section 2",""
"passed","Fri Aug 16 06:41:35 GMT 2024","Fri Aug 16 06:41:35 GMT 2024","74","tests","footer_test","TestFooter","","","Verify attributes of images in links in the Footer",""
"passed","Fri Aug 16 06:47:58 GMT 2024","Fri Aug 16 06:47:58 GMT 2024","12","tests","start_unauthorized_page_test","TestStartUnauthorizedPage","","","Verify value of the title of the tab",""
"passed","Fri Aug 16 06:36:52 GMT 2024","Fri Aug 16 06:36:52 GMT 2024","12","tests","contacts_page_test","TestContactsPage","","","Verify value of the title of the tab",""
"passed","Fri Aug 16 06:49:18 GMT 2024","Fri Aug 16 06:49:40 GMT 2024","22108","tests","Speech exercises EN.","TestCardsEN","","","Check progres-bar and buttons.",""
"passed","Fri Aug 16 06:58:05 GMT 2024","Fri Aug 16 06:58:06 GMT 2024","855","tests","used_resources_page_test","TestUsedResourcesPage","","","Verify presence, visibility and attributes of icons in sections",""
"passed","Fri Aug 16 06:45:59 GMT 2024","Fri Aug 16 06:45:59 GMT 2024","29","tests","specialists_page_test","TestSpecialistsPage","","","Verify presence and visibility of content on the page",""
"passed","Fri Aug 16 06:48:29 GMT 2024","Fri Aug 16 06:48:29 GMT 2024","76","tests","start_unauthorized_page_test","TestStartUnauthorizedPage","","","Verify presence, visibility and attributes of the image in the section 1",""
"passed","Fri Aug 16 06:43:22 GMT 2024","Fri Aug 16 06:43:22 GMT 2024","109","tests","main_page_test","TestMainPage","","","Verify redirection to description page not authorized user.",""
"passed","Fri Aug 16 06:36:20 GMT 2024","Fri Aug 16 06:36:21 GMT 2024","851","tests","authorisation_page_test","TestAuthorizedUserPage","","","Checking the possibility of authorization with incorrect data",""
"passed","Fri Aug 16 06:43:33 GMT 2024","Fri Aug 16 06:43:34 GMT 2024","1174","tests","main_page_test","TestMainPage","","","Verify redirection to donate page not authorized user.",""
"passed","Fri Aug 16 06:43:27 GMT 2024","Fri Aug 16 06:43:29 GMT 2024","1890","tests","main_page_test","TestMainPage","","","Verify redirection to telegram page not authorized user.",""
"passed","Fri Aug 16 06:47:38 GMT 2024","Fri Aug 16 06:47:38 GMT 2024","32","tests","start_unauthorized_page_test","TestStartUnauthorizedPage","","","Verify presence and visibility of content on the page",""
"passed","Fri Aug 16 06:52:51 GMT 2024","Fri Aug 16 06:53:16 GMT 2024","25740","tests","Речевые упражнения.","TestCardsRU","","","Select a random card from ""Предложения"" group and compare UI vs BACKEND data.",""
"passed","Fri Aug 16 06:37:03 GMT 2024","Fri Aug 16 06:37:03 GMT 2024","29","tests","contacts_page_test","TestContactsPage","","","Verify content of the text in the section 2",""
"passed","Fri Aug 16 06:39:50 GMT 2024","Fri Aug 16 06:39:50 GMT 2024","43","tests","footer_test","TestFooter","","","Verify text in the 'Contact us' link in the Footer",""
"passed","Fri Aug 16 06:38:55 GMT 2024","Fri Aug 16 06:38:57 GMT 2024","1612","tests","description_page_test","TestDescriptionPage","","","Verify redirection to donate page not authorized user.",""
"passed","Fri Aug 16 06:44:53 GMT 2024","Fri Aug 16 06:44:54 GMT 2024","1149","tests","registration_page_test","TestRegistrationPage","","","Check registration with an existing email",""
"passed","Fri Aug 16 06:47:53 GMT 2024","Fri Aug 16 06:47:53 GMT 2024","112","tests","start_unauthorized_page_test","TestStartUnauthorizedPage","","","Verify the composition and visibility of elements 
        on the 1st-3rd levels of nesting in the section 2",""
"passed","Fri Aug 16 06:57:28 GMT 2024","Fri Aug 16 06:57:28 GMT 2024","827","tests","used_resources_page_test","TestUsedResourcesPage","","","Verify text in links in sections",""
"passed","Fri Aug 16 06:48:45 GMT 2024","Fri Aug 16 06:49:08 GMT 2024","23354","tests","Speech exercises EN.","TestCardsEN","","","Select random card from ""Word"" group and compare UI vs BACKEND data",""
"passed","Fri Aug 16 06:48:19 GMT 2024","Fri Aug 16 06:48:19 GMT 2024","880","tests","start_unauthorized_page_test","TestStartUnauthorizedPage","","","Verify presence, visibility, clickability, href, status code 
                         of the 'Login' link in the section 1",""
"passed","Fri Aug 16 06:38:19 GMT 2024","Fri Aug 16 06:38:20 GMT 2024","699","tests","contributors_page_test","TestContributorsPage","","","Verify clickability, href of links on the page",""
"passed","Fri Aug 16 06:56:16 GMT 2024","Fri Aug 16 06:56:20 GMT 2024","3890","tests","Statistic.","TestCardsRU","","","Check statistic table.",""
"passed","Fri Aug 16 06:37:22 GMT 2024","Fri Aug 16 06:37:24 GMT 2024","2007","tests","contacts_page_test","TestContactsPage","","","Verify if links in the section 2 lead to the correct pages after clicking",""
"passed","Fri Aug 16 06:39:45 GMT 2024","Fri Aug 16 06:39:45 GMT 2024","43","tests","footer_test","TestFooter","","","Verify content of text in the Footer",""
"passed","Fri Aug 16 06:36:33 GMT 2024","Fri Aug 16 06:36:33 GMT 2024","20","tests","contacts_page_test","TestContactsPage","","","Verify the composition and visibility of elements on the 1st level of nesting in the section 1",""
"passed","Fri Aug 16 06:46:53 GMT 2024","Fri Aug 16 06:46:54 GMT 2024","934","tests","specialists_page_test","TestSpecialistsPage","","","Verify clickability, href, status code of the 'All Specialists' link",""
"passed","Fri Aug 16 06:46:23 GMT 2024","Fri Aug 16 06:46:23 GMT 2024","12","tests","specialists_page_test","TestSpecialistsPage","","","Verify value of the title of the tab",""
"passed","Fri Aug 16 06:40:05 GMT 2024","Fri Aug 16 06:41:25 GMT 2024","80683","tests","footer_test","TestFooter","","","Verify that links in the Footer lead to correct pages after clicking",""
"passed","Fri Aug 16 06:45:32 GMT 2024","Fri Aug 16 06:45:53 GMT 2024","20674","tests","registration_page_test","TestRegistrationPage","","","Check registration without choosing agreement",""
"passed","Fri Aug 16 06:51:37 GMT 2024","Fri Aug 16 06:52:03 GMT 2024","26054","tests","Речевые упражнения.","TestCardsRU","","","Select a random card from ""Похожие фразы"" group and compare UI vs BACKEND data.",""
"passed","Fri Aug 16 06:39:30 GMT 2024","Fri Aug 16 06:39:30 GMT 2024","39","tests","footer_test","TestFooter","","","Verify presence and visibility of the Footer",""
"passed","Fri Aug 16 06:37:30 GMT 2024","Fri Aug 16 06:37:30 GMT 2024","67","tests","contacts_page_test","TestContactsPage","","","Verify that the email link calls an email client",""
"passed","Fri Aug 16 06:56:54 GMT 2024","Fri Aug 16 06:56:54 GMT 2024","308","tests","used_resources_page_test","TestUsedResourcesPage","","","Verify value of the title of the tab",""
"passed","Fri Aug 16 06:41:40 GMT 2024","Fri Aug 16 06:41:40 GMT 2024","102","tests","footer_test","TestFooter","","","Verify sizes of images in links in the Footer",""
"passed","Fri Aug 16 06:45:16 GMT 2024","Fri Aug 16 06:45:16 GMT 2024","609","tests","registration_page_test","TestRegistrationPage","","","Check registration with new email and empty birthday",""
"passed","Fri Aug 16 06:42:59 GMT 2024","Fri Aug 16 06:43:01 GMT 2024","2009","tests","header_test","TestHeaderPage","","","Verify if the 'About' and the 'Telegram' links in the Section 2 
                          lead to the correct pages after click",""
"passed","Fri Aug 16 06:39:19 GMT 2024","Fri Aug 16 06:39:19 GMT 2024","634","tests","description_page_test","TestDescriptionPage","","","Verify redirection to contributors page not authorized user.",""
"passed","Fri Aug 16 06:46:41 GMT 2024","Fri Aug 16 06:46:42 GMT 2024","105","tests","specialists_page_test","TestSpecialistsPage","","","Verify values of names and professions in specialist cards in the grid",""
"passed","Fri Aug 16 06:58:17 GMT 2024","Fri Aug 16 06:58:18 GMT 2024","876","tests","used_resources_page_test","TestUsedResourcesPage","","","Verify sizes of icons in sections",""
"passed","Fri Aug 16 06:56:42 GMT 2024","Fri Aug 16 06:56:43 GMT 2024","939","tests","used_resources_page_test","TestUsedResourcesPage","","","Verify the composition and visibility of elements 
            on the 1st-4th levels of nesting on the page",""
"passed","Fri Aug 16 06:57:17 GMT 2024","Fri Aug 16 06:57:17 GMT 2024","839","tests","used_resources_page_test","TestUsedResourcesPage","","","Verify content of the text on the page",""
"passed","Fri Aug 16 06:57:05 GMT 2024","Fri Aug 16 06:57:06 GMT 2024","841","tests","used_resources_page_test","TestUsedResourcesPage","","","Verify value of title with tag 'h1' on the page",""
"passed","Fri Aug 16 06:47:22 GMT 2024","Fri Aug 16 06:47:22 GMT 2024","107","tests","specialists_page_test","TestSpecialistsPage","","","Verify attributes of images in specialist cards in the grid",""
"passed","Fri Aug 16 06:46:34 GMT 2024","Fri Aug 16 06:46:34 GMT 2024","32","tests","specialists_page_test","TestSpecialistsPage","","","Verify value of text on the page",""
"passed","Fri Aug 16 06:57:39 GMT 2024","Fri Aug 16 06:57:42 GMT 2024","3265","tests","used_resources_page_test","TestUsedResourcesPage","","","Verify presence, visibility, clickability, href, status code of links in sections",""
"passed","Fri Aug 16 06:42:17 GMT 2024","Fri Aug 16 06:42:17 GMT 2024","204","tests","header_test","TestHeaderPage","","","Verify composition, visibility of elements on the 1st-6th levels of nesting in the Header",""
"passed","Fri Aug 16 06:50:24 GMT 2024","Fri Aug 16 06:50:51 GMT 2024","26418","tests","Речевые упражнения.","TestCardsRU","","","Select random card from group ""Слова"" and compare UI vs BACKEND data.",""
"passed","Fri Aug 16 06:37:59 GMT 2024","Fri Aug 16 06:37:59 GMT 2024","40","tests","contributors_page_test","TestContributorsPage","","","Verify values of title and subtitles with tags h2, h3 on the page",""
"passed","Fri Aug 16 06:36:39 GMT 2024","Fri Aug 16 06:36:39 GMT 2024","135","tests","contacts_page_test","TestContactsPage","","","Verify the composition and visibility of elements 
        on the 1st-5th levels of nesting in the section 2",""
"passed","Fri Aug 16 06:41:30 GMT 2024","Fri Aug 16 06:41:31 GMT 2024","80","tests","footer_test","TestFooter","","","Verify that the 'Contact us' link in the Footer calls an email client",""
"passed","Fri Aug 16 06:43:06 GMT 2024","Fri Aug 16 06:43:06 GMT 2024","23","tests","header_test","TestHeaderPage","","","Verify values of the text in the 'About' and the 'Telegram' links 
                          in the Section 2 in the Header",""
"passed","Fri Aug 16 06:36:14 GMT 2024","Fri Aug 16 06:36:15 GMT 2024","1655","tests","authorisation_page_test","TestAuthorizedUserPage","","","Checking the possibility of authorization with the correct data",""
"passed","Fri Aug 16 06:39:40 GMT 2024","Fri Aug 16 06:39:40 GMT 2024","128","tests","footer_test","TestFooter","","","Verify presence, visibility of text, links, images in the Footer",""
"passed","Fri Aug 16 06:36:45 GMT 2024","Fri Aug 16 06:36:46 GMT 2024","157","tests","contacts_page_test","TestContactsPage","","","Verify presence, visibility of sections, the dividing line and elements with text on the page",""
"passed","Fri Aug 16 06:46:05 GMT 2024","Fri Aug 16 06:46:05 GMT 2024","337","tests","specialists_page_test","TestSpecialistsPage","","","Verify the composition and visibility of elements 
        on the 1st-6th levels of nesting on the page",""
"passed","Fri Aug 16 06:45:21 GMT 2024","Fri Aug 16 06:45:22 GMT 2024","599","tests","registration_page_test","TestRegistrationPage","","","Check registration with new email and empty email",""
"passed","Fri Aug 16 06:42:26 GMT 2024","Fri Aug 16 06:42:26 GMT 2024","76","tests","header_test","TestHeaderPage","","","Verify presence, visibility of links, buttons in the Header",""
"passed","Fri Aug 16 06:43:17 GMT 2024","Fri Aug 16 06:43:17 GMT 2024","3","tests","login_page_test","TestLoginPage","","","Test for authorization customer.",""
"passed","Fri Aug 16 06:48:34 GMT 2024","Fri Aug 16 06:48:34 GMT 2024","55","tests","start_unauthorized_page_test","TestStartUnauthorizedPage","","","Verify size of the image in the section 1",""
"passed","Fri Aug 16 06:37:47 GMT 2024","Fri Aug 16 06:37:48 GMT 2024","1588","tests","contributors_page_test","TestContributorsPage","","","Verify presence, visibility of titles/subtitles, cards, descriptions, links, images on the page",""
"passed","Fri Aug 16 06:38:36 GMT 2024","Fri Aug 16 06:38:37 GMT 2024","1052","tests","contributors_page_test","TestContributorsPage","","","Verify sizes of images in contributor cards in grids",""
"passed","Fri Aug 16 06:42:53 GMT 2024","Fri Aug 16 06:42:54 GMT 2024","1183","tests","header_test","TestHeaderPage","","","Verify presence, visibility, clickability, href, status code of the 'About' and the 'Telegram' links in the Section 2 in the Header",""
"passed","Fri Aug 16 06:42:43 GMT 2024","Fri Aug 16 06:42:43 GMT 2024","90","tests","header_test","TestHeaderPage","","","Verify that the 'Logo' link on the 'Contacts' page leads an unauthorized user 
                             to the Start Unauthorized Page after clicking",""
"passed","Fri Aug 16 06:56:31 GMT 2024","Fri Aug 16 06:56:31 GMT 2024","839","tests","used_resources_page_test","TestUsedResourcesPage","","","Verify presence and visibility of content on the page",""
"passed","Fri Aug 16 06:53:27 GMT 2024","Fri Aug 16 06:53:52 GMT 2024","25269","tests","Речевые упражнения.","TestCardsRU","","","Select a random card from ""Слова с частотной группировкой"" group and compare UI vs BACKEND data.",""
"passed","Fri Aug 16 06:51:01 GMT 2024","Fri Aug 16 06:51:27 GMT 2024","25409","tests","Речевые упражнения.","TestCardsRU","","","Select random card from group ""Слова Королёвой"" and compare UI vs BACKEND data.",""
"passed","Fri Aug 16 06:38:42 GMT 2024","Fri Aug 16 06:38:43 GMT 2024","149","tests","description_page_test","TestDescriptionPage","","","Verify return main page from description page.",""
"passed","Fri Aug 16 06:42:48 GMT 2024","Fri Aug 16 06:42:48 GMT 2024","94","tests","header_test","TestHeaderPage","","","Verify presence, visibility, attributes and sizes of the 'Logo' image",""
"passed","Fri Aug 16 06:48:08 GMT 2024","Fri Aug 16 06:48:08 GMT 2024","64","tests","start_unauthorized_page_test","TestStartUnauthorizedPage","","","Verify content of the text in sections 1, 2",""
"skipped","Fri Aug 16 06:55:50 GMT 2024","Fri Aug 16 06:56:05 GMT 2024","14666","tests","Речевые упражнения.","TestCardsRU","","","Solutions to a random task in the ""Слова"" group and comparison of statics.",""
"passed","Fri Aug 16 06:37:40 GMT 2024","Fri Aug 16 06:37:42 GMT 2024","1608","tests","contributors_page_test","TestContributorsPage","","","Verify the composition and visibility of elements 
        on the 1st-5th levels of nesting on the page",""
"passed","Fri Aug 16 06:38:09 GMT 2024","Fri Aug 16 06:38:09 GMT 2024","387","tests","contributors_page_test","TestContributorsPage","","","Verify values of the text in card descriptions",""
"passed","Fri Aug 16 06:45:10 GMT 2024","Fri Aug 16 06:45:11 GMT 2024","608","tests","registration_page_test","TestRegistrationPage","","","Check registration with new email and empty first name",""
"passed","Fri Aug 16 06:43:56 GMT 2024","Fri Aug 16 06:43:57 GMT 2024","695","tests","main_page_test","TestMainPage","","","Verify redirection to contributors page not authorized user.",""
"passed","Fri Aug 16 06:41:54 GMT 2024","Fri Aug 16 06:42:08 GMT 2024","13379","tests","footer_test","TestFooter","","","Verify Footer invisibility through the modal window with the exercise",""
"passed","Fri Aug 16 06:47:48 GMT 2024","Fri Aug 16 06:47:49 GMT 2024","83","tests","start_unauthorized_page_test","TestStartUnauthorizedPage","","","Verify the composition and visibility of elements 
        on the 1st-3rd levels of nesting in the section 1",""
"passed","Fri Aug 16 06:47:28 GMT 2024","Fri Aug 16 06:47:34 GMT 2024","5148","tests","specialists_page_test","TestSpecialistsPage","","","Verify sizes of images in specialist cards in the grid",""
"passed","Fri Aug 16 06:45:04 GMT 2024","Fri Aug 16 06:45:05 GMT 2024","621","tests","registration_page_test","TestRegistrationPage","","","Check registration with new email and empty password",""
"passed","Fri Aug 16 06:39:12 GMT 2024","Fri Aug 16 06:39:14 GMT 2024","1673","tests","description_page_test","TestDescriptionPage","","","Verify redirection to github not authorized user.",""
"passed","Fri Aug 16 06:44:59 GMT 2024","Fri Aug 16 06:45:00 GMT 2024","597","tests","registration_page_test","TestRegistrationPage","","","Check registration with new email and empty confirm password",""
"passed","Fri Aug 16 06:47:43 GMT 2024","Fri Aug 16 06:47:43 GMT 2024","30","tests","start_unauthorized_page_test","TestStartUnauthorizedPage","","","Verify amount and visibility of sections with content on the page",""
"passed","Fri Aug 16 06:42:12 GMT 2024","Fri Aug 16 06:42:12 GMT 2024","32","tests","header_test","TestHeaderPage","","","Verify presence and visibility of the Header",""
"passed","Fri Aug 16 06:36:27 GMT 2024","Fri Aug 16 06:36:27 GMT 2024","27","tests","contacts_page_test","TestContactsPage","","","Verify presence and visibility of content on the page",""
"passed","Fri Aug 16 06:38:31 GMT 2024","Fri Aug 16 06:38:31 GMT 2024","775","tests","contributors_page_test","TestContributorsPage","","","Verify attribute values of images in contributors cards in grids",""
"passed","Fri Aug 16 06:55:00 GMT 2024","Fri Aug 16 06:55:40 GMT 2024","39361","tests","Речевые упражнения.","TestCardsRU","","","Solutions to a random task in the ""Слова Королёвой"" .",""
"passed","Fri Aug 16 06:48:24 GMT 2024","Fri Aug 16 06:48:24 GMT 2024","121","tests","start_unauthorized_page_test","TestStartUnauthorizedPage","","","Verify that the 'Login' link leads to the correct page after clicking",""
"passed","Fri Aug 16 06:37:15 GMT 2024","Fri Aug 16 06:37:16 GMT 2024","1150","tests","contacts_page_test","TestContactsPage","","","Verify presence, visibility, clickability, href, prefix, status code of links in the section 2",""
"passed","Fri Aug 16 06:38:48 GMT 2024","Fri Aug 16 06:38:50 GMT 2024","1878","tests","description_page_test","TestDescriptionPage","","","Verify redirection to telegram page not authorized user.",""
"passed","Fri Aug 16 06:39:55 GMT 2024","Fri Aug 16 06:40:00 GMT 2024","4059","tests","footer_test","TestFooter","","","Verify clickability, href, prefix and subject, status code of links in the Footer",""
"passed","Fri Aug 16 06:46:29 GMT 2024","Fri Aug 16 06:46:29 GMT 2024","33","tests","specialists_page_test","TestSpecialistsPage","","","Verify value of title with tag 'h2' on the page",""
"passed","Fri Aug 16 06:57:53 GMT 2024","Fri Aug 16 06:57:55 GMT 2024","1881","tests","used_resources_page_test","TestUsedResourcesPage","","","Verify that links in the sections lead to the correct pages after clicking",""
"passed","Fri Aug 16 06:36:57 GMT 2024","Fri Aug 16 06:36:57 GMT 2024","50","tests","contacts_page_test","TestContactsPage","","","Verify values of the title and subtitles with tags h1, h2 on the page",""
"passed","Fri Aug 16 06:44:39 GMT 2024","Fri Aug 16 06:44:48 GMT 2024","9173","tests","registration_page_test","TestRegistrationPage","","","Check registration with new email",""
"passed","Fri Aug 16 06:42:37 GMT 2024","Fri Aug 16 06:42:37 GMT 2024","95","tests","header_test","TestHeaderPage","","","Verify that the 'Logo' link on the Start Unauthorized Page 
                             doesn't refresh the current page or lead to other pages after clicking",""
"passed","Fri Aug 16 06:54:03 GMT 2024","Fri Aug 16 06:54:50 GMT 2024","46637","tests","Речевые упражнения.","TestCardsRU","","","Solutions to a random task in the ""Слова"" .",""
"passed","Fri Aug 16 06:47:12 GMT 2024","Fri Aug 16 06:47:17 GMT 2024","4619","tests","specialists_page_test","TestSpecialistsPage","","","Verify that the 'All Specialists' link leads an authorized user 
                         to the correct page after clicking",""
"passed","Fri Aug 16 06:39:35 GMT 2024","Fri Aug 16 06:39:35 GMT 2024","221","tests","footer_test","TestFooter","","","Verify composition and visibility of elements on the 1st-7th levels of nesting in the Footer",""
"passed","Fri Aug 16 06:43:44 GMT 2024","Fri Aug 16 06:43:45 GMT 2024","637","tests","main_page_test","TestMainPage","","","Verify redirection to specialists page not authorized user.",""
