"Status","Start Time","Stop Time","Duration in ms","Parent Suite","Suite","Sub Suite","Test Class","Test Method","Name","Description"
"passed","Sun Sep 22 09:46:12 GMT 2024","Sun Sep 22 09:46:12 GMT 2024","199","tests","header_test","TestHeaderPage","","","Verify values of the text in links, buttons in the Header for an authorized user",""
"passed","Sun Sep 22 09:50:39 GMT 2024","Sun Sep 22 09:50:39 GMT 2024","13","tests","start_unauthorized_page_test","TestStartUnauthorizedPage","","","Verify value of the title of the tab",""
"passed","Sun Sep 22 09:50:59 GMT 2024","Sun Sep 22 09:50:59 GMT 2024","130","tests","start_unauthorized_page_test","TestStartUnauthorizedPage","","","Verify that the 'Login' link leads to the correct page after clicking",""
"passed","Sun Sep 22 09:43:31 GMT 2024","Sun Sep 22 09:43:31 GMT 2024","250","tests","footer_test","TestFooter","","","Verify composition and visibility of elements on the 1st-7th levels of nesting in the Footer",""
"passed","Sun Sep 22 09:45:32 GMT 2024","Sun Sep 22 09:45:32 GMT 2024","45","tests","header_test","TestHeaderPage","","","Verify presence, visibility and attributes of the image in the 'Logo' link",""
"passed","Sun Sep 22 09:51:14 GMT 2024","Sun Sep 22 09:51:23 GMT 2024","9292","tests","Speech exercises EN.","TestCardsEN","","","Select random card from ""Word"" group and compare UI vs BACKEND data",""
"passed","Sun Sep 22 09:47:07 GMT 2024","Sun Sep 22 09:47:08 GMT 2024","1324","tests","main_page_test","TestMainPage","","","Verify redirection to telegram page not authorized user.",""
