"Status","Start Time","Stop Time","Duration in ms","Parent Suite","Suite","Sub Suite","Test Class","Test Method","Name","Description"
"passed","Sun Sep 22 09:42:04 GMT 2024","Sun Sep 22 09:42:06 GMT 2024","1709","tests","contributors_page_test","TestContributorsPage","","","Verify presence, visibility of titles/subtitles, cards, descriptions, links, images on the page",""
"passed","Sun Sep 22 09:42:34 GMT 2024","Sun Sep 22 09:42:35 GMT 2024","638","tests","contributors_page_test","TestContributorsPage","","","Verify href, status code of the 'All Team' link",""
"passed","Sun Sep 22 09:47:47 GMT 2024","Sun Sep 22 09:48:00 GMT 2024","12334","tests","profile_page_test","TestProfilePage","","","Change the password by receiving an email link",""
"passed","Sun Sep 22 09:44:56 GMT 2024","Sun Sep 22 09:45:01 GMT 2024","5061","tests","header_test","TestHeaderPage","","","Verify clickability, href, status code of links in the Header for an unauthorized user",""
"passed","Sun Sep 22 09:52:00 GMT 2024","Sun Sep 22 09:52:11 GMT 2024","11044","tests","Речевые упражнения.","TestCardsRU","","","Select random card from group ""Слова"" and compare UI vs BACKEND data.",""
"passed","Sun Sep 22 09:41:01 GMT 2024","Sun Sep 22 09:41:02 GMT 2024","21","tests","contacts_page_test","TestContactsPage","","","Verify the composition and visibility of elements on the 1st level of nesting in the section 1",""
"passed","Sun Sep 22 09:56:08 GMT 2024","Sun Sep 22 09:56:09 GMT 2024","818","tests","used_resources_page_test","TestUsedResourcesPage","","","Verify presence, visibility and attributes of icons in sections",""
"passed","Sun Sep 22 09:51:44 GMT 2024","Sun Sep 22 09:51:53 GMT 2024","9673","tests","Speech exercises EN.","TestCardsEN","","","Select a random card from ""Similar phrases"" group and compare UI vs BACKEND data",""
"passed","Sun Sep 22 09:49:45 GMT 2024","Sun Sep 22 09:49:45 GMT 2024","126","tests","specialists_page_test","TestSpecialistsPage","","","Verify values of names and professions in specialist cards in the grid",""
"passed","Sun Sep 22 09:41:54 GMT 2024","Sun Sep 22 09:41:54 GMT 2024","36","tests","contributors_page_test","TestContributorsPage","","","Verify presence, visibility and structure of content on the page",""
"passed","Sun Sep 22 09:41:27 GMT 2024","Sun Sep 22 09:41:27 GMT 2024","31","tests","contacts_page_test","TestContactsPage","","","Verify content of the text in the section 2",""
"passed","Sun Sep 22 09:42:49 GMT 2024","Sun Sep 22 09:42:49 GMT 2024","141","tests","description_page_test","TestDescriptionPage","","","Verify return main page from description page.",""
"passed","Sun Sep 22 09:42:43 GMT 2024","Sun Sep 22 09:42:45 GMT 2024","1144","tests","contributors_page_test","TestContributorsPage","","","Verify sizes of images in contributor cards in grids",""
"passed","Sun Sep 22 09:48:16 GMT 2024","Sun Sep 22 09:48:17 GMT 2024","672","tests","registration_page_test","TestRegistrationPage","","","Check registration with new email and empty confirm password",""
"passed","Sun Sep 22 09:53:04 GMT 2024","Sun Sep 22 09:53:14 GMT 2024","9799","tests","Речевые упражнения.","TestCardsRU","","","Select a random card from ""Предложения"" group and compare UI vs BACKEND data.",""
"passed","Sun Sep 22 09:49:50 GMT 2024","Sun Sep 22 09:49:50 GMT 2024","49","tests","specialists_page_test","TestSpecialistsPage","","","Verify text in the 'All Specialists' link",""
"passed","Sun Sep 22 09:40:50 GMT 2024","Sun Sep 22 09:40:51 GMT 2024","918","tests","authorisation_page_test","TestAuthorizedUserPage","","","Checking the possibility of authorization with incorrect data",""
"passed","Sun Sep 22 09:43:54 GMT 2024","Sun Sep 22 09:44:03 GMT 2024","8733","tests","footer_test","TestFooter","","","Verify that links in the Footer lead to correct pages after clicking",""
"passed","Sun Sep 22 09:45:42 GMT 2024","Sun Sep 22 09:45:42 GMT 2024","27","tests","header_test","TestHeaderPage","","","Verify presence and visibility of the Header for an authorized user",""
"passed","Sun Sep 22 09:43:23 GMT 2024","Sun Sep 22 09:43:23 GMT 2024","179","tests","description_page_test","TestDescriptionPage","","","Verify redirection to used resources page not authorized user.",""
"passed","Sun Sep 22 09:42:26 GMT 2024","Sun Sep 22 09:42:26 GMT 2024","477","tests","contributors_page_test","TestContributorsPage","","","Verify text in card links and the 'All Team' link",""
"passed","Sun Sep 22 09:51:07 GMT 2024","Sun Sep 22 09:51:07 GMT 2024","59","tests","start_unauthorized_page_test","TestStartUnauthorizedPage","","","Verify size of the image in the section 1",""
"passed","Sun Sep 22 09:43:18 GMT 2024","Sun Sep 22 09:43:19 GMT 2024","664","tests","description_page_test","TestDescriptionPage","","","Verify redirection to contributors page not authorized user.",""
"passed","Sun Sep 22 09:42:30 GMT 2024","Sun Sep 22 09:42:31 GMT 2024","757","tests","contributors_page_test","TestContributorsPage","","","Verify clickability, href of links on the page",""
"passed","Sun Sep 22 09:42:13 GMT 2024","Sun Sep 22 09:42:13 GMT 2024","83","tests","contributors_page_test","TestContributorsPage","","","Verify values of title and subtitles with tags h2, h3 on the page",""
"passed","Sun Sep 22 09:48:35 GMT 2024","Sun Sep 22 09:48:35 GMT 2024","667","tests","registration_page_test","TestRegistrationPage","","","Check registration with new email and empty email",""
"passed","Sun Sep 22 09:48:04 GMT 2024","Sun Sep 22 09:48:07 GMT 2024","3742","tests","registration_page_test","TestRegistrationPage","","","Check registration with new email",""
"passed","Sun Sep 22 09:40:46 GMT 2024","Sun Sep 22 09:40:47 GMT 2024","902","tests","authorisation_page_test","TestAuthorizedUserPage","","","Checking the possibility of authorization with the correct data",""
"passed","Sun Sep 22 09:49:40 GMT 2024","Sun Sep 22 09:49:40 GMT 2024","36","tests","specialists_page_test","TestSpecialistsPage","","","Verify value of text on the page",""
"passed","Sun Sep 22 09:46:51 GMT 2024","Sun Sep 22 09:46:53 GMT 2024","1737","tests","header_test","TestHeaderPage","","","Verify if external links in the Header for an authorized user 
            lead to correct pages after click",""
"passed","Sun Sep 22 09:45:24 GMT 2024","Sun Sep 22 09:45:24 GMT 2024","253","tests","header_test","TestHeaderPage","","","Verify the dropdown opens/closes after clicking on the 'More' button in the Header",""
"passed","Sun Sep 22 09:51:29 GMT 2024","Sun Sep 22 09:51:37 GMT 2024","8245","tests","Speech exercises EN.","TestCardsEN","","","Check progres-bar and buttons.",""
"passed","Sun Sep 22 09:44:30 GMT 2024","Sun Sep 22 09:44:30 GMT 2024","33","tests","header_test","TestHeaderPage","","","Verify presence and visibility of the Header for an unauthorized user",""
"passed","Sun Sep 22 09:44:22 GMT 2024","Sun Sep 22 09:44:26 GMT 2024","3959","tests","footer_test","TestFooter","","","Verify Footer invisibility through the modal window with the exercise",""
"passed","Sun Sep 22 09:49:14 GMT 2024","Sun Sep 22 09:49:15 GMT 2024","351","tests","specialists_page_test","TestSpecialistsPage","","","Verify the composition and visibility of elements 
        on the 1st-6th levels of nesting on the page",""
"passed","Sun Sep 22 09:45:05 GMT 2024","Sun Sep 22 09:45:10 GMT 2024","4740","tests","header_test","TestHeaderPage","","","Verify if internal links in the Header for an unauthorized user 
            lead to correct pages after click",""
"passed","Sun Sep 22 09:41:50 GMT 2024","Sun Sep 22 09:41:50 GMT 2024","96","tests","contacts_page_test","TestContactsPage","","","Verify that the email link calls an email client",""
"passed","Sun Sep 22 09:45:36 GMT 2024","Sun Sep 22 09:45:36 GMT 2024","52","tests","header_test","TestHeaderPage","","","Verify size of the image in the 'Logo' link",""
"passed","Sun Sep 22 09:47:21 GMT 2024","Sun Sep 22 09:47:22 GMT 2024","670","tests","main_page_test","TestMainPage","","","Verify redirection to specialists page not authorized user.",""
"passed","Sun Sep 22 09:45:20 GMT 2024","Sun Sep 22 09:45:20 GMT 2024","115","tests","header_test","TestHeaderPage","","","Verify that the 'Logo' link on the Start Unauthorized Page 
                             doesn't refresh the current page or lead to other pages after clicking",""
"passed","Sun Sep 22 09:46:59 GMT 2024","Sun Sep 22 09:46:59 GMT 2024","3","tests","login_page_test","TestLoginPage","","","Test for authorization customer.",""
"passed","Sun Sep 22 09:44:07 GMT 2024","Sun Sep 22 09:44:07 GMT 2024","101","tests","footer_test","TestFooter","","","Verify that the 'Contact us' link in the Footer calls an email client",""
"passed","Sun Sep 22 09:41:12 GMT 2024","Sun Sep 22 09:41:12 GMT 2024","164","tests","contacts_page_test","TestContactsPage","","","Verify presence, visibility of sections, the dividing line and elements with text on the page",""
"passed","Sun Sep 22 09:50:47 GMT 2024","Sun Sep 22 09:50:47 GMT 2024","69","tests","start_unauthorized_page_test","TestStartUnauthorizedPage","","","Verify content of the text in sections 1, 2",""
"passed","Sun Sep 22 09:47:12 GMT 2024","Sun Sep 22 09:47:13 GMT 2024","777","tests","main_page_test","TestMainPage","","","Verify redirection to donate page not authorized user.",""
"passed","Sun Sep 22 09:50:55 GMT 2024","Sun Sep 22 09:50:55 GMT 2024","517","tests","start_unauthorized_page_test","TestStartUnauthorizedPage","","","Verify presence, visibility, clickability, href, status code 
                         of the 'Login' link in the section 1",""
"passed","Sun Sep 22 09:46:05 GMT 2024","Sun Sep 22 09:46:06 GMT 2024","360","tests","header_test","TestHeaderPage","","","Verify presence, visibility of links, buttons in the Header for an authorized user",""
"passed","Sun Sep 22 09:50:32 GMT 2024","Sun Sep 22 09:50:32 GMT 2024","110","tests","start_unauthorized_page_test","TestStartUnauthorizedPage","","","Verify the composition and visibility of elements 
        on the 1st-3rd levels of nesting in the section 1",""
"passed","Sun Sep 22 09:50:24 GMT 2024","Sun Sep 22 09:50:24 GMT 2024","43","tests","start_unauthorized_page_test","TestStartUnauthorizedPage","","","Verify presence and visibility of content on the page",""
"passed","Sun Sep 22 09:44:52 GMT 2024","Sun Sep 22 09:44:52 GMT 2024","182","tests","header_test","TestHeaderPage","","","Verify values of the text in links, buttons in the Header for an unauthorized user",""
"passed","Sun Sep 22 09:50:08 GMT 2024","Sun Sep 22 09:50:09 GMT 2024","1658","tests","specialists_page_test","TestSpecialistsPage","","","Verify that the 'All Specialists' link leads an authorized user 
                         to the correct page after clicking",""
"passed","Sun Sep 22 09:41:43 GMT 2024","Sun Sep 22 09:41:45 GMT 2024","1528","tests","contacts_page_test","TestContactsPage","","","Verify if links in the section 2 lead to the correct pages after clicking",""
"passed","Sun Sep 22 09:52:17 GMT 2024","Sun Sep 22 09:52:26 GMT 2024","9054","tests","Речевые упражнения.","TestCardsRU","","","Select random card from group ""Слова Королёвой"" and compare UI vs BACKEND data.",""
"passed","Sun Sep 22 09:42:39 GMT 2024","Sun Sep 22 09:42:40 GMT 2024","825","tests","contributors_page_test","TestContributorsPage","","","Verify attribute values of images in contributors cards in grids",""
"passed","Sun Sep 22 09:55:22 GMT 2024","Sun Sep 22 09:55:22 GMT 2024","261","tests","used_resources_page_test","TestUsedResourcesPage","","","Verify value of the title of the tab",""
"passed","Sun Sep 22 09:49:35 GMT 2024","Sun Sep 22 09:49:35 GMT 2024","38","tests","specialists_page_test","TestSpecialistsPage","","","Verify value of title with tag 'h2' on the page",""
"passed","Sun Sep 22 09:50:51 GMT 2024","Sun Sep 22 09:50:51 GMT 2024","37","tests","start_unauthorized_page_test","TestStartUnauthorizedPage","","","Verify text in the 'Login' link in the section 1",""
"passed","Sun Sep 22 09:47:26 GMT 2024","Sun Sep 22 09:47:27 GMT 2024","1364","tests","main_page_test","TestMainPage","","","Verify redirection to github not authorized user.",""
"passed","Sun Sep 22 09:41:58 GMT 2024","Sun Sep 22 09:42:00 GMT 2024","1717","tests","contributors_page_test","TestContributorsPage","","","Verify the composition and visibility of elements 
        on the 1st-5th levels of nesting on the page",""
"passed","Sun Sep 22 09:55:29 GMT 2024","Sun Sep 22 09:55:30 GMT 2024","805","tests","used_resources_page_test","TestUsedResourcesPage","","","Verify value of title with tag 'h1' on the page",""
"passed","Sun Sep 22 09:50:43 GMT 2024","Sun Sep 22 09:50:43 GMT 2024","48","tests","start_unauthorized_page_test","TestStartUnauthorizedPage","","","Verify values of titles and subtitles with tags h2, h4 on the page",""
"passed","Sun Sep 22 09:47:17 GMT 2024","Sun Sep 22 09:47:17 GMT 2024","159","tests","main_page_test","TestMainPage","","","Verify redirection to contacts page not authorized user.",""
"passed","Sun Sep 22 09:46:31 GMT 2024","Sun Sep 22 09:46:45 GMT 2024","13846","tests","header_test","TestHeaderPage","","","Verify if internal links in the Header for an authorized user 
            lead to correct pages after click",""
"passed","Sun Sep 22 09:42:18 GMT 2024","Sun Sep 22 09:42:18 GMT 2024","19","tests","contributors_page_test","TestContributorsPage","","","Verify content of the text on the page",""
"passed","Sun Sep 22 09:54:13 GMT 2024","Sun Sep 22 09:54:38 GMT 2024","25262","tests","Речевые упражнения.","TestCardsRU","","","Solutions to a random task in the ""Слова Королёвой"" .",""
"passed","Sun Sep 22 09:53:36 GMT 2024","Sun Sep 22 09:54:06 GMT 2024","30418","tests","Речевые упражнения.","TestCardsRU","","","Solutions to a random task in the ""Слова"" .",""
"passed","Sun Sep 22 09:42:09 GMT 2024","Sun Sep 22 09:42:09 GMT 2024","12","tests","contributors_page_test","TestContributorsPage","","","Verify value of the title of the tab",""
"passed","Sun Sep 22 09:48:39 GMT 2024","Sun Sep 22 09:48:40 GMT 2024","660","tests","registration_page_test","TestRegistrationPage","","","Check registration without choosing gender",""
"passed","Sun Sep 22 09:41:22 GMT 2024","Sun Sep 22 09:41:22 GMT 2024","54","tests","contacts_page_test","TestContactsPage","","","Verify values of the title and subtitles with tags h1, h2 on the page",""
"passed","Sun Sep 22 09:41:38 GMT 2024","Sun Sep 22 09:41:38 GMT 2024","863","tests","contacts_page_test","TestContactsPage","","","Verify presence, visibility, clickability, href, prefix, status code of links in the section 2",""
"passed","Sun Sep 22 09:56:00 GMT 2024","Sun Sep 22 09:56:02 GMT 2024","2304","tests","used_resources_page_test","TestUsedResourcesPage","","","Verify that links in the sections lead to the correct pages after clicking",""
"passed","Sun Sep 22 09:43:43 GMT 2024","Sun Sep 22 09:43:43 GMT 2024","47","tests","footer_test","TestFooter","","","Verify text in the 'Contact us' link in the Footer",""
"passed","Sun Sep 22 09:47:43 GMT 2024","Sun Sep 22 09:47:43 GMT 2024","115","tests","main_page_test","TestMainPage","","","Checking the clickability of the Registration button.",""
"passed","Sun Sep 22 09:55:08 GMT 2024","Sun Sep 22 09:55:09 GMT 2024","796","tests","used_resources_page_test","TestUsedResourcesPage","","","Verify presence and visibility of content on the page",""
"passed","Sun Sep 22 09:55:15 GMT 2024","Sun Sep 22 09:55:16 GMT 2024","895","tests","used_resources_page_test","TestUsedResourcesPage","","","Verify the composition and visibility of elements 
            on the 1st-4th levels of nesting on the page",""
"passed","Sun Sep 22 09:41:17 GMT 2024","Sun Sep 22 09:41:17 GMT 2024","13","tests","contacts_page_test","TestContactsPage","","","Verify value of the title of the tab",""
"passed","Sun Sep 22 09:52:48 GMT 2024","Sun Sep 22 09:52:58 GMT 2024","9401","tests","Речевые упражнения.","TestCardsRU","","","Select a random card from ""Группа слов"" group and compare UI vs BACKEND data.",""
"passed","Sun Sep 22 09:49:09 GMT 2024","Sun Sep 22 09:49:09 GMT 2024","31","tests","specialists_page_test","TestSpecialistsPage","","","Verify presence and visibility of content on the page",""
"passed","Sun Sep 22 09:45:49 GMT 2024","Sun Sep 22 09:45:59 GMT 2024","10539","tests","header_test","TestHeaderPage","","","Verify composition, visibility of elements on the 1st-6th levels of nesting in the Header
            for an authorized user",""
"passed","Sun Sep 22 09:47:40 GMT 2024","Sun Sep 22 09:47:40 GMT 2024","88","tests","main_page_test","TestMainPage","","","Checking the clickability of the Start button.",""
"passed","Sun Sep 22 09:47:03 GMT 2024","Sun Sep 22 09:47:03 GMT 2024","114","tests","main_page_test","TestMainPage","","","Verify redirection to description page not authorized user.",""
"passed","Sun Sep 22 09:44:11 GMT 2024","Sun Sep 22 09:44:11 GMT 2024","79","tests","footer_test","TestFooter","","","Verify attributes of images in links in the Footer",""
"passed","Sun Sep 22 09:55:37 GMT 2024","Sun Sep 22 09:55:37 GMT 2024","806","tests","used_resources_page_test","TestUsedResourcesPage","","","Verify content of the text on the page",""
"passed","Sun Sep 22 09:51:03 GMT 2024","Sun Sep 22 09:51:03 GMT 2024","79","tests","start_unauthorized_page_test","TestStartUnauthorizedPage","","","Verify presence, visibility and attributes of the image in the section 1",""
"passed","Sun Sep 22 09:48:44 GMT 2024","Sun Sep 22 09:49:04 GMT 2024","20754","tests","registration_page_test","TestRegistrationPage","","","Check registration without choosing agreement",""
"skipped","Sun Sep 22 09:54:44 GMT 2024","Sun Sep 22 09:54:53 GMT 2024","9250","tests","Речевые упражнения.","TestCardsRU","","","Solutions to a random task in the ""Слова"" group and comparison of statics.",""
"passed","Sun Sep 22 09:45:14 GMT 2024","Sun Sep 22 09:45:16 GMT 2024","1852","tests","header_test","TestHeaderPage","","","Verify if external links in the Header for an unauthorized user 
            lead to correct pages after click",""
"passed","Sun Sep 22 09:49:30 GMT 2024","Sun Sep 22 09:49:30 GMT 2024","12","tests","specialists_page_test","TestSpecialistsPage","","","Verify value of the title of the tab",""
"passed","Sun Sep 22 09:52:32 GMT 2024","Sun Sep 22 09:52:42 GMT 2024","9425","tests","Речевые упражнения.","TestCardsRU","","","Select a random card from ""Похожие фразы"" group and compare UI vs BACKEND data.",""
"passed","Sun Sep 22 09:44:33 GMT 2024","Sun Sep 22 09:44:44 GMT 2024","10369","tests","header_test","TestHeaderPage","","","Verify composition, visibility of elements on the 1st-6th levels of nesting in the Header
            for an unauthorized user",""
"passed","Sun Sep 22 09:48:25 GMT 2024","Sun Sep 22 09:48:26 GMT 2024","698","tests","registration_page_test","TestRegistrationPage","","","Check registration with new email and empty first name",""
"passed","Sun Sep 22 09:43:27 GMT 2024","Sun Sep 22 09:43:27 GMT 2024","49","tests","footer_test","TestFooter","","","Verify presence and visibility of the Footer",""
"passed","Sun Sep 22 09:50:01 GMT 2024","Sun Sep 22 09:50:02 GMT 2024","631","tests","specialists_page_test","TestSpecialistsPage","","","Verify that the 'All Specialists' link leads an unauthorized user 
                         to the correct page after clicking",""
"passed","Sun Sep 22 09:48:30 GMT 2024","Sun Sep 22 09:48:31 GMT 2024","696","tests","registration_page_test","TestRegistrationPage","","","Check registration with new email and empty birthday",""
"passed","Sun Sep 22 09:41:07 GMT 2024","Sun Sep 22 09:41:07 GMT 2024","140","tests","contacts_page_test","TestContactsPage","","","Verify the composition and visibility of elements 
        on the 1st-5th levels of nesting in the section 2",""
"passed","Sun Sep 22 09:50:35 GMT 2024","Sun Sep 22 09:50:35 GMT 2024","123","tests","start_unauthorized_page_test","TestStartUnauthorizedPage","","","Verify the composition and visibility of elements 
        on the 1st-3rd levels of nesting in the section 2",""
"passed","Sun Sep 22 09:50:14 GMT 2024","Sun Sep 22 09:50:15 GMT 2024","115","tests","specialists_page_test","TestSpecialistsPage","","","Verify attributes of images in specialist cards in the grid",""
"passed","Sun Sep 22 09:55:44 GMT 2024","Sun Sep 22 09:55:44 GMT 2024","802","tests","used_resources_page_test","TestUsedResourcesPage","","","Verify text in links in sections",""
"passed","Sun Sep 22 09:43:12 GMT 2024","Sun Sep 22 09:43:14 GMT 2024","1557","tests","description_page_test","TestDescriptionPage","","","Verify redirection to github not authorized user.",""
"passed","Sun Sep 22 09:43:47 GMT 2024","Sun Sep 22 09:43:50 GMT 2024","3201","tests","footer_test","TestFooter","","","Verify clickability, href, prefix and subject, status code of links in the Footer",""
"passed","Sun Sep 22 09:42:53 GMT 2024","Sun Sep 22 09:42:54 GMT 2024","1331","tests","description_page_test","TestDescriptionPage","","","Verify redirection to telegram page not authorized user.",""
"passed","Sun Sep 22 09:41:32 GMT 2024","Sun Sep 22 09:41:32 GMT 2024","32","tests","contacts_page_test","TestContactsPage","","","Verify text in links in the section 2",""
"passed","Sun Sep 22 09:55:00 GMT 2024","Sun Sep 22 09:55:01 GMT 2024","1392","tests","Statistic.","TestCardsRU","","","Check statistic table.",""
"passed","Sun Sep 22 09:45:28 GMT 2024","Sun Sep 22 09:45:28 GMT 2024","198","tests","header_test","TestHeaderPage","","","Verify switching of the 'ru' and 'en' buttons in the Header",""
"passed","Sun Sep 22 09:49:55 GMT 2024","Sun Sep 22 09:49:56 GMT 2024","654","tests","specialists_page_test","TestSpecialistsPage","","","Verify clickability, href, status code of the 'All Specialists' link",""
"passed","Sun Sep 22 09:49:20 GMT 2024","Sun Sep 22 09:49:25 GMT 2024","5372","tests","specialists_page_test","TestSpecialistsPage","","","Verify presence, visibility of the title, text, link, grid, cards and images  
        on the 2nd, 3rd, 5th, 6th levels of nesting on the page",""
"passed","Sun Sep 22 09:47:31 GMT 2024","Sun Sep 22 09:47:32 GMT 2024","642","tests","main_page_test","TestMainPage","","","Verify redirection to contributors page not authorized user.",""
"passed","Sun Sep 22 09:56:15 GMT 2024","Sun Sep 22 09:56:16 GMT 2024","838","tests","used_resources_page_test","TestUsedResourcesPage","","","Verify sizes of icons in sections",""
"passed","Sun Sep 22 09:44:48 GMT 2024","Sun Sep 22 09:44:48 GMT 2024","350","tests","header_test","TestHeaderPage","","","Verify presence, visibility of links, buttons in the Header for an unauthorized user",""
"passed","Sun Sep 22 09:46:19 GMT 2024","Sun Sep 22 09:46:25 GMT 2024","5603","tests","header_test","TestHeaderPage","","","Verify clickability, href, status code of links in the Header for an authorized user",""
"passed","Sun Sep 22 09:43:39 GMT 2024","Sun Sep 22 09:43:39 GMT 2024","49","tests","footer_test","TestFooter","","","Verify content of text in the Footer",""
"passed","Sun Sep 22 09:48:11 GMT 2024","Sun Sep 22 09:48:12 GMT 2024","1205","tests","registration_page_test","TestRegistrationPage","","","Check registration with an existing email",""
"passed","Sun Sep 22 09:43:35 GMT 2024","Sun Sep 22 09:43:35 GMT 2024","138","tests","footer_test","TestFooter","","","Verify presence, visibility of text, links, images in the Footer",""
"passed","Sun Sep 22 09:43:04 GMT 2024","Sun Sep 22 09:43:04 GMT 2024","171","tests","description_page_test","TestDescriptionPage","","","Verify redirection to contacts page not authorized user.",""
"passed","Sun Sep 22 09:50:20 GMT 2024","Sun Sep 22 09:50:20 GMT 2024","170","tests","specialists_page_test","TestSpecialistsPage","","","Verify sizes of images in specialist cards in the grid",""
"passed","Sun Sep 22 09:42:21 GMT 2024","Sun Sep 22 09:42:22 GMT 2024","436","tests","contributors_page_test","TestContributorsPage","","","Verify values of the text in card descriptions",""
"passed","Sun Sep 22 09:50:28 GMT 2024","Sun Sep 22 09:50:28 GMT 2024","31","tests","start_unauthorized_page_test","TestStartUnauthorizedPage","","","Verify amount and visibility of sections with content on the page",""
"passed","Sun Sep 22 09:44:15 GMT 2024","Sun Sep 22 09:44:15 GMT 2024","107","tests","footer_test","TestFooter","","","Verify sizes of images in links in the Footer",""
"passed","Sun Sep 22 09:55:51 GMT 2024","Sun Sep 22 09:55:53 GMT 2024","2078","tests","used_resources_page_test","TestUsedResourcesPage","","","Verify presence, visibility, clickability, href, status code of links in sections",""
"passed","Sun Sep 22 09:53:20 GMT 2024","Sun Sep 22 09:53:30 GMT 2024","9373","tests","Речевые упражнения.","TestCardsRU","","","Select a random card from ""Слова с частотной группировкой"" group and compare UI vs BACKEND data.",""
"passed","Sun Sep 22 09:48:21 GMT 2024","Sun Sep 22 09:48:21 GMT 2024","701","tests","registration_page_test","TestRegistrationPage","","","Check registration with new email and empty password",""
"passed","Sun Sep 22 09:47:35 GMT 2024","Sun Sep 22 09:47:36 GMT 2024","154","tests","main_page_test","TestMainPage","","","Verify redirection to used resources page not authorized user.",""
"passed","Sun Sep 22 09:40:56 GMT 2024","Sun Sep 22 09:40:56 GMT 2024","28","tests","contacts_page_test","TestContactsPage","","","Verify presence and visibility of content on the page",""
"passed","Sun Sep 22 09:42:58 GMT 2024","Sun Sep 22 09:43:00 GMT 2024","1153","tests","description_page_test","TestDescriptionPage","","","Verify redirection to donate page not authorized user.",""
"passed","Sun Sep 22 09:43:08 GMT 2024","Sun Sep 22 09:43:09 GMT 2024","676","tests","description_page_test","TestDescriptionPage","","","Verify redirection to specialists page not authorized user.",""
