"Status","Start Time","Stop Time","Duration in ms","Parent Suite","Suite","Sub Suite","Test Class","Test Method","Name","Description"
"passed","Thu May 23 08:23:56 GMT 2024","Thu May 23 08:23:56 GMT 2024","82","tests","footer_test","TestFooter","","","Verify presence, visibility and accuracy of the Contact us link in Footer",""
"passed","Thu May 23 08:21:46 GMT 2024","Thu May 23 08:21:46 GMT 2024","35","tests","contributors_page_test","TestContributorsPage","","","Verify value of title with tag 'h2' on the page",""
"passed","Thu May 23 08:22:21 GMT 2024","Thu May 23 08:22:21 GMT 2024","100","tests","description_page_test","TestDescriptionPage","","","Verify return main page from description page.",""
"passed","Thu May 23 08:29:00 GMT 2024","Thu May 23 08:29:00 GMT 2024","91","tests","specialists_page_test","TestSpecialistsPage","","","Verify presence, visibility and accuracy of the 1th card's image in the grid",""
"passed","Thu May 23 08:28:02 GMT 2024","Thu May 23 08:28:03 GMT 2024","576","tests","registration_page_test","TestRegistrationPage","","","Check registration without choosing gender",""
"passed","Thu May 23 08:31:12 GMT 2024","Thu May 23 08:31:23 GMT 2024","11064","tests","Речевые упражнения.","TestCardsRU","","","Select random card from group ""Слова"" and compare UI vs BACKEND data.",""
"passed","Thu May 23 08:22:08 GMT 2024","Thu May 23 08:22:09 GMT 2024","714","tests","contributors_page_test","TestContributorsPage","","","Verify href, status code, text of the 'All Team' link on the page",""
"passed","Thu May 23 08:23:28 GMT 2024","Thu May 23 08:23:30 GMT 2024","2545","tests","footer_test","TestFooter","","","Verify accuracy of texts in Footer on each page specified in the kit",""
"passed","Thu May 23 08:26:25 GMT 2024","Thu May 23 08:26:26 GMT 2024","944","tests","main_page_test","TestMainPage","","","Verify redirection to donate page not authorized user.",""
"passed","Thu May 23 08:30:17 GMT 2024","Thu May 23 08:30:18 GMT 2024","714","tests","start_unauthorized_page_test","TestStartUnauthorizedPage","","","Verify presence, visibility, clickability, href, status code, text 
                         of the 'Login' link in the section 1 on the page",""
"passed","Thu May 23 08:30:14 GMT 2024","Thu May 23 08:30:14 GMT 2024","93","tests","start_unauthorized_page_test","TestStartUnauthorizedPage","","","Verify attribute values and size of the image in the section 1 on the page",""
"passed","Thu May 23 08:27:58 GMT 2024","Thu May 23 08:27:59 GMT 2024","598","tests","registration_page_test","TestRegistrationPage","","","Check registration with new email and empty email",""
"passed","Thu May 23 08:23:10 GMT 2024","Thu May 23 08:23:12 GMT 2024","2508","tests","footer_test","TestFooter","","","Verify presence and visibility of Footer on each page specified in the kit",""
"passed","Thu May 23 08:23:34 GMT 2024","Thu May 23 08:23:34 GMT 2024","538","tests","footer_test","TestFooter","","","Verify presence, visibility, clickability, href, status code of the ARASAAC link in Footer",""
"passed","Thu May 23 08:23:17 GMT 2024","Thu May 23 08:23:19 GMT 2024","2512","tests","footer_test","TestFooter","","","Verify presence and visibility of Footer on each page specified in the kit",""
"passed","Thu May 23 08:23:02 GMT 2024","Thu May 23 08:23:05 GMT 2024","2586","tests","footer_test","TestFooter","","","Verify presence and visibility of Footer on each page specified in the kit",""
"passed","Thu May 23 08:21:07 GMT 2024","Thu May 23 08:21:07 GMT 2024","23","tests","contacts_page_test","TestContactsPage","","","Verify values of subtitles with tag 'h2' on the page",""
"passed","Thu May 23 08:29:24 GMT 2024","Thu May 23 08:29:29 GMT 2024","5232","tests","specialists_page_test","TestSpecialistsPage","","","Verify that the 'All Specialists' link leads an unauthorized user 
                         to the correct page after clicking",""
"passed","Thu May 23 08:30:57 GMT 2024","Thu May 23 08:31:06 GMT 2024","9230","tests","Speech exercises EN.","TestCardsEN","","","Select a random card from ""Similar phrases"" group and compare UI vs BACKEND data",""
"passed","Thu May 23 08:28:36 GMT 2024","Thu May 23 08:28:36 GMT 2024","56","tests","specialists_page_test","TestSpecialistsPage","","","Verify presence, visibility and content accuracy of the text on the Specialists page",""
"passed","Thu May 23 08:30:02 GMT 2024","Thu May 23 08:30:02 GMT 2024","28","tests","start_unauthorized_page_test","TestStartUnauthorizedPage","","","Verify values of subtitles with tag 'h4' on the page",""
"passed","Thu May 23 08:25:26 GMT 2024","Thu May 23 08:25:26 GMT 2024","78","tests","footer_test","TestFooter","","","Verify changes of visible sizes of the ARASAAC link's image in Footer",""
"passed","Thu May 23 08:23:42 GMT 2024","Thu May 23 08:23:42 GMT 2024","147","tests","footer_test","TestFooter","","","Verify presence, visibility, clickability, href, status code of the JETBRAINS link in Footer",""
"passed","Thu May 23 08:26:05 GMT 2024","Thu May 23 08:26:05 GMT 2024","45","tests","footer_test","TestFooter","","","Verify visible sizes of the Selectel link's image in Footer",""
"passed","Thu May 23 08:28:31 GMT 2024","Thu May 23 08:28:31 GMT 2024","59","tests","specialists_page_test","TestSpecialistsPage","","","Verify presence, visibility and text accuracy of the title on the Specialists page",""
"passed","Thu May 23 08:24:03 GMT 2024","Thu May 23 08:24:07 GMT 2024","4397","tests","footer_test","TestFooter","","","Verify Footer invisibility through the modal window with the exercise",""
"passed","Thu May 23 08:29:44 GMT 2024","Thu May 23 08:29:44 GMT 2024","33","tests","start_unauthorized_page_test","TestStartUnauthorizedPage","","","Verify presence and visibility of content on the page",""
"passed","Thu May 23 08:35:41 GMT 2024","Thu May 23 08:35:42 GMT 2024","801","tests","used_resources_page_test","TestUsedResourcesPage","","","Verify presence, visibility and text accuracy of the title on the page",""
"passed","Thu May 23 08:21:53 GMT 2024","Thu May 23 08:21:53 GMT 2024","18","tests","contributors_page_test","TestContributorsPage","","","Verify values of the text in the slogan on the page",""
"passed","Thu May 23 08:26:08 GMT 2024","Thu May 23 08:26:08 GMT 2024","79","tests","footer_test","TestFooter","","","Verify changes of visible sizes of the Selectel link's image in Footer",""
"passed","Thu May 23 08:36:42 GMT 2024","Thu May 23 08:36:43 GMT 2024","1020","tests","used_resources_page_test","TestUsedResourcesPage","","","Verify presence, visibility, clickability, href, status code, text of the 'Plants' link",""
"passed","Thu May 23 08:22:16 GMT 2024","Thu May 23 08:22:17 GMT 2024","795","tests","contributors_page_test","TestContributorsPage","","","Verify attribute values of images in contributors cards in the grid",""
"passed","Thu May 23 08:22:12 GMT 2024","Thu May 23 08:22:13 GMT 2024","424","tests","contributors_page_test","TestContributorsPage","","","Verify presence and visibility of images in contributors cards in the grid",""
"skipped","Thu May 23 08:34:04 GMT 2024","Thu May 23 08:35:15 GMT 2024","70784","tests","Речевые упражнения.","TestCardsRU","","","Solutions to a random task in the ""Слова Королёвой"" .",""
"passed","Thu May 23 08:30:43 GMT 2024","Thu May 23 08:30:51 GMT 2024","8241","tests","Speech exercises EN.","TestCardsEN","","","Check progres-bar and buttons.",""
"passed","Thu May 23 08:36:07 GMT 2024","Thu May 23 08:36:08 GMT 2024","1011","tests","used_resources_page_test","TestUsedResourcesPage","","","Verify presence, visibility, clickability, href, status code, text of the freepik.com link",""
"passed","Thu May 23 08:21:42 GMT 2024","Thu May 23 08:21:42 GMT 2024","39","tests","contributors_page_test","TestContributorsPage","","","Verify amount of contributor cards with images, links and descriptions in the section grid",""
"passed","Thu May 23 08:25:37 GMT 2024","Thu May 23 08:25:37 GMT 2024","79","tests","footer_test","TestFooter","","","Verify changes of visible sizes of the EPAM link's image in Footer",""
"passed","Thu May 23 08:21:02 GMT 2024","Thu May 23 08:21:02 GMT 2024","33","tests","contacts_page_test","TestContactsPage","","","Verify value of title with tag 'h1' on the page",""
"passed","Thu May 23 08:26:53 GMT 2024","Thu May 23 08:26:53 GMT 2024","102","tests","main_page_test","TestMainPage","","","Checking the clickability of the Registration button.",""
"passed","Thu May 23 08:37:37 GMT 2024","Thu May 23 08:37:38 GMT 2024","784","tests","used_resources_page_test","TestUsedResourcesPage","","","Verify sizes of the icon in the 'Flora' link's section",""
"passed","Thu May 23 08:29:14 GMT 2024","Thu May 23 08:29:14 GMT 2024","62","tests","specialists_page_test","TestSpecialistsPage","","","Verify values of profession in specialist cards in the grid",""
"passed","Thu May 23 08:22:47 GMT 2024","Thu May 23 08:22:47 GMT 2024","640","tests","description_page_test","TestDescriptionPage","","","Verify redirection to contributors page not authorized user.",""
"passed","Thu May 23 08:36:14 GMT 2024","Thu May 23 08:36:17 GMT 2024","2447","tests","used_resources_page_test","TestUsedResourcesPage","","","Verify that the freepik.com link leads to the correct page after click",""
"passed","Thu May 23 08:28:55 GMT 2024","Thu May 23 08:28:55 GMT 2024","212","tests","specialists_page_test","TestSpecialistsPage","","","Verify attribute values and sizes of images in specialist cards in the grid",""
"passed","Thu May 23 08:23:20 GMT 2024","Thu May 23 08:23:23 GMT 2024","2790","tests","footer_test","TestFooter","","","Verify presence and visibility of Footer on each page specified in the kit",""
"passed","Thu May 23 08:25:07 GMT 2024","Thu May 23 08:25:12 GMT 2024","5002","tests","footer_test","TestFooter","","","Verify that the SELECTEL link in Footer leads to the correct page after click",""
"passed","Thu May 23 08:26:42 GMT 2024","Thu May 23 08:26:42 GMT 2024","643","tests","main_page_test","TestMainPage","","","Verify redirection to contributors page not authorized user.",""
"skipped","Thu May 23 08:35:21 GMT 2024","Thu May 23 08:35:27 GMT 2024","6511","tests","Речевые упражнения.","TestCardsRU","","","Solutions to a random task in the ""Слова"" group and comparison of statics.",""
"passed","Thu May 23 08:36:01 GMT 2024","Thu May 23 08:36:02 GMT 2024","772","tests","used_resources_page_test","TestUsedResourcesPage","","","Verify presence and visibility of the section with the freepik.com link on the page",""
"passed","Thu May 23 08:23:24 GMT 2024","Thu May 23 08:23:27 GMT 2024","2636","tests","footer_test","TestFooter","","","Verify accuracy of texts in Footer on each page specified in the kit",""
"passed","Thu May 23 08:29:58 GMT 2024","Thu May 23 08:29:58 GMT 2024","23","tests","start_unauthorized_page_test","TestStartUnauthorizedPage","","","Verify values of titles with tag 'h2' on the page",""
"passed","Thu May 23 08:32:30 GMT 2024","Thu May 23 08:32:41 GMT 2024","10637","tests","Речевые упражнения.","TestCardsRU","","","Select a random card from ""Слова с частотной группировкой"" group and compare UI vs BACKEND data.",""
"passed","Thu May 23 08:24:25 GMT 2024","Thu May 23 08:24:30 GMT 2024","5110","tests","footer_test","TestFooter","","","Verify that the JETBRAINS link in Footer leads to the correct page after click",""
"passed","Thu May 23 08:27:42 GMT 2024","Thu May 23 08:27:42 GMT 2024","622","tests","registration_page_test","TestRegistrationPage","","","Check registration with new email and empty confirm password",""
"passed","Thu May 23 08:32:15 GMT 2024","Thu May 23 08:32:24 GMT 2024","9177","tests","Речевые упражнения.","TestCardsRU","","","Select a random card from ""Предложения"" group and compare UI vs BACKEND data.",""
"passed","Thu May 23 08:28:06 GMT 2024","Thu May 23 08:28:27 GMT 2024","20680","tests","registration_page_test","TestRegistrationPage","","","Check registration without choosing agreement",""
"passed","Thu May 23 08:22:00 GMT 2024","Thu May 23 08:22:00 GMT 2024","401","tests","contributors_page_test","TestContributorsPage","","","Verify text in links in card links",""
"passed","Thu May 23 08:25:23 GMT 2024","Thu May 23 08:25:23 GMT 2024","45","tests","footer_test","TestFooter","","","Verify visible sizes of the ARASAAC link's image in Footer",""
"passed","Thu May 23 08:37:09 GMT 2024","Thu May 23 08:37:10 GMT 2024","767","tests","used_resources_page_test","TestUsedResourcesPage","","","Verify presence and visibility of the section with the 'Flora' link on the page",""
"passed","Thu May 23 08:20:39 GMT 2024","Thu May 23 08:20:39 GMT 2024","57","tests","contacts_page_test","TestContactsPage","","","Verify presence, visibility and structure of content on the page",""
"passed","Thu May 23 08:26:17 GMT 2024","Thu May 23 08:26:17 GMT 2024","114","tests","main_page_test","TestMainPage","","","Verify redirection to description page not authorized user.",""
"passed","Thu May 23 08:27:37 GMT 2024","Thu May 23 08:27:38 GMT 2024","1185","tests","registration_page_test","TestRegistrationPage","","","Check registration with an existing email",""
"passed","Thu May 23 08:23:06 GMT 2024","Thu May 23 08:23:09 GMT 2024","2627","tests","footer_test","TestFooter","","","Verify presence and visibility of Footer on each page specified in the kit",""
"passed","Thu May 23 08:31:29 GMT 2024","Thu May 23 08:31:37 GMT 2024","8297","tests","Речевые упражнения.","TestCardsRU","","","Select random card from group ""Слова Королёвой"" and compare UI vs BACKEND data.",""
"passed","Thu May 23 08:24:33 GMT 2024","Thu May 23 08:25:03 GMT 2024","30234","tests","footer_test","TestFooter","","","Verify that the REG.RU link in Footer leads to the correct page after click",""
"passed","Thu May 23 08:21:34 GMT 2024","Thu May 23 08:21:34 GMT 2024","22","tests","contributors_page_test","TestContributorsPage","","","Verify amount and visibility of sections with content on the page",""
"passed","Thu May 23 08:29:10 GMT 2024","Thu May 23 08:29:10 GMT 2024","55","tests","specialists_page_test","TestSpecialistsPage","","","Verify values of names in specialist cards in the grid",""
"passed","Thu May 23 08:22:34 GMT 2024","Thu May 23 08:22:34 GMT 2024","144","tests","description_page_test","TestDescriptionPage","","","Verify redirection to contacts page not authorized user.",""
"passed","Thu May 23 08:26:46 GMT 2024","Thu May 23 08:26:46 GMT 2024","144","tests","main_page_test","TestMainPage","","","Verify redirection to used resources page not authorized user.",""
"passed","Thu May 23 08:26:33 GMT 2024","Thu May 23 08:26:34 GMT 2024","642","tests","main_page_test","TestMainPage","","","Verify redirection to specialists page not authorized user.",""
"passed","Thu May 23 08:36:56 GMT 2024","Thu May 23 08:36:57 GMT 2024","780","tests","used_resources_page_test","TestUsedResourcesPage","","","Verify presence, visibility and accuracy of the icon in the 'Plants' link's section",""
"passed","Thu May 23 08:30:21 GMT 2024","Thu May 23 08:30:21 GMT 2024","121","tests","start_unauthorized_page_test","TestStartUnauthorizedPage","","","Verify that the 'Login' link leads to the correct page after clicking",""
"passed","Thu May 23 08:30:05 GMT 2024","Thu May 23 08:30:05 GMT 2024","36","tests","start_unauthorized_page_test","TestStartUnauthorizedPage","","","Verify values of the text in the section 1 on the page",""
"passed","Thu May 23 08:22:51 GMT 2024","Thu May 23 08:22:51 GMT 2024","141","tests","description_page_test","TestDescriptionPage","","","Verify redirection to used resources page not authorized user.",""
"passed","Thu May 23 08:26:01 GMT 2024","Thu May 23 08:26:01 GMT 2024","66","tests","footer_test","TestFooter","","","Verify presence, visibility and accuracy of the Selectel link's image in Footer",""
"passed","Thu May 23 08:25:33 GMT 2024","Thu May 23 08:25:33 GMT 2024","44","tests","footer_test","TestFooter","","","Verify visible sizes of the EPAM link's image in Footer",""
"passed","Thu May 23 08:29:55 GMT 2024","Thu May 23 08:29:55 GMT 2024","96","tests","start_unauthorized_page_test","TestStartUnauthorizedPage","","","Verify the composition and visibility of elements 
        on the 1st, 2nd, 3rd levels of nesting in the section 2",""
"passed","Thu May 23 08:20:57 GMT 2024","Thu May 23 08:20:57 GMT 2024","28","tests","contacts_page_test","TestContactsPage","","","Verify presence and visibility of the dividing line on the page",""
"passed","Thu May 23 08:21:37 GMT 2024","Thu May 23 08:21:39 GMT 2024","1347","tests","contributors_page_test","TestContributorsPage","","","Verify the composition and visibility of elements on the 1st, 2nd, 3rd, 4th levels of nesting in the section",""
"passed","Thu May 23 08:21:16 GMT 2024","Thu May 23 08:21:16 GMT 2024","28","tests","contacts_page_test","TestContactsPage","","","Verify values of the text in links in sections 1, 2 on the page",""
"passed","Thu May 23 08:20:53 GMT 2024","Thu May 23 08:20:53 GMT 2024","132","tests","contacts_page_test","TestContactsPage","","","Verify the composition and visibility of elements 
        on the 1st, 2nd, 3rd, 4th, 5th levels of nesting in the section 2",""
"passed","Thu May 23 08:23:45 GMT 2024","Thu May 23 08:23:47 GMT 2024","1689","tests","footer_test","TestFooter","","","Verify presence, visibility, clickability, href, status code of the REG.RU link in Footer",""
"passed","Thu May 23 08:27:54 GMT 2024","Thu May 23 08:27:55 GMT 2024","622","tests","registration_page_test","TestRegistrationPage","","","Check registration with new email and empty birthday",""
"passed","Thu May 23 08:20:34 GMT 2024","Thu May 23 08:20:35 GMT 2024","867","tests","authorisation_page_test","TestAuthorizedUserPage","","","Checking the possibility of authorization with incorrect data",""
"passed","Thu May 23 08:22:59 GMT 2024","Thu May 23 08:23:01 GMT 2024","2648","tests","footer_test","TestFooter","","","Verify presence and visibility of Footer on each page specified in the kit",""
"passed","Thu May 23 08:29:51 GMT 2024","Thu May 23 08:29:51 GMT 2024","86","tests","start_unauthorized_page_test","TestStartUnauthorizedPage","","","Verify the composition and visibility of elements 
        on the 1st, 2nd, 3rd levels of nesting in the section 1",""
"passed","Thu May 23 08:26:30 GMT 2024","Thu May 23 08:26:30 GMT 2024","145","tests","main_page_test","TestMainPage","","","Verify redirection to contacts page not authorized user.",""
"passed","Thu May 23 08:28:49 GMT 2024","Thu May 23 08:28:50 GMT 2024","1017","tests","specialists_page_test","TestSpecialistsPage","","","Verify presence and visibility of images in specialist cards in the grid",""
"passed","Thu May 23 08:35:54 GMT 2024","Thu May 23 08:35:55 GMT 2024","782","tests","used_resources_page_test","TestUsedResourcesPage","","","Verify presence and visibility of the section with links on the page",""
"passed","Thu May 23 08:36:22 GMT 2024","Thu May 23 08:36:23 GMT 2024","809","tests","used_resources_page_test","TestUsedResourcesPage","","","Verify presence, visibility and accuracy of the icon in the freepik.com link's section",""
"passed","Thu May 23 08:25:29 GMT 2024","Thu May 23 08:25:30 GMT 2024","69","tests","footer_test","TestFooter","","","Verify presence, visibility and accuracy of the EPAM link's image in Footer",""
"passed","Thu May 23 08:21:11 GMT 2024","Thu May 23 08:21:11 GMT 2024","29","tests","contacts_page_test","TestContactsPage","","","Verify values of the text in sections 1, 2 on the page",""
"passed","Thu May 23 08:20:48 GMT 2024","Thu May 23 08:20:48 GMT 2024","23","tests","contacts_page_test","TestContactsPage","","","Verify the composition and visibility of elements on the 1st level of nesting in the section 1",""
"passed","Thu May 23 08:27:30 GMT 2024","Thu May 23 08:27:33 GMT 2024","3178","tests","registration_page_test","TestRegistrationPage","","","Check registration with new email",""
"passed","Thu May 23 08:31:43 GMT 2024","Thu May 23 08:31:53 GMT 2024","10018","tests","Речевые упражнения.","TestCardsRU","","","Select a random card from ""Похожие фразы"" group and compare UI vs BACKEND data.",""
"passed","Thu May 23 08:25:50 GMT 2024","Thu May 23 08:25:50 GMT 2024","66","tests","footer_test","TestFooter","","","Verify presence, visibility and accuracy of the REG.RU link's image in Footer",""
"passed","Thu May 23 08:31:59 GMT 2024","Thu May 23 08:32:09 GMT 2024","9921","tests","Речевые упражнения.","TestCardsRU","","","Select a random card from ""Группа слов"" group and compare UI vs BACKEND data.",""
"passed","Thu May 23 08:37:24 GMT 2024","Thu May 23 08:37:25 GMT 2024","1594","tests","used_resources_page_test","TestUsedResourcesPage","","","Verify that the 'Flora' link leads to the correct page after click",""
"passed","Thu May 23 08:25:57 GMT 2024","Thu May 23 08:25:58 GMT 2024","78","tests","footer_test","TestFooter","","","Verify changes of visible sizes of the REG.RU link's image in Footer",""
"passed","Thu May 23 08:30:09 GMT 2024","Thu May 23 08:30:09 GMT 2024","34","tests","start_unauthorized_page_test","TestStartUnauthorizedPage","","","Verify values of the text in the section 2 on the page",""
"passed","Thu May 23 08:24:11 GMT 2024","Thu May 23 08:24:13 GMT 2024","2350","tests","footer_test","TestFooter","","","Verify that the ARASAAC link in Footer leads to the correct page after click",""
"passed","Thu May 23 08:36:35 GMT 2024","Thu May 23 08:36:36 GMT 2024","763","tests","used_resources_page_test","TestUsedResourcesPage","","","Verify presence and visibility of the section with the 'Plants' link on the page",""
"passed","Thu May 23 08:29:35 GMT 2024","Thu May 23 08:29:41 GMT 2024","5919","tests","specialists_page_test","TestSpecialistsPage","","","Verify that the 'All Specialists' link leads an authorized user 
                         to the correct page after clicking",""
"passed","Thu May 23 08:37:03 GMT 2024","Thu May 23 08:37:04 GMT 2024","772","tests","used_resources_page_test","TestUsedResourcesPage","","","Verify sizes of the icon in the 'Plants' link's section",""
"passed","Thu May 23 08:21:20 GMT 2024","Thu May 23 08:21:21 GMT 2024","685","tests","contacts_page_test","TestContactsPage","","","Verify presence, visibility, clickability, href, prefix, status code 
        of links in sections 1, 2 on the page",""
"passed","Thu May 23 08:25:19 GMT 2024","Thu May 23 08:25:19 GMT 2024","65","tests","footer_test","TestFooter","","","Verify presence, visibility and accuracy of the ARASAAC link's image in Footer",""
"passed","Thu May 23 08:26:14 GMT 2024","Thu May 23 08:26:14 GMT 2024","3","tests","login_page_test","TestLoginPage","","","Test for authorization customer.",""
"passed","Thu May 23 08:27:46 GMT 2024","Thu May 23 08:27:46 GMT 2024","668","tests","registration_page_test","TestRegistrationPage","","","Check registration with new email and empty password",""
"passed","Thu May 23 08:22:55 GMT 2024","Thu May 23 08:22:58 GMT 2024","2627","tests","footer_test","TestFooter","","","Verify presence and visibility of Footer on each page specified in the kit",""
"passed","Thu May 23 08:28:45 GMT 2024","Thu May 23 08:28:45 GMT 2024","16","tests","specialists_page_test","TestSpecialistsPage","","","Verify visibility of cards in the grid on the Specialists page",""
"passed","Thu May 23 08:22:38 GMT 2024","Thu May 23 08:22:38 GMT 2024","638","tests","description_page_test","TestDescriptionPage","","","Verify redirection to specialists page not authorized user.",""
"passed","Thu May 23 08:27:50 GMT 2024","Thu May 23 08:27:50 GMT 2024","614","tests","registration_page_test","TestRegistrationPage","","","Check registration with new email and empty first name",""
"passed","Thu May 23 08:35:33 GMT 2024","Thu May 23 08:35:36 GMT 2024","2284","tests","Statistic.","TestCardsRU","","","Check statistic table.",""
"passed","Thu May 23 08:25:16 GMT 2024","Thu May 23 08:25:16 GMT 2024","78","tests","footer_test","TestFooter","","","Verify that the Contact us link in Footer calls an email client",""
"passed","Thu May 23 08:22:04 GMT 2024","Thu May 23 08:22:04 GMT 2024","458","tests","contributors_page_test","TestContributorsPage","","","Verify presence, visibility, clickability, href of links in the section",""
"passed","Thu May 23 08:35:48 GMT 2024","Thu May 23 08:35:49 GMT 2024","797","tests","used_resources_page_test","TestUsedResourcesPage","","","Verify presence, visibility and content accuracy of the text on the page",""
"passed","Thu May 23 08:25:47 GMT 2024","Thu May 23 08:25:47 GMT 2024","78","tests","footer_test","TestFooter","","","Verify changes of visible sizes of the JETBRAINS link's image in Footer",""
"passed","Thu May 23 08:25:54 GMT 2024","Thu May 23 08:25:54 GMT 2024","44","tests","footer_test","TestFooter","","","Verify visible sizes of the REG.RU link's image in Footer",""
"passed","Thu May 23 08:25:40 GMT 2024","Thu May 23 08:25:40 GMT 2024","66","tests","footer_test","TestFooter","","","Verify presence, visibility and accuracy of the JETBRAINS link's image in Footer",""
"skipped","Thu May 23 08:32:46 GMT 2024","Thu May 23 08:33:58 GMT 2024","71522","tests","Речевые упражнения.","TestCardsRU","","","Solutions to a random task in the ""Слова"" .",""
"passed","Thu May 23 08:37:31 GMT 2024","Thu May 23 08:37:32 GMT 2024","778","tests","used_resources_page_test","TestUsedResourcesPage","","","Verify presence, visibility and accuracy of the icon in the 'Flora' link's section",""
"passed","Thu May 23 08:30:27 GMT 2024","Thu May 23 08:30:37 GMT 2024","10320","tests","Speech exercises EN.","TestCardsEN","","","Select random card from ""Word"" group and compare UI vs BACKEND data",""
