"Status","Start Time","Stop Time","Duration in ms","Parent Suite","Suite","Sub Suite","Test Class","Test Method","Name","Description"
"passed","Thu May 23 08:36:49 GMT 2024","Thu May 23 08:36:51 GMT 2024","1735","tests","used_resources_page_test","TestUsedResourcesPage","","","Verify that the 'Plants' link leads to the correct page after click",""
"passed","Thu May 23 08:23:38 GMT 2024","Thu May 23 08:23:38 GMT 2024","228","tests","footer_test","TestFooter","","","Verify presence, visibility, clickability, href, status code of the EPAM link in Footer",""
"passed","Thu May 23 08:24:16 GMT 2024","Thu May 23 08:24:22 GMT 2024","5260","tests","footer_test","TestFooter","","","Verify that the EPAM link in Footer leads to the correct page after click",""
"passed","Thu May 23 08:29:48 GMT 2024","Thu May 23 08:29:48 GMT 2024","22","tests","start_unauthorized_page_test","TestStartUnauthorizedPage","","","Verify amount and visibility of sections with content on the page",""
"passed","Thu May 23 08:21:25 GMT 2024","Thu May 23 08:21:26 GMT 2024","1170","tests","contacts_page_test","TestContactsPage","","","Verify that links in sections 1, 2 lead to the correct pages after click",""
"passed","Thu May 23 08:36:29 GMT 2024","Thu May 23 08:36:30 GMT 2024","768","tests","used_resources_page_test","TestUsedResourcesPage","","","Verify sizes of the icon in the freepik.com link's section",""
"passed","Thu May 23 08:22:42 GMT 2024","Thu May 23 08:22:43 GMT 2024","1347","tests","description_page_test","TestDescriptionPage","","","Verify redirection to github not authorized user.",""
"passed","Thu May 23 08:29:19 GMT 2024","Thu May 23 08:29:19 GMT 2024","619","tests","specialists_page_test","TestSpecialistsPage","","","Verify presence, visibility, clickability, href, status code, text 
                         of the 'All Specialists' link on the Specialists page",""
"passed","Thu May 23 08:22:29 GMT 2024","Thu May 23 08:22:31 GMT 2024","1143","tests","description_page_test","TestDescriptionPage","","","Verify redirection to donate page not authorized user.",""
"passed","Thu May 23 08:23:50 GMT 2024","Thu May 23 08:23:52 GMT 2024","1816","tests","footer_test","TestFooter","","","Verify presence, visibility, clickability, href, status code of the Selectel link in Footer",""
"passed","Thu May 23 08:22:25 GMT 2024","Thu May 23 08:22:26 GMT 2024","1126","tests","description_page_test","TestDescriptionPage","","","Verify redirection to telegram page not authorized user.",""
"passed","Thu May 23 08:26:49 GMT 2024","Thu May 23 08:26:50 GMT 2024","82","tests","main_page_test","TestMainPage","","","Checking the clickability of the Start button.",""
"passed","Thu May 23 08:29:05 GMT 2024","Thu May 23 08:29:05 GMT 2024","43","tests","specialists_page_test","TestSpecialistsPage","","","Verify presence and visibility of text sections (including names and professions) 
         in specialist cards in the grid",""
"passed","Thu May 23 08:21:56 GMT 2024","Thu May 23 08:21:56 GMT 2024","410","tests","contributors_page_test","TestContributorsPage","","","Verify values of the text in card descriptions",""
"passed","Thu May 23 08:26:37 GMT 2024","Thu May 23 08:26:39 GMT 2024","1376","tests","main_page_test","TestMainPage","","","Verify redirection to github not authorized user.",""
"passed","Thu May 23 08:21:30 GMT 2024","Thu May 23 08:21:30 GMT 2024","80","tests","contributors_page_test","TestContributorsPage","","","Verify presence, visibility and structure of content on the page",""
"passed","Thu May 23 08:37:16 GMT 2024","Thu May 23 08:37:18 GMT 2024","1637","tests","used_resources_page_test","TestUsedResourcesPage","","","Verify presence, visibility, clickability, href, status code, text of the 'Flora' link",""
"passed","Thu May 23 08:26:21 GMT 2024","Thu May 23 08:26:22 GMT 2024","1163","tests","main_page_test","TestMainPage","","","Verify redirection to telegram page not authorized user.",""
"passed","Thu May 23 08:20:44 GMT 2024","Thu May 23 08:20:44 GMT 2024","20","tests","contacts_page_test","TestContactsPage","","","Verify amount and visibility of sections with content on the page",""
"passed","Thu May 23 08:28:40 GMT 2024","Thu May 23 08:28:40 GMT 2024","43","tests","specialists_page_test","TestSpecialistsPage","","","Verify presence, visibility and size of the grid on the Specialists page",""
"passed","Thu May 23 08:21:49 GMT 2024","Thu May 23 08:21:49 GMT 2024","28","tests","contributors_page_test","TestContributorsPage","","","Verify values of subtitles with tag 'h3' on the page",""
"passed","Thu May 23 08:26:57 GMT 2024","Thu May 23 08:27:27 GMT 2024","30191","tests","profile_page_test","TestProfilePage","","","Change the password by receiving an email link",""
"passed","Thu May 23 08:23:13 GMT 2024","Thu May 23 08:23:16 GMT 2024","2718","tests","footer_test","TestFooter","","","Verify presence and visibility of Footer on each page specified in the kit",""
"passed","Thu May 23 08:20:29 GMT 2024","Thu May 23 08:20:30 GMT 2024","947","tests","authorisation_page_test","TestAuthorizedUserPage","","","Checking the possibility of authorization with the correct data",""
"passed","Thu May 23 08:22:52 GMT 2024","Thu May 23 08:22:54 GMT 2024","2512","tests","footer_test","TestFooter","","","Verify presence and visibility of Footer on each page specified in the kit",""
"passed","Thu May 23 08:25:43 GMT 2024","Thu May 23 08:25:43 GMT 2024","44","tests","footer_test","TestFooter","","","Verify visible sizes of the JETBRAINS link's image in Footer",""
