"Status","Start Time","Stop Time","Duration in ms","Parent Suite","Suite","Sub Suite","Test Class","Test Method","Name","Description"
"passed","Tue Aug 27 07:46:22 GMT 2024","Tue Aug 27 07:46:22 GMT 2024","28","tests","contacts_page_test","TestContactsPage","","","Verify text in links in the section 2",""
"passed","Tue Aug 27 07:54:03 GMT 2024","Tue Aug 27 07:54:03 GMT 2024","34","tests","specialists_page_test","TestSpecialistsPage","","","Verify value of text on the page",""
"passed","Tue Aug 27 07:50:07 GMT 2024","Tue Aug 27 07:50:07 GMT 2024","102","tests","footer_test","TestFooter","","","Verify sizes of images in links in the Footer",""
"passed","Tue Aug 27 07:52:00 GMT 2024","Tue Aug 27 07:52:00 GMT 2024","99","tests","main_page_test","TestMainPage","","","Checking the clickability of the Registration button.",""
"passed","Tue Aug 27 07:55:46 GMT 2024","Tue Aug 27 07:56:08 GMT 2024","22023","tests","Speech exercises EN.","TestCardsEN","","","Select random card from ""Word"" group and compare UI vs BACKEND data",""
"passed","Tue Aug 27 07:52:50 GMT 2024","Tue Aug 27 07:52:51 GMT 2024","614","tests","registration_page_test","TestRegistrationPage","","","Check registration with new email and empty first name",""
"passed","Tue Aug 27 08:07:57 GMT 2024","Tue Aug 27 08:07:58 GMT 2024","791","tests","used_resources_page_test","TestUsedResourcesPage","","","Verify presence, visibility and attributes of icons in sections",""
"passed","Tue Aug 27 07:46:32 GMT 2024","Tue Aug 27 07:46:33 GMT 2024","1214","tests","contacts_page_test","TestContactsPage","","","Verify if links in the section 2 lead to the correct pages after clicking",""
"passed","Tue Aug 27 07:47:48 GMT 2024","Tue Aug 27 07:47:48 GMT 2024","144","tests","description_page_test","TestDescriptionPage","","","Verify redirection to contacts page not authorized user.",""
"passed","Tue Aug 27 07:54:55 GMT 2024","Tue Aug 27 07:54:55 GMT 2024","33","tests","start_unauthorized_page_test","TestStartUnauthorizedPage","","","Verify presence and visibility of content on the page",""
"passed","Tue Aug 27 07:50:55 GMT 2024","Tue Aug 27 07:50:55 GMT 2024","94","tests","header_test","TestHeaderPage","","","Verify that the 'Logo' link on the Start Unauthorized Page 
                             doesn't refresh the current page or lead to other pages after clicking",""
"passed","Tue Aug 27 07:46:38 GMT 2024","Tue Aug 27 07:46:38 GMT 2024","68","tests","contacts_page_test","TestContactsPage","","","Verify that the email link calls an email client",""
"passed","Tue Aug 27 07:46:17 GMT 2024","Tue Aug 27 07:46:17 GMT 2024","29","tests","contacts_page_test","TestContactsPage","","","Verify content of the text in the section 2",""
"passed","Tue Aug 27 07:49:59 GMT 2024","Tue Aug 27 07:49:59 GMT 2024","78","tests","footer_test","TestFooter","","","Verify that the 'Contact us' link in the Footer calls an email client",""
"passed","Tue Aug 27 07:55:25 GMT 2024","Tue Aug 27 07:55:25 GMT 2024","730","tests","start_unauthorized_page_test","TestStartUnauthorizedPage","","","Verify presence, visibility, clickability, href, status code 
                         of the 'Login' link in the section 1",""
"passed","Tue Aug 27 07:50:34 GMT 2024","Tue Aug 27 07:50:35 GMT 2024","207","tests","header_test","TestHeaderPage","","","Verify composition, visibility of elements on the 1st-6th levels of nesting in the Header",""
"passed","Tue Aug 27 07:55:17 GMT 2024","Tue Aug 27 07:55:17 GMT 2024","65","tests","start_unauthorized_page_test","TestStartUnauthorizedPage","","","Verify content of the text in sections 1, 2",""
"passed","Tue Aug 27 07:48:21 GMT 2024","Tue Aug 27 07:48:21 GMT 2024","45","tests","footer_test","TestFooter","","","Verify content of text in the Footer",""
"passed","Tue Aug 27 07:54:08 GMT 2024","Tue Aug 27 07:54:08 GMT 2024","105","tests","specialists_page_test","TestSpecialistsPage","","","Verify values of names and professions in specialist cards in the grid",""
"passed","Tue Aug 27 08:07:02 GMT 2024","Tue Aug 27 08:07:03 GMT 2024","779","tests","used_resources_page_test","TestUsedResourcesPage","","","Verify value of title with tag 'h1' on the page",""
"passed","Tue Aug 27 07:47:00 GMT 2024","Tue Aug 27 07:47:00 GMT 2024","40","tests","contributors_page_test","TestContributorsPage","","","Verify values of title and subtitles with tags h2, h3 on the page",""
"passed","Tue Aug 27 07:52:59 GMT 2024","Tue Aug 27 07:53:00 GMT 2024","595","tests","registration_page_test","TestRegistrationPage","","","Check registration with new email and empty email",""
"passed","Tue Aug 27 07:51:19 GMT 2024","Tue Aug 27 07:51:19 GMT 2024","2","tests","login_page_test","TestLoginPage","","","Test for authorization customer.",""
"passed","Tue Aug 27 07:56:54 GMT 2024","Tue Aug 27 07:57:17 GMT 2024","22984","tests","Speech exercises EN.","TestCardsEN","","","Select a random card from ""Similar phrases"" group and compare UI vs BACKEND data",""
"passed","Tue Aug 27 07:50:31 GMT 2024","Tue Aug 27 07:50:31 GMT 2024","33","tests","header_test","TestHeaderPage","","","Verify presence and visibility of the Header",""
"passed","Tue Aug 27 07:46:51 GMT 2024","Tue Aug 27 07:46:52 GMT 2024","1567","tests","contributors_page_test","TestContributorsPage","","","Verify presence, visibility of titles/subtitles, cards, descriptions, links, images on the page",""
"passed","Tue Aug 27 07:53:59 GMT 2024","Tue Aug 27 07:53:59 GMT 2024","32","tests","specialists_page_test","TestSpecialistsPage","","","Verify value of title with tag 'h2' on the page",""
"passed","Tue Aug 27 07:52:42 GMT 2024","Tue Aug 27 07:52:42 GMT 2024","604","tests","registration_page_test","TestRegistrationPage","","","Check registration with new email and empty confirm password",""
"passed","Tue Aug 27 07:53:39 GMT 2024","Tue Aug 27 07:53:39 GMT 2024","327","tests","specialists_page_test","TestSpecialistsPage","","","Verify the composition and visibility of elements 
        on the 1st-6th levels of nesting on the page",""
"passed","Tue Aug 27 07:54:13 GMT 2024","Tue Aug 27 07:54:13 GMT 2024","45","tests","specialists_page_test","TestSpecialistsPage","","","Verify text in the 'All Specialists' link",""
"passed","Tue Aug 27 08:00:50 GMT 2024","Tue Aug 27 08:01:35 GMT 2024","44883","tests","Речевые упражнения.","TestCardsRU","","","Solutions to a random task in the ""Слова"" .",""
"passed","Tue Aug 27 07:47:43 GMT 2024","Tue Aug 27 07:47:44 GMT 2024","1068","tests","description_page_test","TestDescriptionPage","","","Verify redirection to donate page not authorized user.",""
"passed","Tue Aug 27 07:48:01 GMT 2024","Tue Aug 27 07:48:02 GMT 2024","635","tests","description_page_test","TestDescriptionPage","","","Verify redirection to contributors page not authorized user.",""
"passed","Tue Aug 27 07:56:18 GMT 2024","Tue Aug 27 07:56:45 GMT 2024","27487","tests","Speech exercises EN.","TestCardsEN","","","Check progres-bar and buttons.",""
"passed","Tue Aug 27 07:46:12 GMT 2024","Tue Aug 27 07:46:12 GMT 2024","49","tests","contacts_page_test","TestContactsPage","","","Verify values of the title and subtitles with tags h1, h2 on the page",""
"passed","Tue Aug 27 07:47:56 GMT 2024","Tue Aug 27 07:47:57 GMT 2024","1448","tests","description_page_test","TestDescriptionPage","","","Verify redirection to github not authorized user.",""
"passed","Tue Aug 27 07:54:46 GMT 2024","Tue Aug 27 07:54:51 GMT 2024","5151","tests","specialists_page_test","TestSpecialistsPage","","","Verify sizes of images in specialist cards in the grid",""
"passed","Tue Aug 27 08:07:23 GMT 2024","Tue Aug 27 08:07:23 GMT 2024","763","tests","used_resources_page_test","TestUsedResourcesPage","","","Verify text in links in sections",""
"passed","Tue Aug 27 07:51:09 GMT 2024","Tue Aug 27 07:51:09 GMT 2024","68","tests","header_test","TestHeaderPage","","","Verify attributes of the image in the 'Logo' link",""
"passed","Tue Aug 27 07:51:43 GMT 2024","Tue Aug 27 07:51:45 GMT 2024","1372","tests","main_page_test","TestMainPage","","","Verify redirection to github not authorized user.",""
"passed","Tue Aug 27 07:46:26 GMT 2024","Tue Aug 27 07:46:27 GMT 2024","760","tests","contacts_page_test","TestContactsPage","","","Verify presence, visibility, clickability, href, prefix, status code of links in the section 2",""
"passed","Tue Aug 27 07:53:34 GMT 2024","Tue Aug 27 07:53:34 GMT 2024","30","tests","specialists_page_test","TestSpecialistsPage","","","Verify presence and visibility of content on the page",""
"passed","Tue Aug 27 07:52:55 GMT 2024","Tue Aug 27 07:52:56 GMT 2024","627","tests","registration_page_test","TestRegistrationPage","","","Check registration with new email and empty birthday",""
"passed","Tue Aug 27 08:06:31 GMT 2024","Tue Aug 27 08:06:32 GMT 2024","779","tests","used_resources_page_test","TestUsedResourcesPage","","","Verify presence and visibility of content on the page",""
"passed","Tue Aug 27 07:51:39 GMT 2024","Tue Aug 27 07:51:40 GMT 2024","661","tests","main_page_test","TestMainPage","","","Verify redirection to specialists page not authorized user.",""
"passed","Tue Aug 27 07:55:10 GMT 2024","Tue Aug 27 07:55:10 GMT 2024","12","tests","start_unauthorized_page_test","TestStartUnauthorizedPage","","","Verify value of the title of the tab",""
"passed","Tue Aug 27 07:50:03 GMT 2024","Tue Aug 27 07:50:03 GMT 2024","73","tests","footer_test","TestFooter","","","Verify attributes of images in links in the Footer",""
"passed","Tue Aug 27 07:53:54 GMT 2024","Tue Aug 27 07:53:54 GMT 2024","14","tests","specialists_page_test","TestSpecialistsPage","","","Verify value of the title of the tab",""
"passed","Tue Aug 27 07:59:07 GMT 2024","Tue Aug 27 07:59:32 GMT 2024","24899","tests","Речевые упражнения.","TestCardsRU","","","Select a random card from ""Группа слов"" group and compare UI vs BACKEND data.",""
"passed","Tue Aug 27 07:50:38 GMT 2024","Tue Aug 27 07:50:38 GMT 2024","163","tests","header_test","TestHeaderPage","","","Verify presence, visibility of links, buttons, images in the Header",""
"passed","Tue Aug 27 08:07:46 GMT 2024","Tue Aug 27 08:07:48 GMT 2024","2251","tests","used_resources_page_test","TestUsedResourcesPage","","","Verify that links in the sections lead to the correct pages after clicking",""
"passed","Tue Aug 27 07:47:25 GMT 2024","Tue Aug 27 07:47:25 GMT 2024","762","tests","contributors_page_test","TestContributorsPage","","","Verify attribute values of images in contributors cards in grids",""
"passed","Tue Aug 27 07:50:42 GMT 2024","Tue Aug 27 07:50:42 GMT 2024","67","tests","header_test","TestHeaderPage","","","Verify values of the text in links, buttons in the Header",""
"passed","Tue Aug 27 07:51:48 GMT 2024","Tue Aug 27 07:51:49 GMT 2024","638","tests","main_page_test","TestMainPage","","","Verify redirection to contributors page not authorized user.",""
"passed","Tue Aug 27 07:50:46 GMT 2024","Tue Aug 27 07:50:51 GMT 2024","5546","tests","header_test","TestHeaderPage","","","Verify clickability, href, status code of links in the Header",""
"passed","Tue Aug 27 07:58:00 GMT 2024","Tue Aug 27 07:58:24 GMT 2024","23603","tests","Речевые упражнения.","TestCardsRU","","","Select random card from group ""Слова Королёвой"" and compare UI vs BACKEND data.",""
"passed","Tue Aug 27 07:50:16 GMT 2024","Tue Aug 27 07:50:27 GMT 2024","11081","tests","footer_test","TestFooter","","","Verify Footer invisibility through the modal window with the exercise",""
"passed","Tue Aug 27 07:55:33 GMT 2024","Tue Aug 27 07:55:33 GMT 2024","77","tests","start_unauthorized_page_test","TestStartUnauthorizedPage","","","Verify presence, visibility and attributes of the image in the section 1",""
"passed","Tue Aug 27 08:08:07 GMT 2024","Tue Aug 27 08:08:08 GMT 2024","806","tests","used_resources_page_test","TestUsedResourcesPage","","","Verify sizes of icons in sections",""
"passed","Tue Aug 27 07:47:20 GMT 2024","Tue Aug 27 07:47:21 GMT 2024","730","tests","contributors_page_test","TestContributorsPage","","","Verify href, status code of the 'All Team' link",""
"passed","Tue Aug 27 07:45:48 GMT 2024","Tue Aug 27 07:45:48 GMT 2024","28","tests","contacts_page_test","TestContactsPage","","","Verify presence and visibility of content on the page",""
"passed","Tue Aug 27 07:51:35 GMT 2024","Tue Aug 27 07:51:35 GMT 2024","139","tests","main_page_test","TestMainPage","","","Verify redirection to contacts page not authorized user.",""
"passed","Tue Aug 27 07:55:06 GMT 2024","Tue Aug 27 07:55:06 GMT 2024","112","tests","start_unauthorized_page_test","TestStartUnauthorizedPage","","","Verify the composition and visibility of elements 
        on the 1st-3rd levels of nesting in the section 2",""
"skipped","Tue Aug 27 08:05:54 GMT 2024","Tue Aug 27 08:06:08 GMT 2024","13738","tests","Речевые упражнения.","TestCardsRU","","","Solutions to a random task in the ""Слова"" group and comparison of statics.",""
"passed","Tue Aug 27 07:53:08 GMT 2024","Tue Aug 27 07:53:29 GMT 2024","20679","tests","registration_page_test","TestRegistrationPage","","","Check registration without choosing agreement",""
"passed","Tue Aug 27 08:07:33 GMT 2024","Tue Aug 27 08:07:36 GMT 2024","3797","tests","used_resources_page_test","TestUsedResourcesPage","","","Verify presence, visibility, clickability, href, status code of links in sections",""
"passed","Tue Aug 27 07:54:33 GMT 2024","Tue Aug 27 07:54:36 GMT 2024","3655","tests","specialists_page_test","TestSpecialistsPage","","","Verify that the 'All Specialists' link leads an authorized user 
                         to the correct page after clicking",""
"passed","Tue Aug 27 07:54:18 GMT 2024","Tue Aug 27 07:54:18 GMT 2024","695","tests","specialists_page_test","TestSpecialistsPage","","","Verify clickability, href, status code of the 'All Specialists' link",""
"passed","Tue Aug 27 07:55:13 GMT 2024","Tue Aug 27 07:55:13 GMT 2024","45","tests","start_unauthorized_page_test","TestStartUnauthorizedPage","","","Verify values of titles and subtitles with tags h2, h4 on the page",""
"passed","Tue Aug 27 07:47:12 GMT 2024","Tue Aug 27 07:47:12 GMT 2024","449","tests","contributors_page_test","TestContributorsPage","","","Verify text in card links and the 'All Team' link",""
"passed","Tue Aug 27 08:07:12 GMT 2024","Tue Aug 27 08:07:13 GMT 2024","773","tests","used_resources_page_test","TestUsedResourcesPage","","","Verify content of the text on the page",""
"passed","Tue Aug 27 07:48:35 GMT 2024","Tue Aug 27 07:49:55 GMT 2024","80625","tests","footer_test","TestFooter","","","Verify that links in the Footer lead to correct pages after clicking",""
"passed","Tue Aug 27 07:55:29 GMT 2024","Tue Aug 27 07:55:29 GMT 2024","126","tests","start_unauthorized_page_test","TestStartUnauthorizedPage","","","Verify that the 'Login' link leads to the correct page after clicking",""
"passed","Tue Aug 27 07:48:05 GMT 2024","Tue Aug 27 07:48:05 GMT 2024","137","tests","description_page_test","TestDescriptionPage","","","Verify redirection to used resources page not authorized user.",""
"passed","Tue Aug 27 07:51:31 GMT 2024","Tue Aug 27 07:51:32 GMT 2024","774","tests","main_page_test","TestMainPage","","","Verify redirection to donate page not authorized user.",""
"passed","Tue Aug 27 08:06:41 GMT 2024","Tue Aug 27 08:06:42 GMT 2024","865","tests","used_resources_page_test","TestUsedResourcesPage","","","Verify the composition and visibility of elements 
            on the 1st-4th levels of nesting on the page",""
"passed","Tue Aug 27 07:55:37 GMT 2024","Tue Aug 27 07:55:37 GMT 2024","56","tests","start_unauthorized_page_test","TestStartUnauthorizedPage","","","Verify size of the image in the section 1",""
"passed","Tue Aug 27 07:47:34 GMT 2024","Tue Aug 27 07:47:34 GMT 2024","141","tests","description_page_test","TestDescriptionPage","","","Verify return main page from description page.",""
"passed","Tue Aug 27 08:06:18 GMT 2024","Tue Aug 27 08:06:22 GMT 2024","3874","tests","Statistic.","TestCardsRU","","","Check statistic table.",""
"passed","Tue Aug 27 07:54:59 GMT 2024","Tue Aug 27 07:54:59 GMT 2024","30","tests","start_unauthorized_page_test","TestStartUnauthorizedPage","","","Verify amount and visibility of sections with content on the page",""
"passed","Tue Aug 27 07:48:17 GMT 2024","Tue Aug 27 07:48:17 GMT 2024","130","tests","footer_test","TestFooter","","","Verify presence, visibility of text, links, images in the Footer",""
"passed","Tue Aug 27 08:00:16 GMT 2024","Tue Aug 27 08:00:41 GMT 2024","25495","tests","Речевые упражнения.","TestCardsRU","","","Select a random card from ""Слова с частотной группировкой"" group and compare UI vs BACKEND data.",""
"passed","Tue Aug 27 07:51:22 GMT 2024","Tue Aug 27 07:51:22 GMT 2024","117","tests","main_page_test","TestMainPage","","","Verify redirection to description page not authorized user.",""
"passed","Tue Aug 27 08:06:51 GMT 2024","Tue Aug 27 08:06:51 GMT 2024","239","tests","used_resources_page_test","TestUsedResourcesPage","","","Verify value of the title of the tab",""
"passed","Tue Aug 27 07:48:09 GMT 2024","Tue Aug 27 07:48:09 GMT 2024","38","tests","footer_test","TestFooter","","","Verify presence and visibility of the Footer",""
"passed","Tue Aug 27 07:58:34 GMT 2024","Tue Aug 27 07:58:58 GMT 2024","24007","tests","Речевые упражнения.","TestCardsRU","","","Select a random card from ""Похожие фразы"" group and compare UI vs BACKEND data.",""
"passed","Tue Aug 27 07:47:38 GMT 2024","Tue Aug 27 07:47:39 GMT 2024","1182","tests","description_page_test","TestDescriptionPage","","","Verify redirection to telegram page not authorized user.",""
"passed","Tue Aug 27 07:47:08 GMT 2024","Tue Aug 27 07:47:08 GMT 2024","392","tests","contributors_page_test","TestContributorsPage","","","Verify values of the text in card descriptions",""
"passed","Tue Aug 27 07:46:45 GMT 2024","Tue Aug 27 07:46:47 GMT 2024","1594","tests","contributors_page_test","TestContributorsPage","","","Verify the composition and visibility of elements 
        on the 1st-5th levels of nesting on the page",""
"passed","Tue Aug 27 07:47:04 GMT 2024","Tue Aug 27 07:47:04 GMT 2024","17","tests","contributors_page_test","TestContributorsPage","","","Verify content of the text on the page",""
"passed","Tue Aug 27 07:53:04 GMT 2024","Tue Aug 27 07:53:05 GMT 2024","579","tests","registration_page_test","TestRegistrationPage","","","Check registration without choosing gender",""
"passed","Tue Aug 27 07:53:44 GMT 2024","Tue Aug 27 07:53:49 GMT 2024","5352","tests","specialists_page_test","TestSpecialistsPage","","","Verify presence, visibility of the title, text, link, grid, cards and images  
        on the 2nd, 3rd, 5th, 6th levels of nesting on the page",""
"passed","Tue Aug 27 07:52:46 GMT 2024","Tue Aug 27 07:52:47 GMT 2024","620","tests","registration_page_test","TestRegistrationPage","","","Check registration with new email and empty password",""
"passed","Tue Aug 27 07:47:16 GMT 2024","Tue Aug 27 07:47:17 GMT 2024","689","tests","contributors_page_test","TestContributorsPage","","","Verify clickability, href of links on the page",""
"passed","Tue Aug 27 07:55:21 GMT 2024","Tue Aug 27 07:55:21 GMT 2024","36","tests","start_unauthorized_page_test","TestStartUnauthorizedPage","","","Verify text in the 'Login' link in the section 1",""
"passed","Tue Aug 27 07:51:00 GMT 2024","Tue Aug 27 07:51:00 GMT 2024","88","tests","header_test","TestHeaderPage","","","Verify that the 'Logo' link on the 'Contacts' page leads an unauthorized user 
                             to the Start Unauthorized Page after clicking",""
"passed","Tue Aug 27 07:51:53 GMT 2024","Tue Aug 27 07:51:53 GMT 2024","137","tests","main_page_test","TestMainPage","","","Verify redirection to used resources page not authorized user.",""
"passed","Tue Aug 27 07:48:24 GMT 2024","Tue Aug 27 07:48:24 GMT 2024","45","tests","footer_test","TestFooter","","","Verify text in the 'Contact us' link in the Footer",""
"passed","Tue Aug 27 07:51:26 GMT 2024","Tue Aug 27 07:51:27 GMT 2024","1175","tests","main_page_test","TestMainPage","","","Verify redirection to telegram page not authorized user.",""
"passed","Tue Aug 27 07:47:52 GMT 2024","Tue Aug 27 07:47:52 GMT 2024","637","tests","description_page_test","TestDescriptionPage","","","Verify redirection to specialists page not authorized user.",""
"passed","Tue Aug 27 07:51:04 GMT 2024","Tue Aug 27 07:51:05 GMT 2024","1301","tests","header_test","TestHeaderPage","","","Verify if the 'About', 'Telegram' links in the Header lead to correct pages after click",""
"passed","Tue Aug 27 07:52:37 GMT 2024","Tue Aug 27 07:52:38 GMT 2024","1146","tests","registration_page_test","TestRegistrationPage","","","Check registration with an existing email",""
"passed","Tue Aug 27 07:48:13 GMT 2024","Tue Aug 27 07:48:13 GMT 2024","223","tests","footer_test","TestFooter","","","Verify composition and visibility of elements on the 1st-7th levels of nesting in the Footer",""
"passed","Tue Aug 27 08:01:44 GMT 2024","Tue Aug 27 08:05:38 GMT 2024","233704","tests","Речевые упражнения.","TestCardsRU","","","Solutions to a random task in the ""Слова Королёвой"" .",""
"passed","Tue Aug 27 07:46:56 GMT 2024","Tue Aug 27 07:46:56 GMT 2024","11","tests","contributors_page_test","TestContributorsPage","","","Verify value of the title of the tab",""
"passed","Tue Aug 27 07:57:26 GMT 2024","Tue Aug 27 07:57:51 GMT 2024","24876","tests","Речевые упражнения.","TestCardsRU","","","Select random card from group ""Слова"" and compare UI vs BACKEND data.",""
"passed","Tue Aug 27 07:45:38 GMT 2024","Tue Aug 27 07:45:39 GMT 2024","1057","tests","authorisation_page_test","TestAuthorizedUserPage","","","Checking the possibility of authorization with the correct data",""
"passed","Tue Aug 27 07:46:02 GMT 2024","Tue Aug 27 07:46:03 GMT 2024","159","tests","contacts_page_test","TestContactsPage","","","Verify presence, visibility of sections, the dividing line and elements with text on the page",""
"passed","Tue Aug 27 07:52:25 GMT 2024","Tue Aug 27 07:52:34 GMT 2024","8689","tests","registration_page_test","TestRegistrationPage","","","Check registration with new email",""
"passed","Tue Aug 27 07:45:43 GMT 2024","Tue Aug 27 07:45:44 GMT 2024","854","tests","authorisation_page_test","TestAuthorizedUserPage","","","Checking the possibility of authorization with incorrect data",""
"passed","Tue Aug 27 07:55:02 GMT 2024","Tue Aug 27 07:55:02 GMT 2024","84","tests","start_unauthorized_page_test","TestStartUnauthorizedPage","","","Verify the composition and visibility of elements 
        on the 1st-3rd levels of nesting in the section 1",""
"passed","Tue Aug 27 07:54:41 GMT 2024","Tue Aug 27 07:54:41 GMT 2024","116","tests","specialists_page_test","TestSpecialistsPage","","","Verify attributes of images in specialist cards in the grid",""
"passed","Tue Aug 27 07:52:04 GMT 2024","Tue Aug 27 07:52:20 GMT 2024","16235","tests","profile_page_test","TestProfilePage","","","Change the password by receiving an email link",""
"passed","Tue Aug 27 07:48:28 GMT 2024","Tue Aug 27 07:48:31 GMT 2024","2950","tests","footer_test","TestFooter","","","Verify clickability, href, prefix and subject, status code of links in the Footer",""
"passed","Tue Aug 27 07:46:42 GMT 2024","Tue Aug 27 07:46:42 GMT 2024","38","tests","contributors_page_test","TestContributorsPage","","","Verify presence, visibility and structure of content on the page",""
"passed","Tue Aug 27 07:51:56 GMT 2024","Tue Aug 27 07:51:56 GMT 2024","80","tests","main_page_test","TestMainPage","","","Checking the clickability of the Start button.",""
"passed","Tue Aug 27 07:47:29 GMT 2024","Tue Aug 27 07:47:30 GMT 2024","1062","tests","contributors_page_test","TestContributorsPage","","","Verify sizes of images in contributor cards in grids",""
"passed","Tue Aug 27 07:54:23 GMT 2024","Tue Aug 27 07:54:24 GMT 2024","563","tests","specialists_page_test","TestSpecialistsPage","","","Verify that the 'All Specialists' link leads an unauthorized user 
                         to the correct page after clicking",""
"passed","Tue Aug 27 07:45:53 GMT 2024","Tue Aug 27 07:45:53 GMT 2024","21","tests","contacts_page_test","TestContactsPage","","","Verify the composition and visibility of elements on the 1st level of nesting in the section 1",""
"passed","Tue Aug 27 07:45:58 GMT 2024","Tue Aug 27 07:45:58 GMT 2024","138","tests","contacts_page_test","TestContactsPage","","","Verify the composition and visibility of elements 
        on the 1st-5th levels of nesting in the section 2",""
"passed","Tue Aug 27 07:46:07 GMT 2024","Tue Aug 27 07:46:07 GMT 2024","12","tests","contacts_page_test","TestContactsPage","","","Verify value of the title of the tab",""
"passed","Tue Aug 27 07:59:41 GMT 2024","Tue Aug 27 08:00:07 GMT 2024","25446","tests","Речевые упражнения.","TestCardsRU","","","Select a random card from ""Предложения"" group and compare UI vs BACKEND data.",""
